Rank;Sourceid;Title;Type;Issn;SJR;SJR Best Quartile;H index;Total Docs. (2002);Total Docs. (3years);Total Refs.;Total Cites (3years);Citable Docs. (3years);Cites / Doc. (2years);Ref. / Doc.;Country;Region;Publisher;Coverage;Categories
275;20364;Sports Orthopaedics and Traumatology;journal;0949328X, 18764339;0.128;Q4;11;54;33;692;3;30;0.09;12.81;Germany;Western Europe;Urban und Fischer Verlag Jena;2001-2021;"Orthopedics and Sports Medicine (Q4); Physical Therapy, Sports Therapy and Rehabilitation (Q4)"
276;20127;Canadian Journal of Hospital Pharmacy;journal;19202903, 00084123;0.125;Q3;24;58;144;709;16;99;0.14;12.22;Canada;Northern America;Canadian Society of Hospital Pharmacists;1973-2021;"Pharmacy (Q3); Pharmacology (medical) (Q4)"
277;15079;Hearing Journal;journal;23336218, 07457472;0.125;Q4;20;141;187;625;10;96;0.05;4.43;United States;Northern America;Lippincott Williams and Wilkins Ltd.;2001-2021;Speech and Hearing (Q4)
278;21100332425;Australian Journal of Rehabilitation Counselling;journal;13238922, 18386059;0.124;Q4;13;9;39;373;4;39;0.09;41.44;United Kingdom;Western Europe;Cambridge University Press;1995-2021;"Physical Therapy, Sports Therapy and Rehabilitation (Q4); Rehabilitation (Q4)"
279;5800207553;Linguistics in the Netherlands;journal;09297332;0.124;Q3;15;19;56;252;5;56;0.08;13.26;Netherlands;Western Europe;John Benjamins Publishing Company;1996-2017, 2019-2020;"Health Professions (miscellaneous) (Q3); Linguistics and Language (Q3); Multidisciplinary (Q3); Social Sciences (miscellaneous) (Q3); Psychology (miscellaneous) (Q4)"
280;27234;Laboratoriums Medizin;journal;14390477, 03423026;0.122;Q3;16;80;263;2702;37;255;0.15;33.78;Germany;Western Europe;Walter de Gruyter GmbH;1977-2018;"Medical Laboratory Technology (Q3); Biochemistry (medical) (Q4); Clinical Biochemistry (Q4)"
281;19892;Medicina dello Sport;journal;00257826;0.122;Q4;15;41;118;925;7;114;0.06;22.56;Italy;Western Europe;Edizioni Minerva Medica S.p.A.;1965, 1973-1982, 1996-2021;"Orthopedics and Sports Medicine (Q4); Physical Therapy, Sports Therapy and Rehabilitation (Q4); Sports Science (Q4)"
282;17860;Radiologic Technology;journal;00338397, 19435657;0.122;Q4;22;47;178;492;17;170;0.06;10.47;United States;Northern America;Grune And Stratton;1963-2021;"Radiological and Ultrasound Technology (Q4); Radiology, Nuclear Medicine and Imaging (Q4)"
283;5800169164;American Journal of Chinese Studies;journal;-;0.121;Q4;0;0;1;0;0;1;0;0;United States;Northern America;;;"Medicine (miscellaneous) (Q3); Social Sciences (miscellaneous) (Q3); Health Professions (miscellaneous) (Q4)"
284;26096;Australian Journal of Clinical and Experimental Hypnosis;journal;01560417;0.121;Q4;11;14;46;296;4;45;0.03;21.14;Australia;Pacific Region;Australian Society of Hypnosis Ltd;1978-1985, 1987-2013, 2016-2017;"Clinical Psychology (Q4); Complementary and Manual Therapy (Q4)"
285;145693;Canadian Pharmacists Journal;journal;17151635;0.121;Q3;24;117;350;627;11;239;0.03;5.36;Canada;Northern America;Canadian Pharmacists Association;2005-2021;"Pharmaceutical Science (Q3); Pharmacy (Q3)"
286;13779;Clinical and Refractive Optometry;journal;17054850;0.121;Q4;3;0;0;0;0;0;0;0;Canada;Northern America;Mediconcept Inc.;2003-2013, 2015-2016;"Ophthalmology (Q4); Optometry (Q4)"
287;19838;Deutsche Zeitschrift fur Sportmedizin;journal;03445925;0.121;Q4;20;71;589;1545;49;588;0.08;21.76;Germany;Western Europe;Dynamic Media Sales Verlag;1996-2021;"Orthopedics and Sports Medicine (Q4); Physical Therapy, Sports Therapy and Rehabilitation (Q4); Sports Science (Q4)"
288;21100466202;European Journal of Clinical Pharmacy;journal;2385409X;0.121;-;6;53;123;1381;15;109;0.12;26.06;Spain;Western Europe;Rsago Editorial, S. L.,;2016-2021;Pharmacology (medical) (Q4)
289;13738;International Journal of Audiology;journal;14992027, 17088186;0.121;Q4;85;54;115;1326;112;112;0.77;24.56;United Kingdom;Western Europe;Taylor and Francis Ltd.;1962-2021;"Linguistics and Language (Q3); Speech and Hearing (Q4)"
290;26767;Altex;journal;1868596X, 18688551;0.12;Q3;57;36;70;0;18;64;0.26;0;Germany;Western Europe;Springer International Publishing AG;2000-2021;"Medical Laboratory Technology (Q3); Medicine (miscellaneous) (Q3); Pharmacology (Q4)"
291;27566;ACSM's Health and Fitness Journal;journal;1536593X, 10915397;0.119;Q4;23;30;63;260;6;63;0.11;8.67;United States;Northern America;Lippincott Williams and Wilkins Ltd.;1998-2021;"Orthopedics and Sports Medicine (Q4); Physical Therapy, Sports Therapy and Rehabilitation (Q4); Public Health, Environmental and Occupational Health (Q4); Sports Science (Q4)"
292;2000147401;Journal of the International Phonetic Association;journal;00251003;0.119;Q4;36;15;42;326;5;40;0.1;21.73;United Kingdom;Western Europe;Cambridge University Press;1971-1985, 1987-2021;"Linguistics and Language (Q3); Anthropology (Q4); Speech and Hearing (Q4)"
293;8300153134;Laboratory Techniques in Biochemistry and Molecular Biology;book series;00757535;0.117;Q3;8;0;33;0;1;24;0;0;Netherlands;Western Europe;Elsevier;1969-1970, 1972, 1976, 1978-1981, 1983-1985, 1987-1988, 1990-1991, 1993, 1998-2000, 2003, 2005, 2007, 2009;"Medical Laboratory Technology (Q3); Biochemistry (Q4); Molecular Biology (Q4)"
294;29134;Case Manager;journal;15326527, 10619259;0.115;Q4;10;91;223;285;5;220;0.03;3.13;United States;Northern America;Mosby Inc.;1995, 1999-2006;"Medicine (miscellaneous) (Q3); Health Professions (miscellaneous) (Q4)"
295;12192;Journal of Back and Musculoskeletal Rehabilitation;journal;18786324, 10538127;0.113;Q4;33;25;54;631;10;47;0.03;25.24;Netherlands;Western Europe;IOS Press BV;1992-2000, 2002-2021;"Orthopedics and Sports Medicine (Q4); Physical Therapy, Sports Therapy and Rehabilitation (Q4); Rehabilitation (Q4)"
296;19900192008;Sport History Review;journal;10871659, 15432947;0.113;Q4;7;1;6;0;3;6;0;0;United States;Northern America;Human Kinetics Publishers Inc.;1999, 2002, 2009-2021;"History (Q2); Physical Therapy, Sports Therapy and Rehabilitation (Q4); Sports Science (Q4)"
297;12110;Behavioral Healthcare Tomorrow;journal;10638490;0.112;Q4;9;52;179;0;9;175;0.03;0;United States;Northern America;Manisses Communications Group Inc.;1994-2005;"Clinical Psychology (Q4); Health Professions (miscellaneous) (Q4); Health (social science) (Q4); Psychology (miscellaneous) (Q4)"
298;11700154353;European Journal of Physical and Rehabilitation Medicine;journal;19739095, 19739087;0.112;Q4;63;32;95;585;5;85;0.04;18.28;Italy;Western Europe;Edizioni Minerva Medica S.p.A.;2008-2021;"Physical Therapy, Sports Therapy and Rehabilitation (Q4); Rehabilitation (Q4)"
299;32874;American Journal of Art Therapy;journal;00074764;0.111;Q4;9;0;24;0;2;24;0.06;0;United States;Northern America;American Art Therapy Association Inc.;1973-1983, 1985, 1987, 1989-2001;"Clinical Biochemistry (Q4); Health Professions (miscellaneous) (Q4)"
300;40596;Australian and New Zealand Journal of Audiology;journal;14434873;0.111;Q4;16;12;10;218;1;10;0.1;18.17;Australia;Pacific Region;Australian Academic Press;2000-2010;Speech and Hearing (Q4)
301;144942;Journal of Physical Therapy Science (discontinued);journal;09155287;0.111;Q4;40;16;59;290;3;59;0.08;18.13;Japan;Asiatic Region;Society of Physical Therapy Science (Rigaku Ryoho Kagakugakkai);1995-2018;Physical Therapy, Sports Therapy and Rehabilitation (Q4)
302;28054;Australian Journal of Medical Science;journal;10381643;0.11;Q4;6;11;258;210;2;243;0;19.09;Australia;Pacific Region;Australian Institute of Medical Scientists;1992-2015;"Biochemistry (medical) (Q4); Clinical Biochemistry (Q4); Hematology (Q4); Immunology and Allergy (Q4); Medical Laboratory Technology (Q4); Microbiology (medical) (Q4)"
303;145569;L1 Educational Studies in Language and Literature;journal;15731731, 15676617;0.11;Q4;15;16;15;523;5;12;0.33;32.69;Belgium;Western Europe;International Association for Research in L1 Education (ARLE);2001-2021;"Literature and Literary Theory (Q2); Linguistics and Language (Q3); Education (Q4); Health Professions (miscellaneous) (Q4); Psychology (miscellaneous) (Q4)"
304;17268;Medecine Nucleaire;journal;09281258, 18786820;0.108;Q4;9;87;224;1542;25;206;0.14;17.72;France;Western Europe;Elsevier Masson s.r.l.;1993-2021;"Biophysics (Q4); Radiological and Ultrasound Technology (Q4); Radiology, Nuclear Medicine and Imaging (Q4)"
305;13829;Japan Journal of Logopedics and Phoniatrics;journal;18843646, 00302813;0.104;Q4;6;51;104;382;2;104;0;7.49;Japan;Asiatic Region;Japan Society of Logopedics and Phoniatrics;1967, 1970-2021;"LPN and LVN (Q4); Speech and Hearing (Q4)"
306;67922;Orthopaedic Physical Therapy Clinics of North America;journal;10591516;0.104;Q4;11;14;113;693;5;98;0.03;49.5;United Kingdom;Western Europe;W.B. Saunders Ltd;1995-2002;"Physical Therapy, Sports Therapy and Rehabilitation (Q4); Surgery (Q4)"
307;21416;Zentralsterilisation - Central Service (discontinued);journal;09426086;0.104;Q4;9;72;115;86;3;78;0.03;1.19;Germany;Western Europe;mhp-Verlag GmbH;2000-2017;"Medical Laboratory Technology (Q4); Microbiology (medical) (Q4)"
308;12100157156;Current Protocols in Cytometry;journal;19349297, 19349300;0.103;Q4;30;13;101;0;2;101;0.02;0;United States;Northern America;"John Wiley &amp; Sons Inc.";2001-2020;"Biochemistry (Q4); Histology (Q4); Medical Laboratory Technology (Q4); Medicine (miscellaneous) (Q4)"
309;19700180734;Elsevier Ergonomics Book Series;book series;1572347X;0.103;Q4;9;16;38;0;1;1;0.03;0;Netherlands;Western Europe;Elsevier;2000, 2002, 2005;"Orthopedics and Sports Medicine (Q4); Physical Therapy, Sports Therapy and Rehabilitation (Q4)"
310;23103;Journal of Pharmacy Practice;journal;08971900, 15311937;0.103;-;31;49;151;2557;7;132;0.04;52.18;United States;Northern America;SAGE Publications Inc.;1988-2021;Pharmacology (medical) (Q4)
311;21075;Journal of sport history;journal;00941700, 21558450;0.103;Q4;10;3;8;0;2;8;0.25;0;United States;Northern America;North American Society for Sport History;1977-1979, 1981-1984, 1987, 1989, 1999-2002, 2010, 2012-2020;"Cultural Studies (Q3); History (Q3); Sports Science (Q4)"
312;16373;Hong Kong Physiotherapy Journal;journal;10137025;0.102;Q4;18;5;15;135;0;12;0;27;China;Asiatic Region;Hong Kong Physiotherapy Association;2000-2021;Physical Therapy, Sports Therapy and Rehabilitation (Q4)
313;21100199851;International Journal of Athletic Therapy and Training;journal;21577285;0.102;Q4;17;95;287;490;4;231;0.01;5.16;United States;Northern America;Human Kinetics Publishers Inc.;2012-2021;"Orthopedics and Sports Medicine (Q4); Physical Therapy, Sports Therapy and Rehabilitation (Q4); Rehabilitation (Q4); Sports Science (Q4)"
314;4700152478;Jornal Brasileiro de Patologia e Medicina Laboratorial;journal;16762444;0.102;Q4;16;31;10;755;0;10;0;24.35;Brazil;Latin America;Sociedade Brasileira de Pneumologia e Tisiologia;2001-2002, 2006-2021;"Clinical Biochemistry (Q4); Medical Laboratory Technology (Q4); Pathology and Forensic Medicine (Q4)"
315;78263;Journal of Sports Chiropractic and Rehabilitation;journal;10841288;0.102;Q4;6;0;73;0;2;59;0.02;0;United States;Northern America;Atwood Publishing;1996-2001;"Complementary and Alternative Medicine (Q4); Orthopedics and Sports Medicine (Q4); Physical Therapy, Sports Therapy and Rehabilitation (Q4); Public Health, Environmental and Occupational Health (Q4); Rehabilitation (Q4)"
316;21100855845;Perfusion (Germany);journal;14324334, 09350020;0.102;Q4;7;0;10;0;0;10;0;0;Germany;Western Europe;Verlag Perfusion GmbH;2001, 2004-2019;"Cardiology and Cardiovascular Medicine (Q4); Health Professions (miscellaneous) (Q4); Medicine (miscellaneous) (Q4)"
317;5000158801;Physiotherapy in Sport;journal;09540741;0.102;Q4;2;0;11;0;0;11;0;0;United Kingdom;Western Europe;Physiotherapy in Sport;1996-1999;Physical Therapy, Sports Therapy and Rehabilitation (Q4)
318;20005;Australian Journal of Pharmacy;journal;03118002;0.101;Q4;6;105;31;128;1;31;0;1.22;Australia;Pacific Region;Australian Pharmaceutical Publishing Company Ltd;1974-1976, 1978-1985, 1996-2019;"Pharmacology (medical) (Q4); Pharmacy (Q4)"
319;4900152807;British Journal of Chiropractic (United Kingdom);journal;14662108;0.101;Q2;4;4;21;96;0;21;0;24;United Kingdom;Western Europe;College of Chiropractors;1997-2002;Chiropractics (Q2)
320;18029;Canadian Journal of Respiratory Therapy;journal;23686820, 12059838;0.101;Q4;11;55;48;97;0;24;0;1.76;Canada;Northern America;Canadian Society of Respiratory Therapists;1996-2021;"Health Professions (miscellaneous) (Q4); Pulmonary and Respiratory Medicine (Q4)"
321;4000149001;Cancer Imaging;journal;17405025, 14707330;0.101;Q4;52;26;29;216;0;28;0;8.31;United Kingdom;Western Europe;BioMed Central Ltd.;2000-2021;"Medicine (miscellaneous) (Q4); Oncology (Q4); Radiological and Ultrasound Technology (Q4); Radiology, Nuclear Medicine and Imaging (Q4)"
322;27958;Forum Logopadie (discontinued);journal;09320547;0.101;Q4;9;27;21;253;1;19;0.05;9.37;Germany;Western Europe;Schulz-Kirchner Verlag GmbH;2001-2017;"LPN and LVN (Q4); Speech and Hearing (Q4)"
323;4700152879;Health Information Management Journal;journal;18333575, 18333583;0.101;-;24;8;42;0;2;40;0;0;Australia;Pacific Region;SAGE Publications Inc.;2002-2021;"Health Policy (Q4); Leadership and Management (Q4)"
324;19700175258;Journal of Chiropractic Humanities;journal;15563499;0.101;Q3;12;0;22;0;0;22;0;0;United States;Northern America;Elsevier Inc.;1993-1999, 2001, 2004-2020;"Chiropractics (Q3); Complementary and Alternative Medicine (Q4)"
325;15901;Journal of Japanese Association of Physical Medicine Balneology and Climatology;journal;00290343;0.101;Q4;3;0;22;0;0;22;0;0;Japan;Asiatic Region;Nihon Onsen Kiko Butsuri Igakkai;1976-1999;Physical Therapy, Sports Therapy and Rehabilitation (Q4)
326;4700152778;Journal of the American Association for Medical Transcription;journal;07452624;0.101;Q1;2;0;23;0;0;23;0;0;United States;Northern America;Lippincott Williams and Wilkins Ltd.;1987-1992, 1997-1999, 2004-2007;"Medical Assisting and Transcription (Q1); Medical Terminology (Q1)"
327;68900;Journal of the American Optometric Association;journal;00030244;0.101;Q4;25;1;43;19;0;26;0;19;United States;Northern America;American Optometric Association;1949-1950, 1965-1971, 1973-2000, 2002-2004;"Health Professions (miscellaneous) (Q4); Medicine (miscellaneous) (Q4)"
328;144916;Journal of the Japanese Physical Therapy Association;journal;13441272;0.101;Q4;10;4;16;86;0;16;0;21.5;Japan;Asiatic Region;Japanese Physical Therapy Association;1998-2015;Physical Therapy, Sports Therapy and Rehabilitation (Q4)
329;4700151608;Journal of the Philosophy of Sport;journal;00948705;0.101;Q4;28;19;44;349;9;14;0.18;18.37;United Kingdom;Western Europe;Taylor and Francis Ltd.;1974-1993, 1995-2021;"Health (social science) (Q4); Social Sciences (miscellaneous) (Q4); Sports Science (Q4)"
330;27231;Klinichescheskaya Laboratornaya Diagnostika;journal;08692084;0.101;Q4;11;152;377;616;9;377;0.03;4.05;Russian Federation;Eastern Europe;Izdatel'stvo Meditsina;1993-2020;"Biochemistry (medical) (Q4); Medical Laboratory Technology (Q4); Medicine (miscellaneous) (Q4)"
331;21823;Pharmacia;journal;04280296;0.101;Q4;16;10;49;143;0;47;0;14.3;Bulgaria;Eastern Europe;Pensoft Publishers;1945, 1954-1955, 1987-1991, 1997-2021;"Pharmaceutical Science (Q4); Pharmacology (medical) (Q4); Pharmacy (Q4)"
332;16952;Physiotherapy Singapore;journal;02191091;0.101;Q4;7;16;44;308;1;36;0;19.25;Singapore;Asiatic Region;Singapore Physiotherapy Association;1999-2008, 2010;Physical Therapy, Sports Therapy and Rehabilitation (Q4)
333;21828;Revista Cubana de Farmacia;journal;00347515, 15612988;0.101;Q3;9;15;30;172;1;30;0.11;11.47;Cuba;Latin America;Editorial Ciencias Medicas;1980-1991, 1996-2000, 2002, 2004-2021;"Pharmacy (Q3); Pharmaceutical Science (Q4); Pharmacology (Q4)"
334;73721;South African journal of communication disorders. Die Suid-Afrikaanse tydskrif vir Kommunikasieafwykings, The;journal;03798046;0.101;-;12;4;22;0;1;22;0;0;South Africa;Africa;South African Speech And Hearing Association;1977-2021;Medicine (miscellaneous) (Q4)
335;17600155045;Staps;journal;17821568, 0247106X;0.101;Q4;10;21;27;633;0;24;0;30.14;Belgium;Western Europe;Boeck Universite;2001-2021;"Orthopedics and Sports Medicine (Q4); Physical Therapy, Sports Therapy and Rehabilitation (Q4)"
336;28203;Bio-Medical Engineering;journal;00063398, 15738256;0.1;Q4;17;82;234;627;0;234;0;7.65;United States;Northern America;Springer New York;1967-2021;"Biomedical Engineering (Q4); Medical Laboratory Technology (Q4); Medicine (miscellaneous) (Q4)"
337;92771;European Journal of Sports Traumatology and Related Research;journal;15923894;0.1;Q4;9;0;48;0;0;47;0;0;Italy;Western Europe;Editrice Kurtis s.r.l.;1996-2001;"Orthopedics and Sports Medicine (Q4); Physical Therapy, Sports Therapy and Rehabilitation (Q4); Surgery (Q4)"
338;21100823451;German Journal of Exercise and Sport Research;journal;25093150, 25093142;0.1;Q4;14;27;79;58;0;79;0;2.15;Germany;Western Europe;Springer Berlin;1999, 2017-2021;"Orthopedics and Sports Medicine (Q4); Physical Therapy, Sports Therapy and Rehabilitation (Q4)"
339;5800210947;Heythrop Journal - Quarterly Review of Philosophy and Theology;journal;00181196;0.1;-;11;22;51;721;2;46;0.06;32.77;United States;Northern America;Wiley-Blackwell;1960-2021;"Philosophy (Q4); Religious Studies (Q4)"
340;15341;International Journal of the History of Sport;journal;09523367, 17439035;0.1;Q4;22;34;40;0;2;40;0.05;0;United Kingdom;Western Europe;Routledge;1984-1995, 1998-2002, 2010-2021;"History (Q4); Social Sciences (miscellaneous) (Q4); Sports Science (Q4)"
341;16693;Journal of Dementia Care (discontinued);journal;13518372;0.1;Q4;13;133;160;417;11;46;0.07;3.14;United Kingdom;Western Europe;Hawker Publications Ltd;2001-2017;"Geriatrics and Gerontology (Q4); Gerontology (Q4); Health Professions (miscellaneous) (Q4); Psychiatry and Mental Health (Q4)"
342;21227;Pharmacy in Practice;journal;13581538;0.1;Q4;5;21;64;222;0;46;0;10.57;United Kingdom;Western Europe;Medicom Publishing;1995-2009;"Health Policy (Q4); Pharmacology (Q4); Pharmacology (medical) (Q4); Pharmacy (Q4)"
343;145431;Rigakuryoho Kagaku;journal;13411667;0.1;Q4;7;41;95;335;2;95;0.03;8.17;Japan;Asiatic Region;Society of Physical Therapy Science (Rigaku Ryoho Kagakugakkai);1995-2015, 2017-2021;Physical Therapy, Sports Therapy and Rehabilitation (Q4)
344;21101052930;Acta Acustica;journal;10224793, 26814617;;-;60;138;71;2544;34;66;0.48;18.43;France;Western Europe;EDP Sciences;2021;"Acoustics and Ultrasonics; Computer Science Applications; Electrical and Electronic Engineering; Speech and Hearing"
345;28586;BioMedical Engineering Online;journal;1475925X;;-;81;8;0;145;0;0;0;18.13;United Kingdom;Western Europe;BioMed Central Ltd.;2002-2021;"Biomaterials; Biomedical Engineering; Medicine (miscellaneous); Radiological and Ultrasound Technology; Radiology, Nuclear Medicine and Imaging"
346;13777;Clinical and Experimental Optometry;journal;14440938, 08164622;;-;59;71;145;1647;14;132;0.08;23.2;United Kingdom;Western Europe;Taylor and Francis Ltd.;1986-2021;"Ophthalmology; Optometry"
347;130099;Concepts in Magnetic Resonance Part B: Magnetic Resonance Engineering;journal;15525031, 1552504X;;-;35;28;0;718;0;0;0;25.64;United States;Northern America;Hindawi Publishing Corporation;2002-2018;"Physical and Theoretical Chemistry; Radiological and Ultrasound Technology; Radiology, Nuclear Medicine and Imaging; Spectroscopy"
348;19835;Current Sports Medicine Reports;journal;15378918, 1537890X;;-;56;54;0;1829;0;0;0;33.87;United States;Northern America;Lippincott Williams and Wilkins Ltd.;2002-2021;"Medicine (miscellaneous); Orthopedics and Sports Medicine; Public Health, Environmental and Occupational Health; Sports Science"
349;16355;Fizjoterapia Polska;journal;16420136, 20844328;;-;9;48;0;808;0;0;0;16.83;Poland;Eastern Europe;DJ Studio;2002-2003, 2005-2012, 2014-2021;Physical Therapy, Sports Therapy and Rehabilitation
350;74826;Fizyoterapi Rehabilitasyon;journal;13008757;;-;10;18;0;514;0;0;0;28.56;Turkey;Middle East;Turkish Physical Therapy Association;2002-2018;"Orthopedics and Sports Medicine; Physical Therapy, Sports Therapy and Rehabilitation; Rehabilitation"
351;17700156427;Handbook of Immunohistochemistry and in Situ Hybridization of Human Carcinomas;book series;18745784;;-;5;107;0;4239;0;0;0;39.62;United States;Northern America;Elsevier Inc.;2002, 2005-2006;"Biochemistry (medical); Immunology; Medical Laboratory Technology; Oncology"
352;83742;Hong Kong Journal of Occupational Therapy;journal;15691861;;-;15;5;0;156;0;0;0;31.2;Singapore;Asiatic Region;Elsevier (Singapore) Pte Ltd;2002-2021;Occupational Therapy
353;22108;International Journal of Disability, Development and Education;journal;1465346X, 1034912X;;-;45;15;92;536;42;81;0.37;35.73;United Kingdom;Western Europe;Routledge;1989-2021;"Developmental and Educational Psychology; Education; Health Professions (miscellaneous); Health (social science)"
354;18052;JALA - Journal of the Association for Laboratory Automation;journal;15402452, 15355535;;-;24;62;104;445;19;104;0.18;7.18;United States;Northern America;Association for Laboratory Automation;1999-2010;"Computer Science Applications; Medical Laboratory Technology"
355;7500153109;Journal of Chiropractic Medicine;journal;15563715, 15563707;;-;24;35;0;727;0;0;0;20.77;United States;Northern America;Elsevier USA;2002-2021;Chiropractics
356;4000152113;Journal of Sports Science and Medicine;journal;13032968;;-;72;20;0;769;0;0;0;38.45;Turkey;Middle East;Department of Sports Medicine, Medical Faculty of Uludag University;2002-2021;"Orthopedics and Sports Medicine; Physical Therapy, Sports Therapy and Rehabilitation; Sports Science"
357;5100152406;Journal of Teaching in the Addictions;journal;15332713, 15332705;;-;9;6;0;179;0;0;0;29.83;United States;Northern America;Haworth Press Inc.;2002-2009;"Education; Health Professions (miscellaneous); Social Sciences (miscellaneous)"
358;21100197966;Medicina Naturista;journal;15763080;;-;6;6;32;78;0;23;0;13;Spain;Western Europe;Zaragoza : Universidad de Zaragoza, Facultad de Medicina;2000, 2002, 2004-2011, 2013, 2015-2021;"Chiropractics; Complementary and Alternative Medicine; Physical Therapy, Sports Therapy and Rehabilitation"
359;13823;Noise and Health;journal;14631741, 19984030;;-;52;34;0;802;0;0;0;23.59;India;Asiatic Region;Wolters Kluwer Medknow Publications;2002-2021;"Otorhinolaryngology; Public Health, Environmental and Occupational Health; Speech and Hearing"
360;21211;Pharmacy Education;journal;14772701, 15602214;;-;18;36;0;335;0;0;0;9.31;Netherlands;Western Europe;;1973-1978, 2002-2021;"Education; Pharmaceutical Science; Pharmacy"
361;21100978621;Physical and Engineering Sciences in Medicine;journal;26624729, 26624737;;-;35;23;69;539;36;68;0.4;23.43;Netherlands;Western Europe;Springer Netherlands;2020-2021;"Biomedical Engineering; Biophysics; Biotechnology; Instrumentation; Radiological and Ultrasound Technology; Radiology, Nuclear Medicine and Imaging"
362;21101054302;Science of Diabetes Self-Management and Care;journal;26350114, 26350106;;-;78;77;207;1245;164;189;0.64;16.17;United States;Northern America;SAGE Publications Inc.;2021;"Endocrinology, Diabetes and Metabolism; Health Professions (miscellaneous); Health (social science)"
363;12100156147;Sport in History;journal;17460271, 17460263;;-;19;16;39;774;3;38;0.04;48.38;United Kingdom;Western Europe;Routledge;2003-2021;"History; Physical Therapy, Sports Therapy and Rehabilitation"
364;21076;Sports Biomechanics;journal;17526116, 14763141;;-;43;18;0;425;0;0;0;23.61;United Kingdom;Western Europe;Taylor and Francis Ltd.;2002-2021;"Orthopedics and Sports Medicine; Physical Therapy, Sports Therapy and Rehabilitation; Sports Science"
365;19715;Sports Medicine Standards and Malpractice Reporter;journal;1041696X;;-;1;17;0;1;0;0;0;0.06;United States;Northern America;PRC Publishing, Inc.;2002-2011;"Law; Orthopedics and Sports Medicine; Physical Therapy, Sports Therapy and Rehabilitation"
