Rank;Sourceid;Title;Type;Issn;SJR;SJR Best Quartile;H index;Total Docs. (2002);Total Docs. (3years);Total Refs.;Total Cites (3years);Citable Docs. (3years);Cites / Doc. (2years);Ref. / Doc.;Country;Region;Publisher;Coverage;Categories
378;24599;Computational Biology and Chemistry;journal;14769271;0.441;Q3;61;57;184;1559;211;181;0.86;27.35;United Kingdom;Western Europe;Elsevier Ltd.;2003-2021;"Biochemistry (Q3); Computational Mathematics (Q3); Organic Chemistry (Q3); Structural Biology (Q4)"
379;20623;Fire and Materials;journal;03080501, 10991018;0.441;Q2;61;33;114;631;79;114;0.8;19.12;United Kingdom;Western Europe;John Wiley and Sons Ltd;1976, 1978-1989, 1991-2021;"Metals and Alloys (Q1); Ceramics and Composites (Q2); Chemistry (miscellaneous) (Q2); Polymers and Plastics (Q2); Electronic, Optical and Magnetic Materials (Q3)"
380;87025;Crystal Engineering;journal;14630184;0.439;Q2;24;50;46;833;55;46;1.2;16.66;United Kingdom;Western Europe;Pergamon Press Ltd.;2000-2003;"Chemistry (miscellaneous) (Q2); Materials Chemistry (Q2)"
381;28005;Hyperfine Interactions;journal;15729540, 03043843;0.438;Q3;47;218;934;3707;547;918;0.5;17;Netherlands;Western Europe;Springer Netherlands;1975-2021;"Atomic and Molecular Physics, and Optics (Q3); Condensed Matter Physics (Q3); Nuclear and High Energy Physics (Q3); Physical and Theoretical Chemistry (Q3)"
382;28130;Journal of Adhesion;journal;00218464, 15455823;0.437;Q2;55;47;165;1146;114;165;0.54;24.38;United Kingdom;Western Europe;Taylor and Francis Ltd.;1969-2021;"Chemistry (miscellaneous) (Q2); Materials Chemistry (Q2); Mechanics of Materials (Q2); Surfaces, Coatings and Films (Q2); Surfaces and Interfaces (Q3)"
383;25891;Journal of Macromolecular Science - Pure and Applied Chemistry;journal;10601325;0.436;Q2;52;103;355;2340;215;354;0.54;22.72;United States;Northern America;Taylor and Francis Ltd.;1992-2021;"Ceramics and Composites (Q2); Chemistry (miscellaneous) (Q2); Materials Chemistry (Q2); Polymers and Plastics (Q2)"
384;13755;High Temperatures - High Pressures;journal;00181544, 14723441;0.431;Q3;30;77;235;1338;103;235;0.4;17.38;United States;Northern America;Old City Publishing;1969-1970, 1972-1992, 1994, 1997-2003, 2008-2021;"Mechanics of Materials (Q2); Condensed Matter Physics (Q3); Physical and Theoretical Chemistry (Q3)"
385;26965;Journal of Molecular Liquids;journal;18733166, 01677322;0.43;Q3;132;139;427;4184;289;421;0.6;30.1;Netherlands;Western Europe;Elsevier;1983-2021;"Materials Chemistry (Q2); Atomic and Molecular Physics, and Optics (Q3); Condensed Matter Physics (Q3); Electronic, Optical and Magnetic Materials (Q3); Physical and Theoretical Chemistry (Q3); Spectroscopy (Q3)"
386;24756;Match;journal;03406253;0.43;Q2;64;25;75;738;69;74;0.87;29.52;Serbia;Eastern Europe;University of Kragujevac, Faculty of Science;1990, 1996-2021;"Chemistry (miscellaneous) (Q2); Applied Mathematics (Q3); Computational Theory and Mathematics (Q3); Computer Science Applications (Q3)"
387;28522;Journal of Macromolecular Science - Physics;journal;1525609X, 00222348;0.425;Q2;50;82;227;2217;156;226;0.5;27.04;United States;Northern America;Taylor and Francis Ltd.;1967-2021;"Chemistry (miscellaneous) (Q2); Materials Chemistry (Q2); Polymers and Plastics (Q2); Condensed Matter Physics (Q3)"
388;84944;Reviews in Analytical Chemistry;journal;07930135;0.418;Q3;25;13;58;819;41;58;0.85;63;Germany;Western Europe;Walter de Gruyter GmbH;1980-1983, 1985-1987, 1989, 1991-1992, 1994-2021;Analytical Chemistry (Q3)
389;24593;Calphad: Computer Coupling of Phase Diagrams and Thermochemistry;journal;03645916;0.417;Q2;66;37;104;1091;59;101;0.49;29.49;United Kingdom;Western Europe;Elsevier Ltd.;1977-2021;"Chemical Engineering (miscellaneous) (Q1); Chemistry (miscellaneous) (Q2); Computer Science Applications (Q3)"
390;14804;Spectroscopy (New York);journal;1875922X, 07124813;0.416;Q3;38;43;36;1114;26;34;0.78;25.91;Netherlands;Western Europe;IOS Press BV;1988, 1994, 1996-2012;Spectroscopy (Q3)
391;24043;Journal of Labelled Compounds and Radiopharmaceuticals;journal;03624803, 10991344;0.415;Q3;48;111;691;2479;368;689;0.82;22.33;United Kingdom;Western Europe;John Wiley and Sons Ltd;1976-2021;"Radiology, Nuclear Medicine and Imaging (Q2); Analytical Chemistry (Q3); Biochemistry (Q3); Drug Discovery (Q3); Organic Chemistry (Q3); Spectroscopy (Q3)"
392;24170;Journal of Chemical Research - Part S;journal;13645560, 03082342;0.411;Q2;37;245;843;4132;486;842;0.49;16.87;United Kingdom;Western Europe;Science Reviews Ltd;1996-2003;Chemistry (miscellaneous) (Q2)
393;93856;AIChE Ethylene Producers Conference Proceedings;conference and proceedings;-;0.41;-;8;41;95;142;9;95;0.12;3.46;United States;Northern America;;1999, 2001-2015;"Chemical Engineering (miscellaneous); Chemistry (miscellaneous)"
394;13557;Journal of Chemical Engineering of Japan;journal;00219592;0.41;Q2;50;205;571;2820;298;518;0.45;13.76;Japan;Asiatic Region;Society of Chemical Engineers, Japan;1968-2021;"Chemical Engineering (miscellaneous) (Q1); Chemistry (miscellaneous) (Q2)"
395;13691;Journal of Vinyl and Additive Technology;journal;15480585, 10835601;0.409;Q2;36;29;95;512;42;95;0.48;17.66;United Kingdom;Western Europe;John Wiley and Sons Ltd;1984-1989, 1992-2021;"Chemical Engineering (miscellaneous) (Q2); Chemistry (miscellaneous) (Q2); Marketing (Q2); Materials Chemistry (Q2); Polymers and Plastics (Q2)"
396;24801;Molecular Simulation;journal;08927022, 10290435;0.407;Q2;59;59;163;1874;140;163;0.98;31.76;United Kingdom;Western Europe;Taylor and Francis Ltd.;1987-2021;"Chemical Engineering (miscellaneous) (Q2); Chemistry (miscellaneous) (Q2); Materials Science (miscellaneous) (Q2); Condensed Matter Physics (Q3); Information Systems (Q3); Modeling and Simulation (Q3)"
397;16393;Chemical Engineering Communications;journal;00986445, 15635201;0.402;Q2;54;95;220;1999;85;220;0.36;21.04;United Kingdom;Western Europe;Taylor and Francis Ltd.;1973-1976, 1978-2021;"Chemical Engineering (miscellaneous) (Q2); Chemistry (miscellaneous) (Q2)"
398;12965;Zeitschrift fur Naturforschung - Section A Journal of Physical Sciences;journal;09320784, 18657109;0.402;Q3;49;167;438;3217;315;438;0.75;19.26;Germany;Western Europe;Walter de Gruyter GmbH;1946-2021;"Mathematical Physics (Q3); Physical and Theoretical Chemistry (Q3); Physics and Astronomy (miscellaneous) (Q3)"
399;11400153304;Progress in Heterocyclic Chemistry;book series;09596380;0.398;Q3;25;17;59;2517;27;19;0.26;148.06;United Kingdom;Western Europe;Elsevier Ltd.;1995-2003, 2005, 2007-2009, 2011-2018, 2020-2021;Organic Chemistry (Q3)
400;16396;Chemical Engineering and Technology;journal;09307516, 15214125;0.395;Q2;85;234;619;2813;272;553;0.42;12.02;Germany;Western Europe;Wiley-VCH Verlag;1978, 1987-2021;"Industrial and Manufacturing Engineering (Q1); Chemical Engineering (miscellaneous) (Q2); Chemistry (miscellaneous) (Q2)"
401;24071;Metal-Based Drugs;journal;07930291, 16875486;0.392;Q3;38;12;142;379;124;141;0.91;31.58;United States;Northern America;Hindawi Publishing Corporation;1996-2002, 2007-2011;"Pharmacology (Q2); Drug Discovery (Q3); Inorganic Chemistry (Q3); Toxicology (Q3)"
402;130041;PhysChemComm;journal;14602733;0.389;Q3;22;25;57;1099;26;57;0.4;43.96;United Kingdom;Western Europe;Royal Society of Chemistry;1998-2003;Physical and Theoretical Chemistry (Q3)
403;40752;Analusis;journal;03654877;0.387;Q2;36;0;300;0;238;286;0.99;0;France;Western Europe;EDP Sciences;1973-1989, 1995-2000;"Chemistry (miscellaneous) (Q2); Engineering (miscellaneous) (Q2)"
404;26988;Luminescence;journal;15227243, 15227235;0.387;Q2;48;29;146;906;144;145;1.04;31.24;United Kingdom;Western Europe;John Wiley and Sons Ltd;1997-2021;"Chemistry (miscellaneous) (Q2); Biophysics (Q3)"
405;16322;Desalination;journal;00119164;0.386;Q2;203;514;660;5349;403;658;0.6;10.41;Netherlands;Western Europe;Elsevier;1966-2022;"Chemical Engineering (miscellaneous) (Q2); Chemistry (miscellaneous) (Q2); Materials Science (miscellaneous) (Q2); Mechanical Engineering (Q2); Water Science and Technology (Q2)"
406;22716;Australian Journal of Chemistry;journal;14450038, 00049425;0.385;Q2;80;129;431;3807;330;430;0.75;29.51;Australia;Pacific Region;CSIRO;1948-2021;Chemistry (miscellaneous) (Q2)
407;13665;Journal of Cellular Plastics;journal;15307999, 0021955X;0.383;Q2;43;28;77;338;36;77;0.37;12.07;United Kingdom;Western Europe;SAGE Publications Ltd;1965-2021;"Chemistry (miscellaneous) (Q2); Materials Chemistry (Q2); Polymers and Plastics (Q2)"
408;13784;Journal of Non-Equilibrium Thermodynamics;journal;03400204, 14374358;0.382;Q2;37;24;74;514;55;74;0.39;21.42;Germany;Western Europe;Walter de Gruyter GmbH;1976-2021;"Chemistry (miscellaneous) (Q2); Physics and Astronomy (miscellaneous) (Q3)"
409;19500157076;Reaction Kinetics, Mechanisms and Catalysis;journal;18785204, 18785190;0.381;Q3;43;143;468;2014;210;468;0.46;14.08;Netherlands;Western Europe;Springer Netherlands;2010-2021;"Physical and Theoretical Chemistry (Q3); Catalysis (Q4)"
410;25174;Electrochemistry;journal;13443542;0.377;Q3;44;217;503;2120;255;469;0.43;9.77;Japan;Asiatic Region;Electrochemical Society of Japan;1996-2021;Electrochemistry (Q3)
411;25282;Journal of Fluorescence;journal;15734994, 10530509;0.377;Q3;74;74;135;1369;127;135;0.98;18.5;United States;Northern America;Springer New York;1991-2021;"Law (Q1); Clinical Psychology (Q2); Social Sciences (miscellaneous) (Q2); Sociology and Political Science (Q2); Biochemistry (Q3); Clinical Biochemistry (Q3); Spectroscopy (Q3)"
412;29664;Journal of Trace Elements in Medicine and Biology;journal;0946672X;0.377;Q3;82;38;124;1271;110;124;0.7;33.45;Germany;Western Europe;Urban und Fischer Verlag GmbH und Co. KG;1995-2021;"Biochemistry (Q3); Inorganic Chemistry (Q3); Molecular Medicine (Q3)"
413;26583;Ceramics - Silikaty;journal;08625468, 18045847;0.376;Q3;35;26;82;343;31;81;0.43;13.19;Czech Republic;Eastern Europe;Institute of Chemical Technology;1991-2021;"Ceramics and Composites (Q2); Chemical Engineering (miscellaneous) (Q2); Materials Chemistry (Q2); Analytical Chemistry (Q3); Physical and Theoretical Chemistry (Q3)"
414;21100826271;Inorganic and Nano-Metal Chemistry;journal;24701556, 24701564;0.374;Q3;45;127;416;3182;261;416;0.61;25.06;United Kingdom;Western Europe;Taylor and Francis Ltd.;2017-2021;"Inorganic Chemistry (Q3); Physical and Theoretical Chemistry (Q3)"
415;24111;Indian Journal of Chemistry - Section B Organic and Medicinal Chemistry;journal;03764699, 09750983;0.373;Q3;48;261;797;4596;387;796;0.45;17.61;India;Asiatic Region;Scientific Publishers of India;1970, 1973-1978, 1981, 1989-1991, 1996-2018, 2020-2021;"Pharmacology, Toxicology and Pharmaceutics (miscellaneous) (Q2); Organic Chemistry (Q3)"
416;16783;Amino Acids;journal;09394451, 14382199;0.37;Q3;127;96;279;3738;320;269;1.35;38.94;Austria;Western Europe;Springer-Verlag Wien;1991-2021;"Biochemistry (Q3); Clinical Biochemistry (Q3); Organic Chemistry (Q3)"
417;17700156431;Handbook of Analytical Separations;book series;15677192;0.37;Q3;12;0;55;0;29;47;0.53;0;Netherlands;Western Europe;Elsevier;2000-2001, 2003-2004, 2008, 2020;"Pathology and Forensic Medicine (Q2); Pharmacology, Toxicology and Pharmaceutics (miscellaneous) (Q2); Analytical Chemistry (Q3); Environmental Chemistry (Q4)"
418;23471;Croatica Chemica Acta;journal;1334417X, 00111643;0.369;Q2;52;68;220;1787;162;220;0.75;26.28;Croatia;Eastern Europe;Croatian Chemical Society;1980-1981, 1996-2021;Chemistry (miscellaneous) (Q2)
419;25879;International Journal of Molecular Sciences;journal;14220067, 16616596;0.369;Q3;195;82;37;3419;25;34;0.68;41.7;Switzerland;Western Europe;Multidisciplinary Digital Publishing Institute (MDPI);2000-2021;"Medicine (miscellaneous) (Q2); Computer Science Applications (Q3); Inorganic Chemistry (Q3); Organic Chemistry (Q3); Physical and Theoretical Chemistry (Q3); Spectroscopy (Q3); Catalysis (Q4); Molecular Biology (Q4)"
420;13609;Korean Journal of Chemical Engineering;journal;19757220, 02561115;0.363;Q2;65;178;419;3486;343;419;0.77;19.58;United States;Northern America;Springer New York;1984-2021;"Chemical Engineering (miscellaneous) (Q2); Chemistry (miscellaneous) (Q2)"
421;26952;Journal of Dispersion Science and Technology;journal;15322351, 01932691;0.361;Q3;58;73;233;2496;143;233;0.45;34.19;United States;Northern America;Taylor and Francis Ltd.;1980-2021;"Polymers and Plastics (Q2); Surfaces, Coatings and Films (Q2); Physical and Theoretical Chemistry (Q3)"
422;19700180785;Studies in Natural Products Chemistry;book series;15725995;0.361;Q3;41;46;100;7039;59;55;0.59;153.02;Netherlands;Western Europe;Elsevier;1995-1997, 2000-2003, 2005-2006, 2008, 2012-2021;"Drug Discovery (Q3); Organic Chemistry (Q3)"
423;24819;Natural Product Research;journal;14786427, 14786419;0.359;Q3;58;71;181;984;92;181;0.55;13.86;United Kingdom;Western Europe;Taylor and Francis Ltd.;2003-2021;"Analytical Chemistry (Q3); Biochemistry (Q3); Organic Chemistry (Q3); Plant Science (Q3)"
424;13572;Cellular Polymers;journal;14782421, 02624893;0.358;Q3;28;18;56;336;21;56;0.32;18.67;United Kingdom;Western Europe;SAGE Publications Ltd;1982-1987, 1989, 1991-2021;"Polymers and Plastics (Q2); Organic Chemistry (Q3)"
425;24110;Indian Journal of Chemistry - Section A Inorganic, Physical, Theoretical and Analytical Chemistry;journal;09750975, 03764710;0.357;Q3;41;247;783;5419;398;782;0.53;21.94;India;Asiatic Region;Scientific Publishers of India;1996-2021;"Inorganic Chemistry (Q3); Physical and Theoretical Chemistry (Q3)"
426;19900192900;Molecular Informatics;journal;18681751, 18681743;0.356;Q3;70;33;87;1445;120;87;1.41;43.79;Germany;Western Europe;"Wiley - VCH Verlag GmbH &amp; CO. KGaA";2010-2021;"Computer Science Applications (Q3); Drug Discovery (Q3); Molecular Medicine (Q3); Organic Chemistry (Q3); Structural Biology (Q4)"
427;23944;Bunseki Kagaku;journal;05251931;0.352;Q3;20;166;427;3188;248;427;0.6;19.2;Japan;Asiatic Region;Japan Society for Analytical Chemistry;1952, 1954-1957, 1959-2021;Analytical Chemistry (Q3)
428;21550;Structural Chemistry;journal;15729001, 10400400;0.351;Q3;48;51;142;1538;90;140;0.51;30.16;United States;Northern America;Springer New York;1990-2021;"Condensed Matter Physics (Q3); Physical and Theoretical Chemistry (Q3)"
429;14526;Physics and Chemistry of Liquids;journal;10290451, 00319104;0.349;Q3;38;55;183;1138;84;183;0.47;20.69;United Kingdom;Western Europe;Taylor and Francis Ltd.;1968-2021;"Condensed Matter Physics (Q3); Electronic, Optical and Magnetic Materials (Q3); Materials Chemistry (Q3); Physical and Theoretical Chemistry (Q3)"
430;74739;Comptes Rendus de l'Academie de Sciences - Serie IIb: Mecanique, Physique, Chimie, Astronomie;journal;12874620;0.348;Q2;25;0;254;0;112;251;0.35;0;Netherlands;Western Europe;Elsevier BV;1997-2000;"Chemistry (miscellaneous) (Q2); Physics and Astronomy (miscellaneous) (Q3)"
431;4400151608;ChemMedChem;journal;18607187, 18607179;0.346;Q3;106;139;399;3333;365;396;0.83;23.98;United Kingdom;Western Europe;John Wiley and Sons Ltd;2006-2021;"Pharmacology, Toxicology and Pharmaceutics (miscellaneous) (Q2); Organic Chemistry (Q3); Molecular Medicine (Q4)"
432;25827;Chinese Journal of Polymer Science (English Edition);journal;02567679, 14396203;0.346;Q3;40;69;231;1229;101;231;0.54;17.81;Germany;Western Europe;Springer Verlag;1985-2021;"Chemical Engineering (miscellaneous) (Q2); Polymers and Plastics (Q2); Organic Chemistry (Q3)"
433;28868;Journal of Fire Protection Engineering;journal;1532172X, 10423915;0.344;Q2;28;13;29;262;17;27;0.55;20.15;United Kingdom;Western Europe;SAGE Publications Ltd;1990-2013;"Chemistry (miscellaneous) (Q2); Materials Science (miscellaneous) (Q2); Safety, Risk, Reliability and Quality (Q2)"
434;19958;Archives of Pharmacal Research;journal;19763786, 02536269;0.343;Q3;93;149;327;4026;294;327;0.87;27.02;South Korea;Asiatic Region;Pharmaceutical Society of Korea;1978-2021;"Drug Discovery (Q3); Organic Chemistry (Q3); Molecular Medicine (Q4)"
435;18384;Medicinal Chemistry Research;journal;10542523, 15548120;0.342;Q3;50;35;102;976;93;100;0.78;27.89;United States;Northern America;Birkhauser Boston;1994, 1996-2021;"Pharmacology, Toxicology and Pharmaceutics (miscellaneous) (Q2); Organic Chemistry (Q3)"
436;13089;International Journal of Polymer Analysis and Characterization;journal;15635341, 1023666X;0.34;Q3;44;20;76;475;40;76;0.52;23.75;United Kingdom;Western Europe;Taylor and Francis Ltd.;1995-2021;"Chemical Engineering (miscellaneous) (Q2); Polymers and Plastics (Q2); Analytical Chemistry (Q3)"
437;23232;Food Technology;trade journal;00156639;0.339;Q2;58;301;382;368;162;217;0.22;1.22;United States;Northern America;Institute of Food Technologists;1973, 1979, 1982-1983, 1986, 1989, 1991, 1993-2021;"Industrial and Manufacturing Engineering (Q1); Chemistry (miscellaneous) (Q2); Food Science (Q2)"
438;24177;Journal of Coordination Chemistry;journal;10290389, 00958972;0.334;Q3;51;142;301;3543;188;300;0.64;24.95;United Kingdom;Western Europe;Taylor and Francis Ltd.;1971-2021;"Materials Chemistry (Q3); Physical and Theoretical Chemistry (Q3)"
439;13540;Advances in Polymer Technology;journal;07306679, 10982329;0.33;Q3;47;28;73;736;50;73;0.56;26.29;United States;Northern America;"John Wiley &amp; Sons Inc.";1981-2021;"Chemical Engineering (miscellaneous) (Q2); Polymers and Plastics (Q2); Organic Chemistry (Q3)"
440;24097;Journal of the Indian Chemical Society;journal;00194522;0.33;Q3;33;268;524;5201;217;522;0.43;19.41;India;Asiatic Region;Elsevier BV;1973-1985, 1987-1991, 1996-2021;"Drug Discovery (Q3); Electrochemistry (Q3); Inorganic Chemistry (Q3); Organic Chemistry (Q3); Physical and Theoretical Chemistry (Q3)"
441;23941;Journal of Mathematical Chemistry;journal;02599791, 15728897;0.329;Q2;65;49;153;1221;99;153;0.51;24.92;Netherlands;Western Europe;Springer Netherlands;1987-2021;"Chemistry (miscellaneous) (Q2); Applied Mathematics (Q3)"
442;18300156734;Main Group Chemistry;journal;17451167, 10241221;0.328;Q3;20;0;16;0;8;16;0.3;0;Netherlands;Western Europe;IOS Press BV;1995-2000, 2005-2021;"Inorganic Chemistry (Q3); Materials Chemistry (Q3); Organic Chemistry (Q3)"
443;22658;Acta Chimica Slovenica;journal;15803155, 13180207;0.327;Q2;49;77;144;1581;82;144;0.59;20.53;Slovenia;Eastern Europe;Slovensko Kemijsko Drustvo;1996-2021;Chemistry (miscellaneous) (Q2)
444;27012;Progress in Colloid and Polymer Science;book series;0340255X;0.326;Q3;38;54;295;1483;167;295;0.46;27.46;Germany;Western Europe;Springer Verlag;1978-1979, 1983-1985, 1987-1988, 1990, 1993-1994, 1996-2013;"Polymers and Plastics (Q2); Colloid and Surface Chemistry (Q3); Materials Chemistry (Q3); Organic Chemistry (Q3); Physical and Theoretical Chemistry (Q3)"
445;26528;Trends in Glycoscience and Glycotechnology;journal;09157352, 18832113;0.325;Q4;37;29;136;1511;111;136;0.89;52.1;Japan;Asiatic Region;Gakushin Publishing Company;1986, 1989-2021;"Biochemistry (Q3); Organic Chemistry (Q4)"
446;24673;Crystal Research and Technology;journal;15214079, 02321300;0.324;Q2;67;147;462;2761;272;459;0.51;18.78;Germany;Western Europe;"John Wiley &amp; Sons Inc.";1966-2021;"Chemistry (miscellaneous) (Q2); Materials Science (miscellaneous) (Q2); Condensed Matter Physics (Q3)"
447;21492;Research on Chemical Intermediates;journal;09226168, 15685675;0.324;Q2;54;72;230;2204;158;228;0.63;30.61;Netherlands;Western Europe;Springer Netherlands;1984-2021;Chemistry (miscellaneous) (Q2)
448;26442;Polycyclic Aromatic Compounds;journal;15635333, 10406638;0.32;Q4;36;88;211;2089;133;211;0.6;23.74;United Kingdom;Western Europe;Taylor and Francis Ltd.;1990-2021;"Polymers and Plastics (Q2); Materials Chemistry (Q3); Organic Chemistry (Q4)"
449;28480;Tetsu-To-Hagane/Journal of the Iron and Steel Institute of Japan;journal;00211575;0.317;Q3;36;122;370;2751;185;369;0.52;22.55;Japan;Asiatic Region;Iron and Steel Institute of Japan;1968-1991, 1994-2021;"Metals and Alloys (Q2); Condensed Matter Physics (Q3); Materials Chemistry (Q3); Physical and Theoretical Chemistry (Q3)"
450;20479;JSME International Journal, Series B: Fluids and Thermal Engineering;journal;13408054, 13475371;0.315;Q3;37;119;272;1582;79;272;0.28;13.29;Japan;Asiatic Region;Japan Society of Mechanical Engineers;1988-2007;"Fluid Flow and Transfer Processes (Q1); Mechanical Engineering (Q2); Physical and Theoretical Chemistry (Q3)"
451;30401;Journal of Trace and Microprobe Techniques;journal;07334680;0.312;Q3;26;23;161;359;89;161;0.54;15.61;United States;Northern America;Marcel Dekker Inc.;1986-1987, 1996-2003;Analytical Chemistry (Q3)
452;13301;Surface Coatings International Part B: Coatings International;journal;14764865;0.31;Q2;22;43;130;777;31;130;0.29;18.07;United Kingdom;Western Europe;"Oil &amp; Colour Chemists' Association";1996-2006;"Chemical Engineering (miscellaneous) (Q2); Chemistry (miscellaneous) (Q2); Surfaces and Interfaces (Q3); Surfaces, Coatings and Films (Q3)"
453;21968;Theoretical and Computational Chemistry;book series;13807323;0.31;Q3;30;36;87;3448;59;47;1.18;95.78;Netherlands;Western Europe;Elsevier;1995-1996, 1998-1999, 2001-2005, 2007;Physical and Theoretical Chemistry (Q3)
454;144932;Protein Journal;journal;15723887;0.306;Q3;56;71;279;2109;242;279;0.79;29.7;United States;Northern America;Springer New York;1996-2021;"Analytical Chemistry (Q3); Bioengineering (Q3); Biochemistry (Q4); Organic Chemistry (Q4)"
455;23449;Journal of the Chinese Chemical Society;journal;00094536, 21926549;0.305;Q2;47;161;493;4537;274;493;0.56;28.18;United States;Northern America;Wiley-Blackwell;1954-2021;Chemistry (miscellaneous) (Q2)
456;11700154632;Proceedings - International Conference on Application of Concurrency to System Design, ACSD;conference and proceedings;15504808;0.304;-;23;0;24;0;17;23;0.71;0;United States;Northern America;;;"Chemical Engineering (miscellaneous); Chemistry (miscellaneous); Engineering (miscellaneous); Materials Science (miscellaneous)"
457;22804;Chemical Papers;journal;03666352, 13369075;0.302;Q2;46;75;219;1288;81;219;0.36;17.17;Switzerland;Western Europe;Springer International Publishing AG;1973, 1996-2021;"Chemical Engineering (miscellaneous) (Q2); Chemistry (miscellaneous) (Q2); Industrial and Manufacturing Engineering (Q2); Materials Chemistry (Q3); Biochemistry (Q4)"
458;57377;International Chemical Recovery Conference;conference and proceedings;-;0.298;-;11;0;31;0;7;30;0.23;0;United States;Northern America;TAPPI Press;1998, 2001, 2010;"Chemical Engineering (miscellaneous); Chemistry (miscellaneous); Industrial and Manufacturing Engineering; Media Technology"
459;26570;Journal of Cosmetic Science;journal;15257886;0.298;Q2;38;52;109;539;52;109;0.59;10.37;United States;Northern America;Society of Cosmetic Chemists;1996-2020;"Chemistry (miscellaneous) (Q2); Dermatology (Q2); Medicine (miscellaneous) (Q2)"
460;21443;Polish Journal of Chemistry;journal;01375083;0.298;Q2;35;193;636;4482;353;636;0.54;23.22;Poland;Eastern Europe;Polish Chemical Society;1996-2009;Chemistry (miscellaneous) (Q2)
461;16304;Adsorption Science and Technology;journal;02636174;0.297;Q2;40;84;210;1855;145;210;0.68;22.08;United Kingdom;Western Europe;Hindawi Limited;1984-1985, 1989-2021;"Chemical Engineering (miscellaneous) (Q2); Chemistry (miscellaneous) (Q2); Surfaces and Interfaces (Q3)"
462;23433;Chimia;journal;00094293;0.296;Q2;56;111;316;1721;235;316;0.74;15.5;Switzerland;Western Europe;Swiss Chemical Society;1947-1949, 1960-1961, 1973-1986, 1996-2021;"Chemistry (miscellaneous) (Q2); Medicine (miscellaneous) (Q2)"
463;20180;Trace Elements and Electrolytes (discontinued);journal;09462104;0.295;Q3;21;44;117;973;60;114;0.56;22.11;Germany;Western Europe;Dustri-Verlag Dr. Karl Feistle;1994-2016, 2021;"Clinical Biochemistry (Q3); Inorganic Chemistry (Q3); Biochemistry (Q4)"
464;101678;Laser Chemistry;journal;02786273, 14763516;0.292;Q3;14;9;81;255;48;81;0.6;28.33;United States;Northern America;Hindawi Publishing Corporation;1984, 1992-2000, 2002, 2006-2010;"Atomic and Molecular Physics, and Optics (Q3); Spectroscopy (Q3); Biochemistry (Q4)"
465;19700185200;Journal of Natural Medicines;journal;13403443, 18610293;0.291;Q4;50;69;231;745;74;224;0.34;10.8;Germany;Western Europe;Springer Verlag;2006-2021;"Complementary and Alternative Medicine (Q2); Medicine (miscellaneous) (Q2); Pharmaceutical Science (Q2); Drug Discovery (Q4); Organic Chemistry (Q4)"
466;24711;Molecular Crystals and Liquid Crystals;journal;15421406, 15635287;0.291;Q2;54;724;2616;8351;1305;2595;0.5;11.53;United Kingdom;Western Europe;Taylor and Francis Ltd.;1972, 2003-2021;"Chemistry (miscellaneous) (Q2); Materials Science (miscellaneous) (Q2); Condensed Matter Physics (Q3)"
467;23955;Chemia Analityczna;journal;00092223;0.29;Q4;25;84;265;1974;151;265;0.56;23.5;Poland;Eastern Europe;Polskie Towarzystwo Chemiczne;1983, 1996-2009;Analytical Chemistry (Q4)
468;23415;Accreditation and Quality Assurance;journal;09491775, 14320517;0.288;Q2;40;100;251;933;86;251;0.43;9.33;United States;Northern America;Springer New York;1996-2021;"Chemical Engineering (miscellaneous) (Q2); Chemistry (miscellaneous) (Q2); Safety, Risk, Reliability and Quality (Q2); Instrumentation (Q3)"
469;19700180801;Studies in Interface Science;book series;13837303;0.288;Q3;21;33;82;1476;28;12;0.34;44.73;Netherlands;Western Europe;Elsevier;1995-1996, 1998, 2000-2003, 2005-2006, 2010-2011;"Colloid and Surface Chemistry (Q3); Materials Chemistry (Q3); Physical and Theoretical Chemistry (Q3); Surfaces and Interfaces (Q3)"
470;21479;Quimica Nova;journal;01004042, 16787064;0.283;Q2;76;164;402;7850;227;402;0.54;47.87;Brazil;Latin America;Sociedade Brasileira de Quimica;1992, 1997-2021;Chemistry (miscellaneous) (Q2)
471;24112;Indian Journal of Heterocyclic Chemistry;journal;09711627;0.28;Q4;31;106;259;1007;73;259;0.28;9.5;India;Asiatic Region;Connect Journals;1996-2021;"Biochemistry (Q4); Organic Chemistry (Q4)"
472;19600164700;Journal of Chemical Sciences;journal;09743626, 09737103;0.279;Q2;54;74;194;2087;93;190;0.49;28.2;India;Asiatic Region;Springer India;1980-1981, 1986-1987, 1990, 1993, 1996-1997, 2000, 2002-2021;Chemistry (miscellaneous) (Q2)
