Rank;Sourceid;Title;Type;Issn;SJR;SJR Best Quartile;H index;Total Docs. (2010);Total Docs. (3years);Total Refs.;Total Cites (3years);Citable Docs. (3years);Cites / Doc. (2years);Ref. / Doc.;Country;Region;Publisher;Coverage;Categories
106;18694;Theory and Science;journal;15275558;0.101;Q4;10;0;18;0;2;17;0.33;0,00;United States;Northern America;International Consortium for the Advancement of Academic Publishing;2000-2008;"Multidisciplinary (Q4); Social Sciences (miscellaneous) (Q4)"
107;19700166903;Universitas Scientiarum;journal;20271352, 01227483;0.101;Q4;9;21;22;605;0;21;0.00;28,81;Colombia;Latin America;Pontificia Universidad Javeriana;2009-2019;Multidisciplinary (Q4)
108;38958;Research and Development (Barrington, Illinois);journal;07469179;0.100;Q4;3;50;148;10;1;124;0.01;0,20;United States;Northern America;Advantage Business Media;1984-1989, 1994-1996, 1998-1999, 2001-2002, 2007-2018;"Industrial and Manufacturing Engineering (Q4); Multidisciplinary (Q4)"
109;23467;Taiwan Review;journal;17275199, 17275148;0.100;Q4;2;134;379;0;2;337;0.01;0,00;Taiwan;Asiatic Region;Kwang Hwa Publishing Co.;2003-2019;Multidisciplinary (Q4)
110;6500153124;Theology and Science;journal;14746719, 14746700;0.100;Q4;12;31;94;909;21;93;0.23;29,32;United Kingdom;Western Europe;Routledge;2003-2020;"History and Philosophy of Science (Q4); Multidisciplinary (Q4); Religious Studies (Q4)"
111;19700181256;Constructivist Foundations;journal;1782348X;;-;14;26;0;883;0;0;0.00;33,96;Belgium;Western Europe;Vrije Universiteit Brussel;2010-2019;"Cognitive Neuroscience; Education; History and Philosophy of Science; Philosophy"
112;19700168304;Journal of Advanced Research;journal;20901232;;-;45;42;0;1475;0;0;0.00;35,12;Egypt;Africa/Middle East;Cairo University;2010-2020;Multidisciplinary
113;5800207553;Linguistics in the Netherlands;journal;09297332;;-;13;10;46;175;8;46;0.19;17,50;Netherlands;Western Europe;John Benjamins Publishing Company;1996-2017, 2019;"Health Professions (miscellaneous); Language and Linguistics; Linguistics and Language; Multidisciplinary; Psychology (miscellaneous); Social Sciences (miscellaneous)"
114;21100256950;Movement and Sports Sciences - Science et Motricite;journal;21185735, 21185743;;-;8;5;0;195;0;0;0.00;39,00;France;Western Europe;EDP Sciences;2010-2019;"Orthopedics and Sports Medicine; Physical Therapy, Sports Therapy and Rehabilitation; Physiology; Physiology (medical)"
115;19700200807;Research in Science and Technological Education;journal;14701138, 02635143;;-;31;20;58;818;60;49;1.19;40,90;United Kingdom;Western Europe;Taylor and Francis Ltd.;1983-2020;"Education; Multidisciplinary"
