Rank;Sourceid;Title;Type;Issn;SJR;SJR Best Quartile;H index;Total Docs. (2007);Total Docs. (3years);Total Refs.;Total Cites (3years);Citable Docs. (3years);Cites / Doc. (2years);Ref. / Doc.;Country;Publisher;Coverage;Categories
951;16300154741;Global Media and Communication;journal;17427665, 17427673;0.458;Q2;20;41;61;625;42;53;0.79;15.24;United Kingdom;SAGE Publications;2005-ongoing;"Arts and Humanities (miscellaneous) (Q2); Communication (Q2)"
952;72639;International Journal of Comparative Sociology;journal;00207152;0.458;Q2;36;20;67;1118;46;65;0.72;55.90;United States;SAGE Publications;1960-ongoing;"Social Sciences (miscellaneous) (Q2); Sociology and Political Science (Q2)"
953;26863;Middle East Policy;journal;14754967, 10611924;0.458;Q2;23;50;129;882;71;119;0.52;17.64;United Kingdom;Blackwell Publishing Inc.;1992-ongoing;"Political Science and International Relations (Q2); Sociology and Political Science (Q2)"
954;19470;Information Resources Management Journal;journal;15337979, 10401628;0.457;Q1;37;31;65;1220;97;58;1.33;39.35;United States;Idea Group Publishing;2003-ongoing;"Business and International Management (Q1); Library and Information Sciences (Q1); Strategy and Management (Q2)"
955;147231;International Review for the Sociology of Sport;journal;10126902;0.457;Q2;51;24;64;1317;49;61;0.69;54.88;United States;SAGE Publications;1966-2002, 2004-ongoing;"Social Sciences (miscellaneous) (Q2); Sociology and Political Science (Q2); Sports Science (Q3)"
956;27639;Cartography and Geographic Information Science;journal;15230406;0.456;Q2;49;32;64;777;76;62;1.29;24.28;United Kingdom;Taylor & Francis;1997-ongoing;"Civil and Structural Engineering (Q2); Geography, Planning and Development (Q2); Management of Technology and Innovation (Q2)"
957;14506;Local Environment;journal;14696711, 13549839;0.456;Q2;53;40;121;1492;106;114;0.83;37.30;United Kingdom;Carfax Publishing Ltd.;1996-ongoing;"Geography, Planning and Development (Q2); Management, Monitoring, Policy and Law (Q2)"
958;147218;Journal of Conflict and Security Law;journal;14677954;0.454;Q1;20;16;33;2579;29;31;0.94;161.19;United Kingdom;Oxford University Press;2005-ongoing;"Law (Q1); Safety Research (Q2); Safety, Risk, Reliability and Quality (Q2)"
959;23800;Adolescence;journal;00018449;0.453;Q2;66;48;151;1824;167;151;0.64;38.00;United States;Libra Publishing Ltd.;1973-2009;"Health Professions (miscellaneous) (Q1); Education (Q2); Psychology (miscellaneous) (Q2); Social Sciences (miscellaneous) (Q2); Developmental and Educational Psychology (Q3)"
960;21100805777;Information and Learning Science;journal;23985348;0.453;Q1;25;54;139;729;69;131;0.43;13.50;United Kingdom;Emerald Group Publishing Ltd.;2017-ongoing;"Library and Information Sciences (Q1); Computer Science Applications (Q2); Education (Q2)"
961;29232;International Journal of Occupational Safety and Ergonomics;journal;10803548;0.452;Q2;28;40;104;1024;62;104;0.64;25.60;United Kingdom;Taylor & Francis;1995-ongoing;"Public Health, Environmental and Occupational Health (Q2); Safety Research (Q2); Safety, Risk, Reliability and Quality (Q2)"
962;15807;International Review of Administrative Sciences;journal;00208523;0.452;Q2;45;45;153;1525;79;141;0.53;33.89;United States;SAGE Publications;1957-ongoing;"Public Administration (Q2); Sociology and Political Science (Q2)"
963;5000154401;Archaeological Prospection;journal;10990763, 10752196;0.45;Q1;34;17;68;330;49;67;0.79;19.41;United Kingdom;John Wiley & Sons Ltd.;2005-ongoing;"Archeology (Q1); History (Q1)"
964;147221;Journal of Social Archaeology;journal;14696053;0.45;Q1;31;18;50;1187;45;50;0.97;65.94;United States;SAGE Publications;2001-ongoing;"Archeology (Q1); Arts and Humanities (miscellaneous) (Q2)"
965;145212;Sociological Research Online;journal;13607804;0.45;Q2;41;46;121;1908;84;121;0.74;41.48;United Kingdom;British Sociological Association;1996-2001, 2003-ongoing;Sociology and Political Science (Q2)
966;23749;Ancient Mesoamerica;journal;14691787, 09565361;0.449;Q2;35;19;61;1166;39;59;0.56;61.37;United Kingdom;Cambridge University Press;1989-ongoing;"Arts and Humanities (miscellaneous) (Q2); Geography, Planning and Development (Q2)"
967;16473;Journal of Contemporary Asia;journal;00472336;0.449;Q1;33;23;75;925;59;74;0.75;40.22;United Kingdom;Taylor & Francis;1970-ongoing;"Cultural Studies (Q1); Social Sciences (miscellaneous) (Q2)"
968;13954;Journal of the Urban Planning and Development Division, ASCE;journal;07339488;0.449;Q2;36;30;85;790;51;83;0.55;26.33;United States;American Society of Civil Engineers;1979-ongoing;"Civil and Structural Engineering (Q2); Development (Q2); Geography, Planning and Development (Q2); Urban Studies (Q2)"
969;19111;Human Factors and Ergonomics In Manufacturing;journal;10908471, 15206564;0.448;Q3;31;26;75;728;63;74;0.52;28.00;United States;John Wiley & Sons Inc.;1996-ongoing;"Industrial and Manufacturing Engineering (Q1); Human Factors and Ergonomics (Q3)"
970;18676;Technology in Society;journal;0160791X;0.448;Q2;44;43;112;1358;112;111;1.15;31.58;Netherlands;Elsevier BV;1979-ongoing;"Business and International Management (Q1); Education (Q2); Human Factors and Ergonomics (Q2); Sociology and Political Science (Q2)"
971;16511;Australian Journal of Public Administration;journal;03136647;0.447;Q2;36;42;127;1410;81;127;0.55;33.57;United Kingdom;Blackwell Publishing Inc.;1937-ongoing;"Public Administration (Q2); Sociology and Political Science (Q2)"
972;16707;Journal of Family Therapy;journal;14676427, 01634445;0.447;Q2;39;41;82;864;105;74;1.41;21.07;United Kingdom;Blackwell Publishing Inc.;1979-ongoing;"Clinical Psychology (Q2); Social Sciences (miscellaneous) (Q2); Social Psychology (Q3)"
973;4700153513;Journal of the Polynesian Society;journal;00324000;0.447;Q1;12;16;13;563;10;11;0.91;35.19;New Zealand;University of Auckland;1971-1972, 1977, 1979, 1988, 1996, 2001, 2006-ongoing;Cultural Studies (Q1)
974;17700156312;Environmental Policy and Governance;journal;1756932X;0.446;Q2;40;26;73;1145;82;70;0.95;44.04;United States;John Wiley & Sons Inc.;2009-ongoing;"Geography, Planning and Development (Q2); Management, Monitoring, Policy and Law (Q2)"
975;28042;Journal of Geographical Systems;journal;14355949, 14355930;0.445;Q2;48;15;66;619;79;66;1.12;41.27;Germany;Springer Verlag;1999-ongoing;"Earth-Surface Processes (Q2); Geography, Planning and Development (Q2)"
976;26522;Meditteranean Politics;journal;13629395;0.445;Q2;25;25;77;547;49;73;0.71;21.88;United Kingdom;Frank Cass Publishers;1996-ongoing;"Geography, Planning and Development (Q2); Political Science and International Relations (Q2)"
977;22197;PS - Political Science and Politics;journal;10490965, 15375935;0.445;Q2;53;104;330;1627;170;317;0.54;15.64;United Kingdom;Cambridge University Press;1968-ongoing;Sociology and Political Science (Q2)
978;26163;Western Journal of Communication;journal;10570314;0.445;Q2;36;17;58;798;52;56;0.83;46.94;United Kingdom;Taylor & Francis;1992-ongoing;"Language and Linguistics (Q1); Communication (Q2)"
979;6400153111;Journal of Ethnobiology and Ethnomedicine;journal;17464269;0.444;Q1;57;38;66;2448;106;64;1.66;64.42;United Kingdom;BioMed Central;2005-ongoing;"Complementary and Alternative Medicine (Q1); Cultural Studies (Q1); Agricultural and Biological Sciences (miscellaneous) (Q2); Health (social science) (Q2)"
980;5600153491;Journal of Multilingual and Multicultural Development;journal;01434632;0.444;Q1;37;27;88;978;51;83;0.47;36.22;United Kingdom;Routledge;1980-ongoing;"Cultural Studies (Q1); Linguistics and Language (Q1); Education (Q2)"
981;26842;Journal of World Trade;journal;10116702;0.444;Q1;29;33;140;3533;84;134;0.57;107.06;Netherlands;Kluwer Law International;1996-ongoing;"Law (Q1); Political Science and International Relations (Q2); Economics and Econometrics (Q3)"
982;23837;Linguistics and Education;journal;08985898;0.444;Q1;37;22;54;1083;29;50;0.43;49.23;Netherlands;Elsevier BV;1988-ongoing;"Language and Linguistics (Q1); Linguistics and Language (Q1); Education (Q2)"
983;16498;Past and Present;journal;00312746;0.443;Q1;32;30;46;5176;45;43;1.05;172.53;United Kingdom;Oxford University Press;1952-1998, 2000-2001, 2005-ongoing;"Cultural Studies (Q1); History (Q1)"
984;52437;Oceania;journal;00298077;0.442;Q2;22;15;59;553;28;57;0.26;36.87;United States;Wiley-Blackwell;1930-ongoing;"History and Philosophy of Science (Q1); Anthropology (Q2)"
985;27789;International Journal of Marine and Coastal Law;journal;09273522, 15718085;0.44;Q1;25;22;67;2629;72;63;1;119.50;Netherlands;Martinus Nijhoff Publishers;1994-ongoing;"Law (Q1); Environmental Science (miscellaneous) (Q2); Geography, Planning and Development (Q2); Management, Monitoring, Policy and Law (Q2); Oceanography (Q2)"
986;21100801727;Digital Library Perspectives;journal;20595816;0.439;Q2;20;46;104;325;48;104;0.5;7.07;United Kingdom;Emerald Group Publishing Ltd.;2016-ongoing;"Education (Q2); Information Systems (Q2); Library and Information Sciences (Q2)"
987;25158;Global Governance;journal;10752846;0.439;Q2;48;37;97;1498;122;96;0.89;40.49;United States;Lynne Rienner Publishers;1996-ongoing;"Environmental Science (miscellaneous) (Q2); Political Science and International Relations (Q2); Safety Research (Q2); Sociology and Political Science (Q2)"
988;17534;Social Justice Research;journal;15736725, 08857466;0.439;Q1;49;26;69;1496;53;66;0.52;57.54;United States;Kluwer Academic/Plenum Publishers;1987-1990, 1992-ongoing;"Law (Q1); Anthropology (Q2); Sociology and Political Science (Q2)"
989;26890;Health reports / Statistics Canada, Canadian Centre for Health Information = Rapports sur la sante / Statistique Canada, Centre canadien d'information sur la sante;journal;12091367, 08406529;0.438;Q2;53;21;50;0;68;50;1.72;0.00;Canada;Statistics Canada;1989-ongoing;"Demography (Q2); Public Health, Environmental and Occupational Health (Q2)"
990;13344;Social Psychology of Education;journal;15731928, 13812890;0.438;Q2;39;26;66;1142;48;56;0.49;43.92;Netherlands;Kluwer Academic Publishers;1996-ongoing;"Sociology and Political Science (Q2); Developmental and Educational Psychology (Q3); Social Psychology (Q3)"
991;5400152601;Annual Review of Nursing Education;book series;1542412X;0.437;Q2;9;15;45;331;17;43;0.4;22.07;United States;Springer New York LLC;2005-2008;"Nursing (miscellaneous) (Q1); Education (Q2)"
992;144947;European Journal of Ageing;journal;16139372, 16139380;0.437;Q2;36;23;55;748;47;52;0.82;32.52;Germany;Springer Verlag;2005-ongoing;"Geriatrics and Gerontology (Q2); Health (social science) (Q2)"
993;20143;Business and Society;journal;00076503;0.436;Q2;64;24;56;1126;59;47;1.14;46.92;United States;SAGE Publications;1960-1978, 1980-1981, 1983-ongoing;"Business, Management and Accounting (miscellaneous) (Q1); Social Sciences (miscellaneous) (Q2)"
994;200147131;Cambridge Journal of Education;journal;0305764X, 14693577;0.436;Q2;36;34;58;1356;54;53;1.02;39.88;United Kingdom;Carfax Publishing Ltd.;1971-1995, 2005-ongoing;Education (Q2)
995;4700152804;Internet Reference Services Quarterly;journal;15404749, 10875301;0.436;Q2;17;13;104;203;46;100;0.42;15.62;United States;Haworth Press Inc.;1996-2002, 2004-ongoing;"E-learning (Q2); Library and Information Sciences (Q2)"
996;27387;Population Research and Policy Review;journal;15737829, 01675923;0.436;Q2;42;26;77;1139;46;72;0.46;43.81;Netherlands;Kluwer Academic Publishers;1982-ongoing;"Demography (Q2); Management, Monitoring, Policy and Law (Q2)"
997;12012;Annual Review of Sex Research;journal;10532528;0.435;Q2;41;9;27;920;40;24;1.29;102.22;United States;Society for the Scientific Study of Sexuality;1997-2005;"Psychology (miscellaneous) (Q2); Sociology and Political Science (Q2)"
998;18405;Educational Technology and Society;journal;14364522;0.435;Q2;73;85;217;2986;315;208;1.36;35.13;Taiwan;National Taiwan Normal University;1998-ongoing;"Engineering (miscellaneous) (Q1); Education (Q2); E-learning (Q2); Sociology and Political Science (Q2)"
999;4800156301;McKinsey Quarterly;journal;00475394;0.435;Q2;30;82;130;195;92;118;0.78;2.38;United States;McKinsey & Co.;2005-ongoing;"Business, Management and Accounting (miscellaneous) (Q1); Economics, Econometrics and Finance (miscellaneous) (Q2); Political Science and International Relations (Q2)"
1000;21100784742;"Turbo Codes and Related Topics; 6th International ITG-Conference on Source and Channel Coding (TURBOCODING), 2006 4th International Symposium on";conference and proceedings;00002006;0.435;-;13;0;157;0;125;156;0.8;0.00;United States;;2006;"Artificial Intelligence; Automotive Engineering; Computer Networks and Communications; Computer Science Applications; Control and Systems Engineering; Electrical and Electronic Engineering; Mechanical Engineering; Transportation"
1001;13760;Habitat International;journal;01973975;0.434;Q2;59;31;142;1094;93;140;0.64;35.29;United Kingdom;Elsevier Ltd.;1976-ongoing;"Urban Studies (Q2); Nature and Landscape Conservation (Q3)"
1002;144624;International Journal of Innovation and Learning;journal;14718197, 17418089;0.434;Q2;25;36;97;1180;248;97;2.53;32.78;United Kingdom;Inderscience Publishers;2005-ongoing;"Education (Q2); Management of Technology and Innovation (Q2)"
1003;15591;JASSS;journal;14607425;0.434;Q2;51;37;100;1310;135;99;1.43;35.41;United Kingdom;University of Surrey;2000-ongoing;"Computer Science (miscellaneous) (Q2); Social Sciences (miscellaneous) (Q2)"
1004;20563;Minerva;journal;00264695, 15731871;0.433;Q2;33;18;61;1078;31;57;0.33;59.89;Netherlands;Kluwer Academic Publishers;1962-ongoing;"Education (Q2); Social Sciences (miscellaneous) (Q2)"
1005;100147339;British Journal of Special Education;journal;09523383;0.432;Q2;32;33;94;646;64;83;0.55;19.58;United Kingdom;Blackwell Publishing Inc.;1974-1995, 2005-ongoing;"Education (Q2); Developmental and Educational Psychology (Q3)"
1006;14279;Educational Research;journal;00131881, 14695847;0.432;Q2;47;26;60;971;57;60;0.77;37.35;United Kingdom;Routledge;1958-ongoing;Education (Q2)
1007;20902;Environment, Development and Sustainability;journal;1387585X, 15732975;0.431;Q2;47;26;84;927;92;80;0.97;35.65;Netherlands;Kluwer Academic Publishers;1999-ongoing;"Geography, Planning and Development (Q2); Management, Monitoring, Policy and Law (Q2); Economics and Econometrics (Q3)"
1008;28957;Japan and the World Economy;journal;09221425;0.431;Q2;31;26;99;670;42;88;0.4;25.77;Netherlands;Elsevier BV;1988-ongoing;"Finance (Q2); Political Science and International Relations (Q2); Economics and Econometrics (Q3)"
1009;5000158308;CBE Life Sciences Education;journal;19317913;0.429;Q2;48;15;126;362;82;123;0.57;24.13;United States;American Society for Cell Biology;2006-ongoing;"Biochemistry, Genetics and Molecular Biology (miscellaneous) (Q2); Education (Q2)"
1010;130084;Journal of Contemporary Criminal Justice;journal;10439862;0.429;Q1;40;24;56;1068;47;49;1.08;44.50;United States;SAGE Publications;1978-1981, 1983-1984, 1987-ongoing;Law (Q1)
1011;100147347;Transnational Corporations;journal;10149562;0.429;Q2;21;14;30;653;28;28;1;46.64;United States;United Nations Publications;2005-2012, 2015-ongoing;"Business, Management and Accounting (miscellaneous) (Q1); Economics, Econometrics and Finance (miscellaneous) (Q2); Political Science and International Relations (Q2)"
1012;4400151601;Asia Pacific Education Review;journal;15981037;0.428;Q2;23;43;42;1826;11;41;0.27;42.47;Netherlands;Springer Netherlands;2005-ongoing;Education (Q2)
1013;22090;High Ability Studies;journal;13598139, 1469834X;0.428;Q2;28;22;58;778;41;54;0.3;35.36;United Kingdom;Carfax Publishing Ltd.;1996-ongoing;Education (Q2)
1014;62702;Proceedings of the ACM International Conference on Digital Libraries;conference and proceedings;00002002, 00002004, 00001996, 00002010, 00002008, 00002007, 00002000;0.428;-;44;118;98;1400;109;97;0;11.86;United States;;1996-2000, 2002, 2004, 2007-2008, 2010;"Computer Science Applications; Information Systems; Library and Information Sciences; Software"
1015;23587;Journal of Real Estate Practice and Education;journal;15214842;0.427;Q2;12;10;21;231;9;20;0.4;23.10;United States;American Real Estate Society;2003-2016 (cancelled);"Economics, Econometrics and Finance (miscellaneous) (Q2); Education (Q2)"
1016;5800170390;William and Mary Quarterly;journal;00435597;0.427;Q1;33;35;65;2328;46;65;0.54;66.51;United States;Omohundro Institute of Early American History and Culture;1936, 1956, 1971-1972, 1975-1978, 1981-1982, 1984-1987, 1999-ongoing;"Cultural Studies (Q1); History (Q1)"
1017;21211;Pharmacy Education;journal;14772701, 15602214;0.426;Q2;15;48;93;805;57;92;0.48;16.77;United Kingdom;Taylor & Francis;1973-1978, 2002-ongoing;"Pharmacy (Q1); Education (Q2); Pharmaceutical Science (Q2)"
1018;144643;Learning Organization;journal;09696474;0.425;Q2;50;37;111;1261;149;111;1.23;34.08;United Kingdom;Emerald Group Publishing Ltd.;1994-ongoing;"Education (Q2); Organizational Behavior and Human Resource Management (Q2)"
1019;22015;Child Language Teaching and Therapy;journal;02656590;0.424;Q1;29;17;40;556;41;39;1;32.71;United States;SAGE Publications;1985-ongoing;"Language and Linguistics (Q1); Linguistics and Language (Q1); Clinical Psychology (Q2); Education (Q2); Developmental and Educational Psychology (Q3); Speech and Hearing (Q3)"
1020;3900148210;Evidence and Policy;journal;17442648;0.424;Q2;27;30;23;900;24;20;1.2;30.00;United Kingdom;The Policy Press;2006-ongoing;"Orthopedics and Sports Medicine (Q2); Social Sciences (miscellaneous) (Q2); Cardiology and Cardiovascular Medicine (Q3); Physiology (Q3)"
1021;19349;Journal of Mathematical Sociology;journal;0022250X;0.424;Q2;29;16;41;408;37;40;1.04;25.50;United Kingdom;Taylor & Francis;1971-ongoing;"Social Sciences (miscellaneous) (Q2); Sociology and Political Science (Q2); Algebra and Number Theory (Q4)"
1022;21100198461;Proceedings of the 10th European Workshop on Natural Language Generation, ENLG-05;conference and proceedings;00002005;0.424;-;9;0;30;0;30;28;1.07;0.00;United States;;2005;"Language and Linguistics; Linguistics and Language"
1023;21517;South East Asia Research;journal;0967828X;0.424;Q2;17;8;42;524;18;39;0.46;65.50;United States;SAGE Publications Inc.;1995-ongoing;"Development (Q2); Geography, Planning and Development (Q2); Political Science and International Relations (Q2)"
1024;16562;Armed Forces and Society;journal;0095327X;0.423;Q2;36;29;86;2170;74;85;0.89;74.83;United States;SAGE Publications;1974-ongoing;"Safety Research (Q2); Social Sciences (miscellaneous) (Q2); Sociology and Political Science (Q2)"
1025;15415;Phi Delta Kappan;journal;00317217;0.423;Q2;51;212;608;1351;186;522;0.33;6.37;United States;SAGE Publications Inc.;1981, 1984, 1993-ongoing;Education (Q2)
1026;144730;Studies in Nonlinear Dynamics and Econometrics;journal;10811826;0.422;Q2;25;18;88;611;58;87;0.72;33.94;Germany;Walter de Gruyter GmbH;2002-ongoing;"Social Sciences (miscellaneous) (Q2); Analysis (Q3); Economics and Econometrics (Q3)"
1027;5000157803;Bilingualism;journal;14691841, 13667289;0.42;Q1;46;20;43;760;45;38;1.18;38.00;United Kingdom;Cambridge University Press;2005-ongoing;"Language and Linguistics (Q1); Linguistics and Language (Q1); Education (Q2)"
1028;5700168400;Feminist Media Studies;journal;14680777;0.42;Q1;31;35;124;1074;56;55;0.28;30.69;United Kingdom;Taylor & Francis;2001-ongoing;"Gender Studies (Q1); Visual Arts and Performing Arts (Q1); Communication (Q2)"
1029;29840;International Social Work;journal;00208728;0.42;Q2;37;69;175;1550;78;159;0.48;22.46;United States;SAGE Publications;1959-ongoing;"Social Sciences (miscellaneous) (Q2); Social Work (Q2); Sociology and Political Science (Q2)"
1030;29613;Health and Social Work;journal;15456854, 03607283;0.419;Q2;49;22;119;627;150;106;1.08;28.50;United States;National Association of Social Workers Press;1976-ongoing;"Health (social science) (Q2); Social Work (Q2)"
1031;14615;Social work & social sciences review;journal;09535225;0.418;Q2;9;13;9;496;2;8;0.25;38.15;United Kingdom;Whiting & Birch Ltd.;1997-1998, 2000, 2005, 2007, 2010-2014;"Health (social science) (Q2); Social Work (Q2); Sociology and Political Science (Q2)"
1032;145221;Educational Assessment;journal;10627197, 15326977;0.417;Q2;22;13;27;328;17;27;0.63;25.23;United States;Lawrence Erlbaum Associates Inc.;1993-1995, 2005-ongoing;Education (Q2)
1033;145544;Journal of Semantics;journal;01675133;0.417;Q2;32;13;40;456;29;38;0.78;35.08;United Kingdom;Oxford University Press;1982, 1984-1986, 1990-1995, 2005-ongoing;"Arts and Humanities (miscellaneous) (Q2); Linguistics and Language (Q2); Artificial Intelligence (Q3)"
1034;25322;Bulletin of Latin American Research;journal;14709856, 02613050;0.416;Q2;29;27;76;1163;39;72;0.34;43.07;United Kingdom;Blackwell Publishing Inc.;1982-ongoing;"Development (Q2); Geography, Planning and Development (Q2)"
1035;12891;Color Research and Application;journal;15206378, 03612317;0.416;Q3;56;51;158;942;147;143;0.77;18.47;United States;John Wiley & Sons Inc.;1976-ongoing;"Chemical Engineering (miscellaneous) (Q2); Chemistry (miscellaneous) (Q2); Human Factors and Ergonomics (Q3)"
1036;27938;Review of African Political Economy;journal;03056244;0.416;Q2;41;32;175;933;89;151;0.53;29.16;United Kingdom;Carfax Publishing Ltd.;1974-ongoing;"Development (Q2); Geography, Planning and Development (Q2); Political Science and International Relations (Q2)"
1037;15626;International Journal of Law and Psychiatry;journal;01602527;0.415;Q1;58;38;139;1225;143;137;1.1;32.24;United Kingdom;Elsevier Ltd.;1978-1984, 1986-ongoing;"Law (Q1); Psychiatry and Mental Health (Q2); Pathology and Forensic Medicine (Q3)"
1038;28107;Administration in Social Work;journal;03643107;0.414;Q2;32;31;74;1001;46;63;0.63;32.29;United States;Haworth Press Inc.;1977-1986, 1988-2013;"Health (social science) (Q2); Public Administration (Q2); Social Work (Q2)"
1039;5800207716;Gesture;journal;15699773, 15681475;0.414;Q1;31;13;37;444;28;36;0.6;34.15;Netherlands;John Benjamins Publishing Company;2008-ongoing;"Cultural Studies (Q1); Communication (Q2); Linguistics and Language (Q2); Experimental and Cognitive Psychology (Q3)"
1040;30004;Health information and libraries journal;journal;14711842, 14711834;0.413;Q2;34;50;175;1160;149;164;0.88;23.20;United Kingdom;Blackwell Publishing Inc.;2001-ongoing;"Library and Information Sciences (Q2); Health Informatics (Q3); Health Information Management (Q3)"
1041;40064;Medicine, Science and the Law;journal;00258024;0.413;Q1;30;55;171;926;96;165;0.52;16.84;United Kingdom;SAGE Publications Inc.;1960-ongoing;"Law (Q1); Health Policy (Q2); Issues, Ethics and Legal Aspects (Q2)"
1042;24150;International Journal of Middle East Studies;journal;14716380, 00207438;0.412;Q2;37;56;72;2756;42;64;0.73;49.21;United Kingdom;Cambridge University Press;1970-ongoing;"History (Q1); Geography, Planning and Development (Q2); Sociology and Political Science (Q2)"
1043;144821;Language Policy;journal;15731863, 15684555;0.412;Q2;28;9;48;368;23;42;0.57;40.89;Netherlands;Kluwer Academic Publishers;2004-ongoing;"Language and Linguistics (Q1); Linguistics and Language (Q2); Sociology and Political Science (Q2)"
1044;29442;Quest;journal;15432750, 00336297;0.412;Q2;45;33;81;1021;70;81;0.96;30.94;United Kingdom;Taylor & Francis;1963-ongoing;"Education (Q2); Sports Science (Q3)"
1045;14979;ACME;journal;14929732;0.411;Q2;31;21;34;793;22;30;0.76;37.76;Canada;Okanagan University College;2002-2004, 2006-ongoing;Geography, Planning and Development (Q2)
1046;144960;Education and Training;journal;00400912;0.411;Q2;56;65;177;1466;130;176;0.73;22.55;United Kingdom;Emerald Group Publishing Ltd.;2005-ongoing;"Business, Management and Accounting (miscellaneous) (Q1); Education (Q2); Life-span and Life-course Studies (Q2)"
1047;19951;International Journal of Conflict Management;journal;10444068;0.411;Q2;47;17;55;1262;34;54;0.36;74.24;United Kingdom;Emerald Group Publishing Ltd.;1996-ongoing;"Communication (Q2); Management of Technology and Innovation (Q2); Strategy and Management (Q2)"
1048;27025;Orbis;journal;00304387, 18735282;0.411;Q2;23;50;144;0;66;135;0.58;0.00;Netherlands;Elsevier BV;1986, 1989, 1993-ongoing;"Safety Research (Q2); Safety, Risk, Reliability and Quality (Q2); Sociology and Political Science (Q2)"
1049;40309;Population;journal;00324663;0.411;Q2;27;29;70;773;35;68;0.37;26.66;France;Institut National D Etudes Demographiques;1973-ongoing;Demography (Q2)
1050;26619;Symbolic Interaction;journal;01956086;0.411;Q2;42;26;68;1269;65;67;0.71;48.81;United States;Wiley-Blackwell;1977-ongoing;"Nursing (miscellaneous) (Q1); Communication (Q2); Education (Q2); Social Sciences (miscellaneous) (Q2); Sociology and Political Science (Q2); Social Psychology (Q3)"
1051;100147301;CESifo Economic Studies;journal;1610241X;0.41;Q2;24;21;53;842;47;52;0.9;40.10;United Kingdom;Oxford University Press;2005-ongoing;"Geography, Planning and Development (Q2); Economics and Econometrics (Q3)"
1052;29268;Community Development Journal;journal;00103802, 14682656;0.41;Q2;37;34;113;831;85;102;0.7;24.44;United Kingdom;Oxford University Press;1966-ongoing;Development (Q2)
1053;15726;Kolner Zeitschrift fr Soziologie und Sozialpsychologie;journal;00232653;0.41;Q2;30;30;101;1762;44;99;0.46;58.73;Germany;V S - Verlag fur Sozialwissenschaften;1983, 1988-1989, 1992-1993, 1996-ongoing;"Sociology and Political Science (Q2); Social Psychology (Q3)"
1054;22773;Policy Sciences;journal;00322687, 15730891;0.409;Q2;49;15;52;1119;39;49;0.81;74.60;Netherlands;Kluwer Academic Publishers;1970-ongoing;"Development (Q2); Management, Monitoring, Policy and Law (Q2); Public Administration (Q2); Social Sciences (miscellaneous) (Q2); Sociology and Political Science (Q2)"
1055;28066;Acta Geographica Sinica;journal;03755444;0.408;Q2;48;121;340;3419;310;340;0.86;28.26;China;Science Press;1978-ongoing;"Earth and Planetary Sciences (miscellaneous) (Q2); Geography, Planning and Development (Q2)"
