Rank;Sourceid;Title;Type;Issn;SJR;SJR Best Quartile;H index;Total Docs. (2016);Total Docs. (3years);Total Refs.;Total Cites (3years);Citable Docs. (3years);Cites / Doc. (2years);Ref. / Doc.;Country;Region;Publisher;Coverage;Categories
1272;17500155122;International Journal of Integrative Biology (discontinued);journal;09738363, 09742816;0.123;Q4;24;3;26;159;11;22;0.08;53;India;Asiatic Region;Omics Publishing Group;2008-2017;"Agricultural and Biological Sciences (miscellaneous) (Q4); Biochemistry, Genetics and Molecular Biology (miscellaneous) (Q4); Earth and Planetary Sciences (miscellaneous) (Q4); Environmental Science (miscellaneous) (Q4); Neuroscience (miscellaneous) (Q4)"
1273;21100844181;International Journal of Tourism Cities;journal;20565615, 20565607;0.123;-;16;20;21;1301;9;21;0.43;65.05;United Kingdom;Western Europe;Emerald Group Publishing Ltd.;2015-2021;Tourism, Leisure and Hospitality Management (Q4)
1274;21100777397;International Workshop on Integrated Nonlinear Microwave and Millimetre-Wave Circuits, INMMiC 2014;conference and proceedings;-;0.123;-;0;0;1;0;0;1;0;0;United States;Northern America;;;Ecological Modeling
1275;21100435520;Legal Studies on Access and Benefit-sharing;book series;2213493X;0.123;Q4;4;0;18;0;7;1;0;0;Netherlands;Western Europe;Brill Academic Publishers;2013;"Law (Q4); Management, Monitoring, Policy and Law (Q4)"
1276;21100812600;Proceedings - 12th IEEE International Conference on E-Business Engineering, ICEBE 2015;conference and proceedings;-;0.123;-;1;0;1;0;0;1;0;0;United States;Northern America;;;"Energy (miscellaneous); Engineering (miscellaneous); Environmental Science (miscellaneous)"
1277;21100780337;Proceedings of the 16th Electronics Packaging Technology Conference, EPTC 2014;conference and proceedings;-;0.123;-;1;0;1;0;0;1;0;0;United States;Northern America;;;"Environmental Engineering; Geography, Planning and Development; Nature and Landscape Conservation"
1278;21100795203;Proceedings of the 2015 18th AISEM Annual Conference, AISEM 2015;conference and proceedings;-;0.123;-;1;0;1;0;1;1;1;0;United States;Northern America;;;"Artificial Intelligence; Civil and Structural Engineering; Computer Science Applications; Environmental Engineering"
1279;27465;Annales - Universitatis Mariae Curie-Sklodowska, Sectio B;journal;01371983;0.122;Q4;8;25;51;692;14;51;0.26;27.68;Poland;Eastern Europe;De Gruyter Open Ltd.;1975, 1977, 1979-1980, 1982, 1986, 1991, 1994-2000, 2002-2021;"Earth and Planetary Sciences (miscellaneous) (Q4); Water Science and Technology (Q4)"
1280;21100432349;Change Over Time;journal;2153053X, 21530548;0.122;Q4;7;15;56;569;14;53;0.3;37.93;United States;Northern America;University of Pennsylvania Press;2011-2020;"Conservation (Q3); History (Q3); Urban Studies (Q3); Nature and Landscape Conservation (Q4)"
1281;23267;International Journal of Environmental Technology and Management;journal;1741511X, 14662132;0.122;Q4;23;22;105;1132;29;102;0.31;51.45;United Kingdom;Western Europe;Inderscience Enterprises Ltd.;2001-2021;"Environmental Engineering (Q4); Management, Monitoring, Policy and Law (Q4)"
1282;21100775037;Proceedings of ISAV 2015: 1st International Workshop on In Situ Infrastructures for Enabling Extreme-Scale Analysis and Visualization, Held in conjunction with SC 2015: The International Conference for High Performance Computing, Networking, Storage and Analysis;conference and proceedings;-;0.122;-;5;0;8;0;13;8;1.63;0;United States;Northern America;;;Environmental Science (miscellaneous)
1283;21100229199;Transboundary Water Management in a Changing Climate - Proceedings of the AMICE Final Conference;conference and proceedings;-;0.122;-;1;0;9;0;0;7;0;0;Netherlands;Western Europe;;;Water Science and Technology
1284;12000154521;Developments in Earth Surface Processes;book series;09282025;0.121;Q4;25;35;87;2302;18;4;0.2;65.77;Netherlands;Western Europe;Elsevier;1996-1998, 2005-2007, 2009, 2011, 2013-2017, 2020;"Atmospheric Science (Q4); Earth-Surface Processes (Q4); Geology (Q4); Global and Planetary Change (Q4)"
1285;21100448511;Proceedings of NDM 2015: 5th International Workshop on Network-Aware Data Management - Held in conjunction with SC 2015: The International Conference for High Performance Computing, Networking, Storage and Analysis;conference and proceedings;-;0.121;-;3;0;7;0;6;5;0.86;0;United States;Northern America;;;"Computer Science Applications; Ocean Engineering; Water Science and Technology"
1286;19400157034;West African Journal of Applied Ecology;journal;08554307;0.121;Q4;13;11;36;335;15;36;0.43;30.45;Ghana;Africa;Ecological Laboratory, University of Ghana;2009-2021;"Ecology (Q4); Ecology, Evolution, Behavior and Systematics (Q4)"
1287;21100420307;2015 IEEE 35th International Conference on Electronics and Nanotechnology, ELNANO 2015 - Conference Proceedings;conference and proceedings;-;0.12;-;7;0;123;0;46;122;0.37;0;United States;Northern America;;;"Nuclear Energy and Engineering; Radiation; Waste Management and Disposal"
1288;21100463822;23rd Italian Symposium on Advanced Database Systems, SEBD 2015;conference and proceedings;-;0.12;-;3;0;45;0;8;43;0.18;0;Italy;Western Europe;;;"Environmental Engineering; Geochemistry and Petrology; Geotechnical Engineering and Engineering Geology; Mechanical Engineering"
1289;21100258751;International Journal of Social Sustainability in Economic, Social and Cultural Context;journal;2325114X, 23251115;0.12;Q4;4;20;92;838;12;92;0.11;41.9;United States;Northern America;Common Ground Research Networks;2013-2021;"Environmental Science (miscellaneous) (Q4); Geography, Planning and Development (Q4); Sociology and Political Science (Q4)"
1290;21100398405;Proceedings of the 15th International Conference of the European Society for Precision Engineering and Nanotechnology, EUSPEN 2015;conference and proceedings;-;0.12;-;5;0;191;0;45;189;0.24;0;Germany;Western Europe;;;"Environmental Engineering; Industrial and Manufacturing Engineering; Instrumentation; Materials Science (miscellaneous); Mechanical Engineering"
1291;23033;Proceedings of the Royal Society of Victoria;journal;00359211;0.12;Q4;21;11;39;665;4;34;0.1;60.45;Australia;Pacific Region;Royal Society of Victoria;1980-2011, 2014-2018, 2020-2021;"Ecology (Q4); Geology (Q4)"
1292;21100420305;15th International High-Level Radioactive Waste Management Conference 2015, IHLRWM 2015;conference and proceedings;-;0.119;-;5;0;134;0;11;132;0.08;0;United States;Northern America;;;"Computer Networks and Communications; Information Systems"
1293;21100355989;International Conference on Marine and Freshwater Environments, iMFE 2014;conference and proceedings;-;0.119;-;3;0;48;0;10;47;0.21;0;Canada;Northern America;;;"Ocean Engineering; Pollution; Water Science and Technology"
1294;21100207622;International Journal of Social Ecology and Sustainable Development;journal;19478410, 19478402;0.119;Q4;11;15;75;854;15;75;0.2;56.93;United States;Northern America;IGI Global Publishing;2010-2022;"Development (Q4); Ecology (Q4); Environmental Engineering (Q4); Management, Monitoring, Policy and Law (Q4)"
1295;21100246540;International Journal of Technology Management and Sustainable Development;journal;14742748, 20400551;0.119;Q4;9;16;46;597;12;44;0.3;37.31;United Kingdom;Western Europe;Intellect Ltd.;2013-2020;"Geography, Planning and Development (Q4); Management, Monitoring, Policy and Law (Q4); Management of Technology and Innovation (Q4)"
1296;21100358101;2014 International Conference on Lightning Protection, ICLP 2014;conference and proceedings;-;0.118;-;11;0;372;0;208;369;0.56;0;United States;Northern America;;;Environmental Engineering
1297;21100199515;Biopesticides International;journal;0973483X, 09769412;0.118;Q4;8;21;51;678;9;51;0.17;32.29;India;Asiatic Region;Connect Journals;2011-2021;"Agronomy and Crop Science (Q4); Management, Monitoring, Policy and Law (Q4); Plant Science (Q4)"
1298;24706;Park Science;journal;10909966, 07359462;0.118;Q4;12;0;75;0;11;68;0.07;0;United States;Northern America;National Park Service;1996-2006, 2008-2015;"Management, Monitoring, Policy and Law (Q4); Nature and Landscape Conservation (Q4)"
1299;93698;Proceedings of the International Conference on Radioactive Waste Management and Environmental Remediation, ICEM;conference and proceedings;-;0.118;-;8;0;193;0;20;191;0;0;United States;Northern America;The American Society of Mechanical Engineers(ASME);1995, 2001-2003, 2009-2011, 2013;"Energy Engineering and Power Technology; Safety, Risk, Reliability and Quality; Waste Management and Disposal"
1300;4700153106;Field Mycology;journal;14681641;0.117;Q4;7;38;115;215;7;99;0.05;5.66;Netherlands;Western Europe;Elsevier BV;2006-2021;"Ecology (Q4); Plant Science (Q4)"
1301;21100378863;Indoor Air 2014 - 13th International Conference on Indoor Air Quality and Climate;conference and proceedings;-;0.117;-;6;0;967;0;63;965;0.07;0;United States;Northern America;;;"Building and Construction; Computer Science Applications; Health, Toxicology and Mutagenesis; Pollution"
1302;21100372696;International Low Impact Development Conference 2015 - LID: It Works in All Climates and Soils - Proceedings of the 2015 International Low Impact Development Conference;conference and proceedings;-;0.117;-;4;0;46;0;7;44;0.15;0;United States;Northern America;;;"Civil and Structural Engineering; Water Science and Technology"
1303;145497;Journal of Environmental Science and Engineering;journal;0367827X;0.117;Q4;18;32;156;840;17;156;0.1;26.25;India;Asiatic Region;National Environmental Engineering Research Inst.;2004-2016;"Environmental Science (miscellaneous) (Q4); Medicine (miscellaneous) (Q4)"
1304;21100384024;Proceedings of 2015 12th International Bhurban Conference on Applied Sciences and Technology, IBCAST 2015;conference and proceedings;-;0.117;-;9;0;110;0;56;108;0.51;0;United States;Northern America;;;"Computer Science (miscellaneous); Fluid Flow and Transfer Processes; Materials Science (miscellaneous); Water Science and Technology"
1305;21100406320;Proceedings of the 2014 ACM Southeast Regional Conference, ACM SE 2014;conference and proceedings;-;0.117;-;6;0;65;0;15;64;0.23;0;United States;Northern America;;;"Environmental Engineering; Industrial and Manufacturing Engineering; Instrumentation; Materials Science (miscellaneous); Mechanical Engineering"
1306;21100291830;Selenium in the Environment and Human Health - Proceedings of the 3rd International Conference on Selenium in the Environment and Human Health;conference and proceedings;-;0.117;-;5;0;92;0;18;90;0.2;0;Netherlands;Western Europe;;;"Health, Toxicology and Mutagenesis; Toxicology"
1307;21100345809;2014 The 3rd International Conference on Agro-Geoinformatics, Agro-Geoinformatics 2014;conference and proceedings;-;0.116;-;6;0;115;0;26;114;0.23;0;United States;Northern America;;;"Agronomy and Crop Science; Civil and Structural Engineering; Geography, Planning and Development; Information Systems; Pollution"
1308;21100268070;Air and Waste Management Association - Guideline on Air Quality Models 2013: The Path Forward;conference and proceedings;-;0.116;-;4;0;63;0;12;61;0;0;United States;Northern America;;;Pollution
1309;25709;BioCycle;trade journal;02765055;0.116;Q4;19;99;303;79;14;303;0.06;0.8;United States;Northern America;JG Press Inc.;1981-2019;"Soil Science (Q4); Waste Management and Disposal (Q4)"
1310;24816;Bolleti de la Societat d'Historia Natural de les Balears;journal;0212260X;0.116;Q4;9;0;24;0;3;24;0.13;0;Spain;Western Europe;Societat d'Historia Natural de les Balears;1992-1996, 2000-2012, 2014-2015;"Ecology (Q4); Geology (Q4)"
1311;14598;Ecology, Environment and Conservation (discontinued);journal;0971765X;0.116;Q4;17;472;828;7798;53;827;0.06;16.52;India;Asiatic Region;EM International;1997-2021;"Ecology (Q4); Ecology, Evolution, Behavior and Systematics (Q4); Nature and Landscape Conservation (Q4)"
1312;28195;GIM International (discontinued);trade journal;15669076;0.116;Q4;12;79;164;46;14;164;0.06;0.58;Netherlands;Western Europe;GITC B.V.;2001-2018;"Earth and Planetary Sciences (miscellaneous) (Q4); Engineering (miscellaneous) (Q4); Environmental Science (miscellaneous) (Q4)"
1313;22688;Indian Journal of Environmental Protection;journal;02537141;0.116;Q4;20;115;254;2259;7;242;0.02;19.64;India;Asiatic Region;Kalpana Corporation;1981-1990, 2000-2021;Environmental Science (miscellaneous) (Q4)
1314;19700188314;Pertanika Journal of Science and Technology;journal;01287680;0.116;Q4;19;38;132;1029;32;129;0.14;27.08;Malaysia;Asiatic Region;Universiti Putra Malaysia;2010-2021;"Agricultural and Biological Sciences (miscellaneous) (Q4); Chemical Engineering (miscellaneous) (Q4); Computer Science (miscellaneous) (Q4); Environmental Science (miscellaneous) (Q4)"
1315;21100448230;Regions and Cohesion;journal;2152906X, 21529078;0.116;Q4;6;18;36;627;7;32;0.19;34.83;United States;Northern America;Berghahn Journals;2014-2021;"Geography, Planning and Development (Q4); Global and Planetary Change (Q4); Political Science and International Relations (Q4)"
1316;6500153138;Studies in the History of Gardens and Designed Landscapes;journal;14601176;0.116;Q4;9;25;72;1002;17;72;0.29;40.08;United Kingdom;Western Europe;Taylor and Francis Ltd.;1996-2021;"Visual Arts and Performing Arts (Q2); Nature and Landscape Conservation (Q4)"
1317;18216;Ultrapure Water;trade journal;07478291;0.116;Q4;10;0;52;0;7;52;0.15;0;United States;Northern America;Tall Oaks Publishing Inc.;1989-2015;"Fluid Flow and Transfer Processes (Q4); Water Science and Technology (Q4)"
1318;18755;Water and Energy International;journal;0972057X;0.116;Q4;9;109;142;686;5;76;0.07;6.29;India;Asiatic Region;Central Board of Irrigation and Power;1995-2019;"Renewable Energy, Sustainability and the Environment (Q4); Water Science and Technology (Q4)"
1319;21100450031;2015 IEEE 21st International Symposium for Design and Technology in Electronic Packaging, SIITME 2015;conference and proceedings;-;0.115;-;7;0;78;0;27;75;0.35;0;United States;Northern America;;;"Energy Engineering and Power Technology; Environmental Engineering; Renewable Energy, Sustainability and the Environment"
1320;18418;Archives of Hydroengineering and Environmental Mechanics;journal;12313726;0.115;Q4;13;17;28;305;6;27;0.17;17.94;Poland;Eastern Europe;De Gruyter Open Ltd.;1994-2010, 2012-2020;"Civil and Structural Engineering (Q4); Water Science and Technology (Q4)"
1321;20000195021;Ecology and Civil Engineering;journal;18825974, 13443755;0.115;Q4;9;23;40;379;7;37;0.14;16.48;Japan;Asiatic Region;Ecology and Civil Engineering Society;1998-2021;"Civil and Structural Engineering (Q4); Ecology (Q4)"
1322;21100349552;Proceedings of the 37th AMOP Technical Seminar on Environmental Contamination and Response;conference and proceedings;-;0.115;-;6;0;66;0;19;62;0.29;0;Canada;Northern America;;;"Environmental Engineering; Pollution; Waste Management and Disposal"
1323;21100421981;2015 4th IEEE International Conference on Advanced Logistics and Transport, IEEE ICALT 2015;conference and proceedings;-;0.114;-;8;0;60;0;17;58;0.28;0;United States;Northern America;;;"Business and International Management; Management, Monitoring, Policy and Law; Management of Technology and Innovation"
1324;28756;Geographische Rundschau;journal;00167460;0.114;Q4;13;0;101;0;10;101;0;0;Germany;Western Europe;Westermann Schulbuchverlag GmbH;1975, 1977-2014, 2018-2021;"Atmospheric Science (Q4); Energy (miscellaneous) (Q4); Geography, Planning and Development (Q4); Water Science and Technology (Q4)"
1325;18700156711;International Journal of Energy, Environment and Economics;journal;1054853X;0.114;Q4;8;25;77;563;5;76;0.05;22.52;United States;Northern America;Nova Science Publishers, Inc.;2007, 2009-2020;"Economics, Econometrics and Finance (miscellaneous) (Q4); Energy (miscellaneous) (Q4); Environmental Science (miscellaneous) (Q4)"
1326;21100344980;Recent Advances in Environmental Vibration - Proceedings of 6th International Symposium on Environmental Vibration, ISEV 2013;conference and proceedings;-;0.114;-;3;0;65;0;6;64;0;0;China;Asiatic Region;;;"Environmental Engineering; Management, Monitoring, Policy and Law; Mechanics of Materials; Safety, Risk, Reliability and Quality"
1327;16920;Gas Wasserfach Wasser Abwasser;journal;00163651;0.113;Q4;11;189;295;852;7;262;0.02;4.51;Germany;Western Europe;R. Oldenbourg;1970-2013, 2015-2018;Water Science and Technology (Q4)
1328;21100332447;Hydroecologie Appliquee;journal;1958556X, 11479213;0.113;Q4;10;16;8;614;2;8;0.25;38.38;France;Western Europe;EDP Sciences;2010, 2014, 2016-2018, 2021;"Aquatic Science (Q4); Ecology (Q4); Ecology, Evolution, Behavior and Systematics (Q4); Water Science and Technology (Q4)"
1329;21100446005;International Conference on Electrical, Electronics, Signals, Communication and Optimization, EESCO 2015;conference and proceedings;-;0.113;-;11;0;446;0;187;444;0.42;0;United States;Northern America;;;"Building and Construction; Civil and Structural Engineering; Earth and Planetary Sciences (miscellaneous); Environmental Engineering; Materials Science (miscellaneous); Safety, Risk, Reliability and Quality"
1330;21100237616;Papers on Global Change IGBP;journal;1730802X;0.113;Q4;4;15;27;174;5;26;0.13;11.6;Poland;Eastern Europe;De Gruyter Open Ltd.;2012-2018;"Ecology (Q4); Geology (Q4); Geophysics (Q4); Global and Planetary Change (Q4)"
1331;57806;Socijalna Ekologija;journal;13300113;0.113;Q4;10;22;20;933;3;20;0.14;42.41;Croatia;Eastern Europe;Hrvatsko Sociolosko Drustvo/Croatian Sociological Association;1994-2021;"Geography, Planning and Development (Q4); Management, Monitoring, Policy and Law (Q4)"
1332;13162;Terra;journal;00403741;0.113;Q4;8;0;54;0;2;34;0.04;0;Finland;Western Europe;Geographical Society of Finland;1978-2015, 2017-2021;"Agricultural and Biological Sciences (miscellaneous) (Q4); Earth and Planetary Sciences (miscellaneous) (Q4); Geography, Planning and Development (Q4); Water Science and Technology (Q4)"
1333;21100495938;Geotechnical Engineering for Infrastructure and Development - Proceedings of the XVI European Conference on Soil Mechanics and Geotechnical Engineering, ECSMGE 2015;conference and proceedings;-;0.112;-;7;0;120;0;45;117;0.38;0;United Kingdom;Western Europe;;;"Earth and Planetary Sciences (miscellaneous); Environmental Science (miscellaneous); Soil Science"
1334;21100346457;IEEE Proceedings of the INternational Conference On Emerging Trends in Science Engineering and Technology: Recent Advancements on Science and Engineering Innovation, INCOSET 2012;conference and proceedings;-;0.112;-;7;0;93;0;29;91;0.31;0;United States;Northern America;;;"Computer Science (miscellaneous); Engineering (miscellaneous); Environmental Engineering; Management of Technology and Innovation"
1335;5100152918;Jeoloji Muhendisligi Dergisi;journal;10169172;0.112;Q4;6;12;21;399;4;21;0.08;33.25;Turkey;Middle East;TMMOB - Jeoloji Muhendisleri Odasi;2005-2021;"Earth and Planetary Sciences (miscellaneous) (Q4); Environmental Science (miscellaneous) (Q4)"
1336;21100248871;Proceedings of the 36th AMOP Technical Seminar on Environmental Contamination and Response;conference and proceedings;-;0.112;-;4;0;64;0;14;62;0;0;Canada;Northern America;;;"Environmental Engineering; Pollution; Waste Management and Disposal"
1337;9500154150;Progress in Agricultural Engineering Sciences;journal;1786335X;0.112;Q4;8;5;13;206;2;13;0.1;41.2;Hungary;Eastern Europe;Akademiai Kiado;2007-2009, 2011-2020;"Industrial and Manufacturing Engineering (Q3); Environmental Engineering (Q4); Mechanical Engineering (Q4)"
1338;25880;Techniques - Sciences - Methodes;journal;02997258;0.112;Q4;10;6;154;121;5;135;0.04;20.17;France;Western Europe;Assoc. Generale des Hygienistes et Techniciens Municipaux;1987-1989, 1991-2021;"Agricultural and Biological Sciences (miscellaneous) (Q4); Fluid Flow and Transfer Processes (Q4); Ocean Engineering (Q4); Water Science and Technology (Q4)"
1339;21100455673;2015 IEEE 2nd VR International Workshop on Collaborative Virtual Environments, 3DCVE 2015;conference and proceedings;-;0.111;-;2;0;4;0;1;2;0.25;0;United States;Northern America;;;"Electrical and Electronic Engineering; Environmental Science (miscellaneous); Radiation"
1340;19700177004;Advances in Environmental Biology;journal;19950756, 19981066;0.111;Q4;24;0;3547;0;432;3547;0.12;0;Jordan;Middle East;American-Eurasian Network for Scientific Information;2009-2015;"Agricultural and Biological Sciences (miscellaneous) (Q4); Environmental Science (miscellaneous) (Q4)"
1341;21100403407;Air and Waste Management Association - 33rd International Conference on Thermal Treatment Technologies and Hazardous Waste Combustors, IT3/HWC 2014;conference and proceedings;-;0.111;-;0;0;3;0;0;2;0;0;United States;Northern America;;;"Information Systems; Information Systems and Management"
1342;21100424406;ASABE 1st Climate Change Symposium: Adaptation and Mitigation;conference and proceedings;-;0.111;-;3;0;68;0;2;67;0.03;0;United States;Northern America;;;Information Systems
1343;19632;Asian Journal of Microbiology, Biotechnology and Environmental Sciences (discontinued);journal;09723005;0.111;Q4;16;157;438;3781;34;438;0.07;24.08;India;Asiatic Region;Global Publications;2001-2018;"Applied Microbiology and Biotechnology (Q4); Biotechnology (Q4); Environmental Science (miscellaneous) (Q4); Microbiology (Q4)"
1344;21100345620;CAS-CERN Accelerator School: Superconductivity for Accelerators - Proceedings;conference and proceedings;-;0.111;-;5;0;25;0;3;23;0.12;0;Swaziland;Africa;;;"Atomic and Molecular Physics, and Optics; Computer Science Applications; Condensed Matter Physics; Environmental Engineering; Fuel Technology; Geotechnical Engineering and Engineering Geology; Instrumentation"
1345;21100334853;Engineering Technology and Applications - Proceedings of the 2014 International Conference on Engineering Technology and Applications, ICETA 2014;conference and proceedings;-;0.111;-;1;0;18;0;1;16;0.06;0;Netherlands;Western Europe;;;Environmental Engineering
1346;21100244922;Environmental Engineering IV - Proceedings of the Conference on Environmental Engineering IV;conference and proceedings;-;0.111;-;5;0;58;0;8;56;0;0;Netherlands;Western Europe;;;Environmental Engineering
1347;21002;Environmental Health Criteria;book series;0250863X;0.111;Q4;12;0;3;0;0;2;0;0;Switzerland;Western Europe;World Health Organization;1978, 1981-2003, 2005-2007, 2009, 2011, 2013;Health, Toxicology and Mutagenesis (Q4)
1348;21100205957;E-Water;trade journal;19948549;0.111;Q4;2;0;2;0;1;2;0.5;0;Germany;Western Europe;;;"Pollution (Q4); Waste Management and Disposal (Q4)"
1349;22946;Forest Research;journal;10011498;0.111;Q4;16;140;421;2022;61;421;0.15;14.44;China;Asiatic Region;Chinese Academy of Forestry;1988-2021;"Ecology (Q4); Forestry (Q4); Plant Science (Q4)"
1350;5200152706;International Journal of Regulation and Governance;journal;09724907;0.111;Q4;7;0;2;0;0;2;0;0;India;Asiatic Region;Teri Press;2001-2013;Waste Management and Disposal (Q4)
1351;17509;Journal Europeen d'Hydrologie;journal;10236368;0.111;Q4;8;0;2;0;0;2;0;0;France;Western Europe;Assoc. Scient. Europeenne pour l'Eau et la Sante;2002-2013;"Pollution (Q4); Water Science and Technology (Q4)"
1352;21100228743;Journal of the Bombay Natural History Society;journal;00066982;0.111;Q4;7;22;199;180;2;80;0;8.18;India;Asiatic Region;Bombay Natural History Society;1981, 1984, 1990-1993, 2011-2020;"Ecology (Q4); Management, Monitoring, Policy and Law (Q4); Nature and Landscape Conservation (Q4)"
1353;5000153106;Plant Protection Quarterly;journal;08152195;0.111;Q4;17;0;11;0;1;10;0;0;Australia;Pacific Region;Plant Protection Quarterly;2006-2013;"Agronomy and Crop Science (Q4); Horticulture (Q4); Management, Monitoring, Policy and Law (Q4); Nature and Landscape Conservation (Q4)"
1354;21100395914;Proceedings - International Conference on Technologies for Sustainable Development, ICTSD 2015;conference and proceedings;-;0.111;-;8;0;86;0;28;85;0.33;0;United States;Northern America;;;"Management, Monitoring, Policy and Law; Renewable Energy, Sustainability and the Environment"
1355;21100322092;Proceedings of the 26th International Conference on Efficiency, Cost, Optimization, Simulation and Environmental Impact of Energy Systems, ECOS 2013;conference and proceedings;-;0.111;-;5;0;329;0;23;328;0;0;China;Asiatic Region;;;"Energy (miscellaneous); Environmental Science (miscellaneous)"
1356;21100375387;Shallow Anomalies Workshop: Indications of Prospective Petroleum Systems?;conference and proceedings;-;0.111;-;3;0;13;0;4;11;0.31;0;Netherlands;Western Europe;;;"Geophysics; Pollution"
1357;23886;Telma (discontinued);journal;03404927;0.111;Q4;8;0;35;0;4;32;0.09;0;Germany;Western Europe;Deutsche Gesellschaft fur Moor- und Torfkunde e.V.;1977-1978, 1982-2015;"Ecology (Q4); Ecology, Evolution, Behavior and Systematics (Q4)"
1358;31610;Working Paper of the University of Leeds, School of Geography;journal;-;0.111;Q4;4;0;2;0;0;2;0;0;United Kingdom;Western Europe;;1984-2003, 2005-2013, 2015;"Earth and Planetary Sciences (miscellaneous) (Q4); Geography, Planning and Development (Q4); Water Science and Technology (Q4)"
1359;21100301431;BHR Group - 15th International Symposium on Aerodynamics, Ventilation and Fire in Tunnels 2013;conference and proceedings;-;0.11;-;3;0;58;0;5;56;0;0;United Kingdom;Western Europe;;;Management, Monitoring, Policy and Law
1360;21100286449;Civil-Comp Proceedings;journal;17593433;0.11;Q4;13;331;1527;4711;85;1523;0.06;14.23;United Kingdom;Western Europe;Civil-Comp Press;2003, 2005-2017;"Artificial Intelligence (Q4); Civil and Structural Engineering (Q4); Computational Theory and Mathematics (Q4); Environmental Engineering (Q4)"
1361;21100456654;Geotechnical Engineering for Infrastructure and Development - Proceedings of the XVI European Conference on Soil Mechanics and Geotechnical Engineering, ECSMGE 2015;conference and proceedings;-;0.11;-;6;0;334;0;47;331;0.14;0;United Kingdom;Western Europe;;;"Computer Vision and Pattern Recognition; Linguistics and Language; Otorhinolaryngology; Software; Speech and Hearing"
