Rank;Sourceid;Title;Type;Issn;SJR;SJR Best Quartile;H index;Total Docs. (2017);Total Docs. (3years);Total Refs.;Total Cites (3years);Citable Docs. (3years);Cites / Doc. (2years);Ref. / Doc.;Country;Region;Publisher;Coverage;Categories
1354;21100786315;Australasian Journal of Regional Studies;journal;10307923;0.118;Q4;6;21;23;919;11;21;0.48;43.76;Australia;Pacific Region;Australia and New Zealand Regional Science Association International Inc. (ANZRSAI);2016-2020;"Economics, Econometrics and Finance (miscellaneous) (Q4); Geography, Planning and Development (Q4); Management, Monitoring, Policy and Law (Q4); Urban Studies (Q4)"
1355;23272;Developments in Environmental Modelling;book series;01678892;0.118;Q4;11;35;53;722;7;15;0.11;20.63;Netherlands;Western Europe;Elsevier;1984, 1987-1988, 1990, 1998, 2001-2002, 2011-2012, 2014-2017, 2019;Ecological Modeling (Q4)
1356;20000195091;Ecotropica;journal;09493026;0.118;Q4;11;0;8;0;3;8;0;0;Germany;Western Europe;;2010-2014;"Ecology (Q4); Ecology, Evolution, Behavior and Systematics (Q4)"
1357;5100155100;Japanese Journal of Conservation Ecology;journal;13424327;0.118;Q4;8;0;44;0;6;42;0.13;0;Japan;Asiatic Region;Ecological Society of Japan;2006-2011, 2013-2014, 2016;Nature and Landscape Conservation (Q4)
1358;21100268407;Revista de Gestao Social e Ambiental;journal;1981982X;0.118;Q4;6;29;62;1204;8;59;0.13;41.52;Brazil;Latin America;Associacao Nacional de Pos-Graduacao e Pesquisa em Administracao;2013-2020;"Geography, Planning and Development (Q4); Management, Monitoring, Policy and Law (Q4)"
1359;21100334907;Sustainable Watershed Management - Proceedings of the 2nd International Conference on Sustainable Watershed Management, SUWAMA 2014;conference and proceedings;-;0.118;-;1;0;15;0;2;13;0;0;Netherlands;Western Europe;;;Water Science and Technology
1360;51442;CONCAWE Reports;journal;01660810;0.117;Q4;5;13;33;852;3;33;0.1;65.54;Belgium;Western Europe;Oil Companies European Organisation for Environmental and Health Protection;1999-2019;"Energy (miscellaneous) (Q4); Environmental Science (miscellaneous) (Q4); Process Chemistry and Technology (Q4); Safety, Risk, Reliability and Quality (Q4)"
1361;29518;Japanese Journal of Limnology;journal;00215104;0.117;Q4;15;27;45;331;6;29;0.08;12.26;Japan;Asiatic Region;Japanese Society of Limnology;1931, 1934-1944, 1949-1950, 1952, 1955-2014, 2016-2020;"Aquatic Science (Q4); Ecology (Q4); Water Science and Technology (Q4)"
1362;23413;Journal of Industrial Pollution Control (discontinued);journal;09702083;0.117;Q4;15;141;140;2205;15;140;0.09;15.64;India;Asiatic Region;Enviro Media;1996-2017;"Atmospheric Science (Q4); Fluid Flow and Transfer Processes (Q4); Ocean Engineering (Q4); Pollution (Q4); Water Science and Technology (Q4)"
1363;17700156707;Landscape Journal;journal;02772426, 15532704;0.117;Q4;12;13;42;654;9;36;0.06;50.31;United States;Northern America;University of Wisconsin Press;2009-2019, 2021;Nature and Landscape Conservation (Q4)
1364;29215;Transactions of the Institute of Indian Geographers;journal;09709851;0.117;Q4;6;23;67;458;10;67;0.06;19.91;India;Asiatic Region;Institute of Indian Geographers;1980-2021;"Geography, Planning and Development (Q4); Ocean Engineering (Q4); Water Science and Technology (Q4)"
1365;21100463821;1st EAGE Eastern Africa Petroleum Geoscience Forum - Sharing Lessons Learned: What's Next?;conference and proceedings;-;0.116;-;1;0;21;0;2;20;0.1;0;Germany;Western Europe;;;Metals and Alloys
1366;21100376179;2014 International Work Conference on Bio-Inspired Intelligence: Intelligent Systems for Biodiversity Conservation, IWOBI 2014 - Proceedings;conference and proceedings;-;0.116;-;4;0;16;0;9;15;0;0;United States;Northern America;;;"Artificial Intelligence; Computer Science Applications; Information Systems; Nature and Landscape Conservation"
1367;21100455469;2015 International Conference on Computer and Computational Sciences, ICCCS 2015;conference and proceedings;-;0.116;-;6;0;56;0;24;54;0.43;0;United States;Northern America;;;"Ecological Modeling; Information Systems and Management"
1368;21100457085;8th International Conference on Humanoid, Nanotechnology, Information Technology, Communication and Control, Environment and Management, HNICEM 2015;conference and proceedings;-;0.116;-;11;0;113;0;99;112;0.88;0;United States;Northern America;;;"Aerospace Engineering; Atomic and Molecular Physics, and Optics; Computer Networks and Communications; Electronic, Optical and Magnetic Materials; Instrumentation"
1369;18418;Archives of Hydroengineering and Environmental Mechanics;journal;12313726;0.116;Q4;13;12;40;235;9;39;0.16;19.58;Poland;Eastern Europe;De Gruyter Open Ltd.;1994-2010, 2012-2020;"Civil and Structural Engineering (Q4); Water Science and Technology (Q4)"
1370;19700170838;International Journal of Rural Management;journal;09730680, 09730052;0.116;Q4;11;11;30;426;6;26;0.23;38.73;India;Asiatic Region;Sage Publications India Pvt. Ltd;2005-2010, 2012-2021;"Geography, Planning and Development (Q4); Management, Monitoring, Policy and Law (Q4); Strategy and Management (Q4)"
1371;21100395914;Proceedings - International Conference on Technologies for Sustainable Development, ICTSD 2015;conference and proceedings;-;0.116;-;8;0;86;0;39;85;0.45;0;United States;Northern America;;;"Management, Monitoring, Policy and Law; Renewable Energy, Sustainability and the Environment"
1372;21100287325;Chinese Journal of Environmental Engineering;journal;16739108;0.115;Q4;12;954;3059;11978;413;3059;0.13;12.56;China;Asiatic Region;Science Press;2013-2021;"Environmental Chemistry (Q4); Environmental Engineering (Q4); Pollution (Q4); Waste Management and Disposal (Q4); Water Science and Technology (Q4)"
1373;21100821159;Climate Change Economics;journal;20100086, 20100078;0.115;Q4;28;22;57;768;57;56;0.87;34.91;Singapore;Asiatic Region;World Scientific Publishing Co. Pte Ltd;2010-2021;"Economics and Econometrics (Q4); Global and Planetary Change (Q4); Management, Monitoring, Policy and Law (Q4)"
1374;21100451292;FAIM 2014 - Proceedings of the 24th International Conference on Flexible Automation and Intelligent Manufacturing: Capturing Competitive Advantage via Advanced Manufacturing and Enterprise Transformation;conference and proceedings;-;0.115;-;4;0;95;0;15;93;0;0;United States;Northern America;;;"Environmental Engineering; Global and Planetary Change; Ocean Engineering"
1375;21100497107;IC3K 2015 - Proceedings of the 7th International Joint Conference on Knowledge Discovery, Knowledge Engineering and Knowledge Management;conference and proceedings;-;0.115;-;2;0;26;0;3;24;0.12;0;United States;Northern America;;;Environmental Engineering
1376;4700151707;International Journal of Low Radiation;journal;17419190, 14776545;0.115;Q4;14;6;38;170;7;38;0.16;28.33;United Kingdom;Western Europe;Inderscience Enterprises Ltd;2004, 2006-2011, 2013-2020;"Health, Toxicology and Mutagenesis (Q4); Public Health, Environmental and Occupational Health (Q4)"
1377;21100332426;Reservoir Sedimentation - Special Session on Reservoir Sedimentation of the 7th International Conference on Fluvial Hydraulics, RIVER FLOW 2014;conference and proceedings;-;0.115;-;4;0;16;0;6;14;0;0;United States;Northern America;;;"Nature and Landscape Conservation; Water Science and Technology"
1378;21100291830;Selenium in the Environment and Human Health - Proceedings of the 3rd International Conference on Selenium in the Environment and Human Health;conference and proceedings;-;0.115;-;5;0;92;0;10;90;0;0;Netherlands;Western Europe;;;"Health, Toxicology and Mutagenesis; Toxicology"
1379;21100220342;Studies in Regional Science;journal;02876256, 18806465;0.115;Q4;11;16;96;158;13;92;0.12;9.88;Japan;Asiatic Region;The Japan Section of the Regional Science Association International;1970-2020;"Environmental Science (miscellaneous) (Q4); Social Sciences (miscellaneous) (Q4)"
1380;21100800605;Sustainable Hydraulics in the Era of Global Change - Proceedings of the 4th European Congress of the International Association of Hydroenvironment engineering and Research, IAHR 2016;conference and proceedings;-;0.115;-;5;0;115;0;12;113;0.1;0;United States;Northern America;;;"Architecture; Civil and Structural Engineering"
1381;21100777176;ACM SIGGRAPH 2016 Emerging Technologies, SIGGRAPH 2016;conference and proceedings;-;0.114;-;7;0;23;0;31;22;1.35;0;United States;Northern America;;;"Management, Monitoring, Policy and Law; Pollution; Water Science and Technology"
1382;19700177004;Advances in Environmental Biology;journal;19950756, 19981066;0.114;Q4;24;0;2936;0;307;2936;0.09;0;Jordan;Middle East;American-Eurasian Network for Scientific Information;2009-2015;"Agricultural and Biological Sciences (miscellaneous) (Q4); Environmental Science (miscellaneous) (Q4)"
1383;21100810725;ECCM 2016 - Proceeding of the 17th European Conference on Composite Materials;conference and proceedings;-;0.114;-;7;0;914;0;156;914;0.17;0;Italy;Western Europe;;;"Environmental Engineering; Ocean Engineering; Water Science and Technology"
1384;21100446001;Forensic Engineering 2015: Performance of the Built Environment - Proceedings of the 7th Congress on Forensic Engineering;conference and proceedings;-;0.114;-;3;0;91;0;8;89;0.09;0;United States;Northern America;;;"Building and Construction; Civil and Structural Engineering; Electrical and Electronic Engineering; Geotechnical Engineering and Engineering Geology; Mechanical Engineering"
1385;21100378863;Indoor Air 2014 - 13th International Conference on Indoor Air Quality and Climate;conference and proceedings;-;0.114;-;6;0;967;0;59;965;0;0;United States;Northern America;;;"Building and Construction; Computer Science Applications; Health, Toxicology and Mutagenesis; Pollution"
1386;21100457025;Proceedings of 2015 International Conference on Information and Communication Technology and Systems, ICTS 2015;conference and proceedings;-;0.114;-;8;0;44;0;42;42;0.95;0;United States;Northern America;;;"Energy Engineering and Power Technology; Human-Computer Interaction; Management, Monitoring, Policy and Law; Renewable Energy, Sustainability and the Environment"
1387;21100463188;Transport and Energy Processes 2015 - Core Programming Area at the 2015 AIChE Annual Meeting;conference and proceedings;-;0.114;-;1;0;13;0;1;12;0.08;0;United States;Northern America;;;"Earth and Planetary Sciences (miscellaneous); Environmental Science (miscellaneous); Soil Science"
1388;21100356015;Water and Ecology (discontinued);journal;23053488;0.114;Q4;7;39;87;726;17;85;0.3;18.62;Russian Federation;Eastern Europe;St. Petersburg State University of Architecture and Civil Engineering;2014-2020;"Ecology (Q4); Waste Management and Disposal (Q4); Water Science and Technology (Q4)"
1389;21100450031;2015 IEEE 21st International Symposium for Design and Technology in Electronic Packaging, SIITME 2015;conference and proceedings;-;0.113;-;7;0;78;0;34;75;0.44;0;United States;Northern America;;;"Energy Engineering and Power Technology; Environmental Engineering; Renewable Energy, Sustainability and the Environment"
1390;20989;Environmental Forum;trade journal;07315732;0.113;Q4;9;21;66;118;5;66;0.07;5.62;United States;Northern America;Environmental Law Institute;1997-2020;"Geography, Planning and Development (Q4); Management, Monitoring, Policy and Law (Q4)"
1391;21100398405;Proceedings of the 15th International Conference of the European Society for Precision Engineering and Nanotechnology, EUSPEN 2015;conference and proceedings;-;0.113;-;5;0;191;0;35;189;0.18;0;Germany;Western Europe;;;"Environmental Engineering; Industrial and Manufacturing Engineering; Instrumentation; Materials Science (miscellaneous); Mechanical Engineering"
1392;24539;Wasser und Abfall;journal;14369095;0.113;Q4;5;88;213;561;16;175;0.02;6.38;Germany;Western Europe;Springer Vieweg;2003-2021;"Pollution (Q4); Water Science and Technology (Q4)"
1393;21100455612;2015 4th International Conference on Future Generation Communication Technology, FGCT 2015;conference and proceedings;-;0.112;-;5;0;29;0;22;27;0.76;0;United States;Northern America;;;"Health, Toxicology and Mutagenesis; Pollution; Toxicology"
1394;21100424406;ASABE 1st Climate Change Symposium: Adaptation and Mitigation;conference and proceedings;-;0.112;-;3;0;68;0;6;67;0.09;0;United States;Northern America;;;Information Systems
1395;19632;Asian Journal of Microbiology, Biotechnology and Environmental Sciences (discontinued);journal;09723005;0.112;Q4;16;174;459;3713;36;459;0.09;21.34;India;Asiatic Region;Global Publications;2001-2018;"Applied Microbiology and Biotechnology (Q4); Biotechnology (Q4); Environmental Science (miscellaneous) (Q4); Microbiology (Q4)"
1396;21100778885;Environmental Research, Engineering and Management;journal;20292139, 13921649;0.112;Q4;8;26;33;642;4;28;0.12;24.69;Lithuania;Eastern Europe;Kaunas University of Technology;2015-2021;"Environmental Engineering (Q4); Management, Monitoring, Policy and Law (Q4); Pollution (Q4); Renewable Energy, Sustainability and the Environment (Q4); Waste Management and Disposal (Q4)"
1397;5800210947;Heythrop Journal - Quarterly Review of Philosophy and Theology;journal;00181196;0.112;-;11;50;168;1656;29;161;0.14;33.12;United States;Northern America;Wiley-Blackwell;1960-2021;"Philosophy (Q3); Religious Studies (Q3)"
1398;21100379915;Hydrology and Water Resources Symposium 2014, HWRS 2014 - Conference Proceedings;conference and proceedings;-;0.112;-;5;0;112;0;11;110;0;0;Australia;Pacific Region;;;"Ocean Engineering; Oceanography; Water Science and Technology"
1399;21100266696;International Journal of Environmental Sustainability;journal;23251077, 23251085;0.112;Q4;6;6;49;205;10;49;0.12;34.17;United States;Northern America;Common Ground Research Networks;2012-2021;"Environmental Science (miscellaneous) (Q4); Renewable Energy, Sustainability and the Environment (Q4)"
1400;145497;Journal of Environmental Science and Engineering;journal;0367827X;0.112;Q4;18;24;133;472;11;133;0.02;19.67;India;Asiatic Region;National Environmental Engineering Research Inst.;2004-2016;"Environmental Science (miscellaneous) (Q4); Medicine (miscellaneous) (Q4)"
1401;6500153247;Journal of Spatial Hydrology;journal;15304736;0.112;Q4;12;0;4;0;1;4;0;0;United States;Northern America;Spatial Hydrology;2007-2012, 2014;"Management, Monitoring, Policy and Law (Q4); Water Science and Technology (Q4)"
1402;86787;Malayan Nature Journal;journal;00251291;0.112;Q4;8;38;38;870;7;37;0.12;22.89;Malaysia;Asiatic Region;Malaysian Nature Society;1977, 1982-1984, 2008-2015, 2017-2021;"Ecology, Evolution, Behavior and Systematics (Q4); Nature and Landscape Conservation (Q4)"
1403;12666;Nuclear Engineering International;trade journal;00295507;0.112;Q4;10;77;196;13;11;196;0.04;0.17;United Kingdom;Western Europe;Wilmington Business Publishing;1970-2018;"Nuclear Energy and Engineering (Q4); Safety, Risk, Reliability and Quality (Q4); Waste Management and Disposal (Q4)"
1404;21100777164;Proceedings of the 16th International Conference of the European Society for Precision Engineering and Nanotechnology, EUSPEN 2016;conference and proceedings;-;0.112;-;5;0;257;0;47;255;0.18;0;United Kingdom;Western Europe;;;"Computer Science Applications; Electrical and Electronic Engineering; Information Systems"
1405;96222;Proceedings of the Air & Waste Management Association's Annual Meeting & Exhibition;conference and proceedings;10526102;0.112;-;12;268;189;1967;3;189;0.02;7.34;United States;Northern America;;;Engineering (miscellaneous)
1406;21100206210;Scopus: Journal of East African Ornithology;journal;23131799, 02504162;0.112;Q4;4;15;51;188;6;46;0.11;12.53;Kenya;Africa;Nature Kenya: The East Africa Natural History Society;2009-2011, 2013-2021;"Animal Science and Zoology (Q4); Ecology (Q4); Ecology, Evolution, Behavior and Systematics (Q4)"
1407;16585;Technische Textilien;trade journal;03233243;0.112;Q4;8;0;30;0;1;30;0;0;Germany;Western Europe;Deutscher Fachverlag GmbH;1989-1990, 1998-2014, 2018, 2020;"Business, Management and Accounting (miscellaneous) (Q4); Environmental Science (miscellaneous) (Q4); Industrial and Manufacturing Engineering (Q4); Polymers and Plastics (Q4)"
1408;21100455673;2015 IEEE 2nd VR International Workshop on Collaborative Virtual Environments, 3DCVE 2015;conference and proceedings;-;0.111;-;2;0;4;0;2;2;0.5;0;United States;Northern America;;;"Electrical and Electronic Engineering; Environmental Science (miscellaneous); Radiation"
1409;21100375335;2nd EAGE Integrated Reservoir Modelling Conference - Uncertainty Management: Are we Doing it Right?;conference and proceedings;-;0.111;-;2;0;26;0;1;25;0;0;Netherlands;Western Europe;;;"Geophysics; Management, Monitoring, Policy and Law; Modeling and Simulation"
1410;21100403407;Air and Waste Management Association - 33rd International Conference on Thermal Treatment Technologies and Hazardous Waste Combustors, IT3/HWC 2014;conference and proceedings;-;0.111;-;0;0;3;0;0;2;0;0;United States;Northern America;;;"Information Systems; Information Systems and Management"
1411;14598;Ecology, Environment and Conservation (discontinued);journal;0971765X;0.111;Q4;17;316;1086;5714;49;1085;0.04;18.08;India;Asiatic Region;EM International;1997-2021;"Ecology (Q4); Ecology, Evolution, Behavior and Systematics (Q4); Nature and Landscape Conservation (Q4)"
1412;21100812560;Environmental Aspects, Applications and Implications of Nanomaterials and Nanotechnology 2016 - Topical Conference at the 2016 AIChE Annual Meeting;conference and proceedings;-;0.111;-;0;0;3;0;0;2;0;0;United States;Northern America;;;"Energy (miscellaneous); Materials Science (miscellaneous); Pollution"
1413;21100840089;Environment and Natural Resources Journal;journal;16865456, 24082384;0.111;Q4;6;14;0;467;0;0;0;33.36;Thailand;Asiatic Region;Mahidol University;2017-2021;Environmental Science (miscellaneous) (Q4)
1414;21100205957;E-Water;trade journal;19948549;0.111;Q4;2;0;2;0;0;2;0;0;Germany;Western Europe;;;"Pollution (Q4); Waste Management and Disposal (Q4)"
1415;5100152918;Jeoloji Muhendisligi Dergisi;journal;10169172;0.111;Q4;6;10;25;308;3;25;0.06;30.8;Turkey;Middle East;TMMOB - Jeoloji Muhendisleri Odasi;2005-2021;"Earth and Planetary Sciences (miscellaneous) (Q4); Environmental Science (miscellaneous) (Q4)"
1416;19900193274;Journal of King Abdulaziz University, Marine Science;journal;10128840;0.111;Q4;9;9;33;282;1;33;0.05;31.33;Saudi Arabia;Middle East;King Abdulaziz University Scientific Publishing Center;2009-2018, 2020;"Aquatic Science (Q4); Environmental Chemistry (Q4); Oceanography (Q4); Water Science and Technology (Q4)"
1417;18967;Mutation Research;journal;00275107;0.111;Q4;13;0;1;0;1;1;0;0;Netherlands;Western Europe;Elsevier;1964, 1973-1992, 1994-1999, 2003-2010, 2012-2014;"Genetics (Q4); Health, Toxicology and Mutagenesis (Q4); Molecular Biology (Q4)"
1418;17678;NAFO Scientific Council Studies;journal;02506432;0.111;Q4;13;1;2;19;0;2;0;19;Canada;Northern America;Northwest Atlantic Fisheries Organization;1993-2003, 2005, 2007-2010, 2013-2015, 2017;"Aquatic Science (Q4); Ecology (Q4); Oceanography (Q4)"
1419;21100773710;Perspective Technologies and Methods in MEMS Design, MEMSTECH 2016 - Proceedings of 12th International Conference;conference and proceedings;-;0.111;-;8;0;43;0;25;41;0.58;0;United States;Northern America;;;"Pollution; Waste Management and Disposal"
1420;19700187620;Planning and Environmental Law;journal;15568601, 15480755;0.111;Q4;8;0;35;0;0;2;0;0;United Kingdom;Western Europe;Taylor and Francis Ltd.;2004-2014;"Geography, Planning and Development (Q4); Law (Q4); Management, Monitoring, Policy and Law (Q4)"
1421;21100793694;Proceedings - 2016 10th International Conference on Innovative Mobile and Internet Services in Ubiquitous Computing, IMIS 2016;conference and proceedings;-;0.111;-;9;0;125;0;47;111;0.38;0;United States;Northern America;;;Environmental Engineering
1422;21100812591;Process Intensification 2016 - Topical Conference at the 2016 AIChE Annual Meeting;conference and proceedings;-;0.111;-;0;0;3;0;0;2;0;0;United States;Northern America;;;"Chemical Engineering (miscellaneous); Engineering (miscellaneous); Management of Technology and Innovation"
1423;24263;USDA Forest Service - Research Papers RMRS;journal;05025001;0.111;Q4;13;0;2;0;0;2;0;0;United States;Northern America;USDA Forest Service;1996-2014, 2016, 2018;"Ecology (Q4); Forestry (Q4); Plant Science (Q4)"
1424;21100373635;Conference Proceedings - 14th International Conference of the European Society for Precision Engineering and Nanotechnology, EUSPEN 2014;conference and proceedings;-;0.11;-;5;0;194;0;21;191;0;0;United Kingdom;Western Europe;;;"Environmental Engineering; Industrial and Manufacturing Engineering; Instrumentation; Materials Science (miscellaneous); Mechanical Engineering"
1425;21100346457;IEEE Proceedings of the INternational Conference On Emerging Trends in Science Engineering and Technology: Recent Advancements on Science and Engineering Innovation, INCOSET 2012;conference and proceedings;-;0.11;-;7;0;93;0;32;91;0;0;United States;Northern America;;;"Computer Science (miscellaneous); Engineering (miscellaneous); Environmental Engineering; Management of Technology and Innovation"
1426;21100301409;Issues in Toxicology;book series;17577179, 17577187;0.11;Q4;16;35;169;3257;31;85;0.23;93.06;United Kingdom;Western Europe;Royal Society of Chemistry;2007-2021;"Health, Toxicology and Mutagenesis (Q4); Pharmacology (Q4); Toxicology (Q4)"
1427;9500154150;Progress in Agricultural Engineering Sciences;journal;1786335X;0.11;Q4;8;5;15;102;3;15;0.18;20.4;Hungary;Eastern Europe;Akademiai Kiado;2007-2009, 2011-2020;"Environmental Engineering (Q4); Industrial and Manufacturing Engineering (Q4); Mechanical Engineering (Q4)"
1428;21100446024;12th International Conference on the Mediterranean Coastal Environment, MEDCOAST 2015;conference and proceedings;-;0.109;-;5;0;99;0;19;96;0.19;0;Turkey;Middle East;;;"Environmental Engineering; Pollution; Waste Management and Disposal"
1429;19325;Arab Gulf Journal of Scientific Research;journal;10154442;0.109;Q4;14;7;29;178;2;29;0.06;25.43;Iraq;Middle East;Arabian Gulf University;1983-2020;"Agronomy and Crop Science (Q4); Ecology, Evolution, Behavior and Systematics (Q4); Water Science and Technology (Q4)"
1430;24477;Journal of New England Water Environment Association;journal;10773002;0.109;Q4;4;41;72;58;4;50;0.02;1.41;United States;Northern America;New England Water Environment Association;1993-2019;"Pollution (Q4); Water Science and Technology (Q4)"
1431;16293;Journal of Planning and Environment Law;journal;03074870;0.109;Q4;9;26;178;800;21;143;0.13;30.77;United Kingdom;Western Europe;"Sweet &amp; Maxwell Ltd.";1970, 1979-1989, 1996-2021;"Geography, Planning and Development (Q4); Law (Q4); Management, Monitoring, Policy and Law (Q4)"
1432;21100779205;Proceedings of 2016 7th International Conference on Mechanical and Aerospace Engineering, ICMAE 2016;conference and proceedings;-;0.109;-;7;0;119;0;39;118;0.33;0;United States;Northern America;;;"Business and International Management; Management, Monitoring, Policy and Law; Management of Technology and Innovation; Strategy and Management"
1433;13162;Terra;journal;00403741;0.109;Q4;8;9;25;262;1;24;0.13;29.11;Finland;Western Europe;Geographical Society of Finland;1978-2015, 2017-2021;"Agricultural and Biological Sciences (miscellaneous) (Q4); Earth and Planetary Sciences (miscellaneous) (Q4); Geography, Planning and Development (Q4); Water Science and Technology (Q4)"
1434;21100466763;World Environmental and Water Resources Congress 2016: Watershed Management, Irrigation and Drainage, and Water Resources Planning and Management - Papers from Sessions of the Proceedings of the 2016 World Environmental and Water Resources Congress;conference and proceedings;-;0.109;-;5;0;57;0;20;55;0.35;0;United States;Northern America;;;Civil and Structural Engineering
1435;21100338343;1st Applied Shallow Marine Geophysics Conference, Part of Near Surface Geoscience 2014;conference and proceedings;-;0.108;-;2;0;21;0;5;20;0;0;Netherlands;Western Europe;;;"Environmental Engineering; Geophysics; Ocean Engineering"
1436;21100420307;2015 IEEE 35th International Conference on Electronics and Nanotechnology, ELNANO 2015 - Conference Proceedings;conference and proceedings;-;0.108;-;7;0;123;0;33;122;0.27;0;United States;Northern America;;;"Nuclear Energy and Engineering; Radiation; Waste Management and Disposal"
1437;21100410743;3rd SEMAT Workshop on General Theories of Software Engineering, GTSE 2014 - Proceedings;conference and proceedings;-;0.108;-;3;0;9;0;4;7;0;0;United States;Northern America;;;"Ecology; Numerical Analysis"
1438;25709;BioCycle;trade journal;02765055;0.108;Q4;19;90;297;56;19;297;0.05;0.62;United States;Northern America;JG Press Inc.;1981-2019;"Soil Science (Q4); Waste Management and Disposal (Q4)"
1439;21100398521;Earth and Space 2014: Engineering for Extreme Environments - Proceedings of the 14th Biennial International Conference on Engineering, Science, Construction, and Operations in Challenging Environments;conference and proceedings;-;0.108;-;6;0;77;0;13;75;0;0;United States;Northern America;;;"Building and Construction; Environmental Engineering"
1440;21100463866;Environmental Aspects, Applications and Implications of Nanomaterials and Nanotechnology 2015 - Topical Conference at the 2015 AIChE Annual Meeting;conference and proceedings;-;0.108;-;1;0;4;0;0;3;0;0;United States;Northern America;;;"Computer Graphics and Computer-Aided Design; Computer Vision and Pattern Recognition"
1441;21100775327;IACAS 2016 - 56th Israel Annual Conference on Aerospace Sciences;conference and proceedings;-;0.108;-;4;0;81;0;13;80;0.16;0;Israel;Middle East;;;"Electrical and Electronic Engineering; Environmental Engineering; Soil Science; Water Science and Technology"
