Rank;Sourceid;Title;Type;Issn;SJR;SJR Best Quartile;H index;Total Docs. (2020);Total Docs. (3years);Total Refs.;Total Cites (3years);Citable Docs. (3years);Cites / Doc. (2years);Ref. / Doc.;Country;Region;Publisher;Coverage;Categories
425;25193;Applied Sciences;journal;14545101;0.293;Q3;20;25;48;875;70;48;0.81;35;Romania;Eastern Europe;Balkan Society of Geometers;1999-2021;"Engineering (miscellaneous) (Q2); Applied Mathematics (Q3); Computer Science Applications (Q3); Fluid Flow and Transfer Processes (Q3); Instrumentation (Q3); Materials Science (miscellaneous) (Q3); Process Chemistry and Technology (Q3)"
426;16380;Chemical and Petroleum Engineering (English translation of Khimicheskoe i Neftyanoe Mashinostroenie);journal;00092355, 15738329;0.293;Q3;19;133;428;1290;276;428;0.55;9.7;United States;Northern America;Springer New York;1965-1998, 2000-2021;"Chemical Engineering (miscellaneous) (Q3); Energy Engineering and Power Technology (Q3); Fuel Technology (Q3); Geochemistry and Petrology (Q4)"
427;21100913762;International Journal of Nanoscience and Nanotechnology;journal;24235911, 17357004;0.291;Q4;9;20;57;770;80;57;1.4;38.5;Iran;Middle East;Iranian Nano Society;2018-2021;"Engineering (miscellaneous) (Q2); Atomic and Molecular Physics, and Optics (Q3); Chemistry (miscellaneous) (Q3); Materials Science (miscellaneous) (Q3); Bioengineering (Q4)"
428;21100198926;CFD Letters;journal;21801363;0.288;Q3;16;118;90;3200;203;89;2.26;27.12;Malaysia;Asiatic Region;ISSR;2009-2014, 2018-2021;"Fluid Flow and Transfer Processes (Q3); Modeling and Simulation (Q3)"
429;19900192431;Revista Mexicana de Ingeniera Quimica;journal;16652738;0.288;Q3;20;159;256;6870;458;256;2.05;43.21;Mexico;Latin America;Universidad Autonoma Metropolitana-Iztapalapa;2008-2021;Chemical Engineering (miscellaneous) (Q3)
430;21100835668;Journal of Thermal Engineering;journal;21487847;0.287;Q3;14;97;179;3201;240;179;1.43;33;Turkey;Middle East;Yildiz Technical University;2015-2021;"Building and Construction (Q3); Energy Engineering and Power Technology (Q3); Fluid Flow and Transfer Processes (Q3)"
431;26985;Kinetics and Catalysis;journal;00231584, 16083210;0.286;Q4;36;83;288;3791;279;287;0.97;45.67;United States;Northern America;Pleiades Publishing;1968-1971, 1984-1992, 1996-2021;"Chemistry (miscellaneous) (Q3); Computer Science Applications (Q3); Modeling and Simulation (Q3); Catalysis (Q4)"
432;4700152612;Current Nanoscience;journal;15734137;0.285;Q4;47;87;212;6470;342;203;1.71;74.37;United Arab Emirates;Middle East;Bentham Science Publishers B.V.;2006-2021;"Biomedical Engineering (Q3); Biotechnology (Q3); Medicine (miscellaneous) (Q3); Pharmaceutical Science (Q3); Bioengineering (Q4); Nanoscience and Nanotechnology (Q4)"
433;13055;Indian Chemical Engineer;journal;0975007X, 00194506;0.283;Q3;14;44;75;1275;96;75;1.19;28.98;United Kingdom;Western Europe;Taylor and Francis Ltd.;1992, 2009-2021;Chemical Engineering (miscellaneous) (Q3)
434;87828;International Journal of Heat and Technology;journal;03928764;0.283;Q3;30;106;526;2927;620;526;1.15;27.61;Italy;Western Europe;Edizioni E.T.S.;1983-1993, 1995-2021;"Condensed Matter Physics (Q3); Fluid Flow and Transfer Processes (Q3); Mechanical Engineering (Q3)"
435;21100967718;Nanomedicine Research Journal;journal;24767123, 24763489;0.283;Q4;13;40;96;1467;146;96;1.3;36.68;Iran;Middle East;Tehran University of Medical Sciences;2016-2021;"Biotechnology (Q3); Internal Medicine (Q3); Pharmacology (medical) (Q3); Biochemistry (Q4); Bioengineering (Q4); Molecular Medicine (Q4)"
436;17158;Textile Progress;journal;17542278, 00405167;0.283;Q3;28;3;12;1257;33;12;2;419;United Kingdom;Western Europe;Taylor and Francis Ltd.;1969-1978, 1981-1995, 1997-1998, 2000-2020;"Chemical Engineering (miscellaneous) (Q3); Industrial and Manufacturing Engineering (Q3); Materials Science (miscellaneous) (Q3)"
437;19400157518;Rasayan Journal of Chemistry;journal;09760083, 09741496;0.281;Q3;24;327;717;9125;867;717;1.25;27.91;India;Asiatic Region;Rasayan Journal;2008-2021;"Pharmacology, Toxicology and Pharmaceutics (miscellaneous) (Q2); Chemical Engineering (miscellaneous) (Q3); Chemistry (miscellaneous) (Q3); Energy (miscellaneous) (Q3); Biochemistry (Q4)"
438;19644;Technology and Health Care;journal;18787401, 09287329;0.281;Q4;48;125;431;3254;569;417;1.34;26.03;Netherlands;Western Europe;IOS Press BV;1993-2021;"Information Systems (Q3); Medicine (miscellaneous) (Q3); Bioengineering (Q4); Biomaterials (Q4); Biomedical Engineering (Q4); Biophysics (Q4); Health Informatics (Q4)"
439;12889;Huozhayao Xuebao/Chinese Journal of Explosives and Propellants;journal;10077812;0.279;Q3;22;109;335;2384;186;335;0.6;21.87;China;Asiatic Region;China Ordnance Industry Corporation;2001-2005, 2008-2021;"Chemical Engineering (miscellaneous) (Q3); Fuel Technology (Q3)"
440;17900156728;Polish Journal of Chemical Technology;journal;18994741, 15098117;0.279;Q3;23;47;183;1468;231;183;1.15;31.23;Poland;Eastern Europe;De Gruyter Open Ltd.;2007-2021;"Biotechnology (Q3); Chemical Engineering (miscellaneous) (Q3); Chemistry (miscellaneous) (Q3)"
441;21100825292;Voprosy Khimii i Khimicheskoi Tekhnologii;journal;03214095, 24137987;0.278;Q3;8;125;318;2014;177;318;0.56;16.11;Ukraine;Eastern Europe;Ukrainian State University of Chemical Technology;2015-2021;"Chemical Engineering (miscellaneous) (Q3); Chemistry (miscellaneous) (Q3); Materials Chemistry (Q3); Environmental Chemistry (Q4)"
442;21100811515;Advances in Biomembranes and Lipid Self-Assembly;book series;24519634;0.276;Q4;20;11;40;1319;38;19;1.07;119.91;Netherlands;Western Europe;Elsevier BV;2016-2021;"Biochemistry (Q4); Bioengineering (Q4); Biophysics (Q4)"
443;21100773812;Chemistry Journal of Moldova;journal;18571727, 23451688;0.275;Q4;7;20;78;768;108;78;1.08;38.4;Moldova;Eastern Europe;Institute of Chemistry, Academy of Sciences of Moldova;2016-2021;"Chemistry (miscellaneous) (Q3); Environmental Chemistry (Q4); Process Chemistry and Technology (Q4)"
444;19700202601;International Review on Modelling and Simulations;journal;19749821, 25331701;0.275;Q3;23;48;142;1506;284;142;2.1;31.38;Italy;Western Europe;Praise Worthy Prize S.r.l;2010-2021;"Chemical Engineering (miscellaneous) (Q3); Electrical and Electronic Engineering (Q3); Mechanical Engineering (Q3); Modeling and Simulation (Q3)"
445;19600161818;Chemical Engineering Transactions;journal;22839216;0.274;Q3;39;554;4228;9075;2998;4228;0.69;16.38;Italy;Western Europe;AIDIC-Italian Association of Chemical Engineering;2009-2021;Chemical Engineering (miscellaneous) (Q3)
446;18766;Petroleum Chemistry;journal;15556239, 09655441;0.274;Q3;27;154;527;5270;613;527;1.05;34.22;United States;Northern America;Pleiades Publishing;1991-2021;"Chemical Engineering (miscellaneous) (Q3); Chemistry (miscellaneous) (Q3); Energy Engineering and Power Technology (Q3); Fuel Technology (Q3); Geochemistry and Petrology (Q4)"
447;23201;Food Science and Technology Research;journal;13446606;0.273;Q3;45;97;328;2933;261;328;0.7;30.24;Switzerland;Western Europe;Japanese Society for Food Science and Technology;1999-2021;"Biotechnology (Q3); Chemical Engineering (miscellaneous) (Q3); Food Science (Q3); Industrial and Manufacturing Engineering (Q3); Marketing (Q3)"
448;130033;International Journal of Chemical Reactor Engineering;journal;15426580;0.268;Q3;36;100;333;3932;439;327;1.34;39.32;Germany;Western Europe;Walter de Gruyter GmbH;2002, 2004-2021;Chemical Engineering (miscellaneous) (Q3)
449;19700201144;Journal of Pharmacy and Bioallied Sciences;journal;09764879, 09757406;0.268;Q4;42;201;295;4865;592;292;1.52;24.2;India;Asiatic Region;Wolters Kluwer Medknow Publications;2011-2021;"Biochemistry, Genetics and Molecular Biology (miscellaneous) (Q3); Pharmacology, Toxicology and Pharmaceutics (miscellaneous) (Q3); Bioengineering (Q4)"
450;21100818722;Cybernetics and Physics;journal;22237038, 22264116;0.267;Q3;9;24;107;636;79;106;0.69;26.5;Russian Federation;Eastern Europe;Institute of Problems of Mechanical Engineering, Russian Academy of Sciences;2016-2021;"Artificial Intelligence (Q3); Computer Vision and Pattern Recognition (Q3); Control and Optimization (Q3); Fluid Flow and Transfer Processes (Q3); Physics and Astronomy (miscellaneous) (Q3); Signal Processing (Q3)"
451;19700201518;Engineering in Agriculture, Environment and Food;journal;18818366;0.267;Q3;21;3;133;72;247;133;1.87;24;Japan;Asiatic Region;Asian Agricultural and Biological Engineering Association;2008-2020;"Chemical Engineering (miscellaneous) (Q3); Food Science (Q3); Industrial and Manufacturing Engineering (Q3)"
452;21100894641;Society of Petroleum Engineers - SPE International Hydraulic Fracturing Technology Conference and Exhibition 2018, IHFT 2018;conference and proceedings;-;0.267;-;9;0;50;0;74;49;1.48;0;United States;Northern America;;;"Fluid Flow and Transfer Processes; Geochemistry and Petrology; Geotechnical Engineering and Engineering Geology"
453;27081;Tenside, Surfactants, Detergents;journal;21958564, 09323414;0.267;Q3;26;60;190;1850;181;185;0.98;30.83;Germany;Western Europe;Walter de Gruyter GmbH;1986-2021;"Chemical Engineering (miscellaneous) (Q3); Chemistry (miscellaneous) (Q3); Condensed Matter Physics (Q4)"
454;19700186874;Catalysis in Industry;journal;20700555, 20700504;0.264;Q4;17;43;133;1781;141;133;1.15;41.42;United States;Northern America;Pleiades Publishing;2010-2021;Catalysis (Q4)
455;27056;Colloid Journal;journal;1061933X, 16083067;0.262;Q4;35;89;292;2805;270;291;0.89;31.52;United States;Northern America;Pleiades Publishing;1989, 1991-1992, 1995-2021;"Surfaces and Interfaces (Q3); Colloid and Surface Chemistry (Q4); Physical and Theoretical Chemistry (Q4)"
456;21100855906;Journal of Membrane Science and Research;journal;24765406;0.262;Q4;17;42;110;2370;162;95;1.19;56.43;Iran;Middle East;Amirkabir University of Technology - Membrane Processes Research Laboratory;2015-2021;"Materials Science (miscellaneous) (Q3); Surfaces, Coatings and Films (Q3); Filtration and Separation (Q4)"
457;28982;Anti-Corrosion Methods and Materials;journal;00035599;0.261;Q3;34;64;247;2097;281;247;1.2;32.77;United Kingdom;Western Europe;Emerald Group Publishing Ltd.;1954-2021;"Chemical Engineering (miscellaneous) (Q3); Materials Science (miscellaneous) (Q3)"
458;16103;Minerva Biotecnologica;journal;11204826, 1827160X;0.259;Q4;19;26;72;1282;115;61;2.37;49.31;Italy;Western Europe;Edizioni Minerva Medica S.p.A.;1996-2021;"Applied Microbiology and Biotechnology (Q3); Biotechnology (Q3); Bioengineering (Q4)"
459;21100820130;Physical Chemistry Research;journal;23452625, 23225521;0.258;Q3;14;44;171;1659;195;171;1.29;37.7;Iran;Middle East;Iranian Chemical Society;2013-2021;"Fluid Flow and Transfer Processes (Q3); Physical and Theoretical Chemistry (Q4); Statistical and Nonlinear Physics (Q4)"
460;21100202725;Chemistry and Chemical Technology;journal;19964196;0.257;Q3;16;54;242;1367;188;242;0.78;25.31;Ukraine;Eastern Europe;Lviv Polytechnic National University;2012-2021;"Chemical Engineering (miscellaneous) (Q3); Chemistry (miscellaneous) (Q3)"
461;19700186837;Coke and Chemistry;journal;1068364X, 19348398;0.257;Q4;14;85;255;1467;147;255;0.5;17.26;United States;Northern America;Pleiades Publishing;2009-2021;"Fuel Technology (Q3); Environmental Chemistry (Q4); Process Chemistry and Technology (Q4)"
462;21100301453;SPR Nanoscience;book series;2049355X, 20493541;0.257;Q3;5;7;14;729;11;12;1.5;104.14;United Kingdom;Western Europe;Royal Society of Chemistry;2014, 2016-2017, 2019-2021;"Chemical Engineering (miscellaneous) (Q3); Chemistry (miscellaneous) (Q3)"
463;23999;Instrumentation Science and Technology;journal;15256030, 10739149;0.255;Q3;26;51;140;1723;184;140;1.55;33.78;United States;Northern America;Taylor and Francis Ltd.;1968-1972, 1974-1977, 1979-1982, 1984-1990, 1992-2021;"Chemical Engineering (miscellaneous) (Q3); Environmental Science (miscellaneous) (Q3); Instrumentation (Q3)"
464;21100801145;2016 IEEE Asian Solid-State Circuits Conference, A-SSCC 2016 - Proceedings;conference and proceedings;-;0.254;-;11;0;93;0;97;90;0;0;United States;Northern America;;;"Automotive Engineering; Computer Networks and Communications; Electrical and Electronic Engineering; Energy Engineering and Power Technology; Fluid Flow and Transfer Processes; Hardware and Architecture; Mechanical Engineering"
465;15600154713;Polymer Science - Series D;journal;19954212, 19954220;0.253;Q3;21;90;269;1366;176;269;0.57;15.18;United States;Northern America;Pleiades Publishing;2009-2021;"Chemical Engineering (miscellaneous) (Q3); Chemistry (miscellaneous) (Q3); Polymers and Plastics (Q3)"
466;21100447815;International Journal of Automotive Engineering;journal;21850992, 21850984;0.25;Q3;9;26;74;499;54;71;0.69;19.19;Japan;Asiatic Region;Society of Automotive Engineers of Japan Inc;2012, 2015-2021;"Automotive Engineering (Q3); Fluid Flow and Transfer Processes (Q3); Safety, Risk, Reliability and Quality (Q3); Human Factors and Ergonomics (Q4)"
467;6100152803;Micro and Nano Letters;journal;17500443;0.25;Q4;34;230;876;6546;940;875;1.08;28.46;United Kingdom;Western Europe;"John Wiley &amp; Sons Inc.";2007-2021;"Materials Science (miscellaneous) (Q3); Bioengineering (Q4); Biomedical Engineering (Q4); Condensed Matter Physics (Q4); Nanoscience and Nanotechnology (Q4)"
468;4000148108;Journal of Chemical Health and Safety;journal;18715532, 18780504;0.249;Q3;23;38;121;1058;117;92;0.88;27.84;United States;Northern America;American Chemical Society;2006-2021;"Chemical Health and Safety (Q3); Chemistry (miscellaneous) (Q3)"
469;21100824682;Smart Science;journal;23080477;0.248;Q4;12;19;74;586;118;74;1.85;30.84;United Kingdom;Western Europe;Taylor and Francis Ltd.;2013, 2015-2021;"Chemistry (miscellaneous) (Q3); Computational Mathematics (Q3); Computer Networks and Communications (Q3); Energy (miscellaneous) (Q3); Engineering (miscellaneous) (Q3); Fluid Flow and Transfer Processes (Q4); Modeling and Simulation (Q4)"
470;28662;Bezopasnost' Truda v Promyshlennosti;journal;26585537, 04092961;0.247;Q4;7;152;274;2549;114;274;0.42;16.77;Russian Federation;Eastern Europe;STC Industrial Safety CJSC;1980, 2001-2005, 2018-2021;"Energy (miscellaneous) (Q3); Environmental Science (miscellaneous) (Q3); Safety, Risk, Reliability and Quality (Q3); Chemical Health and Safety (Q4)"
471;19700182124;Health and Technology;journal;21907196, 21907188;0.247;Q4;22;147;174;4858;289;159;1.5;33.05;Germany;Western Europe;Springer Verlag;2011-2021;"Applied Microbiology and Biotechnology (Q3); Biotechnology (Q3); Bioengineering (Q4); Biomedical Engineering (Q4)"
472;21100853837;Journal of Advanced Research in Fluid Mechanics and Thermal Sciences;journal;22897879;0.247;Q4;17;391;562;12465;782;562;1.4;31.88;Malaysia;Asiatic Region;Penerbit Akademia Baru;2017-2021;Fluid Flow and Transfer Processes (Q4)
473;21100898538;Journal of Biotechnology: X;journal;25901559;0.247;Q4;4;12;9;424;16;9;1.78;35.33;Netherlands;Western Europe;Elsevier BV;2019-2020;"Applied Microbiology and Biotechnology (Q3); Biotechnology (Q3); Bioengineering (Q4)"
474;120139;SPE International Oilfield Chemistry Symposium Proceedings;conference and proceedings;10461779;0.247;-;37;0;168;0;189;166;1.09;0;United States;Northern America;Society of Petroleum Engineers (SPE);1973, 1975, 1995, 1997, 1999, 2001, 2003, 2005, 2007, 2009, 2011, 2013, 2015, 2017, 2019;"Chemical Engineering (miscellaneous); Chemistry (miscellaneous); Energy Engineering and Power Technology"
475;19700186875;Computational Thermal Sciences;journal;19402554, 19402503;0.245;Q4;19;34;105;1080;103;104;0.93;31.76;United States;Northern America;Begell House Inc.;2009-2021;"Computational Mathematics (Q3); Energy Engineering and Power Technology (Q3); Fluid Flow and Transfer Processes (Q4); Surfaces and Interfaces (Q4)"
476;21100463939;Journal of Engineering (United States);journal;23144912, 23144904;0.244;Q3;24;29;89;2657;137;89;1.54;91.62;Egypt;Africa/Middle East;Hindawi Limited;2013-2021;"Chemical Engineering (miscellaneous) (Q3); Civil and Structural Engineering (Q3); Electrical and Electronic Engineering (Q3); Hardware and Architecture (Q3); Industrial and Manufacturing Engineering (Q3); Mechanical Engineering (Q3)"
477;15943;Indian Journal of Fibre and Textile Research;journal;09710426;0.243;Q3;45;67;194;1695;161;189;0.7;25.3;India;Asiatic Region;National Institute of Science Communication and Information Resources (NISCAIR);1990-2021;"Chemical Engineering (miscellaneous) (Q3); Environmental Science (miscellaneous) (Q3); Materials Science (miscellaneous) (Q3); Polymers and Plastics (Q3)"
478;29675;Meditsina truda i promyshlennaia ekologiia;journal;26188945, 10269428;0.241;-;10;171;376;2514;84;349;0.22;14.7;Russian Federation;Eastern Europe;Izmerov Research Institute of Occupational Medicine;1965-2016, 2019-2021;Medicine (miscellaneous) (Q4)
479;21100868543;2018 International Interdisciplinary PhD Workshop, IIPhDW 2018;conference and proceedings;-;0.24;-;7;0;92;0;183;91;1.99;0;United States;Northern America;;;"Computer Science Applications; Computer Vision and Pattern Recognition; Control and Optimization; Electrical and Electronic Engineering; Energy Engineering and Power Technology; Fluid Flow and Transfer Processes; Mechanics of Materials; Signal Processing"
480;14228;Progress in Rubber, Plastics and Recycling Technology;journal;14777606, 14782413;0.24;Q3;15;17;43;758;46;43;1.12;44.59;United Kingdom;Western Europe;RAPRA Technology Ltd.;2003-2021;"Chemical Engineering (miscellaneous) (Q3); Materials Chemistry (Q3); Polymers and Plastics (Q3); Organic Chemistry (Q4)"
481;26487;Solvent Extraction Research and Development;journal;21884765, 13417215;0.239;Q3;21;15;32;387;38;32;1;25.8;Japan;Asiatic Region;Japan Association of Solvent Extraction;1996-2021;"Chemical Engineering (miscellaneous) (Q3); Chemistry (miscellaneous) (Q3)"
482;19700183150;International Journal of Multiphysics;journal;17509548;0.237;Q4;13;28;84;683;59;84;0.61;24.39;United Kingdom;Western Europe;;2010-2021;"Computational Mechanics (Q3); Mechanics of Materials (Q3); Fluid Flow and Transfer Processes (Q4); Modeling and Simulation (Q4); Numerical Analysis (Q4)"
483;21101019609;Journal of Electrochemical Science and Engineering;journal;18479286;0.236;Q3;14;34;76;1139;89;74;1.16;33.5;Croatia;Eastern Europe;International Association of Physical Chemists;2012-2021;"Chemical Engineering (miscellaneous) (Q3); Materials Chemistry (Q3); Colloid and Surface Chemistry (Q4); Electrochemistry (Q4)"
484;21100871768;Proceedings of the 17th InterSociety Conference on Thermal and Thermomechanical Phenomena in Electronic Systems, ITherm 2018;conference and proceedings;-;0.236;-;10;0;182;0;228;180;1.25;0;United States;Northern America;;;"Electrical and Electronic Engineering; Fluid Flow and Transfer Processes; Mechanics of Materials; Safety, Risk, Reliability and Quality"
485;21100831407;Journal of The Institution of Engineers (India): Series E;journal;22502483, 22502491;0.235;Q3;11;32;64;895;60;64;0.73;27.97;India;Asiatic Region;Springer India;2012-2021;"Chemical Engineering (miscellaneous) (Q3); Industrial and Manufacturing Engineering (Q3); Materials Science (miscellaneous) (Q3)"
486;17700156004;WSEAS Transactions on Fluid Mechanics;journal;2224347X, 17905087;0.234;Q4;12;23;52;509;50;52;1.24;22.13;Greece;Western Europe;World Scientific and Engineering Academy and Society;2009-2015, 2017-2021;"Computational Mechanics (Q3); Ocean Engineering (Q3); Physics and Astronomy (miscellaneous) (Q3); Fluid Flow and Transfer Processes (Q4); Modeling and Simulation (Q4)"
487;14266;Russian Journal of Applied Chemistry;journal;10704272, 16083296;0.233;Q3;30;227;790;5888;615;789;0.83;25.94;United States;Northern America;Pleiades Publishing;1995-2021;"Chemical Engineering (miscellaneous) (Q3); Chemistry (miscellaneous) (Q3)"
488;14237;Journal of Fuel Chemistry and Technology;journal;18725813, 02532409;0.231;Q3;41;172;555;5560;517;555;0.9;32.33;China;Asiatic Region;Science Press;1996-2021;"Chemical Engineering (miscellaneous) (Q3); Fuel Technology (Q3); Physical and Theoretical Chemistry (Q4)"
489;21100804545;Progress in Color, Colorants and Coatings;journal;20082134, 23831790;0.231;Q4;11;14;80;469;81;80;0.98;33.5;Iran;Middle East;Institute for Color Science and Technology (ICST);2016-2021;"Surfaces, Coatings and Films (Q3); Process Chemistry and Technology (Q4)"
490;26583;Ceramics - Silikaty;journal;08625468, 18045847;0.23;Q3;35;50;150;1684;151;150;1;33.68;Czech Republic;Eastern Europe;Institute of Chemical Technology;1991-2021;"Chemical Engineering (miscellaneous) (Q3); Materials Chemistry (Q3); Analytical Chemistry (Q4); Ceramics and Composites (Q4); Physical and Theoretical Chemistry (Q4)"
491;21100837966;2017 6th International Symposium on Advanced Control of Industrial Processes, AdCONIP 2017;conference and proceedings;-;0.229;-;6;0;113;0;60;110;0;0;United States;Northern America;;;"Control and Optimization; Industrial and Manufacturing Engineering; Modeling and Simulation; Process Chemistry and Technology"
492;12100154841;Journal of Applied Biological Chemistry;journal;19760442;0.229;Q4;21;60;176;1876;111;170;0.57;31.27;South Korea;Asiatic Region;The Korean Society for Applied Biological Chemistry;2008-2021;"Bioengineering (Q4); Organic Chemistry (Q4)"
493;144782;e-Journal of Surface Science and Nanotechnology;journal;13480391;0.228;Q4;24;50;134;1171;83;132;0.54;23.42;Japan;Asiatic Region;The Japan Society of Vacuum and Surface Science;2005-2021;"Biotechnology (Q3); Surfaces, Coatings and Films (Q3); Bioengineering (Q4); Condensed Matter Physics (Q4); Mechanics of Materials (Q4); Nanoscience and Nanotechnology (Q4); Surfaces and Interfaces (Q4)"
494;21100838538;Proceedings of the 16th InterSociety Conference on Thermal and Thermomechanical Phenomena in Electronic Systems, ITherm 2017;conference and proceedings;-;0.228;-;14;0;203;0;200;201;0;0;United States;Northern America;;;"Electrical and Electronic Engineering; Electronic, Optical and Magnetic Materials; Fluid Flow and Transfer Processes; Surfaces and Interfaces"
495;7200153124;Eurasian Chemico-Technological Journal;journal;15623920;0.227;Q3;11;38;137;1075;122;137;0.85;28.29;Kazakhstan;Asiatic Region;al-Farabi Kazakh State National University;2003-2004, 2007-2021;"Chemical Engineering (miscellaneous) (Q3); Chemistry (miscellaneous) (Q3); Materials Science (miscellaneous) (Q3); Condensed Matter Physics (Q4)"
496;18800156701;NACE - International Corrosion Conference Series;book series;03614409;0.226;Q3;40;204;1425;3386;315;1415;0.24;16.6;United States;Northern America;National Association of Corrosion Engineers;1983, 1996-2003, 2005-2020;"Chemical Engineering (miscellaneous) (Q3); Chemistry (miscellaneous) (Q3); Materials Science (miscellaneous) (Q3)"
497;21457;Przemysl Chemiczny;journal;00332496;0.226;Q3;20;41;981;1390;335;935;0.36;33.9;Poland;Eastern Europe;Wydawnictwo SIGMA - N O T Sp. z o.o.;1973, 1975-1988, 1990, 1996-2021;"Chemical Engineering (miscellaneous) (Q3); Chemistry (miscellaneous) (Q3)"
498;21100840458;Periodicals of Engineering and Natural Sciences;journal;23034521;0.225;Q4;16;240;341;5584;436;341;1.2;23.27;Bosnia and Herzegovina;Eastern Europe;International University of Sarajevo;2017-2021;"Architecture (Q2); Computer Science (miscellaneous) (Q3); Electrical and Electronic Engineering (Q3); Industrial and Manufacturing Engineering (Q3); Mechanical Engineering (Q3); Bioengineering (Q4); Biomedical Engineering (Q4)"
499;21523;Russian Journal of Coordination Chemistry/Koordinatsionnaya Khimiya;journal;10703284, 16083318;0.224;Q3;29;89;337;3595;340;337;1.04;40.39;United States;Northern America;Pleiades Publishing;1996-2021;"Chemical Engineering (miscellaneous) (Q3); Chemistry (miscellaneous) (Q3)"
500;24098;Indian Journal of Chemical Technology;journal;0971457X;0.222;Q3;41;59;201;1743;177;198;0.6;29.54;India;Asiatic Region;National Institute of Science Communication and Information Resources (NISCAIR);1994-2021;"Chemical Engineering (miscellaneous) (Q3); Chemistry (miscellaneous) (Q3)"
501;13539;ChemChemTech;journal;05792991, 25003070;0.221;Q3;7;178;517;4669;202;517;0.43;26.23;Russian Federation;Eastern Europe;Ivanovo State University of Chemistry and Technology;1980, 1982, 2017-2021;"Chemical Engineering (miscellaneous) (Q3); Chemistry (miscellaneous) (Q3)"
502;24128;Iranian Journal of Chemistry and Chemical Engineering;journal;10219986;0.221;Q3;27;168;403;6565;358;399;0.72;39.08;Iran;Middle East;Iranian Journal of Chemistry and Chemical Engineering;1996-2021;"Chemical Engineering (miscellaneous) (Q3); Chemistry (miscellaneous) (Q3)"
503;21100239852;Journal of Chemical Technology and Metallurgy;journal;13147978, 13147471;0.22;Q3;22;169;429;4176;333;428;0.79;24.71;Bulgaria;Eastern Europe;University of Chemical Technology and Metallurgy;2013-2021;"Chemical Engineering (miscellaneous) (Q3); Industrial and Manufacturing Engineering (Q3)"
504;15826;Zhongguo Zaozhi Xuebao/Transactions of China Pulp and Paper;journal;10006842;0.22;Q3;9;53;142;1386;91;142;0.58;26.15;China;Asiatic Region;China Technical Association of Paper Industry;1997-1998, 2002-2021;"Media Technology (Q2); Chemical Engineering (miscellaneous) (Q3); Materials Science (miscellaneous) (Q3)"
505;22476;Informacion Tecnologica (discontinued);journal;07180764, 07168756;0.218;Q3;15;136;482;4059;296;472;0.6;29.85;Chile;Latin America;Centro de Informacion Tecnologica;1996-2021;"Multidisciplinary (Q2); Agricultural and Biological Sciences (miscellaneous) (Q3); Business, Management and Accounting (miscellaneous) (Q3); Chemical Engineering (miscellaneous) (Q3); Chemistry (miscellaneous) (Q3); Computer Science (miscellaneous) (Q3); Energy (miscellaneous) (Q3); Food Science (Q3); Industrial and Manufacturing Engineering (Q3); Materials Science (miscellaneous) (Q3); Computer Science Applications (Q4); Geotechnical Engineering and Engineering Geology (Q4); Strategy and Management (Q4)"
