Rank;Sourceid;Title;Type;Issn;SJR;SJR Best Quartile;H index;Total Docs. (2014);Total Docs. (3years);Total Refs.;Total Cites (3years);Citable Docs. (3years);Cites / Doc. (2years);Ref. / Doc.;Country;Region;Publisher;Coverage;Categories
188;16411;Chemical Engineering Research and Design;journal;17443563, 02638762;1.022;Q1;108;300;784;11761;2511;772;2.77;39.2;United Kingdom;Western Europe;Institution of Chemical Engineers;1983-2021;"Chemical Engineering (miscellaneous) (Q1); Chemistry (miscellaneous) (Q1)"
189;19700186746;ACS Combinatorial Science;journal;21568952, 21568944;1.021;Q1;84;96;272;3863;893;270;3.26;40.24;United States;Northern America;American Chemical Society;2011-2020;"Chemistry (miscellaneous) (Q1); Medicine (miscellaneous) (Q1)"
190;24158;"Journal of Chemical &amp; Engineering Data";journal;00219568, 15205134;1.015;Q1;140;511;1680;17155;3881;1659;2.11;33.57;United States;Northern America;American Chemical Society;1956-2021;"Chemical Engineering (miscellaneous) (Q1); Chemistry (miscellaneous) (Q1)"
191;25786;Bioorganic and Medicinal Chemistry;journal;14643391, 09680896;1.01;Q1;171;680;2365;28000;7438;2353;3.06;41.18;United Kingdom;Western Europe;Elsevier Ltd.;1993-2021;"Drug Discovery (Q1); Organic Chemistry (Q1); Pharmaceutical Science (Q1); Biochemistry (Q2); Clinical Biochemistry (Q2); Molecular Medicine (Q2); Molecular Biology (Q3)"
192;14464;Polymer Testing;journal;01429418;1.01;Q1;107;186;494;4984;1269;469;2.5;26.8;United Kingdom;Western Europe;Elsevier Ltd.;1980-2021;"Organic Chemistry (Q1); Polymers and Plastics (Q1)"
193;13057;"Industrial &amp; Engineering Chemistry Research";journal;15205045, 08885885;1.009;Q1;231;2082;5253;81596;16016;5216;2.95;39.19;United States;Northern America;American Chemical Society;1987-2021;"Chemical Engineering (miscellaneous) (Q1); Chemistry (miscellaneous) (Q1); Industrial and Manufacturing Engineering (Q1)"
194;25938;Macromolecular Materials and Engineering;journal;14387492, 14392054;1.009;Q2;104;135;354;5822;1075;350;2.78;43.13;Germany;Western Europe;Wiley-VCH Verlag;1989, 2000-2021;"Chemical Engineering (miscellaneous) (Q1); Materials Chemistry (Q1); Polymers and Plastics (Q1); Organic Chemistry (Q2)"
195;24824;New Journal of Chemistry;journal;11440546, 13699261;1.006;Q1;126;772;1241;37358;4120;1233;3.19;48.39;United Kingdom;Western Europe;Royal Society of Chemistry;1996-2021;"Chemistry (miscellaneous) (Q1); Materials Chemistry (Q1); Catalysis (Q2)"
196;13261;Progress in Organic Coatings;journal;00330655, 03009440;0.997;Q2;115;262;690;9148;2070;680;2.79;34.92;Netherlands;Western Europe;Elsevier;1972-2021;"Chemical Engineering (miscellaneous) (Q1); Materials Chemistry (Q1); Surfaces, Coatings and Films (Q1); Organic Chemistry (Q2)"
197;29079;Particle and Particle Systems Characterization;journal;15214117, 09340866;0.996;Q1;60;130;166;7796;491;164;3.03;59.97;Germany;Western Europe;Wiley-VCH Verlag;1984-2021;"Chemistry (miscellaneous) (Q1); Condensed Matter Physics (Q1); Materials Science (miscellaneous) (Q1)"
198;25879;International Journal of Molecular Sciences;journal;14220067, 16616596;0.991;Q1;195;1416;3062;80594;10372;3040;3.36;56.92;Switzerland;Western Europe;Multidisciplinary Digital Publishing Institute (MDPI);2000-2021;"Computer Science Applications (Q1); Inorganic Chemistry (Q1); Medicine (miscellaneous) (Q1); Spectroscopy (Q1); Catalysis (Q2); Organic Chemistry (Q2); Physical and Theoretical Chemistry (Q2); Molecular Biology (Q3)"
199;24072;Mikrochimica Acta;journal;14365073, 00263672;0.989;Q1;94;220;609;9508;2291;607;3.9;43.22;Austria;Western Europe;Springer-Verlag Wien;1926-1944, 1947-2021;Analytical Chemistry (Q1)
200;21971;Topics in Catalysis;journal;15729028, 10225528;0.987;Q1;116;173;546;7018;1362;526;2.41;40.57;Netherlands;Western Europe;Springer Netherlands;1994-2021;"Chemistry (miscellaneous) (Q1); Catalysis (Q2)"
201;24537;Surface and Coatings Technology;journal;02578972;0.983;Q1;182;867;2698;31747;6964;2683;2.33;36.62;Netherlands;Western Europe;Elsevier;1986-2021;"Chemistry (miscellaneous) (Q1); Condensed Matter Physics (Q1); Materials Chemistry (Q1); Surfaces, Coatings and Films (Q1); Surfaces and Interfaces (Q2)"
202;26899;Fluid Phase Equilibria;journal;03783812;0.981;Q2;126;512;1143;20262;2787;1131;2.35;39.57;Netherlands;Western Europe;Elsevier;1977-2021;"Chemical Engineering (miscellaneous) (Q1); Physics and Astronomy (miscellaneous) (Q1); Physical and Theoretical Chemistry (Q2)"
203;26491;Synlett;journal;09365214, 14372096;0.978;Q2;136;601;1740;22968;4172;1722;2.37;38.22;Germany;Western Europe;Georg Thieme Verlag;1989-2021;Organic Chemistry (Q2)
204;24016;Journal of Analytical Atomic Spectrometry;journal;13645544, 02679477;0.975;Q1;118;246;689;10352;2339;676;3.59;42.08;United Kingdom;Western Europe;Royal Society of Chemistry;1971, 1977-1978, 1983-1984, 1986-2021;"Analytical Chemistry (Q1); Spectroscopy (Q1)"
205;25280;Journal of Biological Inorganic Chemistry;journal;09498257, 14321327;0.972;Q1;106;122;321;6288;962;306;2.49;51.54;Germany;Western Europe;Springer Verlag;1996-2021;"Inorganic Chemistry (Q1); Biochemistry (Q2)"
206;26512;Tetrahedron;journal;14645416, 00404020;0.972;Q2;226;1140;3774;58436;11337;3760;2.92;51.26;United Kingdom;Western Europe;Elsevier Ltd.;1957-2021;"Drug Discovery (Q1); Biochemistry (Q2); Organic Chemistry (Q2)"
207;14858;Biophysical Chemistry;journal;03014622, 18734200;0.955;Q2;100;58;264;2778;588;258;2.03;47.9;Netherlands;Western Europe;Elsevier;1973-2021;"Biochemistry (Q2); Biophysics (Q2); Organic Chemistry (Q2)"
208;24044;Journal of Mass Spectrometry;journal;10969888, 10765174;0.951;Q1;123;163;508;5596;1352;473;2.57;34.33;United States;Northern America;Wiley-Blackwell;1995-2021;"Medicine (miscellaneous) (Q1); Spectroscopy (Q1)"
209;25937;Macromolecular Chemistry and Physics;journal;10221352, 15213935;0.951;Q2;115;248;828;11178;2203;823;2.73;45.07;Germany;Western Europe;Wiley-VCH Verlag;1994-2021;"Condensed Matter Physics (Q1); Materials Chemistry (Q1); Polymers and Plastics (Q1); Organic Chemistry (Q2); Physical and Theoretical Chemistry (Q2)"
210;28983;Applied Surface Science;journal;01694332;0.948;-;204;2445;5764;85377;18024;5726;3;34.92;Netherlands;Western Europe;Elsevier;1984-2022;Surfaces, Coatings and Films (Q1)
211;25788;Bioorganic and Medicinal Chemistry Letters;journal;14643405, 0960894X;0.942;Q2;154;1113;4287;32620;11308;4285;2.66;29.31;United Kingdom;Western Europe;Elsevier Ltd.;1991-2021;"Pharmaceutical Science (Q1); Biochemistry (Q2); Clinical Biochemistry (Q2); Drug Discovery (Q2); Organic Chemistry (Q2); Molecular Biology (Q3); Molecular Medicine (Q3)"
212;19700194010;MedChemComm;journal;20402503, 20402511;0.942;-;0;0;0;0;0;0;0;0;United Kingdom;Western Europe;Royal Society of Chemistry;2010-2019;"Pharmaceutical Science (Q1); Biochemistry (Q2)"
213;16083;Journal of Chemical Technology and Biotechnology;journal;02682575, 10974660;0.938;Q1;124;233;703;10162;1945;691;2.54;43.61;United Kingdom;Western Europe;John Wiley and Sons Ltd;1979-1981, 1983-2021;"Chemical Engineering (miscellaneous) (Q1); Fuel Technology (Q1); Inorganic Chemistry (Q1); Pollution (Q1); Waste Management and Disposal (Q1); Biotechnology (Q2); Organic Chemistry (Q2); Renewable Energy, Sustainability and the Environment (Q2)"
214;19600157322;Journal of Cheminformatics;journal;17582946;0.933;Q2;61;48;206;2076;746;201;4.77;43.25;United Kingdom;Western Europe;Chemistry Central;2009-2021;"Computer Graphics and Computer-Aided Design (Q1); Computer Science Applications (Q1); Library and Information Sciences (Q1); Physical and Theoretical Chemistry (Q2)"
215;16759;Advances in Clinical Chemistry;journal;00652423;0.918;Q1;53;41;77;6066;249;1;2.91;147.95;United States;Northern America;Academic Press Inc.;1958-1973, 1975-1978, 1980-1981, 1983, 1985-1987, 1989-1990, 1992-1994, 1996, 1998-2001, 2003-2021;"Chemistry (miscellaneous) (Q1); Clinical Biochemistry (Q2)"
216;20922;Microchemical Journal;journal;0026265X;0.907;Q1;90;184;578;6874;1883;572;3.09;37.36;United States;Northern America;Elsevier Inc.;1957-2021;"Analytical Chemistry (Q1); Spectroscopy (Q2)"
217;24593;Calphad: Computer Coupling of Phase Diagrams and Thermochemistry;journal;03645916;0.904;Q1;66;88;217;4145;346;215;1.5;47.1;United Kingdom;Western Europe;Elsevier Ltd.;1977-2021;"Chemical Engineering (miscellaneous) (Q1); Chemistry (miscellaneous) (Q1); Computer Science Applications (Q1)"
218;27083;Thermochimica Acta;journal;00406031, 1872762X;0.903;Q2;142;381;1218;13321;3306;1212;2.37;34.96;Netherlands;Western Europe;Elsevier;1970-2021;"Condensed Matter Physics (Q1); Instrumentation (Q1); Physical and Theoretical Chemistry (Q2)"
219;16945;Chemistry and Physics of Lipids;journal;18732941, 00093084;0.891;Q2;103;92;266;6625;766;261;2.67;72.01;Ireland;Western Europe;Elsevier Ireland Ltd;1966-2021;"Biochemistry (Q2); Organic Chemistry (Q2); Cell Biology (Q3); Molecular Biology (Q3)"
220;28425;Fire Safety Journal;journal;03797112;0.891;Q1;85;81;301;2491;536;294;1.53;30.75;United Kingdom;Western Europe;Elsevier Ltd.;1977-2021;"Chemistry (miscellaneous) (Q1); Materials Science (miscellaneous) (Q1); Safety, Risk, Reliability and Quality (Q1); Physics and Astronomy (miscellaneous) (Q2)"
221;22748;Catalysis Letters;journal;1572879X, 1011372X;0.89;Q1;125;276;625;10275;1755;623;2.47;37.23;Netherlands;Western Europe;Springer Netherlands;1988-2021;"Chemistry (miscellaneous) (Q1); Catalysis (Q3)"
222;14805;Steroids;journal;0039128X, 18785867;0.889;Q2;107;173;594;8211;1700;585;2.83;47.46;United States;Northern America;Elsevier Inc.;1963-2021;"Biochemistry (Q2); Clinical Biochemistry (Q2); Endocrinology (Q2); Organic Chemistry (Q2); Pharmacology (Q2); Molecular Biology (Q3)"
223;21429;Photochemical and Photobiological Sciences;journal;1474905X, 14749092;0.885;Q2;105;186;670;8897;1894;651;2.46;47.83;Switzerland;Western Europe;Springer International Publishing AG;2002-2021;Physical and Theoretical Chemistry (Q2)
224;24756;Match;journal;03406253;0.882;Q1;64;103;355;2523;580;353;1.7;24.5;Serbia;Eastern Europe;University of Kragujevac, Faculty of Science;1990, 1996-2021;"Chemistry (miscellaneous) (Q1); Computer Science Applications (Q1); Applied Mathematics (Q2); Computational Theory and Mathematics (Q2)"
225;24595;Chemometrics and Intelligent Laboratory Systems;journal;01697439;0.88;Q2;132;181;438;6800;1401;429;2.78;37.57;Netherlands;Western Europe;Elsevier;1986-2021;"Computer Science Applications (Q1); Process Chemistry and Technology (Q1); Software (Q1); Analytical Chemistry (Q2); Spectroscopy (Q2)"
226;24088;Rapid Communications in Mass Spectrometry;journal;09514198, 10970231;0.878;Q2;139;328;1122;10471;2711;1051;2.28;31.92;United Kingdom;Western Europe;John Wiley and Sons Ltd;1987-2021;"Analytical Chemistry (Q2); Organic Chemistry (Q2); Spectroscopy (Q2)"
227;21100405051;Methods and Applications in Fluorescence;journal;20506120;0.873;Q2;28;27;19;1181;49;17;2.58;43.74;United Kingdom;Western Europe;IOP Publishing Ltd.;2013-2021;"Atomic and Molecular Physics, and Optics (Q1); Instrumentation (Q1); Materials Science (miscellaneous) (Q1); Spectroscopy (Q2)"
228;16392;Chemical Engineering and Processing: Process Intensification;journal;02552701;0.862;Q1;111;146;453;5809;1212;443;2.59;39.79;Netherlands;Western Europe;Elsevier;1984-2021;"Chemical Engineering (miscellaneous) (Q1); Chemistry (miscellaneous) (Q1); Energy Engineering and Power Technology (Q1); Industrial and Manufacturing Engineering (Q1); Process Chemistry and Technology (Q1)"
229;29886;Solid State Communications;journal;00381098;0.859;Q1;134;347;1270;10205;2443;1265;2.06;29.41;United Kingdom;Western Europe;Elsevier Ltd.;1963-2021;"Chemistry (miscellaneous) (Q1); Materials Chemistry (Q1); Condensed Matter Physics (Q2)"
230;21322;Flow, Turbulence and Combustion;journal;13866184, 15731987;0.857;Q2;68;73;201;2918;441;193;2.02;39.97;Netherlands;Western Europe;Springer Netherlands;1996-2021;"Chemical Engineering (miscellaneous) (Q1); Physical and Theoretical Chemistry (Q2); Physics and Astronomy (miscellaneous) (Q2)"
231;24517;Solid State Nuclear Magnetic Resonance;journal;09262040, 15273326;0.856;Q1;64;27;120;1131;309;114;2.65;41.89;Netherlands;Western Europe;Elsevier;1992-2021;"Chemistry (miscellaneous) (Q1); Instrumentation (Q1); Radiation (Q1); Nuclear and High Energy Physics (Q2)"
232;26589;Colloids and Surfaces A: Physicochemical and Engineering Aspects;journal;18734359, 09277757;0.854;-;179;876;1898;32579;5746;1884;2.97;37.19;Netherlands;Western Europe;Elsevier;1993-2021;Colloid and Surface Chemistry (Q2)
233;19200156922;Biointerphases;journal;15594106, 19348630;0.846;Q1;50;48;134;522;428;129;3.28;10.88;United States;Northern America;American Vacuum Society;2008-2021;"Chemistry (miscellaneous) (Q1); Materials Science (miscellaneous) (Q1); Biochemistry, Genetics and Molecular Biology (miscellaneous) (Q2); Biomaterials (Q2); Physics and Astronomy (miscellaneous) (Q2)"
234;16533;Phytochemical Analysis;journal;09580344, 10991565;0.846;Q2;76;69;256;2355;741;254;2.64;34.13;United Kingdom;Western Europe;John Wiley and Sons Ltd;1990-2021;"Complementary and Alternative Medicine (Q1); Food Science (Q1); Plant Science (Q1); Analytical Chemistry (Q2); Biochemistry (Q2); Drug Discovery (Q2); Medicine (miscellaneous) (Q2); Molecular Medicine (Q3)"
235;21100201310;ChemPlusChem;journal;21926506;0.843;Q1;63;195;445;9972;1120;440;3.04;51.14;Germany;Western Europe;Wiley-VCH Verlag;2012-2021;Chemistry (miscellaneous) (Q1)
236;29887;Solid State Ionics;journal;01672738;0.837;Q1;201;459;1102;12976;3092;1092;2.62;28.27;Netherlands;Western Europe;Elsevier;1979-2021;"Chemistry (miscellaneous) (Q1); Materials Science (miscellaneous) (Q1); Condensed Matter Physics (Q2)"
237;25857;Flavour and Fragrance Journal;journal;10991026, 08825734;0.836;Q1;72;43;164;1711;343;152;1.99;39.79;United Kingdom;Western Europe;John Wiley and Sons Ltd;1985-2021;"Chemistry (miscellaneous) (Q1); Food Science (Q1)"
238;12142;International Journal of Mass Spectrometry;journal;13873806;0.834;Q2;116;192;781;7043;1656;755;2.04;36.68;Netherlands;Western Europe;Elsevier;1998-2021;"Instrumentation (Q1); Condensed Matter Physics (Q2); Physical and Theoretical Chemistry (Q2); Spectroscopy (Q2)"
239;9500154039;Journal of Electroanalytical Chemistry;journal;15726657;0.833;Q2;163;406;1148;16501;3394;1140;2.88;40.64;Netherlands;Western Europe;Elsevier BV;1959-2021;"Chemical Engineering (miscellaneous) (Q1); Analytical Chemistry (Q2); Electrochemistry (Q2)"
240;25199;Journal of Solid State Electrochemistry;journal;14328488, 14330768;0.831;Q2;89;363;1077;14409;2917;1067;2.61;39.69;Germany;Western Europe;Springer Verlag;1997-2021;"Electrical and Electronic Engineering (Q1); Materials Science (miscellaneous) (Q1); Condensed Matter Physics (Q2); Electrochemistry (Q2)"
241;14240;Reactive and Functional Polymers;journal;13815148;0.831;Q1;104;151;489;6517;1407;483;2.7;43.16;Netherlands;Western Europe;Elsevier;1995-2021;"Chemical Engineering (miscellaneous) (Q1); Chemistry (miscellaneous) (Q1); Materials Chemistry (Q1); Polymers and Plastics (Q1); Biochemistry (Q2); Environmental Chemistry (Q2)"
242;19700174958;Drug Testing and Analysis;journal;19427611, 19427603;0.824;Q2;57;167;394;6349;1063;359;2.39;38.02;United Kingdom;Western Europe;John Wiley and Sons Ltd;2009-2021;"Pharmaceutical Science (Q1); Analytical Chemistry (Q2); Environmental Chemistry (Q2); Spectroscopy (Q2)"
243;21511;Russian Chemical Reviews;journal;0036021X, 14684837;0.824;Q1;78;47;165;9348;448;162;2.61;198.89;United Kingdom;Western Europe;Turpion Ltd.;1970-2021;Chemistry (miscellaneous) (Q1)
244;4000150314;Chemical Biology and Drug Design;journal;17470277;0.818;-;82;153;543;5433;1456;524;2.58;35.51;United Kingdom;Western Europe;Blackwell;2006-2021;"Biochemistry (Q2); Molecular Medicine (Q3)"
245;23068;European Food Research and Technology;journal;14382385, 14382377;0.816;Q1;109;218;704;8282;1350;704;1.87;37.99;Germany;Western Europe;Springer Verlag;1996-2021;"Chemistry (miscellaneous) (Q1); Food Science (Q1); Industrial and Manufacturing Engineering (Q1); Biochemistry (Q2); Biotechnology (Q2)"
246;19700201640;Cholesterol;journal;20901283, 20901291;0.811;Q2;21;7;49;355;139;48;2.7;50.71;United States;Northern America;Hindawi Publishing Corporation;2010-2018;"Endocrinology, Diabetes and Metabolism (Q2); Hematology (Q2); Internal Medicine (Q2); Organic Chemistry (Q2)"
247;19700188457;Metal ions in life sciences;book series;20419821, 15590836;0.809;Q1;41;12;95;1162;244;87;2.37;96.83;Germany;Western Europe;Walter de Gruyter GmbH;2006-2007, 2010-2021;"Inorganic Chemistry (Q1); Biochemistry (Q2); Medicine (miscellaneous) (Q2)"
248;24680;Diamond and Related Materials;journal;09259635;0.804;Q1;116;132;618;4966;1351;616;2.29;37.62;Netherlands;Western Europe;Elsevier BV;1991-2021;"Chemistry (miscellaneous) (Q1); Electrical and Electronic Engineering (Q1); Electronic, Optical and Magnetic Materials (Q1); Materials Chemistry (Q1); Mechanical Engineering (Q1); Physics and Astronomy (miscellaneous) (Q2)"
249;27009;Oxidation of Metals;journal;0030770X, 15734889;0.804;Q1;80;76;198;2109;310;192;1.25;27.75;United States;Northern America;Springer New York;1969-2021;"Inorganic Chemistry (Q1); Materials Chemistry (Q1); Metals and Alloys (Q1)"
250;12179;Journal of Luminescence;journal;00222313;0.802;Q1;119;820;1723;28131;4867;1719;2.89;34.31;Netherlands;Western Europe;Elsevier;1970-2022;"Chemistry (miscellaneous) (Q1); Atomic and Molecular Physics, and Optics (Q2); Biochemistry (Q2); Biophysics (Q2); Condensed Matter Physics (Q2)"
251;26966;Journal of Photochemistry and Photobiology A: Chemistry;journal;18732666, 10106030;0.802;Q1;165;238;814;10277;2200;810;2.64;43.18;Netherlands;Western Europe;Elsevier;1987-2022;"Chemical Engineering (miscellaneous) (Q1); Chemistry (miscellaneous) (Q1); Physics and Astronomy (miscellaneous) (Q2)"
252;25242;Comments on Inorganic Chemistry;journal;02603594, 15489574;0.8;Q1;43;10;24;451;48;21;0.8;45.1;United Kingdom;Western Europe;Taylor and Francis Ltd.;1981-2021;Inorganic Chemistry (Q1)
253;26972;Journal of Solid State Chemistry;journal;1095726X, 00224596;0.799;Q1;148;389;1594;15340;3982;1591;2.26;39.43;United States;Northern America;Academic Press Inc.;1969-2021;"Ceramics and Composites (Q1); Inorganic Chemistry (Q1); Materials Chemistry (Q1); Condensed Matter Physics (Q2); Electronic, Optical and Magnetic Materials (Q2); Physical and Theoretical Chemistry (Q2)"
254;14123;Lipids;journal;15589307, 00244201;0.797;Q2;125;120;352;4752;807;347;2.06;39.6;Germany;Western Europe;"John Wiley &amp; Sons Inc.";1966-2021;"Biochemistry (Q2); Organic Chemistry (Q2); Cell Biology (Q3)"
255;26514;Tetrahedron Letters;journal;00404039, 18733581;0.796;Q2;173;1633;5074;61018;13333;5072;2.6;37.37;United Kingdom;Western Europe;Elsevier Ltd.;1959-2021;"Biochemistry (Q2); Drug Discovery (Q2); Organic Chemistry (Q2)"
256;25789;Bioorganic Chemistry;journal;00452068, 10902120;0.79;Q2;66;85;95;4196;228;91;2.34;49.36;United States;Northern America;Academic Press Inc.;1971-2021;"Biochemistry (Q2); Drug Discovery (Q2); Organic Chemistry (Q2); Molecular Biology (Q3)"
257;34587;International Journal of Polymeric Materials and Polymeric Biomaterials;journal;1563535X, 00914037;0.79;Q2;43;112;304;4288;929;304;3.52;38.29;United Kingdom;Western Europe;Taylor and Francis Ltd.;1971-2021;"Chemical Engineering (miscellaneous) (Q1); Polymers and Plastics (Q1); Analytical Chemistry (Q2)"
258;25762;Advances in Polymer Science;book series;00653195;0.789;Q2;118;50;166;7217;433;152;1.94;144.34;United States;Northern America;Springer New York;1958-1961, 1963-1964, 1969, 1976-1982, 1986-1987, 1990-2021;"Chemical Engineering (miscellaneous) (Q1); Polymers and Plastics (Q1); Organic Chemistry (Q2)"
259;24703;Journal of Crystal Growth;journal;00220248;0.786;Q2;155;709;2426;17481;4378;2399;1.91;24.66;Netherlands;Western Europe;Elsevier;1967-2021;"Materials Chemistry (Q1); Condensed Matter Physics (Q2); Inorganic Chemistry (Q2)"
260;19600157794;Electrocatalysis;journal;18682529, 18685994;0.785;Q2;39;52;130;2012;307;123;2.47;38.69;United States;Northern America;Springer Publishing Company;2010-2021;Electrochemistry (Q2)
261;21190;Drug Development and Industrial Pharmacy;journal;03639045, 15205762;0.783;Q2;90;198;556;7972;1193;547;2.08;40.26;United States;Northern America;Informa Healthcare;1974, 1976-2021;"Drug Discovery (Q2); Organic Chemistry (Q2); Pharmacology (Q2)"
262;12157;Journal of Electron Spectroscopy and Related Phenomena;journal;03682048;0.781;Q2;93;154;356;5280;581;349;1.71;34.29;Netherlands;Western Europe;Elsevier;1972-2021;"Atomic and Molecular Physics, and Optics (Q2); Condensed Matter Physics (Q2); Electronic, Optical and Magnetic Materials (Q2); Physical and Theoretical Chemistry (Q2); Radiation (Q2); Spectroscopy (Q2)"
263;14456;Polymer International;journal;10970126, 09598103;0.78;-;110;260;683;11062;1720;673;2.51;42.55;United Kingdom;Western Europe;John Wiley and Sons Ltd;1991-2021;Polymers and Plastics (Q1)
264;16395;Chemical Engineering Education (discontinued);journal;00092479;0.777;Q1;26;36;110;543;61;97;0.57;15.08;United States;Northern America;American Society for Engineering Education;1970, 1972-1975, 1977-1979, 1981-1990, 1993, 1996-2017;"Chemical Engineering (miscellaneous) (Q1); Chemistry (miscellaneous) (Q1)"
265;25194;Journal of Applied Electrochemistry;journal;15728838, 0021891X;0.776;Q2;116;148;397;5149;945;392;2.49;34.79;Netherlands;Western Europe;Springer Netherlands;1971-2021;"Chemical Engineering (miscellaneous) (Q1); Materials Chemistry (Q1); Electrochemistry (Q2)"
266;13900154734;Journal of the Taiwan Institute of Chemical Engineers;journal;18761070;0.774;Q1;91;381;432;14303;1358;427;3.28;37.54;Taiwan;Asiatic Region;Taiwan Institute of Chemical Engineers;2009-2021;"Chemical Engineering (miscellaneous) (Q1); Chemistry (miscellaneous) (Q1)"
267;25881;JAOCS, Journal of the American Oil Chemists' Society;journal;15589331, 0003021X;0.768;Q2;124;215;674;6939;1345;656;1.74;32.27;Germany;Western Europe;"John Wiley &amp; Sons Inc.";1947-2021;"Chemical Engineering (miscellaneous) (Q1); Organic Chemistry (Q2)"
268;18500157900;Food Additives and Contaminants - Part A Chemistry, Analysis, Control, Exposure and Risk Assessment;journal;19440057, 19440049;0.764;Q1;80;213;596;7351;1428;587;2.1;34.51;United Kingdom;Western Europe;Taylor and Francis Ltd.;2008-2021;"Chemistry (miscellaneous) (Q1); Food Science (Q1); Health, Toxicology and Mutagenesis (Q2); Medicine (miscellaneous) (Q2); Public Health, Environmental and Occupational Health (Q2); Toxicology (Q2)"
269;21744;Planta Medica;journal;14390221, 00320943;0.762;Q2;122;190;734;6845;1767;723;2.16;36.03;Germany;Western Europe;Georg Thieme Verlag;1961, 1965-2021;"Complementary and Alternative Medicine (Q1); Pharmaceutical Science (Q1); Analytical Chemistry (Q2); Drug Discovery (Q2); Organic Chemistry (Q2); Pharmacology (Q2); Molecular Medicine (Q3)"
270;27010;Photochemistry and Photobiology;journal;17511097, 00318655;0.761;Q2;138;185;561;7855;1379;545;2.31;42.46;United States;Northern America;Wiley-Blackwell;1962-2021;"Medicine (miscellaneous) (Q2); Physical and Theoretical Chemistry (Q2); Biochemistry (Q3)"
271;26586;Chemical Physics Letters;journal;00092614;0.755;Q2;240;863;2916;29821;5762;2908;1.94;34.56;Netherlands;Western Europe;Elsevier;1967-2021;"Physical and Theoretical Chemistry (Q2); Physics and Astronomy (miscellaneous) (Q2)"
272;26513;Tetrahedron Asymmetry;journal;1362511X, 09574166;0.753;Q2;109;209;753;9731;1730;753;2.31;46.56;United Kingdom;Western Europe;Elsevier Ltd.;1990-2017;"Inorganic Chemistry (Q2); Organic Chemistry (Q2); Physical and Theoretical Chemistry (Q2); Catalysis (Q3)"
273;21100244836;Journal of Energy Chemistry;journal;20954956;0.752;Q2;75;109;339;3755;840;331;2.57;34.45;Netherlands;Western Europe;Elsevier BV;2013-2022;"Energy Engineering and Power Technology (Q1); Energy (miscellaneous) (Q1); Fuel Technology (Q1); Electrochemistry (Q2)"
274;14500154746;International Journal for Ion Mobility Spectrometry;journal;18654584, 14356163;0.749;Q2;24;19;84;512;119;79;1.12;26.95;Germany;Western Europe;Springer Verlag;2008-2020;Spectroscopy (Q2)
275;12921;European Journal of Lipid Science and Technology;journal;14389312, 14387697;0.742;Q1;99;191;540;7682;1230;500;1.92;40.22;Germany;Western Europe;Wiley-VCH Verlag;2000-2021;"Chemistry (miscellaneous) (Q1); Food Science (Q1); Industrial and Manufacturing Engineering (Q1); Biotechnology (Q2)"
276;20623;Fire and Materials;journal;03080501, 10991018;0.741;Q1;61;58;144;1716;250;142;1.68;29.59;United Kingdom;Western Europe;John Wiley and Sons Ltd;1976, 1978-1989, 1991-2021;"Ceramics and Composites (Q1); Chemistry (miscellaneous) (Q1); Metals and Alloys (Q1); Polymers and Plastics (Q1); Electronic, Optical and Magnetic Materials (Q2)"
277;7700153115;Annual Reports in Computational Chemistry;book series;15741400;0.74;Q1;29;7;26;606;35;13;2.36;86.57;Netherlands;Western Europe;Elsevier BV;2005-2020;"Chemistry (miscellaneous) (Q1); Computational Mathematics (Q2)"
278;26370;Molecules;journal;14203049;0.738;Q1;171;1293;2822;60182;8395;2816;2.81;46.54;Switzerland;Western Europe;Multidisciplinary Digital Publishing Institute (MDPI);1992, 1996-2021;"Chemistry (miscellaneous) (Q1); Pharmaceutical Science (Q1); Analytical Chemistry (Q2); Drug Discovery (Q2); Medicine (miscellaneous) (Q2); Organic Chemistry (Q2); Physical and Theoretical Chemistry (Q2); Molecular Medicine (Q3)"
279;24571;X-Ray Spectrometry;journal;00498246, 10974539;0.736;Q2;47;49;223;966;309;215;1.34;19.71;United Kingdom;Western Europe;John Wiley and Sons Ltd;1972-2021;Spectroscopy (Q2)
280;23522;Electrochemical and Solid-State Letters;journal;10990062;0.722;Q2;146;0;494;0;1159;494;2.52;0;United States;Northern America;Electrochemical Society, Inc.;1998-2012;"Chemical Engineering (miscellaneous) (Q1); Electrical and Electronic Engineering (Q1); Electrochemistry (Q2); Materials Science (miscellaneous) (Q2); Physical and Theoretical Chemistry (Q2)"
