Rank;Sourceid;Title;Type;Issn;SJR;SJR Best Quartile;H index;Total Docs. (2006);Total Docs. (3years);Total Refs.;Total Cites (3years);Citable Docs. (3years);Cites / Doc. (2years);Ref. / Doc.;Country;Publisher;Coverage;Categories
311;28222;Journal of Neuroscience Nursing;journal;08880395;0.272;Q4;39;61;162;644;111;132;0.81;10,56;United States;Lippincott Williams & Wilkins Ltd.;1986-ongoing;"Medical and Surgical Nursing (Q1); Neurology (clinical) (Q3); Surgery (Q3); Endocrine and Autonomic Systems (Q4)"
312;14224;Arquivos de Neuro-Psiquiatria;journal;0004282X;0.271;Q4;44;216;655;4435;386;639;0.51;20,53;Brazil;Associacao Arquivos de Neuro-Psiquiatria Dr. Oswaldo Lange;1947-1965, 1971-ongoing;"Neurology (clinical) (Q3); Biological Psychiatry (Q4)"
313;16187;International MS Journal;journal;13528963, 14693410;0.271;Q4;23;15;68;464;45;64;0.58;30,93;United Kingdom;Cambridge Medical Publications;1997-2011;"Medicine (miscellaneous) (Q2); Neurology (clinical) (Q3); Neurology (Q4)"
314;17554;Acta Neuropsychiatrica;journal;16015215, 09242708;0.262;Q4;28;37;103;1584;66;95;0.81;42,81;United Kingdom;Cambridge University Press;1989-2004, 2006-ongoing;"Psychiatry and Mental Health (Q3); Biological Psychiatry (Q4)"
315;13742;International Tinnitus Journal;journal;09465448;0.259;Q4;27;29;104;632;49;98;0.39;21,79;United States;State University of New York, Health Science Center at Brooklyn;1998-ongoing;"Otorhinolaryngology (Q3); Speech and Hearing (Q3); Sensory Systems (Q4)"
316;145567;Pragmatics and Cognition;journal;15699943, 09290907;0.259;Q4;27;27;57;845;33;50;0.68;31,30;Netherlands;John Benjamins Publishing Company;2005-ongoing;"Computer Science (miscellaneous) (Q2); History and Philosophy of Science (Q2); Language and Linguistics (Q2); Linguistics and Language (Q2); Behavioral Neuroscience (Q4)"
317;17462;Neuropsychoanalysis;journal;15294145, 20443978;0.245;Q4;24;45;105;1204;34;62;0.53;26,76;United Kingdom;Taylor and Francis Ltd.;1999-ongoing;"Neuropsychology and Physiological Psychology (Q3); Neuroscience (miscellaneous) (Q4)"
318;18043;Neuroscience and Behavioral Physiology;journal;00970549;0.245;Q4;29;134;417;3428;159;417;0.32;25,58;United States;Kluwer Academic/Plenum Publishers;1972-1973, 1976-1978, 1980-ongoing;Neuroscience (miscellaneous) (Q4)
319;5700152857;Mind, Culture, and Activity;journal;10749039;0.238;Q4;44;19;57;856;38;44;1.33;45,05;United Kingdom;Taylor & Francis;1994-ongoing;"Cultural Studies (Q1); Anthropology (Q2); Language and Linguistics (Q2); Education (Q3); Social Psychology (Q3); Cognitive Neuroscience (Q4); Developmental and Educational Psychology (Q4)"
320;19307;Revue Neurologique;journal;00353787;0.238;Q4;41;234;643;7695;333;608;0.55;32,88;France;Elsevier Masson;1950-1961, 1963-ongoing;"Neurology (clinical) (Q3); Neurology (Q4)"
321;17438;Der Nervenarzt;journal;14330407, 00282804;0.232;Q4;40;175;517;5059;381;468;0.79;28,91;Germany;Springer Verlag;1947-ongoing;"Medicine (miscellaneous) (Q3); Neurology (clinical) (Q3); Psychiatry and Mental Health (Q3); Neurology (Q4)"
322;17700156422;Handbook of Chemical Neuroanatomy;book series;09248196;0.229;Q4;18;0;11;0;5;9;0.56;0,00;Netherlands;Elsevier BV;1996-1997, 1999-2000, 2002, 2005;Cellular and Molecular Neuroscience (Q4)
323;18743;Psychologie et NeuroPsychiatrie du Vieillissement;journal;17601703;0.221;Q4;15;28;142;1065;42;135;0.22;38,04;France;John Libbey Eurotext;2003-2010;"Geriatrics and Gerontology (Q3); Neurology (clinical) (Q3); Biological Psychiatry (Q4); Neuropsychology and Physiological Psychology (Q4)"
324;15633;Fortschritte der Neurologie Psychiatrie;journal;14393522, 07204299;0.212;Q4;30;90;266;2951;162;222;0.75;32,79;Germany;Georg Thieme Verlag;1955-1963, 1973-ongoing;"Medicine (miscellaneous) (Q3); Neurology (clinical) (Q3); Psychiatry and Mental Health (Q3); Neurology (Q4)"
325;17600155117;Devenir;journal;10158154;0.21;Q4;10;21;44;620;7;43;0.13;29,52;Switzerland;Editions Medecine et Hygiene;2001-ongoing;"Life-span and Life-course Studies (Q3); Pediatrics (Q3); Pediatrics, Perinatology and Child Health (Q3); Developmental and Educational Psychology (Q4); Developmental Neuroscience (Q4)"
326;21100778814;Brain and Mind;journal;13891987, 15733300;0.206;Q4;17;0;23;0;29;21;0.0;0,00;Netherlands;Kluwer Academic Publishers;2000-2003;Neuroscience (miscellaneous) (Q4)
327;144726;Reviews in Neurological Diseases;journal;15452913;0.205;Q4;21;29;78;801;29;70;0.41;27,62;United States;MedReviews;2004-2011;"Neurology (clinical) (Q3); Neurology (Q4)"
328;17551;Acta Neurologica Taiwanica;journal;1028768X;0.2;Q4;21;53;117;997;43;110;0.6;18,81;Taiwan;Taiwan Neurological Society;1997-ongoing;"Medicine (miscellaneous) (Q3); Neurology (clinical) (Q3); Neurology (Q4)"
329;17992;Neurophysiology;journal;15739007, 00902977;0.197;Q4;11;64;167;1467;36;164;0.2;22,92;United States;Kluwer Academic/Plenum Publishers;1969-ongoing;"Neuroscience (miscellaneous) (Q4); Physiology (Q4)"
330;15127;Bulletin de la Societe Belge d'Ophtalmologie;journal;00810746;0.196;Q4;21;39;105;555;44;105;0.36;14,23;Belgium;Societe Belge d'Ophtalmologie;1951-2013;"Ophthalmology (Q3); Sensory Systems (Q4)"
331;16091;Homeostasis in Health and Disease;journal;09607560;0.193;Q4;10;47;125;516;13;124;0.11;10,98;Czech Republic;Collegium Internationale Activitatis Nervosae Superioris;1991-1992, 1994-2001, 2003-2006;"Psychiatry and Mental Health (Q3); Neuroscience (miscellaneous) (Q4)"
332;19400156832;Brain Impairment;journal;14439646;0.19;Q4;18;0;15;0;6;14;0.43;0,00;United Kingdom;Cambridge University Press;2004, 2008-ongoing;"Neurology (clinical) (Q3); Behavioral Neuroscience (Q4); Cognitive Neuroscience (Q4); Neurology (Q4); Neuropsychology and Physiological Psychology (Q4); Speech and Hearing (Q4)"
333;19700180720;Handbook of Clinical Neurophysiology;book series;15674231;0.188;Q4;11;45;224;4309;46;217;0.19;95,76;Netherlands;Elsevier BV;2003-2005, 2008, 2010, 2013;"Neurology (clinical) (Q3); Neuroscience (miscellaneous) (Q4)"
334;21100204931;Sistemi Intelligenti;journal;11209550;0.188;Q4;7;6;103;115;5;97;0.07;19,17;Italy;Il Mulino publishing house;2011-ongoing;"Language and Linguistics (Q2); Linguistics and Language (Q2); Artificial Intelligence (Q4); Cognitive Neuroscience (Q4); Experimental and Cognitive Psychology (Q4)"
335;17491;Neuroembryology;journal;14248530, 14248522;0.18;Q4;10;0;22;0;9;22;0.0;0,00;Switzerland;S. Karger AG;2002-2003;"Developmental Biology (Q4); Developmental Neuroscience (Q4); Embryology (Q4); Neuroscience (miscellaneous) (Q4)"
336;18055;Neuroscience Research Communications;journal;15206769, 08936609;0.17800000000000002;Q4;18;0;92;0;27;90;0.3;0,00;United States;John Wiley & Sons Inc.;1987-2004;Neuroscience (miscellaneous) (Q4)
337;130153;Sleep and Biological Rhythms;journal;14469235, 14798425;0.174;Q4;25;35;163;927;47;156;0.21;26,49;Germany;Springer Verlag;2004-ongoing;"Neurology (Q4); Neuropsychology and Physiological Psychology (Q4); Physiology (Q4); Physiology (medical) (Q4)"
338;19700180838;Blue Books of Practical Neurology;book series;18773419;0.168;Q4;6;0;68;0;22;62;0.0;0,00;Netherlands;Elsevier BV;2001-2004;"Neurology (clinical) (Q3); Neurology (Q4)"
339;5300152517;International Journal on Disability and Human Development;journal;21910367, 21911231;0.16699999999999998;Q4;22;63;110;1312;9;106;0.09;20,83;Germany;Walter de Gruyter GmbH;2006-ongoing;"Advanced and Specialized Nursing (Q3); Geriatrics and Gerontology (Q3); Rehabilitation (Q3); Psychiatry and Mental Health (Q4); Sensory Systems (Q4); Speech and Hearing (Q4)"
340;15873;Journal of Clinical Neuromuscular Disease;journal;15220443;0.166;Q4;24;33;89;833;25;85;0.18;25,24;United States;Lippincott Williams & Wilkins Ltd.;1999-ongoing;"Medicine (miscellaneous) (Q3); Neurology (clinical) (Q3); Neurology (Q4)"
341;16819;Journal of the History of the Neurosciences;journal;0964704X;0.166;Q4;23;35;111;1231;35;98;0.38;35,17;United Kingdom;Taylor & Francis;1992-ongoing;"History and Philosophy of Science (Q3); Neurology (clinical) (Q3); Neuroscience (miscellaneous) (Q4)"
342;16858;L.O.G.O.S. Interdisziplinair;journal;0944405X;0.166;Q4;6;37;54;410;5;52;0.1;11,08;Netherlands;Elsevier BV;2004-ongoing;"Biological Psychiatry (Q4); Psychiatry and Mental Health (Q4)"
343;24068;Zhurnal Vysshei Nervnoi Deyatelnosti Imeni I.P. Pavlova;journal;00444677;0.16;Q4;13;73;285;2190;53;285;0.12;30,00;Russian Federation;Maik Nauka Publishing / Springer SBM;1951-ongoing;"Medicine (miscellaneous) (Q3); Neuroscience (miscellaneous) (Q4)"
344;17970;Neurology Psychiatry and Brain Research;journal;09419500;0.158;Q4;15;44;76;1236;19;75;0.27;28,09;Germany;Elsevier GmbH;1992-ongoing;"Neurology (clinical) (Q3); Neuroscience (miscellaneous) (Q4); Psychiatry and Mental Health (Q4)"
345;14322;Brain and Nerve;journal;00068969;0.157;Q4;18;140;418;2336;80;417;0.18;16,69;Japan;Igaku-Shoin Ltd.;1960-2008;Neuroscience (miscellaneous) (Q4)
346;71103;Neurology and Clinical Neurophysiology;journal;15268748;0.155;Q4;15;0;120;0;29;120;0.24;0,00;United States;American Academy of Clinical Neurophysiology;2000-2005;"Medicine (miscellaneous) (Q3); Neuroscience (miscellaneous) (Q4)"
347;130045;Journal of Applied Biomedicine;journal;12140287, 1214021X;0.154;Q4;26;22;26;952;21;23;0.91;43,27;Spain;Elsevier Espana;2005-ongoing;"Agricultural and Biological Sciences (miscellaneous) (Q3); Biochemistry, Genetics and Molecular Biology (miscellaneous) (Q3); Medicine (miscellaneous) (Q3); Pharmacology, Toxicology and Pharmaceutics (miscellaneous) (Q3); Neuroscience (miscellaneous) (Q4)"
348;145096;Neuropsychopharmacologia Hungarica : a Magyar Pszichofarmakologiai Egyesulet lapja = official journal of the Hungarian Association of Psychopharmacology;journal;14198711;0.154;Q4;14;27;61;553;18;50;0.36;20,48;Hungary;Neuroline;2004-ongoing;"Pharmacology, Toxicology and Pharmaceutics (miscellaneous) (Q3); Neurology (clinical) (Q4); Neuropsychology and Physiological Psychology (Q4); Neuroscience (miscellaneous) (Q4)"
349;144733;Phenomenology and the Cognitive Sciences;journal;15687759;0.152;Q4;33;18;28;758;11;28;0.39;42,11;Netherlands;Kluwer Academic Publishers;2004-ongoing;"Philosophy (Q2); Cognitive Neuroscience (Q4)"
350;84371;Eye Tracking Research and Applications Symposium (ETRA);conference and proceedings;00002004, 00002002, 00002005, 00002010, 00002008;0.15;-;40;0;70;0;40;67;0.6;0,00;United States;;2002, 2004-2005, 2008, 2010;"Computer Vision and Pattern Recognition; Human-Computer Interaction; Ophthalmology; Sensory Systems"
351;16893;Biogenic Amines;journal;15693910, 01688561;0.145;Q4;14;19;85;479;17;82;0.23;25,21;Netherlands;V S P;1989-2007;"Neuroscience (miscellaneous) (Q4); Pharmacology (Q4)"
352;11700154377;Journal of Individual Differences;journal;16140001;0.14300000000000002;Q4;29;24;11;1078;4;10;0.4;44,92;United States;Hogrefe & Huber Publishers;2005-ongoing;"Biological Psychiatry (Q4); Psychology (miscellaneous) (Q4)"
353;19292;Revue de Neuropsychologie;journal;11554452;0.14300000000000002;Q4;10;0;27;0;4;26;0.08;0,00;France;Association pour la Diffusion des Recherches en Sciences Cognitives de Langue Francaise;1996-2004;"Neuroscience (miscellaneous) (Q4); Psychology (miscellaneous) (Q4)"
354;13871;Eye Science;journal;10004432;0.141;Q4;11;55;189;86;18;189;0.07;1,56;China;Sun Yat-sen University of Medical Sciences;1985-2008, 2010-2015;"Medicine (miscellaneous) (Q3); Ophthalmology (Q4); Sensory Systems (Q4)"
355;11600153416;Current Protocols in Neuroscience;journal;19348584, 19348576;0.13;Q4;32;21;58;43;19;58;0.34;2,05;United States;Wiley-Liss Inc;2001-ongoing;"Medicine (miscellaneous) (Q3); Neuroscience (miscellaneous) (Q4)"
356;40483;Ideggyogyaszati Szemle;journal;00191442;0.129;Q4;13;51;114;993;16;114;0.13;19,47;Hungary;Kiadja Es Terjeszti A Literatura Medica;1954-1964, 1973-1985, 2002-ongoing;"Neurology (Q4); Neurology (clinical) (Q4)"
357;91878;Archivos de Neurociencias;journal;10285938;0.126;Q4;5;45;131;1571;7;113;0.05;34,91;Mexico;Instituto Nacional de Neurologia y Neurocirugia Manuel Velosco Suarez;1999-ongoing;"Neurology (Q4); Neurology (clinical) (Q4)"
358;7200153153;Journal of Epilepsy and Clinical Neurophysiology;journal;16762649;0.126;Q4;10;49;118;1136;15;112;0.16;23,18;Brazil;Liga Brasileira de Epilepsia;2001-2012;"Neurology (Q4); Neurology (clinical) (Q4); Physiology (medical) (Q4)"
359;18744;Psychoneuro;journal;16119991;0.126;Q4;8;95;273;1282;51;227;0.25;13,49;Germany;Georg Thieme Verlag;2003-2008;"Neuroscience (miscellaneous) (Q4); Pharmacology (medical) (Q4); Psychiatry and Mental Health (Q4); Psychology (miscellaneous) (Q4)"
360;19700180775;NeuroImmune Biology;book series;15677443;0.124;Q4;10;0;77;0;7;69;0.16;0,00;Netherlands;Elsevier BV;2001-2003, 2005, 2007-2010;"Immunology (Q4); Neurology (Q4); Neurology (clinical) (Q4)"
361;19287;Revista Ecuatoriana de Neurologia;journal;10198113;0.123;Q4;4;25;52;574;2;47;0.0;22,96;Ecuador;Sociedad Ecuatoriana de Neurologia;1992-2012, 2015-ongoing;"Neurology (Q4); Neurology (clinical) (Q4)"
362;147230;Neuroembryology and Aging;journal;16613406, 16613414;0.117;Q4;9;14;16;677;2;13;0.15;48,36;Switzerland;Karger AG;2004-2008;"Aging (Q4); Developmental Biology (Q4); Developmental Neuroscience (Q4); Embryology (Q4); Neuroscience (miscellaneous) (Q4)"
363;4000149005;Clinical Psychopharmacology and Neuroscience;journal;17381088;0.114;Q4;22;7;7;243;1;7;0.14;34,71;South Korea;Korean College of Neuropsychopharmacology;2005-ongoing;"Behavioral Neuroscience (Q4); Pharmacology (medical) (Q4); Psychiatry and Mental Health (Q4)"
364;19700177331;Zeitschrift fur Neuropsychologie;journal;1016264X;0.114;Q4;11;0;34;0;8;32;0.0;0,00;Switzerland;Verlag Hans Huber AG;1999-2003, 2010-ongoing;"Cognitive Neuroscience (Q4); Neuropsychology and Physiological Psychology (Q4); Psychiatry and Mental Health (Q4)"
365;15512;Epilepsies;journal;11496576;0.112;Q4;8;43;136;1130;8;118;0.07;26,28;France;John Libbey Eurotext;1989-2010;"Neurology (Q4); Neurology (clinical) (Q4)"
366;14924;Confinia Cephalalgica;journal;11220279;0.111;Q4;3;14;49;199;2;37;0.0;14,21;France;Masson Publishing;1993-ongoing;"Neurology (Q4); Neurology (clinical) (Q4)"
367;17606;African Journal of Neurological Sciences;journal;10158618, 19922647;0.11;Q4;10;25;64;364;2;55;0.03;14,56;Egypt;Pan African Association of Neurological Sciences;1982, 1988-1999, 2001-2017 (cancelled);"Neurology (Q4); Neurology (clinical) (Q4)"
368;5300152235;Neuroscience Bulletin;journal;16737067;0.109;Q4;35;57;142;1381;10;142;0.08;24,23;China;Springer Singapore;2005-ongoing;"Medicine (miscellaneous) (Q4); Neuroscience (miscellaneous) (Q4); Physiology (Q4)"
369;4700151920;Rivista Italiana di Neurobiologia;journal;00356336;0.108;Q4;2;14;20;576;1;19;0.05;41,14;Italy;Societa dei neurologi, neurochirurghi e neuroradiologi ospedalieri;1961, 1964-1965, 2005-2009;"Neurology (clinical) (Q4); Neuroscience (miscellaneous) (Q4)"
370;18671;Psychiatria et Neurologia Japonica - Seishin Shinkeigaku Zasshi;journal;00332658;0.107;Q4;12;177;408;1058;28;406;0.03;5,98;Japan;Japanese Society of Psychiatry and Neurology;1963-ongoing;"Medicine (miscellaneous) (Q4); Neuroscience (miscellaneous) (Q4)"
371;17500155017;Medecine du Sommeil;journal;17694493;0.106;Q4;4;36;56;787;3;50;0.06;21,86;France;Elsevier Masson;2004-ongoing;"Behavioral Neuroscience (Q4); Cognitive Neuroscience (Q4); Neurology (Q4); Neurology (clinical) (Q4); Neuropsychology and Physiological Psychology (Q4)"
372;3300147817;EMC - Neurologie;journal;17624231;0.105;Q4;4;0;65;0;3;64;0.05;0,00;France;Editions scientifique et medicales Elsevier SAS;2004-2005;"Neurology (Q4); Neurology (clinical) (Q4)"
373;71051;Psyche;journal;1039723X;0.105;Q4;15;69;44;1000;3;44;0.07;14,49;United States;Association for the Scientific Study of Conciousness;1997-1998, 2000-2007, 2010;"Philosophy (Q3); Artificial Intelligence (Q4); Cognitive Neuroscience (Q4); Experimental and Cognitive Psychology (Q4)"
374;17300154985;Autism Research;journal;19393792, 19393806;0.102;Q4;53;0;0;0;0;0;0.0;0,00;United States;John Wiley & Sons Inc.;2008-ongoing;"Genetics (clinical) (Q4); Neurology (clinical) (Q4); Neuroscience (miscellaneous) (Q4)"
375;20011;Chinese Journal of Neurology;journal;10067876;0.102;Q4;8;137;334;1655;17;305;0.06;12,08;China;Zhonghua Yixeuehui Zazhishe/Chinese Medical Association Publishing House;1959, 1997-ongoing;"Neurology (Q4); Neurology (clinical) (Q4)"
376;144607;Neuroforum;journal;09470875;0.102;Q4;3;13;13;56;1;11;0.09;4,31;Germany;Walter de Gruyter GmbH;2005-ongoing;"Neurology (Q4); Neurology (clinical) (Q4)"
377;15624;Focus on Parkinson's Disease;journal;09242015;0.101;Q4;2;4;17;105;0;14;0.0;26,25;Netherlands;PMSI Bugamor BV;1997-2009, 2011-2014;"Neurology (Q4); Neurology (clinical) (Q4)"
378;17700155012;Handbook of Clinical Neurology;book series;00729752;0.101;Q4;41;64;36;6344;0;33;0.0;99,13;United States;Elsevier Science Inc.;2003-2004, 2006-ongoing;"Medicine (miscellaneous) (Q4); Neurology (Q4); Neurology (clinical) (Q4)"
379;19700180767;Practical Logic of Cognitive Systems;book series;18745075;0.101;Q4;0;0;31;0;0;28;0.0;0,00;Netherlands;Elsevier BV;2003, 2005;"Computer Science (miscellaneous) (Q4); Experimental and Cognitive Psychology (Q4); Logic (Q4); Mathematics (miscellaneous) (Q4); Neuroscience (miscellaneous) (Q4)"
380;130169;Sinapse;journal;1645281X;0.101;Q4;5;45;15;1167;0;15;0.0;25,93;Portugal;Sociedade Portuguesa de Neurologia;2005-ongoing;"Cellular and Molecular Neuroscience (Q4); Neurology (clinical) (Q4)"
381;5100155028;Acta Endocrinologica;journal;1843066X, 18410987;0.1;Q4;10;0;42;0;0;37;0.0;0,00;Romania;Acta Endocrinologica Foundation;2008-ongoing;"Endocrine and Autonomic Systems (Q4); Endocrinology (Q4); Endocrinology, Diabetes and Metabolism (Q4)"
382;13865;Evidence-Based Eye Care;journal;15364836, 15258599;0.1;Q4;4;0;220;0;0;206;0.0;0,00;United States;Lippincott Williams & Wilkins Ltd.;2001-2005;"Ophthalmology (Q4); Sensory Systems (Q4)"
383;15680;Giornale di Neuropsicofarmacologia;journal;03919048;0.1;Q4;1;15;79;273;0;70;0.0;18,20;Italy;C I C Edizioni International srl;1996-2008;"Neurology (clinical) (Q4); Neuropsychology and Physiological Psychology (Q4); Neuroscience (miscellaneous) (Q4); Pharmaceutical Science (Q4); Pharmacology (Q4); Pharmacology (medical) (Q4); Psychiatry and Mental Health (Q4)"
384;19909;Journal of the Japan Epilepsy Society;journal;09120890, 13475509;0.1;Q4;3;7;56;135;1;54;0.02;19,29;Japan;Nihon Tenkan Gakkai/Japan Epilepsy Society;1983-ongoing;"Neurology (Q4); Neurology (clinical) (Q4)"
385;145645;Research and Practice in Alzheimer's Disease;journal;12848360;0.1;Q4;4;60;58;719;1;57;0.03;11,98;France;SERDI Publisher;2003, 2005-2007;"Aging (Q4); Biological Psychiatry (Q4); Geriatrics and Gerontology (Q4); Neuropsychology and Physiological Psychology (Q4)"
386;4700152282;Alzheimer's Care Quarterly;journal;15253279;;-;7;37;0;771;0;0;0.0;20,84;United States;Aspen Publishers;2006-2007;"Geriatrics and Gerontology; Gerontology; Neuropsychology and Physiological Psychology; Neuroscience (miscellaneous)"
387;6500153245;Brain Cell Biology;journal;15597105, 15597113;;-;20;21;0;865;0;0;0.0;41,19;United States;Kluwer Academic Publishers;2006, 2008;"Cell Biology; Cellular and Molecular Neuroscience"
388;4000151712;Chinese Journal of Contemporary Neurology and Neurosurgery;journal;16726731;;-;8;37;0;474;0;0;0.0;12,81;China;Tianjin Huanhu Hospital;2006-ongoing;"Neurology; Neurology (clinical)"
389;17700156533;Handbook of Behavioral Neuroscience;book series;15697339;;-;19;37;0;4004;0;0;0.0;108,22;Netherlands;Elsevier BV;2006, 2008-2010, 2013, 2016-ongoing;"Behavioral Neuroscience; Cognitive Neuroscience"
390;4200151402;International Journal of Stroke;journal;17474930, 17474949;;-;59;63;0;1603;0;0;0.0;25,44;United States;SAGE Publications;2006-ongoing;Neurology
391;5800179587;Journal of Brachial Plexus and Peripheral Nerve Injury;journal;17497221;;-;19;9;0;193;0;0;0.0;21,44;United Kingdom;BioMed Central;2006-ongoing;"Neurology; Neurology (clinical)"
392;16666;Journal of Brain Science;journal;13415301;;-;4;7;0;89;0;0;0.0;12,71;United States;PJD Publications Ltd.;1997-1999, 2006-2009, 2011-2013, 2016-ongoing;Neuroscience (miscellaneous)
393;4700152872;Journal of NeuroImmune Pharmacology;journal;15571890, 15571904;;-;64;40;0;3423;0;0;0.0;85,58;Germany;Springer Verlag;2006-ongoing;"Immunology; Immunology and Allergy; Neuroscience (miscellaneous); Pharmacology"
394;4000152109;Journal of Pediatric Neurosciences;journal;19983948, 18171745;;-;14;26;0;419;0;0;0.0;16,12;India;Medknow Publications;2006-ongoing;"Neuroscience (miscellaneous); Pediatrics, Perinatology and Child Health"
395;19900191993;Journal of Visualized Experiments;journal;1940087X;;-;67;32;0;82;0;0;0.0;2,56;United States;MYJoVE Corporation;2006-ongoing;"Biochemistry, Genetics and Molecular Biology (miscellaneous); Chemical Engineering (miscellaneous); Immunology and Microbiology (miscellaneous) ; Neuroscience (miscellaneous)"
396;5700191214;Molecular Neurodegeneration;journal;17501326;;-;66;19;0;1233;0;0;0.0;64,89;United Kingdom;BioMed Central;2006-ongoing;"Cellular and Molecular Neuroscience; Molecular Biology; Neurology (clinical)"
397;7000153261;Neural Development;journal;17498104;;-;46;3;0;0;0;0;0.0;0,00;United Kingdom;BioMed Central;2006-ongoing;Developmental Neuroscience
398;17400154834;Neural Regeneration Research;journal;16735374;;-;24;1;0;16;0;0;0.0;16,00;China;Medknow Publications;2008-ongoing;Developmental Neuroscience
399;19700183500;Neurology, Neurophysiology and Neuroscience;journal;19331266;;-;4;6;0;87;0;0;0.0;14,50;United States;Neuroscience Publications;2006-2007;"Medicine (miscellaneous); Neurology; Neurology (clinical)"
400;4100151703;Neuropsychiatric Disease and Treatment;journal;11766328;;-;55;69;0;3465;0;0;0.0;50,22;New Zealand;Dove Medical Press Ltd;2006-ongoing;"Biological Psychiatry; Psychiatry and Mental Health"
401;21100371966;Open Life Sciences;journal;23915412;;-;28;38;0;1901;0;0;0.0;50,03;Germany;Walter de Gruyter GmbH;2015-ongoing;"Agricultural and Biological Sciences (miscellaneous); Biochemistry, Genetics and Molecular Biology (miscellaneous); Immunology and Microbiology (miscellaneous) ; Neuroscience (miscellaneous)"
402;10800153315;Progress in Neurotherapeutics and Neuropsychopharmacology;journal;17482321;;-;4;16;0;469;0;0;0.0;29,31;United Kingdom;Cambridge University Press;2008;"Neurology; Neurology (clinical); Psychiatry and Mental Health"
403;4000151608;Psychiatry Investigation;journal;17383684;;-;26;25;0;870;0;0;0.0;34,80;South Korea;Korean Neuropsychiatric Association;2006-ongoing;"Biological Psychiatry; Psychiatry and Mental Health"
404;7000153204;Social Cognitive and Affective Neuroscience;journal;17495024, 17495016;;-;87;30;0;270;0;0;0.0;9,00;United Kingdom;Oxford University Press;2006-ongoing;"Cognitive Neuroscience; Experimental and Cognitive Psychology; Medicine (miscellaneous)"
405;5800179612;Social Neuroscience;journal;17470919, 17470927;;-;56;34;0;180;0;0;0.0;5,29;United Kingdom;Taylor & Francis;2006-ongoing;"Behavioral Neuroscience; Development; Social Psychology"
406;12100155713;The Mental Lexicon;journal;18711340;;-;21;13;0;549;0;0;0.0;42,23;Netherlands;John Benjamins Publishing Company;2009-ongoing;"Cognitive Neuroscience; Language and Linguistics; Linguistics and Language"
407;4700152448;Yeni Symposium;journal;13044591, 13008773;;-;6;22;0;640;0;0;0.0;29,09;Turkey;Cerrahpasa Tip Fakultesi Psikiyatri Klinigi;2006-ongoing;"Biological Psychiatry; Neurology (clinical); Psychiatry and Mental Health"
