Rank;Sourceid;Title;Type;Issn;SJR;SJR Best Quartile;H index;Total Docs. (2002);Total Docs. (3years);Total Refs.;Total Cites (3years);Citable Docs. (3years);Cites / Doc. (2years);Ref. / Doc.;Country;Region;Publisher;Coverage;Categories
181;18886;Sexuality and Disability;journal;15736717, 01461044;0.27;Q2;42;25;80;834;49;68;0.63;33.36;United States;Northern America;Kluwer Academic/Human Sciences Press Inc.;1978-1987, 1991-2021;"Physical Therapy, Sports Therapy and Rehabilitation (Q2); Rehabilitation (Q2)"
182;12400154722;Informatics for Health and Social Care;journal;17538157;0.266;Q3;40;26;66;534;60;64;0.68;20.54;United Kingdom;Western Europe;Informa Healthcare;1976-1995, 2008-2021;"Nursing (miscellaneous) (Q2); Health Informatics (Q3); Health Information Management (Q3)"
183;15746;Pediatric Physical Therapy;journal;08985669, 1538005X;0.261;Q2;50;36;82;531;26;70;0.2;14.75;United States;Northern America;Lippincott Williams and Wilkins Ltd.;1989-2021;"Medicine (miscellaneous) (Q2); Physical Therapy, Sports Therapy and Rehabilitation (Q2); Pediatrics, Perinatology and Child Health (Q3)"
184;16805;Journal of Music Therapy;journal;00222917;0.257;Q1;51;16;52;465;30;52;0.54;29.06;United States;Northern America;American Music Therapy Association, Inc.;1964-2021;"Complementary and Manual Therapy (Q1); Music (Q1); Medicine (miscellaneous) (Q2)"
185;16780;International Journal of Rehabilitation Research;journal;03425282, 14735660;0.256;Q2;54;47;146;1135;84;146;0.4;24.15;United States;Northern America;Lippincott Williams and Wilkins Ltd.;1978-2021;"Medicine (miscellaneous) (Q2); Physical Therapy, Sports Therapy and Rehabilitation (Q2); Rehabilitation (Q2)"
186;16981;Rehabilitacia;journal;00338680, 03750922;0.25;Q2;9;30;94;317;10;94;0.14;10.57;Slovakia;Eastern Europe;Liecreh s.r.o.;1980-1990, 1995-2021;"Physical Therapy, Sports Therapy and Rehabilitation (Q2); Rehabilitation (Q2)"
187;15033;Deafness and Education International;journal;14643154, 1557069X;0.239;Q3;23;12;38;162;18;38;0.38;13.5;United Kingdom;Western Europe;Maney Publishing;1999-2021;"Education (Q3); Speech and Hearing (Q3)"
188;23710;Journal of Medical Systems;journal;01485598, 1573689X;0.238;Q4;89;49;112;1197;62;110;0.39;24.43;United States;Northern America;Springer New York;1977-2021;"Medicine (miscellaneous) (Q2); Health Informatics (Q3); Information Systems (Q3); Health Information Management (Q4)"
189;13795;Contact Lens and Anterior Eye;journal;14765411, 13670484;0.237;Q2;54;16;62;648;27;51;0.35;40.5;Netherlands;Western Europe;Elsevier;1997-2021;"Medicine (miscellaneous) (Q2); Optometry (Q2); Ophthalmology (Q3)"
190;14315;Journal of Developmental and Physical Disabilities;journal;1056263X, 15733580;0.237;Q2;47;30;75;785;24;75;0.24;26.17;United States;Northern America;Springer New York;1991-2021;"Physical Therapy, Sports Therapy and Rehabilitation (Q2); Developmental and Educational Psychology (Q4)"
191;18019;NeuroRehabilitation;journal;10538135, 18786448;0.237;Q3;69;49;120;2022;58;102;0.51;41.27;Netherlands;Western Europe;IOS Press BV;1991-2021;"Rehabilitation (Q2); Neurology (clinical) (Q3); Physical Therapy, Sports Therapy and Rehabilitation (Q3)"
192;29285;Journal of Vocational Rehabilitation;journal;10522263, 18786316;0.234;Q3;40;32;127;765;28;104;0.15;23.91;Netherlands;Western Europe;IOS Press BV;1991-2021;"Rehabilitation (Q2); Occupational Therapy (Q3)"
193;14367;Seminars in Speech and Language;journal;10989056, 07340478;0.233;Q3;44;35;75;1183;36;75;0.41;33.8;United States;Northern America;Thieme Medical Publishers Inc.;1984-1991, 1995-2021;"LPN and LVN (Q2); Speech and Hearing (Q3)"
194;19530;Sportverletzung-Sportschaden;journal;14391236, 09320555;0.233;Q4;22;25;74;292;34;71;0.3;11.68;Germany;Western Europe;Georg Thieme Verlag;1987-2021;"Medicine (miscellaneous) (Q2); Orthopedics and Sports Medicine (Q3); Sports Science (Q4)"
195;19582;Studies in Health Technology and Informatics;journal;09269630;0.233;Q4;61;570;1585;5885;573;1554;0.33;10.32;Netherlands;Western Europe;IOS Press BV;1991, 1993-2021;"Biomedical Engineering (Q3); Health Informatics (Q3); Health Information Management (Q4)"
196;15900;Journal of Extra-Corporeal Technology;journal;00221058;0.231;Q2;36;42;104;749;53;93;0.56;17.83;United States;Northern America;American Society of Extra-Corporeal Technology;1975-2021;"Health Professions (miscellaneous) (Q2); Medicine (miscellaneous) (Q2); Cardiology and Cardiovascular Medicine (Q3)"
197;14655;Optometry;journal;15581527, 15291839;0.228;Q2;39;114;284;1323;88;249;0.21;11.61;United States;Northern America;Elsevier Inc.;1999-2012;"Medicine (miscellaneous) (Q2); Optometry (Q2)"
198;16262;Advances in Physiotherapy;journal;16511948, 14038196;0.222;Q3;27;23;56;636;25;50;0.27;27.65;United Kingdom;Western Europe;Informa Healthcare;1999-2012;Physical Therapy, Sports Therapy and Rehabilitation (Q3)
199;12100156754;Sport Management Review;journal;14413523;0.22;Q4;63;8;30;436;10;30;0.45;54.5;Netherlands;Western Europe;Elsevier BV;1998-2021;"Business and International Management (Q2); Marketing (Q3); Organizational Behavior and Human Resource Management (Q3); Strategy and Management (Q3); Tourism, Leisure and Hospitality Management (Q3); Management Science and Operations Research (Q4); Sports Science (Q4)"
200;16320;Critical Reviews in Physical and Rehabilitation Medicine;journal;21626553, 08962960;0.216;Q3;17;14;45;1555;15;45;0.21;111.07;United States;Northern America;Begell House Inc.;1995-2021;"Rehabilitation (Q2); Physical Therapy, Sports Therapy and Rehabilitation (Q3)"
201;26097;Australian Journal of Clinical Hypnotherapy and Hypnosis;journal;08100713;0.212;Q2;6;12;29;220;6;24;0.24;18.33;Australia;Pacific Region;Australian Society of Clinical Hypnotherapists;1982-2015, 2017-2018;"Complementary and Manual Therapy (Q2); Clinical Psychology (Q3)"
202;26548;Contemporary Hypnosis;journal;09605290;0.212;Q2;23;20;63;558;22;59;0.47;27.9;United Kingdom;Western Europe;John Wiley and Sons Ltd;1996-2009;"Complementary and Manual Therapy (Q2); Clinical Psychology (Q3)"
203;17048;Physikalische Medizin Rehabilitationsmedizin Kurortmedizin;journal;1439085X, 09406689;0.212;Q3;18;35;108;749;36;103;0.41;21.4;Germany;Western Europe;Georg Thieme Verlag;1991-2021;"Physical Therapy, Sports Therapy and Rehabilitation (Q3); Rehabilitation (Q3); Sports Science (Q4)"
204;14366;Seminars in Hearing;journal;07340451, 10988955;0.211;Q3;29;40;108;1118;25;90;0.25;27.95;United States;Northern America;Thieme Medical Publishers Inc.;1986-2021;Speech and Hearing (Q3)
205;75220;Therapeutic Communities;journal;09641866;0.21;Q2;17;27;76;364;8;59;0.08;13.48;United Kingdom;Western Europe;Emerald Group Publishing Ltd.;1992-2021;"Health Professions (miscellaneous) (Q2); Clinical Psychology (Q3); Psychiatry and Mental Health (Q3)"
206;11800154592;Journal of Sports Economics;journal;15270025, 15527794;0.208;Q4;51;23;54;432;15;52;0.28;18.78;United Kingdom;Western Europe;SAGE Publications Ltd;2000-2021;"Economics, Econometrics and Finance (miscellaneous) (Q2); Sports Science (Q4)"
207;21102;Pharmaceutical Journal;journal;00316873;0.208;-;28;2882;1642;1404;124;572;0.06;0.49;United Kingdom;Western Europe;Pharmaceutical Press;1945-1949, 1994-2012, 2014-2017;"Pharmaceutical Science (Q2); Pharmacology (Q3)"
208;21100219304;International Journal of Therapy and Rehabilitation;journal;17411645, 1759779X;0.205;Q3;26;81;264;1373;41;208;0.17;16.95;United Kingdom;Western Europe;Mark Allen Publishing Ltd.;1996-2021;"Physical Therapy, Sports Therapy and Rehabilitation (Q3); Rehabilitation (Q3)"
209;14033;Psychology of Sport and Exercise;journal;14690292;0.205;Q4;99;17;22;1050;9;20;0.41;61.76;Netherlands;Western Europe;Elsevier BV;2000-2022;"Applied Psychology (Q4); Sports Science (Q4)"
210;4700152294;Activities, Adaptation and Aging;journal;01924788;0.204;Q2;24;10;60;316;24;60;0.34;31.6;United States;Northern America;Routledge;1981-1999, 2001-2021;"Gerontology (Q2); Health Professions (miscellaneous) (Q2); Geriatrics and Gerontology (Q3)"
211;18568;Journal of Histotechnology;journal;01478885, 20460236;0.203;Q2;23;46;139;821;44;106;0.29;17.85;United Kingdom;Western Europe;Maney Publishing;1977-2021;"Medical Laboratory Technology (Q2); Anatomy (Q3); Histology (Q3)"
212;21300;Health Marketing Quarterly;journal;15450864, 07359683;0.201;Q2;28;20;76;572;26;73;0.28;28.6;United States;Northern America;Routledge;1983-2021;"Health Professions (miscellaneous) (Q2); Marketing (Q3)"
213;17700156741;International Journal of Play Therapy;journal;15556824;0.201;Q2;30;13;22;423;10;22;0.54;32.54;United States;Northern America;American Psychological Association;1992-2021;"Complementary and Manual Therapy (Q2); Clinical Psychology (Q3)"
214;14564;American Annals of the Deaf;journal;15430375, 0002726X;0.2;Q3;43;36;115;752;42;107;0.34;20.89;United States;Northern America;Gallaudet University Press;1946-1951, 1961, 1965-2021;"Education (Q3); Speech and Hearing (Q3); Developmental and Educational Psychology (Q4)"
215;19444;American Journal of Pharmaceutical Education;journal;15536467, 00029459;0.199;-;69;68;201;1207;87;201;0.39;17.75;United States;Northern America;American Association of Colleges of Pharmacy;1945-1948, 1973-1989, 1991, 1996-2021;"Medicine (miscellaneous) (Q2); Education (Q3); Pharmacology, Toxicology and Pharmaceutics (miscellaneous) (Q3)"
216;19816;Biology of Sport;journal;0860021X;0.199;Q3;33;30;77;851;18;77;0.16;28.37;Poland;Eastern Europe;Institute of Sport;1996-2022;"Orthopedics and Sports Medicine (Q3); Physical Therapy, Sports Therapy and Rehabilitation (Q3); Physiology (medical) (Q4); Sports Science (Q4)"
217;17231;Journal of Nuclear Medicine Technology;journal;15355675, 00914916;0.198;Q3;42;37;152;287;30;123;0.14;7.76;United States;Northern America;Society of Nuclear Medicine and Molecular Imaging;1976, 1993-2021;"Medicine (miscellaneous) (Q2); Radiological and Ultrasound Technology (Q3); Radiology, Nuclear Medicine and Imaging (Q3)"
218;5100153505;Occupational Ergonomics;journal;13599364;0.198;Q3;18;20;18;431;8;18;0.44;21.55;Netherlands;Western Europe;IOS Press BV;1998, 2000-2002, 2004-2008, 2011, 2018;"Advanced and Specialized Nursing (Q2); Physical Therapy, Sports Therapy and Rehabilitation (Q3); Public Health, Environmental and Occupational Health (Q3); Rehabilitation (Q3)"
219;17478;Topics in Spinal Cord Injury Rehabilitation;journal;19455763, 10820744;0.198;Q3;37;34;113;985;26;98;0.24;28.97;United States;Northern America;Thomas Land Publishers Inc.;1998-2021;"Neurology (clinical) (Q3); Physical Therapy, Sports Therapy and Rehabilitation (Q3); Rehabilitation (Q3)"
220;15538;Journal of Human Movement Studies;journal;03067297;0.197;Q3;26;62;131;1416;36;131;0.24;22.84;United Kingdom;Western Europe;Teviot Scientific Publications Ltd.;1976-1989, 1996-2007;"Orthopedics and Sports Medicine (Q3); Physical Therapy, Sports Therapy and Rehabilitation (Q3); Experimental and Cognitive Psychology (Q4)"
221;16851;Manuelle Medizin;journal;14330466, 00252514;0.197;Q3;15;97;198;798;22;165;0.11;8.23;Germany;Western Europe;Springer Verlag;1973-2021;"Complementary and Alternative Medicine (Q2); Complementary and Manual Therapy (Q3); Physical Therapy, Sports Therapy and Rehabilitation (Q3)"
222;23263;Sprache Stimme Gehor;journal;03420477, 14391260;0.197;Q3;11;30;90;697;18;84;0.15;23.23;Germany;Western Europe;Georg Thieme Verlag;1980-2021;"Psychiatry and Mental Health (Q3); Speech and Hearing (Q3); Applied Psychology (Q4)"
223;13742;International Tinnitus Journal;journal;09465448;0.195;Q4;31;26;87;408;20;82;0.2;15.69;United States;Northern America;Tinnitus Center;1998-2021;"Otorhinolaryngology (Q3); Sensory Systems (Q4); Speech and Hearing (Q4)"
224;16788;Journal of Bodywork and Movement Therapies;journal;15329283, 13608592;0.193;Q3;55;35;126;801;16;100;0.16;22.89;United States;Northern America;Churchill Livingstone;1996-2021;"Complementary and Alternative Medicine (Q2); Complementary and Manual Therapy (Q3); Physical Therapy, Sports Therapy and Rehabilitation (Q3); Rehabilitation (Q3)"
225;29890;Strength and Conditioning Journal;journal;15334295, 15241602;0.193;Q3;46;101;104;695;32;104;0.28;6.88;United States;Northern America;Lippincott Williams and Wilkins Ltd.;1996-2021;"Orthopedics and Sports Medicine (Q3); Physical Therapy, Sports Therapy and Rehabilitation (Q3); Sports Science (Q4)"
226;20347;Schweizerische Zeitschrift fur Sportmedizin und Sporttraumatologie;journal;14220644;0.192;Q3;14;28;115;611;14;99;0.1;21.82;Switzerland;Western Europe;Rubmedia AG;1996-2017;"Orthopedics and Sports Medicine (Q3); Physical Therapy, Sports Therapy and Rehabilitation (Q3)"
227;5700154403;Australian Journal of Emergency Management;journal;13241540;0.19;Q1;27;25;121;374;14;112;0.13;14.96;Australia;Pacific Region;Australian Institute for Disaster Resilience;1998-2021;"Emergency Medical Services (Q1); Health Professions (miscellaneous) (Q2); Safety Research (Q3)"
228;21083;Pharmaceutical Care Espana (discontinued);journal;11396202;0.188;Q1;9;53;51;743;10;44;0.2;14.02;Spain;Western Europe;Fundacion Pharamaceutical Care Espana;2001-2017;"Pharmacy (Q1); Pharmaceutical Science (Q3); Pharmacology (Q3)"
229;29380;Rehabilitation Nursing;journal;02784807;0.188;Q3;38;22;99;62;42;93;0.26;2.82;United States;Northern America;Lippincott Williams and Wilkins Ltd.;1975-2021;"Medicine (miscellaneous) (Q2); Nursing (miscellaneous) (Q2); Physical Therapy, Sports Therapy and Rehabilitation (Q3); Rehabilitation (Q3)"
230;65917;Clinical Kinesiology;journal;08969620;0.186;Q3;12;6;34;208;9;34;0.27;34.67;United States;Northern America;Turnkey Publishing Inc.;1988-2017;"Physical Therapy, Sports Therapy and Rehabilitation (Q3); Rehabilitation (Q3)"
231;19700201335;Scandinavian Journal of Disability Research;journal;17453011, 15017419;0.185;Q3;23;9;32;348;10;32;0.32;38.67;Sweden;Western Europe;Stockholm University Press;1999-2021;"Physical Therapy, Sports Therapy and Rehabilitation (Q3); Rehabilitation (Q3)"
232;21100837274;Physical Therapy Reviews;journal;10833196, 1743288X;0.184;Q3;35;26;84;1282;23;68;0.15;49.31;United Kingdom;Western Europe;Taylor and Francis Ltd.;1996-2021;"Orthopedics and Sports Medicine (Q3); Physical Therapy, Sports Therapy and Rehabilitation (Q3); Rehabilitation (Q3)"
233;12054;Arts in Psychotherapy;journal;01974556, 18735878;0.182;Q3;39;25;77;516;14;77;0.19;20.64;United Kingdom;Western Europe;Elsevier Ltd.;1973, 1975-2021;"Clinical Psychology (Q3); Health Professions (miscellaneous) (Q3); Psychiatry and Mental Health (Q3)"
234;17208;Journal de Radiologie;journal;17730384, 02210363;0.181;Q3;31;201;648;2604;222;558;0.32;12.96;France;Western Europe;Elsevier Masson s.r.l.;1973-2011;"Radiological and Ultrasound Technology (Q3); Radiology, Nuclear Medicine and Imaging (Q3)"
235;19915;Physician and Sportsmedicine;journal;23263660, 00913847;0.181;Q3;48;161;573;792;111;465;0.19;4.92;United Kingdom;Western Europe;Taylor and Francis Ltd.;1978-2005, 2008-2021;"Orthopedics and Sports Medicine (Q3); Physical Therapy, Sports Therapy and Rehabilitation (Q3); Sports Science (Q4)"
236;21218;JNMS - Journal of the Neuromusculoskeletal System;journal;10678239;0.178;Q3;9;28;45;525;13;45;0.29;18.75;United States;Northern America;Data Trace Publishing Co.;1996-2002;"Neurology (clinical) (Q3); Physical Therapy, Sports Therapy and Rehabilitation (Q3)"
237;16802;Journal of Manual and Manipulative Therapy;journal;10669817, 20426186;0.178;Q3;43;18;62;554;13;50;0.25;30.78;United Kingdom;Western Europe;Maney Publishing;1993-2021;Physical Therapy, Sports Therapy and Rehabilitation (Q3)
238;5300152517;International Journal on Disability and Human Development;journal;21910367, 21911231;0.174;Q4;26;22;124;543;39;115;0.29;24.68;Germany;Western Europe;Nova Science Publishers, Inc.;1999-2003, 2005-2021;"Advanced and Specialized Nursing (Q2); Geriatrics and Gerontology (Q3); Psychiatry and Mental Health (Q3); Rehabilitation (Q3); Sensory Systems (Q4); Speech and Hearing (Q4)"
239;21316;AIDS and Public Policy Journal;journal;08873852;0.17;Q3;13;8;30;440;5;29;0.19;55;United States;Northern America;University Publishing Group, Inc.;1987-2005;"Health Professions (miscellaneous) (Q3); Health (social science) (Q3); Public Health, Environmental and Occupational Health (Q3); Social Sciences (miscellaneous) (Q3)"
240;21044;Cochlear Implants International;journal;17547628, 14670100;0.169;Q4;34;10;10;198;6;9;0.6;19.8;United Kingdom;Western Europe;Maney Publishing;2001-2021;"Otorhinolaryngology (Q3); Speech and Hearing (Q4)"
241;145406;Art Therapy;journal;07421656;0.164;Q4;34;30;108;443;24;108;0.23;14.77;United Kingdom;Western Europe;Taylor and Francis Ltd.;1983-2021;"Clinical Psychology (Q4); Complementary and Manual Therapy (Q4)"
242;29735;Foot;journal;09582592, 15322963;0.162;Q2;37;35;153;703;24;139;0.13;20.09;United Kingdom;Western Europe;Churchill Livingstone;1991-2021;"Medicine (miscellaneous) (Q2); Podiatry (Q2); Orthopedics and Sports Medicine (Q3)"
243;21100312401;Revista Cubana de Informacion en Ciencias de la Salud;journal;23072113;0.16;Q4;13;35;85;337;8;85;0.03;9.63;Cuba;Latin America;Centro Nacional De Informacion De Ciencias Medicas;2013-2021;"Health Policy (Q3); Library and Information Sciences (Q3); Health Information Management (Q4)"
244;15373;Journal of Aggression, Maltreatment and Trauma;journal;10926771, 1545083X;0.155;Q3;50;14;110;810;16;106;0.15;57.86;United States;Northern America;Routledge;1997-1998, 2000-2021;"Health Professions (miscellaneous) (Q3); Psychiatry and Mental Health (Q3); Clinical Psychology (Q4)"
245;15770;Physical and Occupational Therapy in Pediatrics;journal;01942638, 15413144;0.155;Q3;48;23;59;592;19;50;0.35;25.74;United States;Northern America;Informa Healthcare;1980-2021;"Medicine (miscellaneous) (Q3); Occupational Therapy (Q3); Pediatrics, Perinatology and Child Health (Q3); Physical Therapy, Sports Therapy and Rehabilitation (Q3); Rehabilitation (Q3)"
246;19812;Archivos de Medicina del Deporte;journal;02128799;0.153;Q3;12;57;155;1417;13;137;0.06;24.86;Spain;Western Europe;Federacion Espanola De Medicina Del Deporte;1997-2021;"Physical Therapy, Sports Therapy and Rehabilitation (Q3); Orthopedics and Sports Medicine (Q4); Sports Science (Q4)"
247;4700152769;Pharmacopeial Forum (discontinued);journal;03634655;0.152;Q2;19;12;21;100;8;21;0.38;8.33;United States;Northern America;United States Pharmacopeial Convention Inc.;1996-1998, 2000-2018;"Pharmacy (Q2); Drug Guides (Q3); Pharmacology (Q3)"
248;28781;Japanese Journal of Physical Fitness and Sports Medicine;journal;0039906X;0.15;Q3;11;50;157;996;21;157;0.1;19.92;Japan;Asiatic Region;Japanese Society of Physical Fitness and Sports Medicine;1956, 1958-2021;"Physical Therapy, Sports Therapy and Rehabilitation (Q3); Orthopedics and Sports Medicine (Q4); Sports Science (Q4)"
249;12100155715;Assessment for Effective Intervention;journal;19387458, 15345084;0.149;Q3;28;29;56;919;8;55;0.17;31.69;United States;Northern America;SAGE Publications Inc.;1988-1993, 1995, 1997, 1999-2021;"Health Professions (miscellaneous) (Q3); Developmental and Educational Psychology (Q4); Education (Q4)"
250;21100202751;Neurodiagnostic journal,The;journal;21646821, 23758627;0.147;Q3;19;18;64;421;15;53;0.21;23.39;United Kingdom;Western Europe;Taylor and Francis Ltd.;1996-2021;"Medical Laboratory Technology (Q3); Neurology (clinical) (Q4)"
251;5800207375;European Journal of Sport Science;journal;17461391;0.146;Q3;65;42;37;1225;8;37;0.22;29.17;United Kingdom;Western Europe;Taylor and Francis Ltd.;2001-2021;"Medicine (miscellaneous) (Q3); Physical Therapy, Sports Therapy and Rehabilitation (Q3); Orthopedics and Sports Medicine (Q4); Sports Science (Q4)"
252;19700201601;Journal of laboratory automation;journal;22110690, 22110682;0.145;Q3;42;10;34;66;10;34;0.35;6.6;United States;Northern America;SAGE Publications Inc.;1999-2002, 2004-2016;"Medical Laboratory Technology (Q3); Medicine (miscellaneous) (Q3); Computer Science Applications (Q4)"
253;15456;Journal of Emotional Abuse;journal;15404714, 10926798;0.144;Q3;32;0;40;0;10;38;0.04;0;United States;Northern America;"The Haworth Maltreatment &amp; Trauma Press";1997-2001, 2003-2008;"Health Professions (miscellaneous) (Q3); Social Sciences (miscellaneous) (Q3); Clinical Psychology (Q4); Psychiatry and Mental Health (Q4)"
254;12412;Topics in Geriatric Rehabilitation;journal;15502414, 08827524;0.142;Q3;28;32;101;1242;23;81;0.28;38.81;United States;Northern America;Lippincott Williams and Wilkins Ltd.;1985-2021;"Geriatrics and Gerontology (Q3); Physical Therapy, Sports Therapy and Rehabilitation (Q3); Rehabilitation (Q3)"
255;22338;Hospital Pharmacy;journal;19451253, 00185787;0.141;Q2;24;163;491;1733;75;406;0.17;10.63;United States;Northern America;Thomas Land Publishers Inc.;1973-2021;"Pharmacy (Q2); Pharmacology (medical) (Q3); Pharmacology (Q4)"
256;16407;Occupational Therapy in Health Care;journal;07380577, 15413098;0.141;Q4;26;31;92;789;8;86;0.04;25.45;United States;Northern America;Informa Healthcare;1984-1993, 1995-2021;"Medicine (miscellaneous) (Q3); Occupational Therapy (Q4)"
257;4000148601;Journal of Visual Communication in Medicine;journal;17453062, 17453054;0.14;Q3;16;54;146;270;15;126;0.13;5;United Kingdom;Western Europe;Informa Healthcare;1978-2021;"Visual Arts and Performing Arts (Q1); Health Professions (miscellaneous) (Q3)"
258;29774;Physical and Occupational Therapy in Geriatrics;journal;02703181, 15413152;0.14;Q4;21;26;91;727;14;86;0.14;27.96;United States;Northern America;Informa Healthcare;1980-2021;"Geriatrics and Gerontology (Q3); Gerontology (Q3); Rehabilitation (Q3); Occupational Therapy (Q4)"
259;20500195133;Clinical Pharmacist;journal;17589061;0.139;Q2;13;85;117;887;14;92;0.12;10.44;United Kingdom;Western Europe;Pharmaceutical Press;2009-2012, 2014-2019;"Pharmacy (Q2); Pharmacology (medical) (Q3)"
260;22051;Ergotherapie und Rehabilitation;journal;09428623;0.139;Q3;4;55;57;470;4;42;0.07;8.55;Germany;Western Europe;Schulz-Kirchner Verlag GmbH;2001-2019;"Physical Therapy, Sports Therapy and Rehabilitation (Q3); Occupational Therapy (Q4)"
261;14000155897;International Journal of Speech-Language Pathology;journal;17549507, 17549515;0.137;Q4;47;19;67;647;13;57;0.14;34.05;United Kingdom;Western Europe;Informa Healthcare;2009-2021;"Linguistics and Language (Q3); LPN and LVN (Q3); Otorhinolaryngology (Q3); Research and Theory (Q3); Speech and Hearing (Q4)"
262;20349;Science and Sports;journal;17784131, 07651597;0.136;Q4;26;46;149;1015;19;147;0.1;22.07;France;Western Europe;Elsevier Masson s.r.l.;1986-2021;"Orthopedics and Sports Medicine (Q4); Sports Science (Q4)"
263;56502;Journal of Audiological Medicine;journal;09637133;0.135;Q3;10;19;55;502;6;44;0.08;26.42;United Kingdom;Western Europe;Whurr Publishers Ltd.;1992-2002;"Health Professions (miscellaneous) (Q3); Otorhinolaryngology (Q3); Psychology (miscellaneous) (Q4)"
264;17211;Journal of Diagnostic Medical Sonography;journal;15525430, 87564793;0.134;Q4;17;92;192;767;5;172;0.04;8.34;United States;Northern America;SAGE Publications Inc.;1985-2021;"Radiological and Ultrasound Technology (Q4); Radiology, Nuclear Medicine and Imaging (Q4)"
265;88845;Journal of Psychotherapy in Independent Practice;journal;15229580;0.134;Q3;9;0;55;0;11;51;0.2;0;United States;Northern America;Haworth Press Inc.;2000-2001;"Health Professions (miscellaneous) (Q3); Social Sciences (miscellaneous) (Q3); Psychiatry and Mental Health (Q4); Psychology (miscellaneous) (Q4)"
266;19916;Research in Sports Medicine;journal;15438635, 15438627;0.134;Q4;39;0;42;0;3;42;0.1;0;United Kingdom;Western Europe;Taylor and Francis Ltd.;2003-2021;"Medicine (miscellaneous) (Q3); Orthopedics and Sports Medicine (Q4); Physical Therapy, Sports Therapy and Rehabilitation (Q4); Sports Science (Q4)"
267;4000148206;Journal of Neurologic Physical Therapy;journal;15570584, 15570576;0.133;Q4;55;19;62;845;12;62;0.09;44.47;United States;Northern America;Lippincott Williams and Wilkins Ltd.;2004-2021;"Medicine (miscellaneous) (Q3); Rehabilitation (Q3); Geriatrics and Gerontology (Q4); Neurology (clinical) (Q4); Physical Therapy, Sports Therapy and Rehabilitation (Q4)"
268;11300153731;Ultrasound;journal;17431344, 1742271X;0.132;Q4;19;61;152;402;6;133;0.05;6.59;United Kingdom;Western Europe;SAGE Publications Ltd;1993-2021;"Radiological and Ultrasound Technology (Q4); Radiology, Nuclear Medicine and Imaging (Q4)"
269;17133;Pravention und Rehabilitation (discontinued);journal;0937552X;0.131;Q4;8;21;69;507;9;68;0.12;24.14;Germany;Western Europe;Dustri-Verlag Dr. Karl Feistle;1993-2017, 2021;"Physical Therapy, Sports Therapy and Rehabilitation (Q4); Rehabilitation (Q4)"
270;16739;Annals of the ICRP;journal;1872969X, 01466453;0.13;Q4;50;10;83;894;13;60;0.22;89.4;United States;Northern America;SAGE Publications Inc.;1976-1989, 1991, 1993-2010, 2012-2021;"Public Health, Environmental and Occupational Health (Q4); Radiological and Ultrasound Technology (Q4); Radiology, Nuclear Medicine and Imaging (Q4)"
271;17483;Zeitschrift fur Medizinische Physik;journal;09393889;0.13;Q4;36;33;68;614;15;67;0.22;18.61;Germany;Western Europe;Urban und Fischer Verlag Jena;2000-2021;"Biophysics (Q4); Radiological and Ultrasound Technology (Q4); Radiology, Nuclear Medicine and Imaging (Q4)"
272;19700186276;Australasian journal of optometry, The;journal;0817881X, 14440938;0.129;Q3;1;0;0;0;0;0;0;0;Australia;Pacific Region;Optometrists Association Australia;1920-1942, 1944-1959, 2016-2021;"Optometry (Q3); Ophthalmology (Q4)"
273;23104;Journal of Pharmacy Practice and Research;journal;1445937X;0.129;Q2;23;75;111;1082;32;99;0.29;14.43;United States;Northern America;Wiley-Blackwell;2002-2021;"Pharmacy (Q2); Pharmacology (medical) (Q3)"
274;4700153007;Rivista Italiana della Medicina di Laboratorio;journal;1825859X;0.129;Q3;10;56;149;937;8;134;0.05;16.73;Italy;Western Europe;Springer-Verlag Italia Srl;2005-2021;"Medical Laboratory Technology (Q3); Biochemistry (medical) (Q4)"
