Rank;Sourceid;Title;Type;Issn;SJR;SJR Best Quartile;H index;Total Docs. (2003);Total Docs. (3years);Total Refs.;Total Cites (3years);Citable Docs. (3years);Cites / Doc. (2years);Ref. / Doc.;Country;Publisher;Coverage;Categories
216;18291;Socio-Economic Planning Sciences;journal;00380121;0.423;Q3;43;16;47;490;31;44;0.62;30.63;United Kingdom;Elsevier Ltd.;1967-ongoing;"Geography, Planning and Development (Q1); Strategy and Management (Q2); Economics and Econometrics (Q3); Management Science and Operations Research (Q3); Statistics, Probability and Uncertainty (Q3)"
217;28957;Japan and the World Economy;journal;09221425;0.415;Q2;31;33;77;561;25;76;0.24;17;Netherlands;Elsevier BV;1988-ongoing;"Political Science and International Relations (Q1); Finance (Q2); Economics and Econometrics (Q3)"
218;27949;Zeitschrift fr Wirtschaftsgeographie;journal;00443751;0.415;Q3;14;18;47;897;40;47;0.7;49.83;Germany;Walter de Gruyter GmbH;1978-1981, 1984, 1988-ongoing;"Geography, Planning and Development (Q1); Economics and Econometrics (Q3)"
219;24884;Scottish Journal of Political Economy;journal;14679485, 00369292;0.414;Q3;44;36;94;1156;65;94;0.55;32.11;United Kingdom;Blackwell Publishing Inc.;1954-ongoing;"Sociology and Political Science (Q2); Economics and Econometrics (Q3)"
220;100147314;Journal of International Financial Management and Accounting;journal;09541314, 1467646X;0.407;Q2;31;11;34;401;18;33;0.36;36.45;United Kingdom;Blackwell Publishing Inc.;1989-1992, 1994-ongoing;"Business, Management and Accounting (miscellaneous) (Q2); Finance (Q2); Accounting (Q3)"
221;19600157009;North American Actuarial Journal;journal;10920277;0.407;Q3;40;48;202;786;65;202;0.27;16.38;United Kingdom;Taylor & Francis;1997-ongoing;"Economics and Econometrics (Q3); Statistics and Probability (Q3); Statistics, Probability and Uncertainty (Q3)"
222;20097;Bulletin of Economic Research;journal;03073378, 14678586;0.405;Q3;26;26;57;515;24;57;0.33;19.81;United Kingdom;Blackwell Publishing Inc.;1948-ongoing;Economics and Econometrics (Q3)
223;21462;International Journal of Health Care Finance and Economics;journal;13896563, 15736962;0.404;Q1;26;14;32;36;16;32;0.5;2.57;Netherlands;Kluwer Academic Publishers;2001-2014;"Economics, Econometrics and Finance (miscellaneous) (Q1); Health (social science) (Q2); Medicine (miscellaneous) (Q2); Finance (Q3)"
224;21995;Contemporary Economic Policy;journal;14657287, 10743529;0.399;Q3;43;40;120;1258;66;119;0.47;31.45;United Kingdom;Blackwell Publishing Inc.;1982-ongoing;"Business, Management and Accounting (miscellaneous) (Q2); Public Administration (Q2); Economics and Econometrics (Q3)"
225;20642;Empirical Economics;journal;14358921, 03777332;0.395;Q3;48;46;111;1274;54;111;0.51;27.7;Germany;Springer Verlag;1976-ongoing;"Social Sciences (miscellaneous) (Q2); Economics and Econometrics (Q3); Mathematics (miscellaneous) (Q3); Statistics and Probability (Q3)"
226;20669;Journal of Multinational Financial Management;journal;1042444X;0.395;Q3;36;28;77;675;44;77;0.44;24.11;Netherlands;Elsevier BV;1997-ongoing;"Economics and Econometrics (Q3); Finance (Q3)"
227;20320;Journal of Policy Modeling;journal;01618938;0.393;Q3;43;64;150;1177;82;149;0.43;18.39;Netherlands;Elsevier BV;1979-ongoing;Economics and Econometrics (Q3)
228;26836;Journal of International Economic Law;journal;14643758, 13693034;0.392;Q1;44;40;101;2823;83;99;0.8;70.58;United Kingdom;Oxford University Press;1998-ongoing;"Economics, Econometrics and Finance (miscellaneous) (Q1); Law (Q1)"
229;16110;Kyklos;journal;14676435, 00235962;0.391;Q3;52;22;89;649;73;89;0.74;29.5;United Kingdom;Blackwell Publishing Inc.;1947-1951, 1953-ongoing;"Arts and Humanities (miscellaneous) (Q2); Economics and Econometrics (Q3)"
230;15662;International Review of Law and Economics;journal;01448188;0.377;Q3;38;28;73;717;42;72;0.52;25.61;Netherlands;Elsevier BV;1981-ongoing;"Law (Q1); Economics and Econometrics (Q3); Finance (Q3)"
231;24206;Review of Financial Economics;journal;10583300;0.376;Q3;34;22;42;571;9;39;0.23;25.95;Netherlands;Elsevier BV;1994-ongoing;"Economics and Econometrics (Q3); Finance (Q3)"
232;29441;Review of Economic Design;journal;14344750, 14344742;0.375;Q1;23;25;65;461;18;65;0.15;18.44;Germany;Springer Verlag;1996-ongoing;Economics, Econometrics and Finance (miscellaneous) (Q1)
233;18895;Journal of Advanced Transportation;journal;01976729;0.369;Q3;34;21;53;367;23;50;0.52;17.48;Egypt;Hindawi Limited;1979-ongoing;"Automotive Engineering (Q1); Mechanical Engineering (Q2); Strategy and Management (Q2); Computer Science Applications (Q3); Economics and Econometrics (Q3)"
234;23736;Research in Economics;journal;10909451, 10909443;0.368;Q3;23;20;52;446;21;50;0.32;22.3;United States;Elsevier Inc.;1997-ongoing;Economics and Econometrics (Q3)
235;19900192165;Financial Review;journal;15406288, 07328516;0.367;Q3;39;32;97;949;37;97;0.18;29.66;United States;Wiley-Blackwell;1969-1995, 2008, 2011-ongoing;"Economics and Econometrics (Q3); Finance (Q3)"
236;24350;Journal of Economic Education;journal;00220485;0.364;Q3;43;34;117;428;51;117;0.39;12.59;United States;Heldref Publications;1969-ongoing;"Education (Q2); Economics and Econometrics (Q3)"
237;28952;Journal of Economic Issues;journal;00213624;0.364;Q3;40;73;182;2504;106;175;0.46;34.3;United Kingdom;Taylor & Francis;1982, 1985, 1988, 1990-1992, 1996-ongoing;"Business, Management and Accounting (miscellaneous) (Q2); Economics and Econometrics (Q3)"
238;4000152103;Advances in Entrepreneurship, Firm Emergence and Growth;book series;10747540;0.361;Q2;15;11;20;931;27;18;1.67;84.64;United Kingdom;Emerald Group Publishing Ltd.;2000, 2002-2007, 2009-2010, 2014-ongoing;"Business, Management and Accounting (miscellaneous) (Q2); Economics, Econometrics and Finance (miscellaneous) (Q2)"
239;28970;Journal of Cultural Economics;journal;08852545;0.36;Q2;37;17;48;519;66;48;1.19;30.53;United States;Springer New York LLC;1977-ongoing;Economics, Econometrics and Finance (miscellaneous) (Q2)
240;15015;Agricultural History Review;journal;00021490;0.355;Q3;17;11;33;1061;17;33;0.17;96.45;United States;University of California Press;1978-ongoing;"History and Philosophy of Science (Q1); Agronomy and Crop Science (Q3); Animal Science and Zoology (Q3); Economics and Econometrics (Q3)"
241;23665;International Business Review;journal;09695931;0.351;Q3;79;39;110;2142;115;109;0.62;54.92;United Kingdom;Elsevier Ltd.;1993-ongoing;"Business and International Management (Q2); Marketing (Q2); Finance (Q3)"
242;27094;Fiscal Studies;journal;01435671, 14755890;0.349;Q3;35;20;55;540;53;55;0.56;27;United States;Wiley-Blackwell;1979-ongoing;"Accounting (Q3); Economics and Econometrics (Q3); Finance (Q3)"
243;22255;National Institute Economic Review;journal;17413036, 00279501;0.347;Q2;30;46;130;498;47;130;0.3;10.83;United States;SAGE Publications;1960-ongoing;Economics, Econometrics and Finance (miscellaneous) (Q2)
244;21210;Local Economy;journal;14709325, 02690942;0.346;Q2;32;34;101;590;47;98;0.35;17.35;United States;SAGE Publications;1986-ongoing;Economics, Econometrics and Finance (miscellaneous) (Q2)
245;28992;Journal of European Economic History;journal;03915115;0.345;Q3;3;0;3;0;1;3;0.5;0;Italy;Banca di Roma;1974-1975, 1979, 1981-1984, 1999-2001, 2012;"History (Q1); Economics and Econometrics (Q3)"
246;19053;Computational Economics;journal;09277099, 15729974;0.344;Q2;36;35;88;685;28;81;0.31;19.57;Netherlands;Kluwer Academic Publishers;1993-ongoing;"Economics, Econometrics and Finance (miscellaneous) (Q2); Computer Science Applications (Q3)"
247;20023;Economic Record;journal;14754932, 00130249;0.344;Q3;38;39;82;1251;56;82;0.59;32.08;United Kingdom;Blackwell Publishing Inc.;1925-1932, 1934-ongoing;Economics and Econometrics (Q3)
248;27748;Emerging Markets Finance and Trade;journal;1540496X;0.344;Q2;26;30;65;814;36;65;0.66;27.13;United States;M.E. Sharpe Inc.;2002-ongoing;"Economics, Econometrics and Finance (miscellaneous) (Q2); Finance (Q3)"
249;28487;Economic Systems Research;journal;09535314, 14695758;0.343;Q3;48;22;64;493;42;64;0.79;22.41;United Kingdom;Carfax Publishing Ltd.;1989-ongoing;Economics and Econometrics (Q3)
250;28148;Eurasian Geography and Economics;journal;15387216;0.342;Q3;38;34;94;1442;83;94;0.95;42.41;United Kingdom;Taylor & Francis;2002-ongoing;"Geography, Planning and Development (Q2); Economics and Econometrics (Q3)"
251;22736;Journal of Asian Economics;journal;10490078;0.335;Q3;38;54;82;1184;63;79;0.61;21.93;Netherlands;Elsevier BV;1990-ongoing;"Economics and Econometrics (Q3); Finance (Q3)"
252;29020;Manchester School;journal;14636786, 14679957;0.335;Q3;36;42;132;1173;53;132;0.33;27.93;United Kingdom;Blackwell Publishing Inc.;1930-1941, 1943-1944, 1946-ongoing;Economics and Econometrics (Q3)
253;17914;Venture Capital;journal;14645343, 13691066;0.334;Q3;44;18;66;830;54;62;0.75;46.11;United Kingdom;Taylor & Francis;1999-ongoing;Finance (Q3)
254;18768;Applied Economics;journal;00036846;0.333;Q3;72;188;613;4758;276;613;0.36;25.31;United Kingdom;Routledge;1969-ongoing;Economics and Econometrics (Q3)
255;21780;Nonlinear Analysis: Real World Applications;journal;14681218;0.333;Q2;75;41;98;786;45;98;0.37;19.17;Netherlands;Elsevier BV;2000-ongoing;"Economics, Econometrics and Finance (miscellaneous) (Q2); Engineering (miscellaneous) (Q2); Medicine (miscellaneous) (Q2); Applied Mathematics (Q3); Analysis (Q4); Computational Mathematics (Q4)"
256;24257;Asian-Pacific Economic Literature;journal;08189935, 14678411;0.332;Q3;19;6;16;289;13;16;1.1;48.17;United Kingdom;Blackwell Publishing Inc.;1987-ongoing;"Development (Q2); Geography, Planning and Development (Q2); Economics and Econometrics (Q3)"
257;57810;Journal of Cultural Heritage;journal;12962074;0.331;-;53;103;163;1561;162;162;0.45;15.16;France;Elsevier Masson;2000-ongoing;"Archeology (arts and humanities) (Q1); Conservation (Q1); History (Q1); Anthropology (Q2); Chemistry (miscellaneous) (Q2); Materials Science (miscellaneous) (Q2); Spectroscopy (Q4)"
258;21100821602;Business and Professional Communication Quarterly;journal;23294922, 23294906;0.33;Q2;30;50;137;598;43;124;0.35;11.96;United States;SAGE Publications;2014-ongoing;"Arts and Humanities (miscellaneous) (Q2); Business and International Management (Q2); Business, Management and Accounting (miscellaneous) (Q2); Economics, Econometrics and Finance (miscellaneous) (Q2)"
259;17531;Journal of International Financial Markets, Institutions and Money;journal;10424431;0.329;Q3;45;27;71;782;34;71;0.32;28.96;Netherlands;Elsevier BV;1997-ongoing;"Economics and Econometrics (Q3); Finance (Q3)"
260;15500;Journal of Family and Economic Issues;journal;15733475, 10580476;0.321;Q3;40;25;47;545;29;47;0.55;21.8;United States;Kluwer Academic/Plenum Publishers;1992-ongoing;"Economics and Econometrics (Q3); Social Psychology (Q3)"
261;22273;Peace Economics, Peace Science and Public Policy;journal;10792457;0.321;Q3;14;7;26;104;5;25;0.19;14.86;Germany;Walter de Gruyter GmbH;2001-ongoing;"Management, Monitoring, Policy and Law (Q2); Political Science and International Relations (Q2); Sociology and Political Science (Q2); Economics and Econometrics (Q3)"
262;29804;International Journal of Accounting;journal;10944060;0.319;Q3;47;33;76;756;41;73;0.22;22.91;United Kingdom;Elsevier Ltd.;1996-ongoing;"Accounting (Q3); Finance (Q3)"
263;15263;Pulp and Paper Canada;trade journal;03164004;0.318;Q3;26;149;447;761;119;425;0.24;5.11;Canada;Business Information Group;1974-1992, 1994-ongoing;"Chemical Engineering (miscellaneous) (Q2); Industrial and Manufacturing Engineering (Q2); Materials Science (miscellaneous) (Q2); Mechanical Engineering (Q2); Economics and Econometrics (Q3)"
264;20077;De Economist;journal;15729982, 0013063X;0.312;Q3;25;19;64;585;20;63;0.32;30.79;Netherlands;Kluwer Academic Publishers;1852-1944, 1946-1950, 1952-ongoing;Economics and Econometrics (Q3)
265;29008;Journal of Post Keynesian Economics;journal;01603477;0.302;Q3;35;38;118;1156;65;114;0.46;30.42;United States;M.E. Sharpe Inc.;1985, 1989, 1996-ongoing;Economics and Econometrics (Q3)
266;28467;Economic Modelling;journal;02649993;0.301;Q3;56;52;100;1473;49;100;0.32;28.33;Netherlands;Elsevier BV;1984-ongoing;Economics and Econometrics (Q3)
267;100147313;Journal of Business Finance and Accounting;journal;0306686X;0.3;Q3;64;57;168;1743;89;166;0.47;30.58;United Kingdom;Blackwell Publishing Inc.;1974-ongoing;"Business, Management and Accounting (miscellaneous) (Q2); Accounting (Q3); Finance (Q3)"
268;15493;Finance and Development;trade journal;01451707, 15645142;0.299;Q3;29;31;123;119;87;123;0.75;3.84;United States;International Monetary Fund;1973, 1975-1976, 1978-ongoing;"Development (Q2); Geography, Planning and Development (Q2); Finance (Q3)"
269;24356;Journal of Economics/ Zeitschrift fr Nationalokonomie;journal;16177134, 09318658;0.298;Q3;28;32;83;660;20;81;0.27;20.63;Germany;Springer Verlag;1970-ongoing;"Business, Management and Accounting (miscellaneous) (Q2); Economics and Econometrics (Q3)"
270;200147129;Cato Journal;journal;02733072;0.294;Q2;25;0;84;0;35;84;0.3;0;United States;Cato Institute;1996-2002, 2004-ongoing;"Economics, Econometrics and Finance (miscellaneous) (Q2); Geography, Planning and Development (Q2); Public Administration (Q2)"
271;22819;International Journal of Market Research;journal;14707853;0.293;Q3;47;29;71;667;30;68;0.48;23;United Kingdom;N T C Publications Ltd.;1996-ongoing;"Business and International Management (Q2); Marketing (Q2); Economics and Econometrics (Q3)"
272;22733;Journal of African Economies;journal;09638024, 14643723;0.293;Q3;40;27;80;991;30;79;0.25;36.7;United Kingdom;Oxford University Press;1992-ongoing;"Development (Q2); Economics and Econometrics (Q3)"
273;25564;German Economic Review;journal;14680475, 14656485;0.291;Q3;28;22;43;667;19;43;0.44;30.32;United Kingdom;Blackwell Publishing Inc.;2001-ongoing;Economics and Econometrics (Q3)
274;26842;Journal of World Trade;journal;10116702;0.289;Q3;29;49;90;4930;54;89;0.45;100.61;Netherlands;Kluwer Law International;1996-ongoing;"Law (Q1); Political Science and International Relations (Q2); Economics and Econometrics (Q3)"
275;8300153115;Advances in Environmental Accounting and Management;book series;14793598;0.288;Q2;12;10;9;243;5;8;0;24.3;United Kingdom;Emerald Group Publishing Ltd.;2000, 2003, 2006, 2014-ongoing;"Economics, Econometrics and Finance (miscellaneous) (Q2); Management, Monitoring, Policy and Law (Q2); Accounting (Q3)"
276;22839;International Marketing Review;journal;02651335;0.287;Q3;77;32;93;1675;54;93;0.44;52.34;United Kingdom;Emerald Group Publishing Ltd;1983-ongoing;"Business and International Management (Q2); Marketing (Q2); Economics and Econometrics (Q3)"
277;145573;GENEVA Risk and Insurance Review;journal;1554964X;0.281;Q3;19;11;31;210;8;31;0.24;19.09;Germany;Springer Verlag;1996-2002, 2005-ongoing;"Business, Management and Accounting (miscellaneous) (Q2); Accounting (Q3); Economics and Econometrics (Q3); Finance (Q3)"
278;11800154587;China Information;journal;0920203X, 1741590X;0.28;Q2;20;8;38;396;12;38;0.37;49.5;United Kingdom;SAGE Publications;1986-ongoing;"Arts and Humanities (miscellaneous) (Q2); Economics, Econometrics and Finance (miscellaneous) (Q2); Social Sciences (miscellaneous) (Q2)"
279;24010;Constitutional Political Economy;journal;15729966, 10434062;0.28;Q3;26;18;57;640;41;57;0.55;35.56;Netherlands;Kluwer Academic Publishers;1990-ongoing;"Law (Q1); Philosophy (Q1); Sociology and Political Science (Q2); Economics and Econometrics (Q3)"
280;19571;Journal of Media Economics;journal;08997764, 15327736;0.276;Q3;28;15;44;726;22;43;0.48;48.4;United States;Lawrence Erlbaum Associates Inc.;1988-ongoing;"Communication (Q2); Economics and Econometrics (Q3)"
281;19700169607;Annals of Public and Cooperative Economics;journal;13704788, 14678292;0.273;Q3;32;27;77;811;26;74;0.37;30.04;United Kingdom;Blackwell Publishing Inc.;1925-1942, 1948-ongoing;"Sociology and Political Science (Q2); Economics and Econometrics (Q3)"
282;26747;Desarrollo Economico: Revista de Ciencias Sociales;journal;0046001X;0.271;Q3;16;23;68;923;15;68;0.25;40.13;Argentina;Instituto de Desarrollo Economico y Social;1979, 1983, 1992-2011, 2016-ongoing;Economics and Econometrics (Q3)
283;20633;Journal of International Management;journal;10754253;0.271;Q3;60;27;55;1203;35;51;0.8;44.56;Netherlands;Elsevier BV;1998-ongoing;"Business and International Management (Q2); Finance (Q3); Strategy and Management (Q3)"
284;69005;Agricultural Finance Review;journal;00021466, 20416326;0.266;Q2;18;12;32;310;6;32;0.23;25.83;United Kingdom;Emerald Group Publishing Ltd.;1980, 2000-ongoing;"Agricultural and Biological Sciences (miscellaneous) (Q2); Economics, Econometrics and Finance (miscellaneous) (Q2); Economics and Econometrics (Q3); Finance (Q3); Strategy and Management (Q3)"
285;23717;International Journal of Social Economics;journal;03068293;0.265;Q3;34;69;178;2136;47;177;0.16;30.96;United Kingdom;Emerald Group Publishing Ltd.;1974-ongoing;"Social Sciences (miscellaneous) (Q2); Economics and Econometrics (Q3)"
286;35154;Berichte uber Landwirtschaft;journal;00059080;0.264;Q3;11;38;82;1223;23;81;0.31;32.18;Germany;Landwirtschaftsverlag GmbH;1973, 1976-1982, 1984-1987, 1993, 1996-ongoing;"Agronomy and Crop Science (Q3); Animal Science and Zoology (Q3); Economics and Econometrics (Q3)"
287;12975;Economic Systems;journal;09393625;0.264;Q3;31;20;50;695;24;47;0.51;34.75;Netherlands;Elsevier BV;2001-ongoing;Economics and Econometrics (Q3)
288;17423;Geneva Papers on Risk and Insurance: Issues and Practice;journal;10185895, 14680440;0.262;Q3;28;67;139;959;36;139;0.19;14.31;Germany;Springer Verlag;1999-ongoing;"Business, Management and Accounting (miscellaneous) (Q2); Accounting (Q3); Economics and Econometrics (Q3); Finance (Q3)"
289;65131;Canadian Journal of Agricultural Economics;journal;00083976;0.261;Q3;31;25;122;684;29;122;0.19;27.36;United States;Wiley-Blackwell;1952-ongoing;"Agronomy and Crop Science (Q3); Animal Science and Zoology (Q3); Ecology (Q3); Economics and Econometrics (Q3); Global and Planetary Change (Q4)"
290;22726;Applied Financial Economics;journal;09603107, 14664305;0.26;Q3;48;85;169;2423;54;169;0.19;28.51;United Kingdom;Chapman & Hall;1996-2014;"Economics and Econometrics (Q3); Finance (Q3)"
291;27132;Jahrbucher fr Nationalokonomie und Statistik;journal;00214027;0.258;Q3;18;41;107;1135;16;107;0.17;27.68;Germany;Walter de Gruyter GmbH;1978, 1980, 1982, 1985, 1987-1990, 1992-ongoing;"Business, Management and Accounting (miscellaneous) (Q2); Social Sciences (miscellaneous) (Q2); Economics and Econometrics (Q3)"
292;29554;Journal of Bioeconomics;journal;13876996, 15736989;0.258;Q3;22;11;34;427;13;34;0.29;38.82;Netherlands;Kluwer Academic Publishers;1999-ongoing;"Geography, Planning and Development (Q2); Economics and Econometrics (Q3)"
293;25477;South African Journal of Economics;journal;00382280;0.258;Q3;26;34;124;983;47;124;0.36;28.91;United States;Wiley-Blackwell;1933-ongoing;Economics and Econometrics (Q3)
294;28408;Australian Economic History Review;journal;14678446, 00048992;0.257;Q3;14;0;11;0;3;11;0;0;United Kingdom;Blackwell Publishing Inc.;1974, 1983-1984, 1988, 1990-1991, 1993-2001, 2006-ongoing;"History (Q1); Economics and Econometrics (Q3)"
295;29035;Open Economies Review;journal;09237992, 1573708X;0.257;Q3;29;22;72;581;25;72;0.39;26.41;Netherlands;Kluwer Academic Publishers;1990-ongoing;Economics and Econometrics (Q3)
296;26181;Trimestre Economico;journal;00413011;0.257;Q3;10;26;60;882;10;59;0.11;33.92;Mexico;Fondo de Cultura Economica;1979, 1981, 1989, 1996-ongoing;Economics and Econometrics (Q3)
297;24228;Review of Social Economy;journal;14701162, 00346764;0.254;Q3;29;24;85;892;33;73;0.47;37.17;United Kingdom;Routledge;1942, 1944, 1946-ongoing;Economics and Econometrics (Q3)
298;29448;Review of Radical Political Economics;journal;04866134;0.253;Q3;26;27;96;976;42;91;0.33;36.15;United States;SAGE Publications;1969-ongoing;"Philosophy (Q1); Economics and Econometrics (Q3)"
299;29064;Engineering Economist;journal;0013791X;0.252;Q3;29;22;61;373;23;56;0.33;16.95;United Kingdom;Taylor & Francis;1955-ongoing;"Education (Q2); Engineering (miscellaneous) (Q2); Economics and Econometrics (Q3)"
300;12915;Space Policy;journal;02659646;0.252;Q3;21;40;79;416;34;79;0.4;10.4;United Kingdom;Elsevier Ltd.;1985-ongoing;"Sociology and Political Science (Q2); Economics and Econometrics (Q3); Space and Planetary Science (Q3)"
301;21100372152;Journal of Behavioral and Experimental Economics;journal;22148051, 22148043;0.251;Q3;54;49;111;2008;51;106;0.39;40.98;United States;Elsevier Inc.;2014-ongoing;"Social Sciences (miscellaneous) (Q2); Applied Psychology (Q3); Economics and Econometrics (Q3)"
302;20314;Journal of Institutional and Theoretical Economics;journal;09324569;0.251;Q3;31;56;130;1113;47;130;0.37;19.88;Germany;Mohr Siebeck GmbH and Co. KG;1992-1993, 1996-ongoing;Economics and Econometrics (Q3)
303;23052;Politicka Ekonomie;journal;23368225, 00323233;0.251;Q3;13;42;139;926;22;135;0.16;22.05;Czech Republic;Vysoka Skola Ekonomicka;1980, 1982, 1986-1987, 1993, 1996-ongoing;"Sociology and Political Science (Q2); Economics and Econometrics (Q3)"
304;20001;Economic Notes;journal;14680300, 03915026;0.249;Q3;18;13;45;427;8;45;0.18;32.85;United Kingdom;Blackwell Publishing Inc.;2001-ongoing;Economics and Econometrics (Q3)
305;14453;Emerging Markets Review;journal;15660141;0.249;Q3;42;24;56;626;23;56;0.37;26.08;Netherlands;Elsevier BV;2000-ongoing;"Business and International Management (Q2); Economics and Econometrics (Q3)"
306;144642;Managerial Auditing Journal;journal;02686902;0.245;Q2;47;71;161;2352;42;161;0.24;33.13;United Kingdom;Emerald Group Publishing Ltd;1986-ongoing;"Business, Management and Accounting (miscellaneous) (Q2); Economics, Econometrics and Finance (miscellaneous) (Q2); Accounting (Q3); Organizational Behavior and Human Resource Management (Q3)"
307;18769;Applied Economics Letters;journal;13504851, 14664291;0.24;Q3;42;198;483;2392;118;483;0.22;12.08;United Kingdom;Chapman & Hall;1994-ongoing;Economics and Econometrics (Q3)
308;29806;International Journal of Accounting Information Systems;journal;14670895;0.24;Q3;44;15;45;553;24;37;0.78;36.87;United Kingdom;Elsevier Ltd.;2000-ongoing;"Accounting (Q3); Finance (Q3); Information Systems and Management (Q3); Management Information Systems (Q3)"
309;28854;International Trade Journal;journal;08853908, 15210545;0.24;Q2;16;27;46;574;10;46;0.24;21.26;United Kingdom;Taylor & Francis;1986-ongoing;"Business and International Management (Q2); Economics, Econometrics and Finance (miscellaneous) (Q2)"
310;200147123;Accounting and Finance;journal;08105391;0.236;Q2;40;17;36;447;17;34;0.26;26.29;United States;Wiley-Blackwell;1979-ongoing;"Economics, Econometrics and Finance (miscellaneous) (Q2); Accounting (Q3); Finance (Q3)"
311;20091;Journal of Macroeconomics;journal;01640704;0.236;Q3;40;33;102;746;34;100;0.23;22.61;Netherlands;Elsevier BV;1979-ongoing;Economics and Econometrics (Q3)
312;20126;Ekonomicky Casopis;journal;00133035;0.235;Q3;15;69;128;1166;12;128;0.08;16.9;Slovakia;Slovak Academic Press Ltd.;1978-ongoing;Economics and Econometrics (Q3)
313;29170;Critical Perspectives on Accounting;journal;10452354, 10959955;0.234;Q3;57;34;117;2164;41;115;0.38;63.65;United States;Elsevier Inc.;1990-ongoing;"Sociology and Political Science (Q2); Accounting (Q3); Finance (Q3); Information Systems and Management (Q3)"
314;20750;European Journal of Law and Economics;journal;09291261, 15729990;0.234;Q3;26;33;90;1154;33;90;0.32;34.97;Netherlands;Kluwer Academic Publishers;1994-ongoing;"Business and International Management (Q2); Law (Q2); Economics and Econometrics (Q3)"
315;23633;Quarterly Review of Economics and Finance;journal;10629769;0.23;Q3;44;45;129;1282;45;127;0.32;28.49;Netherlands;Elsevier BV;1992-ongoing;"Economics and Econometrics (Q3); Finance (Q3)"
316;24191;Review of Political Economy;journal;14653982, 09538259;0.229;Q2;24;28;25;1220;10;25;0.4;43.57;United Kingdom;Taylor & Francis;1989-1996, 2002-ongoing;"Economics, Econometrics and Finance (miscellaneous) (Q2); Political Science and International Relations (Q2)"
317;29429;Post-Communist Economies;journal;14631377;0.227;Q3;23;29;79;909;33;79;0.4;31.34;United Kingdom;Carfax Publishing Ltd.;1999-ongoing;Economics and Econometrics (Q3)
318;19900192150;Pacific Rim Property Research Journal;journal;14445921;0.225;Q2;14;20;53;409;10;52;0.22;20.45;United Kingdom;Taylor & Francis;2000-ongoing;Economics, Econometrics and Finance (miscellaneous) (Q2)
319;29258;Public Finance Review;journal;10911421;0.223;Q3;28;31;87;747;25;86;0.29;24.1;United States;SAGE Publications;1973-1987, 1989-ongoing;"Economics and Econometrics (Q3); Finance (Q3); Public Administration (Q3)"
320;15089;Finance a Uver;journal;24647683, 00151920;0.218;Q3;16;28;171;616;13;171;0.07;22;Czech Republic;Datakonekt sro;1996-ongoing;"Accounting (Q3); Economics and Econometrics (Q3); Finance (Q3)"
321;81032;Japanese Economic Review;journal;13524739, 14685876;0.215;Q3;24;26;98;542;23;98;0.23;20.85;United Kingdom;Blackwell Publishing Inc.;1995-ongoing;Economics and Econometrics (Q3)
322;18299;American Journal of Economics and Sociology;journal;00029246, 15367150;0.214;Q3;34;59;142;1612;45;137;0.45;27.32;United Kingdom;Blackwell Publishing Inc.;1941-1966, 1968-1976, 1978-ongoing;"Economics and Econometrics (Q3); Sociology and Political Science (Q3)"
323;17332;International Journal of Finance and Economics;journal;10991158, 10769307;0.214;Q3;36;20;63;647;17;63;0.33;32.35;United States;John Wiley & Sons Inc.;1996-ongoing;"Accounting (Q3); Economics and Econometrics (Q3); Finance (Q3)"
324;12964;Review of Quantitative Finance and Accounting;journal;0924865X, 15737179;0.214;Q3;36;39;115;1103;23;115;0.21;28.28;United States;Springer New York LLC;1991-ongoing;"Business, Management and Accounting (miscellaneous) (Q2); Accounting (Q3); Finance (Q3)"
