Rank;Sourceid;Title;Type;Issn;SJR;SJR Best Quartile;H index;Total Docs. (2002);Total Docs. (3years);Total Refs.;Total Cites (3years);Citable Docs. (3years);Cites / Doc. (2years);Ref. / Doc.;Country;Region;Publisher;Coverage;Categories
569;23408;Chemistry and Industry (London);trade journal;00093068, 20476329;0.194;Q3;29;99;128;387;61;128;0.38;3.91;United States;Northern America;Wiley-Blackwell;1965-1971, 1973-2021;"Chemical Engineering (miscellaneous) (Q2); Chemistry (miscellaneous) (Q3); Biotechnology (Q4)"
570;34587;International Journal of Polymeric Materials and Polymeric Biomaterials;journal;1563535X, 00914037;0.193;Q4;43;81;291;1648;66;290;0.23;20.35;United Kingdom;Western Europe;Taylor and Francis Ltd.;1971-2021;"Chemical Engineering (miscellaneous) (Q2); Polymers and Plastics (Q3); Analytical Chemistry (Q4)"
571;21986;Turkish Journal of Chemistry;journal;13036130, 13000527;0.192;Q3;49;113;162;2457;56;162;0.38;21.74;Turkey;Middle East;TUBITAK;1996-2021;Chemistry (miscellaneous) (Q3)
572;24057;Kao Teng Hsueh Hsiao Hua Heush Hsueh Pao/ Chemical Journal of Chinese Universities;journal;02510790;0.19;Q3;25;612;1512;7314;465;1512;0.33;11.95;China;Asiatic Region;Higher Education Press;1996-2021;Chemistry (miscellaneous) (Q3)
573;23521;Ecletica Quimica;journal;01004670;0.189;Q3;21;47;49;752;10;49;0.25;16;Brazil;Latin America;Atlantis Livros Ltda.;1996-2021;"Chemistry (miscellaneous) (Q3); Physics and Astronomy (miscellaneous) (Q4)"
574;19700181203;KONA Powder and Particle Journal;journal;02884534, 21875537;0.189;Q3;39;24;76;711;20;73;0.35;29.63;Japan;Asiatic Region;Hosokawa Powder Technology Foundation;1983-2021;"Chemical Engineering (miscellaneous) (Q2); Engineering (miscellaneous) (Q2); Chemistry (miscellaneous) (Q3); Materials Science (miscellaneous) (Q3)"
575;24666;Journal of Supramolecular Chemistry;journal;14727862;0.187;Q3;22;72;41;2440;14;39;0.34;33.89;Netherlands;Western Europe;Elsevier BV;2001-2002;"Chemistry (miscellaneous) (Q3); Materials Chemistry (Q3); Inorganic Chemistry (Q4); Organic Chemistry (Q4)"
576;25921;Khimiya Geterotsiklicheskikh Soedinenii;journal;01326244;0.185;Q4;16;226;180;2952;63;180;0.37;13.06;Latvia;Eastern Europe;Latvian Institute of Organic Synthesis;1996-2011;Organic Chemistry (Q4)
577;26882;Comprehensive Chemical Kinetics;book series;00698040;0.183;Q4;12;0;39;0;13;5;0.06;0;Netherlands;Western Europe;Elsevier;1969, 1972-1973, 1975-1978, 1980, 1983-1986, 1988-1992, 1996-1999, 2001, 2003-2005, 2007;"Chemical Engineering (miscellaneous) (Q2); Physical and Theoretical Chemistry (Q4)"
578;12888;Chinese Journal of Chemical Engineering;journal;10049541;0.182;Q3;61;86;203;1253;49;203;0.25;14.57;China;Asiatic Region;Chemical Industry Press;1993-2021;"Chemical Engineering (miscellaneous) (Q2); Chemistry (miscellaneous) (Q3); Environmental Engineering (Q3); Biochemistry (Q4)"
579;24534;Spectroscopy Europe;journal;09660941;0.182;Q4;23;25;56;153;15;45;0.2;6.12;United States;Northern America;Wiley-Blackwell;1996-2021;"Analytical Chemistry (Q4); Atomic and Molecular Physics, and Optics (Q4); Spectroscopy (Q4)"
580;24817;Nachrichten aus der Chemie;journal;14399598;0.181;Q3;17;177;385;1758;66;358;0.17;9.93;Germany;Western Europe;"Walter de Gruyter GmbH &amp; Co. KG";1982-1984, 1986, 1996-2021;"Chemical Engineering (miscellaneous) (Q2); Chemistry (miscellaneous) (Q3)"
581;145581;International Journal of Photoenergy;journal;1110662X, 1687529X;0.179;Q3;56;25;65;648;29;65;0.55;25.92;United States;Northern America;Hindawi Publishing Corporation;1999-2021;"Chemistry (miscellaneous) (Q3); Materials Science (miscellaneous) (Q3); Renewable Energy, Sustainability and the Environment (Q3); Atomic and Molecular Physics, and Optics (Q4)"
582;26985;Kinetics and Catalysis;journal;00231584, 16083210;0.176;Q3;36;117;352;2612;64;352;0.15;22.32;United States;Northern America;Pleiades Publishing;1968-1971, 1984-1992, 1996-2021;"Chemistry (miscellaneous) (Q3); Modeling and Simulation (Q3); Catalysis (Q4); Computer Science Applications (Q4)"
583;21457;Przemysl Chemiczny;journal;00332496;0.176;Q3;20;72;185;1535;29;185;0.16;21.32;Poland;Eastern Europe;Wydawnictwo SIGMA - N O T Sp. z o.o.;1973, 1975-1988, 1990, 1996-2021;"Chemical Engineering (miscellaneous) (Q2); Chemistry (miscellaneous) (Q3)"
584;12680;Farbe und Lack;trade journal;00147699;0.175;Q3;11;119;261;351;31;191;0.08;2.95;Germany;Western Europe;Vincentz Verlag;1973-1974, 1976-1981, 1983-1989, 1994-2021;"Chemistry (miscellaneous) (Q3); Surfaces, Coatings and Films (Q3)"
585;21997;Uspekhi Khimii;journal;00421308;0.175;Q3;32;52;166;7332;78;166;0.61;141;United Kingdom;Western Europe;Turpion Ltd.;1961-1962, 1973, 1996-2005;Chemistry (miscellaneous) (Q3)
586;23372;Chemicke Listy;journal;12137103, 00092770;0.173;Q3;28;82;277;2724;60;277;0.25;33.22;Czech Republic;Eastern Europe;Czech Society of Chemical Engineering;1996-2021;Chemistry (miscellaneous) (Q3)
587;25246;Chinese Journal of Catalysis;journal;18722067, 02539837;0.172;Q3;74;110;532;1322;127;532;0.26;12.02;China;Asiatic Region;Science Press;1996-2021;"Chemistry (miscellaneous) (Q3); Catalysis (Q4)"
588;12155;Journal of Applied Spectroscopy;journal;00219037, 15738647;0.172;Q4;28;0;11;0;4;11;0;0;Germany;Western Europe;"Springer GmbH &amp; Co, Auslieferungs-Gesellschaf";1965-1999, 2003-2021;"Condensed Matter Physics (Q4); Spectroscopy (Q4)"
589;21100470629;High Temperature Material Processes;journal;10933611, 19404360;0.171;Q4;19;46;125;775;27;125;0.22;16.85;United States;Northern America;Begell House Inc.;1997-2021;"Energy Engineering and Power Technology (Q2); Engineering (miscellaneous) (Q2); Materials Science (miscellaneous) (Q3); Condensed Matter Physics (Q4); Physical and Theoretical Chemistry (Q4); Spectroscopy (Q4)"
590;23777;Zhurnal Fizicheskoj Khimii;journal;00444537;0.17;Q4;19;405;902;0;257;902;0.3;0;Russian Federation;Eastern Europe;Izdatel'stvo Nauka;1987, 1996-2004;Physical and Theoretical Chemistry (Q4)
591;4900153301;Magyar Kemiai Folyoirat, Kemiai Kozlemenyek;journal;14189933;0.169;Q3;6;71;154;2001;21;154;0.15;28.18;Hungary;Eastern Europe;Magyar Kemikusok Egyesulete/Hungarian Chemical Society;1997-2002, 2004-2006;Chemistry (miscellaneous) (Q3)
592;22677;Ambix;journal;17458234, 00026980;0.168;Q3;12;8;13;0;4;13;0.31;0;United Kingdom;Western Europe;Maney Publishing;1937-1938, 1946, 1948-1949, 1951, 1953, 1956-1996, 1998, 2000-2021;"History and Philosophy of Science (Q2); Chemistry (miscellaneous) (Q3)"
593;24018;Journal of Analytical Chemistry;journal;16083199, 10619348;0.168;Q4;35;192;646;4040;103;622;0.16;21.04;United States;Northern America;Pleiades Publishing;1996-2021;Analytical Chemistry (Q4)
594;26902;High Energy Chemistry;journal;00181439, 16083148;0.167;Q4;24;81;229;1564;76;229;0.39;19.31;United States;Northern America;Pleiades Publishing;1996-2021;Physical and Theoretical Chemistry (Q4)
595;22671;Afinidad;journal;00019704;0.166;Q3;17;95;170;2120;45;170;0.15;22.32;Spain;Western Europe;Asociacion de Quimicos del Instituto Quimico de Sarria;1996-2021;"Chemical Engineering (miscellaneous) (Q2); Chemistry (miscellaneous) (Q3)"
596;26530;Chinese Journal of Organic Chemistry;journal;02532786;0.165;Q4;34;186;441;4219;108;441;0.3;22.68;China;Asiatic Region;Science Press;1996-2021;Organic Chemistry (Q4)
597;39914;Magnesium-Bulletin;journal;0172908X;0.161;Q3;7;0;31;0;7;31;0.27;0;Germany;Western Europe;Fischer Medical Publications;1993-2000;"Biochemistry, Genetics and Molecular Biology (miscellaneous) (Q3); Chemistry (miscellaneous) (Q3)"
598;14425;Journal of Surface Science and Technology;journal;09769420, 09701893;0.16;Q4;17;18;63;510;10;63;0.16;28.33;India;Asiatic Region;Indian Society for Surface Science and Technology;1996-2012, 2014-2020;"Surfaces, Coatings and Films (Q3); Electrochemistry (Q4); Materials Chemistry (Q4); Surfaces and Interfaces (Q4)"
599;6100153025;Bulletin of the Academy of Sciences of the USSR Division of Chemical Science;journal;05685230;0.159;Q3;0;0;0;0;0;0;0;0;United States;Northern America;Consultants Bureau;1952-1992;Chemistry (miscellaneous) (Q3)
600;5600152816;European Physical Journal: Special Topics;journal;19516355, 19516401;0.159;Q4;80;363;1815;5682;287;1794;0.14;15.65;Germany;Western Europe;Springer Verlag;2007-2021;"Materials Science (miscellaneous) (Q3); Physical and Theoretical Chemistry (Q4); Physics and Astronomy (miscellaneous) (Q4)"
601;21100451331;IEEE/ISPRS Joint Workshop on Remote Sensing and Data Fusion over Urban Areas, DFUA 2001;conference and proceedings;-;0.158;-;12;0;69;0;19;68;0.28;0;United States;Northern America;;;"Chemical Engineering (miscellaneous); Inorganic Chemistry"
602;29891;Springer Series in Chemical Physics;book series;01726218;0.157;Q4;17;1;253;269;53;251;0.21;269;United States;Northern America;Springer New York;1982, 1989, 1991, 1993-1994, 1996, 1998, 2000-2011, 2013-2021;Physical and Theoretical Chemistry (Q4)
603;28444;Steel Times International;trade journal;01437798;0.157;Q4;9;177;176;52;1;147;0.01;0.29;United Kingdom;Western Europe;DMG World Media (UK) Ltd.;1980-1990, 1995-2020;"Metals and Alloys (Q3); Condensed Matter Physics (Q4); Materials Chemistry (Q4); Physical and Theoretical Chemistry (Q4)"
604;23430;Chemistry World;trade journal;14737604;0.156;Q3;18;228;493;276;47;257;0.07;1.21;United Kingdom;Western Europe;Royal Society of Chemistry;2004-2021;Chemistry (miscellaneous) (Q3)
605;28388;Journal of the Society of Leather Technologies and Chemists;journal;01440322;0.155;Q3;26;82;131;385;46;113;0.29;4.7;United Kingdom;Western Europe;Society of Leather Technologists and Chemists;1994-2021;"Chemical Engineering (miscellaneous) (Q3); Chemistry (miscellaneous) (Q3); Materials Science (miscellaneous) (Q3)"
606;23245;Chemtracts;journal;14319268;0.154;Q3;23;105;440;2357;48;310;0.09;22.45;United States;Northern America;Data Trace Publishing Co.;1997-2010;"Chemistry (miscellaneous) (Q3); Biochemistry (Q4); Molecular Biology (Q4)"
607;25332;Chinese Journal of Inorganic Chemistry;journal;10014861;0.153;Q4;29;299;440;4554;116;440;0.32;15.23;China;Asiatic Region;Chinese Chemical Society;1996-2020;Inorganic Chemistry (Q4)
608;25258;Kuei Suan Jen Hsueh Pao/ Journal of the Chinese Ceramic Society;journal;04545648;0.153;Q4;30;90;142;975;14;142;0.1;10.83;China;Asiatic Region;Chinese Ceramic Society;2000-2021;"Ceramics and Composites (Q3); Inorganic Chemistry (Q4); Materials Chemistry (Q4)"
609;14905;Physiological Chemistry and Physics and Medical NMR;journal;07486642;0.153;Q4;17;15;49;357;16;49;0.3;23.8;United States;Northern America;Pacific Press Inc.;1983-2008, 2011-2012, 2014;"Medicine (miscellaneous) (Q3); Biochemistry (Q4); Biophysics (Q4); Physiology (Q4); Spectroscopy (Q4)"
610;21523;Russian Journal of Coordination Chemistry/Koordinatsionnaya Khimiya;journal;10703284, 16083318;0.152;Q3;29;141;426;3366;70;421;0.18;23.87;United States;Northern America;Pleiades Publishing;1996-2021;"Chemical Engineering (miscellaneous) (Q3); Chemistry (miscellaneous) (Q3)"
611;28867;Journal of Applied Fire Science;journal;10444300, 15414183;0.151;Q3;15;22;45;440;6;39;0.2;20;United States;Northern America;Baywood Publishing Co. Inc.;1993-1994, 1996-2000, 2002-2013;"Chemical Engineering (miscellaneous) (Q3); Chemistry (miscellaneous) (Q3); Condensed Matter Physics (Q4); Safety, Risk, Reliability and Quality (Q4)"
612;27804;Mineral Processing and Extractive Metallurgy Review;journal;08827508, 15477401;0.151;Q4;41;15;72;487;12;71;0.17;32.47;United Kingdom;Western Europe;Taylor and Francis Ltd.;1983, 1985, 1987-1998, 2000-2021;"Economic Geology (Q2); Geotechnical Engineering and Engineering Geology (Q2); Mechanical Engineering (Q3); Chemistry (miscellaneous) (Q4)"
613;21544;South African Journal of Chemistry;journal;03794350;0.151;Q3;22;15;63;299;16;63;0.29;19.93;South Africa;Africa;Bureau for Scientific Publications;1996-2021;Chemistry (miscellaneous) (Q3)
614;74390;Palpu Chongi Gisul/Journal of Korea Technical Association of the Pulp and Paper Industry;journal;02533200;0.147;Q4;13;50;81;464;6;79;0.07;9.28;South Korea;Asiatic Region;Korean Technical Assoc. of the Pulp and Paper Industry;2000-2021;"Media Technology (Q2); Materials Science (miscellaneous) (Q3); Chemistry (miscellaneous) (Q4)"
615;27056;Colloid Journal;journal;1061933X, 16083067;0.144;Q4;35;121;358;2287;48;358;0.16;18.9;United States;Northern America;Pleiades Publishing;1989, 1991-1992, 1995-2021;"Colloid and Surface Chemistry (Q4); Physical and Theoretical Chemistry (Q4); Surfaces and Interfaces (Q4)"
616;14217;Materiale Plastice;journal;00255289;0.144;Q4;25;40;87;1069;27;87;0.37;26.73;Romania;Eastern Europe;Syscom 18 SRL;1970-1971, 1973, 1975-1986, 1988, 1996-2021;"Polymers and Plastics (Q3); Chemistry (miscellaneous) (Q4); Materials Chemistry (Q4); Mechanics of Materials (Q4)"
617;21100855860;Chemical Analysis;book series;00692883;0.143;Q4;15;0;44;0;7;44;0.19;0;United States;Northern America;Interscience Publishers Inc.;1996-2001, 2005, 2007, 2010;Analytical Chemistry (Q4)
618;21100244836;Journal of Energy Chemistry;journal;20954956;0.143;Q4;75;28;67;400;6;67;0.06;14.29;Netherlands;Western Europe;Elsevier BV;2013-2022;"Energy (miscellaneous) (Q2); Fuel Technology (Q2); Energy Engineering and Power Technology (Q3); Electrochemistry (Q4)"
619;26420;Organometallic Chemistry;book series;03010074;0.143;Q4;13;13;43;2013;4;41;0.07;154.85;United Kingdom;Western Europe;Royal Society of Chemistry;1998-2002, 2004-2005, 2007-2012, 2014, 2016, 2019, 2021;"Inorganic Chemistry (Q4); Organic Chemistry (Q4); Physical and Theoretical Chemistry (Q4)"
620;25220;Russian Journal of Electrochemistry;journal;10231935, 16083342;0.143;Q4;40;213;658;4593;54;657;0.09;21.56;United States;Northern America;Pleiades Publishing;1996-2021;Electrochemistry (Q4)
621;29669;Corrosion Science and Protection Technology;journal;10026495;0.142;Q4;16;99;335;1061;27;335;0.07;10.72;China;Asiatic Region;Chinese Academy of Sciences;1992, 1995-2002, 2005-2011, 2013-2019;"Chemical Engineering (miscellaneous) (Q3); Materials Science (miscellaneous) (Q3); Chemistry (miscellaneous) (Q4)"
622;24082;Progress in Chemistry;journal;1005281X;0.142;Q4;35;68;139;4169;41;139;0.23;61.31;China;Asiatic Region;Chinese Academy of Sciences;1997-2021;Chemistry (miscellaneous) (Q4)
623;23773;Wuli Huaxue Xuebao/ Acta Physico - Chimica Sinica;journal;10006818;0.142;Q4;41;234;656;3170;103;656;0.19;13.55;China;Asiatic Region;Chinese Chemical Society and Peking University;1996-2021;Physical and Theoretical Chemistry (Q4)
624;23343;Bulletin of the Chemical Society of Ethiopia;journal;10113924, 1726801X;0.14;Q4;27;21;53;497;9;53;0.23;23.67;Ethiopia;Africa;Chemical Society of Ethiopia;1996-2021;Chemistry (miscellaneous) (Q4)
625;12916;E-Polymers;journal;16187229;0.14;Q4;27;59;19;1971;2;19;0.11;33.41;France;Western Europe;European Polymer Federation;2001-2021;"Chemical Engineering (miscellaneous) (Q3); Polymers and Plastics (Q3); Physical and Theoretical Chemistry (Q4)"
626;12894;Chinese Journal of Chromatography (Se Pu);journal;18722059, 10008713;0.139;Q4;21;145;511;340;63;511;0.1;2.34;China;Asiatic Region;Zhongguo Kexueyuan - Chinese Academy of Sciences;1997-2021;"Chemical Engineering (miscellaneous) (Q3); Analytical Chemistry (Q4); Biochemistry (Q4); Electrochemistry (Q4); Organic Chemistry (Q4)"
627;22476;Informacion Tecnologica (discontinued);journal;07180764, 07168756;0.139;-;15;149;306;1996;11;306;0.05;13.4;Chile;Latin America;Centro de Informacion Tecnologica;1996-2021;"Energy (miscellaneous) (Q2); Geotechnical Engineering and Engineering Geology (Q2); Industrial and Manufacturing Engineering (Q2); Computer Science Applications (Q4); Food Science (Q4); Strategy and Management (Q4)"
628;15175;Kami Pa Gikyoshi/Japan Tappi Journal;journal;0022815X;0.138;Q4;9;176;433;608;18;433;0.05;3.45;Japan;Asiatic Region;Japan Technical Association of the Pulp and Paper Industry;1996-2010;"Media Technology (Q2); Materials Science (miscellaneous) (Q3); Mechanical Engineering (Q3); Chemistry (miscellaneous) (Q4)"
629;22182;Arkivoc;journal;15517004, 15517012;0.133;Q4;64;197;256;5222;34;253;0.13;26.51;United States;Northern America;Arkat USA;2000-2021;Organic Chemistry (Q4)
630;21525;Russian Journal of General Chemistry;journal;16083350, 10703632;0.133;Q4;32;377;1193;6096;91;1193;0.07;16.17;United States;Northern America;Pleiades Publishing;1996-2021;Chemistry (miscellaneous) (Q4)
631;25310;Annual Reports on the Progress of Chemistry - Section A;journal;14604760, 02601818;0.132;Q4;17;41;85;8579;12;84;0.11;209.24;United Kingdom;Western Europe;Royal Society of Chemistry;1979-1980, 1982-2013;Chemistry (miscellaneous) (Q4)
632;24152;Jiegou Huaxue;journal;02545861;0.132;Q4;22;149;300;2025;48;300;0.19;13.59;China;Asiatic Region;Fujian Institute of Research of the Structure of Matter;1996-2021;Chemistry (miscellaneous) (Q4)
633;14237;Journal of Fuel Chemistry and Technology;journal;18725813, 02532409;0.132;Q4;41;83;407;0;20;407;0.07;0;China;Asiatic Region;Science Press;1996-2021;"Fuel Technology (Q2); Chemical Engineering (miscellaneous) (Q3); Physical and Theoretical Chemistry (Q4)"
634;12865;Photonics Spectra;trade journal;07311230;0.132;Q4;18;475;1062;45;56;610;0.05;0.09;United States;Northern America;Laurin Publishing Co. Inc.;1982-1990, 1994-2020;"Analytical Chemistry (Q4); Atomic and Molecular Physics, and Optics (Q4)"
635;21100409900;Protection of Metals and Physical Chemistry of Surfaces;journal;2070206X, 20702051;0.132;Q4;27;98;331;1876;14;331;0.04;19.14;United States;Northern America;Pleiades Publishing;2009-2021;"Metals and Alloys (Q3); Materials Chemistry (Q4); Organic Chemistry (Q4); Surfaces, Coatings and Films (Q4)"
636;25790;Bioorganicheskaya Khimiya;journal;01323423;0.131;Q4;18;85;365;1630;65;362;0.15;19.18;Russian Federation;Eastern Europe;Izdatel'stvo Nauka;1983-2015;"Medicine (miscellaneous) (Q3); Biochemistry (Q4); Organic Chemistry (Q4)"
637;18082;GAK Gummi Fasern Kunststoffe (discontinued);trade journal;01761625;0.131;Q4;9;204;297;439;8;149;0.03;2.15;Germany;Western Europe;Dr. Gupta Verlag;1979, 1984-2017;"Chemical Engineering (miscellaneous) (Q3); Polymers and Plastics (Q3); Chemistry (miscellaneous) (Q4); Materials Chemistry (Q4)"
638;24648;Journal of Structural Chemistry;journal;00224766, 15738779;0.131;Q4;32;152;451;2627;51;451;0.08;17.28;United States;Northern America;Pleiades Publishing;1960-2021;"Inorganic Chemistry (Q4); Materials Chemistry (Q4); Physical and Theoretical Chemistry (Q4)"
639;21407;Nippon Kagaku Kaishi;journal;03694577, 21850909;0.131;Q4;15;76;371;1109;45;371;0.17;14.59;Japan;Asiatic Region;The Chemical Society of Japan;1929-1934, 1938-1939, 1941-1947, 1972-2002;Chemistry (miscellaneous) (Q4)
640;25311;Russian Journal of Inorganic Chemistry;journal;00360236, 15318613;0.131;Q4;34;344;1119;6072;95;1119;0.1;17.65;United States;Northern America;Pleiades Publishing;1996-2021;Inorganic Chemistry (Q4)
641;27057;Russian Journal of Physical Chemistry A;journal;00360244, 1531863X;0.131;Q4;29;420;1342;7609;121;1342;0.09;18.12;United States;Northern America;Pleiades Publishing;1996-2021;Physical and Theoretical Chemistry (Q4)
642;12000154531;Techniques and Instrumentation in Analytical Chemistry;book series;01679244;0.131;Q4;12;12;60;1767;16;34;0.35;147.25;Netherlands;Western Europe;Elsevier;1978, 1982, 1984, 1986, 1988-1989, 1992-1995, 1997-2002, 2005, 2007, 2010;Analytical Chemistry (Q4)
643;23339;Chemical Research in Chinese Universities;journal;10059040;0.13;Q4;28;76;153;1217;24;153;0.19;16.01;Switzerland;Western Europe;Springer International Publishing AG;1999-2021;"Chemistry (miscellaneous) (Q4); Education (Q4)"
644;14727;International Paperworld IPW;trade journal;16151720;0.13;Q4;7;173;368;154;4;230;0.01;0.89;Germany;Western Europe;DPW-Verlagsgesellschaft GmbH;2003-2021;"Media Technology (Q2); Chemical Engineering (miscellaneous) (Q3); Materials Science (miscellaneous) (Q3); Chemistry (miscellaneous) (Q4); Economics and Econometrics (Q4); Materials Chemistry (Q4)"
645;13585;Kemija u industriji/Journal of Chemists and Chemical Engineers (discontinued);journal;00229830;0.13;Q4;11;127;127;1008;4;86;0.02;7.94;Croatia;Eastern Europe;Assoc. of Chemists and Chemical Engineers of Croatia;1993-1999, 2001-2017;"Chemical Engineering (miscellaneous) (Q3); Chemistry (miscellaneous) (Q4)"
646;27075;Studies in Physical and Theoretical Chemistry;book series;01676881;0.13;Q4;13;0;48;0;9;44;0.33;0;Netherlands;Western Europe;Elsevier;1981, 1995, 1998-1999, 2001;Physical and Theoretical Chemistry (Q4)
647;25815;Chemistry of Natural Compounds;journal;15738388, 00093130;0.128;-;42;126;453;1951;54;452;0.12;15.48;United States;Northern America;Springer New York;1965-2021;Plant Science (Q4)
648;24676;Crystallography Reports;journal;10637745, 1562689X;0.128;Q4;38;193;553;3524;81;553;0.16;18.26;United States;Northern America;Pleiades Publishing;1996-2021;"Materials Science (miscellaneous) (Q3); Chemistry (miscellaneous) (Q4); Condensed Matter Physics (Q4)"
649;19700180816;Developments in Mineral Processing;book series;01674528;0.128;Q4;14;0;125;0;3;124;0.02;0;Netherlands;Western Europe;Elsevier;1992, 2000-2001, 2005-2006;"Environmental Engineering (Q3); Industrial and Manufacturing Engineering (Q3); Materials Chemistry (Q4); Physical and Theoretical Chemistry (Q4)"
650;86779;Chemical Physics Reports;journal;10741550;0.126;Q4;12;0;372;0;37;372;0.06;0;United Kingdom;Western Europe;Cambridge International Science Publishing;1995-2001;"Atomic and Molecular Physics, and Optics (Q4); Chemistry (miscellaneous) (Q4)"
651;145688;Hyle;journal;14335158;0.126;Q4;17;5;24;195;3;24;0.12;39;Germany;Western Europe;Hyle Publications;1997-2002, 2004-2021;"Philosophy (Q3); Chemistry (miscellaneous) (Q4)"
652;25824;Chemistry of Heterocyclic Compounds;journal;00093122, 15738353;0.125;Q4;37;265;749;3549;39;610;0.05;13.39;United States;Northern America;Springer New York;1965-2021;Organic Chemistry (Q4)
653;4800156105;Anales des la Asociacion Quimica Argentina;journal;03650375;0.124;Q4;17;27;52;853;11;52;0.13;31.59;Argentina;Latin America;Asociacion Quimica Argentina;1996-2000, 2002-2004, 2008-2009, 2011, 2013-2014;Chemistry (miscellaneous) (Q4)
654;4900153242;Vestnik Moskovskogo Universiteta Seriya 2 Khimiya;journal;05799384;0.124;Q4;13;0;292;0;42;292;0.16;0;Russian Federation;Eastern Europe;Izdatel'stvo Moskovskogo universiteta;1996-2001, 2003-2006, 2014;Chemistry (miscellaneous) (Q4)
655;88311;Adhaesion Kleben und Dichten;trade journal;16191919;0.123;Q4;7;80;218;111;23;153;0.1;1.39;Germany;Western Europe;Springer Vieweg;1996-2021;"Chemical Engineering (miscellaneous) (Q3); Polymers and Plastics (Q3); Chemistry (miscellaneous) (Q4)"
656;16895;Biokhimiia (Moscow, Russia);journal;03209725;0.122;Q4;19;173;292;10;39;292;0.14;0.06;Russian Federation;Eastern Europe;Izdatel'stvo Nauka;1945, 1947, 1949-1996, 1998-1999, 2001-2005;Chemistry (miscellaneous) (Q4)
657;27919;Rare Metals;journal;10010521, 18677185;0.122;Q4;38;80;184;827;9;184;0.06;10.34;China;Asiatic Region;University of Science and Technology Beijing;1982-1987, 1989-2021;"Metals and Alloys (Q3); Condensed Matter Physics (Q4); Materials Chemistry (Q4); Physical and Theoretical Chemistry (Q4)"
658;26483;Russian Journal of Bioorganic Chemistry;journal;10681620, 1608330X;0.122;Q4;27;72;292;1802;28;292;0.13;25.03;United States;Northern America;Pleiades Publishing;1996-2021;"Biochemistry (Q4); Organic Chemistry (Q4)"
659;13532;Additives for Polymers;trade journal;03063747;0.121;Q4;3;33;1;0;0;1;0;0;United Kingdom;Western Europe;Elsevier Ltd.;1987-1995, 2001-2006, 2015;"Business, Management and Accounting (miscellaneous) (Q3); Industrial and Manufacturing Engineering (Q3); Polymers and Plastics (Q3); Organic Chemistry (Q4)"
660;21100775541;Proceedings - Geometric Modeling and Processing 2000: Theory and Applications;conference and proceedings;-;0.121;-;1;0;1;0;0;1;0;0;United States;Northern America;;;"Condensed Matter Physics; Electrical and Electronic Engineering; Electrochemistry"
661;14357;Theoretical Foundations of Chemical Engineering;journal;00405795, 16083431;0.121;Q4;25;97;282;1564;20;282;0.08;16.12;United States;Northern America;Pleiades Publishing;1974-1992, 1996-2021;"Chemical Engineering (miscellaneous) (Q3); Chemistry (miscellaneous) (Q4)"
662;25331;Wuji Cailiao Xuebao/Journal of Inorganic Materials;journal;1000324X;0.121;Q4;27;84;484;944;38;484;0.11;11.24;China;Asiatic Region;Science Press;1993-2021;"Materials Science (miscellaneous) (Q3); Inorganic Chemistry (Q4)"
663;60277;ACS National Meeting Book of Abstracts;conference and proceedings;00657727;0.12;-;7;0;464;0;18;346;0.05;0;United States;Northern America;American Chemical Society;1999-2001, 2004-2011;"Chemical Engineering (miscellaneous); Chemistry (miscellaneous)"
664;24084;Chemistry Bulletin / Huaxue Tongbao;journal;04413776;0.12;Q4;13;12;460;248;42;459;0.06;20.67;China;Asiatic Region;Science Press;1996-2014, 2016;Chemistry (miscellaneous) (Q4)
665;21969;Theoretical and Experimental Chemistry;journal;1573935X, 00405760;0.12;Q4;20;58;181;1300;15;181;0.11;22.41;United States;Northern America;Springer New York;1965-2021;Chemistry (miscellaneous) (Q4)
666;13227;Paint and Coatings Industry;journal;08843848;0.119;Q4;9;101;144;249;6;134;0.04;2.47;United States;Northern America;Business News Publishing Co.;1996-2021;"Marketing (Q3); Chemistry (miscellaneous) (Q4); Surfaces, Coatings and Films (Q4)"
667;19700180812;Analytical Spectroscopy Library;book series;09264345;0.118;Q4;6;0;76;0;5;1;0;0;Netherlands;Western Europe;Elsevier;1990, 1995-1997, 1999-2000;"Analytical Chemistry (Q4); Spectroscopy (Q4)"
668;16584;Technical Textiles International;trade journal;09645993;0.116;Q4;11;46;176;2;7;175;0.03;0.04;United Kingdom;Western Europe;International Newsletters Ltd;1992-2019;"Business, Management and Accounting (miscellaneous) (Q3); Industrial and Manufacturing Engineering (Q3); Materials Science (miscellaneous) (Q3); Chemistry (miscellaneous) (Q4)"
