Rank;Sourceid;Title;Type;Issn;SJR;SJR Best Quartile;H index;Total Docs. (2014);Total Docs. (3years);Total Refs.;Total Cites (3years);Citable Docs. (3years);Cites / Doc. (2years);Ref. / Doc.;Country;Region;Publisher;Coverage;Categories
753;12155;Journal of Applied Spectroscopy;journal;00219037, 15738647;0.169;Q4;28;175;446;3857;175;446;0.38;22.04;Germany;Western Europe;"Springer GmbH &amp; Co, Auslieferungs-Gesellschaf";1965-1999, 2003-2021;"Condensed Matter Physics (Q4); Spectroscopy (Q4)"
754;16348;Transactions of the Institutions of Mining and Metallurgy, Section C: Mineral Processing and Extractive Metallurgy;journal;03719553, 17432855;0.169;Q4;0;0;0;0;0;0;0;0;United Kingdom;Western Europe;Taylor and Francis Ltd.;1969-1991, 1993-2017;"Geotechnical Engineering and Engineering Geology (Q3); Chemistry (miscellaneous) (Q4); Geochemistry and Petrology (Q4)"
755;19700175454;Bulgarian Chemical Communications;journal;08619808;0.168;Q4;18;159;302;4157;116;297;0.32;26.14;Bulgaria;Eastern Europe;Bulgarian Academy of Sciences;2008-2021;Chemistry (miscellaneous) (Q4)
756;79053;Natural Product Sciences;journal;12263907;0.168;Q4;28;52;163;1232;48;163;0.19;23.69;South Korea;Asiatic Region;Korean Society of Pharmacognosy;1997-2021;"Drug Discovery (Q4); Organic Chemistry (Q4)"
757;15286;AATCC Review;trade journal;15328813, 23305525;0.167;Q4;29;17;129;100;48;129;0.3;5.88;United States;Northern America;American Association of Textile Chemists and Colorists;2001-2020;"Chemical Engineering (miscellaneous) (Q3); Materials Science (miscellaneous) (Q3); Chemistry (miscellaneous) (Q4)"
758;21100195303;Eurasian Journal of Analytical Chemistry (discontinued);journal;13063057;0.166;Q4;16;9;50;264;22;50;0.17;29.33;Turkey;Middle East;Moment Publications;2010-2018, 2020;"Pharmaceutical Science (Q3); Analytical Chemistry (Q4); Electrochemistry (Q4); Spectroscopy (Q4)"
759;12893;Combustion, Explosion and Shock Waves;journal;15738345, 00105082;0.164;Q4;43;103;245;1914;130;245;0.52;18.58;United States;Northern America;Pleiades Publishing;1965-2021;"Chemical Engineering (miscellaneous) (Q3); Energy Engineering and Power Technology (Q3); Fuel Technology (Q3); Chemistry (miscellaneous) (Q4); Physics and Astronomy (miscellaneous) (Q4)"
760;12100154834;Macedonian Journal of Chemistry and Chemical Engineering;journal;18575552, 18575625;0.163;Q4;18;27;67;1139;40;65;0.66;42.19;Macedonia;Eastern Europe;The Society of Chemists and Techonogists of Macedonia;2008-2021;"Chemical Engineering (miscellaneous) (Q3); Chemistry (miscellaneous) (Q4)"
761;23349;Journal of the Chemical Society of Pakistan;journal;02535106;0.161;Q4;26;128;641;3674;278;641;0.41;28.7;Pakistan;Asiatic Region;Chemical Society of Pakistan;1996-2021;Chemistry (miscellaneous) (Q4)
762;21100448902;Proceedings of the 8th International Conference on Structural Dynamics, EURODYN 2011;conference and proceedings;-;0.161;-;11;0;505;0;131;504;0;0;United States;Northern America;;;Organic Chemistry
763;20180;Trace Elements and Electrolytes (discontinued);journal;09462104;0.16;Q4;21;35;101;911;40;97;0.4;26.03;Germany;Western Europe;Dustri-Verlag Dr. Karl Feistle;1994-2016, 2021;"Biochemistry (Q4); Clinical Biochemistry (Q4); Inorganic Chemistry (Q4)"
764;4000151908;Asian Dyer;journal;09729488;0.159;Q4;6;26;109;290;7;108;0.03;11.15;India;Asiatic Region;G P S Kwatra;2006-2021;Chemistry (miscellaneous) (Q4)
765;23908;American Laboratory;trade journal;00447749;0.158;Q4;26;70;245;271;28;245;0.11;3.87;United States;Northern America;CompareNetworks Inc;1974, 1978-1986, 1988-1989, 1993-2019;"Biochemistry, Genetics and Molecular Biology (miscellaneous) (Q4); Chemistry (miscellaneous) (Q4)"
766;63769;He-Huaxue yu Fangshe Huaxue/Journal of Nuclear and Radiochemistry;journal;02539950;0.157;Q4;8;78;189;946;25;189;0.12;12.13;China;Asiatic Region;Science Press;1998, 2000-2021;"Chemistry (miscellaneous) (Q4); Nuclear and High Energy Physics (Q4)"
767;4800156105;Anales des la Asociacion Quimica Argentina;journal;03650375;0.155;Q4;17;146;24;795;13;24;0;5.45;Argentina;Latin America;Asociacion Quimica Argentina;1996-2000, 2002-2004, 2008-2009, 2011, 2013-2014;Chemistry (miscellaneous) (Q4)
768;24740;Latin American Applied Research;journal;03270793;0.155;Q4;26;55;137;1266;46;137;0.23;23.02;Argentina;Latin America;PLAPIQUI Planta Piloto de Ingenieria Quimica, CONICET / Universidad Nacional del Sur;1996-2021;"Chemical Engineering (miscellaneous) (Q3); Chemistry (miscellaneous) (Q4); Mechanical Engineering (Q4)"
769;19700187636;Liquid Crystals Today;journal;14645181, 1358314X;0.154;Q4;15;14;65;123;14;44;0.06;8.79;United Kingdom;Western Europe;Taylor and Francis Ltd.;1991-1996, 2000-2021;"Condensed Matter Physics (Q4); Inorganic Chemistry (Q4); Materials Chemistry (Q4)"
770;22703;Asian Journal of Chemistry;journal;09707077;0.153;Q4;38;2036;5453;41503;1383;5453;0.26;20.38;India;Asiatic Region;Chemical Publishing Co.;1996-2021;Chemistry (miscellaneous) (Q4)
771;24152;Jiegou Huaxue;journal;02545861;0.151;Q4;22;259;796;6685;385;796;0.48;25.81;China;Asiatic Region;Fujian Institute of Research of the Structure of Matter;1996-2021;Chemistry (miscellaneous) (Q4)
772;20000195017;Scientific Study and Research: Chemistry and Chemical Engineering, Biotechnology, Food Industry (discontinued);journal;1582540X;0.151;Q4;12;23;94;455;14;93;0.19;19.78;Romania;Eastern Europe;University of Bacau;2011-2020;"Chemical Engineering (miscellaneous) (Q3); Biotechnology (Q4); Chemistry (miscellaneous) (Q4); Food Science (Q4)"
773;23420;Advances in Chromatography;book series;00652415;0.148;Q4;26;1;20;0;5;17;0;0;United States;Northern America;Marcel Dekker Inc.;1970, 1975-1984, 1986-1987, 1989, 1992-2001, 2003, 2005-2019;Analytical Chemistry (Q4)
774;15791;Chemistry and Technology of Fuels and Oils;journal;00093092, 15738310;0.148;Q4;17;78;227;854;30;227;0.12;10.95;Germany;Western Europe;"Springer GmbH &amp; Co, Auslieferungs-Gesellschaf";1965-2021;"Energy Engineering and Power Technology (Q3); Fuel Technology (Q3); Chemical Engineering (miscellaneous) (Q4); Chemistry (miscellaneous) (Q4)"
775;5800228217;IFRF Combustion Journal;journal;1562479X, 20753071;0.147;Q4;4;3;5;74;1;5;0.2;24.67;Italy;Western Europe;International Flame Research Foundation;2007-2010, 2012-2016;"Energy Engineering and Power Technology (Q3); Fuel Technology (Q3); Chemical Engineering (miscellaneous) (Q4); Chemistry (miscellaneous) (Q4); Physics and Astronomy (miscellaneous) (Q4); Pollution (Q4)"
776;24534;Spectroscopy Europe;journal;09660941;0.147;Q4;23;20;97;137;21;78;0.16;6.85;United States;Northern America;Wiley-Blackwell;1996-2021;"Analytical Chemistry (Q4); Atomic and Molecular Physics, and Optics (Q4); Spectroscopy (Q4)"
777;21669;InterCeram: International Ceramic Review;journal;00205214;0.146;Q4;17;54;207;716;31;194;0.12;13.26;Germany;Western Europe;Expert Fachmedien Gmbh;1979, 1983-1986, 1993-2021;"Ceramics and Composites (Q4); Inorganic Chemistry (Q4); Materials Chemistry (Q4)"
778;12729;Korrozios Figyelo;journal;01332546;0.146;Q4;9;5;40;121;6;40;0.21;24.2;Hungary;Eastern Europe;VEKOR Ltd;1988, 1993-2014;"Chemical Engineering (miscellaneous) (Q4); Chemistry (miscellaneous) (Q4); Materials Chemistry (Q4); Surfaces, Coatings and Films (Q4)"
779;21100197363;Revista Virtual de Quimica;journal;19846835;0.145;Q4;16;110;188;4337;71;166;0.31;39.43;Brazil;Latin America;Sociedade Brasileira de Quimica;2011-2021;"Chemistry (miscellaneous) (Q4); Mathematics (miscellaneous) (Q4)"
780;25141;Zeitschrift fur Kristallographie - New Crystal Structures;journal;14337266;0.145;Q4;38;225;780;2331;107;780;0.16;10.36;Germany;Western Europe;Walter de Gruyter GmbH;1954, 1956-2021;"Condensed Matter Physics (Q4); Inorganic Chemistry (Q4); Materials Science (miscellaneous) (Q4)"
781;7200153124;Eurasian Chemico-Technological Journal;journal;15623920;0.143;Q4;11;42;126;981;17;123;0.15;23.36;Kazakhstan;Asiatic Region;al-Farabi Kazakh State National University;2003-2004, 2007-2021;"Chemical Engineering (miscellaneous) (Q4); Chemistry (miscellaneous) (Q4); Condensed Matter Physics (Q4); Materials Science (miscellaneous) (Q4)"
782;14425;Journal of Surface Science and Technology;journal;09769420, 09701893;0.143;Q4;17;6;18;197;5;18;0.29;32.83;India;Asiatic Region;Indian Society for Surface Science and Technology;1996-2012, 2014-2020;"Electrochemistry (Q4); Materials Chemistry (Q4); Surfaces and Interfaces (Q4); Surfaces, Coatings and Films (Q4)"
783;14200154740;Revista Colombiana de Quimica;journal;01202804;0.143;Q4;8;28;57;736;13;57;0.09;26.29;Colombia;Latin America;Universidad Nacional de Colombia;2008-2021;Chemistry (miscellaneous) (Q4)
784;25790;Bioorganicheskaya Khimiya;journal;01323423;0.141;Q4;18;85;253;0;51;248;0.19;0;Russian Federation;Eastern Europe;Izdatel'stvo Nauka;1983-2015;"Biochemistry (Q4); Medicine (miscellaneous) (Q4); Organic Chemistry (Q4)"
785;17700155039;Revista Materia;journal;15177076;0.141;Q4;17;48;106;977;23;99;0.24;20.35;Brazil;Latin America;Universidade Federal do Rio de Janeiro - UFRJ;2009-2021;"Chemistry (miscellaneous) (Q4); Materials Science (miscellaneous) (Q4); Physics and Astronomy (miscellaneous) (Q4)"
786;21100373285;Nova Biotechnologica et Chimica;journal;1339004X, 13386905;0.14;Q4;11;16;35;613;14;35;0.4;38.31;Germany;Western Europe;SciCell s.r.o.;2012-2021;"Analytical Chemistry (Q4); Biotechnology (Q4); Food Science (Q4); Health, Toxicology and Mutagenesis (Q4)"
787;14132;Methods of Biochemical Analysis;journal;00766941;0.139;Q4;24;0;20;0;4;19;0;0;United States;Northern America;"John Wiley &amp; Sons Inc.";1954-1958, 1960, 1962-1963, 1965-1971, 1973-1974, 1976-1977, 1979-1985, 1987-1988, 1990-1992, 1994, 1998, 2001, 2003, 2005-2008, 2010-2011, 2015;"Biochemistry (Q4); Medicine (miscellaneous) (Q4); Organic Chemistry (Q4)"
788;86033;IPPTA: Quarterly Journal of Indian Pulp and Paper Technical Association;journal;03795462;0.138;Q4;12;31;188;326;24;183;0.09;10.52;India;Asiatic Region;Indian Pulp and Paper Technical Association;1998-2019;"Media Technology (Q2); Chemical Engineering (miscellaneous) (Q4); Chemistry (miscellaneous) (Q4); Materials Chemistry (Q4)"
789;22671;Afinidad;journal;00019704;0.136;Q4;17;42;136;1189;17;136;0.14;28.31;Spain;Western Europe;Asociacion de Quimicos del Instituto Quimico de Sarria;1996-2021;"Chemical Engineering (miscellaneous) (Q4); Chemistry (miscellaneous) (Q4)"
790;21100198228;Analele Universitatii Bucuresti Chimie;journal;18440401, 1220871X;0.136;Q4;6;0;21;0;9;20;0;0;Romania;Eastern Europe;Ars Docendi;2011;Chemistry (miscellaneous) (Q4)
791;12916;E-Polymers;journal;16187229;0.135;Q4;27;53;208;1556;39;208;0.23;29.36;France;Western Europe;European Polymer Federation;2001-2021;"Polymers and Plastics (Q3); Chemical Engineering (miscellaneous) (Q4); Physical and Theoretical Chemistry (Q4)"
792;19800188074;Medicinal Plants - International Journal of Phytomedicines and Related Industries;journal;09754261, 09756892;0.135;Q4;10;45;130;1134;23;130;0.16;25.2;Netherlands;Western Europe;IOS Press BV;2010-2021;"Drug Discovery (Q4); Organic Chemistry (Q4); Plant Science (Q4)"
793;21100223518;Revista Latinoamericana de Quimica;journal;03705943;0.135;Q4;6;0;32;0;10;32;0.31;0;Mexico;Latin America;;2012-2013, 2018-2019;Chemistry (miscellaneous) (Q4)
794;19700188164;Malaysian Journal of Analytical Sciences;journal;13942506;0.134;Q4;19;86;129;1670;48;129;0.24;19.42;Malaysia;Asiatic Region;Faculty of Science and Technology, Universiti Kebangsaan Malaysia;2010-2021;Analytical Chemistry (Q4)
795;28361;SEAISI Quarterly (South East Asia Iron and Steel Institute);journal;01295721;0.134;Q4;8;0;93;0;8;93;0.09;0;Malaysia;Asiatic Region;South East Asian Iron and Steel Institute;1981-1989, 1994-2013, 2015, 2017;"Condensed Matter Physics (Q4); Materials Chemistry (Q4); Metals and Alloys (Q4); Physical and Theoretical Chemistry (Q4)"
796;28413;Stahl und Eisen;trade journal;03404803;0.134;Q4;16;125;336;357;34;336;0.13;2.86;Germany;Western Europe;Verlag Stahleisen GmbH;1968-1991, 1993-2020;"Condensed Matter Physics (Q4); Materials Chemistry (Q4); Metals and Alloys (Q4); Physical and Theoretical Chemistry (Q4)"
797;23232;Food Technology;trade journal;00156639;0.133;Q4;58;23;276;92;50;276;0.13;4;United States;Northern America;Institute of Food Technologists;1973, 1979, 1982-1983, 1986, 1989, 1991, 1993-2021;"Industrial and Manufacturing Engineering (Q3); Chemistry (miscellaneous) (Q4); Food Science (Q4)"
798;19700175211;Journal of the Vacuum Society of Japan;journal;18824749, 18822398;0.133;Q4;6;82;324;1503;30;310;0.11;18.33;Japan;Asiatic Region;Vacuum Society of Japan;2008-2017;"Instrumentation (Q4); Materials Science (miscellaneous) (Q4); Spectroscopy (Q4); Surfaces and Interfaces (Q4)"
799;12200154728;Yingxiang Kexue yu Guanghuaxue/Imaging Science and Photochemistry;journal;16740475;0.133;Q4;10;53;143;1527;30;143;0.23;28.81;China;Asiatic Region;Science Press;2008-2021;"Media Technology (Q2); Chemistry (miscellaneous) (Q4)"
800;22661;Actualite Chimique;journal;01519093, 21052409;0.132;Q4;12;46;293;389;22;244;0.09;8.46;France;Western Europe;Societe Francaise de Chimie;1985, 1996-2021;Chemistry (miscellaneous) (Q4)
801;4400151711;Kunststoffe International;trade journal;18624243;0.132;Q4;9;174;471;120;41;471;0.07;0.69;Germany;Western Europe;Walter de Gruyter GmbH;2006-2019;"Chemistry (miscellaneous) (Q4); Materials Chemistry (Q4); Polymers and Plastics (Q4)"
802;24817;Nachrichten aus der Chemie;journal;14399598;0.132;Q4;17;186;691;1780;66;479;0.08;9.57;Germany;Western Europe;"Walter de Gruyter GmbH &amp; Co. KG";1982-1984, 1986, 1996-2021;"Chemical Engineering (miscellaneous) (Q4); Chemistry (miscellaneous) (Q4)"
803;21100423232;Fall Technical Meeting of the Eastern States Section of the Combustion Institute 2011;conference and proceedings;-;0.131;-;3;0;105;0;15;104;0;0;United States;Northern America;;;Software
804;20542;Corrosion Management;trade journal;13555243;0.13;Q4;4;7;18;75;2;18;0.17;10.71;United Kingdom;Western Europe;Square One Advertising and Design Limited;1994-2021;"Chemical Engineering (miscellaneous) (Q4); Chemistry (miscellaneous) (Q4); Materials Science (miscellaneous) (Q4)"
805;12680;Farbe und Lack;trade journal;00147699;0.13;Q4;11;82;197;217;27;197;0.17;2.65;Germany;Western Europe;Vincentz Verlag;1973-1974, 1976-1981, 1983-1989, 1994-2021;"Chemistry (miscellaneous) (Q4); Surfaces, Coatings and Films (Q4)"
806;145688;Hyle;journal;14335158;0.13;Q4;17;8;19;596;8;17;0.29;74.5;Germany;Western Europe;Hyle Publications;1997-2002, 2004-2021;"Philosophy (Q3); Chemistry (miscellaneous) (Q4)"
807;12579;Review of High Pressure Science and Technology/Koatsuryoku No Kagaku To Gijutsu;journal;0917639X, 13481940;0.13;Q4;18;39;110;759;10;91;0.06;19.46;Japan;Asiatic Region;Japan Society of High Pressure Science and Technology;1970, 1992-2021;"Chemistry (miscellaneous) (Q4); Condensed Matter Physics (Q4); Materials Science (miscellaneous) (Q4)"
808;19200157109;Studia Universitatis Babes-Bolyai Chemia;journal;12247154, 20659520;0.13;Q4;13;64;273;1408;51;273;0.22;22;Romania;Eastern Europe;Universitatea Babes-Bolyai, Catedra de Filosofie Sistematica;2009-2021;Chemistry (miscellaneous) (Q4)
809;24112;Indian Journal of Heterocyclic Chemistry;journal;09711627;0.129;Q4;31;80;186;1455;52;186;0.37;18.19;India;Asiatic Region;Connect Journals;1996-2021;"Biochemistry (Q4); Organic Chemistry (Q4)"
810;21100242238;Mass Spectrometry Letters;journal;20938950, 22334203;0.129;Q4;10;20;67;452;17;66;0.25;22.6;South Korea;Asiatic Region;Korean Society Mass Spectrometry;2010-2021;"Analytical Chemistry (Q4); Biochemistry, Genetics and Molecular Biology (miscellaneous) (Q4); Spectroscopy (Q4)"
811;20119;Oilfield Chemistry;journal;10004092;0.129;Q4;12;103;218;374;33;218;0.15;3.63;China;Asiatic Region;China International Book Trading Corp. (Guoji Shudian);1996-2021;"Energy Engineering and Power Technology (Q3); Chemical Engineering (miscellaneous) (Q4); Chemistry (miscellaneous) (Q4)"
812;19600156908;International Journal of Nano and Biomaterials;journal;17528941, 17528933;0.128;Q4;11;23;33;571;13;32;0.29;24.83;United Kingdom;Western Europe;Inderscience Enterprises Ltd;2009-2012, 2014-2021;"Atomic and Molecular Physics, and Optics (Q4); Biomaterials (Q4); Biomedical Engineering (Q4); Nanoscience and Nanotechnology (Q4); Physical and Theoretical Chemistry (Q4)"
813;21100239225;Journal of Spectroscopy;journal;23144939, 23144920;0.128;Q4;25;72;132;2073;62;132;0.47;28.79;Egypt;Africa/Middle East;Hindawi Limited;2013-2021;"Analytical Chemistry (Q4); Atomic and Molecular Physics, and Optics (Q4); Spectroscopy (Q4)"
814;17700156531;NATO Science for Peace and Security Series A: Chemistry and Biology;book series;18746489;0.128;Q4;13;19;266;767;60;255;0.25;40.37;Germany;Western Europe;Springer Verlag;2008-2020;"Biochemistry, Genetics and Molecular Biology (miscellaneous) (Q4); Chemistry (miscellaneous) (Q4); Safety, Risk, Reliability and Quality (Q4)"
815;21100264813;Pakistan Journal of Scientific and Industrial Research Series A: Physical Sciences;journal;22216413, 22232559;0.127;Q4;6;24;53;622;8;51;0.18;25.92;Pakistan;Asiatic Region;PCSIR-Scientific Information Centre;2011-2021;"Materials Science (miscellaneous) (Q4); Mathematical Physics (Q4); Physical and Theoretical Chemistry (Q4); Physics and Astronomy (miscellaneous) (Q4)"
816;100147021;Revue Francophone des Laboratoires (discontinued);journal;1773035X;0.127;Q4;8;130;337;2787;48;296;0.12;21.44;France;Western Europe;Elsevier Masson s.r.l.;2005-2016;"Analytical Chemistry (Q4); Biochemistry (medical) (Q4); Medical Laboratory Technology (Q4)"
817;21100294100;Spectroscopy (Santa Monica);journal;08876703;0.127;Q4;26;54;144;774;26;134;0.18;14.33;United States;Northern America;Advanstar Communications Inc.;1996-2021;"Analytical Chemistry (Q4); Atomic and Molecular Physics, and Optics (Q4); Spectroscopy (Q4)"
818;21100242601;Brazilian Journal of Analytical Chemistry;journal;21793433, 21793425;0.126;Q4;6;8;70;111;8;42;0.14;13.88;Brazil;Latin America;Visao Fokka Communication Agency;2010-2014, 2016-2021;Analytical Chemistry (Q4)
819;21100211769;Chemik;journal;00092886;0.126;Q4;14;97;208;2013;33;199;0.15;20.75;Poland;Eastern Europe;Association of Engineers and Technicians of Chemical Industry;2011-2016;"Chemical Engineering (miscellaneous) (Q4); Chemistry (miscellaneous) (Q4)"
820;27830;Coating International;trade journal;05908450;0.126;Q4;5;31;59;39;5;59;0.09;1.26;Switzerland;Western Europe;Rek and Thomas Medien AG;1988, 2005-2020;"Media Technology (Q3); Chemical Engineering (miscellaneous) (Q4); Chemistry (miscellaneous) (Q4); Surfaces, Coatings and Films (Q4)"
821;29669;Corrosion Science and Protection Technology;journal;10026495;0.126;Q4;16;69;150;561;24;150;0.07;8.13;China;Asiatic Region;Chinese Academy of Sciences;1992, 1995-2002, 2005-2011, 2013-2019;"Chemical Engineering (miscellaneous) (Q4); Chemistry (miscellaneous) (Q4); Materials Science (miscellaneous) (Q4)"
822;24081;Huaxue Fanying Gongcheng Yu Gongyi/Chemical Reaction Engineering and Technology;journal;10017631;0.125;Q4;10;84;280;1498;25;280;0.08;17.83;China;Asiatic Region;Zhejiang University Press;1985-1989, 1996-2021;"Chemical Engineering (miscellaneous) (Q4); Chemistry (miscellaneous) (Q4)"
823;78953;INFORM - International News on Fats, Oils and Related Materials;trade journal;08978026;0.125;Q4;25;44;186;40;35;186;0.18;0.91;United States;Northern America;American Oil Chemists' Society;1973-1974, 1994, 1996-2018;"Biotechnology (Q4); Chemistry (miscellaneous) (Q4); Food Science (Q4)"
824;21100225807;RSC Theoretical and Computational Chemistry Series;book series;20413181, 2041319X;0.124;Q4;5;23;14;1964;9;13;0;85.39;United Kingdom;Western Europe;Royal Society of Chemistry;2009, 2011, 2014-2021;"Chemistry (miscellaneous) (Q4); Computer Science Applications (Q4)"
825;18082;GAK Gummi Fasern Kunststoffe (discontinued);trade journal;01761625;0.123;Q4;9;63;186;629;15;186;0.1;9.98;Germany;Western Europe;Dr. Gupta Verlag;1979, 1984-2017;"Chemical Engineering (miscellaneous) (Q4); Chemistry (miscellaneous) (Q4); Materials Chemistry (Q4); Polymers and Plastics (Q4)"
826;21100205941;Open Structural Biology Journal;journal;18741991;0.123;Q4;0;0;1;0;0;1;0;0;Netherlands;Western Europe;;;"Biochemistry (Q4); Organic Chemistry (Q4); Structural Biology (Q4)"
827;21100197942;Periodico Tche Quimica (discontinued);journal;18060374, 21790302;0.123;Q4;29;11;53;203;4;52;0.06;18.45;Brazil;Latin America;Tche Quimica Group;2011-2020;"Chemistry (miscellaneous) (Q4); Education (Q4)"
828;21100784728;Proceedings of the SICE Annual Conference;conference and proceedings;-;0.123;-;0;0;1;0;0;1;0;0;Japan;Asiatic Region;;;"Chemistry (miscellaneous); Management of Technology and Innovation; Process Chemistry and Technology"
829;110297;Fibre chemistry;journal;00150541, 15738493;0.122;Q4;21;78;262;732;25;261;0.09;9.38;United States;Northern America;Springer Science + Business Media;1969-2021;"Chemical Engineering (miscellaneous) (Q4); Chemistry (miscellaneous) (Q4); Materials Science (miscellaneous) (Q4)"
830;21100512398;IEEE International Symposium on Phased Array Systems and Technology;conference and proceedings;-;0.122;-;11;0;141;0;35;138;0.25;0;United States;Northern America;;;"Chemical Engineering (miscellaneous); Mechanical Engineering; Physical and Theoretical Chemistry"
831;21100826392;CoatingsTech;trade journal;24751499, 24758469;0.121;Q4;11;68;140;388;7;112;0.03;5.71;United States;Northern America;Federation of Societies for Coatings Technology;2004-2015, 2017-2020;"Chemistry (miscellaneous) (Q4); Colloid and Surface Chemistry (Q4); Surfaces and Interfaces (Q4); Surfaces, Coatings and Films (Q4)"
832;24097;Journal of the Indian Chemical Society;journal;00194522;0.121;Q4;33;286;764;8517;165;757;0.2;29.78;India;Asiatic Region;Elsevier BV;1973-1985, 1987-1991, 1996-2021;"Drug Discovery (Q4); Electrochemistry (Q4); Inorganic Chemistry (Q4); Organic Chemistry (Q4); Physical and Theoretical Chemistry (Q4)"
833;21100824682;Smart Science;journal;23080477;0.121;Q4;12;0;8;0;4;8;0.5;0;United Kingdom;Western Europe;Taylor and Francis Ltd.;2013, 2015-2021;"Chemistry (miscellaneous) (Q4); Computational Mathematics (Q4); Computer Networks and Communications (Q4); Energy (miscellaneous) (Q4); Engineering (miscellaneous) (Q4); Fluid Flow and Transfer Processes (Q4); Modeling and Simulation (Q4)"
834;28481;Tezhong Zhuzao Ji Youse Hejin/Special Casting and Nonferrous Alloys;journal;10012249;0.121;Q4;10;386;965;3020;79;965;0.07;7.82;China;Asiatic Region;Journal Office of Special Casting and Nonferrous Alloys;1994-1995, 1997, 2001-2020;"Condensed Matter Physics (Q4); Materials Chemistry (Q4); Metals and Alloys (Q4); Physical and Theoretical Chemistry (Q4)"
835;17600155110;Research Journal of Applied Sciences (discontinued);journal;1815932X, 19936079;0.12;Q4;21;187;249;3179;54;249;0.16;17;Pakistan;Asiatic Region;Medwell Publishing;2009-2016;"Chemistry (miscellaneous) (Q4); Engineering (miscellaneous) (Q4); Multidisciplinary (Q4); Physics and Astronomy (miscellaneous) (Q4)"
836;21100201318;Nuclear Magnetic Resonance;book series;03059804, 14651882;0.119;Q4;5;13;38;3112;13;35;0.38;239.38;United Kingdom;Western Europe;Royal Society of Chemistry;2011-2016, 2021;"Analytical Chemistry (Q4); Biochemistry (Q4); Spectroscopy (Q4)"
837;21100289743;Advances in Mass Data Analysis of Images and Signals in Medicine, Biotechnology, Chemistry and Food Industry - 6th International Conference, MDA 2011, Proceedings;conference and proceedings;-;0.118;-;3;0;12;0;3;10;0;0;Germany;Western Europe;;;"Agricultural and Biological Sciences (miscellaneous); Biotechnology; Chemistry (miscellaneous); Computational Theory and Mathematics; Computer Vision and Pattern Recognition; Medicine (miscellaneous); Signal Processing"
838;24084;Chemistry Bulletin / Huaxue Tongbao;journal;04413776;0.117;Q4;13;197;559;6089;63;559;0.11;30.91;China;Asiatic Region;Science Press;1996-2014, 2016;Chemistry (miscellaneous) (Q4)
839;19700201648;Corrosion and Materials;journal;13261932;0.117;Q4;5;31;101;100;9;65;0.11;3.23;Australia;Pacific Region;Australasian Corrosion Association;2011-2020;"Chemistry (miscellaneous) (Q4); Materials Science (miscellaneous) (Q4)"
840;21100241765;International Journal of Analytical Chemistry;journal;16878760, 16878779;0.117;Q4;21;20;12;606;6;12;0.5;30.3;Egypt;Africa/Middle East;Hindawi Limited;2013-2021;Analytical Chemistry (Q4)
841;13227;Paint and Coatings Industry;journal;08843848;0.117;Q4;9;143;678;5;6;157;0;0.03;United States;Northern America;Business News Publishing Co.;1996-2021;"Chemistry (miscellaneous) (Q4); Marketing (Q4); Surfaces, Coatings and Films (Q4)"
842;12865;Photonics Spectra;trade journal;07311230;0.117;Q4;18;49;319;97;17;271;0.07;1.98;United States;Northern America;Laurin Publishing Co. Inc.;1982-1990, 1994-2020;"Analytical Chemistry (Q4); Atomic and Molecular Physics, and Optics (Q4)"
843;6000195382;WIT Transactions on Engineering Sciences;conference and proceedings;17433533;0.117;-;17;664;470;5730;63;444;0.13;8.63;United Kingdom;Western Europe;WITPress;2006-2014, 2017-2020;"Electrical and Electronic Engineering; Materials Science (miscellaneous); Mathematics (miscellaneous); Mechanical Engineering; Mechanics of Materials"
844;15191;O Papel (Brazil);trade journal;00311057;0.116;Q4;12;105;266;236;21;266;0.04;2.25;Brazil;Latin America;Assoc. Tecnica Brasileira de Celulose e Papel;1996-2018;"Industrial and Manufacturing Engineering (Q3); Media Technology (Q3); Chemical Engineering (miscellaneous) (Q4); Chemistry (miscellaneous) (Q4); Materials Science (miscellaneous) (Q4)"
845;28867;Journal of Applied Fire Science;journal;10444300, 15414183;0.115;Q4;15;0;78;0;5;78;0.02;0;United States;Northern America;Baywood Publishing Co. Inc.;1993-1994, 1996-2000, 2002-2013;"Chemical Engineering (miscellaneous) (Q4); Chemistry (miscellaneous) (Q4); Condensed Matter Physics (Q4); Safety, Risk, Reliability and Quality (Q4)"
