Rank;Sourceid;Title;Type;Issn;SJR;SJR Best Quartile;H index;Total Docs. (2008);Total Docs. (3years);Total Refs.;Total Cites (3years);Citable Docs. (3years);Cites / Doc. (2years);Ref. / Doc.;Country;Region;Publisher;Coverage;Categories
923;11700154350;Trace Metals and other Contaminants in the Environment;book series;18751121;0.114;Q4;16;0;55;0;8;27;0.15;0;Netherlands;Western Europe;Elsevier;2003, 2005-2007, 2011;Environmental Science (miscellaneous) (Q4)
924;11700154344;Developments in Environmental Science;book series;14748177;0.113;Q4;23;29;175;1348;13;166;0.08;46.48;United Kingdom;Western Europe;Elsevier Ltd.;2002-2003, 2005, 2007-2009, 2012-2013;"Atmospheric Science (Q4); Environmental Chemistry (Q4); Health, Toxicology and Mutagenesis (Q4); Pollution (Q4)"
925;5300152610;Folia Oecologica;journal;13365266;0.113;Q4;10;19;33;400;3;33;0.09;21.05;Slovakia;Eastern Europe;Institute of Forest Ecology of the Slovak Academy of Sciences;2006-2021;"Ecology (Q4); Forestry (Q4)"
926;19700170838;International Journal of Rural Management;journal;09730680, 09730052;0.113;Q4;11;13;41;358;7;40;0.19;27.54;India;Asiatic Region;Sage Publications India Pvt. Ltd;2005-2010, 2012-2021;"Geography, Planning and Development (Q4); Management, Monitoring, Policy and Law (Q4); Strategy and Management (Q4)"
927;35948;Journal of the Zhejiang University - Agriculture and Life Science;journal;10089209;0.113;-;12;0;283;0;39;283;0.16;0;China;Asiatic Region;Zhejiang Daxue;2001-2006, 2019-2021;Food Science (Q4)
928;64015;Physical Oceanography;journal;09205047, 09285105;0.113;Q4;9;28;86;471;2;86;0;16.82;Netherlands;Western Europe;Kluwer Academic Publishers;1993-2011;"Ocean Engineering (Q3); Fluid Flow and Transfer Processes (Q4); Oceanography (Q4); Water Science and Technology (Q4)"
929;21100223546;Proceedings of Conference - International Erosion Control Association;conference and proceedings;10922806;0.113;-;1;0;25;0;3;24;0;0;United States;Northern America;;;"Earth-Surface Processes; Environmental Engineering; Soil Science"
930;21100338303;Proceedings of the 11th International Conference of the European Society for Precision Engineering and Nanotechnology, EUSPEN 2011;conference and proceedings;-;0.113;-;8;0;94;0;17;92;0.18;0;Belgium;Western Europe;;;"Environmental Engineering; Industrial and Manufacturing Engineering; Instrumentation; Materials Science (miscellaneous); Mechanical Engineering"
931;21100198225;Proceedings of the Conference on River Basin Management - Progress Towards Implementation of the European Water Framework Directive;conference and proceedings;-;0.113;-;3;0;37;0;2;36;0;0;Netherlands;Western Europe;;;"Environmental Science (miscellaneous); Water Science and Technology"
932;24590;Zoos' Print Journal;journal;09716378;0.113;Q4;18;7;388;17;19;384;0.04;2.43;India;Asiatic Region;Zoo Outreach Organisation;2001-2008;"Animal Science and Zoology (Q4); Ecology (Q4)"
933;8300153115;Advances in Environmental Accounting and Management;book series;14793598;0.112;Q4;14;0;7;0;3;6;0.43;0;United Kingdom;Western Europe;Emerald Group Publishing Ltd.;2000, 2003, 2006, 2014, 2017-2018, 2020;"Accounting (Q4); Economics, Econometrics and Finance (miscellaneous) (Q4); Management, Monitoring, Policy and Law (Q4)"
934;25796;Felsbau;journal;01746979;0.112;Q4;21;0;206;0;19;192;0.11;0;Germany;Western Europe;Verlag Glueckauf GmbH;1988, 1991, 1994-2007;"Energy (miscellaneous) (Q3); Geotechnical Engineering and Engineering Geology (Q3); Water Science and Technology (Q4)"
935;15309;Imago Mundi;journal;14797801, 03085694;0.112;Q4;15;17;37;1022;17;37;0.32;60.12;United Kingdom;Western Europe;Routledge;1935, 1937, 1939, 1947-1956, 1959-1960, 1962-1972, 1975-1997, 2001, 2005-2021;"Earth and Planetary Sciences (miscellaneous) (Q4); Environmental Science (miscellaneous) (Q4)"
936;6500153243;International Review of Environmental and Resource Economics;journal;19321465, 19321473;0.112;Q4;27;9;10;1225;4;9;0.4;136.11;United States;Northern America;Now Publishers Inc;2007-2021;"Accounting (Q4); Economics and Econometrics (Q4); Finance (Q4); Management, Monitoring, Policy and Law (Q4)"
937;7900153102;International Symposium on Underwater Technology, UT 2007 - International Workshop on Scientific Use of Submarine Cables and Related Technologies 2007;conference and proceedings;-;0.112;-;13;0;120;0;44;118;0.37;0;United States;Northern America;;;"Mechanical Engineering; Ocean Engineering; Water Science and Technology"
938;15923;Landscape History;journal;01433768, 21602506;0.112;Q4;10;4;22;112;2;22;0.08;28;United Kingdom;Western Europe;Taylor and Francis Ltd.;1979-2021;"History (Q3); Horticulture (Q4); Nature and Landscape Conservation (Q4)"
939;5000158201;NATO Security through Science Series C: Environmental Security;book series;18714668;0.112;Q4;17;128;486;4965;38;475;0.08;38.79;Germany;Western Europe;Springer Verlag;2005-2009;Environmental Science (miscellaneous) (Q4)
940;144628;Proceedings of the Air and Waste Management Association's Annual Conference and Exhibition, AWMA;conference and proceedings;10526102;0.112;-;8;239;407;2200;12;407;0.03;9.21;United States;Northern America;;;"Energy (miscellaneous); Environmental Science (miscellaneous)"
941;19900193529;Restoring Our Natural Habitat - Proceedings of the 2007 World Environmental and Water Resources Congress;conference and proceedings;-;0.112;-;9;0;435;0;55;434;0.13;0;United States;Northern America;;;"Environmental Engineering; Water Science and Technology"
942;19700182315;WMU Journal of Maritime Affairs;journal;1651436X, 16541642;0.112;Q4;22;27;49;433;9;44;0.2;16.04;Germany;Western Europe;Springer Verlag;2002-2021;"Ocean Engineering (Q3); Safety Research (Q3); Human Factors and Ergonomics (Q4); Management, Monitoring, Policy and Law (Q4); Transportation (Q4)"
943;21100779032;2006 IEEE US/EU Baltic International Symposium, BALTIC 2006;conference and proceedings;-;0.111;-;0;0;3;0;0;2;0;0;United States;Northern America;;;"Artificial Intelligence; Computer Graphics and Computer-Aided Design; Computer Vision and Pattern Recognition; Human-Computer Interaction; Software"
944;21100420347;8th International Symposium on Computers in Education Proceedings, SIIE 2006;conference and proceedings;-;0.111;-;4;0;57;0;8;55;0.14;0;Spain;Western Europe;;;"Public Administration; Water Science and Technology"
945;900147101;Boissiera;book series;03732975;0.111;Q4;5;0;2;0;0;2;0;0;Switzerland;Western Europe;Universite de Geneve;2005, 2009-2011, 2015-2017;"Ecology (Q4); Ecology, Evolution, Behavior and Systematics (Q4)"
946;82174;Boletin Intexter;journal;11316756;0.111;Q4;3;11;39;142;5;39;0.15;12.91;Spain;Western Europe;Instituto de Investigacion Textil y de Cooperacion Industrial;1990-2008, 2010;"Chemical Engineering (miscellaneous) (Q3); History (Q3); Polymers and Plastics (Q3); Environmental Science (miscellaneous) (Q4)"
947;19400157142;Chiang Mai University Journal of Natural Sciences;journal;16851994;0.111;-;12;0;2;0;0;2;0;0;Thailand;Asiatic Region;Chiang Mai University;2003, 2006, 2009-2021;Multidisciplinary (Q4)
948;21100463829;Chinese Journal of Population Resources and Environment;journal;23254262, 10042857;0.111;Q4;14;54;124;739;7;123;0.05;13.69;United Kingdom;Western Europe;Taylor and Francis Ltd.;1992, 2004-2013, 2015-2019;"Demography (Q4); Environmental Science (miscellaneous) (Q4); Toxicology (Q4)"
949;19700175834;Contaminated Soils, Sediments and Water;conference and proceedings;-;0.111;-;5;0;42;0;5;2;0;0;United States;Northern America;;;"Soil Science; Water Science and Technology"
950;21100407616;Fauna Entomologica Scandinavica;book series;01068377;0.111;Q4;5;0;2;0;0;2;0;0;Netherlands;Western Europe;Brill Academic Publishers;2007, 2013, 2015;"Ecology (Q4); Ecology, Evolution, Behavior and Systematics (Q4); Insect Science (Q4)"
951;12400154714;FOG - Freiberg Online Geoscience;journal;14347512;0.111;Q4;8;3;2;153;0;2;0;51;Germany;Western Europe;Eiberg Geoscience Department jointly with Forderkreis Freiberger Geowissenschaften;2006, 2008-2021;"Ecology (Q4); Environmental Chemistry (Q4); Geology (Q4); Water Science and Technology (Q4)"
952;11000153705;Journal of Transnational Management;journal;15475778, 15475786;0.111;Q4;16;21;71;691;4;62;0.07;32.9;United Kingdom;Western Europe;Taylor and Francis Ltd.;2005-2021;"Development (Q4); Geography, Planning and Development (Q4); Management, Monitoring, Policy and Law (Q4)"
953;30554;Landscape Architecture;journal;00238031;0.111;Q4;5;263;748;112;10;404;0.01;0.43;United States;Northern America;American Society of Landscape Architects;1979-1986, 1988-1989, 1997-2014;"Architecture (Q3); Arts and Humanities (miscellaneous) (Q4); Nature and Landscape Conservation (Q4)"
954;17311;Natur und Recht;journal;14390515, 01721631;0.111;Q4;7;175;300;3763;9;299;0.03;21.5;Germany;Western Europe;Springer Verlag;1980, 1997-1998, 2004-2021;"Agricultural and Biological Sciences (miscellaneous) (Q4); Environmental Science (miscellaneous) (Q4)"
955;6100153002;Proceedings of 2006 ASME International Mechanical Engineering Congress and Exposition, IMECE2006 - Environmental Engineering;conference and proceedings;-;0.111;-;0;0;3;0;0;2;0;0;United States;Northern America;;;Environmental Engineering
956;15900154724;"Proceedings of the International Conference W3M Wetlands: Modelling, Monitoring, Management""""";conference and proceedings;-;0.111;-;7;0;45;0;8;43;0.18;0;Poland;Eastern Europe;;;"Ecological Modeling; Management, Monitoring, Policy and Law"
957;101730;Rudarsko Geolosko Naftni Zbornik;journal;03534529, 18490409;0.111;Q4;13;11;33;156;3;31;0.14;14.18;Croatia;Eastern Europe;University of Zagreb;1994-2021;"Energy (miscellaneous) (Q3); Geotechnical Engineering and Engineering Geology (Q3); Geology (Q4); Water Science and Technology (Q4)"
958;19700188468;SPE Projects, Facilities and Construction;journal;19422431;0.111;Q4;10;24;32;286;6;32;0.19;11.92;United States;Northern America;Society of Petroleum Engineers (SPE);2006-2011;"Energy (miscellaneous) (Q3); Ocean Engineering (Q3); Management, Monitoring, Policy and Law (Q4); Mechanical Engineering (Q4)"
959;144824;Standort;journal;01743635;0.111;-;5;31;127;189;2;108;0.02;6.1;Germany;Western Europe;Springer Verlag;2005-2021;Earth and Planetary Sciences (miscellaneous) (Q4)
960;21100276793;Sustainable Development of Water Resources, Water Supply and Environmental Sanitation: Proceedings of the 32nd WEDC International Conference;conference and proceedings;-;0.111;-;4;0;112;0;3;111;0.03;0;United Kingdom;Western Europe;;;"Waste Management and Disposal; Water Science and Technology"
961;5200152209;Sustainable Humanosphere;trade journal;18806503;0.111;Q4;3;0;46;0;1;2;0.04;0;Japan;Asiatic Region;Research Institute for Sustainable Humanosphere;2005-2007, 2011, 2013, 2015-2017, 2019-2020;"Forestry (Q4); Global and Planetary Change (Q4); Nature and Landscape Conservation (Q4)"
962;12000154524;Waste Management Series;book series;14787482;0.111;Q4;14;0;59;0;7;27;0.12;0;United Kingdom;Western Europe;Elsevier Ltd.;2000, 2003-2004, 2006-2007;Waste Management and Disposal (Q4)
963;25727;World Today;journal;00439134;0.111;Q4;1;0;0;0;0;0;0;0;United Kingdom;Western Europe;;;"Earth and Planetary Sciences (miscellaneous) (Q4); Environmental Science (miscellaneous) (Q4); Psychology (miscellaneous) (Q4); Social Sciences (miscellaneous) (Q4)"
964;21100216307;Eau, l'INDUSTRIE, les Nuisances;journal;07555016;0.11;Q4;6;101;170;154;2;158;0.01;1.52;France;Western Europe;Editions Johanet;1985-1991, 1996-2004, 2006-2021;"Ocean Engineering (Q3); Control and Systems Engineering (Q4); Fluid Flow and Transfer Processes (Q4); Water Science and Technology (Q4)"
965;9700153106;Environmental and Water Resources: Milestones in Engineering History;conference and proceedings;-;0.11;-;2;0;19;0;1;18;0.05;0;United States;Northern America;;;Water Science and Technology
966;5100152918;Jeoloji Muhendisligi Dergisi;journal;10169172;0.11;Q4;6;2;25;98;2;25;0.13;49;Turkey;Middle East;TMMOB - Jeoloji Muhendisleri Odasi;2005-2021;"Earth and Planetary Sciences (miscellaneous) (Q4); Environmental Science (miscellaneous) (Q4)"
967;10300153316;Proceedings of the Third IASTED International Conference on Environmental Modelling and Simulation, EMS 2007;conference and proceedings;-;0.11;-;3;0;25;0;3;23;0.12;0;Canada;Northern America;;;Environmental Science (miscellaneous)
968;25287;Rivista Giurdica dell'Ambiente;journal;03942287;0.11;Q4;3;8;128;85;2;128;0.02;10.63;Italy;Western Europe;Giuffre Editore SpA;1997-2012;"Environmental Science (miscellaneous) (Q4); Geography, Planning and Development (Q4); Management, Monitoring, Policy and Law (Q4)"
969;21100198424;Environmental Engineering - Proceedings of the 2nd National Congress of Environmental Engineering;conference and proceedings;-;0.109;-;6;0;79;0;9;77;0.11;0;Netherlands;Western Europe;;;Environmental Engineering
970;20989;Environmental Forum;trade journal;07315732;0.109;Q4;9;84;145;141;4;139;0.03;1.68;United States;Northern America;Environmental Law Institute;1997-2020;"Geography, Planning and Development (Q4); Management, Monitoring, Policy and Law (Q4)"
971;25719;Folia Forestalia Polonica, Series A;journal;00716677;0.109;Q4;12;0;21;0;1;21;0;0;Poland;Eastern Europe;Wydawnictwo Naukowe PWN;1993, 1995-2007, 2009-2021;"Ecology (Q4); Forestry (Q4)"
972;29518;Japanese Journal of Limnology;journal;00215104;0.109;Q4;15;14;73;375;6;70;0.07;26.79;Japan;Asiatic Region;Japanese Society of Limnology;1931, 1934-1944, 1949-1950, 1952, 1955-2014, 2016-2020;"Aquatic Science (Q4); Ecology (Q4); Water Science and Technology (Q4)"
973;27806;Terra et Aqua;trade journal;03766411;0.109;Q4;9;0;55;0;3;41;0.06;0;Netherlands;Western Europe;International Association of Dredging Companies;1972-1975, 1977, 1979-2007;"Ocean Engineering (Q3); Water Science and Technology (Q4)"
974;17700156306;Association for Environmental Health and Sciences - 23rd Annual International Conference on Soils, Sediments and Water 2007;conference and proceedings;-;0.108;-;3;0;33;0;2;31;0.06;0;United States;Northern America;;;"Environmental Engineering; Environmental Science (miscellaneous); Pollution; Soil Science; Water Science and Technology"
975;28195;GIM International (discontinued);trade journal;15669076;0.108;Q4;12;126;291;73;21;254;0.06;0.58;Netherlands;Western Europe;GITC B.V.;2001-2018;"Earth and Planetary Sciences (miscellaneous) (Q4); Engineering (miscellaneous) (Q4); Environmental Science (miscellaneous) (Q4)"
976;16293;Journal of Planning and Environment Law;journal;03074870;0.108;Q4;9;43;157;1310;9;123;0.05;30.47;United Kingdom;Western Europe;"Sweet &amp; Maxwell Ltd.";1970, 1979-1989, 1996-2021;"Geography, Planning and Development (Q4); Law (Q4); Management, Monitoring, Policy and Law (Q4)"
977;11700154340;Proc. 14th International Union of Air Pollution Prevention and Environmental Protection Associations (IUAPPA) World Congress 2007, 18th Clean Air Society of Australia and New Zealand (CASANZ) Conf.;conference and proceedings;-;0.108;-;3;0;166;0;2;165;0.01;0;United States;Northern America;;;"Management, Monitoring, Policy and Law; Nature and Landscape Conservation; Pollution; Waste Management and Disposal"
978;8200153121;Proceedings - Fourth Asia-Pacific Conference on Environmental Electromagnetics, CEEM'2006;conference and proceedings;-;0.108;-;7;0;210;0;34;205;0.16;0;United States;Northern America;;;"Electrical and Electronic Engineering; Environmental Engineering"
979;19700182056;Anartia;journal;1315642X;0.107;Q4;3;0;3;0;0;3;0;0;Venezuela;Latin America;Museo de Biologia de La University del Zulia (MBLUZ);1993-1994, 1998, 2000-2001, 2005, 2009;"Earth and Planetary Sciences (miscellaneous) (Q4); Environmental Science (miscellaneous) (Q4)"
980;24730;Braunschweiger Naturkundliche Schriften;journal;01743384;0.107;Q4;6;0;25;0;2;25;0.15;0;Germany;Western Europe;Staatliches Naturhistorisches Museum;1987-1997, 2001-2006;Ecology (Q4)
981;21100225818;HB 2006 - Healthy Buildings: Creating a Healthy Indoor Environment for People;conference and proceedings;-;0.107;-;1;0;3;0;2;2;0.67;0;United States;Northern America;;;"Building and Construction; Civil and Structural Engineering; Health, Toxicology and Mutagenesis"
982;21100274873;Integrated Assessment of Water Resources and Global Change: A North-South Analysis;conference and proceedings;-;0.107;-;6;0;23;0;3;20;0.13;0;Netherlands;Western Europe;;;Water Science and Technology
983;23323;Japanese Journal of Ecology;journal;00215007;0.107;Q4;13;26;71;822;7;69;0.04;31.62;Japan;Asiatic Region;Tohoku University;1979-2005, 2007-2011, 2013-2021;"Ecology (Q4); Ecology, Evolution, Behavior and Systematics (Q4)"
984;21100242835;Journal of Environmental Health Science and Engineering;journal;2052336X;0.107;Q4;52;41;40;918;3;40;0.08;22.39;Switzerland;Western Europe;Springer International Publishing AG;2012-2021;"Applied Microbiology and Biotechnology (Q4); Environmental Engineering (Q4); Health, Toxicology and Mutagenesis (Q4); Pollution (Q4); Public Health, Environmental and Occupational Health (Q4); Waste Management and Disposal (Q4); Water Science and Technology (Q4)"
985;17678;NAFO Scientific Council Studies;journal;02506432;0.107;Q4;13;2;3;16;0;3;0;8;Canada;Northern America;Northwest Atlantic Fisheries Organization;1993-2003, 2005, 2007-2010, 2013-2015, 2017;"Aquatic Science (Q4); Ecology (Q4); Oceanography (Q4)"
986;21100223743;American Water Works Association - Water Quality Technology Conference and Exposition 2007: Fast Tracks to Water Quality;conference and proceedings;-;0.106;-;4;0;270;0;26;269;0.1;0;United States;Northern America;;;"Geography, Planning and Development; Safety, Risk, Reliability and Quality; Water Science and Technology"
987;67044;International Conference on Debris-Flow Hazards Mitigation: Mechanics, Prediction, and Assessment, Proceedings;conference and proceedings;-;0.106;-;29;0;73;0;5;71;0.07;0;United States;Northern America;ASCE;1997, 2003, 2007, 2011, 2015;"Earth-Surface Processes; Geotechnical Engineering and Engineering Geology; Water Science and Technology"
988;25925;Kobunshi;journal;04541138;0.106;Q4;6;136;224;1181;6;224;0.02;8.68;Japan;Asiatic Region;The Society of Polymer Science;1952-1953, 1956-1959, 1961, 1963-1965, 1967-1974, 1978-1980, 1989-2008, 2011-2018;"Chemical Engineering (miscellaneous) (Q3); Polymers and Plastics (Q3); Environmental Science (miscellaneous) (Q4); Materials Science (miscellaneous) (Q4)"
989;21100274126;Managing Weather and Climate Risks in Agriculture;conference and proceedings;-;0.106;-;4;0;10;0;2;7;0.2;0;United States;Northern America;;;"Earth and Planetary Sciences (miscellaneous); Environmental Science (miscellaneous); Safety, Risk, Reliability and Quality"
990;21180;Natural History;journal;00280712;0.106;Q4;9;75;429;0;12;191;0.03;0;United States;Northern America;American Museum of Natural History Library;1975-1976, 1979, 1983-1984, 1986-1987, 1991-1992, 1994-1995, 1997-1998, 2002-2012;Environmental Science (miscellaneous) (Q4)
991;21613;University of Baltimore Journal of Environmental Law;journal;10626212;0.106;Q4;3;13;42;1596;1;29;0;122.77;United States;Northern America;University of Baltimore School of Law;1997-2000, 2002-2009;"Environmental Science (miscellaneous) (Q4); Geography, Planning and Development (Q4); Law (Q4); Management, Monitoring, Policy and Law (Q4)"
992;9500153967;Water Wheel;trade journal;18167969;0.106;Q4;5;34;91;11;2;91;0.03;0.32;South Africa;Africa;South African Water Research Commission;2003-2020;Water Science and Technology (Q4)
993;145525;ACS, Division of Environmental Chemistry - Preprints of Extended Abstracts;conference and proceedings;15246434;0.105;-;4;260;139;2318;5;139;0.06;8.92;United States;Northern America;;;Energy (miscellaneous)
994;21100496607;Association for Information Systems - 13th Americas Conference on Information Systems, AMCIS 2007: Reaching New Heights;conference and proceedings;-;0.105;-;7;0;141;0;31;139;0.22;0;United States;Northern America;;;"Pollution; Waste Management and Disposal; Water Science and Technology"
995;21100373606;ECOS 2006 - Proceedings of the 19th International Conference on Efficiency, Cost, Optimization, Simulation and Environmental Impact of Energy Systems;conference and proceedings;-;0.105;-;8;0;195;0;33;194;0.17;0;Greece;Western Europe;;;"Energy (miscellaneous); Environmental Science (miscellaneous)"
996;4700152481;Frontiers of Forestry in China;journal;16733517, 16733630;0.105;Q4;14;79;150;1650;10;149;0.07;20.89;China;Asiatic Region;Higher Education Press;2006-2009;"Ecology (Q4); Ecology, Evolution, Behavior and Systematics (Q4); Forestry (Q4)"
997;4400151508;Geosciences;journal;1772094X;0.105;Q4;3;0;47;0;1;42;0.02;0;France;Western Europe;Editions du BRGM;2006-2007;Environmental Science (miscellaneous) (Q4)
998;18967;Mutation Research;journal;00275107;0.105;Q4;13;2;6;0;0;4;0;0;Netherlands;Western Europe;Elsevier;1964, 1973-1992, 1994-1999, 2003-2010, 2012-2014;"Genetics (Q4); Health, Toxicology and Mutagenesis (Q4); Molecular Biology (Q4)"
999;26369;Radwaste Solutions;journal;15294900;0.105;Q4;5;44;132;36;3;109;0.01;0.82;United States;Northern America;American Nuclear Society;2003-2019;"Nuclear Energy and Engineering (Q4); Safety, Risk, Reliability and Quality (Q4); Waste Management and Disposal (Q4)"
1000;53724;Agrochemicals Japan;journal;09195505;0.104;Q4;6;0;5;0;0;5;0;0;Japan;Asiatic Region;Japan Plant Protection Association/Nihon Shokubutsu Boeki Kyokai;1998-2005;"Ecology (Q4); Pollution (Q4)"
1001;21100223709;American Water Works Association - Distribution Systems Symposium, DSS 2007;conference and proceedings;-;0.104;-;1;0;50;0;2;49;0.04;0;United States;Northern America;;;"Geography, Planning and Development; Water Science and Technology"
1002;21100220432;Asian Journal of Atmospheric Environment;journal;19766912, 22871160;0.104;Q4;19;14;5;255;0;5;0;18.21;South Korea;Asiatic Region;Korean Society for Atmospheric Environment;2007-2021;"Atmospheric Science (Q4); Environmental Science (miscellaneous) (Q4)"
1003;17700156218;Biodiversity;journal;14888386, 21600651;0.104;Q4;27;48;70;1534;4;67;0.04;31.96;United Kingdom;Western Europe;Taylor and Francis Ltd.;2000-2021;"Ecology (Q4); Global and Planetary Change (Q4); Nature and Landscape Conservation (Q4)"
1004;33423;Communications on Hydraulic and Geotechnical Engineering - Delft University of Technology;journal;01696548;0.104;Q4;6;0;5;0;0;5;0;0;Netherlands;Western Europe;;1986-2005;"Geotechnical Engineering and Engineering Geology (Q3); Ocean Engineering (Q3); Water Science and Technology (Q4)"
1005;5800228217;IFRF Combustion Journal;journal;1562479X, 20753071;0.104;Q4;4;3;5;87;0;5;0;29;Italy;Western Europe;International Flame Research Foundation;2007-2010, 2012-2016;"Chemical Engineering (miscellaneous) (Q3); Energy Engineering and Power Technology (Q3); Fuel Technology (Q3); Chemistry (miscellaneous) (Q4); Physics and Astronomy (miscellaneous) (Q4); Pollution (Q4)"
1006;15996;International Dyer and Finisher;trade journal;0020658X;0.104;Q4;11;77;284;277;8;284;0.03;3.6;United Kingdom;Western Europe;World Textile Information Network;1989-1992, 1995-2019;"Business and International Management (Q3); Industrial and Manufacturing Engineering (Q3); Polymers and Plastics (Q3); Environmental Science (miscellaneous) (Q4)"
1007;19700187620;Planning and Environmental Law;journal;15568601, 15480755;0.104;Q4;8;18;37;0;0;5;0;0;United Kingdom;Western Europe;Taylor and Francis Ltd.;2004-2014;"Geography, Planning and Development (Q4); Law (Q4); Management, Monitoring, Policy and Law (Q4)"
1008;17390;Soil Mechanics and Foundation Engineering;journal;00380741, 15739279;0.104;Q4;17;40;115;284;3;114;0.03;7.1;United States;Northern America;Springer New York;1964-2021;"Geotechnical Engineering and Engineering Geology (Q3); Ocean Engineering (Q3); Energy (miscellaneous) (Q4); Soil Science (Q4); Water Science and Technology (Q4)"
1009;24539;Wasser und Abfall;journal;14369095;0.104;Q4;5;101;242;475;6;216;0.03;4.7;Germany;Western Europe;Springer Vieweg;2003-2021;"Pollution (Q4); Water Science and Technology (Q4)"
1010;24561;Water Environment and Technology;trade journal;10449493;0.104;Q4;11;0;449;0;19;368;0.06;0;United States;Northern America;Water Environment Federation;1990-2007;"Environmental Engineering (Q4); Pollution (Q4); Water Science and Technology (Q4)"
1011;31610;Working Paper of the University of Leeds, School of Geography;journal;-;0.104;Q4;4;4;5;216;0;5;0;54;United Kingdom;Western Europe;;1984-2003, 2005-2013, 2015;"Earth and Planetary Sciences (miscellaneous) (Q4); Geography, Planning and Development (Q4); Water Science and Technology (Q4)"
1012;30059;World Bank Working Paper;book series;17265878;0.104;Q4;12;0;93;0;13;82;0.15;0;United States;Northern America;United Nations Publications;2003-2007;"Business, Management and Accounting (miscellaneous) (Q3); Development (Q4); Environmental Science (miscellaneous) (Q4)"
1013;4000152119;Advances in the Economics of Environmental Resources;book series;15693740;0.103;Q4;10;0;44;0;4;42;0.03;0;United States;Northern America;Emerald Group Publishing Ltd.;2001-2002, 2005, 2007;"Economics, Econometrics and Finance (miscellaneous) (Q4); Environmental Science (miscellaneous) (Q4)"
1014;51442;CONCAWE Reports;journal;01660810;0.103;Q4;5;8;23;157;3;23;0.08;19.63;Belgium;Western Europe;Oil Companies European Organisation for Environmental and Health Protection;1999-2019;"Process Chemistry and Technology (Q3); Energy (miscellaneous) (Q4); Environmental Science (miscellaneous) (Q4); Safety, Risk, Reliability and Quality (Q4)"
1015;21002;Environmental Health Criteria;book series;0250863X;0.103;Q4;12;0;8;0;2;8;0.29;0;Switzerland;Western Europe;World Health Organization;1978, 1981-2003, 2005-2007, 2009, 2011, 2013;Health, Toxicology and Mutagenesis (Q4)
1016;21100319105;Geomathematics and GIS Analysis of Resources, Environment and Hazards - Annual Conference of the International Association for Mathematical Geology, IAMG 2007;conference and proceedings;-;0.103;-;5;0;194;0;16;193;0.08;0;China;Asiatic Region;;;Environmental Engineering
