Rank;Sourceid;Title;Type;Issn;SJR;SJR Best Quartile;H index;Total Docs. (2004);Total Docs. (3years);Total Refs.;Total Cites (3years);Citable Docs. (3years);Cites / Doc. (2years);Ref. / Doc.;Country;Publisher;Coverage;Categories
1716;5800207716;Gesture;journal;15699773, 15681475;0.171;Q1;31;11;32;253;15;32;0.18;23;Netherlands;John Benjamins Publishing Company;2008-ongoing;"Cultural Studies (Q1); Linguistics and Language (Q2); Communication (Q3); Experimental and Cognitive Psychology (Q4)"
1717;4700152804;Internet Reference Services Quarterly;journal;15404749, 10875301;0.171;Q3;17;11;49;220;7;47;0.21;20;United States;Haworth Press Inc.;1996-2002, 2004-ongoing;"E-learning (Q3); Library and Information Sciences (Q3)"
1718;4700152734;Journal of Hospital Librarianship;journal;15323269;0.171;Q3;7;43;141;342;9;134;0.06;7.95;United States;Haworth Information Press;2001-ongoing;"Library and Information Sciences (Q3); Medicine (miscellaneous) (Q3)"
1719;16264;Journal of Legal Education;journal;00222208;0.171;Q2;15;43;108;1399;17;104;0.17;32.53;United States;Association of America Law Schools;1988, 1996-ongoing;"Law (Q2); Education (Q3)"
1720;25587;Pacific Economic Review;journal;1361374X;0.171;Q3;29;28;80;682;17;80;0.18;24.36;United Kingdom;Blackwell Publishing Inc.;1996-ongoing;"Aerospace Engineering (Q3); Development (Q3); Geography, Planning and Development (Q3); Economics and Econometrics (Q4)"
1721;19043;Seton Hall law review;journal;05865964;0.171;Q2;10;6;13;0;3;12;0.3;0;United States;Seton Hall University;1975, 1980-1981, 1984, 1992, 1996-2001, 2003-ongoing;Law (Q2)
1722;17651;Comparative Social Research;book series;01956310;0.17;Q3;15;0;37;0;9;34;0.26;0;United Kingdom;Emerald Group Publishing Ltd.;1980-1981, 1984, 1999-2000, 2002-2003, 2006-ongoing;Sociology and Political Science (Q3)
1723;13384;Health Care Manager;journal;15255794, 1550512X;0.17;Q3;22;47;106;738;36;106;0.35;15.7;United States;Lippincott Williams & Wilkins Ltd.;1999-ongoing;"Care Planning (Q2); Leadership and Management (Q2); Health Policy (Q3); Health (social science) (Q3); Medicine (miscellaneous) (Q3)"
1724;21100201769;Journal of Communication Management;journal;1363254X;0.17;Q3;31;29;87;982;27;87;0.33;33.86;United Kingdom;Emerald Group Publishing Ltd.;1995-ongoing;"Communication (Q3); Strategy and Management (Q3)"
1725;20100195047;Kadmos;journal;00227498, 16130723;0.17;Q2;9;13;15;248;5;15;0.29;19.08;Germany;Walter de Gruyter GmbH;2011-ongoing;"Classics (Q1); Archeology (Q2); Archeology (arts and humanities) (Q2)"
1726;29932;Mitteilungen der Osterreichischen Geographischen Gesellscaft;journal;00299138;0.17;Q3;8;18;40;595;5;40;0.15;33.06;Austria;Oesterreichische Geographische Gesellschaft;1978-2008, 2011-ongoing;"Earth-Surface Processes (Q3); Geography, Planning and Development (Q3)"
1727;16200154796;North American Archaeologist;journal;01976931, 15413543;0.17;Q2;11;17;26;739;4;26;0.15;43.47;United States;SAGE Publications Inc.;2002-ongoing;"Archeology (Q2); Archeology (arts and humanities) (Q2)"
1728;4400151741;Research on Economic Inequality;book series;10492585;0.17;Q3;12;32;26;780;4;25;0.16;24.38;United Kingdom;Emerald Group Publishing Ltd.;2003-2004, 2006-ongoing;"Sociology and Political Science (Q3); Organizational Behavior and Human Resource Management (Q4)"
1729;87222;Review of Politics;journal;00346705;0.17;Q2;17;24;71;2014;11;71;0.1;83.92;United Kingdom;Cambridge University Press;1939-ongoing;"Political Science and International Relations (Q2); Sociology and Political Science (Q3)"
1730;5600155554;The Southern Communication Journal;journal;1041794X;0.17;Q3;21;25;62;1251;18;62;0.21;50.04;United Kingdom;Taylor and Francis Inc.;1988-ongoing;Communication (Q3)
1731;12881;Behavioral and Social Sciences Librarian;journal;01639269, 15444546;0.169;Q3;14;23;42;523;4;42;0.07;22.74;United States;Haworth Press Inc.;1979-2002, 2004-ongoing;"Library and Information Sciences (Q3); Social Sciences (miscellaneous) (Q3)"
1732;144955;Education and Information Technologies;journal;13602357;0.169;Q3;31;0;41;0;21;41;0.62;0;United States;Springer New York LLC;1996-2002, 2005-ongoing;"Education (Q3); E-learning (Q3); Library and Information Sciences (Q3)"
1733;19699;International Journal of Services, Technology and Management;journal;14606720, 1741525X;0.169;Q3;20;40;92;1154;26;90;0.31;28.85;United Kingdom;Inderscience Publishers;2002-ongoing;"Engineering (miscellaneous) (Q2); E-learning (Q3); Marketing (Q3); Strategy and Management (Q3); Computer Science Applications (Q4)"
1734;5800207565;Journal of Pidgin and Creole Languages;journal;09209034;0.169;Q2;16;31;75;812;16;75;0.23;26.19;Netherlands;John Benjamins Publishing Company;2002-ongoing;"Language and Linguistics (Q2); Linguistics and Language (Q2)"
1735;17585;Law and Social Inquiry;journal;1545696X, 08976546;0.169;Q2;42;21;64;1629;21;57;0.4;77.57;United States;Wiley-Blackwell;1976-ongoing;"Law (Q2); Social Sciences (miscellaneous) (Q3)"
1736;145567;Pragmatics and Cognition;journal;15699943, 09290907;0.169;Q2;27;15;36;584;18;36;0.4;38.93;Netherlands;John Benjamins Publishing Company;2005-ongoing;"History and Philosophy of Science (Q2); Language and Linguistics (Q2); Linguistics and Language (Q2); Computer Science (miscellaneous) (Q3); Behavioral Neuroscience (Q4)"
1737;13623;Searcher:Magazine for Database Professionals;trade journal;10704795;0.169;Q3;12;82;154;61;16;140;0.12;0.74;United States;Information Today, Inc.;1981-1982, 1998-2008;Library and Information Sciences (Q3)
1738;5700183859;Studies in Language;journal;03784177;0.169;Q2;27;34;31;1207;15;31;0.48;35.5;Netherlands;John Benjamins Publishing Company;2002-ongoing;"Language and Linguistics (Q2); Linguistics and Language (Q2); Communication (Q3)"
1739;5800222015;Bilingual Research Journal;journal;15235882, 15235890;0.168;Q2;32;23;95;692;17;94;0.11;30.09;United States;Routledge;1992-2006, 2009-ongoing;"Language and Linguistics (Q2); Linguistics and Language (Q2); Education (Q3)"
1740;25363;Japanese Journal of Alcohol Studies and Drug Dependence;journal;13418963;0.168;Q3;10;22;62;65;20;62;0.26;2.95;Japan;Nihon Arukoru Igakkai/Japenese Medical Society of Alcohol Studies;1981-ongoing;"Health (social science) (Q3); Medicine (miscellaneous) (Q3)"
1741;22918;Journal of Euromarketing;journal;15286967, 10496483;0.168;Q3;17;13;62;472;15;62;0.18;36.31;United States;Haworth Press Inc.;1992-2009;"Geography, Planning and Development (Q3); Marketing (Q3)"
1742;15401;Review of Urban and Regional Development Studies;journal;09170553, 1467940X;0.168;Q3;18;15;45;396;9;45;0.28;26.4;United Kingdom;Blackwell Publishing Inc.;1989-ongoing;"Development (Q3); Geography, Planning and Development (Q3)"
1743;21100801725;VINE Journal of Information and Knowledge Management Systems;journal;20595891;0.168;Q3;24;38;115;222;13;113;0.2;5.84;United Kingdom;Emerald Group Publishing Ltd.;2016-ongoing;"Computer Networks and Communications (Q3); Library and Information Sciences (Q3); Management of Technology and Innovation (Q3); Computer Science Applications (Q4); Information Systems (Q4)"
1744;17700156447;Biodemography and Social Biology;journal;19485565;0.167;Q3;28;11;47;0;14;47;0.23;0;United Kingdom;Taylor & Francis;1990, 2008-ongoing;"Anthropology (Q3); Demography (Q3); Ecology, Evolution, Behavior and Systematics (Q4); Genetics (Q4)"
1745;4000148501;Curriculum Inquiry;journal;03626784;0.167;Q3;32;27;71;670;19;61;0.28;24.81;United Kingdom;Taylor & Francis;1976-ongoing;Education (Q3)
1746;26802;International Journal of Speech Technology;journal;13812416, 15728110;0.167;Q2;24;27;88;636;44;82;0.57;23.56;Netherlands;Kluwer Academic Publishers;1995, 1997-ongoing;"Language and Linguistics (Q2); Linguistics and Language (Q2); Software (Q3); Computer Vision and Pattern Recognition (Q4); Human-Computer Interaction (Q4)"
1747;15347;International Review of Social History;journal;1469512X, 00208590;0.167;Q3;22;27;69;2275;17;68;0.21;84.26;United Kingdom;Cambridge University Press;1956-ongoing;"History (Q1); Social Sciences (miscellaneous) (Q3)"
1748;55361;Proceedings of the IASTED International Conference on Alliances, Mergers and Acquisitions;conference and proceedings;00002003;0.167;-;1;0;10;0;1;9;0.11;0;Canada;;2003;"Business, Management and Accounting (miscellaneous); Development"
1749;5600155187;Reseaux;journal;17775809, 07517971;0.167;Q3;15;42;158;1326;16;151;0.12;31.57;France;Lavoisier;2001-ongoing;"Communication (Q3); Electrical and Electronic Engineering (Q3)"
1750;145290;Bottom Line;journal;0888045X;0.166;Q3;13;37;124;89;24;124;0.17;2.41;United Kingdom;Emerald Group Publishing Ltd.;1988-ongoing;"Business, Management and Accounting (miscellaneous) (Q3); Library and Information Sciences (Q3)"
1751;16824;Central Asian Survey;trade journal;02634937, 14653354;0.166;Q3;28;16;72;206;23;72;0.24;12.88;United Kingdom;Carfax Publishing Ltd.;1982-ongoing;"Development (Q3); Earth-Surface Processes (Q3); Geography, Planning and Development (Q3)"
1752;78798;Ethnologie Francaise;journal;00462616;0.166;Q1;11;76;187;1633;20;184;0.11;21.49;France;Maisonneuve et Larose;1971, 1976, 1981, 2001-ongoing;"Cultural Studies (Q1); Anthropology (Q3)"
1753;17575;Law and Policy;journal;02658240, 14679930;0.166;Q2;40;16;61;852;29;60;0.36;53.25;United Kingdom;Blackwell Publishing Inc.;1979-1995, 2005-ongoing;"Law (Q2); Sociology and Political Science (Q3)"
1754;12071;Revue du Marche Commun et de L'Union Europeenne;journal;00352616;0.166;Q2;4;59;146;493;10;146;0.08;8.36;France;Editions Techniques et Economiques;1979-1991, 1993-2012, 2015;"Political Science and International Relations (Q2); Geography, Planning and Development (Q3)"
1755;23237;Studies in Educational Evaluation;journal;0191491X;0.166;Q3;33;15;63;581;13;62;0.07;38.73;United Kingdom;Elsevier Ltd.;1975-ongoing;Education (Q3)
1756;22132;Virginia Law Review;journal;00426601;0.166;Q2;49;37;95;0;40;88;0.42;0;United States;Virginia Law Review Association;1967, 1974-1978, 1980, 1983-1985, 1987, 1990, 1992, 1995-ongoing;Law (Q2)
1757;6000170740;American Literary History;journal;14684365, 08967148;0.165;Q1;28;42;130;1314;31;128;0.12;31.29;United States;Oxford University Press;1989-ongoing;"Cultural Studies (Q1); History (Q1); Literature and Literary Theory (Q1)"
1758;19200156920;Biotechnology, Agronomy and Society and Environment;journal;13706233, 17804507;0.165;Q3;28;33;64;747;11;57;0.12;22.64;Belgium;Universitaire des Sciences Agronomiques;2009-ongoing;"Forestry (Q3); Geography, Planning and Development (Q3); Agronomy and Crop Science (Q4); Biotechnology (Q4); Plant Science (Q4)"
1759;100147348;Howard Journal of Communications;journal;10646175;0.165;Q3;26;16;50;765;26;50;0.37;47.81;United Kingdom;Taylor & Francis;1988-ongoing;"Communication (Q3); Strategy and Management (Q4)"
1760;55750;Human Ecology Review;journal;10744827;0.165;Q3;35;24;57;991;12;57;0.16;41.29;United States;Society for Human Ecology;1998-ongoing;"Geography, Planning and Development (Q3); Management, Monitoring, Policy and Law (Q3)"
1761;19469;Journal of Early Childhood Teacher Education;journal;10901027;0.165;Q3;15;48;146;1118;10;142;0.09;23.29;United Kingdom;Taylor & Francis;1990-ongoing;"Education (Q3); Social Sciences (miscellaneous) (Q3)"
1762;54407;American Society of Mechanical Engineers, Rail Transportation Division (Publication) RTD;conference and proceedings;00002001, 00002009, 00002010, 00002007, 00001992, 00001998;0.164;-;12;49;70;319;6;67;0.14;6.51;United States;;1992-1998, 2001-2007, 2009-2010;"Mechanical Engineering; Transportation"
1763;5800207744;Bulletin de la Societe de Linguistique de Paris;journal;00379069;0.164;Q2;9;2;47;140;7;47;0;70;Belgium;Peeters Publishers;1996-2013, 2015-ongoing;"Language and Linguistics (Q2); Linguistics and Language (Q2)"
1764;300147008;European Journal of Cultural Studies;journal;13675494;0.164;Q1;38;29;71;801;36;69;0.46;27.62;United States;SAGE Publications;1998-ongoing;"Cultural Studies (Q1); Arts and Humanities (miscellaneous) (Q3); Education (Q3)"
1765;29852;Journal of Accounting Education;journal;07485751;0.164;Q3;29;17;57;339;12;57;0.26;19.94;United Kingdom;Elsevier Ltd.;1983-ongoing;"Accounting (Q3); Education (Q3)"
1766;19600162201;Journal of Institutional Research South East Asia;journal;16756061;0.164;Q3;4;7;24;111;1;21;0.05;15.86;Australia;South-East Asia Association for Institutional Research;2002-ongoing;Education (Q3)
1767;27358;New Review of Information Networking;journal;13614576, 17407869;0.164;Q3;12;18;44;186;6;41;0;10.33;United Kingdom;Taylor & Francis;1995-2008, 2010-ongoing;"Computer Networks and Communications (Q3); Education (Q3); Human-Computer Interaction (Q4); Information Systems (Q4)"
1768;19900188955;PoLAR: Political and Legal Anthropology Review;journal;10816976, 15552934;0.164;Q2;23;18;57;469;15;57;0.31;26.06;Germany;Wiley - VCH Verlag GmbH &Co. KGaA;1973-1974, 1977-1995, 2011-ongoing;"Law (Q2); Anthropology (Q3); Sociology and Political Science (Q3)"
1769;28652;Clinical Gerontologist;journal;15452301, 07317115;0.163;Q3;27;25;115;604;29;101;0.2;24.16;United States;Haworth Press Inc.;1982-ongoing;"Geriatrics and Gerontology (Q3); Gerontology (Q3); Health (social science) (Q3); Clinical Psychology (Q4); Social Psychology (Q4)"
1770;24846;Critical Inquiry;journal;15397858, 00931896;0.163;Q1;57;60;92;1421;85;83;1.02;23.68;United States;University of Chicago Press;1976, 1985-1987, 1996-ongoing;"Cultural Studies (Q1); Arts and Humanities (miscellaneous) (Q3)"
1771;21860;Great Plains Research;journal;10525165;0.163;Q3;17;20;56;560;14;52;0.17;28;United States;University of Nebraska at Lincoln;1991, 1993-ongoing;"Geography, Planning and Development (Q3); Ecology, Evolution, Behavior and Systematics (Q4)"
1772;4700152403;Journal of Gay and Lesbian Social Services;journal;10538720;0.163;Q2;36;1;120;0;26;120;0.14;0;United States;Haworth Press Inc.;1994-ongoing;"Gender Studies (Q2); Sociology and Political Science (Q3)"
1773;15159;Review of Regional Studies;journal;0048749X;0.163;Q3;18;19;56;578;7;56;0.13;30.42;United States;University of Delaware;1977-1982, 1984, 1987-2006, 2008-ongoing;"Earth-Surface Processes (Q3); Geography, Planning and Development (Q3)"
1774;29554;Journal of Bioeconomics;journal;13876996, 15736989;0.162;Q3;22;11;32;521;8;32;0.22;47.36;Netherlands;Kluwer Academic Publishers;1999-ongoing;"Geography, Planning and Development (Q3); Economics and Econometrics (Q4)"
1775;16151;Medical Law Review;journal;14643790, 09670742;0.162;Q2;25;3;36;0;24;36;0.71;0;United Kingdom;Oxford University Press;1993-ongoing;"Law (Q2); Medicine (miscellaneous) (Q3)"
1776;26143;Middle Eastern Studies;journal;00263206;0.162;Q1;30;48;93;2783;25;93;0.28;57.98;United Kingdom;Frank Cass Publishers;1964-ongoing;"Cultural Studies (Q1); History (Q1); Geography, Planning and Development (Q3); Sociology and Political Science (Q3)"
1777;25990;Social Science History;journal;01455532, 15278034;0.162;Q3;26;22;63;1459;21;63;0.3;66.32;United Kingdom;Cambridge University Press;1977-1978, 1980-1984, 1986, 1988-1989, 1996-ongoing;"History (Q1); Social Sciences (miscellaneous) (Q3)"
1778;24965;Empirica;journal;15736911, 03408744;0.161;Q3;26;19;57;546;24;57;0.43;28.74;Netherlands;Kluwer Academic Publishers;1974-ongoing;"Development (Q3); Geography, Planning and Development (Q3)"
1779;18798;Higher Education Policy;journal;09528733, 17403863;0.161;Q3;36;31;96;763;18;75;0.19;24.61;United Kingdom;Palgrave Macmillan Ltd.;1996-ongoing;"Education (Q3); Sociology and Political Science (Q3)"
1780;145585;Industrial Law Journal;journal;03059332;0.161;Q2;22;32;88;0;25;84;0.08;0;United Kingdom;Oxford University Press;1972-1995, 2005-ongoing;Law (Q2)
1781;28955;Justice System Journal;journal;0098261X;0.161;Q2;18;24;74;624;6;63;0.08;26;United Kingdom;Taylor & Francis;1988, 1990-1991, 1993-ongoing;Law (Q2)
1782;5700183126;Sign Language Studies;journal;15336263, 03021475;0.161;Q2;19;17;33;494;9;29;0.31;29.06;United States;Gallaudet University Press;2002-ongoing;"Language and Linguistics (Q2); Linguistics and Language (Q2)"
1783;16504;SIMILE;journal;14966603;0.161;Q3;10;14;28;264;6;28;0.21;18.86;Canada;University of Toronto Press;2002-2009;"Communication (Q3); Library and Information Sciences (Q3)"
1784;5600153364;Sociologia - Problemas e Praticas;journal;08736529;0.161;Q3;13;21;72;735;11;70;0.19;35;Portugal;Instituto Superior de Ciencias do Trabalho e da Empresa;1997-1998, 2012-ongoing;"Social Sciences (miscellaneous) (Q3); Sociology and Political Science (Q3)"
1785;13476;African Development Review;journal;14678268, 10176772;0.16;Q3;24;22;47;806;8;47;0.18;36.64;United Kingdom;Blackwell Publishing Inc.;1989-ongoing;Development (Q3)
1786;4700152781;Community and Junior College Libraries;journal;02763915, 15452522;0.16;Q3;8;19;76;58;4;65;0.09;3.05;United States;Haworth Press Inc.;1882, 1982-1989, 1991, 1995, 1999-ongoing;"Education (Q3); E-learning (Q3); Library and Information Sciences (Q3)"
1787;28124;Estudios Geograficos;journal;00141496;0.16;Q3;8;22;76;718;5;76;0.09;32.64;Spain;CSIC Consejo Superior de Investigaciones Cientificas;1979-ongoing;"Earth-Surface Processes (Q3); Geography, Planning and Development (Q3)"
1788;14175;European Journal of Development Research;journal;09578811;0.16;Q3;41;38;60;1593;19;59;0.31;41.92;United States;Palgrave Macmillan Ltd.;1989-ongoing;"Development (Q3); Geography, Planning and Development (Q3)"
1789;28865;Hermes;journal;00180777;0.16;Q2;10;166;247;3022;9;241;0.05;18.2;Germany;Franz Steiner Verlag Stuttgart GmbH;1967-1969, 1971-1972, 1974, 1976-1977, 1979-1980, 1986-1987, 1996-ongoing;"Classics (Q1); Language and Linguistics (Q2); Linguistics and Language (Q2)"
1790;16800154736;Hesperia;journal;0018098X, 15535622;0.16;Q2;22;16;28;1583;10;27;0.37;98.94;Greece;American School of Classical Studies;2002-ongoing;"Classics (Q1); History (Q1); Archeology (Q2); Archeology (arts and humanities) (Q2)"
1791;21100514454;IEEE International Symposium on Phased Array Systems and Technology;conference and proceedings;00002003;0.16;-;14;0;103;0;34;102;0.33;0;United States;;2003;"Biotechnology; Building and Construction; Education; Medicine (miscellaneous); Pollution; Social Sciences (miscellaneous)"
1792;24834;Journal of Value Inquiry;journal;15730492, 00225363;0.16;Q2;16;30;108;548;16;103;0.13;18.27;Netherlands;Kluwer Academic Publishers;1967-ongoing;"Law (Q2); Philosophy (Q2); Social Sciences (miscellaneous) (Q3)"
1793;21100396570;Lavoro e Diritto;journal;1120947X;0.16;Q2;8;31;78;890;14;74;0.17;28.71;Italy;Il Mulino publishing house;2015-ongoing;Law (Q2)
1794;12100157009;Politics and Policy;journal;17471346, 15555623;0.16;Q2;20;29;93;1070;11;90;0.05;36.9;United States;Wiley-Blackwell;1973-1995, 2008-ongoing;"Political Science and International Relations (Q2); Sociology and Political Science (Q3)"
1795;23953;Rural History: Economy, Society, Culture;journal;09567933, 14740656;0.16;Q3;16;10;32;449;10;32;0.27;44.9;United Kingdom;Cambridge University Press;1990-ongoing;"History (Q1); Arts and Humanities (miscellaneous) (Q3); Geography, Planning and Development (Q3); Urban Studies (Q3)"
1796;6500153212;Screen;journal;00369543, 14602474;0.16;Q1;24;27;89;832;29;83;0.3;30.81;United Kingdom;Oxford University Press;1969-ongoing;"Cultural Studies (Q1); Visual Arts and Performing Arts (Q1); Communication (Q3)"
1797;17100;South Asian Studies;journal;21532699, 02666030;0.16;Q1;9;8;38;179;19;38;0.48;22.38;United Kingdom;Taylor and Francis Inc.;1985-ongoing;"Cultural Studies (Q1); History (Q1); Archeology (arts and humanities) (Q2); Language and Linguistics (Q2)"
1798;21100423355;2003 IEEE Workshop on Automatic Speech Recognition and Understanding, ASRU 2003;conference and proceedings;00002003;0.159;-;19;0;121;0;107;120;0.89;0;United States;;2003;"Communication; Computer Networks and Communications; Electrical and Electronic Engineering; Signal Processing"
1799;30588;Cahiers de Geographie de Quebec;journal;00079766;0.159;Q3;11;17;44;726;9;44;0.17;42.71;Canada;Dep. de Geographie de l'Universite Laval;1978-ongoing;Geography, Planning and Development (Q3)
1800;21323;Flux;journal;11542721;0.159;Q3;10;23;34;408;5;34;0.15;17.74;France;Metropolis;1996-1998, 2002-ongoing;Geography, Planning and Development (Q3)
1801;27217;International Social Science Journal;journal;00208701, 14682451;0.159;Q3;41;47;168;1028;64;168;0.39;21.87;United Kingdom;Blackwell Publishing Inc.;1973-1975, 1978-2006, 2008-2014, 2016-ongoing;Social Sciences (miscellaneous) (Q3)
1802;19500157216;Journal of Addictions and Offender Counseling;journal;10553835;0.159;Q2;15;10;26;318;8;26;0.44;31.8;United States;Wiley-Blackwell;1990-1995, 2009-ongoing;"Law (Q2); Clinical Psychology (Q4); Social Psychology (Q4)"
1803;2000147401;Journal of the International Phonetic Association;journal;00251003;0.159;Q2;29;20;62;412;14;58;0.16;20.6;United Kingdom;Cambridge University Press;1971-1985, 1987-ongoing;"Language and Linguistics (Q2); Linguistics and Language (Q2); Anthropology (Q3); Speech and Hearing (Q4)"
1804;4100151537;Research in Social Problems and Public Policy;journal;01961152;0.159;Q3;14;0;50;0;18;47;0.57;0;United Kingdom;Emerald Group Publishing Ltd.;2001-2003, 2005-2008, 2010-2013, 2016-ongoing;"Rehabilitation (Q3); Sociology and Political Science (Q3)"
1805;21058;UCLA Law Review;journal;00415650;0.159;Q2;39;31;123;0;50;122;0.45;0;United States;University of California at Los Angeles;1968, 1976, 1978, 1980-1983, 1986, 1989, 1991-ongoing;Law (Q2)
1806;12062;International Journal for the Advancement of Counselling;journal;01650653, 15733246;0.158;Q3;23;33;68;819;14;65;0.2;24.82;Netherlands;Kluwer Academic Publishers;1978-1996, 1998-ongoing;"Education (Q3); Psychology (miscellaneous) (Q3); Applied Psychology (Q4)"
1807;67476;Social Anthropology;journal;09640282;0.158;Q3;35;23;64;759;11;63;0.16;33;United States;Wiley-Blackwell;1982, 1992-1995, 2005-ongoing;"Anthropology (Q3); Arts and Humanities (miscellaneous) (Q3); Sociology and Political Science (Q3); Developmental and Educational Psychology (Q4)"
1808;22068;Vanderbilt Law Review;journal;00422533;0.158;Q2;39;42;128;0;30;117;0.27;0;United States;Vanderbilt University;1973-1976, 1978-1979, 1986-1987, 1989-1990, 1992-1993, 1995-ongoing;Law (Q2)
1809;19700177700;European Energy and Environmental Law Review;journal;18793886;0.157;Q2;12;1;60;65;11;60;0.13;65;Netherlands;Kluwer Law International;2008-ongoing;"Law (Q2); Geography, Planning and Development (Q3); Management, Monitoring, Policy and Law (Q3); Renewable Energy, Sustainability and the Environment (Q3)"
1810;12492;Journal of Information Science and Engineering;journal;10162364;0.157;Q3;32;65;184;1316;72;181;0.4;20.25;Taiwan;Institute of Information Science;1993-1994, 1996-ongoing;"Library and Information Sciences (Q3); Computational Theory and Mathematics (Q4); Hardware and Architecture (Q4); Human-Computer Interaction (Q4); Software (Q4)"
1811;40126;Journal of Social Distress and the Homeless;journal;10530789;0.157;Q3;18;0;42;0;19;40;0.43;0;United Kingdom;Maney Publishing;1992-2002, 2015-ongoing;"Health Professions (miscellaneous) (Q3); Psychology (miscellaneous) (Q3); Social Sciences (miscellaneous) (Q3)"
1812;5700164250;Pedagogy, Culture & Society;journal;14681366;0.157;Q1;31;22;79;788;20;79;0.24;35.82;United Kingdom;Triangle Journals Ltd.;1999-ongoing;"Cultural Studies (Q1); Education (Q3)"
1813;21100204931;Sistemi Intelligenti;journal;11209550;0.157;Q2;7;24;102;1185;12;94;0.09;49.38;Italy;Il Mulino publishing house;2011-ongoing;"Language and Linguistics (Q2); Linguistics and Language (Q2); Artificial Intelligence (Q4); Cognitive Neuroscience (Q4); Experimental and Cognitive Psychology (Q4)"
1814;20841;Health and Human Rights;journal;10790969, 21504113;0.156;Q2;27;39;26;1741;8;26;0.31;44.64;United States;Harvard School for Public Health;1994-2001, 2003-2006, 2008-ongoing;"Political Science and International Relations (Q2); Health (social science) (Q3); Sociology and Political Science (Q3)"
1815;144736;Innovative Higher Education;journal;07425627;0.156;Q3;33;9;33;204;9;33;0.29;22.67;Netherlands;Springer Netherlands;1983-2002, 2004-ongoing;Education (Q3)
1816;145600;International Journal of Law and Information Technology;journal;09670769;0.156;Q2;14;8;40;1047;7;40;0.08;130.88;United Kingdom;Oxford University Press;1993-1995, 2004-ongoing;"Law (Q2); Library and Information Sciences (Q3)"
1817;16000154796;Jahrbuch des Deutschen Archaeologischen Instituts;book series;00704415;0.156;Q2;5;8;12;2026;1;12;0;253.25;Germany;Walter de Gruyter GmbH;2001-2002, 2004-2006, 2012, 2014-ongoing;"History (Q1); Visual Arts and Performing Arts (Q1); Archeology (Q2); Archeology (arts and humanities) (Q2)"
1818;10100153322;Journal of Immigrant and Refugee Studies;journal;15562956, 15562948;0.156;Q3;16;25;20;546;3;20;0.15;21.84;United States;Haworth Press Inc.;2006-ongoing;"Demography (Q3); Geography, Planning and Development (Q3); Health (social science) (Q3)"
1819;21100237436;Journal of Information and Knowledge Management;journal;02196492, 17936926;0.156;Q3;17;28;54;1101;12;51;0.24;39.32;United States;World Scientific Publishing Co.;2012-ongoing;"Computer Networks and Communications (Q3); Library and Information Sciences (Q3); Computer Science Applications (Q4)"
1820;5600155080;Philosophy and Social Criticism;journal;01914537;0.156;Q3;26;48;108;1627;26;105;0.19;33.9;United States;SAGE Publications;1973-1982, 1984-ongoing;"Philosophy (Q2); Sociology and Political Science (Q3)"
1821;21100409653;Proceedings of the 2nd International Workshop on Advanced Ground Penetrating Radar;conference and proceedings;00002003;0.156;-;9;0;41;0;30;40;0.75;0;United States;;2003;"Computer Science Applications; Hardware and Architecture; Human-Computer Interaction; Human Factors and Ergonomics; Mechanical Engineering"
1822;21100511229;Proceedings of the International Conference on Ion Implantation Technology;conference and proceedings;00002002;0.156;-;7;0;182;0;25;180;0.14;0;United States;;2002;"Computer Science Applications; Education; Instrumentation; Safety, Risk, Reliability and Quality"
