Rank;Sourceid;Title;Type;Issn;SJR;SJR Best Quartile;H index;Total Docs. (2017);Total Docs. (3years);Total Refs.;Total Cites (3years);Citable Docs. (3years);Cites / Doc. (2years);Ref. / Doc.;Country;Region;Publisher;Coverage;Categories
462;12000154485;Journal of Land Use Science;journal;1747423X, 17474248;0.674;Q2;37;29;86;1645;180;83;2.02;56.72;United Kingdom;Western Europe;Taylor and Francis Ltd.;2006-2021;"Geography, Planning and Development (Q1); Earth-Surface Processes (Q2); Management, Monitoring, Policy and Law (Q2)"
463;21100201022;Frontiers of Environmental Science and Engineering;journal;20952201, 2095221X;0.672;Q2;48;100;339;3809;741;335;2.08;38.09;China;Asiatic Region;Higher Education Press;2012-2022;Environmental Science (miscellaneous) (Q2)
464;21100316609;Life Sciences in Space Research;journal;22145532, 22145524;0.671;Q2;23;35;111;1404;222;102;1.72;40.11;Netherlands;Western Europe;Elsevier BV;2014-2022;"Ecology (Q2); Health, Toxicology and Mutagenesis (Q2); Radiation (Q2); Astronomy and Astrophysics (Q3)"
465;21557;Environmental Values;journal;09632719, 17527015;0.67;Q2;51;36;115;1744;194;97;1.76;48.44;United Kingdom;Western Europe;White Horse Press;1994-2021;"Philosophy (Q1); Environmental Science (miscellaneous) (Q2)"
466;21100817619;International Soil and Water Conservation Research;journal;20956339;0.667;Q2;38;38;99;1634;216;96;2.65;43;Netherlands;Western Europe;;2013-2021;"Agronomy and Crop Science (Q1); Nature and Landscape Conservation (Q2); Soil Science (Q2); Water Science and Technology (Q2)"
467;15900154751;Knowledge and Management of Aquatic Ecosystems;journal;19619502;0.667;Q2;30;57;132;2915;273;129;1.75;51.14;France;Western Europe;EDP Sciences;2008-2021;"Aquatic Science (Q2); Ecology (Q2); Management, Monitoring, Policy and Law (Q2); Nature and Landscape Conservation (Q2); Water Science and Technology (Q2)"
468;18691;Comptes Rendus - Geoscience;journal;16310713, 17787025;0.666;Q3;82;46;152;2173;247;136;1.71;47.24;France;Western Europe;Academie des sciences;2002-2021;"Earth and Planetary Sciences (miscellaneous) (Q2); Global and Planetary Change (Q3)"
469;29945;Journal of Carcinogenesis;journal;09746773, 14773163;0.662;Q2;41;3;20;121;46;20;3.57;40.33;India;Asiatic Region;Wolters Kluwer Medknow Publications;2002-2021;"Health, Toxicology and Mutagenesis (Q2); Cancer Research (Q3); Oncology (Q3)"
470;9700153237;Mutation Research Letters;journal;1873135X;0.662;Q2;0;0;0;0;0;0;0;0;Netherlands;Western Europe;Elsevier BV;1973-1995, 2006, 2012-2021;"Health, Toxicology and Mutagenesis (Q2); Medicine (miscellaneous) (Q2); Molecular Biology (Q3)"
471;21100205763;Systematic and Applied Acarology;journal;13621971;0.662;Q2;22;160;276;5608;448;263;1.72;35.05;Australia;Pacific Region;Systematic and Applied Acarology Society;2000, 2005, 2008, 2010-2021;"Ecology (Q2); Ecology, Evolution, Behavior and Systematics (Q2); Insect Science (Q2)"
472;25866;Geo-Marine Letters;journal;02760460, 14321157;0.658;Q2;59;47;117;2426;216;117;1.68;51.62;Germany;Western Europe;Springer Verlag;1981-2021;"Earth and Planetary Sciences (miscellaneous) (Q2); Environmental Science (miscellaneous) (Q2); Geotechnical Engineering and Engineering Geology (Q2); Oceanography (Q2)"
473;23373;Journal of Environmental Planning and Management;journal;13600559, 09640568;0.657;Q2;75;109;319;6756;614;318;1.73;61.98;United Kingdom;Western Europe;Routledge;1992-2021;"Fluid Flow and Transfer Processes (Q1); Geography, Planning and Development (Q1); Environmental Science (miscellaneous) (Q2); Management, Monitoring, Policy and Law (Q2); Water Science and Technology (Q2)"
474;19431;Wetlands Ecology and Management;journal;15729834, 09234861;0.656;Q2;68;51;181;3116;333;177;1.74;61.1;Netherlands;Western Europe;Springer Netherlands;1982, 1989-2021;"Aquatic Science (Q2); Ecology, Evolution, Behavior and Systematics (Q2); Management, Monitoring, Policy and Law (Q2)"
475;29601;Hydrology Research;journal;22247955, 00291277, 19989563;0.655;Q2;50;121;246;5366;386;240;1.6;44.35;Denmark;Western Europe;;1973-2021;Water Science and Technology (Q2)
476;21989;Herpetological Journal;journal;02680130;0.654;Q2;39;41;95;2308;141;94;1.43;56.29;United Kingdom;Western Europe;British Herpetological Society;1987, 1994-2021;"Animal Science and Zoology (Q1); Ecology, Evolution, Behavior and Systematics (Q2); Nature and Landscape Conservation (Q2); Ecological Modeling (Q3)"
477;12883;New Zealand Journal of Ecology;journal;01106465;0.654;Q2;50;31;115;1863;176;115;1.39;60.1;New Zealand;Pacific Region;New Zealand Ecological Society;1980, 1982-2021;"Ecology (Q2); Ecology, Evolution, Behavior and Systematics (Q2)"
478;13273;Environment and Planning B: Planning and Design;journal;14723417, 02658135;0.653;Q2;0;0;0;0;0;0;0;0;United Kingdom;Western Europe;SAGE Publications Ltd;1984-2016;"Geography, Planning and Development (Q1); Environmental Science (miscellaneous) (Q2)"
479;21100365104;Food Webs;journal;23522496;0.653;Q2;19;39;33;3212;65;31;1.97;82.36;Netherlands;Western Europe;Elsevier BV;2014-2021;"Ecology (Q2); Ecology, Evolution, Behavior and Systematics (Q2)"
480;26814;Coastal Management;journal;08920753, 15210421;0.652;Q2;52;31;107;1787;153;104;0.96;57.65;United Kingdom;Western Europe;Taylor and Francis Ltd.;1987-2021;"Environmental Science (miscellaneous) (Q2); Environmental Chemistry (Q3)"
481;25093;Environmental Toxicology;journal;15227278, 15204081;0.652;Q2;81;212;472;10465;1127;472;2.45;49.36;United States;Northern America;"John Wiley &amp; Sons Inc.";1980, 1999-2021;"Management, Monitoring, Policy and Law (Q2); Medicine (miscellaneous) (Q2); Toxicology (Q2); Health, Toxicology and Mutagenesis (Q3)"
482;21100201941;Journal of Arid Land;journal;16746767, 21947783;0.652;Q2;32;78;234;3367;468;233;1.75;43.17;China;Asiatic Region;Science Press;2009-2021;"Earth-Surface Processes (Q2); Management, Monitoring, Policy and Law (Q2); Water Science and Technology (Q2)"
483;23655;Silva Fennica;journal;22424075, 00375330;0.65;Q3;63;62;130;3493;254;130;1.72;56.34;Finland;Western Europe;Finnish Society of Forest Science;1976, 1978, 1981-2021;"Forestry (Q1); Ecological Modeling (Q3)"
484;130111;Clean Technologies and Environmental Policy;journal;1618954X;0.648;Q2;62;201;591;8441;1535;563;2.53;42;Germany;Western Europe;Springer Verlag;2003-2021;"Environmental Engineering (Q2); Management, Monitoring, Policy and Law (Q2); Environmental Chemistry (Q3)"
485;15608;Engineering in Life Sciences;journal;16182863, 16180240;0.648;Q2;62;136;257;5481;640;249;2.45;40.3;Germany;Western Europe;Wiley-VCH Verlag;2004-2021;"Bioengineering (Q2); Biotechnology (Q2); Environmental Engineering (Q2)"
486;25283;Journal of Fluorine Chemistry;journal;00221139;0.645;Q3;93;191;652;8888;1341;648;1.95;46.53;Netherlands;Western Europe;Elsevier BV;1971-2021;"Inorganic Chemistry (Q2); Organic Chemistry (Q2); Physical and Theoretical Chemistry (Q2); Biochemistry (Q3); Environmental Chemistry (Q3)"
487;17700155709;Fire Ecology;journal;19339747;0.643;Q2;33;27;71;1694;110;65;1.86;62.74;United States;Northern America;Association for Fire Ecology;2009-2021;"Forestry (Q1); Ecology, Evolution, Behavior and Systematics (Q2); Environmental Science (miscellaneous) (Q2)"
488;23354;Journal of Environmental Education;journal;19401892, 00958964;0.64;Q2;60;31;55;1622;153;54;2.67;52.32;United Kingdom;Western Europe;Taylor and Francis Ltd.;1971-2021;"Education (Q2); Environmental Science (miscellaneous) (Q2)"
489;14917;Radiation and Environmental Biophysics;journal;0301634X, 14322099;0.64;Q2;55;46;168;1632;299;164;1.42;35.48;Germany;Western Europe;Springer New York;1974-2021;"Biophysics (Q2); Environmental Science (miscellaneous) (Q2); Radiation (Q2)"
490;21100202110;Environmental Development;journal;22114645;0.638;Q2;37;57;133;3057;348;116;2.74;53.63;Netherlands;Western Europe;Elsevier BV;2012-2021;"Geography, Planning and Development (Q1); Management, Monitoring, Policy and Law (Q2)"
491;50039;Review of Policy Research;journal;1541132X, 15411338;0.637;Q2;48;37;95;2391;246;94;1.46;64.62;United Kingdom;Western Europe;Wiley-Blackwell Publishing Ltd;1981-1995, 1998-2021;"Geography, Planning and Development (Q1); Management, Monitoring, Policy and Law (Q2); Public Administration (Q2)"
492;34696;Turk Tarim ve Ormancilik Dergisi/Turkish Journal of Agriculture and Forestry;journal;1300011X, 13036173;0.636;Q2;46;48;294;2028;495;294;1.66;42.25;Turkey;Middle East;Turkiye Klinikleri Journal of Medical Sciences;1994-2021;"Forestry (Q1); Ecology (Q2); Food Science (Q2)"
493;21100255400;Water (Switzerland);journal;20734441;0.634;Q2;69;1007;1158;49841;2826;1140;2.36;49.49;Switzerland;Western Europe;Multidisciplinary Digital Publishing Institute (MDPI);2009-2021;"Geography, Planning and Development (Q1); Aquatic Science (Q2); Water Science and Technology (Q2); Biochemistry (Q3)"
494;29421;Aquaculture, Economics and Management;journal;13657305, 13657313;0.632;Q2;37;25;65;1123;163;61;2.62;44.92;United Kingdom;Western Europe;Taylor and Francis Ltd.;1997-2021;"Geography, Planning and Development (Q1); Aquatic Science (Q2); Ecology (Q2)"
495;29608;Journal of Limnology;journal;11295767;0.632;Q2;47;65;220;3973;370;205;1.4;61.12;Italy;Western Europe;PagePress Publications;1997-2021;"Aquatic Science (Q2); Ecology (Q2); Water Science and Technology (Q2)"
496;18972;Information Economics and Policy;journal;01676245;0.63;Q2;50;28;76;927;105;74;1.3;33.11;Netherlands;Western Europe;Elsevier;1983-1984, 1986, 1988-1989, 1993-2021;"Economics and Econometrics (Q2); Management, Monitoring, Policy and Law (Q2)"
497;22753;International Journal of Environmental Health Research;journal;09603123, 13691619;0.627;Q2;52;42;143;1999;272;143;1.66;47.6;United Kingdom;Western Europe;Taylor and Francis Ltd.;1991-2021;"Medicine (miscellaneous) (Q2); Pollution (Q2); Public Health, Environmental and Occupational Health (Q2); Health, Toxicology and Mutagenesis (Q3)"
498;21100236217;Review of European, Comparative and International Environmental Law;journal;20500386, 20500394;0.622;Q2;21;28;98;964;149;90;1.39;34.43;United Kingdom;Western Europe;John Wiley and Sons Ltd;2013-2021;"Geography, Planning and Development (Q1); Law (Q1); Management, Monitoring, Policy and Law (Q2)"
499;22630;Proceedings of the Linnean Society of New South Wales;journal;0370047X;0.619;Q2;19;0;1;0;3;1;3;0;Australia;Pacific Region;Linnean Society of New South Wales;1980-1981, 1983, 1996-2001, 2003-2011, 2015;"Agricultural and Biological Sciences (miscellaneous) (Q1); Ecology (Q2); Environmental Science (miscellaneous) (Q2)"
500;24714;Bioacoustics;journal;09524622;0.618;Q2;33;21;58;1029;121;58;2.1;49;United Kingdom;Western Europe;Taylor and Francis Ltd.;1988-2021;"Ecology (Q2); Ecology, Evolution, Behavior and Systematics (Q2)"
501;20873;Environment and Development Economics;journal;1355770X, 14694395;0.617;Q2;66;35;135;1480;178;135;1.54;42.29;United Kingdom;Western Europe;Cambridge University Press;1996-2021;"Development (Q2); Economics and Econometrics (Q2); Environmental Science (miscellaneous) (Q2)"
502;19700188237;Journal of Biological Dynamics;journal;17513766, 17513758;0.617;Q2;34;47;75;1660;117;74;1.23;35.32;United Kingdom;Western Europe;Taylor and Francis Ltd.;2007-2021;"Ecology (Q2); Ecology, Evolution, Behavior and Systematics (Q2)"
503;15838;Atmosphere;journal;20734433;0.615;Q2;46;255;314;12483;613;310;1.92;48.95;Switzerland;Western Europe;Multidisciplinary Digital Publishing Institute (MDPI);2010-2021;"Environmental Science (miscellaneous) (Q2); Atmospheric Science (Q3)"
504;30715;Annals of Regional Science;journal;05701864, 14320592;0.614;Q2;66;61;187;2907;253;181;1.31;47.66;Germany;Western Europe;Springer Verlag;1967-2021;"Social Sciences (miscellaneous) (Q1); Environmental Science (miscellaneous) (Q2)"
505;21100414365;Nature Conservation;journal;13143301, 13146947;0.614;Q2;23;50;46;3235;73;45;1.55;64.7;Bulgaria;Eastern Europe;Pensoft Publishers;2012-2021;Nature and Landscape Conservation (Q2)
506;6000195392;Estonian Journal of Earth Sciences;journal;17364728;0.613;Q2;25;21;96;894;97;94;0.89;42.57;Estonia;Eastern Europe;Estonian Academy Publishers;2007-2021;"Earth and Planetary Sciences (miscellaneous) (Q2); Water Science and Technology (Q2)"
507;19700175283;Journal of Environmental and Public Health;journal;16879805, 16879813;0.612;Q3;41;52;107;2213;208;106;1.79;42.56;Egypt;Africa/Middle East;Hindawi Limited;2009-2021;"Public Health, Environmental and Occupational Health (Q2); Health, Toxicology and Mutagenesis (Q3)"
508;12300154714;Botany;journal;19162790, 19162804;0.611;Q2;89;106;278;5794;439;253;1.22;54.66;Canada;Northern America;National Research Council of Canada;2008-2021;"Ecology (Q2); Ecology, Evolution, Behavior and Systematics (Q2); Plant Science (Q2)"
509;24042;Mine Water and the Environment;journal;16161068, 10259112;0.608;Q2;40;69;139;2424;217;130;1.44;35.13;Germany;Western Europe;Springer Verlag;1991-1995, 2001-2002, 2004-2021;"Geotechnical Engineering and Engineering Geology (Q2); Water Science and Technology (Q2)"
510;21100305331;Sustainability of Water Quality and Ecology;journal;22126139;0.608;Q2;16;11;44;594;77;39;2.11;54;Netherlands;Western Europe;Elsevier BV;2014-2017;"Ecology (Q2); Water Science and Technology (Q2)"
511;28910;Leisure Sciences;journal;15210588, 01490400;0.607;Q2;71;36;82;2248;170;81;1.74;62.44;United Kingdom;Western Europe;Taylor and Francis Ltd.;1977-2021;"Sociology and Political Science (Q1); Environmental Science (miscellaneous) (Q2); Tourism, Leisure and Hospitality Management (Q2)"
512;19700182745;Environmental Communication;journal;17524040, 17524032;0.605;Q2;38;55;112;3002;249;102;2.1;54.58;United Kingdom;Western Europe;Taylor and Francis Ltd.;2010-2021;"Environmental Science (miscellaneous) (Q2); Management, Monitoring, Policy and Law (Q2)"
513;21100305327;Austral Entomology;journal;2052174X, 20521758;0.603;Q2;41;44;125;2187;178;124;1.42;49.7;United States;Northern America;"John Wiley &amp; Sons Inc.";2014-2021;"Agronomy and Crop Science (Q2); Ecology (Q2); Ecology, Evolution, Behavior and Systematics (Q2); Insect Science (Q2)"
514;19700167301;Environmental Economics and Policy Studies;journal;1867383X, 1432847X;0.602;Q2;27;39;79;1389;112;75;1.1;35.62;Japan;Asiatic Region;Springer Japan;1998-2002, 2004-2021;"Economics and Econometrics (Q2); Management, Monitoring, Policy and Law (Q2)"
515;25749;Environmental Engineering Science;journal;10928758;0.602;Q2;68;98;299;4101;450;291;1.54;41.85;United States;Northern America;Mary Ann Liebert Inc.;1997-2021;"Pollution (Q2); Waste Management and Disposal (Q2); Environmental Chemistry (Q3)"
516;21100228041;International Journal of Energy and Environmental Engineering;journal;20089163, 22516832;0.602;Q2;35;31;128;984;289;128;2.14;31.74;United States;Northern America;Springer Science + Business Media;2010-2021;"Energy (miscellaneous) (Q2); Environmental Engineering (Q2)"
517;4000148503;International Journal of Environmental Science and Technology;journal;17351472;0.6;Q2;84;240;867;11162;2042;866;2.3;46.51;Iran;Middle East;CEERS;2005-2021;"Agricultural and Biological Sciences (miscellaneous) (Q2); Environmental Engineering (Q2); Environmental Chemistry (Q3)"
518;29721;Journal of Hydrology and Hydromechanics;journal;13384333, 0042790X;0.599;Q2;29;44;127;1784;253;125;1.92;40.55;Germany;Western Europe;De Gruyter Open Ltd.;1973-1992, 1994-1996, 2007-2021;"Fluid Flow and Transfer Processes (Q1); Mechanical Engineering (Q2); Water Science and Technology (Q2)"
519;34002;International Regional Science Review;journal;01600176, 15526925;0.596;Q2;57;23;56;1468;75;53;1.24;63.83;United States;Northern America;SAGE Publications Inc.;1975-1984, 1986-2021;"Social Sciences (miscellaneous) (Q1); Environmental Science (miscellaneous) (Q2)"
520;16286;Canadian Water Resources Journal;journal;07011784;0.595;Q2;38;29;108;1597;158;102;1.57;55.07;United Kingdom;Western Europe;Taylor and Francis Ltd.;1976-2021;Water Science and Technology (Q2)
521;28201;Biomedical and Environmental Sciences;journal;08953988;0.594;Q3;57;127;390;3206;604;233;1.61;25.24;United Kingdom;Western Europe;Elsevier;1988-2021;"Public Health, Environmental and Occupational Health (Q2); Health, Toxicology and Mutagenesis (Q3)"
522;23179;Environmental and Ecological Statistics;journal;13528505, 15733009;0.594;Q2;48;28;115;992;98;113;0.82;35.43;Netherlands;Western Europe;Springer Netherlands;1994-2021;"Environmental Science (miscellaneous) (Q2); Statistics and Probability (Q3); Statistics, Probability and Uncertainty (Q3)"
523;23369;Journal of Environmental Law;journal;1464374X, 09528873;0.594;Q2;32;22;84;641;103;84;1.33;29.14;United Kingdom;Western Europe;Oxford University Press;1989-2021;"Law (Q1); Management, Monitoring, Policy and Law (Q2)"
524;22310;Polar Research;journal;17518369, 08000395;0.594;Q2;52;34;119;1722;219;118;1.52;50.65;United Kingdom;Western Europe;Norwegian Polar Institute;1982-2021;"Earth and Planetary Sciences (miscellaneous) (Q2); Environmental Science (miscellaneous) (Q2); Oceanography (Q2); Environmental Chemistry (Q3)"
525;23273;International Journal of Phytoremediation;journal;15497879, 15226514;0.592;Q2;90;133;399;6492;894;397;2.13;48.81;United Kingdom;Western Europe;Taylor and Francis Ltd.;1994, 1996-2021;"Plant Science (Q2); Pollution (Q2); Environmental Chemistry (Q3)"
526;21100810502;Transportation Infrastructure Geotechnology;journal;21967202, 21967210;0.592;Q2;11;7;32;165;40;30;0.89;23.57;United States;Northern America;Springer Nature Switzerland AG;2014-2021;"Civil and Structural Engineering (Q2); Environmental Engineering (Q2); Geotechnical Engineering and Engineering Geology (Q2); Transportation (Q2)"
527;21482;Environmental Monitoring and Assessment;journal;01676369, 15732959;0.589;Q2;122;635;2265;31573;4817;2263;2.02;49.72;Netherlands;Western Europe;Springer Netherlands;1981-2021;"Environmental Science (miscellaneous) (Q2); Management, Monitoring, Policy and Law (Q2); Medicine (miscellaneous) (Q2); Pollution (Q2)"
528;24554;Water, Air, and Soil Pollution;journal;00496979, 15732932;0.589;Q2;118;459;1374;21277;2758;1373;1.88;46.36;Netherlands;Western Europe;Springer Netherlands;1971-2021;"Environmental Engineering (Q2); Pollution (Q2); Water Science and Technology (Q2); Ecological Modeling (Q3); Environmental Chemistry (Q3)"
529;21100818904;Journal of Ocean and Wind Energy;journal;23103604;0.582;Q2;13;0;67;0;81;59;1.03;0;United States;Northern America;International Society of Offshore and Polar Engineers;2014-2016;"Energy Engineering and Power Technology (Q2); Ocean Engineering (Q2); Renewable Energy, Sustainability and the Environment (Q2); Water Science and Technology (Q2)"
530;23028;New Zealand Journal of Forestry Science;journal;11795395, 00480134;0.582;Q2;32;24;90;1049;138;88;1.44;43.71;Switzerland;Western Europe;Scion Publishing;1979, 1981, 1983-2021;"Forestry (Q1); Chemical Engineering (miscellaneous) (Q2); Ecology (Q2); Plant Science (Q2)"
531;22758;Wildfowl;journal;09546324;0.582;Q2;23;11;61;388;70;57;0.65;35.27;United Kingdom;Western Europe;Wildfowl and Wetlands Trust;1981-1982, 1987, 1990-2003, 2005-2018, 2020;"Ecology (Q2); Ecology, Evolution, Behavior and Systematics (Q2); Nature and Landscape Conservation (Q2)"
532;21017;Bird Conservation International;journal;09592709, 14740001;0.581;Q2;45;44;126;2219;181;126;1.57;50.43;United Kingdom;Western Europe;Cambridge University Press;1991-2021;"Animal Science and Zoology (Q2); Ecology (Q2); Nature and Landscape Conservation (Q2)"
533;21568;Monthly Review;journal;00270520;0.581;Q2;36;62;176;1719;148;155;0.78;27.73;United States;Northern America;Monthly Review Press;1977, 1980-1982, 1984, 1987, 1996-2020;"Gender Studies (Q1); Geography, Planning and Development (Q2); Management, Monitoring, Policy and Law (Q2); Sociology and Political Science (Q2)"
534;19700177407;Interdisciplinary Toxicology;journal;13379569, 13376853;0.58;Q3;34;25;74;1070;183;73;0.83;42.8;Slovakia;Eastern Europe;Slovak Toxicology Society SETOX;2008-2020;"Health, Toxicology and Mutagenesis (Q3); Pharmacology (Q3); Toxicology (Q3)"
535;21100367469;Toxicology Reports;journal;22147500;0.58;Q3;46;82;396;3879;718;393;1.86;47.3;Ireland;Western Europe;Elsevier Scientific Publishers Ireland;2014-2021;"Health, Toxicology and Mutagenesis (Q3); Toxicology (Q3)"
536;17819;Tropical Ecology;journal;05643295;0.578;Q2;36;74;142;3780;223;141;1.48;51.08;India;Asiatic Region;International Society for Tropical Ecology;1976-1978, 1988, 1993-2021;"Ecology (Q2); Ecology, Evolution, Behavior and Systematics (Q2); Plant Science (Q2)"
537;21100205502;European Journal of Remote Sensing;journal;11298596, 22797254;0.577;Q2;36;50;146;2164;256;146;1.43;43.28;Italy;Western Europe;Associazione Italiana di Telerilevamento;2012-2021;"Applied Mathematics (Q2); Computers in Earth Sciences (Q2); Environmental Science (miscellaneous) (Q2); Atmospheric Science (Q3)"
538;4700152492;Frontiers of Biology in China;journal;16733509, 16733622;0.577;Q2;20;0;0;0;0;0;0;0;China;Asiatic Region;Higher Education Press;2006-2011;"Biotechnology (Q2); Ecology (Q2); Ecology, Evolution, Behavior and Systematics (Q2); Genetics (Q3)"
539;21100782678;Agriculture and Food Security;journal;20487010;0.575;Q2;31;72;78;3180;163;75;1.81;44.17;United Kingdom;Western Europe;BioMed Central Ltd.;2012-2021;"Agronomy and Crop Science (Q2); Ecology (Q2); Food Science (Q2)"
540;5700164337;Journal of Tourism and Cultural Change;journal;14766825;0.572;Q2;31;27;63;1617;93;62;1.44;59.89;United Kingdom;Western Europe;Taylor and Francis Ltd.;2003-2021;"Cultural Studies (Q1); Geography, Planning and Development (Q2); Nature and Landscape Conservation (Q2); Tourism, Leisure and Hospitality Management (Q2); Transportation (Q2)"
541;110291;Applied Biochemistry and Biotechnology;journal;02732289;0.571;Q2;119;333;1665;14147;3594;1663;1.98;42.48;United States;Northern America;Humana Press;1981-2021;"Applied Microbiology and Biotechnology (Q2); Bioengineering (Q2); Biotechnology (Q2); Environmental Engineering (Q2); Medicine (miscellaneous) (Q2); Biochemistry (Q3); Molecular Biology (Q4)"
542;18094;Flora: Morphology, Distribution, Functional Ecology of Plants;journal;03672530;0.57;Q2;60;156;291;8978;464;287;1.45;57.55;Germany;Western Europe;Urban und Fischer Verlag Jena;1975-1976, 1980-1988, 1990-2021;"Ecology (Q2); Ecology, Evolution, Behavior and Systematics (Q2); Plant Science (Q2)"
543;21574;Emu;journal;14485540, 01584197;0.568;Q2;43;52;147;2763;201;147;1.32;53.13;Australia;Pacific Region;CSIRO;1901-2021;"Animal Science and Zoology (Q2); Ecology, Evolution, Behavior and Systematics (Q2); Nature and Landscape Conservation (Q2)"
544;19600157910;Palaeobiodiversity and Palaeoenvironments;journal;18671608, 18671594;0.568;Q2;35;43;112;3084;150;103;1.39;71.72;Germany;Western Europe;Springer Verlag;2010-2021;"Ecology (Q2); Ecology, Evolution, Behavior and Systematics (Q2); Geology (Q2); Paleontology (Q2); Global and Planetary Change (Q3)"
545;29550;Journal of Biochemical and Molecular Toxicology;journal;10956670, 10990461;0.565;Q3;62;137;212;5265;422;210;1.78;38.43;United States;Northern America;"John Wiley &amp; Sons Inc.";1998-2021;"Medicine (miscellaneous) (Q2); Biochemistry (Q3); Health, Toxicology and Mutagenesis (Q3); Molecular Medicine (Q3); Toxicology (Q3); Molecular Biology (Q4)"
546;25917;Journal of Polymers and the Environment;journal;15728900, 15662543;0.562;Q2;80;127;167;5325;415;167;1.95;41.93;United States;Northern America;Springer New York;2000-2021;"Polymers and Plastics (Q1); Environmental Engineering (Q2); Materials Chemistry (Q2)"
547;25241;Toxicology Mechanisms and Methods;journal;15376524, 15376516;0.562;Q3;46;78;247;3838;500;246;2.01;49.21;United Kingdom;Western Europe;Informa Healthcare;1991-2021;"Health, Toxicology and Mutagenesis (Q3); Toxicology (Q3)"
548;25106;Human and Experimental Toxicology;journal;09603271;0.559;Q3;82;132;400;5401;727;390;1.82;40.92;United States;Northern America;SAGE Publications Inc.;1981-2021;"Medicine (miscellaneous) (Q2); Health, Toxicology and Mutagenesis (Q3); Toxicology (Q3)"
549;29199;Industrial Health;journal;18808026, 00198366;0.556;Q3;64;64;203;2379;307;182;1.07;37.17;Japan;Asiatic Region;National Institute of Industrial Health;1963-2021;"Public Health, Environmental and Occupational Health (Q2); Health, Toxicology and Mutagenesis (Q3)"
550;19700182802;International Journal of Biodiversity Science, Ecosystems Services and Management;journal;21513740, 21513732;0.556;Q2;0;0;0;0;0;0;0;0;United Kingdom;Western Europe;Taylor and Francis Ltd.;2010-2018;"Ecology (Q2); Ecology, Evolution, Behavior and Systematics (Q2); Management, Monitoring, Policy and Law (Q2); Nature and Landscape Conservation (Q2)"
551;22869;Journal of Forest Economics;journal;11046899, 16181530;0.555;Q2;39;40;77;1881;139;75;1.65;47.03;United States;Northern America;Now Publishers Inc;1995-2021;"Ecology (Q2); Forestry (Q2); Geography, Planning and Development (Q2)"
552;19600157344;Geoheritage;journal;18672477, 18672485;0.554;Q2;35;43;87;2398;206;84;2.61;55.77;Germany;Western Europe;Springer Verlag;2009-2021;"Earth and Planetary Sciences (miscellaneous) (Q2); Geography, Planning and Development (Q2); Nature and Landscape Conservation (Q2)"
553;23259;Mountain Research and Development;journal;02764741;0.553;Q2;62;54;142;2498;212;131;1.35;46.26;Switzerland;Western Europe;International Mountain Society;1981-2021;"Development (Q2); Environmental Science (miscellaneous) (Q2); Environmental Chemistry (Q3)"
554;19400158519;Environmental Earth Sciences;journal;18666299, 18666280;0.552;Q2;130;810;3662;38078;6297;3641;1.63;47.01;Germany;Western Europe;Springer Verlag;2009-2021;"Earth-Surface Processes (Q2); Geology (Q2); Pollution (Q2); Soil Science (Q2); Water Science and Technology (Q2); Environmental Chemistry (Q3); Global and Planetary Change (Q3)"
555;17465;Community Ecology;journal;15858553, 15882756;0.549;Q2;32;34;80;1977;101;80;0.96;58.15;Hungary;Eastern Europe;Akademiai Kiado;2000-2021;"Ecology (Q2); Ecology, Evolution, Behavior and Systematics (Q2)"
