Rank;Sourceid;Title;Type;Issn;SJR;SJR Best Quartile;H index;Total Docs. (2003);Total Docs. (3years);Total Refs.;Total Cites (3years);Citable Docs. (3years);Cites / Doc. (2years);Ref. / Doc.;Country;Publisher;Coverage;Categories
212;13371;HEC Forum;journal;09562737, 15728498;0.196;Q3;18;23;106;597;16;95;0.22;25,96;Netherlands;Kluwer Academic Publishers;1989-ongoing;"Medicine (miscellaneous) (Q2); Health Policy (Q3); Health (social science) (Q3); Issues, Ethics and Legal Aspects (Q3)"
213;28222;Journal of Neuroscience Nursing;journal;08880395;0.196;Q1;39;49;122;486;69;110;0.48;9,92;United States;Lippincott Williams & Wilkins Ltd.;1986-ongoing;"Medical and Surgical Nursing (Q1); Neurology (clinical) (Q3); Surgery (Q3); Endocrine and Autonomic Systems (Q4)"
214;13310;Nutrition and Health;journal;02601060;0.196;Q3;22;26;97;488;30;88;0.34;18,77;United Kingdom;SAGE Publications Inc.;1982-2004, 2006-2009, 2011-2013, 2017-ongoing;"Medicine (miscellaneous) (Q2); Nutrition and Dietetics (Q3)"
215;27684;European Journal of Oncology Nursing;journal;14623889;0.19399999999999998;Q3;49;38;98;886;33;81;0.26;23,32;United States;Churchill Livingstone;1991, 1998-ongoing;"Medicine (miscellaneous) (Q2); Oncology (nursing) (Q3)"
216;29343;Perspectives in Psychiatric Care;journal;00315990;0.19399999999999998;Q3;30;28;83;537;29;60;0.62;19,18;United States;Wiley-Blackwell;1963-1985, 1987, 1989-ongoing;"Medicine (miscellaneous) (Q2); Psychiatric Mental Health (Q3)"
217;28717;Bulletin of the History of Medicine;journal;10863176, 00075140;0.193;Q2;27;27;64;1559;25;63;0.40;57,74;United States;The Johns Hopkins University Press;1945-ongoing;"History (Q1); Medicine (miscellaneous) (Q2); Nursing (miscellaneous) (Q2)"
218;19700166614;International Journal of Orthopaedic and Trauma Nursing;journal;18781241, 18781292;0.193;Q2;16;40;108;544;14;98;0.13;13,60;Netherlands;Elsevier BV;2010-ongoing;"Advanced and Specialized Nursing (Q2); Orthopedics and Sports Medicine (Q3)"
219;28185;Journal for specialists in pediatric nursing : JSPN;journal;15390136;0.193;Q2;33;24;86;132;31;73;0.40;5,50;United States;Wiley-Blackwell;2002-ongoing;Pediatrics (Q2)
220;12066;Journal of the American Medical Directors Association;journal;15258610;0.192;Q2;75;124;195;2762;67;155;0.43;22,27;United States;Elsevier Inc.;2001-ongoing;"Medicine (miscellaneous) (Q2); Nursing (miscellaneous) (Q2); Health Policy (Q3)"
221;14141;Journal of Health and Human Services Administration;journal;10793739;0.19;Q2;19;26;72;667;26;71;0.21;25,65;United States;Southern Public Administration Education Foundation, Inc.;1994-ongoing;"Leadership and Management (Q2); Medicine (miscellaneous) (Q2); Health Policy (Q3); Public Health, Environmental and Occupational Health (Q3)"
222;21100790700;British Journal of Anaesthetic and Recovery Nursing;journal;17442192, 17426456;0.188;Q2;4;19;64;140;5;63;0.14;7,37;United Kingdom;Cambridge University Press;2000-2013;"Anesthesiology and Pain Medicine (Q2); Medical and Surgical Nursing (Q2)"
223;17831;Medical History;journal;00257273;0.188;Q2;24;20;114;1867;24;113;0.17;93,35;United Kingdom;Cambridge University Press;1957-ongoing;"History (Q1); Medicine (miscellaneous) (Q2); Nursing (miscellaneous) (Q2)"
224;27140;Australian Journal of Advanced Nursing;journal;14474328, 08130531;0.187;Q2;33;16;81;359;20;68;0.22;22,44;Australia;Australian Nursing Federation;1983-ongoing;"Advanced and Specialized Nursing (Q2); Nursing (miscellaneous) (Q2)"
225;90223;Nutrition Bulletin;journal;14673010, 14719827;0.18600000000000003;Q3;35;64;198;861;60;172;0.36;13,45;United Kingdom;John Wiley & Sons Ltd.;1968-1995, 2001-ongoing;"Medicine (miscellaneous) (Q2); Nutrition and Dietetics (Q3)"
226;29380;Rehabilitation Nursing;journal;02784807;0.18600000000000003;Q2;33;32;79;128;30;74;0.41;4,00;United States;Lippincott Williams & Wilkins Ltd.;1981-ongoing;"Medicine (miscellaneous) (Q2); Nursing (miscellaneous) (Q2); Physical Therapy, Sports Therapy and Rehabilitation (Q3); Rehabilitation (Q3)"
227;28206;Journal of Emergency Nursing;journal;15272966, 00991767;0.185;Q2;43;141;458;829;78;381;0.20;5,88;United States;Mosby Inc.;1975-ongoing;Emergency Nursing (Q2)
228;24575;Early Child Development and Care;journal;14768275, 03004430;0.184;Q3;36;60;168;1728;32;167;0.22;28,80;United States;Taylor and Francis Ltd.;1971-1974, 1976, 1978-ongoing;"Pediatrics (Q3); Developmental and Educational Psychology (Q4); Social Psychology (Q4)"
229;24223;Advances in Skin and Wound Care;journal;15388654, 15277941;0.183;Q2;54;43;139;434;91;123;0.57;10,09;United States;Lippincott Williams & Wilkins Ltd.;2000-ongoing;"Advanced and Specialized Nursing (Q2); Dermatology (Q3)"
230;27632;Critical Care Nursing Clinics of North America;journal;08995885;0.183;Q1;27;61;151;1763;77;151;0.49;28,90;United Kingdom;W. B. Saunders Co., Ltd.;1989-ongoing;Critical Care Nursing (Q1)
231;29193;Journal of Aging and Social Policy;journal;15450821, 08959420;0.183;Q3;27;24;111;763;33;109;0.30;31,79;United States;Haworth Press Inc.;1989-ongoing;"Demography (Q3); Gerontology (Q3); Life-span and Life-course Studies (Q4)"
232;28140;International Journal of Palliative Nursing;journal;13576321;0.18100000000000002;Q2;35;72;230;365;73;195;0.33;5,07;United Kingdom;Mark Allen Publishing Ltd.;2000-ongoing;Advanced and Specialized Nursing (Q2)
233;28805;Nurse Education in Practice;journal;14715953;0.18100000000000002;Q2;39;35;82;753;15;69;0.22;21,51;United Kingdom;Churchill Livingstone;2001-ongoing;"Medicine (miscellaneous) (Q2); Nursing (miscellaneous) (Q2); Education (Q3)"
234;29037;Geriatric Nursing;journal;15283984, 01974572;0.18;Q3;35;97;231;904;77;203;0.40;9,32;United States;Mosby Inc.;1980-ongoing;"Medicine (miscellaneous) (Q2); Gerontology (Q3)"
235;28812;Nurse Educator;journal;03633624;0.18;Q1;34;59;274;94;76;270;0.22;1,59;United States;Lippincott Williams & Wilkins Ltd.;1976-ongoing;"Fundamentals and Skills (Q1); Review and Exam Preparation (Q2); Education (Q3); LPN and LVN (Q3)"
236;17784;Research in the Sociology of Health Care;book series;02754959;0.179;Q2;9;13;53;429;15;50;0.25;33,00;United Kingdom;Emerald Group Publishing Ltd.;1991, 1996, 2000-2010, 2014-ongoing;"Nursing (miscellaneous) (Q2); Public Health, Environmental and Occupational Health (Q3); Sociology and Political Science (Q3)"
237;15565;Journal of Loss and Trauma;journal;15325024, 15325032;0.17800000000000002;Q4;32;21;77;563;19;77;0.29;26,81;United States;Brunner - Routledge (US);1996-ongoing;"Psychiatry and Mental Health (Q3); Social Sciences (miscellaneous) (Q3); Psychiatric Mental Health (Q4); Social Psychology (Q4)"
238;27139;Australian Critical Care;journal;10367314;0.17600000000000002;Q1;31;31;97;536;37;73;0.55;17,29;Ireland;Elsevier Ireland Ltd;1992-ongoing;"Critical Care Nursing (Q1); Emergency Nursing (Q2)"
239;3700148010;Policy, Politics, and Nursing Practice;journal;15271544, 15527468;0.175;Q2;26;48;141;708;34;127;0.31;14,75;United States;SAGE Publications;2000-ongoing;"Leadership and Management (Q2); Medicine (miscellaneous) (Q3); Issues, Ethics and Legal Aspects (Q4)"
240;28557;Australasian Journal on Ageing;journal;14406381;0.174;Q2;28;48;133;869;38;109;0.35;18,10;United States;Wiley-Blackwell;1982-1995, 1998-ongoing;"Community and Home Care (Q2); Geriatrics and Gerontology (Q3); Medicine (miscellaneous) (Q3)"
241;65519;Primary Care Update for Ob/Gyns;journal;1068607X;0.17300000000000001;Q3;16;54;146;1065;48;146;0.24;19,72;Netherlands;Elsevier BV;1994-2003;"Nursing (miscellaneous) (Q3); Obstetrics and Gynecology (Q3)"
242;28204;Journal of Continuing Education in Nursing;journal;00220124;0.16899999999999998;Q3;33;32;116;98;41;106;0.42;3,06;United States;Slack Incorporated;1970-ongoing;Review and Exam Preparation (Q3)
243;21743;Journal of Wound, Ostomy and Continence Nursing;journal;15283976, 10715754;0.16899999999999998;Q2;45;65;178;1218;53;152;0.34;18,74;United States;Lippincott Williams & Wilkins Ltd.;1994-ongoing;"Medical and Surgical Nursing (Q2); Advanced and Specialized Nursing (Q3)"
244;27746;Intensive and Critical Care Nursing;journal;09643397;0.168;Q2;51;45;158;1154;54;129;0.42;25,64;United States;Churchill Livingstone;1992-ongoing;Critical Care Nursing (Q2)
245;28241;Journal of Perianesthesia Nursing;journal;15328473, 10899472;0.16699999999999998;Q2;29;77;186;681;45;179;0.27;8,84;United Kingdom;W. B. Saunders Co., Ltd.;1996-ongoing;Medical and Surgical Nursing (Q2)
246;12949;Ostomy Wound Management;journal;08895899;0.16699999999999998;Q3;47;87;232;787;91;205;0.39;9,05;United States;H M P Communications;1988-ongoing;"Gastroenterology (Q3); Internal Medicine (Q3); Medicine (miscellaneous) (Q3); Nursing (miscellaneous) (Q3)"
247;27643;Critical Care Nursing Quarterly;journal;15505111, 08879303;0.166;Q2;30;47;113;651;43;96;0.47;13,85;United States;Lippincott Williams & Wilkins Ltd.;1987-ongoing;Critical Care Nursing (Q2)
248;19700170191;Quality in Ageing and Older Adults;journal;14717794;0.166;Q2;16;23;56;433;10;49;0.24;18,83;United Kingdom;Emerald Group Publishing Ltd.;2000-ongoing;"Care Planning (Q2); Community and Home Care (Q3); Gerontology (Q3)"
249;28242;Journal of Perinatal and Neonatal Nursing;journal;08932190, 15505073;0.165;Q2;37;25;76;561;34;76;0.39;22,44;United States;Lippincott Williams & Wilkins Ltd.;1987-ongoing;"Critical Care Nursing (Q2); Maternity and Midwifery (Q3); Medicine (miscellaneous) (Q3); Pediatrics (Q3)"
250;13270;Nestle Nutrition workshop series. Clinical & performance programme;journal;14227584;0.165;Q3;13;16;84;763;32;84;0.34;47,69;Switzerland;S. Karger AG;1999-2006;"Medicine (miscellaneous) (Q3); Nutrition and Dietetics (Q3); Food Science (Q4)"
251;15097;Journal of Child Health Care;journal;13674935;0.16399999999999998;Q3;30;26;89;630;20;82;0.28;24,23;United States;SAGE Publications;1997-ongoing;"Pediatrics (Q3); Pediatrics, Perinatology and Child Health (Q3)"
252;20150;Tijdschrift voor Verpleeghuisgeneeskunde;journal;13861514;0.162;Q3;4;27;84;395;7;78;0.11;14,63;United States;Reed Business;1996-2009;"Geriatrics and Gerontology (Q3); Gerontology (Q3); Rehabilitation (Q3)"
253;144654;Nutrition and Food Science;journal;00346659;0.161;Q3;26;110;480;754;19;464;0.02;6,85;United Kingdom;Emerald Group Publishing Ltd.;2005-ongoing;"Nutrition and Dietetics (Q3); Food Science (Q4)"
254;13323;Nutrition in Clinical Practice;journal;08845336;0.16;Q3;61;91;190;3038;56;153;0.39;33,38;United States;SAGE Publications;1986-ongoing;"Medicine (miscellaneous) (Q3); Nutrition and Dietetics (Q3)"
255;28002;Revista de Nutricao;journal;14155273;0.16;Q3;33;47;92;1317;18;90;0.12;28,02;Brazil;Pontificia Universidade Catolica de Campinas;2000-ongoing;"Medicine (miscellaneous) (Q3); Nutrition and Dietetics (Q3)"
256;29341;Pediatric nursing;journal;00979805;0.159;Q4;41;72;275;458;75;252;0.28;6,36;United Kingdom;Royal College of Nursing Publishing Co.;1975-ongoing;"Medicine (miscellaneous) (Q3); Pediatrics (Q4)"
257;29333;Orthopaedic Nursing;journal;07446020;0.158;Q3;34;84;205;740;53;187;0.17;8,81;United States;Lippincott Williams & Wilkins Ltd.;1981-ongoing;"Advanced and Specialized Nursing (Q3); Medicine (miscellaneous) (Q3); Orthopedics and Sports Medicine (Q3)"
258;28252;Journal of School Nursing;journal;10598405, 15468364;0.156;Q3;27;42;161;439;29;141;0.22;10,45;United States;SAGE Publications;1991-ongoing;Nursing (miscellaneous) (Q3)
259;27115;American Journal of Nursing;journal;0002936X;0.155;Q3;47;266;824;1150;144;690;0.21;4,32;United States;Lippincott Williams & Wilkins Ltd.;1945-ongoing;"Medicine (miscellaneous) (Q3); Nursing (miscellaneous) (Q3)"
260;81093;Journal of Clinical Governance;journal;14675277;0.155;Q2;6;0;120;0;25;95;0.22;0,00;United Kingdom;Radcliffe Medical Press Ltd.;1999-2002;Leadership and Management (Q2)
261;28211;Journal of Infusion Nursing;journal;15331458;0.154;Q3;32;54;143;846;46;122;0.42;15,67;United States;Lippincott Williams & Wilkins Ltd.;2001-ongoing;"Medicine (miscellaneous) (Q3); Nursing (miscellaneous) (Q3)"
262;27124;Journal of the American Psychiatric Nurses Association;journal;15325725, 10783903;0.153;Q4;25;50;140;747;27;135;0.24;14,94;United States;SAGE Publications;1995-ongoing;Psychiatric Mental Health (Q4)
263;12190;Reviews in Clinical Gerontology;journal;09592598, 14699036;0.153;Q4;25;33;102;2126;28;91;0.14;64,42;United Kingdom;Cambridge University Press;1991-2015;"Geriatrics and Gerontology (Q3); Gerontology (Q4)"
264;28650;Zeitschrift für Geburtshilfe und Neonatologie;journal;14391651, 09482393;0.153;Q3;17;44;132;1015;50;120;0.46;23,07;Germany;Georg Thieme Verlag;1995-ongoing;"Maternity and Midwifery (Q3); Medicine (miscellaneous) (Q3); Obstetrics and Gynecology (Q3); Pediatrics, Perinatology and Child Health (Q3)"
265;14000155897;International Journal of Speech-Language Pathology;journal;17549507, 17549515;0.152;Q2;35;18;62;504;16;48;0.38;28,00;United Kingdom;Informa Healthcare;2009-ongoing, 2017-ongoing;"Language and Linguistics (Q2); Research and Theory (Q2); LPN and LVN (Q3); Otorhinolaryngology (Q3); Speech and Hearing (Q4)"
266;13384;Health Care Manager;journal;15255794, 1550512X;0.151;Q2;22;45;100;714;22;99;0.30;15,87;United States;Lippincott Williams & Wilkins Ltd.;1999-ongoing;"Care Planning (Q2); Health Policy (Q3); Health (social science) (Q3); Leadership and Management (Q3); Medicine (miscellaneous) (Q3)"
267;27339;Journal of Religion and Health;journal;15736571, 00224197;0.151;Q3;34;27;74;546;14;70;0.18;20,22;United States;Kluwer Academic/Plenum Publishers;1961-ongoing;"Religious Studies (Q1); Medicine (miscellaneous) (Q3); Nursing (miscellaneous) (Q3)"
268;21100823214;Canadian Geriatrics Journal;journal;19258348;0.149;Q4;16;27;116;467;17;93;0.25;17,30;Canada;Canadian Geriatrics Society;2011-ongoing;"Geriatrics and Gerontology (Q3); Gerontology (Q4)"
269;28814;Nurse Practitioner;journal;03611817;0.149;Q3;20;113;300;1215;59;243;0.20;10,75;United States;Lippincott Williams & Wilkins Ltd.;1975-ongoing;"Medicine (miscellaneous) (Q3); Nursing (miscellaneous) (Q3)"
270;27052;AORN Journal;journal;00012092;0.147;Q2;39;112;396;739;108;348;0.31;6,60;United States;Elsevier USA;1965-ongoing;Medical and Surgical Nursing (Q2)
271;5300152517;International Journal on Disability and Human Development;journal;21910367, 21911231;0.147;Q3;22;17;120;485;17;111;0.12;28,53;Germany;Walter de Gruyter GmbH;2006-ongoing;"Advanced and Specialized Nursing (Q3); Rehabilitation (Q3); Geriatrics and Gerontology (Q4); Psychiatry and Mental Health (Q4); Sensory Systems (Q4); Speech and Hearing (Q4)"
272;14786;Nutricion Hospitalaria;journal;16995198, 02121611;0.147;Q3;43;50;156;1205;61;142;0.46;24,10;Spain;Grupo Aula Medica S.A.;1989-ongoing;"Medicine (miscellaneous) (Q3); Nutrition and Dietetics (Q3)"
273;68659;Nurse Practitioner Forum: Current Topics and Communications;journal;10455485;0.146;Q3;10;0;49;0;9;48;0.06;0,00;United Kingdom;W. B. Saunders Co., Ltd.;1991-2001;Nursing (miscellaneous) (Q3)
274;12400154748;Population Health Management;journal;19427905, 19427891;0.145;Q3;35;37;69;613;23;66;0.43;16,57;United States;Mary Ann Liebert Inc.;2008-ongoing;"Health Policy (Q3); Leadership and Management (Q3); Public Health, Environmental and Occupational Health (Q4)"
275;27095;Journal of the American Academy of Nurse Practitioners;journal;10412972;0.14400000000000002;Q3;40;72;232;1180;76;228;0.29;16,39;United States;American Academy of Nurse Practitioners;1989-2013;Nursing (miscellaneous) (Q3)
276;27626;Contemporary Nurse;journal;10376178;0.14300000000000002;Q3;34;74;177;1211;30;162;0.14;16,36;United Kingdom;Taylor & Francis;1992-ongoing;Nursing (miscellaneous) (Q3)
277;54716;Journal of Clinical Excellence;journal;14659883;0.14300000000000002;Q3;7;54;178;334;18;153;0.10;6,19;United Kingdom;Radcliffe Medical Press Ltd.;2000-2003;Leadership and Management (Q3)
278;28839;Nursing in critical care;journal;14785153, 13621017;0.14300000000000002;Q2;36;36;59;379;17;51;0.17;10,53;United Kingdom;Blackwell Publishing Inc.;1996-2000, 2002-ongoing;Critical Care Nursing (Q2)
279;27220;Clinical Excellence for Nurse Practitioners;journal;10852360;0.14;Q3;14;0;110;0;27;100;0.33;0,00;United States;Churchill Livingstone;1998-2001, 2004;Nursing (miscellaneous) (Q3)
280;27629;Critical Care Nurse;journal;02795442;0.14;Q3;37;47;225;871;42;178;0.21;18,53;United States;American Association of Critical Care Nurses;1980-ongoing;"Critical Care Nursing (Q3); Medicine (miscellaneous) (Q3)"
281;12299;Journal of Wound Care;journal;09690700;0.14;Q2;57;76;254;670;74;234;0.23;8,82;United Kingdom;Mark Allen Publishing Ltd.;1995-ongoing;"Fundamentals and Skills (Q2); Nursing (miscellaneous) (Q3)"
282;28537;Annals of Long-Term Care;journal;15247929, 19435010;0.139;Q4;16;63;234;922;39;208;0.16;14,63;United States;MultiMedia Healthcare Inc.;1998-ongoing;"Geriatrics and Gerontology (Q4); Gerontology (Q4)"
283;22886;Developing World Bioethics;journal;14718731, 14718847;0.139;Q4;23;17;40;155;12;34;0.35;9,12;United Kingdom;Blackwell Publishing Inc.;2001-ongoing;"Health Policy (Q4); Health (social science) (Q4); Issues, Ethics and Legal Aspects (Q4)"
284;28767;Nephrology Nursing Journal;journal;1526744X;0.139;Q3;31;66;175;365;37;167;0.20;5,53;United States;Jannetti Publications Inc.;2000-ongoing;"Advanced and Specialized Nursing (Q3); Medicine (miscellaneous) (Q3); Nephrology (Q4)"
285;27170;British Journal of Nursing;journal;09660461;0.138;Q3;41;291;938;1983;144;756;0.18;6,81;United Kingdom;Mark Allen Publishing Ltd.;1992-ongoing;Nursing (miscellaneous) (Q3)
286;4700152299;Journal of Addictions Nursing;journal;10884602;0.138;Q4;14;34;55;843;7;40;0.17;24,79;United States;Lippincott Williams & Wilkins Ltd.;1996-2001, 2003-ongoing;"Psychiatric Mental Health (Q4); Psychiatry and Mental Health (Q4)"
287;14200154729;Journal of Dietary Supplements;journal;19390211;0.138;Q3;20;14;40;302;10;34;0.22;21,57;United States;Informa Healthcare;2008-ongoing;"Nutrition and Dietetics (Q3); Pharmacology (medical) (Q3); Food Science (Q4)"
288;28765;Neonatal Network;journal;15392880, 07300832;0.138;Q3;33;41;187;690;63;172;0.35;16,83;United States;Springer Publishing Company;1985-ongoing;"Critical Care and Intensive Care Medicine (Q3); Critical Care Nursing (Q3); Medicine (miscellaneous) (Q3); Pediatrics, Perinatology and Child Health (Q3)"
289;28236;The journal of nursing research : JNR;journal;16823141;0.138;Q3;28;33;51;610;11;51;0.22;18,48;Taiwan;Taiwan Nurses Association;2001-ongoing;"Medicine (miscellaneous) (Q3); Nursing (miscellaneous) (Q3)"
290;27605;Collegian;journal;13227696;0.13699999999999998;Q3;25;29;112;93;12;97;0.13;3,21;Netherlands;Elsevier BV;1995-2003, 2005-ongoing;Nursing (miscellaneous) (Q3)
291;28257;Journal of Vascular Nursing;journal;10620303;0.13699999999999998;Q3;20;39;80;406;16;73;0.09;10,41;United States;Mosby Inc.;1990-ongoing;Medical and Surgical Nursing (Q3)
292;15268;Issues in Law and Medicine;journal;87568160;0.136;Q4;14;18;44;0;10;43;0.27;0,00;United States;National Legal Center for the Medically Dependent and Disabled Inc;1985-ongoing;"Medicine (miscellaneous) (Q3); Health Policy (Q4); Issues, Ethics and Legal Aspects (Q4)"
293;27598;Clinical Nurse Specialist;journal;08876274;0.134;Q1;29;57;187;319;32;143;0.17;5,60;United States;Lippincott Williams & Wilkins Ltd.;1987-ongoing;"Assessment and Diagnosis (Q1); Advanced and Specialized Nursing (Q3); Leadership and Management (Q3); LPN and LVN (Q4)"
294;28162;JONA's Healthcare Law, Ethics, and Regulation;journal;15209229, 1539073X;0.134;Q4;16;22;74;201;17;65;0.30;9,14;United States;Lippincott Williams & Wilkins Ltd.;1999-2013;"Law (Q3); Medicine (miscellaneous) (Q3); Health Policy (Q4); Issues, Ethics and Legal Aspects (Q4)"
295;15698;Pediatria Wspolczesna;journal;15075532;0.134;Q3;10;43;164;727;18;164;0.10;16,91;Poland;Leximed sc;1999-2013;"Gastroenterology (Q3); Nutrition and Dietetics (Q3); Pediatrics, Perinatology and Child Health (Q3)"
296;13062;Progress in Palliative Care;journal;09699260;0.134;Q3;13;26;72;345;11;44;0.25;13,27;United Kingdom;Maney Publishing;2001-ongoing;"Medicine (miscellaneous) (Q3); Nursing (miscellaneous) (Q3)"
297;29968;Aktuelle Ernahrungsmedizin Klinik und Praxis;journal;14389916, 03410501;0.133;Q3;15;68;149;2937;65;133;0.49;43,19;Germany;Georg Thieme Verlag;1960-1963, 1978-ongoing;"Medicine (miscellaneous) (Q3); Nutrition and Dietetics (Q3)"
298;27158;British Journal of Community Nursing;journal;14624753;0.133;Q3;25;104;328;1096;58;276;0.19;10,54;United Kingdom;Mark Allen Publishing Ltd.;2000-ongoing;"Community and Home Care (Q3); Medicine (miscellaneous) (Q3)"
299;13918;Insight - Journal of the American Society of Ophthalmic Registered Nurses;journal;1060135X;0.133;Q3;11;30;85;208;13;78;0.16;6,93;United States;American Society of Ophthalmic Registered Nurses;1988-ongoing;"Advanced and Specialized Nursing (Q3); Medical and Surgical Nursing (Q3); Medicine (miscellaneous) (Q3); Ophthalmology (Q3)"
300;14722;Intensivmedizin und Notfallmedizin;journal;01753851;0.133;Q3;13;83;243;3089;47;237;0.23;37,22;Germany;Dr. Dietrich Steinkopff Verlag;1986-2011;"Critical Care and Intensive Care Medicine (Q3); Emergency Medicine (Q3); Emergency Nursing (Q3)"
301;11000153718;Journal of Renal Care;journal;17556678, 17556686;0.133;Q3;22;53;180;459;20;154;0.13;8,66;United States;Wiley-Blackwell;2006-ongoing;"Advanced and Specialized Nursing (Q3); Nephrology (Q4)"
302;19905;Medicina Paliativa;journal;1134248X;0.133;Q3;10;35;125;657;25;100;0.23;18,77;Spain;Aran Ediciones SA;2000-ongoing;"Anesthesiology and Pain Medicine (Q3); Medicine (miscellaneous) (Q3); Nursing (miscellaneous) (Q3)"
303;21100200604;Workplace health & safety;journal;21650799;0.133;Q3;33;84;235;581;35;224;0.16;6,92;United States;SAGE Publications Inc.;2012-ongoing;"Nursing (miscellaneous) (Q3); Public Health, Environmental and Occupational Health (Q4)"
304;28019;Rivista Italiana di Nutrizione Parenterale ed Enterale;journal;03935582;0.132;Q4;7;24;138;551;15;129;0.12;22,96;Italy;Wichtig Publishing;1986-1995, 1997-2006;"Critical Care and Intensive Care Medicine (Q3); Anatomy (Q4); Food Science (Q4); Nutrition and Dietetics (Q4)"
305;16227;Journal of Law and Medicine;journal;1320159X;0.13;Q4;16;40;84;870;8;75;0.11;21,75;Australia;Lawbook Co.;1994, 2001-ongoing;"Law (Q3); Medicine (miscellaneous) (Q3); Health Policy (Q4); Issues, Ethics and Legal Aspects (Q4)"
306;33557;International Journal of Trauma Nursing;journal;10754210;0.129;Q3;9;0;97;0;6;87;0.07;0,00;United States;Mosby Inc.;1995-2002;Nursing (miscellaneous) (Q3)
307;27995;Progress in Nutrition;journal;11298723;0.129;Q4;7;24;46;892;8;44;0.18;37,17;Italy;Mattioli 1885 SpA;2002-ongoing;"Food Science (Q4); Nutrition and Dietetics (Q4)"
308;12718;Journal of Nutritional and Environmental Medicine;journal;13646907, 13590847;0.128;Q4;19;27;102;807;29;82;0.38;29,89;United Kingdom;Taylor & Francis;1995-2005, 2007-2008;"Medicine (miscellaneous) (Q3); Food Science (Q4); Nutrition and Dietetics (Q4); Public Health, Environmental and Occupational Health (Q4)"
309;19335;Sciences Sociales et Sante;journal;02940337;0.128;Q4;15;25;55;561;13;53;0.29;22,44;France;John Libbey Eurotext;1985, 1996-ongoing;"Health Policy (Q4); Health (social science) (Q4); Issues, Ethics and Legal Aspects (Q4); Public Health, Environmental and Occupational Health (Q4)"
310;12702;Journal für Ernahrungsmedizin;journal;15632873;0.126;Q4;4;21;27;402;4;23;0.17;19,14;Austria;Krause & Pachernegg GmbH;2002-ongoing;"Medicine (miscellaneous) (Q3); Nutrition and Dietetics (Q4)"
311;21762;Medsurg nursing : official journal of the Academy of Medical-Surgical Nurses;journal;10920811;0.126;Q3;26;41;88;936;20;81;0.23;22,83;United States;Jannetti Publications Inc.;1992-2000, 2002-ongoing;"Medical and Surgical Nursing (Q3); Medicine (miscellaneous) (Q3); Surgery (Q4)"
312;13361;Nutrition Today;journal;0029666X, 15389839;0.126;Q4;20;33;75;2;12;65;0.19;0,06;United States;Lippincott Williams & Wilkins Ltd.;1997, 2006-ongoing;Nutrition and Dietetics (Q4)
313;29356;Plastic surgical nursing : official journal of the American Society of Plastic and Reconstructive Surgical Nurses;journal;07415206, 15501841;0.126;Q3;17;50;105;572;14;90;0.11;11,44;United States;Lippincott Williams & Wilkins Ltd.;1983-ongoing;"Advanced and Specialized Nursing (Q3); Medical and Surgical Nursing (Q3); Medicine (miscellaneous) (Q3); Surgery (Q4)"
314;27596;Clinical Journal of Oncology Nursing;journal;10921095;0.125;Q3;40;131;231;1589;54;212;0.25;12,13;United States;Oncology Nursing Society;1997-ongoing;"Oncology (nursing) (Q3); Oncology (Q4)"
315;26729;AANA Journal;journal;00946354;0.124;Q4;28;51;166;874;58;147;0.37;17,14;United States;AANA Publishing Inc.;1978, 1986, 1995-2000, 2002-ongoing;"Anesthesiology and Pain Medicine (Q3); Medicine (miscellaneous) (Q3); Advanced and Specialized Nursing (Q4); Medical and Surgical Nursing (Q4)"
316;27647;Dimensions of Critical Care Nursing;journal;07304625;0.124;Q3;26;43;173;0;22;166;0.10;0,00;United States;Lippincott Williams & Wilkins Ltd.;1982-ongoing;"Critical Care Nursing (Q3); Emergency Nursing (Q3)"
317;23688;International Journal of Healthcare Technology and Management;journal;13682156, 17415144;0.124;Q3;17;30;88;835;6;88;0.07;27,83;United Kingdom;Inderscience Publishers;2003-ongoing;"Leadership and Management (Q3); Health Informatics (Q4)"
318;110089;Minerva Gastroenterologica e Dietologica;journal;1121421X;0.12300000000000001;Q4;24;37;72;1372;11;69;0.20;37,08;Italy;Edizioni Minerva Medica;1965-1977, 1991-ongoing;"Gastroenterology (Q3); Internal Medicine (Q3); Endocrinology, Diabetes and Metabolism (Q4); Nutrition and Dietetics (Q4)"
319;28262;CME Journal Gastroenterology, Hepatology and Nutrition;journal;13679015;0.122;Q4;3;11;69;204;4;59;0.13;18,55;United Kingdom;Rila Publications, Ltd.;2000-2008;"Gastroenterology (Q3); Hepatology (Q4); Nutrition and Dietetics (Q4)"
