Rank;Sourceid;Title;Type;Issn;SJR;SJR Best Quartile;H index;Total Docs. (2006);Total Docs. (3years);Total Refs.;Total Cites (3years);Citable Docs. (3years);Cites / Doc. (2years);Ref. / Doc.;Country;Publisher;Coverage;Categories
212;14320;Brain and Development;journal;03877604;0.7909999999999999;Q2;75;132;364;2540;632;344;1.72;19,24;Netherlands;Elsevier BV;1979-ongoing;"Medicine (miscellaneous) (Q1); Pediatrics, Perinatology and Child Health (Q1); Developmental Neuroscience (Q2); Neurology (clinical) (Q2)"
213;13845;Bulletin of Mathematical Biology;journal;00928240, 15229602;0.79;Q2;78;92;200;3406;388;195;1.94;37,02;United States;Springer New York LLC;1973-ongoing;"Agricultural and Biological Sciences (miscellaneous) (Q1); Environmental Science (miscellaneous) (Q1); Biochemistry, Genetics and Molecular Biology (miscellaneous) (Q2); Computational Theory and Mathematics (Q2); Mathematics (miscellaneous) (Q2); Neuroscience (miscellaneous) (Q2); Pharmacology (Q2); Immunology (Q3)"
214;130017;Current Neurovascular Research;journal;15672026;0.79;Q2;50;34;86;2020;210;79;2.66;59,41;United Arab Emirates;Bentham Science Publishers;2004-ongoing;"Neurology (Q2); Developmental Neuroscience (Q3); Cellular and Molecular Neuroscience (Q4)"
215;16202;International Review of Neurobiology;book series;00747742;0.787;Q4;71;85;173;5480;295;164;1.48;64,47;United States;Elsevier Inc.;1959-1968, 1970-1972, 1974-1977, 1979, 1981-1986, 1988-1990, 1992-ongoing;"Neurology (clinical) (Q2); Cellular and Molecular Neuroscience (Q4)"
216;17940;Neurological Research;journal;01616412;0.787;Q3;71;132;436;5925;872;427;1.87;44,89;United Kingdom;Maney Publishing;1979-ongoing;"Medicine (miscellaneous) (Q1); Neurology (clinical) (Q2); Neurology (Q3)"
217;15428;Journal of Communication Disorders;journal;00219924;0.784;Q3;56;32;91;1158;171;89;1.39;36,19;Netherlands;Elsevier BV;1967-ongoing;"Linguistics and Language (Q1); LPN and LVN (Q1); Speech and Hearing (Q2); Cognitive Neuroscience (Q3); Experimental and Cognitive Psychology (Q3)"
218;94948;World Journal of Biological Psychiatry;journal;15622975;0.784;Q3;60;36;110;1652;205;84;2.25;45,89;United Kingdom;Taylor & Francis;2000-ongoing;"Medicine (miscellaneous) (Q1); Psychiatry and Mental Health (Q2); Biological Psychiatry (Q3)"
219;21100243801;Multisensory research;journal;22134808, 22134794;0.7709999999999999;Q3;47;22;90;1264;116;86;0.91;57,45;Netherlands;Brill;2013-ongoing;"Computer Vision and Pattern Recognition (Q1); Ophthalmology (Q2); Cognitive Neuroscience (Q3); Experimental and Cognitive Psychology (Q3); Sensory Systems (Q3)"
220;24030;Respiratory Physiology and Neurobiology;journal;15699048;0.7609999999999999;Q2;88;153;419;7356;815;409;2.04;48,08;Netherlands;Elsevier BV;2002-ongoing;"Neuroscience (miscellaneous) (Q2); Physiology (Q2); Pulmonary and Respiratory Medicine (Q2)"
221;24804;Neural Networks;journal;08936080;0.757;Q3;128;145;370;5831;914;355;2.69;40,21;United Kingdom;Elsevier Ltd.;1988-ongoing;"Artificial Intelligence (Q1); Cognitive Neuroscience (Q3)"
222;29755;Human Factors;journal;00187208, 15478181;0.75;Q3;100;66;170;2142;307;166;1.78;32,45;United States;SAGE Publications;1958-ongoing;"Human Factors and Ergonomics (Q1); Applied Psychology (Q2); Behavioral Neuroscience (Q3)"
223;19380;Seizure : the journal of the British Epilepsy Association;journal;10591311;0.7340000000000001;Q3;76;95;337;2463;589;318;1.84;25,93;United Kingdom;W. B. Saunders Co., Ltd.;1992-ongoing;"Medicine (miscellaneous) (Q1); Neurology (clinical) (Q2); Neurology (Q3)"
224;17955;Neurology in Practice;journal;14737086;0.731;Q3;37;0;99;0;208;88;2.37;0,00;United Kingdom;BMJ Publishing Group;2001-2005;"Neuropsychology and Physiological Psychology (Q2); Neuroscience (miscellaneous) (Q3)"
225;16746;Journal of Neurogenetics;journal;15635260, 01677063;0.7290000000000001;Q4;32;4;27;188;40;27;1.75;47,00;United Kingdom;Taylor & Francis;1983-1987, 1989-ongoing;"Genetics (Q3); Cellular and Molecular Neuroscience (Q4)"
226;29306;Clinical Autonomic Research;journal;09599851, 16191560;0.7240000000000001;Q3;53;58;225;1406;291;171;1.73;24,24;Germany;Dr. Dietrich Steinkopff Verlag;1991-ongoing;"Medicine (miscellaneous) (Q1); Neurology (clinical) (Q2); Endocrine and Autonomic Systems (Q3)"
227;14539;Developmental Psychobiology;journal;00121630, 10982302;0.7240000000000001;Q3;85;51;191;2292;346;180;1.96;44,94;United States;John Wiley & Sons Inc.;1968-ongoing;"Developmental and Educational Psychology (Q2); Behavioral Neuroscience (Q3); Developmental Biology (Q3); Developmental Neuroscience (Q3)"
228;15741;Pediatric Neurology;journal;08878994;0.722;Q3;84;198;463;3828;890;437;1.88;19,33;Netherlands;Elsevier BV;1985-ongoing;"Pediatrics, Perinatology and Child Health (Q1); Neurology (clinical) (Q2); Developmental Neuroscience (Q3); Neurology (Q3)"
229;12001;Journal of the Experimental Analysis of Behavior;journal;00225002;0.705;Q3;53;50;141;1753;169;134;1.28;35,06;United States;Wiley-Blackwell;1958-ongoing;"Behavioral Neuroscience (Q3); Experimental and Cognitive Psychology (Q3)"
230;14989;Current Neurology and Neuroscience Reports;journal;15284042, 15346293;0.701;Q3;62;72;214;3299;385;198;1.95;45,82;United States;Current Science Inc.;2001-ongoing;"Neurology (clinical) (Q2); Neuroscience (miscellaneous) (Q3)"
231;19900193571;Fluids and Barriers of the CNS;journal;20458118;0.6970000000000001;Q3;41;10;16;408;34;14;2.43;40,80;United Kingdom;BioMed Central;2011-ongoing;"Medicine (miscellaneous) (Q1); Developmental Neuroscience (Q3); Neurology (Q3); Cellular and Molecular Neuroscience (Q4)"
232;22633;Learning Disability Quarterly;journal;07319487;0.685;Q3;44;14;84;794;81;80;1.03;56,71;United States;SAGE Publications Inc.;1978-ongoing;"Education (Q1); Health Professions (miscellaneous) (Q1); Behavioral Neuroscience (Q3)"
233;24578;Mathematical Medicine and Biology;journal;14778599;0.684;Q3;40;19;52;664;89;51;1.36;34,95;United Kingdom;Oxford University Press;1984-1995, 2003-ongoing;"Environmental Science (miscellaneous) (Q1); Medicine (miscellaneous) (Q1); Applied Mathematics (Q2); Biochemistry, Genetics and Molecular Biology (miscellaneous) (Q2); Modeling and Simulation (Q2); Pharmacology (Q2); Immunology and Microbiology (miscellaneous)  (Q3); Neuroscience (miscellaneous) (Q3)"
234;21336;NeuroImmunoModulation;journal;14230216, 10217401;0.684;Q3;58;24;90;909;183;90;2.03;37,88;Switzerland;S. Karger AG;1994-2002, 2004-ongoing;"Endocrine and Autonomic Systems (Q3); Endocrinology (Q3); Immunology (Q3); Neurology (Q3)"
235;14288;Behavioural Processes;journal;03766357;0.682;Q3;69;123;315;4608;466;280;1.46;37,46;Netherlands;Elsevier BV;1976-ongoing;"Animal Science and Zoology (Q1); Medicine (miscellaneous) (Q1); Behavioral Neuroscience (Q3)"
236;14635;Ophthalmologica;journal;00303755, 14230267;0.674;Q3;54;87;256;1630;304;242;1.27;18,74;Switzerland;S. Karger AG;1945-ongoing;"Medicine (miscellaneous) (Q1); Ophthalmology (Q2); Sensory Systems (Q3)"
237;15518;Epileptic Disorders;journal;12949361;0.672;Q3;48;69;170;1872;284;160;1.44;27,13;United States;Wiley-Blackwell;1999-ongoing;"Medicine (miscellaneous) (Q1); Neurology (clinical) (Q2); Neurology (Q3)"
238;13820;Current Eye Research;journal;02713683;0.6709999999999999;Q3;73;114;338;4233;467;327;1.32;37,13;United Kingdom;Taylor & Francis;1981-ongoing;"Ophthalmology (Q2); Sensory Systems (Q3); Cellular and Molecular Neuroscience (Q4)"
239;12886;Cognitive Systems Research;journal;13890417;0.662;Q3;41;25;55;1210;107;51;2.0;48,40;Netherlands;Elsevier BV;1999-ongoing;"Artificial Intelligence (Q2); Cognitive Neuroscience (Q3); Experimental and Cognitive Psychology (Q3)"
240;24785;Alcohol;journal;07418329;0.655;Q3;74;76;216;3130;465;208;2.42;41,18;Netherlands;Elsevier BV;1984-ongoing;"Health (social science) (Q1); Medicine (miscellaneous) (Q1); Toxicology (Q2); Biochemistry (Q3); Neurology (Q3); Behavioral Neuroscience (Q4)"
241;14836;Canadian Journal of Neurological Sciences;journal;03171671;0.654;Q3;62;93;314;2684;412;260;1.37;28,86;United Kingdom;Cambridge University Press;1974-ongoing;"Medicine (miscellaneous) (Q1); Neurology (clinical) (Q2); Neurology (Q3)"
242;19015;Metabolic Brain Disease;journal;15737365, 08857490;0.648;Q4;59;31;109;1085;247;106;2.68;35,00;United States;Kluwer Academic/Plenum Publishers;1986-ongoing;"Neurology (clinical) (Q2); Biochemistry (Q3); Cellular and Molecular Neuroscience (Q4)"
243;23635;Adaptive Behavior;journal;10597123;0.642;Q4;47;24;71;967;142;56;2.24;40,29;United States;SAGE Publications;1992-ongoing;"Experimental and Cognitive Psychology (Q3); Behavioral Neuroscience (Q4)"
244;12768;British Journal of Developmental Psychology;journal;0261510X;0.64;Q3;66;37;145;1648;167;144;1.36;44,54;United States;Wiley-Blackwell;1996-ongoing;"Developmental and Educational Psychology (Q2); Developmental Neuroscience (Q3)"
245;37369;Journal of Neurosurgery: Spine;journal;15475646, 15475654;0.619;Q3;84;193;232;4533;383;218;1.76;23,49;United States;American Association of Neurological Surgeons;2004-ongoing;"Medicine (miscellaneous) (Q2); Neurology (clinical) (Q2); Surgery (Q2); Neurology (Q3)"
246;19884;Spinal Cord;journal;14765624, 13624393;0.613;Q3;97;147;375;3614;617;331;1.87;24,59;United Kingdom;Nature Publishing Group;1996-ongoing;"Medicine (miscellaneous) (Q2); Neurology (clinical) (Q2); Neurology (Q3)"
247;14287;Behavioural Neurology;journal;09534180;0.607;Q3;42;23;47;1276;63;45;0.94;55,48;Netherlands;Hindawi Publishing Corporation;1993-1998, 2000-2001, 2003-ongoing;"Medicine (miscellaneous) (Q2); Neurology (clinical) (Q2); Neurology (Q3); Neuropsychology and Physiological Psychology (Q3)"
248;26013;Endocrine development;journal;14217082;0.607;Q3;34;0;67;0;113;66;1.63;0,00;Switzerland;S. Karger AG;2003-2005, 2007-ongoing;"Endocrinology, Diabetes and Metabolism (Q2); Medicine (miscellaneous) (Q2); Pediatrics, Perinatology and Child Health (Q2); Endocrine and Autonomic Systems (Q3); Endocrinology (Q3)"
249;18122;Nutritional Neuroscience;journal;14768305, 1028415X;0.598;Q3;51;32;132;1277;216;131;1.4;39,91;United Kingdom;Maney Publishing;1998-ongoing;"Medicine (miscellaneous) (Q2); Nutrition and Dietetics (Q2); Neuroscience (miscellaneous) (Q3)"
250;12870;Cognitive Neuropsychiatry;journal;14640619, 13546805;0.594;Q3;55;32;54;2031;91;54;1.57;63,47;United Kingdom;Taylor & Francis;1996-ongoing;"Psychiatry and Mental Health (Q2); Cognitive Neuroscience (Q3)"
251;18712;Psychiatry and Clinical Neurosciences;journal;14401819, 13231316;0.591;Q3;66;138;360;3346;486;314;1.43;24,25;United Kingdom;Blackwell Publishing Inc.;1933, 1947-ongoing;"Medicine (miscellaneous) (Q2); Neurology (clinical) (Q2); Psychiatry and Mental Health (Q2); Neurology (Q3); Neuroscience (miscellaneous) (Q3)"
252;17997;Neurophysiologie Clinique;journal;09877053;0.579;Q3;56;36;82;1519;132;72;1.22;42,19;Netherlands;Elsevier Masson;1988-ongoing;"Medicine (miscellaneous) (Q2); Neurology (clinical) (Q2); Neurology (Q3); Physiology (medical) (Q3)"
253;14340;Brain Injury;journal;1362301X, 02699052;0.573;Q3;92;152;332;6246;517;321;1.38;41,09;United Kingdom;Taylor & Francis;1987-ongoing;"Neurology (clinical) (Q2); Developmental and Educational Psychology (Q3); Neuroscience (miscellaneous) (Q3)"
254;14903;Clinical Neuroscience Research;journal;15662772;0.569;Q3;33;30;133;4109;126;122;0.72;136,97;Netherlands;Elsevier BV;2001-2006;"Neurology (clinical) (Q2); Psychiatry and Mental Health (Q2); Biological Psychiatry (Q3); Neurology (Q3); Neuropsychology and Physiological Psychology (Q3)"
255;5700169289;Journal of Sexual Aggression;journal;17426545, 13552600;0.5670000000000001;Q4;29;24;57;786;44;51;0.53;32,75;United Kingdom;Taylor & Francis;1994, 1996-1997, 1999-ongoing;Behavioral Neuroscience (Q4)
256;6600153204;Brain Structure and Function;journal;18632653, 18632661;0.564;Q3;82;84;238;4049;335;237;1.3;48,20;Germany;Springer Verlag;2007-ongoing;"Anatomy (Q2); Histology (Q2); Neuroscience (miscellaneous) (Q3)"
257;24051;Somatosensory and Motor Research;journal;13691651, 08990220;0.5479999999999999;Q3;44;17;81;606;77;80;0.51;35,65;United Kingdom;Taylor & Francis;1983-2017 (cancelled);"Physiology (Q3); Sensory Systems (Q3)"
258;30014;Journal of Motor Behavior;journal;00222895;0.536;Q4;63;40;137;1690;194;132;1.27;42,25;United States;Heldref Publications;1969-ongoing;"Orthopedics and Sports Medicine (Q2); Biophysics (Q3); Experimental and Cognitive Psychology (Q3); Sports Science (Q3); Cognitive Neuroscience (Q4)"
259;145007;Clinical EEG and Neuroscience;journal;15500594;0.535;Q3;47;38;98;1368;144;94;1.58;36,00;United States;SAGE Publications Inc.;1970-1985, 1988-ongoing;"Medicine (miscellaneous) (Q2); Neurology (clinical) (Q2); Neurology (Q3)"
260;30066;Journal of Psychophysiology;journal;02698803;0.5329999999999999;Q3;42;20;59;788;71;55;1.46;39,40;United States;Hogrefe & Huber Publishers;1987-ongoing;"Neuropsychology and Physiological Psychology (Q3); Neuroscience (miscellaneous) (Q3); Physiology (Q3)"
261;14255;Autonomic Neuroscience: Basic and Clinical;journal;15660702;0.531;Q3;75;113;273;5401;412;272;1.39;47,80;Netherlands;Elsevier BV;2000-ongoing;"Neurology (clinical) (Q2); Endocrine and Autonomic Systems (Q3); Cellular and Molecular Neuroscience (Q4)"
262;15575;European Neurology;journal;14219913, 00143022;0.525;Q3;70;134;359;2602;488;353;1.13;19,42;Switzerland;S. Karger AG;1968-ongoing;"Neurology (clinical) (Q2); Neurology (Q3)"
263;16818;Journal of Sensory Studies;journal;08878250;0.518;Q3;47;28;111;642;82;109;0.73;22,93;United States;Wiley-Blackwell;1986-ongoing;"Food Science (Q2); Sensory Systems (Q3)"
264;14990;Current Neuropharmacology;journal;1570159X;0.515;Q3;58;28;55;3460;47;52;0.9;123,57;United Arab Emirates;Bentham Science Publishers;2004-ongoing;"Medicine (miscellaneous) (Q2); Pharmacology (medical) (Q2); Psychiatry and Mental Health (Q2); Neurology (Q3); Neurology (clinical) (Q3); Pharmacology (Q3)"
265;17700156408;Nature Reviews Neurology;journal;17594766, 17594758;0.495;Q4;124;137;13;3180;12;12;1.0;23,21;United Kingdom;Nature Publishing Group;2009-ongoing;"Neurology (clinical) (Q3); Cellular and Molecular Neuroscience (Q4)"
266;24806;Neural Processing Letters;journal;13704621, 1573773X;0.494;Q3;45;35;106;788;159;101;1.14;22,51;Netherlands;Kluwer Academic Publishers;1994-ongoing;"Artificial Intelligence (Q2); Computer Networks and Communications (Q2); Software (Q2); Neuroscience (miscellaneous) (Q3)"
267;14899;Clinical Neuropathology;journal;07225091;0.49;Q3;40;43;126;914;160;125;1.28;21,26;Germany;Dustri-Verlag Dr. Karl Feistle;1982-ongoing;"Medicine (miscellaneous) (Q2); Pathology and Forensic Medicine (Q2); Neurology (Q3); Neurology (clinical) (Q3)"
268;22507;Invertebrate Neuroscience;journal;13542516;0.483;Q3;33;18;20;615;24;20;1.36;34,17;Germany;Springer Verlag;1995-1999, 2001-ongoing;"Developmental Neuroscience (Q3); Cellular and Molecular Neuroscience (Q4)"
269;32816;Neural Plasticity;journal;16875443, 20905904;0.48;Q3;53;0;68;0;98;64;1.46;0,00;Egypt;Hindawi Publishing Corporation;1998-2005, 2007-ongoing;"Neurology (Q3); Neurology (clinical) (Q3)"
270;14509;Journal of Vision;journal;15347362;0.478;Q3;99;113;1194;4941;902;1194;3.39;43,73;United States;Association for Research in Vision and Ophthalmology;2001-ongoing;"Ophthalmology (Q2); Sensory Systems (Q3)"
271;17540;Acta Neurobiologiae Experimentalis;journal;00651400, 16890035;0.477;Q3;50;42;127;1650;166;126;1.35;39,29;Poland;Polska Akademia Nauk;1970-ongoing;"Medicine (miscellaneous) (Q2); Neuroscience (miscellaneous) (Q3)"
272;24807;Neurocomputing;journal;09252312;0.475;Q4;110;279;803;5290;984;784;1.09;18,96;Netherlands;Elsevier BV;1989-ongoing;"Artificial Intelligence (Q2); Computer Science Applications (Q2); Cognitive Neuroscience (Q4)"
273;14183;Aphasiology;journal;14645041, 02687038;0.46;Q3;61;69;219;2825;216;202;0.79;40,94;United Kingdom;Taylor & Francis;1987-ongoing;"Language and Linguistics (Q1); Linguistics and Language (Q1); LPN and LVN (Q2); Otorhinolaryngology (Q2); Developmental and Educational Psychology (Q3); Neurology (Q3); Neurology (clinical) (Q3)"
274;5400152651;Frontiers of neurology and neuroscience;journal;16604431;0.458;Q3;23;23;16;818;7;16;0.44;35,57;Switzerland;Karger;2005-ongoing;"Medicine (miscellaneous) (Q2); Neurology (clinical) (Q3); Neuroscience (miscellaneous) (Q3)"
275;18153;Pain Research and Management;journal;12036765;0.451;Q3;49;21;91;843;100;64;1.63;40,14;Canada;Hindawi Publishing Corporation;1996-ongoing;"Anesthesiology and Pain Medicine (Q2); Neurology (Q3)"
276;28533;American Journal of Alzheimer's Disease and other Dementias;journal;15333175;0.449;Q3;52;58;172;1742;198;139;1.57;30,03;United States;SAGE Publications;1986-ongoing;"Clinical Psychology (Q2); Geriatrics and Gerontology (Q2); Psychiatry and Mental Health (Q2); Neuroscience (miscellaneous) (Q3)"
277;28675;Brazilian Journal of Medical and Biological Research;journal;0100879X;0.448;Q3;79;194;690;5781;896;681;1.25;29,80;Brazil;Associacao Brasileira de Divulgacao Cientifica;1973-ongoing;"Pharmacology, Toxicology and Pharmaceutics (miscellaneous) (Q1); Medicine (miscellaneous) (Q2); Biochemistry (Q3); Biophysics (Q3); Immunology (Q3); Neuroscience (miscellaneous) (Q3); Physiology (Q3); Cell Biology (Q4)"
278;16704;Journal of ECT;journal;10950680, 15334112;0.448;Q3;53;34;192;619;160;138;0.95;18,21;United States;Lippincott Williams & Wilkins Ltd.;1998-ongoing;"Medicine (miscellaneous) (Q2); Psychiatry and Mental Health (Q2); Neuroscience (miscellaneous) (Q3)"
279;16722;Journal of Integrative Neuroscience;journal;02196352;0.436;Q3;29;29;84;1529;96;80;0.89;52,72;United Kingdom;IOS Press;2002-ongoing;"Medicine (miscellaneous) (Q2); Neuroscience (miscellaneous) (Q3)"
280;12108;Behavioral and Brain Sciences;journal;14691825, 0140525X;0.43;Q4;148;284;1138;5155;736;918;0.8;18,15;United Kingdom;Cambridge University Press;1978-ongoing;"Neuropsychology and Physiological Psychology (Q3); Physiology (Q3); Behavioral Neuroscience (Q4)"
281;14630;Ophthalmic Research;journal;14230259, 00303747;0.429;Q4;50;44;168;1488;172;163;0.97;33,82;Switzerland;S. Karger AG;1973-ongoing;"Medicine (miscellaneous) (Q2); Ophthalmology (Q3); Cellular and Molecular Neuroscience (Q4); Sensory Systems (Q4)"
282;16177;International Journal of Neuroscience;journal;00207454, 15635279;0.403;Q3;57;113;359;3596;365;358;1.06;31,82;United Kingdom;Taylor & Francis;1970-1973, 1975-ongoing;"Medicine (miscellaneous) (Q2); Neuroscience (miscellaneous) (Q3)"
283;14333;Thalamus and Related Systems;journal;14729288, 17448107;0.391;Q3;21;0;50;0;30;47;0.4;0,00;United Kingdom;Cambridge University Press;2001-2005, 2008;"Neurology (clinical) (Q3); Neuroscience (miscellaneous) (Q3)"
284;16683;Journal of Clinical Neuroscience;journal;09675868;0.388;Q3;70;245;684;5292;565;636;0.8;21,60;United States;Churchill Livingstone;1994-ongoing;"Medicine (miscellaneous) (Q2); Neurology (Q3); Neurology (clinical) (Q3); Physiology (medical) (Q3)"
285;145668;Supplements to Clinical neurophysiology;journal;1567424X;0.382;Q3;27;25;169;1244;121;165;0.52;49,76;Netherlands;Elsevier BV;2000, 2002-2004, 2006, 2009-2010, 2013;"Neurology (clinical) (Q3); Neuroscience (miscellaneous) (Q3)"
286;5000153107;Central Nervous System Agents in Medicinal Chemistry;journal;18715249;0.378;Q3;30;20;85;3837;86;79;1.31;191,85;United Arab Emirates;Bentham Science Publishers;2006-ongoing;"Neuropsychology and Physiological Psychology (Q3); Neuroscience (miscellaneous) (Q3); Molecular Medicine (Q4)"
287;15854;Journal of Circadian Rhythms;journal;17403391;0.375;Q4;23;14;23;636;34;22;1.14;45,43;United Kingdom;BioMed Central;2003-ongoing;"Endocrine and Autonomic Systems (Q4); Physiology (Q4)"
288;25336;Neurodegenerative Diseases;journal;16602862, 16602854;0.369;Q3;52;64;40;2767;31;38;0.82;43,23;Switzerland;S. Karger AG;2004-ongoing;"Neurology (Q3); Neurology (clinical) (Q3)"
289;145679;European Journal of Neurology, Supplement;journal;14710552;0.365;Q3;15;0;12;0;19;12;1.58;0,00;United Kingdom;Rapid Science Publishers;2002, 2004-2005;"Neurology (clinical) (Q3); Neuroscience (miscellaneous) (Q3)"
290;17973;Neuromodulation;journal;15251403, 10947159;0.362;Q3;51;38;114;929;106;103;0.91;24,45;United Kingdom;Blackwell Publishing Inc.;1998-ongoing;"Anesthesiology and Pain Medicine (Q2); Medicine (miscellaneous) (Q2); Neurology (Q3); Neurology (clinical) (Q3)"
291;21100244213;Mind and Matter;journal;16118812;0.355;Q3;15;10;28;321;24;24;1.0;32,10;United Kingdom;Imprint Academic;2003-ongoing;"Philosophy (Q1); Sociology and Political Science (Q2); Neuroscience (miscellaneous) (Q3)"
292;3900148612;Journal of Clinical Sleep Medicine;journal;15509397, 15509389;0.354;Q3;78;67;75;1533;66;52;1.27;22,88;United States;The American Academy of Sleep Medicine;2005-ongoing;"Pulmonary and Respiratory Medicine (Q2); Neurology (Q3); Neurology (clinical) (Q3)"
293;17492;Neuroendocrinology Letters;journal;0172780X;0.35200000000000004;Q3;58;160;366;3981;361;336;1.0;24,88;Sweden;Maghira and Maas Publications;1979-1982, 1984-1995, 1997-ongoing;"Medicine (miscellaneous) (Q2); Endocrinology (Q3); Endocrinology, Diabetes and Metabolism (Q3); Neurology (Q3); Neurology (clinical) (Q3); Psychiatry and Mental Health (Q3); Endocrine and Autonomic Systems (Q4)"
294;130113;Cognitive Processing;journal;16124782, 16124790;0.345;Q4;38;83;22;1667;23;21;1.1;20,08;Germany;Springer Verlag;2005-ongoing;"Medicine (miscellaneous) (Q2); Artificial Intelligence (Q3); Cognitive Neuroscience (Q4); Experimental and Cognitive Psychology (Q4)"
295;23481;Journal of Vestibular Research: Equilibrium and Orientation;journal;09574271;0.345;Q3;48;29;93;1068;95;91;0.94;36,83;Netherlands;IOS Press;1990, 1992-ongoing;"Otorhinolaryngology (Q2); Neurology (clinical) (Q3); Neuroscience (miscellaneous) (Q3); Sensory Systems (Q4)"
296;5700155920;Focus on Autism and Other Developmental Disabilities;journal;10883576, 15384829;0.342;Q3;60;24;81;1016;70;81;0.9;42,33;United States;SAGE Publications Inc.;1986-ongoing;"Pediatrics, Perinatology and Child Health (Q2); Neurology (Q3); Neurology (clinical) (Q3); Psychiatry and Mental Health (Q3); Cognitive Neuroscience (Q4)"
297;15440;Dialogues in Clinical Neuroscience;journal;12948322;0.333;Q3;69;40;114;3098;73;100;0.97;77,45;France;Les Laboratoires Servier;2002-ongoing;"Biological Psychiatry (Q3); Psychiatry and Mental Health (Q3)"
298;15664;Functional Neurology;journal;19713274, 03935264;0.332;Q3;37;33;99;820;83;84;0.79;24,85;Italy;CIC Edizioni Internazionali s.r.l.;1986-ongoing;"Medicine (miscellaneous) (Q2); Neurology (clinical) (Q3); Neuroscience (miscellaneous) (Q3)"
299;22573;Research in Community and Mental Health;journal;01920812;0.332;Q4;6;10;15;649;8;13;0.2;64,90;United States;Emerald Group Publishing Ltd.;1981, 2000, 2003-2004, 2006;"Social Sciences (miscellaneous) (Q2); Behavioral Neuroscience (Q4)"
300;21370;Expert Review of Neurotherapeutics;journal;14737175;0.327;Q3;67;152;295;12217;276;276;1.2;80,38;United Kingdom;Taylor & Francis;2001-ongoing;"Neurology (clinical) (Q3); Neuroscience (miscellaneous) (Q3); Pharmacology (medical) (Q3)"
301;10600153338;Integrative Psychological and Behavioral Science;journal;19324502;0.302;Q4;31;0;61;0;39;61;0.33;0,00;United States;Springer Science + Business Media;2007-ongoing;"Cultural Studies (Q1); Philosophy (Q1); Anthropology (Q2); Applied Psychology (Q3); Neuropsychology and Physiological Psychology (Q3); Social Psychology (Q3); Behavioral Neuroscience (Q4); Experimental and Cognitive Psychology (Q4)"
302;7100153145;Developmental Neurorehabilitation;journal;17518423;0.29600000000000004;Q4;48;90;136;4026;188;117;0.7;44,73;United Kingdom;Informa Healthcare;1997-1999, 2002-2003, 2005-ongoing;"Medicine (miscellaneous) (Q2); Rehabilitation (Q2); Pediatrics, Perinatology and Child Health (Q3); Developmental Neuroscience (Q4)"
303;3600148102;Alzheimer's and Dementia;journal;15525279, 15525260;0.289;Q4;94;59;45;1809;33;24;1.38;30,66;Netherlands;Elsevier BV;2005-ongoing;"Geriatrics and Gerontology (Q2); Health Policy (Q2); Neurology (clinical) (Q3); Psychiatry and Mental Health (Q3); Cellular and Molecular Neuroscience (Q4); Developmental Neuroscience (Q4); Epidemiology (Q4)"
304;12798;Perceptual and Motor Skills;journal;01558688, 00315125;0.289;Q4;60;232;924;5099;420;921;0.4;21,98;United States;SAGE Publications Inc.;1962-ongoing;"Experimental and Cognitive Psychology (Q4); Sensory Systems (Q4)"
305;33502;Acupuncture and Electro-Therapeutics Research;journal;03601293;0.287;Q3;24;12;36;328;30;36;0.86;27,33;United States;Cognizant Communication Corporation;1976-ongoing;"Anesthesiology and Pain Medicine (Q2); Complementary and Alternative Medicine (Q2); Neuroscience (miscellaneous) (Q3)"
306;24802;Neural Network World;journal;23364335, 12100552;0.287;Q3;23;39;137;751;54;131;0.3;19,26;Czech Republic;Czech Academy of Sciences;1994-ongoing;"Artificial Intelligence (Q3); Hardware and Architecture (Q3); Neuroscience (miscellaneous) (Q3); Software (Q3)"
307;17969;Neurology India;journal;19984022, 00283886;0.278;Q4;43;163;517;1893;278;356;0.67;11,61;India;Medknow Publications;1965-1979, 1981-1984, 1986-1988, 1994-ongoing;"Neurology (clinical) (Q3); Neurology (Q4)"
308;12453;Acta Biologica Hungarica;journal;02365383;0.277;Q4;25;47;121;1293;68;120;0.65;27,51;Hungary;Akademiai Kiado;1983-ongoing;"Environmental Science (miscellaneous) (Q2); Biochemistry, Genetics and Molecular Biology (miscellaneous) (Q3); Neurology (Q4)"
309;11700154395;Individual Differences Research;journal;1541745X;0.275;Q3;21;31;65;970;27;64;0.43;31,29;United States;Individual Differences Research Group;2003-2014;"Biological Psychiatry (Q3); Psychology (miscellaneous) (Q3)"
310;16838;Journal of Undergraduate Neuroscience Education;journal;15442896;0.273;Q3;14;17;43;232;15;39;0.41;13,65;United States;Davison College;2002-2016 (cancelled);"Education (Q3); Neuroscience (miscellaneous) (Q3)"
