Rank;Sourceid;Title;Type;Issn;SJR;SJR Best Quartile;H index;Total Docs. (2003);Total Docs. (3years);Total Refs.;Total Cites (3years);Citable Docs. (3years);Cites / Doc. (2years);Ref. / Doc.;Country;Publisher;Coverage;Categories
289;4000152113;Journal of Sports Science and Medicine;journal;13032968;0.121;Q4;50;29;20;1346;2;20;0.1;46,41;Turkey;Dept. of Sports Medicine, Medical Faculty of Uludag University;2002-ongoing;"Orthopedics and Sports Medicine (Q4); Physical Therapy, Sports Therapy and Rehabilitation (Q4); Sports Science (Q4)"
290;19900192008;Sport History Review;journal;10871659, 15432947;0.121;Q4;6;0;1;0;0;1;0.0;0,00;United States;Human Kinetics Publishers Inc.;2002, 2009-ongoing;"History (Q2); Physical Therapy, Sports Therapy and Rehabilitation (Q4); Sports Science (Q4)"
291;20088;Vital and health statistics. Ser. 1: Programs and collection procedures;journal;00832014;0.121;Q4;15;1;1;0;0;1;0.0;0,00;United States;U.S. National Center for Health Statistics;1963-1978, 1981, 1985-1987, 1989-1990, 1992-1994, 1997, 1999-2000, 2002-2003, 2005, 2007-ongoing;"Health Information Management (Q4); Statistics and Probability (Q4)"
292;20127;Canadian Journal of Hospital Pharmacy;journal;00084123;0.12;Q3;15;35;144;366;18;91;0.2;10,46;Canada;Canadian Society of Hospital Pharmacists;1973-ongoing;"Pharmacy (Q3); Pharmacology (medical) (Q4)"
293;21100202751;The Neurodiagnostic journal;journal;21646821;0.12;Q3;16;12;66;404;5;50;0.13;33,67;United Kingdom;Taylor & Francis;1996-ongoing;"Medical Laboratory Technology (Q3); Neurology (clinical) (Q4)"
294;7500153109;Journal of Chiropractic Medicine;journal;15563715, 15563707;0.119;Q2;18;29;35;643;4;31;0.13;22,17;United States;Elsevier USA;2002-ongoing;Chiropractics (Q2)
295;21218;JNMS - Journal of the Neuromusculoskeletal System;journal;10678239;0.118;Q4;8;0;56;0;5;51;0.05;0,00;United States;Data Trace Publishing Co.;1996-2002;"Neurology (clinical) (Q4); Physical Therapy, Sports Therapy and Rehabilitation (Q4)"
296;144942;Journal of Physical Therapy Science;journal;21875626, 09155287;0.118;Q4;23;19;56;429;3;56;0.07;22,58;Japan;Society Of Physical Therapy Science;1996-2002, 2004-2017 (cancelled);Physical Therapy, Sports Therapy and Rehabilitation (Q4)
297;27234;Laboratoriums Medizin;journal;14390477, 03423026;0.117;Q3;15;60;226;1960;27;215;0.15;32,67;Germany;Walter de Gruyter GmbH;1985-ongoing;"Medical Laboratory Technology (Q3); Biochemistry (medical) (Q4); Clinical Biochemistry (Q4)"
298;17268;Medecine Nucleaire;journal;09281258;0.117;Q4;9;79;258;1466;17;228;0.06;18,56;France;Elsevier Masson;1993-ongoing;"Biophysics (Q4); Radiological and Ultrasound Technology (Q4); Radiology, Nuclear Medicine and Imaging (Q4)"
299;40596;Australian and New Zealand Journal of Audiology;journal;14434873;0.115;Q4;12;12;23;254;3;22;0.18;21,17;Australia;Australian Academic Press Pty Ltd.;2000-2010;Speech and Hearing (Q4)
300;26097;Australian Journal of Clinical Hypnotherapy and Hypnosis;journal;08100713;0.114;Q4;5;11;30;154;3;25;0.06;14,00;Australia;Australian Academic Press Pty Ltd.;1982-2015;"Clinical Psychology (Q4); Complementary and Manual Therapy (Q4)"
301;5800207553;Linguistics in the Netherlands;journal;09297332;0.114;Q4;13;19;58;323;7;58;0.1;17,00;Netherlands;John Benjamins Publishing Company;2014-ongoing;"Language and Linguistics (Q3); Linguistics and Language (Q3); Multidisciplinary (Q3); Health Professions (miscellaneous) (Q4); Psychology (miscellaneous) (Q4); Social Sciences (miscellaneous) (Q4)"
302;19700201335;Scandinavian Journal of Disability Research;journal;17453011, 15017419;0.114;Q4;18;18;31;545;6;31;0.2;30,28;Sweden;Taylor and Francis AS;1999-ongoing;"Physical Therapy, Sports Therapy and Rehabilitation (Q4); Rehabilitation (Q4)"
303;145693;Canadian Pharmacists Journal;journal;17151635;0.113;Q3;18;123;367;624;13;259;0.06;5,07;Canada;Canadian Pharmacists Association;2005-ongoing;"Pharmacy (Q3); Pharmaceutical Science (Q4)"
304;16373;Hong Kong Physiotherapy Journal;journal;10137025, 1876441X;0.112;Q4;11;9;20;228;1;17;0.11;25,33;Hong Kong;Hong Kong Physiotherapy Association;2000-ongoing;Physical Therapy, Sports Therapy and Rehabilitation (Q4)
305;144916;Journal of the Japanese Physical Therapy Association;journal;13441272;0.112;Q4;7;2;15;43;1;15;0.11;21,50;Japan;Japanese Physical Therapy Association;1998-2015;Physical Therapy, Sports Therapy and Rehabilitation (Q4)
306;145569;L1-Educational Studies in Language and Literature;journal;15676617;0.11;Q4;12;1;8;0;0;3;0.0;0,00;Netherlands;Kluwer Academic Publishers;2001-ongoing;"Literature and Literary Theory (Q1); Language and Linguistics (Q3); Linguistics and Language (Q3); Education (Q4); Health Professions (miscellaneous) (Q4); Psychology (miscellaneous) (Q4)"
307;17133;Pravention und Rehabilitation;journal;0937552X;0.11;Q4;7;22;64;494;6;62;0.12;22,45;Germany;Dustri-Verlag Dr. Karl Feistle;1993-2016 (cancelled);"Physical Therapy, Sports Therapy and Rehabilitation (Q4); Rehabilitation (Q4)"
308;26096;Australian Journal of Clinical and Experimental Hypnosis;journal;01560417;0.109;Q4;10;11;44;167;3;43;0.0;15,18;Australia;Australian Society of Hypnosis;1978-1985, 1987-2013, 2016-ongoing;"Clinical Psychology (Q4); Complementary and Manual Therapy (Q4)"
309;12110;Behavioral Healthcare Tomorrow;journal;10638490;0.108;Q4;8;68;165;15;6;164;0.03;0,22;United States;Manisses Communications Group Inc.;1994-2005;"Clinical Psychology (Q4); Health Professions (miscellaneous) (Q4); Health (social science) (Q4); Psychology (miscellaneous) (Q4)"
310;21227;Pharmacy in Practice;journal;13581538;0.108;Q3;5;51;68;412;5;52;0.08;8,08;United Kingdom;Medicom Publishing;1995-2009;"Pharmacy (Q3); Health Policy (Q4); Pharmacology (Q4); Pharmacology (medical) (Q4)"
311;68900;Journal of the American Optometric Association;journal;00030244;0.107;Q4;22;0;6;0;1;3;0.0;0,00;United States;American Optometric Association;1949, 1965-1971, 1973-2000;"Health Professions (miscellaneous) (Q4); Medicine (miscellaneous) (Q4)"
312;17860;Radiologic Technology;journal;00338397;0.106;Q4;17;47;169;392;12;161;0.08;8,34;United States;American Society of Radiologic Technologists;1963-ongoing;"Radiological and Ultrasound Technology (Q4); Radiology, Nuclear Medicine and Imaging (Q4)"
313;83742;Hong Kong Journal of Occupational Therapy;journal;15691861;0.105;Q4;10;5;5;112;0;4;0.0;22,40;Netherlands;Elsevier BV;2002-ongoing;Occupational Therapy (Q4)
314;19892;Medicina dello Sport;journal;00257826;0.105;Q4;11;38;125;914;5;117;0.04;24,05;Italy;Edizioni Minerva Medica;1965, 1973-1982, 1996-ongoing;"Orthopedics and Sports Medicine (Q4); Physical Therapy, Sports Therapy and Rehabilitation (Q4); Sports Science (Q4)"
315;4700152478;Jornal Brasileiro de Patologia e Medicina Laboratorial;journal;16762444;0.104;Q3;13;0;41;0;3;41;0.07;0,00;Brazil;Sociedade Brasileira de Patologia Clinica;2001-2002, 2006-ongoing;"Medical Laboratory Technology (Q3); Clinical Biochemistry (Q4); Pathology and Forensic Medicine (Q4)"
316;56502;Journal of Audiological Medicine;journal;09637133;0.104;Q4;9;0;55;0;5;47;0.03;0,00;United Kingdom;Whurr Publishers Ltd.;1992-2002;"Health Professions (miscellaneous) (Q4); Otorhinolaryngology (Q4); Psychology (miscellaneous) (Q4)"
317;5100152406;Journal of Teaching in the Addictions;journal;15332713, 15332705;0.104;Q4;8;11;6;179;0;5;0.0;16,27;United States;Haworth Press Inc.;2006-2009;"Education (Q4); Health Professions (miscellaneous) (Q4); Social Sciences (miscellaneous) (Q4)"
318;17211;Journal of Diagnostic Medical Sonography;journal;87564793;0.103;Q4;14;95;234;559;5;197;0.03;5,88;United States;Sage Science Press;1985-ongoing;"Radiological and Ultrasound Technology (Q4); Radiology, Nuclear Medicine and Imaging (Q4)"
319;21075;Journal of sport history;journal;00941700;0.103;Q4;9;0;7;0;0;7;0.0;0,00;United States;North American Society for Sport History;1977-1979, 1981-1984, 1987, 1989, 2000-2002, 2010-ongoing;"Cultural Studies (Q3); History (Q3); Sports Science (Q4)"
320;8300153134;Laboratory Techniques in Biochemistry and Molecular Biology;book series;00757535;0.103;Q4;7;11;9;0;0;7;0.0;0,00;Netherlands;North-Holland Publ Co;1969-1970, 1972, 1976, 1978-1979, 1981, 1983-1985, 1988, 1990-1991, 1993, 1998-2000, 2003, 2007, 2009;"Biochemistry (Q4); Medical Laboratory Technology (Q4); Molecular Biology (Q4)"
321;20347;Schweizerische Zeitschrift fr Sportmedizin und Sporttraumatologie;journal;14220644;0.103;Q4;12;25;109;944;4;92;0.06;37,76;Switzerland;Paul Haupt AG;1996-ongoing;"Orthopedics and Sports Medicine (Q4); Physical Therapy, Sports Therapy and Rehabilitation (Q4)"
322;19700175258;Journal of Chiropractic Humanities;journal;15563499;0.102;Q3;7;0;11;0;0;11;0.0;0,00;Netherlands;Elsevier BV;2010-ongoing;"Chiropractics (Q3); Complementary and Alternative Medicine (Q4)"
323;19715;Sports Medicine Standards and Malpractice Reporter;journal;1041696X;0.102;Q4;1;13;17;1;0;12;0.0;0,08;United States;P R C Publishing, Inc.;2002-2011;"Law (Q4); Orthopedics and Sports Medicine (Q4); Physical Therapy, Sports Therapy and Rehabilitation (Q4)"
324;32874;American Journal of Art Therapy;journal;00074764;0.101;Q4;8;0;16;0;0;16;0.0;0,00;United States;American Art Therapy Association, Inc.;1973-1983, 1985, 1987, 1989-2001;"Clinical Biochemistry (Q4); Health Professions (miscellaneous) (Q4)"
325;4900152807;British Journal of Chiropractic (United Kingdom);journal;14662108;0.101;Q4;3;0;17;0;2;17;0.1;0,00;United Kingdom;College of Chiropractors;1997-2002;Chiropractics (Q4)
326;29134;Case Manager;journal;15326527, 10619259;0.101;Q4;9;72;234;274;6;230;0.03;3,81;United States;Mosby Inc.;1995, 1999-2006;"Health Professions (miscellaneous) (Q4); Medicine (miscellaneous) (Q4)"
327;21823;Farmatsija;journal;04280296;0.101;Q4;5;11;23;271;0;23;0.0;24,64;Bulgaria;Meditsinski Universitet - Sofia;1945, 1954-1955, 1987-1991, 1997-ongoing;"Pharmaceutical Science (Q4); Pharmacology (medical) (Q4); Pharmacy (Q4)"
328;74826;Fizyoterapi Rehabilitasyon;journal;13008757;0.101;Q4;8;18;18;441;0;18;0.0;24,50;Turkey;Physical Therapy Association;2002-ongoing;"Orthopedics and Sports Medicine (Q4); Physical Therapy, Sports Therapy and Rehabilitation (Q4); Rehabilitation (Q4)"
329;78263;Journal of Sports Chiropractic and Rehabilitation;journal;10841288;0.101;Q4;5;0;48;0;1;34;0.0;0,00;United States;Atwood Publishing;1996-2001;"Complementary and Alternative Medicine (Q4); Orthopedics and Sports Medicine (Q4); Physical Therapy, Sports Therapy and Rehabilitation (Q4); Public Health, Environmental and Occupational Health (Q4); Rehabilitation (Q4)"
330;27231;Klinichescheskaya Laboratornaya Diagnostika;journal;08692084;0.101;Q4;9;142;417;1372;9;416;0.01;9,66;Russian Federation;Izdatel'stvo Meditsina Publishers;1993-ongoing;"Biochemistry (medical) (Q4); Medical Laboratory Technology (Q4); Medicine (miscellaneous) (Q4)"
331;16952;Physiotherapy Singapore;journal;02191091;0.101;Q4;6;8;40;227;0;31;0.0;28,38;Singapore;Singapore Physiotherapy Association;1999-2008, 2010;Physical Therapy, Sports Therapy and Rehabilitation (Q4)
332;21828;Revista Cubana de Farmacia;journal;00347515, 15612988;0.101;Q4;8;0;24;0;0;24;0.0;0,00;Cuba;Editorial Ciencias Medicas;1980-1991, 1996-2000, 2002, 2004-ongoing;"Pharmaceutical Science (Q4); Pharmacology (Q4); Pharmacy (Q4)"
333;15341;The International journal of the history of sport;journal;09523367;0.101;Q4;17;0;24;0;0;24;0.0;0,00;United Kingdom;Frank Cass Publishers;1984-1995, 1998-2002, 2010-ongoing;"History (Q4); Social Sciences (miscellaneous) (Q4); Sports Science (Q4)"
334;28054;Australian Journal of Medical Science;journal;10381643;0.1;Q4;5;11;255;273;4;244;0.17;24,82;Australia;Australian Institute of Medical Scientists;1992-2015;"Biochemistry (medical) (Q4); Clinical Biochemistry (Q4); Hematology (Q4); Immunology and Allergy (Q4); Medical Laboratory Technology (Q4); Microbiology (medical) (Q4)"
335;20005;Australian Journal of Pharmacy;journal;03118002;0.1;Q4;5;512;125;448;1;114;0.0;0,88;Australia;Australian Pharmaceutical Publishing Co., Ltd.;1974-1976, 1978-1985, 1996-ongoing;"Pharmacology (medical) (Q4); Pharmacy (Q4)"
336;28203;Bio-Medical Engineering;journal;00063398, 15738256;0.1;Q4;11;71;242;553;0;242;0.0;7,79;Netherlands;Kluwer Academic Publishers;1967-ongoing;"Biomedical Engineering (Q4); Medical Laboratory Technology (Q4); Medicine (miscellaneous) (Q4)"
337;18029;Canadian Journal of Respiratory Therapy;journal;12059838;0.1;Q4;5;28;102;45;0;49;0.0;1,61;Canada;Canadian Society of Respiratory Therapists;1996-ongoing;"Health Professions (miscellaneous) (Q4); Pulmonary and Respiratory Medicine (Q4)"
338;4000149001;Cancer Imaging;journal;17405025, 14707330;0.1;Q4;40;31;55;475;0;45;0.0;15,32;United Kingdom;BioMed Central;2000-ongoing;"Medicine (miscellaneous) (Q4); Oncology (Q4); Radiological and Ultrasound Technology (Q4); Radiology, Nuclear Medicine and Imaging (Q4)"
339;13779;Clinical and Refractive Optometry;journal;17054850;0.1;Q4;3;40;107;520;0;83;0.0;13,00;Canada;Mediaconcept, Inc.;2003-2013, 2015-ongoing;"Ophthalmology (Q4); Optometry (Q4)"
340;12100157156;Current Protocols in Cytometry;journal;19349297, 19349300;0.1;Q4;22;11;114;0;3;114;0.03;0,00;United States;Wiley-Liss Inc;2001-ongoing;"Biochemistry (Q4); Histology (Q4); Medical Laboratory Technology (Q4); Medicine (miscellaneous) (Q4)"
341;19700180734;Elsevier Ergonomics Book Series;book series;1572347X;0.1;Q4;7;0;54;0;0;51;0.0;0,00;Netherlands;Elsevier BV;2000, 2002, 2005;"Orthopedics and Sports Medicine (Q4); Physical Therapy, Sports Therapy and Rehabilitation (Q4)"
342;21100823451;German Journal of Exercise and Sport Research;journal;25093150, 25093142;0.1;Q4;8;34;77;161;0;77;0.0;4,74;Germany;Springer Berlin;2017-ongoing;"Orthopedics and Sports Medicine (Q4); Physical Therapy, Sports Therapy and Rehabilitation (Q4)"
343;17700156427;Handbook of Immunohistochemistry and in Situ Hybridization of Human Carcinomas;book series;18745784;0.1;Q4;4;0;107;0;0;49;0.0;0,00;Netherlands;Elsevier BV;2002, 2005;"Biochemistry (medical) (Q4); Immunology (Q4); Medical Laboratory Technology (Q4); Oncology (Q4)"
344;13829;Japan Journal of Logopedics and Phoniatrics;journal;00302813;0.1;Q4;5;32;122;518;0;122;0.0;16,19;Japan;Japan Society of Logopedics and Phoniatrics;2000-2001, 2003-ongoing;"LPN and LVN (Q4); Speech and Hearing (Q4)"
345;145431;Rigakuryoho Kagaku;journal;13411667;0.1;Q4;6;39;108;157;0;108;0.0;4,03;Japan;Undo Seiri Kenkyukai;2001-2002, 2004-ongoing;Physical Therapy, Sports Therapy and Rehabilitation (Q4)
346;13624;Audiological Medicine;journal;16513835, 1651386X;;-;19;41;0;1482;0;0;0.0;36,15;United Kingdom;Taylor & Francis;2003-2012;Speech and Hearing
347;21100259112;Australasian Journal of Paramedicine;journal;22027270;;-;13;13;0;185;0;0;0.0;14,23;Australia;Faculty of Health, Engineering and Science, Edith Cowan University;2013-ongoing;"Emergency Medical Services; Emergency Medicine; Emergency Nursing"
348;21171;Clinical Chiropractic;journal;14792354;;-;14;25;0;440;0;0;0.0;17,60;Netherlands;Elsevier BV;1997-2012;Chiropractics
349;30931;FTR - Turkiye Fiziksel Tip ve Rehabilitasyon Dergisi;journal;13020234;;-;8;52;0;985;0;0;0.0;18,94;Turkey;Galenos Yayincilik;2003-ongoing;"Physical Therapy, Sports Therapy and Rehabilitation; Rehabilitation"
350;22108;International Journal of Disability, Development and Education;journal;1465346X, 1034912X;;-;31;27;0;1057;0;0;0.0;39,15;United Kingdom;Carfax Publishing Ltd.;1989-1995, 2003-ongoing;"Developmental and Educational Psychology; Education; Health Professions (miscellaneous); Health (social science)"
351;3900148223;Iranian Journal of Radiation Research;journal;17284562, 17284554;;-;13;3;0;58;0;0;0.0;19,33;Iran;Iranian journal of radiation research;2004-ongoing;"Radiological and Ultrasound Technology; Radiology, Nuclear Medicine and Imaging"
352;19868;Journal de Traumatologie du Sport;journal;0762915X;;-;8;47;0;761;0;0;0.0;16,19;France;Elsevier Masson;2003-ongoing;"Orthopedics and Sports Medicine; Rehabilitation; Sports Science; Surgery"
353;15892;Journal of Drug Evaluation;journal;14791137;;-;4;21;0;1019;0;0;0.0;48,52;United Kingdom;Parthenon Publishing Group;2003-2004;"Pharmacology; Pharmacy"
354;21100464658;Journal of innovation in health informatics;journal;20584563, 20584555;;-;34;34;0;442;0;0;0.0;13,00;United Kingdom;BCS, The Chartered Institute for IT;2015-ongoing;"Computer Science Applications; Health Informatics; Health Information Management"
355;21100370879;Journal of managed care & specialty pharmacy;journal;23761032, 23760540;;-;55;101;0;671;0;0;0.0;6,64;United States;Academy of Managed Care Pharmacy (AMCP);2014-ongoing;"Health Policy; Pharmaceutical Science; Pharmacy"
356;12273;Journal of Rehabilitation Medicine, Supplement;journal;16501969;;-;34;17;0;806;0;0;0.0;47,41;United Kingdom;Taylor & Francis;2003-2004;"Physical Therapy, Sports Therapy and Rehabilitation; Rehabilitation"
357;17285;MedicaMundi;journal;00257664;;-;11;21;0;558;0;0;0.0;26,57;Netherlands;Philips Medical Systems International B.V.;1956-1965, 1973-1976, 1988-1995, 1997-1998, 2003-2011;"Radiological and Ultrasound Technology; Radiology, Nuclear Medicine and Imaging"
358;5000158307;Musculoskeletal care;journal;14782189, 15570681;;-;24;16;0;30;0;0;0.0;1,88;United States;Wiley-Blackwell;2003, 2006-ongoing;"Chiropractics; Nursing (miscellaneous); Orthopedics and Sports Medicine; Physical Therapy, Sports Therapy and Rehabilitation; Rehabilitation; Rheumatology"
359;19917;Revista Brasileira de Medicina do Esporte;journal;15178692;;-;24;33;0;1333;0;0;0.0;40,39;Brazil;Redprint Editora Ltda.;2003-ongoing;"Orthopedics and Sports Medicine; Physical Therapy, Sports Therapy and Rehabilitation; Sports Science"
360;12100156147;Sport in History;journal;17460271, 17460263;;-;15;14;0;341;0;0;0.0;24,36;United Kingdom;Routledge;2003-ongoing;"History; Physical Therapy, Sports Therapy and Rehabilitation"
