Rank;Sourceid;Title;Type;Issn;SJR;SJR Best Quartile;H index;Total Docs. (2016);Total Docs. (3years);Total Refs.;Total Cites (3years);Citable Docs. (3years);Cites / Doc. (2years);Ref. / Doc.;Country;Region;Publisher;Coverage;Categories
918;21100812868;Evergreen;journal;21890420;0.234;Q3;15;17;31;350;12;29;0.39;20.59;Japan;Asiatic Region;Joint Journal of Novel Carbon Resource Sciences and Green Asia Strategy;2014-2021;"Ceramics and Composites (Q3); Management, Monitoring, Policy and Law (Q3); Surfaces, Coatings and Films (Q3); Electronic, Optical and Magnetic Materials (Q4)"
919;19350;Mikologiya I Fitopatologiya;journal;00263648;0.234;Q3;13;44;141;1339;57;141;0.45;30.43;Russian Federation;Eastern Europe;Russian Academy of Sciences;1996-2021;"Ecology (Q3); Plant Science (Q3); Ecology, Evolution, Behavior and Systematics (Q4)"
920;18300156713;Australasian Journal of Natural Resources Law and Policy;journal;13205323;0.233;Q3;7;0;5;0;3;5;0;0;Australia;Pacific Region;University of Wollongong;2008-2013;Management, Monitoring, Policy and Law (Q3)
921;18587;Shuili Xuebao/Journal of Hydraulic Engineering;journal;05599350;0.233;Q3;35;177;663;1950;379;663;0.5;11.02;China;Asiatic Region;China Water Power Press;1985-1998, 2001-2021;"Energy Engineering and Power Technology (Q3); Mechanical Engineering (Q3); Water Science and Technology (Q3)"
922;55750;Human Ecology Review;journal;10744827;0.232;Q3;43;6;35;321;21;35;0.4;53.5;United States;Northern America;Society for Human Ecology;1998-2020;"Geography, Planning and Development (Q3); Management, Monitoring, Policy and Law (Q3)"
923;21100416473;Proceedings - 2015 IEEE International Conference on Cloud Engineering, IC2E 2015;conference and proceedings;-;0.232;-;15;0;87;0;139;76;1.6;0;United States;Northern America;;;"Pollution; Linguistics and Language (Q2)"
924;19700186913;Zpravy Lesnickeho Vyzkumu;journal;18059872, 03229688;0.232;Q3;10;39;123;1214;35;123;0.35;31.13;Czech Republic;Eastern Europe;Vyzkumny Ustav Lesniho Hospodarstvi a Myslivosti;2009-2021;"Forestry (Q3); Nature and Landscape Conservation (Q3)"
925;85449;Polish Journal of Soil Science;journal;00792985;0.23;Q3;12;17;43;544;19;43;0.55;32;Poland;Eastern Europe;;1976, 1978-1979, 1987-2021;"Earth-Surface Processes (Q3); Ecology (Q3); Soil Science (Q3)"
926;21100448928;2015 8th International Workshop on the Analysis of Multitemporal Remote Sensing Images, Multi-Temp 2015;conference and proceedings;-;0.229;-;5;0;67;0;17;66;0.25;0;United States;Northern America;;;"Environmental Engineering; Renewable Energy, Sustainability and the Environment"
927;20500195092;International Journal of Sustainable Society;journal;17562546, 17562538;0.228;Q3;16;19;69;707;36;68;0.45;37.21;United Kingdom;Western Europe;Inderscience Enterprises Ltd.;2008-2021;"Environmental Science (miscellaneous) (Q3); Geography, Planning and Development (Q3); Management, Monitoring, Policy and Law (Q3); Sociology and Political Science (Q3)"
928;14692;Environmental History;journal;19308892, 10845453;0.227;Q3;38;29;92;1733;40;71;0.37;59.76;United Kingdom;Western Europe;Oxford University Press;1996-2021;"History (Q1); Environmental Science (miscellaneous) (Q3)"
929;21100390176;Theoretical and Applied Mechanics Letters;journal;20950349;0.227;Q4;25;54;122;1261;113;66;0.97;23.35;Netherlands;Western Europe;Elsevier BV;2011-2021;"Aerospace Engineering (Q3); Civil and Structural Engineering (Q3); Mechanical Engineering (Q3); Mechanics of Materials (Q3); Ocean Engineering (Q3); Biomedical Engineering (Q4); Computational Mechanics (Q4); Environmental Engineering (Q4)"
930;21100283767;Proceedings of the 5th International Conference on Management of Emergent Digital EcoSystems, MEDES 2013;conference and proceedings;-;0.226;-;10;0;57;0;49;56;0;0;United States;Northern America;;;"Ecological Modeling; Information Systems and Management"
931;21100421914;2015 IEEE Transportation Electrification Conference and Expo, ITEC 2015;conference and proceedings;-;0.225;-;13;0;101;0;113;100;1.12;0;United States;Northern America;;;"Architecture; Building and Construction; Control and Systems Engineering; Environmental Engineering; Renewable Energy, Sustainability and the Environment"
932;13600154725;Journal of Residuals Science and Technology (discontinued);journal;15448053;0.225;Q3;15;96;84;2242;96;84;1.35;23.35;United States;Northern America;DEStech Publications Inc.;2006-2017;"Waste Management and Disposal (Q3); Environmental Chemistry (Q4); Environmental Engineering (Q4)"
933;17390;Soil Mechanics and Foundation Engineering;journal;00380741, 15739279;0.225;Q3;17;66;147;983;46;147;0.34;14.89;United States;Northern America;Springer New York;1964-2021;"Energy (miscellaneous) (Q3); Geotechnical Engineering and Engineering Geology (Q3); Ocean Engineering (Q3); Water Science and Technology (Q3); Soil Science (Q4)"
934;14607;Ekologia Bratislava;journal;1337947X, 1335342X;0.224;Q3;22;31;107;1280;51;107;0.34;41.29;Slovakia;Eastern Europe;De Gruyter Open Ltd.;1993-1994, 1996-2021;Ecology (Q3)
935;5200152804;Journal of Water Chemistry and Technology (discontinued);journal;1063455X;0.224;Q3;16;61;153;1228;57;153;0.35;20.13;United States;Northern America;Allerton Press Inc.;2006-2017;"Chemistry (miscellaneous) (Q3); Water Science and Technology (Q3)"
936;13770;Memoranda - Societatis pro Fauna et Flora Fennica (discontinued);journal;03736873;0.224;Q3;12;15;47;598;15;47;0.27;39.87;Finland;Western Europe;Societas pro Fauna et Flora Fennica;1988-2018;"Ecology (Q3); Ecology, Evolution, Behavior and Systematics (Q4)"
937;22273;Peace Economics, Peace Science and Public Policy;journal;15548597, 10792457;0.224;Q3;17;28;96;1087;43;93;0.5;38.82;Germany;Western Europe;Walter de Gruyter GmbH;1994-1996, 1999-2021;"Economics and Econometrics (Q3); Management, Monitoring, Policy and Law (Q3); Political Science and International Relations (Q3); Sociology and Political Science (Q3)"
938;21100205933;Agrarforschung Schweiz;journal;16637909, 16637852;0.223;Q3;10;89;280;677;52;169;0.17;7.61;Switzerland;Western Europe;Recherche agronomique suisse;2012-2020;"Agronomy and Crop Science (Q3); Food Science (Q3); Horticulture (Q3); Pollution (Q3); Animal Science and Zoology (Q4)"
939;101730;Rudarsko Geolosko Naftni Zbornik;journal;03534529, 18490409;0.223;Q3;13;18;52;515;18;50;0.61;28.61;Croatia;Eastern Europe;University of Zagreb;1994-2021;"Energy (miscellaneous) (Q3); Geotechnical Engineering and Engineering Geology (Q3); Water Science and Technology (Q3); Geology (Q4)"
940;12600154786;European Journal of Spatial Development;journal;16509544;0.222;Q3;11;5;10;371;11;10;0.5;74.2;Sweden;Western Europe;Nordregio;2008-2019;"Geography, Planning and Development (Q3); Management, Monitoring, Policy and Law (Q3); Urban Studies (Q3)"
941;12100154931;Issues in Environmental Science and Technology;book series;14651874, 13507583;0.222;Q3;15;19;28;2293;19;25;0.68;120.68;United Kingdom;Western Europe;Royal Society of Chemistry;2007, 2009-2011, 2014-2021;Environmental Science (miscellaneous) (Q3)
942;21100216301;Journal of Chinese Soil and Water Conservation;journal;02556073;0.222;Q3;6;21;87;497;25;87;0.27;23.67;Taiwan;Asiatic Region;Chinese Soil and Water Conservation Society;2012-2021;"Earth-Surface Processes (Q3); Geotechnical Engineering and Engineering Geology (Q3); Water Science and Technology (Q3); Soil Science (Q4)"
943;11900154394;Oriental Journal of Chemistry (discontinued);journal;0970020X, 22315039;0.222;Q4;27;358;875;10359;576;875;0.7;28.94;India;Asiatic Region;Bhopal, S.A. Iqbal;1989, 2008-2018, 2021;"Chemistry (miscellaneous) (Q3); Drug Discovery (Q3); Biochemistry (Q4); Environmental Chemistry (Q4)"
944;33310;Outlook on Agriculture;journal;00307270;0.222;Q3;32;33;105;983;67;98;0.61;29.79;United Kingdom;Western Europe;SAGE Publications Inc.;1973, 1976, 1979-1981, 1984-1989, 1991-2021;"Agronomy and Crop Science (Q3); Ecology (Q3); Animal Science and Zoology (Q4)"
945;19400157013;Problemy Ekorozwoju;journal;18956912, 20801971;0.222;Q3;21;35;88;1102;74;85;0.86;31.49;Poland;Eastern Europe;Politechnika Lubelska;2008-2021;"Geography, Planning and Development (Q3); Management, Monitoring, Policy and Law (Q3); Renewable Energy, Sustainability and the Environment (Q4)"
946;21100416472;ACL-IJCNLP 2015 - 53rd Annual Meeting of the Association for Computational Linguistics and the 7th International Joint Conference on Natural Language Processing, Proceedings of System Demonstrations;conference and proceedings;-;0.221;-;8;0;16;0;41;14;2.56;0;United States;Northern America;;;"Biomedical Engineering; Biotechnology; Computer Networks and Communications; Computer Science Applications; Hardware and Architecture; Human-Computer Interaction"
947;17700155408;International Journal of Environmental and Science Education (discontinued);journal;13063065;0.221;Q3;0;0;0;0;0;0;0;0;Turkey;Middle East;;2009-2016;"Education (Q3); Engineering (miscellaneous) (Q3); Environmental Science (miscellaneous) (Q3)"
948;21100456639;Journal of Integrated Coastal Zone Management;journal;16468872;0.221;Q3;10;27;42;1463;28;42;0.67;54.19;Portugal;Western Europe;APRH (Associacao Portuguesa dos Recursos Hidricos);2015-2021;"Management, Monitoring, Policy and Law (Q3); Water Science and Technology (Q3); Aquatic Science (Q4); Oceanography (Q4)"
949;18721;Proceedings of the Academy of Natural Sciences of Philadelphia;journal;00973157;0.221;Q3;22;5;39;268;26;37;0.77;53.6;United States;Northern America;Academy of Natural Sciences of Philadelphia;1972, 1976-1977, 1985, 1994-1995, 1997, 1999-2003, 2005-2006, 2010-2011, 2013-2020;"Ecology (Q3); Ecology, Evolution, Behavior and Systematics (Q4)"
950;19400158702;Water History;journal;18777236, 18777244;0.22;Q3;10;0;1;0;2;1;2;0;Netherlands;Western Europe;Springer Netherlands;2009-2012, 2014;"History (Q1); Geography, Planning and Development (Q3); Water Science and Technology (Q3)"
951;14578;Ecologia Austral;journal;03275477, 1667782X;0.219;Q3;32;33;101;1551;80;98;0.73;47;Argentina;Latin America;Asociacion Argentina de Ecologia;1991, 1993-2021;"Ecology (Q3); Ecology, Evolution, Behavior and Systematics (Q4)"
952;23945;Gefahrstoffe Reinhaltung der Luft;journal;09498036;0.219;Q3;19;86;238;1071;63;203;0.22;12.45;Germany;Western Europe;"VDI Fachmedien GmBbH &amp; Co.";1996-2021;"Management, Monitoring, Policy and Law (Q3); Pollution (Q3); Health, Toxicology and Mutagenesis (Q4)"
953;21100215167;International Journal of Geophysics;journal;16878868, 1687885X;0.219;Q3;21;12;54;586;35;52;0.8;48.83;Egypt;Africa/Middle East;Hindawi Limited;2009-2021;"Water Science and Technology (Q3); Geophysics (Q4)"
954;5300152523;Cahiers Agricultures;journal;11667699, 17775949;0.218;Q3;21;47;155;1207;56;145;0.33;25.68;France;Western Europe;EDP Sciences;2006-2021;"Agronomy and Crop Science (Q3); Management, Monitoring, Policy and Law (Q3); Animal Science and Zoology (Q4)"
955;21100413836;European Countryside;journal;18038417;0.218;Q3;15;31;55;1277;43;55;0.69;41.19;Germany;Western Europe;de Gruyter;2012-2021;"Geography, Planning and Development (Q3); Management, Monitoring, Policy and Law (Q3); Nature and Landscape Conservation (Q4)"
956;21100818914;Journal of Landscape Ecology(Czech Republic);journal;18054196, 18032427;0.218;Q3;11;15;35;683;22;35;0.67;45.53;Germany;Western Europe;de Gruyter;2013-2021;"Ecology (Q3); Management, Monitoring, Policy and Law (Q3); Nature and Landscape Conservation (Q3)"
957;145503;Agrociencia;journal;14053195, 25219766;0.217;Q3;24;83;193;2893;88;193;0.33;34.86;Mexico;Latin America;Colegio de Postgraduados;2000-2021;"Agronomy and Crop Science (Q3); Environmental Science (miscellaneous) (Q3); Animal Science and Zoology (Q4); Plant Science (Q4)"
958;19700177700;European Energy and Environmental Law Review;journal;18793886, 25890387;0.217;Q3;14;11;53;840;20;45;0.38;76.36;Netherlands;Western Europe;Kluwer Law International;2008-2021;"Geography, Planning and Development (Q3); Law (Q3); Management, Monitoring, Policy and Law (Q3); Renewable Energy, Sustainability and the Environment (Q4)"
959;21100246533;Journal of Ecological Engineering;journal;22998993, 2081139X;0.217;Q3;22;159;235;3490;125;235;0.54;21.95;Poland;Eastern Europe;Polskie Towarzystwo Inzynierii Ekologicznej;2013-2021;"Environmental Science (miscellaneous) (Q3); Ecology, Evolution, Behavior and Systematics (Q4)"
960;145018;Journal of Environmental Hydrology (discontinued);journal;10583912;0.217;Q3;16;11;31;313;13;31;0.24;28.45;United States;Northern America;International Association for Environmental Hydrology;1996-2002, 2005-2017;Water Science and Technology (Q3)
961;21100332426;Reservoir Sedimentation - Special Session on Reservoir Sedimentation of the 7th International Conference on Fluvial Hydraulics, RIVER FLOW 2014;conference and proceedings;-;0.216;-;4;0;16;0;12;14;0.75;0;United States;Northern America;;;"Nature and Landscape Conservation; Water Science and Technology"
962;21100433106;Journal of Asia-Pacific Biodiversity;journal;22879544, 2287884X;0.215;Q3;18;77;135;2404;59;135;0.54;31.22;South Korea;Asiatic Region;Korean Biodiversity Information Facility;2013-2021;"Ecology (Q3); Animal Science and Zoology (Q4); Ecology, Evolution, Behavior and Systematics (Q4); Insect Science (Q4); Plant Science (Q4)"
963;21100407626;Drought: Research and Science-Policy Interfacing - Proceedings of the International Conference on Drought: Research and Science-Policy Interfacing;conference and proceedings;-;0.214;-;3;0;45;0;8;42;0.18;0;Netherlands;Western Europe;;;"Environmental Engineering; Geotechnical Engineering and Engineering Geology; Management, Monitoring, Policy and Law; Pollution"
964;21100323400;Ekologiya Cheloveka (Human Ecology);journal;17280869;0.214;Q3;12;105;292;2165;80;292;0.29;20.62;Russian Federation;Eastern Europe;Northern State Medical University;2012-2021;"Ecology (Q3); Health (social science) (Q3); Health, Toxicology and Mutagenesis (Q4); Public Health, Environmental and Occupational Health (Q4)"
965;21100258634;IEEE Green Technologies Conference;conference and proceedings;21665478;0.214;-;17;29;131;388;135;122;0.78;13.38;United States;Northern America;;;"Ecological Modeling; Electrical and Electronic Engineering; Environmental Engineering"
966;21100239824;Journal for the Study of Religion, Nature and Culture;journal;17494915, 17494907;0.213;Q3;9;27;75;1234;45;66;0.46;45.7;United Kingdom;Western Europe;Equinox Publishing Ltd;2013-2021;"Religious Studies (Q1); Cultural Studies (Q2); Ecology (Q3); Ecology, Evolution, Behavior and Systematics (Q4)"
967;22594;Chinese Journal of Applied Ecology;journal;10019332;0.212;Q4;44;480;1607;18247;1092;1607;0.72;38.01;China;Asiatic Region;Editorial Board of Chinese Journal of Applied Ecology;1991-2021;"Medicine (miscellaneous) (Q3); Ecology (Q4); Ecology, Evolution, Behavior and Systematics (Q4)"
968;21100456848;CPS-SPC 2015 - Proceedings of the 1st ACM Workshop on Cyber-Physical Systems-Security and/or Privacy, co-located with CCS 2015;conference and proceedings;-;0.212;-;8;0;13;0;18;11;1.38;0;United States;Northern America;;;"Engineering (miscellaneous); Geography, Planning and Development; Management, Monitoring, Policy and Law; Pollution"
969;21100247059;Journal of Ecology and Environment;journal;22881220, 22878327;0.212;Q4;14;29;153;875;66;148;0.31;30.17;United Kingdom;Western Europe;BioMed Central Ltd.;2013-2021;"Ecology (Q4); Ecology, Evolution, Behavior and Systematics (Q4)"
970;3200147807;Journal of Food, Agriculture and Environment (discontinued);journal;14590255, 14590263;0.212;Q3;39;60;1601;1677;508;1601;0.27;27.95;Finland;Western Europe;WFL Publisher Ltd.;2006-2017;"Agricultural and Biological Sciences (miscellaneous) (Q3); Environmental Science (miscellaneous) (Q3); Food Science (Q3)"
971;11000153705;Journal of Transnational Management;journal;15475778, 15475786;0.212;Q4;16;18;55;769;29;43;0.42;42.72;United Kingdom;Western Europe;Taylor and Francis Ltd.;2005-2021;"Development (Q3); Geography, Planning and Development (Q3); Management, Monitoring, Policy and Law (Q4)"
972;54198;Shuili Fadian Xuebao/Journal of Hydroelectric Engineering;journal;10031243;0.212;Q3;22;170;805;4187;252;804;0.29;24.63;China;Asiatic Region;Tsinghua University Press;1998, 2001-2021;"Energy Engineering and Power Technology (Q3); Mechanical Engineering (Q3); Water Science and Technology (Q3)"
973;20000195075;Water Practice and Technology;journal;1751231X;0.212;Q3;17;86;219;1416;96;219;0.38;16.47;United Kingdom;Western Europe;IWA Publishing;2011-2021;Water Science and Technology (Q3)
974;23474;Environmental Ethics;journal;01634275;0.21;Q3;31;24;75;1190;43;70;0.35;49.58;United States;Northern America;Environmental Philosophy Inc;1979-1981, 1984, 1988, 1990, 1996-2021;"Philosophy (Q2); Environmental Science (miscellaneous) (Q3)"
975;21100225849;Geo-Eco-Marina;journal;12246808, 22482776;0.21;Q4;10;10;30;364;12;28;0.37;36.4;Romania;Eastern Europe;Institutul National de Cercetare-Dezvoltare pentru Geologie si Geoecologie Marina;2011-2020;"Earth and Planetary Sciences (miscellaneous) (Q3); Geography, Planning and Development (Q3); Aquatic Science (Q4); Ecology (Q4); Ecology, Evolution, Behavior and Systematics (Q4)"
976;15169;Hydrobiological Journal;journal;03758990, 00188166;0.21;Q3;12;62;174;1616;34;174;0.19;26.06;United States;Northern America;Begell House Inc.;1974-1976, 1978-1983, 1987-2021;"Water Science and Technology (Q3); Aquatic Science (Q4); Ecology (Q4)"
977;22630;Proceedings of the Linnean Society of New South Wales;journal;0370047X;0.21;Q3;19;0;1;0;1;1;1;0;Australia;Pacific Region;Linnean Society of New South Wales;1980-1981, 1983, 1996-2001, 2003-2011, 2015;"Agricultural and Biological Sciences (miscellaneous) (Q3); Environmental Science (miscellaneous) (Q3); Ecology (Q4)"
978;22752;International Journal of Environment and Sustainable Development;journal;14787466, 14746778;0.209;Q4;19;30;75;1038;39;72;0.33;34.6;United Kingdom;Western Europe;Inderscience Enterprises Ltd;2002-2021;"Geography, Planning and Development (Q3); Management, Monitoring, Policy and Law (Q4); Renewable Energy, Sustainability and the Environment (Q4)"
979;21100370022;Regional Research of Russia;journal;20799713, 20799705;0.209;-;12;40;145;693;54;145;0.34;17.33;United States;Northern America;Pleiades Publishing;2011-2021;"Earth and Planetary Sciences (miscellaneous) (Q3); Geography, Planning and Development (Q3)"
980;21100218067;Science et Changements Planetaires - Secheresse;journal;11477806, 17775922;0.209;Q4;10;0;39;0;21;36;0;0;France;Western Europe;John Libbey Eurotext;2012-2013;"Ecology (Q4); Global and Planetary Change (Q4); Management, Monitoring, Policy and Law (Q4)"
981;12000154412;Acta Agriculturae Slovenica;journal;18541941, 15819175;0.208;Q3;20;93;124;2687;67;124;0.27;28.89;Slovenia;Eastern Europe;University of Ljubljana;2008-2021;"Agricultural and Biological Sciences (miscellaneous) (Q3); Water Science and Technology (Q3)"
982;27636;Cartographic Perspectives;journal;10489053;0.207;Q3;14;12;54;157;12;34;0.18;13.08;United States;Northern America;NACIS (North American Cartographic Information Society);1990-1992, 2005-2020;"Earth and Planetary Sciences (miscellaneous) (Q3); Environmental Science (miscellaneous) (Q3)"
983;21100780794;Engineering;journal;20958099;0.207;Q4;59;83;62;1738;64;52;1.03;20.94;United Kingdom;Western Europe;Elsevier Ltd.;2015-2021;"Chemical Engineering (miscellaneous) (Q3); Computer Science (miscellaneous) (Q3); Energy Engineering and Power Technology (Q3); Engineering (miscellaneous) (Q3); Materials Science (miscellaneous) (Q3); Environmental Engineering (Q4)"
984;7200153148;Revista Brasileira de Gestao e Desenvolvimento Regional;journal;1809239X;0.207;Q3;7;70;151;1699;22;142;0.11;24.27;Brazil;Latin America;Universidade de Taubate;2007-2021;"Environmental Science (miscellaneous) (Q3); Geography, Planning and Development (Q3); Sociology and Political Science (Q3); Urban Studies (Q3)"
985;20000195091;Ecotropica;journal;09493026;0.206;Q4;11;0;15;0;7;15;0.38;0;Germany;Western Europe;;2010-2014;"Ecology (Q4); Ecology, Evolution, Behavior and Systematics (Q4)"
986;17600155050;Asian Economic Policy Review;journal;18328105, 17483131;0.205;Q4;22;39;110;414;63;75;0.47;10.62;Australia;Pacific Region;Wiley-Blackwell Publishing Ltd;2008-2021;"Economics, Econometrics and Finance (miscellaneous) (Q3); Political Science and International Relations (Q3); Management, Monitoring, Policy and Law (Q4)"
987;31273;Memoirs of the Queensland Museum;journal;00798835;0.205;Q4;35;8;33;194;6;30;0.2;24.25;Australia;Pacific Region;Queensland Museum;1987-2009, 2011-2021;"Ecology (Q4); Paleontology (Q4)"
988;21100390382;Transport and Sustainability;book series;20449941, 2044995X;0.205;Q4;15;19;43;376;35;41;0.81;19.79;United Kingdom;Western Europe;Emerald Group Publishing Ltd.;2012, 2014-2018, 2020-2021;"Management, Monitoring, Policy and Law (Q4); Transportation (Q4)"
989;19700186837;Coke and Chemistry;journal;1068364X, 19348398;0.204;Q4;14;84;276;1146;85;276;0.34;13.64;United States;Northern America;Pleiades Publishing;2009-2021;"Fuel Technology (Q3); Process Chemistry and Technology (Q3); Environmental Chemistry (Q4)"
990;21100206286;Geoingegneria Ambientale e Mineraria;journal;11219041;0.204;Q4;10;34;71;556;23;68;0.31;16.35;Italy;Western Europe;Politecnico, Associazione Gorisorse E Ambiente;2007-2020;"Geotechnical Engineering and Engineering Geology (Q3); Environmental Engineering (Q4)"
991;12701;Nukleonika;journal;15085791, 00295922;0.204;Q3;24;76;275;1109;164;272;0.72;14.59;Poland;Eastern Europe;Institute of Nuclear Chemistry and Technology;1968, 1970, 1973-1974, 1978, 1981, 1996-2021;"Instrumentation (Q3); Nuclear Energy and Engineering (Q3); Safety, Risk, Reliability and Quality (Q3); Waste Management and Disposal (Q3); Condensed Matter Physics (Q4); Nuclear and High Energy Physics (Q4)"
992;21100375904;Open Engineering;journal;23915439;0.204;Q4;28;99;167;1729;147;165;0.79;17.46;Poland;Eastern Europe;De Gruyter Open Ltd.;2015-2021;"Electrical and Electronic Engineering (Q3); Materials Science (miscellaneous) (Q3); Mechanical Engineering (Q3); Aerospace Engineering (Q4); Civil and Structural Engineering (Q4); Environmental Engineering (Q4)"
993;21100446264;Proceedings of the 2015 Federated Conference on Computer Science and Information Systems, FedCSIS 2015;conference and proceedings;-;0.204;-;17;0;219;0;270;218;1.23;0;United States;Northern America;;;"Environmental Engineering; Geophysics; Geotechnical Engineering and Engineering Geology"
994;21100248847;Advances in Sustainability and Environmental Justice;book series;20515030;0.203;Q3;8;25;69;1044;36;64;0.38;41.76;United Kingdom;Western Europe;Emarald Group Publishing Ltd;2013-2017;"Environmental Science (miscellaneous) (Q3); Social Sciences (miscellaneous) (Q3)"
995;21100812103;Bulletin of the Tomsk Polytechnic University, Geo Assets Engineering;journal;24131830, 25001019;0.203;Q3;13;144;180;3830;58;180;0.32;26.6;Russian Federation;Eastern Europe;Tomsk Polytechnic University;2015-2021;"Economic Geology (Q3); Fuel Technology (Q3); Geotechnical Engineering and Engineering Geology (Q3); Materials Science (miscellaneous) (Q3); Waste Management and Disposal (Q3); Management, Monitoring, Policy and Law (Q4)"
996;5000160301;Environmental Quality Management;journal;15206483, 10881913;0.203;Q3;30;31;85;1206;39;84;0.34;38.9;United States;Northern America;"John Wiley &amp; Sons Inc.";1991-2021;"Pollution (Q3); Waste Management and Disposal (Q3); Management, Monitoring, Policy and Law (Q4); Public Health, Environmental and Occupational Health (Q4)"
997;19700170455;Journal of Natural Resources Policy Research;journal;19390467, 19390459;0.203;Q4;16;0;74;0;44;68;0.73;0;United Kingdom;Western Europe;Routledge;2008-2015;"Geography, Planning and Development (Q3); Management, Monitoring, Policy and Law (Q4)"
998;13018;Pirineos;journal;19884281, 03732568;0.203;Q4;14;9;24;451;14;24;0.75;50.11;Spain;Western Europe;CSIC Consejo Superior de Investigaciones Cientificas;1973, 1981-2002, 2004-2021;"Ecology (Q4); Ecology, Evolution, Behavior and Systematics (Q4)"
999;56524;Ecological Restoration;journal;15434079, 15224740;0.202;Q4;31;40;123;1252;45;105;0.4;31.3;United States;Northern America;University of Wisconsin Press;1999-2021;Nature and Landscape Conservation (Q4)
1000;5000157301;Transactions of the Royal Society of South Africa;journal;0035919X, 21540098;0.202;Q3;26;19;55;1410;34;53;0.79;74.21;United Kingdom;Western Europe;Taylor and Francis Ltd.;1909-1910, 1913-1915, 1917-1919, 1921-1926, 1928-1940, 1942-1943, 1945-1949, 1951, 1954-1964, 1967-1972, 1974-1990, 1992-2021;"Agricultural and Biological Sciences (miscellaneous) (Q3); Earth and Planetary Sciences (miscellaneous) (Q3); Environmental Science (miscellaneous) (Q3); Medicine (miscellaneous) (Q3); Multidisciplinary (Q3)"
1001;25553;Allgemeine Forst- und Jagdzeitung;journal;00025852;0.201;Q4;24;0;58;0;29;55;0.42;0;Germany;Western Europe;J.D. Sauerlander Verlag;1977-1978, 1981, 1983-1989, 1996-2015, 2017;"Forestry (Q3); Ecology (Q4)"
1002;21100226810;Journal of Hohai University;journal;10001980;0.201;Q3;11;88;294;1539;82;294;0.26;17.49;China;Asiatic Region;Editorial Board of Journal of Hohai University;2012-2021;"Earth and Planetary Sciences (miscellaneous) (Q3); Water Science and Technology (Q3)"
1003;21100224446;Neotropical Biology and Conservation;journal;22363777, 18099939;0.201;Q4;10;26;69;1121;32;65;0.42;43.12;Brazil;Latin America;Unisinos;2012-2021;Nature and Landscape Conservation (Q4)
1004;21100238408;Scientific Review Engineering and Environmental Sciences;journal;17329353;0.201;Q3;7;46;113;847;19;113;0.16;18.41;Poland;Eastern Europe;Warsaw University of Life Sciences Press;2013-2021;"Building and Construction (Q3); Environmental Science (miscellaneous) (Q3); Geotechnical Engineering and Engineering Geology (Q3); Civil and Structural Engineering (Q4); Earth-Surface Processes (Q4)"
