Rank;Sourceid;Title;Type;Issn;SJR;SJR Best Quartile;H index;Total Docs. (2007);Total Docs. (3years);Total Refs.;Total Cites (3years);Citable Docs. (3years);Cites / Doc. (2years);Ref. / Doc.;Country;Publisher;Coverage;Categories
3000;5800222015;Bilingual Research Journal;journal;15235882, 15235890;0.106;Q3;32;0;90;0;24;90;0.21;0.00;United States;Routledge;1992-2006, 2009-ongoing;"Language and Linguistics (Q3); Linguistics and Language (Q3); Education (Q4)"
3001;145411;Centro Journal;journal;15386279;0.106;Q4;11;30;46;1196;3;44;0.07;39.87;United States;Hunter College Center for Puerto Rican Studies;2005-ongoing;"Arts and Humanities (miscellaneous) (Q4); Social Sciences (miscellaneous) (Q4)"
3002;13201;Communication Law and Policy;journal;10811680;0.106;Q4;9;11;34;635;7;32;0.22;57.73;United States;Lawrence Erlbaum Associates Inc.;2005-ongoing;"Communication (Q4); Law (Q4)"
3003;16400154753;Contemporary French and Francophone Studies;journal;17409292;0.106;Q3;7;55;131;556;4;118;0;10.11;United Kingdom;Taylor & Francis;1997-ongoing;"Literature and Literary Theory (Q2); Visual Arts and Performing Arts (Q2); Cultural Studies (Q3); History (Q3)"
3004;16000154789;Exemplaria;journal;10412573, 17533074;0.106;Q3;9;21;44;954;8;44;0.15;45.43;United Kingdom;Maney Publishing;1989-1995, 2002-ongoing;"Literature and Literary Theory (Q2); Cultural Studies (Q3); Language and Linguistics (Q3); Linguistics and Language (Q3)"
3005;28656;Geografski Vestnik;journal;03503895;0.106;Q4;8;18;47;483;9;47;0.21;26.83;Slovenia;Association of Geographical Societies of Slovenia;1992-ongoing;"Earth-Surface Processes (Q4); Geography, Planning and Development (Q4)"
3006;5600157635;ICER 2006 - Proceedings of the 2nd International Computing Education Research Workshop;conference and proceedings;00002006;0.106;-;11;0;14;0;20;13;1.54;0.00;United States;;2006;"Computer Science (miscellaneous); Education"
3007;4700152808;Journal of Pharmacy Teaching;journal;10440054;0.106;Q4;3;12;23;214;2;20;0.1;17.83;United States;Haworth Press Inc.;2005-2007;Education (Q4)
3008;6000169412;Journal of the Southwest;journal;08948410;0.106;Q3;9;20;67;462;4;67;0.05;23.10;United States;University of Arizona;2001-ongoing;"Literature and Literary Theory (Q2); Cultural Studies (Q3); History (Q3); Anthropology (Q4)"
3009;23075;Langages;journal;0458726X;0.106;Q3;12;33;105;710;23;103;0.2;21.52;France;Armand Colin Editeur;1976, 2002-ongoing;"Language and Linguistics (Q3); Linguistics and Language (Q3)"
3010;4700152636;Mind and Society;journal;15937879;0.106;Q3;15;12;12;521;6;11;0.55;43.42;Germany;Springer Verlag;2006-ongoing;"Cultural Studies (Q3); History (Q3); Philosophy (Q3); Economics, Econometrics and Finance (miscellaneous) (Q4); Experimental and Cognitive Psychology (Q4); Social Psychology (Q4); Social Sciences (miscellaneous) (Q4); Sociology and Political Science (Q4)"
3011;5600157602;Proceedings of the 7th ACM SIG-Information Technology Education Conference, SIGITE 2006;conference and proceedings;00002006;0.106;-;6;0;31;0;5;30;0.17;0.00;United States;;2006;"Education; Information Systems"
3012;25715;Railway Age;trade journal;00338826;0.106;Q4;3;82;394;0;2;294;0.01;0.00;United States;Simmons-Boardman Publishing Corp.;1972-1978, 1981, 1983-1988, 1996-1999, 2001-2007;"Ocean Engineering (Q3); Mechanical Engineering (Q4); Transportation (Q4)"
3013;18394;Rutgers Law Review;journal;00360465;0.106;Q4;14;28;77;4348;7;77;0.08;155.29;United States;Rutgers University;1973, 1975-1977, 1981-1982, 1985, 1987-1990, 1992-1994, 1996-ongoing;Law (Q4)
3014;22771;Wisconsin Law Review;journal;0043650X;0.106;Q4;24;23;106;7676;19;99;0.13;333.74;United States;University of Wisconsin at Madison;1976, 1978-1982, 1984-1985, 1987, 1990, 1992-1993, 1995-ongoing;Law (Q4)
3015;5700154181;Zeitschrift fur Deutsche Philologie;journal;00442496;0.106;Q3;5;23;68;1425;2;67;0.04;61.96;Germany;Erich Schmidt Verlag GmbH & Co.;2002-2012, 2017-ongoing;"Literature and Literary Theory (Q2); Language and Linguistics (Q3); Linguistics and Language (Q3)"
3016;21100199708;AISB'05 Convention: Social Intelligence and Interaction in Animals, Robots and Agents - Proc. of the 2nd International Symposium on the Emergence and Evolution of Linguistic Communication, EELC'05;conference and proceedings;00002005;0.105;-;4;0;24;0;9;21;0.43;0.00;United Kingdom;;2005;"Language and Linguistics; Linguistics and Language"
3017;16100154742;Annual of the British School at Athens;journal;00682454;0.105;Q3;18;12;39;971;3;39;0;80.92;United Kingdom;Cambridge University Press;1894, 1896-1914, 1916, 1918-1921, 1923, 1925-1928, 1930-1940, 1945, 1947-1957, 1959-ongoing;"Visual Arts and Performing Arts (Q2); Archeology (Q3); Archeology (arts and humanities) (Q3); Classics (Q3); History (Q3)"
3018;6500153206;Archaeological Reports;journal;05706084;0.105;Q3;8;41;6;0;3;6;0.5;0.00;United Kingdom;Cambridge University Press;1955-ongoing;"Archeology (Q3); Archeology (arts and humanities) (Q3); Classics (Q3)"
3019;25590;British Journal of Middle Eastern Studies;journal;14693542, 13530194;0.105;Q4;20;17;30;1384;7;28;0.22;81.41;United Kingdom;Carfax Publishing Ltd.;1992-ongoing;"History (Q3); Earth-Surface Processes (Q4); Geography, Planning and Development (Q4)"
3020;16100154791;Comparative Literature Studies;journal;15284212, 00104132;0.105;Q3;12;18;78;565;12;75;0.11;31.39;United States;Pennsylvania State University Press;2002-ongoing;"Literature and Literary Theory (Q2); Cultural Studies (Q3)"
3021;14200154735;Educational Assessment, Evaluation and Accountability;journal;18748597;0.105;Q4;23;25;29;763;2;26;0.08;30.52;Germany;Springer Verlag;2009-ongoing;"Education (Q4); Organizational Behavior and Human Resource Management (Q4)"
3022;24525;Ethics and International Affairs;journal;08926794;0.105;Q4;44;32;79;1146;99;75;1.27;35.81;United Kingdom;Cambridge University Press;1987-ongoing;"Philosophy (Q3); Political Science and International Relations (Q4)"
3023;145266;Ethnic Studies Report;journal;10105832;0.105;Q3;1;0;4;0;0;4;0;0.00;Sri Lanka;International Centre for Ethnic Studies;2003-2004;"Cultural Studies (Q3); Political Science and International Relations (Q4); Psychology (miscellaneous) (Q4); Social Sciences (miscellaneous) (Q4)"
3024;84532;Ethnologia Europaea;journal;16043030, 04254597;0.105;Q3;11;14;55;296;3;55;0.03;21.14;Denmark;Ethnologia Europaea;1987, 2002-ongoing;"Cultural Studies (Q3); Anthropology (Q4); Arts and Humanities (miscellaneous) (Q4)"
3025;23632;Frontiers;journal;15360334, 01609009;0.105;Q4;19;21;88;1620;18;83;0.33;77.14;United States;University of Nebraska Press;1978-1979, 1981, 1983, 1986, 1996-2016 (cancelled);"Arts and Humanities (miscellaneous) (Q4); Gender Studies (Q4)"
3026;21100370222;Griffith Law Review;journal;18394205, 10383441;0.105;Q4;11;0;42;0;2;40;0.04;0.00;United Kingdom;Taylor and Francis Ltd.;2003-2006, 2008-ongoing;Law (Q4)
3027;5000157110;Journal of Ecology and Rural Environment;journal;16734831;0.105;Q4;13;82;155;1291;8;155;0.05;15.74;China;China Environmental Science Press;2006-ongoing;"Agronomy and Crop Science (Q4); Development (Q4)"
3028;21100456706;Journal of Intelligence History;journal;16161262, 21695601;0.105;Q4;3;7;4;159;0;4;0;22.71;United Kingdom;Taylor and Francis Ltd.;2015-ongoing;"History (Q3); Political Science and International Relations (Q4)"
3029;5000153501;Law, Science and Policy;journal;14755335;0.105;Q4;4;6;4;190;2;4;0.5;31.67;United Kingdom;A B Academic Publishers;2006-2007, 2010;"Law (Q4); Management, Monitoring, Policy and Law (Q4); Public Health, Environmental and Occupational Health (Q4)"
3030;28928;Northeast African Studies;journal;15356574, 07409133;0.105;Q3;6;0;5;0;0;4;0;0.00;United States;African Studies Center, Michigan State University;1985, 2000-2002, 2004, 2011-ongoing;"Cultural Studies (Q3); History (Q3)"
3031;21100266585;Proceedings of the IASTED International Conference on Web-Based Education, WBE 2005;conference and proceedings;00002005;0.105;-;6;0;121;0;22;120;0.18;0.00;Canada;;2005;"Computer Networks and Communications; Education"
3032;4100151502;Psychologie du Travail et des Organisations;journal;14202530;0.105;Q4;8;0;48;0;0;42;0;0.00;France;Elsevier Masson SAS;2005-2006, 2008-ongoing;"Human Factors and Ergonomics (Q4); Social Psychology (Q4)"
3033;5800169479;Representation;journal;17494001, 00344893;0.105;Q4;21;24;74;561;24;69;0.32;23.38;United Kingdom;Taylor and Francis Ltd.;1960-1986, 1988-ongoing;Sociology and Political Science (Q4)
3034;18390;Russian Politics and Law;journal;10611940;0.105;Q4;8;34;93;474;2;80;0.02;13.94;United States;M.E. Sharpe Inc.;1992-ongoing;"Law (Q4); Sociology and Political Science (Q4)"
3035;12100155623;The Forum for Social Economics;journal;07360932;0.105;Q4;6;0;4;0;1;4;0;0.00;United States;Taylor and Francis Inc.;1971, 1975-1998, 2004, 2012-2014, 2016-ongoing;"Economics and Econometrics (Q4); Sociology and Political Science (Q4)"
3036;21683;University of Pittsburgh Law Review;journal;00419915;0.105;Q4;14;18;68;5198;4;68;0.07;288.78;United States;University of Pittsburgh Press;1973-1975, 1977, 1979-1980, 1982, 1985, 1987, 1989, 1991, 1993-1994, 1996-ongoing;Law (Q4)
3037;29797;Vestnik Moskovskogo Unviersiteta, Seriya Geografiya;journal;05799414;0.105;Q4;7;68;173;998;6;173;0.05;14.68;Russian Federation;Izdatel'stvo Moskovskogo Gosudarstvennogo Universiteta im.M.V.Lomonosova/Publishing House of Moscow State University;1978-1993, 1995-ongoing;"Agricultural and Biological Sciences (miscellaneous) (Q4); Earth and Planetary Sciences (miscellaneous) (Q4); Geography, Planning and Development (Q4)"
3038;5900152783;Visual Studies;journal;1472586X, 14725878;0.105;Q3;35;20;42;819;33;38;1;40.95;United Kingdom;Routledge;2002-ongoing;"Visual Arts and Performing Arts (Q2); Cultural Studies (Q3); Anthropology (Q4)"
3039;17500154727;Word of Mouth;journal;10483950;0.105;Q4;1;0;4;0;0;4;0;0.00;United Kingdom;SAGE Publications;1990, 1992-1999, 2005-2006, 2008-ongoing;Education (Q4)
3040;31610;Working Paper of the University of Leeds, School of Geography;journal;-;0.105;Q4;4;1;4;50;0;4;0;50.00;United Kingdom;University of Leeds;1984-2003, 2005-2013, 2015;"Earth and Planetary Sciences (miscellaneous) (Q4); Geography, Planning and Development (Q4); Water Science and Technology (Q4)"
3041;17300154814;Worldviews: Environment, Culture, Religion;journal;13635247, 15685357;0.105;Q3;12;15;61;578;8;57;0.19;38.53;Netherlands;Brill;1997-ongoing;"Cultural Studies (Q3); Philosophy (Q3); Religious Studies (Q3); Ecology (Q4); Geography, Planning and Development (Q4); Management, Monitoring, Policy and Law (Q4)"
3042;12100157183;2006 IEEE Symposium on Product Safety Engineering, PSES;conference and proceedings;00002006;0.104;-;1;0;7;0;2;6;0.33;0.00;United States;;2006;"Safety Research; Safety, Risk, Reliability and Quality"
3043;11900154331;7th International Conference on Information Technology Based Higher Education and Training, ITHET;conference and proceedings;00002006;0.104;-;8;0;136;0;16;134;0.12;0.00;United States;;2006;"Computer Science Applications; Education"
3044;26926;African Studies Review;journal;00020206;0.104;Q3;40;30;74;1333;29;74;0.4;44.43;United Kingdom;Cambridge University Press;1962-1963, 1965-1980, 1982, 1984-ongoing;"Cultural Studies (Q3); Anthropology (Q4)"
3045;21100828958;Capital Markets Law Journal;journal;17507227, 17507219;0.104;Q4;5;0;7;0;0;6;0;0.00;United Kingdom;Oxford University Press;2006, 2014-ongoing;"Finance (Q4); Law (Q4)"
3046;5800169373;Comparative Strategy;journal;01495933, 15210448;0.104;Q4;15;22;57;288;18;57;0.33;13.09;United Kingdom;Routledge;1978-ongoing;Political Science and International Relations (Q4)
3047;21100218355;GEOINFO 2005 - 7th Brazilian Symposium on GeoInformatics;conference and proceedings;00002005;0.104;-;4;0;32;0;1;31;0.03;0.00;Portugal;;2005;"Geography, Planning and Development; Information Systems"
3048;6000195384;GIS-Zeitschrift fr Geoinformatik;journal;18699391;0.104;Q4;4;32;7;336;0;6;0;10.50;Germany;Wichmann Verlag;2006-2014;"Geography, Planning and Development (Q4); Information Systems (Q4)"
3049;14306;Harvard Journal on Legislation;journal;0017808X;0.104;Q4;15;16;45;3900;6;39;0.08;243.75;United States;Harvard University, Law School, Publication Center;1975, 1978-1979, 1983, 1987-1992, 1996-ongoing;Law (Q4)
3050;4700152715;Horizontes Antropologicos;journal;01047183;0.104;Q4;11;14;20;575;1;19;0.05;41.07;Brazil;Universidade Federal do Rio Grande do Sul;2006-ongoing;Anthropology (Q4)
3051;17352;IMF Occasional Papers;journal;02516365;0.104;Q4;18;20;52;356;5;44;0.11;17.80;United States;International Monetary Fund;1991-2011, 2013;"Development (Q4); Geography, Planning and Development (Q4)"
3052;145329;International Journal of Discrimination and the Law;journal;13582291;0.104;Q4;7;12;28;330;2;27;0.07;27.50;United States;SAGE Publications;2000, 2005-2009, 2011-ongoing;"Law (Q4); Sociology and Political Science (Q4)"
3053;85495;Jenda;journal;15305686;0.104;Q3;7;0;47;0;2;35;0.07;0.00;United States;Africa Resource Center;2001-2006;"Cultural Studies (Q3); Gender Studies (Q4); Sociology and Political Science (Q4)"
3054;5300152608;Journal of Agriculture and Rural Development in the Tropics and Subtropics, Supplement;journal;16138422;0.104;Q4;3;0;151;0;4;147;0;0.00;Germany;Kassel University Press GmbH;2003-2006;"Agronomy and Crop Science (Q4); Animal Science and Zoology (Q4); Development (Q4); Forestry (Q4); Geography, Planning and Development (Q4)"
3055;5700161675;Journal of Language and Politics;journal;15699862, 15692159;0.104;Q3;23;24;66;1080;35;64;0.56;45.00;Netherlands;John Benjamins Publishing Company;2008-ongoing;"History (Q3); Linguistics and Language (Q3); Sociology and Political Science (Q4)"
3056;4700152421;Journal of Lesbian Studies;journal;15403548, 10894160;0.104;Q4;26;28;98;824;6;95;0.08;29.43;United States;Haworth Press Inc.;1996-ongoing;"Gender Studies (Q4); Medicine (miscellaneous) (Q4)"
3057;17600155208;Journal of South Asian Development;journal;09731741;0.104;Q4;11;10;5;446;3;5;0.6;44.60;India;Sage Publications India Pvt Ltd.;2006-2007, 2009-ongoing;"History (Q3); Business and International Management (Q4); Development (Q4); Economics, Econometrics and Finance (miscellaneous) (Q4); Social Sciences (miscellaneous) (Q4)"
3058;21100198407;Learning by Effective Utilization of Technologies: Facilitating Intercultural Understanding, Proceeding of the 14th International Conference on Computers in Education, ICCE 2006;conference and proceedings;00002006;0.104;-;5;0;113;0;27;111;0.24;0.00;Taiwan;;2006;"Computer Networks and Communications; Education"
3059;21100244603;Lecture Notes in Geoinformation and Cartography;book series;18632351, 18632246;0.104;Q4;31;122;83;2096;6;80;0.08;17.18;Switzerland;Springer International Publishing AG;2006-ongoing;"Civil and Structural Engineering (Q4); Computers in Earth Sciences (Q4); Earth-Surface Processes (Q4); Geography, Planning and Development (Q4)"
3060;13964;Library;journal;00242160;0.104;Q4;11;16;45;835;9;39;0.16;52.19;United Kingdom;Oxford University Press;1889-1899, 1901-1964, 1966-ongoing;"Arts and Humanities (miscellaneous) (Q4); Library and Information Sciences (Q4)"
3061;29905;New Zealand Journal of Geography;journal;00288292;0.104;Q4;6;0;7;0;0;6;0;0.00;New Zealand;New Zealand Geographical Society Inc.;1978-1983, 1985, 1988-2004;"Earth and Planetary Sciences (miscellaneous) (Q4); Geography, Planning and Development (Q4)"
3062;64154;NII Journal;journal;13459996;0.104;Q4;5;0;6;0;0;6;0;0.00;Japan;Kokuritsu Johogaku Kenkyujo;2000-2004;Library and Information Sciences (Q4)
3063;7200153103;Nordic Journal of International Law;journal;09027351, 15718107;0.104;Q4;12;18;7;2135;0;6;0;118.61;Netherlands;Martinus Nijhoff Publishers;2006-ongoing;"Law (Q4); Political Science and International Relations (Q4)"
3064;5800207548;NOWELE;journal;09008675;0.104;Q3;8;17;43;687;6;42;0.13;40.41;Netherlands;John Benjamins Publishing Company;2011-ongoing;"Language and Linguistics (Q3); Linguistics and Language (Q3)"
3065;11200153525;Perioperative Nursing Clinics;journal;15567931;0.104;Q4;6;50;45;735;1;37;0.03;14.70;Netherlands;Elsevier BV;2006-2012;"Medical and Surgical Nursing (Q4); Psychology (miscellaneous) (Q4); Social Sciences (miscellaneous) (Q4)"
3066;21100793178;Psicoperspectivas;journal;07186924;0.104;Q4;10;9;6;58;0;6;0;6.44;Chile;Pontificia Universidad Catolica de Valparaiso;2006-ongoing;"Psychology (miscellaneous) (Q4); Social Sciences (miscellaneous) (Q4)"
3067;16910;Public Roads;trade journal;00333735;0.104;Q4;10;31;103;13;8;103;0.07;0.42;United States;US Federal Highway Administration;1969-1990, 1992-ongoing;"Civil and Structural Engineering (Q4); Geography, Planning and Development (Q4); Transportation (Q4)"
3068;68289;Revue du Nord;journal;00352624;0.104;Q3;5;31;113;849;9;112;0.04;27.39;France;Universite de Lille;1969-1970, 1972, 1974, 1977-1979, 1981-1985, 1988, 2001-ongoing;"Archeology (Q3); Archeology (arts and humanities) (Q3); History (Q3)"
3069;17700156406;Revue Internationale de Droit Economique;journal;10108831, 17821525;0.104;Q4;6;18;46;1389;5;44;0.03;77.17;Belgium;De Boeck & Larcier;2001-ongoing;"Business and International Management (Q4); Economics, Econometrics and Finance (miscellaneous) (Q4); Law (Q4)"
3070;29858;Revue Numismatique;journal;04848942;0.104;Q3;6;11;47;404;3;47;0.09;36.73;France;Societe Francaise de Numismatique;1985, 2002-2007, 2009-ongoing;"Archeology (Q3); Archeology (arts and humanities) (Q3)"
3071;78476;Rheinisches Museum fur Philologie;journal;0035449X;0.104;Q3;7;19;66;1401;3;64;0.03;73.74;Germany;J. D. Sauerlander;1971-1972, 1974, 1976-1978, 1981-1982, 1986, 2002-2012;"Literature and Literary Theory (Q2); Classics (Q3); Language and Linguistics (Q3); Linguistics and Language (Q3)"
3072;27649;Sbornik Ceske Geograficke Spolecnosti;journal;1210115X;0.104;Q4;20;23;77;862;4;69;0.02;37.48;Czech Republic;Ceska Geograficka Spolecnost;1992-ongoing;"Earth-Surface Processes (Q4); Geography, Planning and Development (Q4)"
3073;5800207568;Scando-Slavica;journal;00806765;0.104;Q3;6;6;14;114;2;14;0;19.00;United Kingdom;Routledge;1954, 1956-1995, 1997-ongoing;"Literature and Literary Theory (Q2); Archeology (arts and humanities) (Q3); Cultural Studies (Q3); History (Q3); Language and Linguistics (Q3)"
3074;5800207868;Sign Language & Linguistics;journal;13879316;0.104;Q3;18;14;37;349;1;29;0;24.93;Netherlands;John Benjamins & HAG Publications;2002-ongoing;"Language and Linguistics (Q3); Linguistics and Language (Q3)"
3075;27224;Social theory and practice;journal;0037802X;0.104;Q4;5;0;5;0;0;5;0;0.00;United States;Florida State University;1974-1977, 1981-1982, 1984, 1987-1991, 1995, 1997, 2000-2001, 2003-2006;"Medicine (miscellaneous) (Q4); Social Sciences (miscellaneous) (Q4)"
3076;6700153398;Television Quarterly;journal;00402796;0.104;Q4;3;27;70;0;2;67;0.03;0.00;United States;National Academy of Television Arts and Sciences;2004-2008, 2010;"Visual Arts and Performing Arts (Q2); Communication (Q4)"
3077;5800207391;The Journal of Adult Protection;journal;14668203;0.104;Q4;15;27;74;238;25;66;0.43;8.81;United Kingdom;Emerald Group Publishing Ltd.;1999-ongoing;"Law (Q4); Sociology and Political Science (Q4)"
3078;20872;Transportation Quarterly;journal;02789434;0.104;Q4;18;2;14;0;0;5;0;0.00;United States;Eno Transportation Foundation;1982-2003, 2006-2007;Transportation (Q4)
3079;5800207608;Travaux de Linguistique;journal;00826049;0.104;Q3;4;2;6;22;0;5;0;11.00;Belgium;De Boeck & Larcier;2001-ongoing;"Language and Linguistics (Q3); Linguistics and Language (Q3)"
3080;84979;Tsukuba Daigaku Jinbun Chirigaku Kenkyu;journal;03860183;0.104;Q4;2;0;5;0;0;5;0;0.00;Japan;Tsukuba Daigaku Chikyu Kagakukei;1990-1991, 1999-2000, 2002-2004;Geography, Planning and Development (Q4)
3081;5800172539;Virginia Quarterly Review;journal;0042675X;0.104;Q4;5;33;152;0;6;144;0.06;0.00;United States;University of Virginia;1970, 1978-1979, 1981, 1987-1988, 2002-ongoing;"Literature and Literary Theory (Q2); Visual Arts and Performing Arts (Q2); Sociology and Political Science (Q4)"
3082;21100239628;Workshop on Approaches and Applications of Inductive Programming, AAIP 2005 - In Conjunction with the 22nd International Conference on Machine Learning, ICML 2005;conference and proceedings;00002005;0.104;-;0;0;8;0;0;6;0;0.00;Germany;;2005;"Education; Software"
3083;5700164344;Youth Justice;journal;14732254;0.104;Q4;23;6;32;178;13;27;0.57;29.67;United States;SAGE Publications;2001-ongoing;"Developmental and Educational Psychology (Q4); Law (Q4)"
3084;21100334896;3rd International Workshop on Online Dispute Resolution, in Conjunction with the 18th Annual Conference on Legal Knowledge and Information System, JURIX 2005;conference and proceedings;00002005;0.103;-;1;0;8;0;2;7;0.29;0.00;Netherlands;;2005;Public Administration
3085;21100338342;8th IFIP World Conference on Computers in Education, WCCE 2005;conference and proceedings;00002005;0.103;-;5;0;228;0;10;227;0.04;0.00;United Kingdom;;2005;"Computer Science (miscellaneous); Education"
3086;19600157337;Acta Comeniana;journal;02315955;0.103;Q3;2;13;9;710;0;8;0;54.62;Czech Republic;Ceska Akademie Verlag;2005, 2007, 2009-ongoing;"Cultural Studies (Q3); History (Q3); Religious Studies (Q3); Education (Q4); Philosophy (Q4)"
3087;12622;Albany law review;journal;00024678;0.103;Q4;5;1;8;0;0;8;0;0.00;United States;Albany Law School;1973-1977, 1979, 1981-1982, 1992, 1994, 1996, 1999-2000, 2002-ongoing;Law (Q4)
3088;12669;American Bankruptcy Law Journal;journal;00279048;0.103;Q4;13;16;51;2235;4;50;0.05;139.69;United States;National Conference of Bankruptcy Judges;1996-2011, 2014-ongoing;"Business, Management and Accounting (miscellaneous) (Q4); Law (Q4)"
3089;19343;Archives of Natural History;journal;02609541;0.103;Q4;7;0;7;0;0;7;0;0.00;United Kingdom;Edinburgh University Press;1981-1983, 1985-1989, 1991-1992, 1994, 1996, 1998-2004, 2006, 2008-ongoing;"History (Q3); Agricultural and Biological Sciences (miscellaneous) (Q4); Anthropology (Q4)"
3090;19700182705;Asia and Pacific Studies;journal;17326761;0.103;Q4;2;5;7;112;0;7;0;22.40;Poland;Warsaw University;2006-2008;Political Science and International Relations (Q4)
3091;12822;Chinese Education and Society;journal;10611932;0.103;Q4;12;51;152;465;12;140;0.11;9.12;United States;M.E. Sharpe Inc.;1993-1997, 1999-ongoing;"Education (Q4); Sociology and Political Science (Q4)"
3092;17700155038;Droit et Societe;journal;19696973, 07693362;0.103;Q4;12;29;78;1209;5;73;0.06;41.69;France;Librairie Generale de Droit et de Jurisprudence;2001-ongoing;"Law (Q4); Sociology and Political Science (Q4)"
3093;21100201540;Economia Agraria y Recursos Naturales;journal;15780732;0.103;Q4;7;0;7;0;0;7;0;0.00;Spain;Associacion Espanola de Economia Agraria;2011-ongoing;"Agricultural and Biological Sciences (miscellaneous) (Q4); Environmental Science (miscellaneous) (Q4); Geography, Planning and Development (Q4)"
3094;20362;Electronic Green Journal;journal;10767975;0.103;Q4;10;6;29;72;0;25;0;12.00;United States;University of Idaho Library;2001-ongoing;Geography, Planning and Development (Q4)
3095;94694;ERD Technical Note Series;book series;16555236;0.103;Q4;3;5;8;200;0;8;0;40.00;Philippines;Asian Development Bank;2002, 2005-2007;Geography, Planning and Development (Q4)
3096;28862;Essays in Education;journal;15279359;0.103;Q4;8;32;104;881;2;104;0;27.53;United States;Columbia College;2002-2008;Education (Q4)
3097;23132;Estudos Feministas;journal;18069584, 0104026X;0.103;Q4;13;44;31;905;1;30;0.03;20.57;Brazil;Universidade Federal de Santa Catarina;1994-1995, 2006-ongoing;Gender Studies (Q4)
3098;28735;Geographie et Cultures;book series;11650354;0.103;Q3;8;18;110;391;9;101;0.03;21.72;France;L'Harmattan;1996-2007, 2013-2015;"Cultural Studies (Q3); Geography, Planning and Development (Q4)"
3099;60486;Himalaya;journal;19352212;0.103;Q4;8;0;9;0;0;8;0;0.00;United States;Nepal Studies Association;1981, 2006, 2008-2011, 2013-ongoing;Social Sciences (miscellaneous) (Q4)
3100;27755;Japanese Journal of Legal Medicine;journal;00471887;0.103;Q4;13;3;22;76;2;22;0;25.33;Japan;Nippon Hoi Gakkai;1961-ongoing;"Health Policy (Q4); Law (Q4); Medicine (miscellaneous) (Q4)"
3101;5800207564;Journal of French Language Studies;journal;09592695;0.103;Q3;18;12;50;476;32;50;0.44;39.67;United Kingdom;Cambridge University Press;1991-ongoing;"Language and Linguistics (Q3); Linguistics and Language (Q3)"
3102;5800207582;Journal of Germanic Linguistics;journal;14753014, 14705427;0.103;Q3;14;8;26;308;11;26;0.63;38.50;United Kingdom;Cambridge University Press;2001-2007, 2009-ongoing;"Literature and Literary Theory (Q2); Language and Linguistics (Q3); Linguistics and Language (Q3)"
3103;28811;Journal of health care chaplaincy;journal;15286916, 08854726;0.103;Q4;15;0;7;0;1;7;0;0.00;United States;The Haworth Pastoral Press;1987-1994, 1997-2002, 2004, 2008, 2010-ongoing;"Religious Studies (Q3); Clinical Psychology (Q4); Health (social science) (Q4)"
3104;7600153124;Journal of Hunger and Environmental Nutrition;journal;19320248, 19320256;0.103;Q4;22;12;15;267;1;13;0.08;22.25;United States;Haworth Press Inc.;2006-ongoing;"Health (social science) (Q4); Nutrition and Dietetics (Q4); Public Health, Environmental and Occupational Health (Q4)"
3105;19700183010;Journal of International Commercial Law and Technology;journal;19018401;0.103;Q4;8;27;8;811;1;8;0.13;30.04;Denmark;International Association of IT Lawyers;2006-2015;"Computer Science (miscellaneous) (Q4); Law (Q4)"
3106;24809;Journal of Memetics;journal;13664786;0.103;Q4;12;0;8;0;2;7;0;0.00;United Kingdom;Manchester Metropolitan University;1997-2005;"Philosophy (Q3); Anthropology (Q4); Artificial Intelligence (Q4); Ecology, Evolution, Behavior and Systematics (Q4)"
3107;21100773741;Journal of Policing, Intelligence and Counter Terrorism;journal;18335330, 21595364;0.103;Q4;9;12;8;273;0;7;0;22.75;United Kingdom;Taylor and Francis Ltd.;2006-2013, 2016-ongoing;"Law (Q4); Political Science and International Relations (Q4)"
