Rank;Sourceid;Title;Type;Issn;SJR;SJR Best Quartile;H index;Total Docs. (2013);Total Docs. (3years);Total Refs.;Total Cites (3years);Citable Docs. (3years);Cites / Doc. (2years);Ref. / Doc.;Country;Publisher;Coverage;Categories
549;19700182128;Nanotechnology 2010: Bio Sensors, Instruments, Medical, Environment and Energy - Technical Proceedings of the 2010 NSTI Nanotechnology Conference and Expo, NSTI-Nanotech 2010;conference and proceedings;00002010;0.124;-;4;0;219;0;15;218;0;0;United States;;2010;"Bioengineering; Biomedical Engineering; Electrical and Electronic Engineering"
550;15191;O Papel (Brazil);trade journal;00311057;0.124;Q4;9;121;209;346;14;209;0.06;2.86;Brazil;Associacao Brasileira Tecnica de Celulose e Papel;1996-2013;"Media Technology (Q2); Industrial and Manufacturing Engineering (Q3); Chemical Engineering (miscellaneous) (Q4); Chemistry (miscellaneous) (Q4); Materials Science (miscellaneous) (Q4)"
551;19900191864;8th WSEAS Intl. Conf. on Fluid Mechanics, FM'11, 8th WSEAS Intl. Conf. on Heat and Mass Transfer, HMT'11, 8th WSEAS Intl. Conf. on Mathematical Biology and Ecology, MABE'11;conference and proceedings;00002011;0.123;-;4;0;26;0;2;24;0.08;0;United States;;2011;Fluid Flow and Transfer Processes
552;19500157807;Advances in Natural and Applied Sciences;journal;19950772;0.123;Q4;17;0;367;0;306;366;0.48;0;Jordan;American-Eurasian Network for Scientific Information Publications(AENSI);2009-2012;"Agricultural and Biological Sciences (miscellaneous) (Q4); Biochemistry, Genetics and Molecular Biology (miscellaneous) (Q4); Chemical Engineering (miscellaneous) (Q4); Engineering (miscellaneous) (Q4)"
553;21100817149;11th International Conference on Autonomous Agents and Multiagent Systems 2012, AAMAS 2012: Innovative Applications Track;conference and proceedings;00002012;0.122;-;0;0;1;0;0;1;0;0;United States;;2012;"Chemical Engineering (miscellaneous); Industrial and Manufacturing Engineering"
554;19700173317;2010 International Conference on Biosciences, BioSciencesWorld 2010;conference and proceedings;00002010;0.122;-;5;0;27;0;16;25;0;0;United States;;2010;"Biochemistry; Bioengineering; Biotechnology"
555;21100228003;AIChE 2012 - 2012 AIChE Annual Meeting, Conference Proceedings;conference and proceedings;00002012;0.122;-;0;0;1;0;0;1;0;0;United States;;2012;Chemical Engineering (miscellaneous)
556;21100773771;AIChE Annual Meeting, Conference Proceedings;conference and proceedings;00002010;0.122;-;0;0;1;0;0;1;0;0;United States;;2010;"Chemical Engineering (miscellaneous); Polymers and Plastics"
557;21100544498;Fluid Flows to Black Holes: A Tribute to S. Chandrasekhar on His Birth Centenary;conference and proceedings;00002011;0.122;-;1;0;3;0;0;1;0;0;Singapore;;2011;Fluid Flow and Transfer Processes
558;21100447815;International Journal of Automotive Engineering;journal;21850992, 21850984;0.122;Q4;4;0;1;0;0;1;0;0;Japan;Society of Automotive Engineers of Japan Inc;2015-ongoing;"Automotive Engineering (Q4); Fluid Flow and Transfer Processes (Q4); Human Factors and Ergonomics (Q4); Safety, Risk, Reliability and Quality (Q4)"
559;21100457109;International Proceedings of Chemical, Biological and Environmental Engineering;journal;20104618;0.122;Q4;1;0;1;0;0;1;0;0;Singapore;International Association of Computer Science & Information Technology;2012;"Chemical Engineering (miscellaneous) (Q4); Engineering (miscellaneous) (Q4); Environmental Science (miscellaneous) (Q4)"
560;21100331504;International Review of Aerospace Engineering;journal;19737459, 19737440;0.122;Q4;12;0;0;0;0;0;0;0;Italy;Praise Worthy Prize;2014-ongoing;"Aerospace Engineering (Q4); Control and Systems Engineering (Q4); Electrical and Electronic Engineering (Q4); Fluid Flow and Transfer Processes (Q4)"
561;68307;NPRA International Petrochemical Conference Papers;conference and proceedings;00002000, 00001999, 00002010, 00002002, 00002003, 00002008;0.122;-;1;0;1;0;0;1;0;0;United States;;1999-2000, 2002-2003, 2008, 2010;"Chemical Engineering (miscellaneous); Energy Engineering and Power Technology; Fuel Technology"
562;20119;Oilfield Chemistry;journal;10004092;0.122;Q4;11;106;231;434;22;231;0.07;4.09;China;Gaofenzi Yanjiusuo;1996-ongoing;"Energy Engineering and Power Technology (Q3); Chemical Engineering (miscellaneous) (Q4); Chemistry (miscellaneous) (Q4)"
563;21100775538;Proceedings of the IADIS International Conference WWW/Internet 2011, ICWI 2011;conference and proceedings;00002011;0.122;-;1;0;1;0;0;1;0;0;Portugal;;2011;"Chemical Engineering (miscellaneous); Mechanical Engineering; Physical and Theoretical Chemistry"
564;21100784728;Proceedings of the SICE Annual Conference;conference and proceedings;00002012;0.122;-;0;0;1;0;0;1;0;0;Japan;;2012;"Chemistry (miscellaneous); Management of Technology and Innovation; Process Chemistry and Technology"
565;14328;Suxing Gongcheng Xuebao/Journal of Plasticity Engineering;journal;10072012;0.121;Q4;11;148;460;1784;66;460;0.11;12.05;China;Zhongguo Jixie Gongcheng Xuehui Zhuzao;2001-ongoing;"Polymers and Plastics (Q3); Chemical Engineering (miscellaneous) (Q4); Materials Chemistry (Q4)"
566;13086;Institution of Chemical Engineers Symposium Series;conference and proceedings;00002005, 00002003, 00002006, 00001986, 00001969, 00002000, 00002008, 00001976, 00001990;0.119;-;14;0;201;0;18;196;0.09;0;United Kingdom;;1969, 1976-1986, 1990-2000, 2003, 2005-2006, 2008;"Chemical Engineering (miscellaneous); Engineering (miscellaneous)"
567;14457;International Journal of the Society of Materials Engineering for Resources;journal;13479725;0.119;Q4;10;6;52;79;13;52;0.45;13.17;Japan;Society of Materials Engineering for Resources for Japan;1993-2007, 2009-2014, 2016-ongoing;"Chemical Engineering (miscellaneous) (Q4); Materials Science (miscellaneous) (Q4); Mechanical Engineering (Q4)"
568;19700176045;17th International Colloquium Tribology 2010 - Solving Friction and Wear Problems;conference and proceedings;00002010;0.118;-;3;0;117;0;6;117;0;0;United States;;2010;"Colloid and Surface Chemistry; Process Chemistry and Technology; Surfaces and Interfaces"
569;19700181315;Emerging Techniques and Challenges for Hand-Based Biometrics, ETCHB 2010;conference and proceedings;00002010;0.118;-;8;0;20;0;10;18;0;0;United States;;2010;"Bioengineering; Biotechnology"
570;19900191926;International Conference on Theoretical and Applied Mechanics, International Conference on Fluid Mechanics and Heat and Mass Transfer - Proceedings;conference and proceedings;00002010;0.118;-;3;0;26;0;7;25;0;0;Greece;;2010;Fluid Flow and Transfer Processes
571;21100496560;Proceedings - 2010 WASE International Conference on Information Engineering, ICIE 2010;conference and proceedings;00002010;0.118;-;4;0;77;0;13;75;0;0;United States;;2010;Fluid Flow and Transfer Processes
572;5000158712;Synthesis Lectures on Biomedical Engineering;book series;19300328;0.118;Q4;7;5;13;401;4;12;0.25;80.2;United States;Morgan & Claypool Publishers;2005-ongoing;"Biochemistry (Q4); Bioengineering (Q4); Biomedical Engineering (Q4); Biotechnology (Q4)"
573;24081;Huaxue Fanying Gongcheng Yu Gongyi/Chemical Reaction Engineering and Technology;journal;10017631;0.117;Q4;9;83;299;1721;31;299;0.12;20.73;China;Zhejiang Daxue;1985-1989, 1996-ongoing;"Chemical Engineering (miscellaneous) (Q4); Chemistry (miscellaneous) (Q4)"
574;15263;Pulp and Paper Canada;trade journal;03164004;0.117;Q4;26;23;65;29;3;65;0.08;1.26;Canada;Business Information Group;1974-1992, 1994-ongoing;"Industrial and Manufacturing Engineering (Q3); Chemical Engineering (miscellaneous) (Q4); Economics and Econometrics (Q4); Materials Science (miscellaneous) (Q4); Mechanical Engineering (Q4)"
575;21100197724;ASM Heat Treating Society - 26th Conference and Exposition: Gearing Up for Success;conference and proceedings;00002011;0.116;-;4;0;56;0;10;55;0.18;0;United States;;2011;"Fluid Flow and Transfer Processes; Process Chemistry and Technology"
576;20500195005;ICONN 2010 - Proceedings of the 2010 International Conference on Nanoscience and Nanotechnology;conference and proceedings;00002010;0.116;-;4;0;115;0;12;113;0;0;United States;;2010;"Bioengineering; Biotechnology"
577;21100317402;Proceedings of the 16th International Conference on Miniaturized Systems for Chemistry and Life Sciences, MicroTAS 2012;conference and proceedings;00002012;0.116;-;6;0;675;0;127;673;0.19;0;United States;;2012;"Bioengineering; Chemical Engineering (miscellaneous)"
578;21456;Zhongguo Shengwu Yixue Gongcheng Xuebao/Chinese Journal of Biomedical Engineering;journal;02588021;0.116;Q4;11;110;451;2327;76;449;0.13;21.15;China;Chinese Society of Biomedical Engineering;1984-ongoing;"Bioengineering (Q4); Biomedical Engineering (Q4); Medicine (miscellaneous) (Q4)"
579;19700177313;10AIChE - 2010 AIChE Spring Meeting and 6th Global Congress on Process Safety;conference and proceedings;00002010;0.115;-;3;0;403;0;9;403;0;0;United States;;2010;"Chemical Health and Safety; Safety Research; Safety, Risk, Reliability and Quality"
580;21100201924;11AIChE - 2011 AIChE Spring Meeting and 7th Global Congress on Process Safety, Conference Proceedings;conference and proceedings;00002011;0.115;-;5;0;455;0;17;455;0.04;0;United States;;2011;"Chemical Engineering (miscellaneous); Chemistry (miscellaneous); Safety, Risk, Reliability and Quality"
581;21100198711;2011 E-Health and Bioengineering Conference, EHB 2011;conference and proceedings;00002011;0.115;-;8;0;127;0;48;126;0.38;0;United States;;2011;"Bioengineering; Health Informatics; Health Information Management"
582;19800188020;2011 ISSNIP Biosignals and Biorobotics Conference: Biosignals and Robotics for Better and Safer Living, BRC 2011;conference and proceedings;00002011;0.115;-;5;0;28;0;13;27;0.48;0;United States;;2011;"Artificial Intelligence; Bioengineering; Computer Vision and Pattern Recognition"
583;21100204510;2012 38th Annual Northeast Bioengineering Conference, NEBEC 2012;conference and proceedings;00002012;0.115;-;6;0;219;0;44;218;0.2;0;United States;;2012;Bioengineering
584;21100201942;6th Baltic Conference on Food Science and Technology: Innovations for Food Science and Production, FOODBALT-2011 - Conference Proceedings;conference and proceedings;00002011;0.115;-;5;0;41;0;11;39;0.28;0;United States;;2011;"Bioengineering; Biotechnology; Food Science; Organic Chemistry"
585;25187;Corrosion and Protection;journal;1005748X;0.115;Q4;9;277;356;1063;33;355;0.09;3.84;China;Shanghai Research Institute of Materials;2002-ongoing;"Chemical Engineering (miscellaneous) (Q4); Chemistry (miscellaneous) (Q4); Materials Science (miscellaneous) (Q4)"
586;79877;SPE - DOE Improved Oil Recovery Symposium Proceedings;conference and proceedings;00002004, 00002008, 00002010, 00002012, 00002000, 00002006;0.115;-;26;0;122;0;39;122;0.53;0;United States;;2000, 2004, 2006, 2008, 2010, 2012;"Chemical Engineering (miscellaneous); Energy Engineering and Power Technology"
587;21100310033;JEEP 2011 - 37th Conference on Phase Equilibria;conference and proceedings;00002011;0.114;-;1;0;13;0;4;11;0.36;0;France;;2011;"Chemical Engineering (miscellaneous); Condensed Matter Physics; Materials Chemistry; Nuclear and High Energy Physics; Physical and Theoretical Chemistry"
588;21100231611;Proceedings of International Conference NANOMEETING 2011: Physics, Chemistry and Applications of Nanostructures - Reviews and Short Notes;conference and proceedings;00002011;0.114;-;2;0;146;0;8;144;0.06;0;Singapore;;2011;Chemical Engineering (miscellaneous)
589;19453;Shiyou Huagong/Petrochemical Technology;journal;10008144;0.114;Q4;13;238;720;5158;86;720;0.1;21.67;China;SINOPEC - China Petro-Chemical Corporation;1994-ongoing;"Fuel Technology (Q3); Chemical Engineering (miscellaneous) (Q4)"
590;19900192441;Society of Petroleum Engineers - SPE Americas E and P Health, Safety, Security, and Environmental Conference 2011;conference and proceedings;00002011;0.114;-;6;0;52;0;10;51;0.2;0;United States;;2011;"Chemical Health and Safety; Public Health, Environmental and Occupational Health; Safety, Risk, Reliability and Quality"
591;19900191937;2011 IEEE 37th Annual Northeast Bioengineering Conference, NEBEC 2011;conference and proceedings;00002011;0.113;-;6;0;206;0;35;205;0.17;0;United States;;2011;Bioengineering
592;21100211769;Chemik;journal;00092886;0.113;Q4;10;98;110;2018;13;108;0.12;20.59;Poland;Association of Engineers and Technicians of Chemical Industry;2011-ongoing;"Chemical Engineering (miscellaneous) (Q4); Chemistry (miscellaneous) (Q4)"
593;13058;Ingenieria Quimica;trade journal;02102064;0.113;Q4;6;10;329;104;6;329;0.03;10.4;Spain;Editorial Alcion S.A.;1996-2013;"Fuel Technology (Q3); Media Technology (Q3); Chemical Engineering (miscellaneous) (Q4); Energy Engineering and Power Technology (Q4); Polymers and Plastics (Q4)"
594;13638;Xiandai Huagong/Modern Chemical Industry;journal;02534320;0.113;Q4;13;414;1112;6468;74;1112;0.06;15.62;China;China National Chemical Information Center;1982, 1984-1989, 2000-ongoing;Chemical Engineering (miscellaneous) (Q4)
595;21100254201;ASME 2012 Summer Bioengineering Conference, SBC 2012;conference and proceedings;00002012;0.112;-;4;0;670;0;41;669;0.06;0;United States;;2012;Bioengineering
596;13800154702;Leonardo Journal of Practices and Technologies;journal;15831078;0.112;Q4;13;16;76;349;18;76;0.15;21.81;Romania;AcademicDirect;2008-2016 (cancelled);"Industrial and Manufacturing Engineering (Q3); Chemical Engineering (miscellaneous) (Q4); Materials Science (miscellaneous) (Q4)"
597;24755;Lizi Jiaohuan Yu Xifu/Ion Exchange and Adsorption;journal;10015493;0.112;Q4;8;68;214;1149;17;214;0.05;16.9;China;Nankai Daxue;1987-1995, 1998, 2001-ongoing;"Chemical Engineering (miscellaneous) (Q4); Chemistry (miscellaneous) (Q4); Materials Science (miscellaneous) (Q4)"
598;21100420807;Proceedings of the IADIS International Conference WWW/Internet 2011, ICWI 2011;conference and proceedings;00002011;0.112;-;3;0;93;0;20;91;0.22;0;Portugal;;2011;"Environmental Science (miscellaneous); Filtration and Separation; Industrial and Manufacturing Engineering"
599;21100256961;American Filtration and Separations Society Annual National Conference and Exposition 2010;conference and proceedings;00002010;0.111;-;2;0;79;0;1;77;0;0;United States;;2010;"Environmental Science (miscellaneous); Filtration and Separation; Industrial and Manufacturing Engineering"
600;20542;Corrosion Management;trade journal;13555243;0.111;Q4;4;6;20;73;2;20;0.08;12.17;United Kingdom;Square One Advertising and Design Limited;1994-ongoing;"Chemical Engineering (miscellaneous) (Q4); Chemistry (miscellaneous) (Q4); Materials Science (miscellaneous) (Q4)"
601;19098;Filtration Industry Analyst;trade journal;13656937;0.111;Q4;1;0;2;0;0;2;0;0;Netherlands;Elsevier BV;2001-2010;"Industrial and Manufacturing Engineering (Q3); Business, Management and Accounting (miscellaneous) (Q4); Filtration and Separation (Q4)"
602;19460;Shi You Lian Zhi Yu Hua Gong/Petroleum Processing and Petrochemicals;journal;10052399;0.111;Q4;12;241;672;1016;56;672;0.08;4.22;China;Shiyou Lianzhi yu Huagong Bianjibu/Editorial Office of Petroleum Processing & Petrochemicals;1996-ongoing;"Fuel Technology (Q3); Energy Engineering and Power Technology (Q4); Process Chemistry and Technology (Q4)"
603;20500195122;Technical Proceedings of the 2011 NSTI Nanotechnology Conference and Expo, NSTI-Nanotech 2011;conference and proceedings;00002011;0.111;-;7;399;423;4535;52;421;0.12;11.37;United States;;2011;"Bioengineering; Biomedical Engineering; Ceramics and Composites; Electrical and Electronic Engineering; Hardware and Architecture; Surfaces and Interfaces; Surfaces, Coatings and Films"
604;21100220305;2012 IEEE 2nd Portuguese Meeting in Bioengineering, ENBENG 2012;conference and proceedings;00002012;0.11;-;4;0;63;0;14;62;0.23;0;United States;;2012;Bioengineering
605;88311;Adhaesion Kleben und Dichten;trade journal;16191919;0.11;Q4;6;31;160;67;2;160;0;2.16;Germany;Friedr. Vieweg and Sohn Verlagsgesellschaft mbH;1996-ongoing;"Chemical Engineering (miscellaneous) (Q4); Chemistry (miscellaneous) (Q4); Polymers and Plastics (Q4)"
606;21100238641;Air and Waste Management Association - 6th Specialty Conference on Vapor Intrusion 2012;conference and proceedings;00002012;0.11;-;1;0;28;0;1;27;0.04;0;United States;;2012;Fluid Flow and Transfer Processes
607;21100811143;Propulsion and Power Research;journal;2212540X;0.11;Q4;14;29;8;596;1;8;0.13;20.55;Netherlands;Elsevier BV;2012-ongoing;"Aerospace Engineering (Q4); Automotive Engineering (Q4); Fluid Flow and Transfer Processes (Q4); Fuel Technology (Q4); Mechanical Engineering (Q4)"
608;19700175232;European Corrosion Congress 2009, EUROCORR 2009;conference and proceedings;00002009;0.109;-;4;0;65;0;2;65;0;0;United States;;2009;"Colloid and Surface Chemistry; Surfaces and Interfaces"
609;21100202724;12AIChE - 2012 AIChE Spring Meeting and 8th Global Congress on Process Safety, Conference Proceedings;conference and proceedings;00002012;0.108;-;3;0;438;0;12;438;0.03;0;United States;;2012;"Chemical Engineering (miscellaneous); Chemistry (miscellaneous); Safety, Risk, Reliability and Quality"
610;21100206601;19th International Congress of Chemical and Process Engineering, CHISA 2010 and 7th European Congress of Chemical Engineering, ECCE-7;conference and proceedings;00002010;0.108;-;4;0;589;0;22;589;0;0;United States;;2010;"Chemical Engineering (miscellaneous); Process Chemistry and Technology"
611;21100216307;Eau, l'INDUSTRIE, les Nuisances;journal;07555016;0.108;Q4;6;83;276;55;4;252;0.01;0.66;France;Editions Johanet;1985-1991, 1996-2004, 2006-ongoing;"Control and Systems Engineering (Q4); Fluid Flow and Transfer Processes (Q4); Ocean Engineering (Q4); Water Science and Technology (Q4)"
612;21100203706;IBSC 2012 - Proceedings of the 5th International Brazing and Soldering Conference;conference and proceedings;00002012;0.108;-;4;0;95;0;11;93;0.12;0;United States;;2012;Chemical Engineering (miscellaneous)
613;145554;NPRA Annual Meeting Technical Papers;conference and proceedings;00002010, 00002005;0.108;-;6;0;106;0;10;106;0.17;0;United States;;2005-2010;"Chemical Engineering (miscellaneous); Energy Engineering and Power Technology; Fuel Technology"
614;21100220437;Proceedings of the 13th Asian Congress of Fluid Mechanics;conference and proceedings;00002010;0.108;-;2;0;14;0;3;13;0;0;China;;2010;Fluid Flow and Transfer Processes
615;19900192213;6th WSEAS Int. Conf. on Cellular and Molecular Biology, Biophys. and Bioeng., BIO'10, 8th WSEAS Int. Conf. on Environ., Ecosystems and Dev., EED'10, Int. Conf. on Biosci. and Bioinformatics, ICBB'10;conference and proceedings;00002010;0.107;-;3;0;45;0;4;43;0;0;United States;;2010;"Bioengineering; Cell Biology; Molecular Biology"
616;21100262022;Advances in Mathematical Fluid Mechanics: Dedicated to Giovanni Paolo Galdi on the Occasion of his 60th Birthday;conference and proceedings;00002010;0.107;-;3;0;37;0;4;35;0;0;Germany;;2010;"Fluid Flow and Transfer Processes; Mathematics (miscellaneous)"
617;14696;Converting Magazine;trade journal;07467141;0.107;Q4;2;0;3;0;0;3;0;0;United States;Reed Business;1998-2010;"Chemical Engineering (miscellaneous) (Q4); Industrial and Manufacturing Engineering (Q4); Materials Science (miscellaneous) (Q4)"
618;9500154122;Genetic Engineering and Biotechnology News;journal;1935472X;0.107;Q4;9;281;988;0;43;685;0.08;0;United States;Mary Ann Liebert Inc.;2007-ongoing;"Bioengineering (Q4); Biomedical Engineering (Q4); Biotechnology (Q4); Management of Technology and Innovation (Q4)"
619;13026;Huadong Ligong Daxue Xuebao /Journal of East China University of Science and Technology;journal;10063080;0.107;Q4;10;132;416;1858;45;416;0.08;14.08;China;East China University of Science and Technology;1993-1995, 2001-ongoing;"Chemical Engineering (miscellaneous) (Q4); Engineering (miscellaneous) (Q4); Materials Chemistry (Q4)"
620;19700194011;ISOB 2011 - Proceedings of the 1st International Symposium ISOB 2011 - Proceedings of the 1st International Symposium on Bioengineering;conference and proceedings;00002011;0.107;-;2;0;41;0;5;40;0.13;0;United States;;2011;"Bioengineering; Biotechnology"
621;21100403225;Joint International IGIP-SEFI Annual Conference 2010;conference and proceedings;00002010;0.107;-;5;0;435;0;26;434;0;0;Belgium;;2010;"Chemical Engineering (miscellaneous); Process Chemistry and Technology"
622;18912;Shengwu Yixue Gongchengxue Zazhi/Journal of Biomedical Engineering;journal;10015515;0.107;Q4;12;268;804;0;67;804;0.08;0;China;Sichuan Society for Biomedical Engineering;1997-ongoing;"Bioengineering (Q4); Medicine (miscellaneous) (Q4)"
623;21100497583;22nd Annual International Symposium of the International Council on Systems Engineering, INCOSE 2012 and the 8th Biennial European Systems Engineering Conference 2012, EuSEC 2012;conference and proceedings;00002012;0.106;-;5;0;70;0;15;68;0.22;0;United States;;2012;"Chemical Engineering (miscellaneous); Safety, Risk, Reliability and Quality"
624;21100256964;American Filtration and Separations Society Annual Conference 2011 - Shape up to Green;conference and proceedings;00002011;0.106;-;2;0;101;0;4;100;0.04;0;United States;;2011;"Environmental Science (miscellaneous); Filtration and Separation; Industrial and Manufacturing Engineering"
625;21100222933;Proceedings - 3rd International Conference on Innovations in Bio-Inspired Computing and Applications, IBICA 2012;conference and proceedings;00002012;0.106;-;6;0;67;0;10;65;0.15;0;United States;;2012;"Bioengineering; Software"
626;19456;Shiyou Huagong Gaodeng Xuexiao Xuebao/Journal of Petrochemical Universities;journal;1006396X;0.106;Q4;8;107;337;1335;24;337;0.07;12.48;China;Loaoning Shiyou Huagong Daxue/Liaoning University of Petroleum & Chemical liaoning;2001-ongoing;"Chemical Engineering (miscellaneous) (Q4); Energy Engineering and Power Technology (Q4); Fuel Technology (Q4)"
627;19700175579;Society of Petroleum Engineers - SPE International Conference on Health, Safety and Environment in Oil and Gas Exploration and Production 2010;conference and proceedings;00002010;0.106;-;5;0;150;0;16;148;0;0;United States;;2010;"Chemical Health and Safety; Geochemistry and Petrology; Safety, Risk, Reliability and Quality"
628;19900192313;Society of Petroleum Engineers - SPE International Conference on Health, Safety and Environment in Oil and Gas Exploration and Production 2011;conference and proceedings;00002011;0.106;-;4;0;62;0;5;61;0.08;0;United States;;2011;"Chemical Health and Safety; Safety, Risk, Reliability and Quality"
629;144795;Speciality Petrochemicals;journal;10039384;0.106;Q4;5;102;370;1170;26;370;0.07;11.47;China;Specialty Petrochemical S&T Information Center;2005-2014;"Chemical Engineering (miscellaneous) (Q4); Chemistry (miscellaneous) (Q4); Energy Engineering and Power Technology (Q4); Fuel Technology (Q4)"
630;21100321695;SpringerBriefs in Applied Sciences and Technology;book series;21915318, 2191530X;0.106;Q4;12;372;217;7093;22;92;0.24;19.07;Germany;Springer Verlag;2014-ongoing;"Biotechnology (Q4); Chemical Engineering (miscellaneous) (Q4); Energy Engineering and Power Technology (Q4); Engineering (miscellaneous) (Q4); Materials Science (miscellaneous) (Q4); Mathematics (miscellaneous) (Q4)"
631;19700175736;2010 15th National Biomedical Engineering Meeting, BIYOMUT2010;conference and proceedings;00002010;0.105;-;4;0;146;0;12;145;0;0;United States;;2010;"Bioengineering; Biomedical Engineering"
632;16380;Chemical and Petroleum Engineering;journal;00092355;0.105;Q4;11;143;371;1112;14;368;0.03;7.78;United States;Springer New York LLC;1965-1998, 2000-ongoing;"Chemical Engineering (miscellaneous) (Q4); Energy Engineering and Power Technology (Q4); Fuel Technology (Q4); Geochemistry and Petrology (Q4)"
633;23390;Chemist;trade journal;00093025;0.105;Q4;5;16;5;236;0;4;0;14.75;United States;American Institute of Chemists, Inc.;1996-1999, 2001-2005, 2012-ongoing;"Chemical Engineering (miscellaneous) (Q4); Chemistry (miscellaneous) (Q4)"
634;110297;Fibre Chemistry (English Translation of Khimicheskie Volokna);journal;00150541;0.105;Q4;16;79;223;582;12;221;0.05;7.37;United States;Kluwer Academic/Plenum Publishers;1969-ongoing;"Chemical Engineering (miscellaneous) (Q4); Chemistry (miscellaneous) (Q4); Materials Science (miscellaneous) (Q4)"
635;21100197730;Proceedings of the 6th IASTED International Conference on Biomechanics, BioMech 2011;conference and proceedings;00002011;0.105;-;2;0;23;0;6;22;0.27;0;United States;;2011;"Bioengineering; Biomaterials; Mechanics of Materials"
636;18753;Water;journal;03100367;0.105;Q4;14;0;133;0;8;110;0;0;Australia;Australian Water Association;1977-1982, 1985, 1987, 1992, 1997-2010;"Fluid Flow and Transfer Processes (Q4); Water Science and Technology (Q4)"
637;15814;Wochenblatt fuer Papierfabrikation;trade journal;00437131;0.105;Q4;10;62;179;165;11;179;0.08;2.66;Germany;Deutscher Fachverlag GmbH;1977-1990, 1996-ongoing;"Media Technology (Q3); Chemical Engineering (miscellaneous) (Q4); Industrial and Manufacturing Engineering (Q4); Materials Science (miscellaneous) (Q4); Mechanical Engineering (Q4)"
638;21100286430;ASME 2010 Summer Bioengineering Conference, SBC 2010;conference and proceedings;00002010;0.104;-;3;0;501;0;10;500;0;0;United States;;2010;Bioengineering
639;21100248804;ASME 2011 Summer Bioengineering Conference, SBC 2011;conference and proceedings;00002011;0.104;-;4;0;675;0;21;674;0.03;0;United States;;2011;Bioengineering
640;82174;Boletin Intexter;journal;11316756;0.104;Q4;3;0;6;0;0;6;0;0;Spain;Instituto de Investigacion Textil y de Cooperacion Industrial;1990-2008;"History (Q3); Chemical Engineering (miscellaneous) (Q4); Environmental Science (miscellaneous) (Q4); Polymers and Plastics (Q4)"
641;16382;Chemical Engineer;trade journal;03020797;0.104;Q4;10;283;762;103;19;359;0.07;0.36;United Kingdom;Institution of Chemical Engineers;1968-1969, 1971-1997, 1999-ongoing;"Chemical Engineering (miscellaneous) (Q4); Chemistry (miscellaneous) (Q4)"
