Rank;Sourceid;Title;Type;Issn;SJR;SJR Best Quartile;H index;Total Docs. (2014);Total Docs. (3years);Total Refs.;Total Cites (3years);Citable Docs. (3years);Cites / Doc. (2years);Ref. / Doc.;Country;Region;Publisher;Coverage;Categories
466;18384;Medicinal Chemistry Research;journal;10542523, 15548120;0.412;Q3;50;479;1298;16101;2054;1297;1.58;33.61;United States;Northern America;Birkhauser Boston;1994, 1996-2021;"Pharmacology, Toxicology and Pharmaceutics (miscellaneous) (Q2); Organic Chemistry (Q3)"
467;13540;Advances in Polymer Technology;journal;07306679, 10982329;0.411;Q3;47;83;186;2906;255;185;1.22;35.01;United States;Northern America;"John Wiley &amp; Sons Inc.";1981-2021;"Chemical Engineering (miscellaneous) (Q2); Polymers and Plastics (Q2); Organic Chemistry (Q3)"
468;23938;Atomic Spectroscopy;journal;01955373;0.409;Q3;31;36;101;1175;149;101;1.82;32.64;United States;Northern America;Perkin - Elmer Corp.;1980-1989, 1996-2021;Spectroscopy (Q3)
469;23450;Chinese Journal of Chemistry;journal;16147065, 1001604X;0.409;Q2;45;155;1096;6757;1479;1085;1.57;43.59;United States;Northern America;Wiley-Blackwell;1990-2021;Chemistry (miscellaneous) (Q2)
470;145581;International Journal of Photoenergy;journal;1110662X, 1687529X;0.409;Q2;56;326;692;10180;1106;667;1.53;31.23;United States;Northern America;Hindawi Publishing Corporation;1999-2021;"Chemistry (miscellaneous) (Q2); Materials Science (miscellaneous) (Q2); Renewable Energy, Sustainability and the Environment (Q2); Atomic and Molecular Physics, and Optics (Q3)"
471;22010;Zeitschrift fur Anorganische und Allgemeine Chemie;journal;00442313, 15213749;0.409;Q3;68;392;1103;16006;1326;1095;1.2;40.83;Germany;Western Europe;Wiley-VCH Verlag;1892-1945, 1947-2021;Inorganic Chemistry (Q3)
472;34545;Journal of Asian Natural Products Research;journal;10286020, 14772213;0.408;Q3;42;172;516;2955;577;516;1.08;17.18;United Kingdom;Western Europe;Taylor and Francis Ltd.;1998-2021;"Complementary and Alternative Medicine (Q2); Pharmaceutical Science (Q2); Analytical Chemistry (Q3); Drug Discovery (Q3); Medicine (miscellaneous) (Q3); Organic Chemistry (Q3); Pharmacology (Q3); Molecular Medicine (Q4)"
473;26923;Inorganic Reaction Mechanisms;journal;10286624;0.407;Q3;10;0;10;0;9;8;1.33;0;United States;Northern America;Old City Publishing;2003-2008, 2011-2012;"Inorganic Chemistry (Q3); Physical and Theoretical Chemistry (Q3)"
474;24819;Natural Product Research;journal;14786427, 14786419;0.407;Q3;58;406;1052;8034;1332;1048;1.14;19.79;United Kingdom;Western Europe;Taylor and Francis Ltd.;2003-2021;"Plant Science (Q2); Analytical Chemistry (Q3); Biochemistry (Q3); Organic Chemistry (Q3)"
475;25865;High Performance Polymers;journal;09540083, 13616412;0.406;Q3;43;118;260;3416;342;259;1.34;28.95;United Kingdom;Western Europe;SAGE Publications Ltd;1989-2021;"Materials Chemistry (Q2); Polymers and Plastics (Q2); Organic Chemistry (Q3)"
476;26583;Ceramics - Silikaty;journal;08625468, 18045847;0.405;Q3;35;48;171;1141;150;171;0.65;23.77;Czech Republic;Eastern Europe;Institute of Chemical Technology;1991-2021;"Ceramics and Composites (Q2); Chemical Engineering (miscellaneous) (Q2); Materials Chemistry (Q2); Analytical Chemistry (Q3); Physical and Theoretical Chemistry (Q3)"
477;24138;Isotopes in Environmental and Health Studies;journal;10256016, 14772639;0.405;Q3;42;49;139;1829;150;131;1.07;37.33;United Kingdom;Western Europe;Taylor and Francis Ltd.;1995-2021;"Environmental Science (miscellaneous) (Q2); Environmental Chemistry (Q3); Inorganic Chemistry (Q3)"
478;16393;Chemical Engineering Communications;journal;00986445, 15635201;0.403;Q2;54;102;302;3466;389;302;1.27;33.98;United Kingdom;Western Europe;Taylor and Francis Ltd.;1973-1976, 1978-2021;"Chemical Engineering (miscellaneous) (Q2); Chemistry (miscellaneous) (Q2)"
479;84944;Reviews in Analytical Chemistry;journal;07930135;0.402;Q3;25;18;60;1518;82;59;1.87;84.33;Germany;Western Europe;Walter de Gruyter GmbH;1980-1983, 1985-1987, 1989, 1991-1992, 1994-2021;Analytical Chemistry (Q3)
480;22745;Canadian Journal of Chemistry;journal;00084042, 14803291;0.401;Q2;69;176;474;7905;523;474;1.1;44.91;Canada;Northern America;National Research Council of Canada;1951, 1960, 1965, 1973-2021;"Chemistry (miscellaneous) (Q2); Organic Chemistry (Q3); Catalysis (Q4)"
481;25174;Electrochemistry;journal;13443542;0.398;Q3;44;113;345;2902;295;310;0.89;25.68;Japan;Asiatic Region;Electrochemical Society of Japan;1996-2021;Electrochemistry (Q3)
482;25864;Heterocycles;journal;03855414;0.398;Q3;66;269;724;10786;816;724;1.17;40.1;Japan;Asiatic Region;Japan Institute of Heterocyclic Chemistry;1983-2021;"Analytical Chemistry (Q3); Organic Chemistry (Q3); Pharmacology (Q3)"
483;13664;Journal of Adhesion Science and Technology;journal;15685616, 01694243;0.398;Q2;73;170;557;5119;664;537;1.07;30.11;United Kingdom;Western Europe;Taylor and Francis Ltd.;1987-2021;"Chemistry (miscellaneous) (Q2); Materials Chemistry (Q2); Surfaces, Coatings and Films (Q2); Mechanics of Materials (Q3); Surfaces and Interfaces (Q3)"
484;93516;Polymer Science - Series C;journal;1555614X, 18112382;0.398;Q2;24;10;40;721;49;39;1.11;72.1;United States;Northern America;Pleiades Publishing;2000-2021;"Chemistry (miscellaneous) (Q2); Materials Chemistry (Q2); Polymers and Plastics (Q2)"
485;26902;High Energy Chemistry;journal;00181439, 16083148;0.397;Q3;24;69;217;1411;158;217;0.75;20.45;United States;Northern America;Pleiades Publishing;1996-2021;Physical and Theoretical Chemistry (Q3)
486;144932;Protein Journal;journal;15723887;0.396;Q3;56;59;229;2295;235;229;1.01;38.9;United States;Northern America;Springer New York;1996-2021;"Analytical Chemistry (Q3); Biochemistry (Q3); Bioengineering (Q3); Organic Chemistry (Q3)"
487;21100252806;Bioactive Carbohydrates and Dietary Fibre;journal;22126198;0.395;Q3;31;31;37;1551;65;36;1.76;50.03;United Kingdom;Western Europe;Elsevier BV;2013-2021;"Food Science (Q2); Biochemistry (Q3); Organic Chemistry (Q3)"
488;16378;Chemical and Biochemical Engineering Quarterly;journal;18465153, 03529568;0.395;Q2;43;56;161;1792;221;158;1.03;32;Croatia;Eastern Europe;Assoc. of Chemists and Chemical Engineers of Croatia;1987, 1996-2021;"Chemistry (miscellaneous) (Q2); Process Chemistry and Technology (Q2); Biochemistry (Q3)"
489;13089;International Journal of Polymer Analysis and Characterization;journal;15635341, 1023666X;0.395;Q3;44;66;176;1711;244;176;1.48;25.92;United Kingdom;Western Europe;Taylor and Francis Ltd.;1995-2021;"Chemical Engineering (miscellaneous) (Q2); Polymers and Plastics (Q2); Analytical Chemistry (Q3)"
490;4000151702;Current Analytical Chemistry;journal;15734110;0.391;Q3;35;65;167;3361;196;155;1.08;51.71;United Arab Emirates;Middle East;Bentham Science Publishers B.V.;2006-2021;Analytical Chemistry (Q3)
491;26988;Luminescence;journal;15227243, 15227235;0.389;Q2;48;182;347;6206;505;342;1.37;34.1;United Kingdom;Western Europe;John Wiley and Sons Ltd;1997-2021;"Chemistry (miscellaneous) (Q2); Biophysics (Q3)"
492;28480;Tetsu-To-Hagane/Journal of the Iron and Steel Institute of Japan;journal;00211575;0.389;Q3;36;194;279;5027;153;273;0.48;25.91;Japan;Asiatic Region;Iron and Steel Institute of Japan;1968-1991, 1994-2021;"Materials Chemistry (Q2); Metals and Alloys (Q2); Condensed Matter Physics (Q3); Physical and Theoretical Chemistry (Q3)"
493;23941;Journal of Mathematical Chemistry;journal;02599791, 15728897;0.388;Q2;65;166;508;5509;613;497;1.23;33.19;Netherlands;Western Europe;Springer Netherlands;1987-2021;"Chemistry (miscellaneous) (Q2); Applied Mathematics (Q3)"
494;16934;Minerals and Metallurgical Processing;journal;07479182;0.388;Q2;0;0;0;0;0;0;0;0;United States;Northern America;Society for Mining, Metallurgy and Exploration;1984-2018;"Chemistry (miscellaneous) (Q2); Control and Systems Engineering (Q2); Geotechnical Engineering and Engineering Geology (Q2); Materials Chemistry (Q2); Mechanical Engineering (Q2); Metals and Alloys (Q2)"
495;29109;Corrosion Engineering Science and Technology;journal;1478422X;0.383;Q2;44;106;272;2542;262;264;0.91;23.98;United Kingdom;Western Europe;Maney Publishing;2003-2021;"Chemical Engineering (miscellaneous) (Q2); Chemistry (miscellaneous) (Q2); Materials Science (miscellaneous) (Q2)"
496;22729;Journal of the Brazilian Chemical Society;journal;01035053, 16784790;0.383;Q2;73;286;855;11369;1146;824;1.18;39.75;Brazil;Latin America;Sociedade Brasileira de Quimica;1990, 1996-2021;Chemistry (miscellaneous) (Q2)
497;24169;Journal of Chemical Education;journal;19381328, 00219584;0.381;Q2;90;409;1156;9961;1407;1136;1.26;24.35;United States;Northern America;American Chemical Society;1924-2021;"Chemistry (miscellaneous) (Q2); Education (Q2)"
498;19642;Journal - American Water Works Association;journal;15518833, 0003150X;0.38;Q2;76;212;497;2148;231;428;0.45;10.13;United States;Northern America;"John Wiley &amp; Sons Inc.";1946, 1969-2021;"Chemistry (miscellaneous) (Q2); Water Science and Technology (Q2)"
499;19900192116;Journal of Pharmaceutical Analysis;journal;20951779;0.38;Q3;38;47;189;1569;233;189;1.14;33.38;China;Asiatic Region;Xi'an Jiaotong University;2011-2021;"Pharmacy (Q1); Pharmaceutical Science (Q2); Analytical Chemistry (Q3); Drug Discovery (Q3); Electrochemistry (Q3); Spectroscopy (Q3)"
500;21100201539;Spectroscopic Properties of Inorganic and Organometallic Compounds;book series;14651939, 05848555;0.379;Q3;10;11;28;1000;25;25;0.89;90.91;United Kingdom;Western Europe;Royal Society of Chemistry;2012-2014, 2016, 2018, 2021;"Inorganic Chemistry (Q3); Organic Chemistry (Q3); Physical and Theoretical Chemistry (Q3)"
501;22804;Chemical Papers;journal;03666352, 13369075;0.378;Q2;46;209;439;7181;601;435;1.53;34.36;Switzerland;Western Europe;Springer International Publishing AG;1973, 1996-2021;"Chemical Engineering (miscellaneous) (Q2); Chemistry (miscellaneous) (Q2); Industrial and Manufacturing Engineering (Q2); Materials Chemistry (Q2); Biochemistry (Q3)"
502;17600154901;Journal of Superhard Materials;journal;19349408, 10634576;0.375;Q3;24;53;159;1196;97;159;0.56;22.57;United States;Northern America;Pleiades Publishing;2007-2021;"Materials Science (miscellaneous) (Q2); Inorganic Chemistry (Q3)"
503;7900153139;Journal of Oleo Science;journal;13473352, 13458957;0.374;Q2;47;150;308;5023;406;276;1.2;33.49;Japan;Asiatic Region;Japan Oil Chemists Society;2001-2021;"Chemical Engineering (miscellaneous) (Q2); Chemistry (miscellaneous) (Q2); Medicine (miscellaneous) (Q3)"
504;24043;Journal of Labelled Compounds and Radiopharmaceuticals;journal;03624803, 10991344;0.372;Q3;48;114;319;3812;330;314;1.13;33.44;United Kingdom;Western Europe;John Wiley and Sons Ltd;1976-2021;"Analytical Chemistry (Q3); Biochemistry (Q3); Drug Discovery (Q3); Organic Chemistry (Q3); Radiology, Nuclear Medicine and Imaging (Q3); Spectroscopy (Q3)"
505;26487;Solvent Extraction Research and Development;journal;21884765, 13417215;0.371;Q2;21;26;63;519;73;63;1.09;19.96;Japan;Asiatic Region;Japan Association of Solvent Extraction;1996-2021;"Chemical Engineering (miscellaneous) (Q2); Chemistry (miscellaneous) (Q2)"
506;23932;Analytical Letters;journal;1532236X, 00032719;0.37;Q3;62;236;696;7224;762;690;1.13;30.61;United States;Northern America;Taylor and Francis Ltd.;1967-2021;"Analytical Chemistry (Q3); Biochemistry (Q3); Biochemistry (medical) (Q3); Clinical Biochemistry (Q3); Electrochemistry (Q3); Spectroscopy (Q3)"
507;19200156941;Digest Journal of Nanomaterials and Biostructures;journal;18423582;0.369;Q3;48;178;603;4778;850;603;1.18;26.84;Romania;Eastern Europe;National Institute R and D of Materials Physics;2009-2021;"Materials Science (miscellaneous) (Q2); Atomic and Molecular Physics, and Optics (Q3); Biomedical Engineering (Q3); Condensed Matter Physics (Q3); Nanoscience and Nanotechnology (Q3); Physical and Theoretical Chemistry (Q3); Structural Biology (Q4)"
508;26885;Doklady Physical Chemistry;journal;00125016, 16083121;0.368;Q3;22;52;192;640;135;192;0.64;12.31;United States;Northern America;Pleiades Publishing;1996-2021;Physical and Theoretical Chemistry (Q3)
509;19600164700;Journal of Chemical Sciences;journal;09743626, 09737103;0.368;Q2;54;205;429;8189;541;423;1.15;39.95;India;Asiatic Region;Springer India;1980-1981, 1986-1987, 1990, 1993, 1996-1997, 2000, 2002-2021;Chemistry (miscellaneous) (Q2)
510;26572;Journal of Essential Oil Research;journal;21638152, 10412905;0.366;Q2;53;70;232;2182;250;229;1.1;31.17;United Kingdom;Western Europe;Taylor and Francis Ltd.;1989-2021;Chemistry (miscellaneous) (Q2)
511;21100233406;Monographs in Supramolecular Chemistry;book series;13688642, 20417144;0.365;Q2;7;0;1;0;7;1;7;0;United Kingdom;Western Europe;Royal Society of Chemistry;2013, 2015-2021;"Chemical Engineering (miscellaneous) (Q2); Chemistry (miscellaneous) (Q2)"
512;12100156819;Green Chemistry Letters and Reviews;journal;17517192, 17518253;0.364;Q2;41;54;142;1942;247;136;1.53;35.96;United Kingdom;Western Europe;Taylor and Francis Ltd.;2007-2021;"Chemistry (miscellaneous) (Q2); Environmental Chemistry (Q4)"
513;11700154632;Proceedings - International Conference on Application of Concurrency to System Design, ACSD;conference and proceedings;15504808;0.363;-;23;21;73;479;69;67;0.92;22.81;United States;Northern America;;;"Chemical Engineering (miscellaneous); Chemistry (miscellaneous); Engineering (miscellaneous); Materials Science (miscellaneous)"
514;24098;Indian Journal of Chemical Technology;journal;0971457X;0.362;Q2;41;49;178;1481;157;170;0.71;30.22;India;Asiatic Region;National Institute of Science Communication and Information Resources (NISCAIR);1994-2021;"Chemical Engineering (miscellaneous) (Q2); Chemistry (miscellaneous) (Q2)"
515;24059;Journal of Planar Chromatography - Modern TLC;journal;17890993, 09334173;0.361;Q3;31;79;286;1886;231;277;0.85;23.87;Hungary;Eastern Europe;Research Institute for Medicinal Plants;1995-2021;"Analytical Chemistry (Q3); Biochemistry (Q3); Clinical Biochemistry (Q3)"
516;24803;Monatshefte fur Chemie;journal;00269247, 14344475;0.361;Q2;67;237;634;8599;883;629;1.38;36.28;Austria;Western Europe;Springer-Verlag Wien;1880-1888, 1890-1912, 1914-1937, 1939, 1941, 1943, 1946-2021;Chemistry (miscellaneous) (Q2)
517;12441;Open Systems and Information Dynamics;journal;15731324, 12301612;0.361;Q3;33;23;81;728;58;79;0.73;31.65;Singapore;Asiatic Region;World Scientific Publishing Co. Pte Ltd;1992-1995, 1997-2021;"Computational Mechanics (Q2); Fluid Flow and Transfer Processes (Q2); Information Systems (Q3); Mathematical Physics (Q3); Mechanics of Materials (Q3); Physical and Theoretical Chemistry (Q3); Statistical and Nonlinear Physics (Q3); Statistics and Probability (Q4)"
518;26985;Kinetics and Catalysis;journal;00231584, 16083210;0.36;Q2;36;101;317;3125;261;315;0.78;30.94;United States;Northern America;Pleiades Publishing;1968-1971, 1984-1992, 1996-2021;"Chemistry (miscellaneous) (Q2); Computer Science Applications (Q3); Modeling and Simulation (Q3); Catalysis (Q4)"
519;4900152712;Chinese Journal of Analytical Chemistry;journal;18722040;0.359;Q3;34;85;243;2170;311;243;1.4;25.53;Netherlands;Western Europe;Elsevier BV;1989, 1996-2021;Analytical Chemistry (Q3)
520;26528;Trends in Glycoscience and Glycotechnology;journal;09157352, 18832113;0.357;Q3;37;23;70;524;54;59;0.42;22.78;Japan;Asiatic Region;Gakushin Publishing Company;1986, 1989-2021;"Biochemistry (Q3); Organic Chemistry (Q3)"
521;21492;Research on Chemical Intermediates;journal;09226168, 15685675;0.353;Q2;54;286;717;8169;820;711;1.1;28.56;Netherlands;Western Europe;Springer Netherlands;1984-2021;Chemistry (miscellaneous) (Q2)
522;130099;Concepts in Magnetic Resonance Part B: Magnetic Resonance Engineering;journal;15525031, 1552504X;0.352;Q3;35;10;50;195;43;50;1;19.5;United States;Northern America;Hindawi Publishing Corporation;2002-2018;"Physical and Theoretical Chemistry (Q3); Radiological and Ultrasound Technology (Q3); Radiology, Nuclear Medicine and Imaging (Q3); Spectroscopy (Q3)"
523;26946;Journal of Advanced Oxidation Technologies (discontinued);journal;12038407;0.352;Q3;27;48;121;1549;137;121;1.11;32.27;Canada;Northern America;Walter de Gruyter GmbH;2004-2018;Physical and Theoretical Chemistry (Q3)
524;24174;Journal of Cluster Science;journal;15728862, 10407278;0.351;Q2;49;127;251;5203;342;247;1.33;40.97;United States;Northern America;Springer New York;1990-2021;"Chemistry (miscellaneous) (Q2); Materials Science (miscellaneous) (Q2); Biochemistry (Q3); Condensed Matter Physics (Q3)"
525;28522;Journal of Macromolecular Science - Physics;journal;1525609X, 00222348;0.35;Q2;50;144;491;4147;448;491;0.86;28.8;United States;Northern America;Taylor and Francis Ltd.;1967-2021;"Chemistry (miscellaneous) (Q2); Polymers and Plastics (Q2); Condensed Matter Physics (Q3); Materials Chemistry (Q3)"
526;22042;Journal of the Ceramic Society of Japan;journal;18820743, 13486535;0.35;Q2;60;202;522;5225;477;519;0.79;25.87;Japan;Asiatic Region;Ceramic Society of Japan;1988-2021;"Ceramics and Composites (Q2); Chemistry (miscellaneous) (Q2); Condensed Matter Physics (Q3); Materials Chemistry (Q3)"
527;145739;Central European Journal of Chemistry;journal;18951066, 16443624;0.348;Q2;42;139;529;5600;648;528;1.24;40.29;Poland;Eastern Europe;Central European Science Journals;2004-2014;"Chemistry (miscellaneous) (Q2); Materials Chemistry (Q3)"
528;23415;Accreditation and Quality Assurance;journal;09491775, 14320517;0.347;Q2;40;62;266;1384;196;218;0.77;22.32;United States;Northern America;Springer New York;1996-2021;"Chemical Engineering (miscellaneous) (Q2); Chemistry (miscellaneous) (Q2); Safety, Risk, Reliability and Quality (Q2); Instrumentation (Q3)"
529;21100819607;Egyptian Journal of Petroleum;journal;11100621, 20902468;0.345;Q3;46;47;81;1396;64;81;0.7;29.7;Egypt;Africa/Middle East;Egyptian Petroleum Research Institute;2011-2021;"Fuel Technology (Q2); Process Chemistry and Technology (Q2); Organic Chemistry (Q3); Renewable Energy, Sustainability and the Environment (Q3); Catalysis (Q4); Geochemistry and Petrology (Q4)"
530;19700181203;KONA Powder and Particle Journal;journal;02884534, 21875537;0.344;Q2;39;20;47;1004;78;45;1.25;50.2;Japan;Asiatic Region;Hosokawa Powder Technology Foundation;1983-2021;"Chemical Engineering (miscellaneous) (Q2); Chemistry (miscellaneous) (Q2); Engineering (miscellaneous) (Q2); Materials Science (miscellaneous) (Q2)"
531;4800152303;Acta Chimica Sinica;journal;05677351;0.342;Q3;42;148;1055;7647;1199;1055;1.56;51.67;China;Asiatic Region;Science Press;1982, 1996-2021;Chemistry (miscellaneous) (Q3)
532;4000150001;Bioinorganic Chemistry and Applications;journal;15653633, 1687479X;0.339;Q3;40;52;87;2000;166;86;1.84;38.46;United States;Northern America;Hindawi Publishing Corporation;2003-2021;"Biochemistry (Q3); Inorganic Chemistry (Q3); Organic Chemistry (Q3)"
533;25260;Heteroatom Chemistry;journal;10981071, 10427163;0.339;Q3;43;82;241;3232;301;241;1.26;39.41;United States;Northern America;Wiley-Blackwell;1990-2021;Chemistry (miscellaneous) (Q3)
534;24865;Soft Materials;journal;15394468, 1539445X;0.339;Q3;27;68;110;3066;130;108;1.23;45.09;United States;Northern America;Taylor and Francis Ltd.;2004-2021;"Materials Science (miscellaneous) (Q2); Chemistry (miscellaneous) (Q3); Condensed Matter Physics (Q3)"
535;25815;Chemistry of Natural Compounds;journal;15738388, 00093130;0.335;-;42;377;1014;5664;643;993;0.62;15.02;United States;Northern America;Springer New York;1965-2021;Plant Science (Q3)
536;27860;Journal of the American Leather Chemists Association;journal;00029726;0.335;Q3;32;44;142;858;83;138;0.49;19.5;United States;Northern America;American Leather Chemists Association;1969-1970, 1976-1990, 1994-2021;"Chemical Engineering (miscellaneous) (Q2); Materials Science (miscellaneous) (Q2); Chemistry (miscellaneous) (Q3)"
537;28899;Transition Metal Chemistry;journal;1572901X, 03404285;0.334;Q3;58;112;336;3830;454;336;1.37;34.2;Netherlands;Western Europe;Springer Netherlands;1975-2021;"Metals and Alloys (Q2); Inorganic Chemistry (Q3); Materials Chemistry (Q3)"
538;16423;Chemie-Ingenieur-Technik;journal;15222640, 0009286X;0.331;Q3;39;202;643;5709;579;614;0.8;28.26;Germany;Western Europe;Wiley-VCH Verlag;1949-2021;"Chemical Engineering (miscellaneous) (Q2); Industrial and Manufacturing Engineering (Q2); Chemistry (miscellaneous) (Q3)"
539;28546;Journal of Nanoscience and Nanotechnology (discontinued);journal;15334899, 15334880;0.327;Q3;108;1395;4871;58185;7060;4836;1.65;41.71;United States;Northern America;American Scientific Publishers;2001-2018;"Materials Science (miscellaneous) (Q2); Bioengineering (Q3); Biomedical Engineering (Q3); Chemistry (miscellaneous) (Q3); Condensed Matter Physics (Q3); Nanoscience and Nanotechnology (Q3)"
540;28136;Journal of Computational and Theoretical Nanoscience;journal;15461955, 15461963;0.326;Q3;53;369;1135;12240;1466;1123;1.46;33.17;United States;Northern America;American Scientific Publishers;2004-2020;"Electrical and Electronic Engineering (Q2); Materials Science (miscellaneous) (Q2); Chemistry (miscellaneous) (Q3); Computational Mathematics (Q3); Condensed Matter Physics (Q3); Nanoscience and Nanotechnology (Q3)"
541;19700186902;Bubble Science, Engineering and Technology;journal;17588979, 17588960;0.324;Q3;12;4;16;132;18;15;1.13;33;United Kingdom;Western Europe;Maney Publishing;2009-2012, 2014;"Chemical Engineering (miscellaneous) (Q2); Materials Science (miscellaneous) (Q2); Chemistry (miscellaneous) (Q3)"
542;21100267917;Carbohydrate Chemistry;book series;2041353X, 14651963;0.323;Q3;12;29;43;2824;59;40;0.9;97.38;United Kingdom;Western Europe;Royal Society of Chemistry;2011-2014, 2016-2018, 2021;"Organic Chemistry (Q3); Biochemistry (Q4)"
543;27056;Colloid Journal;journal;1061933X, 16083067;0.323;Q3;35;97;309;2805;265;309;0.81;28.92;United States;Northern America;Pleiades Publishing;1989, 1991-1992, 1995-2021;"Colloid and Surface Chemistry (Q3); Physical and Theoretical Chemistry (Q3); Surfaces and Interfaces (Q3)"
544;145580;International Journal of Peptide Research and Therapeutics;journal;15733149, 15733904;0.323;Q3;38;62;124;2334;128;123;0.96;37.65;Netherlands;Western Europe;Springer Netherlands;1996-2002, 2005-2021;"Analytical Chemistry (Q3); Bioengineering (Q3); Drug Discovery (Q3); Biochemistry (Q4); Molecular Medicine (Q4)"
545;16402;Chemical Engineering Progress (discontinued);trade journal;03607275;0.322;Q3;40;102;178;576;107;178;0.59;5.65;United States;Northern America;American Institute of Chemical Engineers;1969-2018;"Chemical Engineering (miscellaneous) (Q2); Industrial and Manufacturing Engineering (Q2); Chemistry (miscellaneous) (Q3); Materials Chemistry (Q3)"
546;21100461983;Frontiers in Chemistry;journal;22962646;0.321;Q3;69;114;37;8760;49;35;1.32;76.84;Switzerland;Western Europe;Frontiers Media S.A.;2013-2021;Chemistry (miscellaneous) (Q3)
547;19900195090;Open Chemical and Biomedical Methods Journal;journal;1876536X;0.321;Q3;4;0;6;0;4;6;0.33;0;Netherlands;Western Europe;;;"Electrical and Electronic Engineering (Q2); Biomedical Engineering (Q3); Cardiology and Cardiovascular Medicine (Q3); Electrochemistry (Q3); Biochemistry (Q4)"
548;18766;Petroleum Chemistry;journal;15556239, 09655441;0.32;Q3;27;99;293;2444;188;292;0.57;24.69;United States;Northern America;Pleiades Publishing;1991-2021;"Chemical Engineering (miscellaneous) (Q2); Energy Engineering and Power Technology (Q2); Fuel Technology (Q2); Chemistry (miscellaneous) (Q3); Geochemistry and Petrology (Q4)"
549;22182;Arkivoc;journal;15517004, 15517012;0.318;Q3;64;111;564;4734;598;564;1.06;42.65;United States;Northern America;Arkat USA;2000-2021;Organic Chemistry (Q3)
550;23501;Doklady Chemistry;journal;00125008, 16083113;0.318;Q3;21;54;228;618;138;228;0.49;11.44;United States;Northern America;Pleiades Publishing;1996-2021;Chemistry (miscellaneous) (Q3)
551;14217;Materiale Plastice;journal;00255289;0.316;Q3;25;105;194;2188;157;194;0.93;20.84;Romania;Eastern Europe;Syscom 18 SRL;1970-1971, 1973, 1975-1986, 1988, 1996-2021;"Polymers and Plastics (Q2); Chemistry (miscellaneous) (Q3); Materials Chemistry (Q3); Mechanics of Materials (Q3)"
552;21100409900;Protection of Metals and Physical Chemistry of Surfaces;journal;2070206X, 20702051;0.315;Q3;27;134;369;3269;263;369;0.71;24.4;United States;Northern America;Pleiades Publishing;2009-2021;"Metals and Alloys (Q2); Materials Chemistry (Q3); Organic Chemistry (Q3); Surfaces, Coatings and Films (Q3)"
553;21100466764;Applied Biological Chemistry;journal;24680842, 24680834;0.314;Q3;26;116;265;3329;229;264;0.79;28.7;Netherlands;Western Europe;Springer Netherlands;2016-2021;"Biochemistry, Genetics and Molecular Biology (miscellaneous) (Q3); Organic Chemistry (Q3)"
554;26608;Hanneng Cailiao/Chinese Journal of Energetic Materials;journal;10069941;0.314;Q3;23;172;487;2728;202;477;0.47;15.86;China;Asiatic Region;Chinese Academy of Engineering Physics;1996-2021;"Industrial and Manufacturing Engineering (Q2); Chemistry (miscellaneous) (Q3); Materials Science (miscellaneous) (Q3); Mechanical Engineering (Q3)"
555;21496;Revista de Chimie (discontinued);journal;00347752;0.314;Q3;31;306;787;7420;583;787;0.82;24.25;Romania;Eastern Europe;Syscom 18 SRL;1973, 1996-2021;Chemistry (miscellaneous) (Q3)
556;28005;Hyperfine Interactions;journal;15729540, 03043843;0.313;Q3;47;254;532;5086;319;523;0.63;20.02;Netherlands;Western Europe;Springer Netherlands;1975-2021;"Atomic and Molecular Physics, and Optics (Q3); Condensed Matter Physics (Q3); Nuclear and High Energy Physics (Q3); Physical and Theoretical Chemistry (Q3)"
557;22677;Ambix;journal;17458234, 00026980;0.312;Q3;12;26;45;1431;19;40;0.45;55.04;United Kingdom;Western Europe;Maney Publishing;1937-1938, 1946, 1948-1949, 1951, 1953, 1956-1996, 1998, 2000-2021;"History and Philosophy of Science (Q2); Chemistry (miscellaneous) (Q3)"
558;19700188408;Artificial DNA: PNA and XNA;journal;19490968, 1949095X;0.311;Q3;15;10;46;228;60;37;1.32;22.8;United States;Northern America;Landes Bioscience;2010-2014, 2016;"Medicine (miscellaneous) (Q3); Organic Chemistry (Q3); Biochemistry (Q4)"
