Rank;Sourceid;Title;Type;Issn;SJR;SJR Best Quartile;H index;Total Docs. (2003);Total Docs. (3years);Total Refs.;Total Cites (3years);Citable Docs. (3years);Cites / Doc. (2years);Ref. / Doc.;Country;Publisher;Coverage;Categories
320;27662;Emergency nurse : the journal of the RCN Accident and Emergency Nursing Association;journal;13545752;0.122;Q3;15;69;200;751;12;178;0.04;10,88;United Kingdom;Royal College of Nursing Publishing Co.;1992, 1998-ongoing;Emergency Nursing (Q3)
321;36336;Home Care Provider;journal;1084628X;0.122;Q3;10;0;118;0;10;91;0.14;0,00;United States;Mosby-Year Book Inc.;1996-2001;"Leadership and Management (Q3); Health (social science) (Q4)"
322;67199;The Canadian nurse;journal;00084581;0.122;Q3;17;62;222;57;19;187;0.10;0,92;Canada;Canadian Nurses Association/Association des Infirmieres et Infirmiers du Canada;1945-ongoing;"Medicine (miscellaneous) (Q3); Nursing (miscellaneous) (Q3)"
323;27155;BMC Nursing;journal;14726955;0.121;Q3;29;2;1;83;0;1;0.00;41,50;United Kingdom;BioMed Central;2002-ongoing;Nursing (miscellaneous) (Q3)
324;28852;Nursing management;journal;07446314;0.121;Q3;20;192;661;321;57;594;0.09;1,67;United States;Lippincott Williams & Wilkins Ltd.;1981-ongoing;Leadership and Management (Q3)
325;30026;Cahiers de Nutrition et de Dietetique;journal;00079960;0.12;Q4;12;59;187;1232;36;173;0.25;20,88;France;Elsevier Masson;1973-1991, 1994-ongoing;"Medicine (miscellaneous) (Q3); Nutrition and Dietetics (Q4)"
326;21100806011;Endocrinologia, Diabetes y Nutricion;journal;25300164;0.12;Q4;20;66;55;2071;7;40;0.20;31,38;Spain;Elsevier BV;2017-ongoing;"Endocrinology (Q4); Endocrinology, Diabetes and Metabolism (Q4); Nutrition and Dietetics (Q4)"
327;27682;European Journal of Cardiovascular Nursing;journal;14745151;0.12;Q4;45;38;44;1379;13;40;0.33;36,29;United States;SAGE Publications Inc.;2002-ongoing;"Medicine (miscellaneous) (Q3); Advanced and Specialized Nursing (Q4); Cardiology and Cardiovascular Medicine (Q4); Medical and Surgical Nursing (Q4)"
328;5200152803;Internet Journal of Advanced Nursing Practice;journal;15236064;0.11800000000000001;Q4;7;0;31;0;1;31;0.00;0,00;United States;Internet Scientific Publications;1997-2000, 2002, 2006-2008;Advanced and Specialized Nursing (Q4)
329;93074;Medecine de Catastrophe Urgences Collectives;journal;12798479;0.11599999999999999;Q3;3;0;33;0;2;32;0.00;0,00;Netherlands;Elsevier BV;1998-2000;"Emergency Medicine (Q3); Nursing (miscellaneous) (Q3)"
330;28837;Nursing Forum;journal;00296473;0.11599999999999999;Q3;31;22;31;182;4;27;0.00;8,27;United States;Wiley-Blackwell;1961-1981, 1984-1985, 1987-2000, 2002-ongoing;Nursing (miscellaneous) (Q3)
331;21942;Reanimation;journal;16240693;0.11599999999999999;Q3;16;109;328;3302;39;282;0.17;30,29;France;Elsevier Masson SAS;2001-ongoing;"Emergency Medicine (Q3); Emergency Nursing (Q3)"
332;28003;Revista Espanola de Nutricion Comunitaria;journal;11353074;0.11599999999999999;Q4;9;19;26;428;2;25;0.08;22,53;Spain;Nexus Ediciones;2001-2010, 2012-ongoing;"Medicine (miscellaneous) (Q3); Nutrition and Dietetics (Q4)"
333;94039;Journal of Managed Pharmaceutical Care;journal;15349721, 15349713;0.115;Q3;3;0;35;0;3;34;0.09;0,00;United States;Pharmaceutical Products Press;2001;"Leadership and Management (Q3); Pharmacology (Q4)"
334;27657;Disaster Management and Response;journal;15402495, 15402487;0.114;Q4;20;53;8;174;1;6;0.17;3,28;United States;Mosby Inc.;2002-2007;"Emergency Medicine (Q4); Nursing (miscellaneous) (Q4)"
335;21100215113;International journal of nursing knowledge;journal;20473087;0.114;Q2;21;9;21;44;3;18;0.17;4,89;Germany;Wiley-VCH Verlag;2012-ongoing;"Fundamentals and Skills (Q2); Research and Theory (Q3)"
336;12000154532;Nursing for Women's Health;journal;17514851, 1751486X;0.114;Q4;15;72;248;400;19;215;0.08;5,56;United States;Elsevier Inc.;2007-ongoing;Nursing (miscellaneous) (Q4)
337;51128;Seminars for nurse managers;journal;10663851;0.114;Q4;8;0;134;0;7;124;0.06;0,00;United Kingdom;W. B. Saunders Co., Ltd.;1994-2002;"Leadership and Management (Q4); Nursing (miscellaneous) (Q4)"
338;18200156704;Working with Older People;journal;13663666;0.114;Q3;8;48;82;48;3;78;0.05;1,00;United Kingdom;Emerald Group Publishing Ltd.;2000-ongoing;"Community and Home Care (Q3); Gerontology (Q4)"
339;5800207384;Journal of Social Work in Long-Term Care;journal;15332624;0.113;Q4;9;34;41;443;3;41;0.07;13,03;United States;Haworth Social Work Practice Press;2001-2004, 2006;"Health (social science) (Q4); Nursing (miscellaneous) (Q4)"
340;32829;Nutritional Sciences Journal;journal;10116958;0.113;Q4;8;31;83;672;5;79;0.08;21,68;China;Zhonghua min guo ying yang xue hui;1994-2013;"Medicine (miscellaneous) (Q3); Nutrition and Dietetics (Q4)"
341;12650;Contemporary Ob/Gyn;journal;00903159;0.111;Q4;9;66;223;1627;18;221;0.06;24,65;United States;UBM Medica Periodical Publication;1975-1977, 1982, 1996-ongoing;"Obstetrics and Gynecology (Q3); Advanced and Specialized Nursing (Q4); Maternity and Midwifery (Q4)"
342;11300153503;Journal of Correctional Health Care;journal;10783458;0.111;Q3;19;17;50;255;2;46;0.06;15,00;United States;SAGE Publications;1994-ongoing;"Community and Home Care (Q3); Public Health, Environmental and Occupational Health (Q4)"
343;26658;Nutrition Clinique et Metabolisme;journal;09850562;0.111;Q4;13;34;140;1000;23;126;0.21;29,41;France;Elsevier Masson;1987-ongoing;"Endocrinology, Diabetes and Metabolism (Q4); Internal Medicine (Q4); Nutrition and Dietetics (Q4)"
344;16988;Patient Care;journal;0031305X;0.11;Q4;8;48;260;689;22;260;0.12;14,35;United States;Advanstar Communications Inc.;1975, 1977-1987, 1989, 1991, 1996-2004;Leadership and Management (Q4)
345;14042;Hospital Materiel Management Quarterly;journal;01922262;0.109;Q4;9;0;63;0;7;58;0.00;0,00;United States;Aspen Publishers;1979-2001;Leadership and Management (Q4)
346;28786;Newborn and Infant Nursing Review;journal;15273369;0.109;Q4;21;36;81;901;9;63;0.14;25,03;United Kingdom;W. B. Saunders Co., Ltd.;2001-ongoing;Pediatrics (Q4)
347;80252;Care of the Critically Ill;journal;02660970;0.10800000000000001;Q3;8;47;162;881;5;119;0.04;18,74;United Kingdom;Houndmills Stockton Press;1990-2010;"Critical Care and Intensive Care Medicine (Q3); Critical Care Nursing (Q3)"
348;29744;Clinician in Management;journal;14759926, 09655751;0.10800000000000001;Q4;9;7;102;111;14;84;0.24;15,86;United Kingdom;BMJ Publishing Group;1999-2007;Leadership and Management (Q4)
349;11000153729;Professional Case Management;journal;19328087;0.10800000000000001;Q2;20;30;108;50;10;93;0.12;1,67;United States;Lippincott Williams & Wilkins Ltd.;2007-ongoing;"Assessment and Diagnosis (Q2); Care Planning (Q3); Health Policy (Q4); Leadership and Management (Q4)"
350;15282;JAAPA : official journal of the American Academy of Physician Assistants;journal;15471896;0.107;Q1;14;78;247;508;16;194;0.07;6,51;United States;Lippincott Williams & Wilkins Ltd.;1999-ongoing;Nurse Assisting (Q1)
351;28818;Nursing;journal;03604039, 15388689;0.107;Q3;20;461;931;99;27;867;0.03;0,21;United States;Lippincott Williams & Wilkins Ltd.;1967-ongoing;"Assessment and Diagnosis (Q3); Advanced and Specialized Nursing (Q4); Critical Care Nursing (Q4); Emergency Nursing (Q4); LPN and LVN (Q4)"
352;29344;Pflege;journal;10125302;0.107;Q4;11;34;121;75;8;106;0.10;2,21;Switzerland;Hogrefe Publishing GmbH;1991-ongoing;"Medicine (miscellaneous) (Q4); Nursing (miscellaneous) (Q4)"
353;17601;Journal of Clinical Biochemistry and Nutrition;journal;09120009;0.106;Q4;50;14;49;424;9;49;0.10;30,29;Japan;Institute of Applied Biochemistry;1993-ongoing;"Clinical Biochemistry (Q4); Medicine (miscellaneous) (Q4); Nutrition and Dietetics (Q4)"
354;28255;Journal of trauma nursing : the official journal of the Society of Trauma Nurses;journal;10787496;0.106;Q4;17;14;53;55;2;53;0.00;3,93;United States;Lippincott Williams & Wilkins Ltd.;1995-ongoing;"Advanced and Specialized Nursing (Q4); Critical Care Nursing (Q4); Emergency Nursing (Q4)"
355;11700154712;Traumatology;journal;15347656, 10859373;0.106;Q4;28;19;19;521;2;14;0.14;27,42;United States;American Psychological Association Inc.;2008-ongoing;"Emergency Medicine (Q4); Nursing (miscellaneous) (Q4); Public Health, Environmental and Occupational Health (Q4)"
356;27681;Enfermeria intensiva / Sociedad Espanola de Enfermeria Intensiva y Unidades Coronarias;journal;11302399, 15781291;0.105;Q4;14;14;51;13;3;45;0.03;0,93;Spain;Ediciones Doyma S.A.;1994-ongoing;"Critical Care and Intensive Care Medicine (Q4); Critical Care Nursing (Q4)"
357;27689;Evidence-based nursing;journal;13676539, 14689618;0.105;Q3;19;103;307;343;19;7;1.86;3,33;United Kingdom;BMJ Publishing Group;2001-ongoing;Fundamentals and Skills (Q3)
358;21100198555;Medizinische Klinik - Intensivmedizin und Notfallmedizin;journal;21936218, 21936226;0.105;Q4;11;0;16;0;1;14;0.07;0,00;Germany;Springer Verlag;2011-ongoing;"Critical Care and Intensive Care Medicine (Q3); Emergency Medicine (Q4); Emergency Nursing (Q4); Internal Medicine (Q4)"
359;29292;Nursing times;journal;09547762;0.105;Q4;24;604;2996;1114;106;2751;0.04;1,84;United Kingdom;Emap Media Ltd.;1947-1951, 1961-ongoing;Nursing (miscellaneous) (Q4)
360;28838;Nursing History Review;journal;10628061;0.10400000000000001;Q4;11;10;29;885;4;29;0.10;88,50;United States;Springer Publishing Company;1993-ongoing;Nursing (miscellaneous) (Q4)
361;29738;Nursing older people;journal;14720795;0.10400000000000001;Q4;17;70;221;299;13;197;0.07;4,27;United Kingdom;Royal College of Nursing Publishing Co.;2000-ongoing;Gerontology (Q4)
362;4700152719;Ciencia y Enfermeria;journal;07172079, 07179553;0.10300000000000001;Q4;11;0;7;0;0;7;0.00;0,00;Chile;Universidad de Concepcion, Facultad de Medicina, Departmento de Enfermeria;2002, 2006-ongoing;Nursing (miscellaneous) (Q4)
363;5000158303;Internet Journal of Law, Healthcare and Ethics;journal;15288250;0.10300000000000001;Q4;4;7;7;118;0;7;0.00;16,86;United States;Internet Scientific Publications;2000, 2003, 2006-2011;Issues, Ethics and Legal Aspects (Q4)
364;4000151502;Journal of perioperative practice;journal;17504589;0.10300000000000001;Q4;14;57;256;133;11;230;0.04;2,33;United Kingdom;Association for Perioperative Practice;2006-ongoing;"Anesthesiology and Pain Medicine (Q4); Medical and Surgical Nursing (Q4); Medicine (miscellaneous) (Q4); Surgery (Q4)"
365;4700152791;Point of Care;journal;15330303, 1533029X;0.10300000000000001;Q4;12;2;8;0;0;7;0.00;0,00;United States;Lippincott Williams & Wilkins Ltd.;2006-ongoing;Nursing (miscellaneous) (Q4)
366;28032;Scandinavian Journal of Nutrition/Naringsforskning, Supplement;journal;11026510;0.10300000000000001;Q4;7;0;6;0;0;6;0.00;0,00;Sweden;Swedish Nutrition Foundation;1996, 1998-2000;"Food Science (Q4); Medicine (miscellaneous) (Q4); Nutrition and Dietetics (Q4)"
367;17600155042;Gerontologie et Societe;journal;01510193, 21010218;0.102;Q4;9;65;124;713;4;118;0.03;10,97;France;Fondation Nationale de Gerontologie;2001-2013, 2018-ongoing;"Geriatrics and Gerontology (Q4); Gerontology (Q4); Health (social science) (Q4)"
368;73057;Journal of Nutritional Immunology;journal;10495150;0.102;Q4;5;0;9;0;1;9;0.11;0,00;United States;Haworth Medical Press;1993-1997;"Immunology (Q4); Nutrition and Dietetics (Q4)"
369;11700154358;Journal of Research in Nursing;journal;1744988X, 17449871;0.102;Q4;28;0;12;0;2;10;0.20;0,00;United Kingdom;SAGE Publications;1996-1999, 2002, 2005-ongoing;Research and Theory (Q4)
370;28116;Voprosy Pitaniia;journal;00428833;0.102;Q4;14;67;203;832;4;202;0.02;12,42;Russian Federation;Nutritec;1954-ongoing;"Medicine (miscellaneous) (Q4); Nutrition and Dietetics (Q4)"
371;4700152255;Women and Birth;journal;18715192;0.102;Q4;31;17;51;248;2;41;0.00;14,59;Netherlands;Elsevier BV;2006-ongoing;"Maternity and Midwifery (Q4); Medicine (miscellaneous) (Q4); Obstetrics and Gynecology (Q4)"
372;500147002;Worldviews on Evidence-Based Nursing;journal;1545102X, 17416787;0.102;Q4;40;3;12;302;1;12;0.08;100,67;United Kingdom;Blackwell Publishing Inc.;2004-ongoing;"Medicine (miscellaneous) (Q4); Nursing (miscellaneous) (Q4)"
373;32990;CRNA: Clinical Forum for Nurse Anesthetists;journal;10482687;0.10099999999999999;Q4;10;0;35;0;3;30;0.00;0,00;United States;Saunders;1992-2000;"Anesthesiology and Pain Medicine (Q4); Nursing (miscellaneous) (Q4)"
374;3900148510;Forum of Nutrition;book series;16600347;0.10099999999999999;Q4;29;163;20;2652;5;20;0.25;16,27;Switzerland;Karger AG;1998, 2001, 2003, 2005-2007, 2009-2010;"Nutrition and Dietetics (Q4); Public Health, Environmental and Occupational Health (Q4)"
375;4700152879;Health Information Management Journal;journal;18333575, 18333583;0.10099999999999999;Q4;19;6;21;0;0;19;0.00;0,00;Australia;SAGE Publications Inc.;2002-ongoing;"Health Policy (Q4); Leadership and Management (Q4)"
376;3300147411;Home Health Care Management and Practice;journal;10848223;0.10099999999999999;Q4;16;97;270;798;4;241;0.01;8,23;United States;SAGE Publications;1988-ongoing;"Community and Home Care (Q4); Leadership and Management (Q4); Public Health, Environmental and Occupational Health (Q4)"
377;21100416601;Inside Case Management;journal;10736514;0.10099999999999999;Q4;1;52;33;34;0;32;0.00;0,65;United States;Lippincott Williams and Wilkins;1995;"Assessment and Diagnosis (Q4); Care Planning (Q4); Health Policy (Q4); Leadership and Management (Q4)"
378;5000158302;Internet Journal of Academic Physician Assistants;journal;10924078;0.10099999999999999;Q2;4;0;13;0;0;13;0.00;0,00;United States;Internet Scientific Publications;1997, 1999, 2001, 2006-2007, 2009-2010;Nurse Assisting (Q2)
379;11700154728;Internet Journal of Pain, Symptom Control and Palliative Care;journal;15288277;0.10099999999999999;Q4;4;0;18;0;0;18;0.00;0,00;United States;Internet Scientific Publications;2001-2002, 2006-2011;"Critical Care and Intensive Care Medicine (Q4); Critical Care Nursing (Q4); Oncology (Q4); Oncology (nursing) (Q4)"
380;4000151903;Journal of Community Nursing;journal;02634465;0.10099999999999999;Q4;9;0;219;0;6;219;0.03;0,00;United Kingdom;PTM Publishers Ltd.;1998-2002, 2006-ongoing;Community and Home Care (Q4)
381;4100151711;Journal of Hospice and Palliative Nursing;journal;15222179, 15390705;0.10099999999999999;Q4;20;31;33;468;0;24;0.00;15,10;United States;Lippincott Williams & Wilkins Ltd.;1999-ongoing;"Advanced and Specialized Nursing (Q4); Community and Home Care (Q4)"
382;29555;Journal of Housing for the Elderly;journal;02763893;0.10099999999999999;Q4;21;16;26;433;2;25;0.08;27,06;United States;Haworth Press Inc.;1983-1995, 1997, 1999, 2001-ongoing;"Gerontology (Q4); Life-span and Life-course Studies (Q4); Public Administration (Q4)"
383;19700175275;Mental Health and Social Inclusion;journal;20428308, 20428316;0.10099999999999999;Q4;10;33;101;43;2;89;0.02;1,30;United Kingdom;Emerald Group Publishing Ltd.;2010-ongoing;"Health (social science) (Q4); Psychiatric Mental Health (Q4); Psychiatry and Mental Health (Q4)"
384;26274;Metiers de la Petite Enfance;journal;1258780X;0.10099999999999999;Q4;3;50;40;33;0;33;0.00;0,66;Netherlands;Elsevier BV;2002-ongoing;"Developmental and Educational Psychology (Q4); Pharmacology (nursing) (Q4)"
385;29324;Online Journal of Nursing Informatics;journal;10899758;0.10099999999999999;Q4;11;15;16;162;0;14;0.00;10,80;United States;On-Line Journal of Nursing Informatics;1997-ongoing;"Health Informatics (Q4); Nursing (miscellaneous) (Q4)"
386;4400151521;Pakistan Journal of Nutrition;journal;16805194;0.10099999999999999;Q4;31;0;31;0;0;31;0.00;0,00;Pakistan;Asian Network for Scientific Information;2002, 2006-ongoing;"Food Science (Q4); Nutrition and Dietetics (Q4); Public Health, Environmental and Occupational Health (Q4)"
387;19700174682;Safer Communities;journal;17578043;0.10099999999999999;Q3;11;39;17;352;1;15;0.07;9,03;United Kingdom;Emerald Group Publishing Ltd.;2009-ongoing;"Community and Home Care (Q3); Law (Q4); Public Health, Environmental and Occupational Health (Q4); Safety Research (Q4)"
388;27073;Aide Soignante;journal;11663413;0.1;Q4;2;109;117;42;0;112;0.00;0,39;Netherlands;Elsevier BV;2002-ongoing;Nursing (miscellaneous) (Q4)
389;27138;Assistenza Infermieristica e Ricerca;journal;15925986;0.1;Q4;9;21;78;24;2;72;0.04;1,14;Italy;II Pensiero Scientifico Editore srl;1999-ongoing;Nursing (miscellaneous) (Q4)
390;27627;Creative nursing;journal;10784535;0.1;Q4;10;11;69;0;0;61;0.00;0,00;United States;Springer Publishing Company;1994-ongoing;"Medicine (miscellaneous) (Q4); Nursing (miscellaneous) (Q4)"
391;13829;Japan Journal of Logopedics and Phoniatrics;journal;00302813;0.1;Q4;5;32;122;518;0;122;0.00;16,19;Japan;Japan Society of Logopedics and Phoniatrics;2000-2001, 2003-ongoing;"LPN and LVN (Q4); Speech and Hearing (Q4)"
392;28260;Nursing New Zealand (Wellington, N.Z. : 1995);journal;11732032;0.1;Q4;6;153;419;140;1;302;0.01;0,92;New Zealand;New Zealand Nurses' Organization;1995-ongoing;"Medicine (miscellaneous) (Q4); Nursing (miscellaneous) (Q4)"
393;57692;Nutricion Clinica y Dietetica Hospitalaria;journal;02116057, 1989208X;0.1;Q4;10;45;42;746;0;42;0.00;16,58;Spain;Alpe Editores;1981-1982, 2002-ongoing;"Medicine (miscellaneous) (Q4); Nutrition and Dietetics (Q4)"
394;29387;Revista Cubana de Enfermeria;journal;08640319, 15612961;0.1;Q4;6;0;90;0;0;90;0.00;0,00;Cuba;Editorial Ciencias Medicas;1985-2002, 2006-ongoing;Nursing (miscellaneous) (Q4)
395;30008;Revista da Escola de Enfermagem da U S P;journal;00806234;0.1;Q4;25;49;150;176;0;149;0.00;3,59;Brazil;Universidade de Sao Paulo;1967-ongoing;Nursing (miscellaneous) (Q4)
396;29389;Revista Latino-Americana de Enfermagem;journal;01041169, 15188345;0.1;Q4;30;109;291;397;7;279;0.01;3,64;Brazil;University of Sao Paulo, Ribeirao Preto College of Nursing Organisation;1993-ongoing;Nursing (miscellaneous) (Q4)
397;9500153969;Revue de l'Infirmiere;journal;12938505;0.1;Q4;4;187;269;69;1;268;0.01;0,37;France;Elsevier Masson SAS;1971-2000, 2002-ongoing;Nursing (miscellaneous) (Q4)
398;21100840445;Revue Internationale de Soins Palliatifs;journal;22352155, 16641531;0.1;Q4;5;51;50;392;1;39;0.03;7,69;Switzerland;Editions Medecine et Hygiene;2013, 2017-ongoing;"Advanced and Specialized Nursing (Q4); Fundamentals and Skills (Q4); Medicine (miscellaneous) (Q4)"
399;29948;Soins. Gerontologie;journal;12686034;0.1;Q4;5;62;201;88;1;201;0.01;1,42;France;Masson Publishing;1996-ongoing;"Gerontology (Q4); Medicine (miscellaneous) (Q4)"
400;29946;"Soins; la revue de reference infirmiere";journal;00380814;0.1;Q4;5;191;474;65;3;470;0.01;0,34;France;Masson Publishing;1965-1973, 1976-ongoing;"Medicine (miscellaneous) (Q4); Nursing (miscellaneous) (Q4)"
401;29950;Soins. Pediatrie, puericulture;journal;12594792;0.1;Q4;3;66;211;72;3;210;0.01;1,09;France;Masson Publishing;1995-ongoing;Pediatrics (Q4)
402;29952;Soins. Psychiatrie;journal;02416972;0.1;Q4;5;58;193;22;1;187;0.01;0,38;France;Masson Publishing;1980-ongoing;"Medicine (miscellaneous) (Q4); Psychiatric Mental Health (Q4)"
403;20218;The Journal of the Egyptian Public Health Association;journal;00132446;0.1;Q4;14;27;88;0;0;88;0.00;0,00;United States;Lippincott Williams & Wilkins Ltd.;1965-1974, 1976-1980, 1985, 1988-2005, 2007, 2010-ongoing;"Community and Home Care (Q4); Health Informatics (Q4); Public Health, Environmental and Occupational Health (Q4)"
404;28123;The practising midwife;journal;14613123;0.1;Q4;10;104;429;586;11;408;0.03;5,63;United Kingdom;Hochland & Hochland Ltd;1998-ongoing;"Maternity and Midwifery (Q4); Medicine (miscellaneous) (Q4)"
405;21100259112;Australasian Journal of Paramedicine;journal;22027270;;-;13;13;0;185;0;0;0.00;14,23;Australia;Faculty of Health, Engineering and Science, Edith Cowan University;2013-ongoing;"Emergency Medical Services; Emergency Medicine; Emergency Nursing"
406;100147025;Clinical Medicine and Research;journal;15394182, 15546179;;-;47;52;0;1166;0;0;0.00;22,42;United States;Marshfield Clinic;2003-ongoing;"Community and Home Care; Medicine (miscellaneous)"
407;38677;Ernahrungs Umschau;journal;03402371;;-;12;71;0;666;0;0;0.00;9,38;Germany;Main Umschau Verlag Breidenstein;1973-1978, 1981-1982, 2003-ongoing;"Medicine (miscellaneous); Nutrition and Dietetics"
408;29041;Geriatrics and Aging;journal;14888416, 14888408;;-;10;184;0;2170;0;0;0.00;11,79;Canada;Ribosome Communications;2003-2009;"Aging; Geriatrics and Gerontology; Gerontology"
409;52557;International Journal of Nursing Education Scholarship;journal;1548923X;;-;31;1;0;36;0;0;0.00;36,00;Germany;Walter de Gruyter GmbH;2003-ongoing;"Education; Nursing (miscellaneous)"
410;5000158307;Musculoskeletal care;journal;14782189, 15570681;;-;24;16;0;30;0;0;0.00;1,88;United States;Wiley-Blackwell;2003, 2006-ongoing;"Chiropractics; Nursing (miscellaneous); Orthopedics and Sports Medicine; Physical Therapy, Sports Therapy and Rehabilitation; Rehabilitation; Rheumatology"
411;28813;Nurse Leader;journal;15414612, 15414620;;-;11;23;0;52;0;0;0.00;2,26;United States;Mosby Inc.;2003-ongoing;Leadership and Management
412;29254;Nursing Philosophy;journal;14667681, 1466769X;;-;29;33;0;338;0;0;0.00;10,24;United Kingdom;Blackwell Publishing Inc.;2003-ongoing;"Issues, Ethics and Legal Aspects; Medicine (miscellaneous); Research and Theory"
413;4000151904;Palliative and Supportive Care;journal;14789523, 14789515;;-;41;49;0;389;0;0;0.00;7,94;United Kingdom;Cambridge University Press;2003-ongoing;"Clinical Psychology; Medicine (miscellaneous); Nursing (miscellaneous); Psychiatry and Mental Health"
414;79572;Revista Romana de Bioetica;journal;15835170;;-;9;3;0;0;0;0;0.00;0,00;Romania;Kolos;2003, 2007-2015;"Health Policy; Health (social science); Issues, Ethics and Legal Aspects"
