Rank;Sourceid;Title;Type;Issn;SJR;SJR Best Quartile;H index;Total Docs. (2004);Total Docs. (3years);Total Refs.;Total Cites (3years);Citable Docs. (3years);Cites / Doc. (2years);Ref. / Doc.;Country;Publisher;Coverage;Categories
2479;23370;Journal of Environmental Law and Litigation;journal;10490280;0.111;Q3;9;16;35;2726;4;35;0.11;170.38;United States;University of Oregon;1996-ongoing;"Geography, Planning and Development (Q3); Law (Q3); Management, Monitoring, Policy and Law (Q4)"
2480;19800188055;Journal of Financial Crime;journal;17587239, 13590790;0.111;Q3;18;38;67;1276;6;67;0.09;33.58;United Kingdom;Emerald Group Publishing Ltd.;1993-ongoing;"Law (Q3); Economics, Econometrics and Finance (miscellaneous) (Q4)"
2481;12245;Journal of HIV/AIDS and Social Services;journal;1538151X, 15381501;0.111;Q4;13;27;33;619;3;27;0.11;22.93;United States;Haworth Press Inc.;2002-ongoing;Health (social science) (Q4)
2482;4700152620;Journal of Indian Philosophy;journal;00221791;0.111;Q3;16;20;71;795;10;71;0.13;39.75;Netherlands;Kluwer Academic Publishers;1970-ongoing;"Cultural Studies (Q3); Philosophy (Q3)"
2483;16271;Journal of legislation;journal;01469584;0.111;Q4;1;0;2;0;0;2;0;0;United States;University of Notre Dame, Law School;1978, 1981-1982, 1993, 2001, 2003;"Medicine (miscellaneous) (Q4); Social Sciences (miscellaneous) (Q4)"
2484;20358;Journal of Rural Co-operation;journal;03777480;0.111;Q4;9;8;28;133;1;28;0.06;16.63;Israel;International Research Center on Rural Cooperative Communities;1984-1993, 1995-2010;"Geography, Planning and Development (Q4); Urban Studies (Q4)"
2485;22763;Journal of the American Oriental Society. American Oriental Society;journal;00030279;0.111;Q3;13;31;68;917;5;68;0.07;29.58;United States;American Oriental Society;1971, 1973, 1979, 1982, 1986, 1988, 1998, 2002-2008, 2010-ongoing;"Cultural Studies (Q3); Arts and Humanities (miscellaneous) (Q4)"
2486;29408;Judaism;journal;00225762;0.111;Q3;4;32;57;270;2;51;0.04;8.44;United States;American Jewish Congress;1973, 1975-1976, 1985, 1988-1989, 1995-1996, 1999, 2002-2006;"Religious Studies (Q2); Cultural Studies (Q3); History (Q3); Medicine (miscellaneous) (Q3); Philosophy (Q3)"
2487;145569;L1-Educational Studies in Language and Literature;journal;15676617;0.111;Q3;12;4;9;153;0;3;0;38.25;Netherlands;Kluwer Academic Publishers;2001-ongoing;"Literature and Literary Theory (Q2); Language and Linguistics (Q3); Linguistics and Language (Q3); Education (Q4); Health Professions (miscellaneous) (Q4); Psychology (miscellaneous) (Q4)"
2488;30372;Land Reform, Land Settlement and Cooperratives;journal;02511894;0.111;Q4;8;19;43;688;1;43;0.03;36.21;Italy;Food and Agriculture Organization of the United Nations;1978-1979, 1982-1990, 1993-2001, 2003-2009;"Development (Q4); Geography, Planning and Development (Q4); Urban Studies (Q4)"
2489;5800207561;Langue Francaise;journal;00238368;0.111;Q3;11;28;62;691;8;58;0.14;24.68;France;Armand Colin Editeur;2002-ongoing;"Language and Linguistics (Q3); Linguistics and Language (Q3)"
2490;16494;Late imperial China = Ch'ing shih wen t'i;journal;08843236, 10863257;0.111;Q2;12;8;19;541;5;19;0.29;67.63;United States;Johns Hopkins University Press;1987-1988, 2001-ongoing;"Cultural Studies (Q2); History (Q2)"
2491;17300154965;Leo Baeck Institute Yearbook;book series;00758744;0.111;Q3;7;0;2;0;2;2;0;0;United Kingdom;Oxford University Press;1996, 1999, 2001, 2005-2012, 2014-ongoing;"Cultural Studies (Q3); History (Q3)"
2492;16100154756;Lexikos;journal;16844904, 22240039;0.111;Q3;12;25;45;427;8;39;0.21;17.08;South Africa;Buro van die Woordeboek van die Afrikaanse Taal;2002-ongoing;"Language and Linguistics (Q3); Linguistics and Language (Q3)"
2493;27223;Luso-Brazilian Review;journal;15489957, 00247413;0.111;Q3;4;0;2;0;0;2;0;0;United States;University of Wisconsin Press;1978, 1980-1981, 2001, 2009-ongoing;"Literature and Literary Theory (Q2); Cultural Studies (Q3); History (Q3); Sociology and Political Science (Q4)"
2494;22936;Maryland historical magazine;journal;00254258;0.111;Q4;1;0;2;0;0;2;0;0;United States;Maryland Historical Society;1955, 1964, 1970, 1972, 1974, 1978-1979, 1981-1982, 1985-1988, 2000-2002;"Medicine (miscellaneous) (Q4); Social Sciences (miscellaneous) (Q4)"
2495;5700165111;Media History;journal;13688804;0.111;Q3;8;0;2;0;0;2;0;0;United Kingdom;Carfax Publishing Ltd.;2001, 2010-ongoing;"Cultural Studies (Q3); History (Q3); Communication (Q4)"
2496;6500153152;Medium Aevum;journal;00258385;0.111;Q3;8;16;30;798;5;30;0.17;49.88;United Kingdom;Society for the Study of Mediaeval Languages and Literature;2002-ongoing;"Literature and Literary Theory (Q1); Language and Linguistics (Q3); Linguistics and Language (Q3)"
2497;21100201776;Melanges de l'Ecole Francaise de Rome:Antiquite;journal;02235102, 17242134;0.111;Q3;6;29;54;2133;5;54;0.09;73.55;Italy;Casalini Libri Digital Division;2002-2007, 2009-2012, 2014-ongoing;"Classics (Q2); Visual Arts and Performing Arts (Q2); Archeology (Q3); Archeology (arts and humanities) (Q3); History (Q3)"
2498;19700175275;Mental Health and Social Inclusion;journal;20428308, 20428316;0.111;Q4;10;31;100;84;2;88;0.02;2.71;United Kingdom;Emerald Group Publishing Ltd.;2010-ongoing;"Health (social science) (Q4); Psychiatric Mental Health (Q4); Psychiatry and Mental Health (Q4)"
2499;24474;Modern Philology;journal;00268232, 15456951;0.111;Q2;13;13;55;799;5;55;0.05;61.46;United States;University of Chicago Press;1984, 1986, 1996-ongoing;"Literature and Literary Theory (Q1); Cultural Studies (Q2); Language and Linguistics (Q3); Linguistics and Language (Q3)"
2500;28919;Museum Helveticum;book series;00274054;0.111;Q3;7;12;42;669;2;42;0.05;55.75;Switzerland;Schwabe and Co. AG;1972, 1977, 1986, 2002-ongoing;"Classics (Q2); Language and Linguistics (Q3); Linguistics and Language (Q3)"
2501;5700183838;Muttersprache;journal;0027514X;0.111;Q3;6;27;46;613;6;45;0.13;22.7;Germany;Gesellschaft fur deutsche Sprache;2002-ongoing;"Language and Linguistics (Q3); Linguistics and Language (Q3)"
2502;17018;New Perspectives on Turkey;journal;08966346, 13053299;0.111;Q3;14;0;2;0;0;2;0;0;United Kingdom;Cambridge University Press;1993, 1995, 1999-2002, 2008-ongoing;"Cultural Studies (Q3); History (Q3); Economics and Econometrics (Q4); Sociology and Political Science (Q4)"
2503;19700169884;NORA - Nordic Journal of Feminist and Gender Research;journal;08038740;0.111;Q3;23;22;56;417;7;56;0.18;18.95;United Kingdom;Routledge;1993-ongoing;Gender Studies (Q3)
2504;6700153306;Numismatic Chronicle;journal;00782696;0.111;Q3;8;10;26;744;2;26;0.08;74.4;United Kingdom;Royal Numismatic Society;2002-ongoing;"Archeology (Q3); Archeology (arts and humanities) (Q3)"
2505;5700161058;Portuguese Studies Review;journal;10571515;0.111;Q4;2;0;2;0;0;2;0;0;United States;;;"Medicine (miscellaneous) (Q4); Social Sciences (miscellaneous) (Q4)"
2506;19900191815;Proceedings of the Royal Irish Academy, Section C: Archaeology, Celtic Studies, History, Linguistics and Literature;journal;20090048, 00358991;0.111;Q3;5;0;2;0;0;2;0;0;Ireland;Royal Irish Academy;2010-ongoing;"Literature and Literary Theory (Q2); Archeology (Q3); Archeology (arts and humanities) (Q3); Cultural Studies (Q3); History (Q3)"
2507;25730;Railway Gazette International;journal;03735346;0.111;Q3;6;143;587;12;9;273;0.04;0.08;United States;Reed Business;1972-1981, 1983-2007;"Mechanical Engineering (Q3); Transportation (Q3)"
2508;61243;Recherches amerindiennes au Quebec;journal;03184137;0.111;Q4;1;0;2;0;1;2;0;0;Canada;;;"Medicine (miscellaneous) (Q4); Psychology (miscellaneous) (Q4); Social Sciences (miscellaneous) (Q4)"
2509;5600155553;Religion and American Culture;journal;10521151;0.111;Q2;12;8;22;756;6;22;0.14;94.5;United States;Indiana University Press;2001-ongoing;"Cultural Studies (Q2); Religious Studies (Q2)"
2510;5600152877;Rethinking Marxism;journal;08935696;0.111;Q4;22;30;141;660;30;140;0.16;22;United Kingdom;Routledge;1988-1996, 1998-ongoing;Sociology and Political Science (Q4)
2511;26579;Revista Europea de Estudios Latinoamericanos y del Caribe/European Review of Latin American and Caribbean Studies;journal;09240608;0.111;Q4;7;0;2;0;0;2;0;0;Netherlands;Centre for Latin American Research and Documentation/Centro de Estudios y Documentacin Latinoamericanos (CEDLA);1996, 2001, 2012-ongoing;"History (Q3); Sociology and Political Science (Q4)"
2512;16200154722;Revue Biblique;journal;00350907;0.111;Q3;8;21;39;1191;4;39;0.1;56.71;France;J. Gabalda et Cie;2002-ongoing;"Religious Studies (Q2); Archeology (Q3); Archeology (arts and humanities) (Q3); History (Q3)"
2513;16000154733;Revue des Etudes Anciennes;journal;00352004;0.111;Q3;7;26;38;1656;4;38;0.11;63.69;France;Universite de Bordeaux III;2002-2013, 2017-ongoing;"Classics (Q2); Visual Arts and Performing Arts (Q2); Archeology (Q3); Archeology (arts and humanities) (Q3); History (Q3)"
2514;5700168874;Rhetorica;journal;07348584, 15338541;0.111;Q3;14;14;49;1116;11;49;0.18;79.71;United States;University of California Press;1996-ongoing;"Language and Linguistics (Q3); Linguistics and Language (Q3)"
2515;16400154711;Seminar - A Journal of Germanic Studies;journal;00371939;0.111;Q3;7;22;51;520;4;50;0.06;23.64;Canada;University of Toronto Press;1996-ongoing;"Literature and Literary Theory (Q1); Cultural Studies (Q3)"
2516;16060;Shakespeare Studies;journal;05829399;0.111;Q2;8;15;23;475;5;22;0.23;31.67;United States;Fairleigh Dickinson University Press;1979, 1983, 2002-2013;"Literature and Literary Theory (Q1); Cultural Studies (Q2); Visual Arts and Performing Arts (Q2)"
2517;17501;Slezsky Sbornik;journal;00376833;0.111;Q4;1;0;2;0;0;2;0;0;Czech Republic;;;"Medicine (miscellaneous) (Q4); Social Sciences (miscellaneous) (Q4)"
2518;18128;Sociologisk Forskning;journal;00380342;0.111;Q4;6;27;52;574;2;48;0.06;21.26;Sweden;Swedish Sociological Association;1996-ongoing;Sociology and Political Science (Q4)
2519;16200154735;Studies in the Age of Chaucer;journal;01902407;0.111;Q2;11;10;23;1125;1;22;0.05;112.5;United States;New Chaucer Society, University of Oklahoma;2002-ongoing;"Literature and Literary Theory (Q1); Cultural Studies (Q2); History (Q2)"
2520;5700164553;Taiwan Journal of Anthropology;journal;17271878;0.111;Q4;2;0;0;0;0;0;0;0;China;Academia Sinica;2013-ongoing;Anthropology (Q4)
2521;13161;Teaching Geography;trade journal;03058018;0.111;Q4;7;18;54;99;4;54;0.11;5.5;United Kingdom;Geographical Association;1983, 1997-2014;"Earth-Surface Processes (Q4); Geography, Planning and Development (Q4); Human Factors and Ergonomics (Q4)"
2522;5700153863;The Germanic Review;journal;00168890, 19306962;0.111;Q3;9;14;73;398;4;72;0.06;28.43;United States;Heldref Publications;1974-1980, 1982-1988, 1990-ongoing;"Literature and Literary Theory (Q1); Cultural Studies (Q3)"
2523;16908;The Responsive community : rights and responsibilities;journal;10530754;0.111;Q4;2;0;2;0;1;2;0;0;United States;The George Washington University;1990-1991, 1993-1994, 1996-1997, 1999, 2001-2002;"Medicine (miscellaneous) (Q4); Psychology (miscellaneous) (Q4); Social Sciences (miscellaneous) (Q4)"
2524;20797;Ulster Folklife;journal;00827347;0.111;Q2;3;6;9;302;1;9;0.11;50.33;United Kingdom;Ulster Folk and Transport Museum;1980, 2002-2006, 2010-2014;"Cultural Studies (Q2); Visual Arts and Performing Arts (Q2); History (Q3); Anthropology (Q4)"
2525;21613;University of Baltimore Journal of Environmental Law;journal;10626212;0.111;Q3;3;14;28;978;1;24;0.04;69.86;United States;University of Baltimore;1997-2000, 2002-2009;"Law (Q3); Environmental Science (miscellaneous) (Q4); Geography, Planning and Development (Q4); Management, Monitoring, Policy and Law (Q4)"
2526;16100154768;War in History;journal;09683445, 14770385;0.111;Q3;15;16;56;1807;7;56;0.17;112.94;United Kingdom;SAGE Publications;1994-ongoing;"Cultural Studies (Q3); History (Q3)"
2527;24329;Women's studies;journal;00497878;0.111;Q3;8;0;2;0;0;2;0;0;Switzerland;Gordon and Breach Science Publishers;1972-1984, 1986-1995, 2002, 2010-ongoing;"Gender Studies (Q3); Arts and Humanities (miscellaneous) (Q4); Social Sciences (miscellaneous) (Q4)"
2528;1000147119;Zeitschrift fr Germanistische Linguistik;journal;03013294;0.111;Q3;10;33;81;760;7;81;0.06;23.03;Germany;De Gruyter Mouton;1973-ongoing;"Language and Linguistics (Q3); Linguistics and Language (Q3); Developmental and Educational Psychology (Q4)"
2529;5700158839;Zeitschrift fr Semiotik;journal;01706241;0.111;Q3;4;20;34;639;1;33;0.03;31.95;Germany;Stauffenburg Verlag;2002-ongoing;"Literature and Literary Theory (Q1); Cultural Studies (Q3); Language and Linguistics (Q3); Linguistics and Language (Q3); Philosophy (Q3)"
2530;55565;Zeszyty Instytutu Geografii i Prezestrzennego Zagospodarowania;journal;08676836;0.111;Q4;2;0;2;0;0;2;0;0;Poland;;1998-2001;Geography, Planning and Development (Q4)
2531;27593;ANQ;journal;0895769X;0.11;Q3;5;81;122;603;4;121;0.04;7.44;United States;Heldref Publications;1988-ongoing;"Literature and Literary Theory (Q2); Cultural Studies (Q3); History (Q3)"
2532;16100154750;AUMLA-Journal of the Australasian Universities Language and Literature Association;journal;00012793;0.11;Q3;4;12;40;316;2;39;0.05;26.33;Australia;Australasian Universities Language and Literature Association;2002-2012;"Literature and Literary Theory (Q2); Cultural Studies (Q3); Language and Linguistics (Q3); Linguistics and Language (Q3)"
2533;27650;Chirigaku Hyoron/Geographical Review of Japan;journal;13479555;0.11;Q4;8;52;97;1858;3;97;0.04;35.73;Japan;Nippon Chiri-Gakkai;1978-1984, 1994, 2001-2008, 2011-ongoing;"Earth-Surface Processes (Q4); Geography, Planning and Development (Q4)"
2534;4700152768;EContent;trade journal;15252531;0.11;Q4;8;103;247;2;18;238;0.07;0.02;United States;Online Inc;1999-ongoing;"Information Systems (Q4); Library and Information Sciences (Q4)"
2535;28609;Geodezia es Kartografia;journal;00167118;0.11;Q4;7;33;110;308;11;107;0.11;9.33;Hungary;Hungarian Society of Surveying, Mapping and Remote sensing;1979-1981, 1988-1989, 1991-1992, 1995-2007, 2011-ongoing;"Computers in Earth Sciences (Q4); Earth-Surface Processes (Q4); Geography, Planning and Development (Q4); Geophysics (Q4)"
2536;145485;Historiographia Linguistica;journal;03025160;0.11;Q3;10;16;77;1443;8;76;0.11;90.19;Netherlands;John Benjamins Publishing Company;2001, 2005-ongoing;"History (Q3); Language and Linguistics (Q3); Linguistics and Language (Q3)"
2537;5800169295;International Spectator;journal;03932729;0.11;Q4;22;35;122;336;13;121;0.11;9.6;United Kingdom;Routledge;1983-ongoing;Political Science and International Relations (Q4)
2538;19900192529;Journal of Iberian and Latin American Research;journal;21519668, 13260219;0.11;Q3;7;20;51;210;1;50;0.03;10.5;United Kingdom;Routledge;1995-2008, 2010-ongoing;"Literature and Literary Theory (Q2); Cultural Studies (Q3); Sociology and Political Science (Q4)"
2539;5800207384;Journal of Social Work in Long-Term Care;journal;15332624;0.11;Q4;9;16;75;348;15;73;0.22;21.75;United States;Haworth Social Work Practice Press;2001-2004, 2006;"Health (social science) (Q4); Nursing (miscellaneous) (Q4)"
2540;145516;Language, Culture and Curriculum;journal;07908318;0.11;Q3;26;16;65;0;12;64;0.2;0;United Kingdom;Taylor & Francis;1988-ongoing;"Language and Linguistics (Q3); Linguistics and Language (Q3); Education (Q4)"
2541;5700153725;Representations;journal;07346018;0.11;Q3;29;23;87;1932;19;85;0.17;84;United States;University of California Press;1983, 1986-1988, 1996-ongoing;"Cultural Studies (Q3); Arts and Humanities (miscellaneous) (Q4); Gender Studies (Q4); Sociology and Political Science (Q4)"
2542;24328;Revista de Indias;journal;00348341;0.11;Q3;11;30;55;895;5;54;0.1;29.83;Spain;CSIC Consejo Superior de Investigaciones Cientificas;1980, 1983, 1985-1987, 1996-ongoing;"Cultural Studies (Q3); History (Q3); Sociology and Political Science (Q4)"
2543;17600155221;Revue Internationale et Strategique;journal;12871672;0.11;Q4;5;63;198;1028;5;191;0.02;16.32;France;Dalloz Editions;2001-ongoing;Political Science and International Relations (Q4)
2544;15035;Social Work with Groups;journal;01609513, 15409481;0.11;Q4;20;26;81;476;16;71;0.18;18.31;United States;Haworth Press Inc.;1978-ongoing;"Education (Q4); Social Sciences (miscellaneous) (Q4); Social Work (Q4)"
2545;17600155215;Spirale;journal;12784699, 19516274;0.11;Q4;5;82;271;355;1;241;0;4.33;France;Editions Eres;2001-ongoing;"Developmental and Educational Psychology (Q4); Education (Q4); Health (social science) (Q4)"
2546;21100220342;Studies in Regional Science;journal;02876256, 18806465;0.11;Q4;10;6;136;168;2;136;0.01;28;Japan;The Japan Section of the Regional Science Association International;2008, 2011-ongoing;"Environmental Science (miscellaneous) (Q4); Social Sciences (miscellaneous) (Q4)"
2547;12974;University of Cincinnati Law Review;journal;00096881;0.11;Q3;20;46;125;0;10;117;0.08;0;United States;University of Cincinnati, College of Law;1973, 1975-1978, 1980-1982, 1987, 1990, 1992-1994, 1996-2013, 2016-ongoing;Law (Q3)
2548;22591;World Watch;trade journal;08960615;0.11;Q4;11;22;36;48;4;36;0.05;2.18;United States;Worldwatch Institute;1988-2010;Geography, Planning and Development (Q4)
2549;26737;Zeitschrift fur Romanische Philologie;journal;00498661;0.11;Q3;7;127;71;690;3;71;0.04;5.43;Germany;Walter de Gruyter GmbH;1987, 1996-ongoing;"Literature and Literary Theory (Q2); Language and Linguistics (Q3); Linguistics and Language (Q3)"
2550;5600153996;Academic Questions;journal;08954852;0.109;Q4;9;42;134;383;5;95;0.06;9.12;United States;Springer New York LLC;1987-ongoing;Education (Q4)
2551;23748;Amerikastudien;journal;03402827;0.109;Q3;7;24;47;1230;4;47;0.09;51.25;Germany;Universitaetsverlag Winter GmbH;1983, 1999-2000, 2002-ongoing;"Cultural Studies (Q3); History (Q3)"
2552;5800207689;Anglia;journal;03405222;0.109;Q3;9;24;65;577;4;65;0.02;24.04;Germany;Walter de Gruyter GmbH;1996-1999, 2001-ongoing;"Literature and Literary Theory (Q2); Language and Linguistics (Q3); Linguistics and Language (Q3)"
2553;28888;Computer Law and Security Review;journal;02673649;0.109;Q4;28;62;211;374;15;29;0.24;6.03;United Kingdom;Elsevier Ltd.;1985-ongoing;"Business, Management and Accounting (miscellaneous) (Q3); Computer Networks and Communications (Q4); Law (Q4)"
2554;16293;Journal of Planning and Environment Law;journal;03074870;0.109;Q4;8;35;70;348;5;70;0.04;9.94;United Kingdom;Sweet & Maxwell Ltd;1970, 1979-1989, 1996-ongoing;"Geography, Planning and Development (Q4); Law (Q4); Management, Monitoring, Policy and Law (Q4)"
2555;25683;Rail International;journal;00208442;0.109;Q3;4;50;316;68;9;270;0.03;1.36;Belgium;International Railway Congress Association;1970-1989, 1994-2004;"Transportation (Q3); Mechanical Engineering (Q4)"
2556;5700161893;Revue Internationale de Politique Comparee;journal;13700731, 17821533;0.109;Q4;11;29;80;1040;4;79;0.04;35.86;Belgium;De Boeck & Larcier;2001-ongoing;"Political Science and International Relations (Q4); Sociology and Political Science (Q4)"
2557;29858;Revue Numismatique;journal;04848942;0.109;Q3;6;13;38;502;5;37;0.14;38.62;France;Societe Francaise de Numismatique;1985, 2002-2007, 2009-ongoing;"Archeology (Q3); Archeology (arts and humanities) (Q3)"
2558;29645;Urban Design International;journal;13575317, 14684519;0.109;Q4;25;22;54;430;3;44;0.07;19.55;United Kingdom;Palgrave Macmillan Ltd.;1996-ongoing;"Geography, Planning and Development (Q4); Urban Studies (Q4)"
2559;4600151402;Volta Review;journal;00428639;0.109;Q3;25;19;16;685;6;16;0;36.05;United States;Alexander Graham Bell Association for the Deaf and Hard of Hearing;1946-1948, 1973, 1996-2001, 2004-2015, 2017-ongoing;"Cultural Studies (Q3); Arts and Humanities (miscellaneous) (Q4); Developmental and Educational Psychology (Q4)"
2560;16228;Asian Agri-History;journal;09717730;0.108;Q4;12;24;70;226;9;70;0.15;9.42;India;Asian Agri-History Foundation;1998-2016 (cancelled);"Agricultural and Biological Sciences (miscellaneous) (Q4); Arts and Humanities (miscellaneous) (Q4); Geography, Planning and Development (Q4)"
2561;100147035;Criminal Justice Review;journal;07340168;0.108;Q4;29;14;39;626;5;39;0.17;44.71;United States;SAGE Publications;1976-ongoing;Law (Q4)
2562;28088;Documentacja Geograficzna;journal;00125032;0.108;Q4;5;14;127;180;4;127;0.03;12.86;Poland;Polska Akademia Nauk;1978-1990, 1992-1997, 2001-2004, 2006-2008;"Earth-Surface Processes (Q4); Geography, Planning and Development (Q4)"
2563;144967;Early Childhood Education Journal;journal;10823301;0.108;Q4;32;0;68;0;9;68;0.14;0;Netherlands;Springer Netherlands;1996-2002, 2005-ongoing;"Developmental and Educational Psychology (Q4); Education (Q4)"
2564;15802;Environmental Law and Management;journal;10676058;0.108;Q4;6;26;41;315;5;41;0.17;12.12;United Kingdom;Lawtext Publishing Ltd.;1993-ongoing;"Geography, Planning and Development (Q4); Management, Monitoring, Policy and Law (Q4)"
2565;5700168058;European Journal of Crime, Criminal Law and Criminal Justice;journal;15718174, 09289569;0.108;Q4;15;23;57;0;8;56;0.14;0;Netherlands;Martinus Nijhoff Publishers;1996-2000, 2002-ongoing;"Law (Q4); Political Science and International Relations (Q4); Sociology and Political Science (Q4)"
2566;110097;Food and Drug Law Journal;journal;1064590X;0.108;Q4;18;38;100;1112;16;97;0.11;29.26;United States;Food and Drug Law Institute;1992-ongoing;"Law (Q4); Medicine (miscellaneous) (Q4); Pharmacology (Q4); Public Health, Environmental and Occupational Health (Q4)"
2567;17600155042;Gerontologie et Societe;journal;01510193, 21010218;0.108;Q4;9;67;189;876;11;179;0.03;13.07;France;Fondation Nationale de Gerontologie;2001-2013, 2018-ongoing;"Geriatrics and Gerontology (Q4); Gerontology (Q4); Health (social science) (Q4)"
2568;6000159531;International Journal of Cultural Property;journal;09407391;0.108;Q3;19;0;40;0;2;40;0;0;United Kingdom;Cambridge University Press;1992-2002, 2005-ongoing;"Museology (Q2); Conservation (Q3); Cultural Studies (Q3); History (Q3); Anthropology (Q4)"
2569;20357;Journal of Criminal Law and Criminology;journal;00914169;0.108;Q4;42;26;62;0;6;62;0.05;0;United States;Williams & Wilkins Co.;1974-1985, 1987, 1991, 1996-ongoing;Law (Q4)
2570;4700152402;Journal of Family Social Work;journal;10522158;0.108;Q4;17;20;65;863;12;62;0.14;43.15;United States;Haworth Press Inc.;1994-ongoing;"Development (Q4); Social Work (Q4); Sociology and Political Science (Q4)"
2571;5700162193;Leiden Journal of International Law;journal;09221565, 14789698;0.108;Q4;30;34;116;3123;15;115;0.09;91.85;United Kingdom;Cambridge University Press;1988-ongoing;"Law (Q4); Political Science and International Relations (Q4)"
2572;5800207551;Lingvisticae Investigationes;journal;03784169;0.108;Q3;10;15;37;340;6;37;0.21;22.67;Netherlands;John Benjamins Publishing Company;2008-ongoing;Linguistics and Language (Q3)
2573;16149;Medical Law International;journal;09685332;0.108;Q4;10;8;21;616;4;21;0.18;77;United Kingdom;SAGE Publications Inc.;1993-ongoing;"Law (Q4); Medicine (miscellaneous) (Q4)"
2574;27845;Military Law Review;journal;00264040;0.108;Q4;11;11;53;0;6;53;0.03;0;United States;US Army Judge Advocate General's Corps;1973, 1987, 1989, 1995-ongoing;Law (Q4)
2575;17600154906;Pouvoirs: Revue d'Etudes Constitutionnelles et Politiques;journal;21010390, 01520768;0.108;Q4;6;45;115;656;8;113;0.07;14.58;France;Editions du Seuil;2001-ongoing;"Political Science and International Relations (Q4); Sociology and Political Science (Q4)"
2576;21100429589;Proceedings of the IEEE-EMBS Special Topic Conference on Molecular, Cellular and Tissue Engineering, MCTE 2002;conference and proceedings;00002002;0.108;-;3;0;79;0;5;77;0.06;0;United States;;2002;"Computer Science Applications; Hardware and Architecture; Human-Computer Interaction; Human Factors and Ergonomics; Mechanical Engineering"
2577;16100154707;Res: Anthropology and Aesthetics;journal;02771322;0.108;Q3;8;4;53;241;2;51;0.04;60.25;United States;Peabody Museum of Archaeology and Ethnology, Harvard University;2002-2010, 2012, 2017-ongoing;"Visual Arts and Performing Arts (Q2); Archeology (Q3); Archeology (arts and humanities) (Q3); Anthropology (Q4)"
2578;4100151520;Research in Public Policy Analysis and Management;book series;07321317;0.108;Q4;8;19;43;692;6;41;0;36.42;United Kingdom;Emerald Group Publishing Ltd.;2001-2002, 2004, 2006-2008, 2010-2013;"Business, Management and Accounting (miscellaneous) (Q3); Development (Q4); Public Administration (Q4); Sociology and Political Science (Q4)"
2579;20383;Temple Law Review;journal;08998086;0.108;Q4;14;28;62;0;3;51;0.1;0;United States;Temple University;1992-1994, 1996-ongoing;Law (Q4)
2580;5600153334;Women's History Review;journal;09612025, 1747583X;0.108;Q4;19;32;97;1148;9;92;0.06;35.88;United Kingdom;Triangle Journals Ltd.;1992-ongoing;"History (Q3); Gender Studies (Q4)"
2581;5700169025;Women's Writing;journal;17475848, 09699082;0.108;Q4;12;20;89;498;7;87;0.09;24.9;United Kingdom;Triangle Journals Ltd.;1994-2005, 2010-ongoing;"Literature and Literary Theory (Q2); Gender Studies (Q4)"
2582;21100382610;Advances in the History of Rhetoric;journal;15362426, 19360835;0.107;Q3;5;19;10;458;0;3;0;24.11;United Kingdom;Taylor and Francis Ltd.;1997-1999, 2002-2007, 2011-ongoing;"Literature and Literary Theory (Q2); Language and Linguistics (Q3); Linguistics and Language (Q3); Communication (Q4)"
2583;19700188379;Arbeiderhistorie;journal;08017778;0.107;Q4;2;0;3;0;0;3;0;0;Norway;Arbeiderbevegelsens arkiv og bibliotek;2001, 2011, 2013-ongoing;"History (Q3); Sociology and Political Science (Q4)"
2584;25354;Canadian Journal of African Studies;journal;00083968;0.107;Q3;6;0;3;0;0;3;0;0;United Kingdom;Taylor and Francis Ltd.;1976, 1980, 1982-1986, 1988-1996, 1999, 2001, 2014-ongoing;"Cultural Studies (Q3); History (Q3); Anthropology (Q4); Demography (Q4); Development (Q4); Geography, Planning and Development (Q4); Sociology and Political Science (Q4)"
