Rank;Sourceid;Title;Type;Issn;SJR;SJR Best Quartile;H index;Total Docs. (2004);Total Docs. (3years);Total Refs.;Total Cites (3years);Citable Docs. (3years);Cites / Doc. (2years);Ref. / Doc.;Country;Publisher;Coverage;Categories
846;21617;Nations and Nationalism;journal;14698129, 13545078;0.382;Q1;39;33;73;1298;50;73;0.73;39.33;United Kingdom;Blackwell Publishing Inc.;1995-ongoing;"Geography, Planning and Development (Q1); Arts and Humanities (miscellaneous) (Q2); Political Science and International Relations (Q2)"
847;15681;Journal of Digital Information;journal;13687506;0.381;Q2;24;22;47;904;74;46;1.61;41.09;United Kingdom;British Computer Society;1996-2012;"E-learning (Q2); Library and Information Sciences (Q2); Computer Science Applications (Q3); Information Systems (Q3)"
848;25314;Journal of Drug Education;journal;15414159, 00472379;0.381;Q2;36;25;79;996;75;79;0.74;39.84;United States;SAGE Publications Inc.;1972-ongoing;"Health (social science) (Q2); Medicine (miscellaneous) (Q2); Psychiatry and Mental Health (Q2); Public Health, Environmental and Occupational Health (Q2)"
849;26252;Maritime Policy and Management;journal;03088839;0.381;Q1;48;29;88;837;74;77;0.86;28.86;United Kingdom;Taylor & Francis;1976-ongoing;"Geography, Planning and Development (Q1); Ocean Engineering (Q1); Management, Monitoring, Policy and Law (Q2); Transportation (Q2)"
850;18086;Sociological Inquiry;journal;1475682X, 00380245;0.381;Q2;45;26;85;1420;39;79;0.39;54.62;United Kingdom;Blackwell Publishing Inc.;1961-ongoing;Sociology and Political Science (Q2)
851;10300153321;HOMO- Journal of Comparative Human Biology;journal;16181301, 0018442X;0.38;Q1;27;17;48;674;26;47;0.52;39.65;Germany;Elsevier BV;1950-1951, 1995-ongoing;"Anthropology (Q1); Medicine (miscellaneous) (Q2)"
852;19700167014;Journal of Gay and Lesbian Mental Health;journal;19359705, 19359713;0.38;Q2;27;23;98;451;44;91;0.52;19.61;United States;Taylor and Francis;2008-ongoing;"Clinical Psychology (Q2); Health (social science) (Q2); Psychiatry and Mental Health (Q2)"
853;28806;Nurse Education Today;journal;02606917;0.38;Q2;65;85;267;2544;175;210;0.66;29.93;United Kingdom;Churchill Livingstone;1985-ongoing;"Nursing (miscellaneous) (Q1); Education (Q2)"
854;22614;Research in the Teaching of English;journal;0034527X;0.38;Q1;33;16;11;701;13;11;0;43.81;United States;National Council of Teachers of English;1996-2001, 2004-ongoing;"Language and Linguistics (Q1); Linguistics and Language (Q1); Education (Q2)"
855;27949;Zeitschrift fr Wirtschaftsgeographie;journal;00443751;0.38;Q1;14;16;48;720;26;48;0.29;45;Germany;Walter de Gruyter GmbH;1978-1981, 1984, 1988-ongoing;"Geography, Planning and Development (Q1); Economics and Econometrics (Q3)"
856;144636;Linguistics and Philosophy;journal;01650157;0.379;Q1;43;0;41;0;30;41;0.74;0;Netherlands;D. Reidel Pub. Co.;1977-2002, 2005-ongoing;"Linguistics and Language (Q1); Philosophy (Q1)"
857;23256;System;journal;0346251X;0.379;Q1;63;34;86;1162;51;83;0.63;34.18;United Kingdom;Elsevier Ltd.;1973-ongoing;"Language and Linguistics (Q1); Linguistics and Language (Q1); Education (Q2)"
858;4100151507;Research in Social Stratification and Mobility;book series;02765624;0.378;Q2;30;27;31;1356;18;30;0.65;50.22;United Kingdom;Elsevier Ltd.;2004-ongoing;Social Sciences (miscellaneous) (Q2)
859;34940;Medical Anthropology: Cross Cultural Studies in Health and Illness;journal;01459740;0.377;Q1;37;12;48;643;40;42;1.04;53.58;United Kingdom;Taylor & Francis;1977-1986, 1989-1997, 1999-ongoing;"Anthropology (Q1); Health (social science) (Q2)"
860;5700161756;Anthropological Theory;journal;14634996;0.376;Q1;44;22;78;1171;64;69;0.73;53.23;United States;SAGE Publications;2001-ongoing;"Anthropology (Q1); Arts and Humanities (miscellaneous) (Q2)"
861;12125;Behaviour and Information Technology;journal;13623001, 0144929X;0.376;Q2;65;42;137;1441;113;127;0.68;34.31;United Kingdom;Taylor & Francis;1982-ongoing;"Arts and Humanities (miscellaneous) (Q2); Human-Computer Interaction (Q2); Social Sciences (miscellaneous) (Q2); Developmental and Educational Psychology (Q3)"
862;19111;Human Factors and Ergonomics In Manufacturing;journal;10908471, 15206564;0.376;Q2;31;24;68;737;40;68;0.47;30.71;United States;John Wiley & Sons Inc.;1996-ongoing;"Industrial and Manufacturing Engineering (Q1); Human Factors and Ergonomics (Q2)"
863;17493;Internet Research;journal;10662243;0.376;Q2;71;40;134;1286;135;125;0.85;32.15;United Kingdom;Emerald Group Publishing Ltd.;1995-ongoing;"Communication (Q2); Sociology and Political Science (Q2); Economics and Econometrics (Q3)"
864;13360;Knowledge Organization;journal;09437444;0.376;Q2;24;19;47;364;15;43;0.33;19.16;Germany;Ergon Verlag;1993-ongoing;Library and Information Sciences (Q2)
865;25722;World Policy Journal;journal;07402775;0.376;Q2;19;42;103;629;47;100;0.51;14.98;United States;Duke University Press;1989, 1994, 1996-ongoing;"Political Science and International Relations (Q2); Sociology and Political Science (Q2)"
866;19700187622;Research Papers in Education;journal;02671522;0.375;Q2;37;24;67;822;31;59;0.54;34.25;United Kingdom;Taylor & Francis;1986-ongoing;Education (Q2)
867;29421;Aquaculture, Economics and Management;journal;13657305, 13657313;0.373;Q1;28;23;72;438;35;72;0.46;19.04;United Kingdom;Taylor & Francis;1997-ongoing;"Geography, Planning and Development (Q1); Ecology (Q2); Aquatic Science (Q3)"
868;17740;Compendium on Continuing Education for the Practicing Veterinarian;journal;01931903;0.373;Q2;33;113;264;2554;134;251;0.54;22.6;United States;Veterinary Learning Systems;1996-2006;"Education (Q2); Veterinary (miscellaneous) (Q2)"
869;28465;Economic Development Quarterly;journal;08912424;0.373;Q2;41;32;88;884;56;87;0.64;27.63;United States;SAGE Publications;1987-ongoing;"Development (Q2); Urban Studies (Q2); Economics and Econometrics (Q3)"
870;15420;Electronic Library;journal;02640473;0.373;Q2;33;115;283;591;75;185;0.46;5.14;United Kingdom;Emerald Group Publishing Ltd.;1984-ongoing;"Library and Information Sciences (Q2); Computer Science Applications (Q3)"
871;13338;Health Care Analysis;journal;15733394, 10653058;0.372;Q2;32;27;87;618;61;84;0.71;22.89;Netherlands;Kluwer Academic Publishers;1993-ongoing;"Health Policy (Q2); Health (social science) (Q2); Issues, Ethics and Legal Aspects (Q2)"
872;97337;International Journal of Osteoarchaeology;journal;10991212, 1047482X;0.372;Q1;53;38;126;1536;81;125;0.67;40.42;United States;John Wiley & Sons Inc.;1991-ongoing;"Anthropology (Q1); Archeology (Q1); Archeology (arts and humanities) (Q1)"
873;22886;Developing World Bioethics;journal;14718731, 14718847;0.371;Q2;23;13;57;389;40;50;0.79;29.92;United Kingdom;Blackwell Publishing Inc.;2001-ongoing;"Health Policy (Q2); Health (social science) (Q2); Issues, Ethics and Legal Aspects (Q2)"
874;19700201158;Studies in Science Education;journal;19408412, 03057267;0.371;Q2;39;4;16;651;23;1;20;162.75;United Kingdom;Taylor and Francis Inc.;1974-ongoing;Education (Q2)
875;20720;Ethnicity and Health;journal;14653419, 13557858;0.37;Q1;49;21;69;891;70;67;0.81;42.43;United Kingdom;Carfax Publishing Ltd.;1996-ongoing;"Cultural Studies (Q1); Arts and Humanities (miscellaneous) (Q2); Public Health, Environmental and Occupational Health (Q2)"
876;16907;Research on Social Work Practice;journal;10497315;0.37;Q2;56;44;132;1639;108;127;0.8;37.25;United States;SAGE Publications;1991-ongoing;"Psychology (miscellaneous) (Q2); Social Sciences (miscellaneous) (Q2); Social Work (Q2); Sociology and Political Science (Q2)"
877;5700161063;Urban Forum;journal;10153802;0.37;Q1;31;17;42;720;28;42;0.71;42.35;Netherlands;Springer Netherlands;1990-ongoing;"Geography, Planning and Development (Q1); Urban Studies (Q2)"
878;27696;Journal of Southern African Studies;journal;03057070, 14653893;0.369;Q1;42;40;113;1070;72;113;0.56;26.75;United Kingdom;Carfax Publishing Ltd.;1974-ongoing;"Geography, Planning and Development (Q1); Arts and Humanities (miscellaneous) (Q2); Sociology and Political Science (Q2)"
879;22090;High Ability Studies;journal;13598139, 1469834X;0.368;Q2;28;22;41;635;16;39;0.36;28.86;United Kingdom;Carfax Publishing Ltd.;1996-ongoing;Education (Q2)
880;29275;Journal of Geography in Higher Education;journal;03098265, 14661845;0.368;Q1;41;33;79;912;57;79;0.53;27.64;United Kingdom;Carfax Publishing Ltd.;1977-ongoing;"Geography, Planning and Development (Q1); Education (Q2)"
881;5800207537;Language and Literature;journal;09639470, 14617293;0.368;Q1;23;19;60;632;32;47;0.97;33.26;United States;SAGE Publications;1996-ongoing;"Language and Linguistics (Q1); Linguistics and Language (Q1); Literature and Literary Theory (Q1)"
882;20960;Science and Public Policy;journal;03023427, 14715430;0.368;Q1;55;40;124;1184;85;124;0.65;29.6;United Kingdom;Oxford University Press;1978-1982, 1985-1986, 1988-ongoing;"Geography, Planning and Development (Q1); Management, Monitoring, Policy and Law (Q2); Public Administration (Q2)"
883;14506;Local Environment;journal;14696711, 13549839;0.367;Q1;53;38;97;1147;62;96;0.58;30.18;United Kingdom;Carfax Publishing Ltd.;1996-ongoing;"Geography, Planning and Development (Q1); Management, Monitoring, Policy and Law (Q2)"
884;12397;Polar Record;journal;00322474, 14753057;0.367;Q2;28;28;99;1014;43;95;0.34;36.21;United Kingdom;Cambridge University Press;1931-ongoing;"Earth and Planetary Sciences (miscellaneous) (Q2); Ecology (Q2); Geography, Planning and Development (Q2)"
885;17479;International Journal of Water Resources Development;journal;13600648, 07900627;0.366;Q2;46;38;116;674;44;116;0.37;17.74;United Kingdom;Carfax Publishing Ltd.;1983-1985, 1987-ongoing;"Development (Q2); Water Science and Technology (Q2)"
886;18950;Journal of College Student Development;journal;08975264, 15433382;0.366;Q2;67;43;162;1682;132;159;0.79;39.12;United States;The Johns Hopkins University Press;1996-ongoing;Education (Q2)
887;57810;Journal of Cultural Heritage;journal;12962074;0.366;Q2;53;44;171;846;111;161;0.63;19.23;France;Elsevier Masson;2000-ongoing;"Archeology (arts and humanities) (Q1); Conservation (Q1); History (Q1); Anthropology (Q2); Chemistry (miscellaneous) (Q2); Materials Science (miscellaneous) (Q2); Spectroscopy (Q4)"
888;5600156553;Journal of Pacific History;journal;00223344;0.366;Q1;17;20;60;1416;25;56;0.39;70.8;United Kingdom;Taylor & Francis;1966-ongoing;"Cultural Studies (Q1); History (Q1); Sociology and Political Science (Q2)"
889;37903;Ethos;journal;00912131, 15481352;0.365;Q2;39;27;63;1221;45;63;0.54;45.22;United States;Wiley-Blackwell;1973-ongoing;"Anthropology (Q2); Arts and Humanities (miscellaneous) (Q2); Sociology and Political Science (Q2)"
890;15631;International Journal of Information Management;journal;02684012;0.365;Q2;91;40;107;1076;106;89;0.82;26.9;United Kingdom;Elsevier Ltd.;1986-ongoing;"Computer Networks and Communications (Q2); Library and Information Sciences (Q2); Information Systems (Q3)"
891;18140;Sociology of Religion;journal;10694404;0.365;Q2;41;0;25;0;22;25;0;0;United States;Association for the Sociology of Religion;1996, 1998-2001, 2005-ongoing;"Religious Studies (Q1); Social Sciences (miscellaneous) (Q2)"
892;25874;Sustainable Development;journal;10991719, 09680802;0.365;Q2;51;18;61;618;51;61;0.64;34.33;United States;John Wiley & Sons Inc.;1993-ongoing;"Development (Q2); Renewable Energy, Sustainability and the Environment (Q2)"
893;22112;Traffic Injury Prevention;journal;15389588, 1538957X;0.365;Q1;44;51;101;1735;73;95;0.77;34.02;United Kingdom;Taylor & Francis;2002-ongoing;"Safety Research (Q1); Public Health, Environmental and Occupational Health (Q2)"
894;24054;Communication Education;journal;03634523;0.364;Q2;54;25;86;949;69;84;0.52;37.96;United Kingdom;Routledge;1976-ongoing;"Language and Linguistics (Q1); Communication (Q2); Education (Q2)"
895;15877;Journal of Community Health;journal;00945145, 15733610;0.363;Q2;54;34;98;917;94;97;0.95;26.97;Netherlands;Kluwer Academic Publishers;1975-ongoing;"Health (social science) (Q2); Public Health, Environmental and Occupational Health (Q2)"
896;18463;Africa;journal;00019720;0.362;Q2;38;28;78;1232;39;78;0.47;44;United Kingdom;Cambridge University Press;1928-1940, 1943-ongoing;"Anthropology (Q2); Arts and Humanities (miscellaneous) (Q2); Geography, Planning and Development (Q2)"
897;28710;British Journal of Social Work;journal;00453102, 1468263X;0.36;Q2;71;66;180;2479;168;178;0.63;37.56;United Kingdom;Oxford University Press;1971-ongoing;"Health (social science) (Q2); Social Sciences (miscellaneous) (Q2); Social Work (Q2)"
898;5600153363;Equity & Excellence in Education;journal;10665684;0.36;Q2;35;35;89;1560;36;89;0.5;44.57;United Kingdom;Taylor & Francis;1963-1982, 1984, 1986-1988, 1991, 1993-ongoing;Education (Q2)
899;23098;Jahrbuch fr Regional Wissenschaft/Review of Regional Research;journal;01737600;0.36;Q2;13;5;27;214;12;27;0.22;42.8;Germany;Springer Verlag;1998-ongoing;Geography, Planning and Development (Q2)
900;27691;Journal of Public Policy;journal;14697815, 0143814X;0.36;Q2;43;14;43;812;27;43;0.47;58;United Kingdom;Cambridge University Press;1981-ongoing;"Management, Monitoring, Policy and Law (Q2); Public Administration (Q2)"
901;12395;Polar Geography;journal;1088937X;0.36;Q2;24;21;52;857;24;52;0.27;40.81;United Kingdom;Taylor & Francis;1977-1979, 1995-2005, 2007-ongoing;"Agricultural and Biological Sciences (miscellaneous) (Q2); Earth and Planetary Sciences (miscellaneous) (Q2); Geography, Planning and Development (Q2)"
902;23346;Journal of Environment and Development;journal;10704965;0.359;Q2;37;22;70;670;33;68;0.31;30.45;United States;SAGE Publications;1992-ongoing;"Development (Q2); Geography, Planning and Development (Q2); Management, Monitoring, Policy and Law (Q2)"
903;16723;Journal of Intellectual and Developmental Disability;journal;13668250, 14699532;0.359;Q2;48;31;81;933;42;76;0.44;30.1;United Kingdom;Carfax Publishing Ltd.;1970-2013, 2017-ongoing;"Arts and Humanities (miscellaneous) (Q2); Education (Q2); Medicine (miscellaneous) (Q2); Psychology (miscellaneous) (Q2)"
904;14031;Psychology of Men and Masculinity;journal;15249220;0.358;Q1;50;20;33;837;41;33;1.14;41.85;United States;American Psychological Association;2000-ongoing;"Gender Studies (Q1); Life-span and Life-course Studies (Q2); Applied Psychology (Q3); Social Psychology (Q3)"
905;24827;Journal of Philosophy of Education;journal;14679752, 03098249;0.357;Q2;36;43;108;1118;54;104;0.58;26;United Kingdom;Blackwell Publishing Inc.;1967-ongoing;"History (Q1); Philosophy (Q1); Education (Q2)"
906;24141;Artificial Intelligence Review;journal;02692821, 15737462;0.356;Q1;63;27;77;777;96;73;1.4;28.78;Netherlands;Kluwer Academic Publishers;1986-ongoing;"Language and Linguistics (Q1); Linguistics and Language (Q1); Artificial Intelligence (Q3)"
907;15617;Journal of Comparative Family Studies;journal;00472328;0.356;Q2;35;34;99;1417;49;95;0.43;41.68;Canada;University of Calgary Press;1973, 1976-2013;"Anthropology (Q2); Sociology and Political Science (Q2); Social Psychology (Q3)"
908;24472;Children and Society;journal;09510605, 10990860;0.355;Q2;49;33;112;1045;70;95;0.63;31.67;United States;John Wiley & Sons Inc.;1987-1995, 2003-ongoing;"Education (Q2); Health (social science) (Q2); Life-span and Life-course Studies (Q2); Social Work (Q2)"
909;29335;Education for Information;journal;01678329;0.355;Q2;17;11;49;398;20;45;0.36;36.18;Netherlands;IOS Press;1983, 1986, 1988-ongoing;"Education (Q2); Library and Information Sciences (Q2); Information Systems (Q3)"
910;19096;Journal of North African Studies;journal;13629387;0.355;Q2;20;33;76;304;28;76;0.42;9.21;United Kingdom;Frank Cass Publishers;1996-ongoing;"Development (Q2); Geography, Planning and Development (Q2); Political Science and International Relations (Q2)"
911;78582;Journal of the Royal Anthropological Institute;journal;13590987;0.355;Q2;57;34;31;1967;33;31;0;57.85;United States;Wiley-Blackwell;1995-2001, 2004-ongoing;"Anthropology (Q2); Arts and Humanities (miscellaneous) (Q2)"
912;19966;Bulletin of Indonesian Economic Studies;journal;14727234, 00074918;0.354;Q2;28;15;53;304;58;53;0.91;20.27;United Kingdom;Carfax Publishing Ltd.;1965-ongoing;"Development (Q2); Economics and Econometrics (Q3)"
913;25493;Cross-Cultural Research;journal;10693971;0.354;Q2;36;22;52;688;34;52;0.68;31.27;United States;SAGE Publications;1966-1984, 1986-ongoing;"Anthropology (Q2); Arts and Humanities (miscellaneous) (Q2); Psychology (miscellaneous) (Q2)"
914;19400158595;World Trade Review;journal;14747456, 14753138;0.354;Q1;27;31;45;411;25;42;0.6;13.26;United Kingdom;Cambridge University Press;2002-ongoing;"Law (Q1); Political Science and International Relations (Q2); Economics and Econometrics (Q3)"
915;27511;Australian Geographer;journal;14653311, 00049182;0.352;Q2;38;24;57;1008;39;57;0.76;42;United Kingdom;Carfax Publishing Ltd.;1928-1929, 1931-1943, 1945-1948, 1950-ongoing;"Earth-Surface Processes (Q2); Geography, Planning and Development (Q2)"
916;18103;Sociological Quarterly;journal;00380253;0.352;Q2;54;37;101;2237;55;99;0.47;60.46;United States;Taylor and Francis Ltd.;1960-ongoing;Sociology and Political Science (Q2)
917;26926;African Studies Review;journal;00020206;0.35;Q1;40;27;91;853;41;91;0.42;31.59;United Kingdom;Cambridge University Press;1962-1963, 1965-1980, 1982, 1984-ongoing;"Cultural Studies (Q1); Anthropology (Q2)"
918;16200154705;Journal of Research in Music Education;journal;00224294;0.35;Q2;37;28;85;641;36;84;0.45;22.89;United States;Sage Periodicals Press;1953-ongoing;"Music (Q1); Education (Q2)"
919;144644;Library Management;journal;01435124;0.35;Q2;26;47;142;774;41;142;0.26;16.47;United Kingdom;Emerald Group Publishing Ltd.;1979-ongoing;Library and Information Sciences (Q2)
920;14304;Educational Review;journal;14653397, 00131911;0.349;Q2;42;21;70;527;52;69;0.64;25.1;United Kingdom;Carfax Publishing Ltd.;1948-ongoing;Education (Q2)
921;12308;Journal of Social Work Education;journal;10437797;0.349;Q2;49;31;121;1141;85;103;0.72;36.81;United Kingdom;Taylor & Francis;1985-ongoing;"Education (Q2); Social Sciences (miscellaneous) (Q2); Social Work (Q2)"
922;100147024;Qualitative Research;journal;14687941;0.349;Q2;63;20;61;816;62;56;0.95;40.8;United States;SAGE Publications;2001-ongoing;"History and Philosophy of Science (Q1); Social Sciences (miscellaneous) (Q2)"
923;15442;Information Systems Management;journal;10580530;0.348;Q2;53;49;142;531;68;132;0.41;10.84;United Kingdom;Taylor & Francis;1992-ongoing;"Library and Information Sciences (Q2); Computer Science Applications (Q3); Information Systems (Q3)"
924;147221;Journal of Social Archaeology;journal;14696053;0.347;Q1;31;17;49;1115;30;48;0.39;65.59;United States;SAGE Publications;2001-ongoing;"Archeology (Q1); Arts and Humanities (miscellaneous) (Q2)"
925;12373;Journal of Computer Information Systems;journal;08874417;0.346;Q2;55;51;187;1946;193;187;0.91;38.16;United Kingdom;Taylor & Francis;1995-ongoing;"Education (Q2); Computer Networks and Communications (Q3); Information Systems (Q3)"
926;28911;Leisure Studies;journal;14664496, 02614367;0.346;Q2;57;24;60;939;47;60;0.48;39.13;United Kingdom;Routledge;1981-ongoing;"Geography, Planning and Development (Q2); Tourism, Leisure and Hospitality Management (Q3)"
927;28105;Erdkunde;journal;00140015;0.345;Q2;29;21;64;981;42;64;0.71;46.71;Germany;Ferd. Dummler;1976, 1978-ongoing;"Earth and Planetary Sciences (miscellaneous) (Q2); Ecology (Q2); Geography, Planning and Development (Q2)"
928;18735;Accountability in Research;journal;08989621;0.344;Q2;24;13;44;594;31;42;0.77;45.69;United Kingdom;Taylor & Francis;1989-ongoing;"Education (Q2); Library and Information Sciences (Q2); Medicine (miscellaneous) (Q2)"
929;28889;Journal of Hellenic Studies;journal;00754269;0.344;Q1;28;11;32;696;18;32;0.6;63.27;United Kingdom;Cambridge University Press;1880-1891, 1893-ongoing;"Archeology (Q1); Archeology (arts and humanities) (Q1); Classics (Q1); Language and Linguistics (Q1); Linguistics and Language (Q1); Literature and Literary Theory (Q1); Visual Arts and Performing Arts (Q1)"
930;12856;Comparative Education Review;journal;00104086, 1545701X;0.343;Q2;47;16;55;553;44;48;1.13;34.56;United States;University of Chicago Press;1976-1977, 1980-1982, 1984, 1994, 1996-ongoing;Education (Q2)
931;19700187607;Journalism Studies;journal;1461670X, 14699699;0.343;Q2;51;27;71;1125;38;70;0.52;41.67;United Kingdom;Routledge;2001-ongoing;Communication (Q2)
932;5600152890;Body and Society;journal;1357034X, 14603632;0.342;Q1;56;16;73;825;53;73;0.67;51.56;United States;SAGE Publications;1995-ongoing;"Cultural Studies (Q1); Health (social science) (Q2); Social Psychology (Q3)"
933;27731;Latin American Perspectives;journal;0094582X;0.342;Q2;34;35;102;1407;38;102;0.2;40.2;United States;SAGE Publications;1977, 1984, 1986-ongoing;"Geography, Planning and Development (Q2); Sociology and Political Science (Q2)"
934;12828;Population and Environment;journal;01990039;0.341;Q2;44;29;77;1182;59;77;0.45;40.76;United States;Kluwer Academic/Plenum Publishers;1980-1985, 1987-ongoing;"Demography (Q2); Environmental Science (miscellaneous) (Q2)"
935;23224;Australian Journal of International Affairs;journal;10357718;0.339;Q2;26;26;81;788;44;81;0.49;30.31;United Kingdom;Taylor & Francis;1977-1978, 1987, 1990-ongoing;"Geography, Planning and Development (Q2); Political Science and International Relations (Q2)"
936;24034;Democratization;journal;13510347;0.339;Q2;44;38;108;1648;68;108;0.63;43.37;United Kingdom;Frank Cass Publishers;1994-ongoing;"Geography, Planning and Development (Q2); Political Science and International Relations (Q2)"
937;64975;Environmental Archaeology;journal;14614103;0.339;Q1;23;20;25;1055;16;25;0.64;52.75;United Kingdom;Maney Publishing;1981, 2002-ongoing;"Archeology (Q1); Archeology (arts and humanities) (Q1); Environmental Science (miscellaneous) (Q2)"
938;38661;Quarterly Journal of International Agriculture;journal;00498599;0.339;Q2;16;23;62;534;20;62;0.24;23.22;Germany;D L G Verlags GmbH;1979-1982, 1984-2015;"Development (Q2); Geography, Planning and Development (Q2)"
939;19928;Transcultural Psychiatry;journal;13634615;0.339;Q2;47;29;94;1184;48;84;0.52;40.83;United States;SAGE Publications;1964-ongoing;"Health (social science) (Q2); Psychiatry and Mental Health (Q3)"
940;144730;Studies in Nonlinear Dynamics and Econometrics;journal;10811826;0.338;Q2;25;34;35;909;12;33;0.36;26.74;Germany;Walter de Gruyter GmbH;2002-ongoing;"Social Sciences (miscellaneous) (Q2); Economics and Econometrics (Q3); Analysis (Q4)"
941;19285;Zeitschrift fr Soziologie;journal;03401804;0.338;Q2;28;28;82;1711;38;72;0.67;61.11;Germany;Walter de Gruyter GmbH;1981, 1983-1984, 1986-1987, 1989-1991, 1994-ongoing;Sociology and Political Science (Q2)
942;16100154741;Archaeology in Oceania;journal;00038121;0.337;Q1;23;12;29;354;16;29;0.55;29.5;United States;Wiley-Blackwell;2002-ongoing;"Archeology (Q1); Archeology (arts and humanities) (Q1); Anthropology (Q2)"
943;16000154735;Bulletin de la Societe Prehistorique Francaise;journal;02497638;0.337;Q1;17;43;91;1564;19;80;0.24;36.37;France;Societe Prehistorique Francaise;2002-ongoing;"Archeology (Q1); Archeology (arts and humanities) (Q1)"
944;16241;Journal of Law and Society;journal;0263323X;0.337;Q1;44;27;81;1049;56;81;0.89;38.85;United Kingdom;Blackwell Publishing Inc.;1983, 1985, 1988, 1991-1993, 1996-ongoing;"Law (Q1); Sociology and Political Science (Q2)"
945;4700152722;Technical Services Quarterly;journal;07317131;0.337;Q2;15;20;50;181;12;50;0.29;9.05;United States;Haworth Press Inc.;1984-ongoing;"Library and Information Sciences (Q2); Computer Science Applications (Q3)"
946;5600157642;Public Policy and Administration;journal;09520767, 17494192;0.336;Q2;31;27;81;699;38;72;0.58;25.89;United States;SAGE Publications;1986-ongoing;"Public Administration (Q2); Sociology and Political Science (Q2)"
947;21995;Contemporary Economic Policy;journal;14657287, 10743529;0.335;Q2;43;42;119;1359;73;118;0.44;32.36;United Kingdom;Blackwell Publishing Inc.;1982-ongoing;"Business, Management and Accounting (miscellaneous) (Q2); Public Administration (Q2); Economics and Econometrics (Q3)"
948;19089;Government and Opposition;journal;0017257X, 14777053;0.335;Q2;41;30;82;1771;47;80;0.58;59.03;United Kingdom;Cambridge University Press;1965-ongoing;"Public Administration (Q2); Sociology and Political Science (Q2)"
949;27204;International Journal of Social Research Methodology: Theory and Practice;journal;14645300, 13645579;0.335;Q2;50;38;82;712;46;70;0.62;18.74;United Kingdom;Taylor & Francis;1998-ongoing;Social Sciences (miscellaneous) (Q2)
950;21389;International Journal of Technology and Design Education;journal;15731804, 09577572;0.335;Q2;31;18;47;646;22;45;0.38;35.89;Netherlands;Kluwer Academic Publishers;1990-ongoing;"Education (Q2); Engineering (miscellaneous) (Q2)"
951;21447;Journal of English for Academic Purposes;journal;14751585;0.335;Q1;45;19;30;734;21;28;0.75;38.63;United Kingdom;Elsevier Ltd.;2002-ongoing;"Language and Linguistics (Q1); Linguistics and Language (Q1); Education (Q2)"
952;12759;Omega: Journal of Death and Dying;journal;15413764, 00302228;0.335;Q2;35;57;17;1918;12;16;0;33.65;United States;SAGE Publications Inc.;1970, 1973-ongoing;"Critical Care and Intensive Care Medicine (Q2); Health (social science) (Q2); Life-span and Life-course Studies (Q2)"
953;21100451306;Proceedings - 21st International Conference on Distributed Computing Systems Workshops;conference and proceedings;00002001;0.335;-;13;0;75;0;73;74;0;0;United States;;2001;"Computer Networks and Communications; Education"
954;23776;Archivaria;journal;03186954;0.334;Q2;23;16;42;714;18;40;0.26;44.63;Canada;Association of Canadian Archivists;1980, 1989-1990, 1996-ongoing;Library and Information Sciences (Q2)
955;12575;Food and Nutrition Bulletin;journal;03795721;0.334;Q2;62;58;248;1526;131;240;0.61;26.31;United States;SAGE Publications Inc.;1982-ongoing;"Geography, Planning and Development (Q2); Food Science (Q3); Nutrition and Dietetics (Q3)"
