Rank;Sourceid;Title;Type;Issn;SJR;SJR Best Quartile;H index;Total Docs. (2007);Total Docs. (3years);Total Refs.;Total Cites (3years);Citable Docs. (3years);Cites / Doc. (2years);Ref. / Doc.;Country;Publisher;Coverage;Categories
1;58530;National vital statistics reports : from the Centers for Disease Control and Prevention, National Center for Health Statistics, National Vital Statistics System;journal;15518922, 15518930;11.443;Q1;89;10;25;60;567;25;29.64;6.00;United States;US Department of Health and Human Services;1998-ongoing;Life-span and Life-course Studies (Q1)
2;16036;Administrative Science Quarterly;journal;00018392;7.194;Q1;165;19;53;1852;252;48;4.13;97.47;United States;Cornell University Press;1975-1987, 1989-1990, 1993-1994, 1996-ongoing;"Arts and Humanities (miscellaneous) (Q1); Public Administration (Q1); Sociology and Political Science (Q1)"
3;19434;MMWR. Recommendations and reports : Morbidity and mortality weekly report. Recommendations and reports / Centers for Disease Control;journal;10575987, 15458601;6.472;Q1;134;8;49;129;946;49;22.41;16.13;United States;Centers for Disease Control and Prevention (CDC);1990-ongoing;"Epidemiology (Q1); Health Information Management (Q1); Health (social science) (Q1); Health, Toxicology and Mutagenesis (Q1); Medicine (miscellaneous) (Q1)"
4;17700155020;Handbook of Regional and Urban Economics;book series;15740080;6.102;Q1;29;0;24;0;132;2;0;0.00;Netherlands;Elsevier BV;1987, 1999, 2004, 2015;"Economics and Econometrics (Q1); Geography, Planning and Development (Q1); Urban Studies (Q1)"
5;15557;American Political Science Review;journal;15375943, 00030554;5.64;Q1;159;58;152;2855;604;149;2.84;49.22;United Kingdom;Cambridge University Press;1906-ongoing;"Political Science and International Relations (Q1); Sociology and Political Science (Q1)"
6;71056;MMWR. Surveillance summaries : Morbidity and mortality weekly report. Surveillance summaries / CDC;journal;15458636, 15460738;5.512;Q1;90;14;31;0;480;31;13.45;0.00;United States;Centers for Disease Control and Prevention (CDC);2002-ongoing;"Epidemiology (Q1); Health Information Management (Q1); Health (social science) (Q1); Health, Toxicology and Mutagenesis (Q1)"
7;30039;Journal of Personality and Social Psychology;journal;00223514;5.221;Q1;328;112;392;8002;2246;387;4.92;71.45;United States;American Psychological Association;1965-ongoing;"Social Psychology (Q1); Sociology and Political Science (Q1)"
8;12481;Journal of Engineering Education;journal;10694730, 21689830;5.077;Q1;93;34;105;1229;567;94;7.2;36.15;United States;Wiley-Blackwell;1969-1978, 1993-1995, 1997-ongoing;"Education (Q1); Engineering (miscellaneous) (Q1)"
9;16926;American Journal of Sociology;journal;00029602, 15375390;4.769;Q1;160;38;111;3848;590;109;4.5;101.26;United States;University of Chicago Press;1948-1950, 1964-ongoing;Sociology and Political Science (Q1)
10;15574;Information Systems Research;journal;15265536, 10477047;4.751;Q1;145;27;74;1430;499;72;4.67;52.96;United States;Institute for Operations Research and the Management Sciences;1990-ongoing;"Computer Networks and Communications (Q1); Information Systems (Q1); Information Systems and Management (Q1); Library and Information Sciences (Q1); Management Information Systems (Q1)"
11;16929;American Sociological Review;journal;00031224;4.711;Q1;174;49;136;3512;609;125;4.18;71.67;United States;SAGE Publications;1965-ongoing;Sociology and Political Science (Q1)
12;39139;International Organization;journal;15315088, 00208183;4.677;Q1;133;24;93;1331;441;91;4.48;55.46;United Kingdom;Cambridge University Press;1947-ongoing;"Law (Q1); Organizational Behavior and Human Resource Management (Q1); Political Science and International Relations (Q1); Sociology and Political Science (Q1)"
13;16976;Annual Review of Sociology;journal;03600572, 15452115;4.587;Q1;151;23;60;3091;332;60;2.92;134.39;United States;Annual Reviews Inc.;1975, 1977, 1980-1981, 1983-ongoing;Sociology and Political Science (Q1)
14;25835;International Security;journal;15314804, 01622889;4.45;Q1;97;26;80;3088;370;61;5.58;118.77;United States;MIT Press;1984, 1996-ongoing;"Law (Q1); Political Science and International Relations (Q1); Sociology and Political Science (Q1)"
15;29214;Transactions of the Institute of British Geographers;journal;00202754;4.315;Q1;96;36;108;2158;530;90;5.2;59.94;United Kingdom;Blackwell Publishing Inc.;1976-ongoing;"Earth-Surface Processes (Q1); Geography, Planning and Development (Q1)"
16;24204;Review of Economics and Statistics;journal;00346535, 15309142;4.294;Q1;142;58;204;2126;667;202;2.37;36.66;United States;MIT Press;1978-ongoing;"Economics and Econometrics (Q1); Social Sciences (miscellaneous) (Q1)"
17;15555;American Journal of Political Science;journal;00925853, 15405907;3.836;Q1;150;43;178;2462;529;178;2.4;57.26;United Kingdom;Blackwell Publishing Inc.;1982, 1986, 1996-ongoing;"Political Science and International Relations (Q1); Sociology and Political Science (Q1)"
18;15107;IEEE Transactions on Information Theory;journal;00189448;3.806;Q1;249;387;1152;9597;6365;1068;5.33;24.80;United States;Institute of Electrical and Electronics Engineers;1969-ongoing;"Computer Science Applications (Q1); Information Systems (Q1); Library and Information Sciences (Q1)"
19;12872;Cognitive Psychology;journal;10955623, 00100285;3.784;Q1;108;21;59;1640;241;58;4.05;78.10;United States;Elsevier Inc.;1970-ongoing;"Artificial Intelligence (Q1); Developmental and Educational Psychology (Q1); Experimental and Cognitive Psychology (Q1); Linguistics and Language (Q1); Neuropsychology and Physiological Psychology (Q1)"
20;22899;Journal of Consumer Research;journal;00935301, 15375277;3.755;Q1;155;63;202;2198;657;202;2.46;34.89;United Kingdom;Oxford University Press;1977-1978, 1984, 1996-ongoing;"Anthropology (Q1); Arts and Humanities (miscellaneous) (Q1); Business and International Management (Q1); Economics and Econometrics (Q1); Marketing (Q1)"
21;25725;World Politics;journal;00438871, 10863338;3.603;Q1;99;20;62;2416;178;57;2.27;120.80;United Kingdom;Cambridge University Press;1948-ongoing;"Political Science and International Relations (Q1); Sociology and Political Science (Q1)"
22;18034;World Bank Research Observer;journal;15646971, 02573032;3.598;Q1;58;10;30;649;143;30;3;64.90;United Kingdom;Oxford University Press;1986-ongoing;"Development (Q1); Economics and Econometrics (Q1)"
23;12442;Progress in Human Geography;journal;14770288, 03091325;3.557;Q1;131;61;163;4045;699;148;4.01;66.31;United States;SAGE Publications;1977-ongoing;Geography, Planning and Development (Q1)
24;19684;Criminology;journal;00111384;3.543;Q1;122;19;94;1147;261;90;2.44;60.37;United States;Wiley-Blackwell;1963-ongoing;"Law (Q1); Pathology and Forensic Medicine (Q1)"
25;26239;Quaternary Science Reviews;journal;02773791;3.449;Q1;164;221;550;15663;2258;505;4.14;70.87;United Kingdom;Elsevier Ltd.;1982-ongoing;"Archeology (Q1); Archeology (arts and humanities) (Q1); Ecology, Evolution, Behavior and Systematics (Q1); Geology (Q1); Global and Planetary Change (Q1)"
26;29432;American Educational Research Journal;journal;00028312;3.358;Q1;103;30;72;2161;237;71;2.77;72.03;United States;SAGE Publications;1978, 1982, 1986, 1996-ongoing;Education (Q1)
27;110092;MMWR. Morbidity and mortality weekly report;journal;01492195, 1545861X;3.329;Q1;182;163;998;1172;3526;728;5.51;7.19;United States;US Department of Health and Human Services;1981-ongoing;"Epidemiology (Q1); Health Information Management (Q1); Health (social science) (Q1); Health, Toxicology and Mutagenesis (Q1); Medicine (miscellaneous) (Q1)"
28;12857;Cognition;journal;00100277;3.25;Q1;165;107;232;4588;1043;219;3.93;42.88;Netherlands;Elsevier BV;1972-1974, 1976-ongoing;"Cognitive Neuroscience (Q1); Developmental and Educational Psychology (Q1); Experimental and Cognitive Psychology (Q1); Language and Linguistics (Q1); Linguistics and Language (Q1)"
29;13358;Sociology of Education;journal;00380407;3.204;Q1;82;16;53;934;115;52;1.34;58.38;United States;SAGE Publications;1980, 1983, 1992, 1996-ongoing;"Education (Q1); Sociology and Political Science (Q1)"
30;24456;Child Development;journal;14678624, 00093920;3.165;Q1;228;107;313;6420;1482;311;3.56;60.00;United States;Blackwell Publishing Inc.;1945-1948, 1950-ongoing;"Developmental and Educational Psychology (Q1); Education (Q1); Pediatrics, Perinatology and Child Health (Q1); Social Work (Q1)"
31;16220;Journal of Law and Economics;journal;15375285, 00222186;3.148;Q1;75;28;72;1116;151;72;2.04;39.86;United States;University of Chicago Press;1978-1989, 1996-ongoing;"Economics and Econometrics (Q1); Law (Q1)"
32;13357;Journal of the Learning Sciences;journal;10508406, 15327809;3.132;Q1;84;15;50;863;220;46;3;57.53;United States;Lawrence Erlbaum Associates Inc.;1991-1992, 1994-ongoing;"Developmental and Educational Psychology (Q1); Education (Q1)"
33;11600153640;Quarterly Journal of Political Science;journal;15540634, 15540626;3.126;Q1;29;5;5;155;8;4;2;31.00;United States;Now Publishers Inc.;2006-ongoing;"Political Science and International Relations (Q1); Sociology and Political Science (Q1)"
34;26365;Demography;journal;00703370, 15337790;3.071;Q1;115;48;114;2538;405;114;2.21;52.88;United States;Springer New York LLC;1964-ongoing;Demography (Q1)
35;145558;Political Analysis;journal;10471987, 14764989;3.071;Q1;59;24;85;678;168;77;2.17;28.25;United Kingdom;Cambridge University Press;1989-1993, 2004-ongoing;"Political Science and International Relations (Q1); Sociology and Political Science (Q1)"
36;27663;Journal of Conflict Resolution;journal;00220027;2.996;Q1;94;39;118;2080;309;118;2.65;53.33;United States;SAGE Publications;1957-ongoing;"Business, Management and Accounting (miscellaneous) (Q1); Political Science and International Relations (Q1); Sociology and Political Science (Q1)"
37;15499;Journal of Experimental Social Psychology;journal;00221031, 10960465;2.929;Q1;125;109;223;3981;616;217;2.31;36.52;United States;Elsevier Inc.;1965-ongoing;"Social Psychology (Q1); Sociology and Political Science (Q1)"
38;16512;Review of Educational Research;journal;00346543;2.917;Q1;132;19;49;2140;233;49;3.46;112.63;United States;SAGE Publications;1931-ongoing;Education (Q1)
39;20910;Transportation Science;journal;15265447, 00411655;2.762;Q1;99;34;116;922;344;113;2.45;27.12;United States;Institute for Operations Research and the Management Sciences;1969-ongoing;"Civil and Structural Engineering (Q1); Transportation (Q1)"
40;22750;Journal of Economic Geography;journal;14682702, 14682710;2.747;Q1;88;33;81;2236;317;78;3.29;67.76;United Kingdom;Oxford University Press;2001-ongoing;"Economics and Econometrics (Q1); Geography, Planning and Development (Q1)"
41;25098;Future of Children;journal;15501558, 10548289;2.709;Q1;75;21;62;1383;264;53;5.4;65.86;United States;David and Lucile Packard Foundation;1994-ongoing;"Health (social science) (Q1); Public Health, Environmental and Occupational Health (Q1); Sociology and Political Science (Q1)"
42;22055;Exceptional Children;journal;00144029;2.706;Q1;78;24;86;1007;285;81;3.67;41.96;United States;SAGE Publications Inc.;1936-1937, 1958, 1961-ongoing;"Developmental and Educational Psychology (Q1); Education (Q1)"
43;21149;Leadership Quarterly;journal;10489843;2.692;Q1;132;38;138;2943;468;116;3.35;77.45;United Kingdom;Elsevier Ltd.;1990-ongoing;"Applied Psychology (Q1); Business and International Management (Q1); Organizational Behavior and Human Resource Management (Q1); Sociology and Political Science (Q1)"
44;22478;Journal of Memory and Language;journal;10960821, 0749596X;2.679;Q1;129;63;205;3686;646;200;2.49;58.51;United States;Elsevier Inc.;1985-ongoing;"Artificial Intelligence (Q1); Experimental and Cognitive Psychology (Q1); Language and Linguistics (Q1); Linguistics and Language (Q1); Neuropsychology and Physiological Psychology (Q1)"
45;13500;Developmental Psychology;journal;00121649;2.606;Q1;190;106;278;6789;1137;277;3.22;64.05;United States;American Psychological Association;1969-ongoing;"Demography (Q1); Developmental and Educational Psychology (Q1); Life-span and Life-course Studies (Q1)"
46;12808;Journal of Educational Psychology;journal;00220663;2.59;Q1;177;42;185;2688;624;185;2.66;64.00;United States;American Psychological Association;1910-ongoing;"Developmental and Educational Psychology (Q1); Education (Q1)"
47;19726;Educational Evaluation and Policy Analysis;journal;01623737;2.584;Q1;67;16;44;579;84;44;1.89;36.19;United States;SAGE Publications;1979-1982, 1996-ongoing;Education (Q1)
48;16242;Journal of Law, Economics, and Organization;journal;14657341, 87566222;2.566;Q1;63;30;64;933;123;64;1.49;31.10;United Kingdom;Oxford University Press;1985-ongoing;"Economics and Econometrics (Q1); Law (Q1); Organizational Behavior and Human Resource Management (Q1)"
49;5800207540;Journal of Politeness Research;journal;16125681;2.561;Q1;29;11;22;585;71;22;3.23;53.18;Germany;Walter de Gruyter GmbH;2005-ongoing;"Communication (Q1); Cultural Studies (Q1); Language and Linguistics (Q1); Linguistics and Language (Q1); Social Psychology (Q1)"
50;14929;Global Networks;journal;14710374, 14702266;2.551;Q1;58;28;65;1455;186;65;2.69;51.96;United Kingdom;Blackwell Publishing Inc.;2004-ongoing;Social Sciences (miscellaneous) (Q1)
51;30020;Journal of Organizational Behavior;journal;10991379, 08943796;2.506;Q1;152;63;160;3757;637;156;3.13;59.63;United States;John Wiley & Sons Inc.;1981-1982, 2019, 1984-ongoing;"Applied Psychology (Q1); Organizational Behavior and Human Resource Management (Q1); Psychology (miscellaneous) (Q1); Sociology and Political Science (Q1)"
52;28094;Accounting, Organizations and Society;journal;03613682;2.479;Q1;116;33;101;2633;334;99;3.06;79.79;United Kingdom;Elsevier Ltd.;1976-ongoing;"Accounting (Q1); Applied Psychology (Q1); Information Systems and Management (Q1); Organizational Behavior and Human Resource Management (Q1); Sociology and Political Science (Q1)"
53;110302;Geografiska Annaler, Series B: Human Geography;journal;04353684;2.462;Q1;50;19;72;1282;226;66;1.28;67.47;United Kingdom;Taylor and Francis Ltd.;1976, 1978-1979, 1982-ongoing;Geography, Planning and Development (Q1)
54;16232;British Journal of Political Science;journal;00071234, 14692112;2.455;Q1;85;30;117;2040;225;109;1.95;68.00;United Kingdom;Cambridge University Press;1971-ongoing;Sociology and Political Science (Q1)
55;23621;Journal of Research in Science Teaching;journal;10982736, 00224308;2.43;Q1;114;60;138;2746;311;134;1.82;45.77;United States;John Wiley & Sons Inc.;1963-1967, 1969-ongoing;Education (Q1)
56;15482;Journal of Experimental Psychology: Learning Memory and Cognition;journal;02787393;2.413;Q1;142;71;319;3489;924;319;2.29;49.14;United States;American Psychological Association;1975, 1982-ongoing;"Experimental and Cognitive Psychology (Q1); Language and Linguistics (Q1); Linguistics and Language (Q1)"
57;30718;Annals of Tourism Research;journal;01607383;2.395;Q1;144;34;184;1831;528;180;2.4;53.85;United Kingdom;Elsevier Ltd.;1974-ongoing;"Development (Q1); Tourism, Leisure and Hospitality Management (Q1)"
58;18173;Mathematical Finance;journal;09601627, 14679965;2.392;Q1;68;27;92;669;155;91;1.49;24.78;United Kingdom;Blackwell Publishing Inc.;1991-ongoing;"Accounting (Q1); Applied Mathematics (Q1); Economics and Econometrics (Q1); Finance (Q1); Social Sciences (miscellaneous) (Q1)"
59;15298;Structural Equation Modeling;journal;15328007, 10705511;2.383;Q1;84;29;89;983;238;89;2.02;33.90;United States;Lawrence Erlbaum Associates Inc.;1994-ongoing;"Decision Sciences (miscellaneous) (Q1); Economics, Econometrics and Finance (miscellaneous) (Q1); Modeling and Simulation (Q1); Sociology and Political Science (Q1)"
60;14834;Journal of Development of Economics;journal;03043878;2.373;Q1;123;89;215;3076;387;213;1.36;34.56;Netherlands;Elsevier BV;1974-ongoing;"Development (Q1); Economics and Econometrics (Q1)"
61;21424;Journal for Research in Mathematics Education;journal;00218251;2.317;Q1;69;24;55;1218;68;47;1.34;50.75;United States;National Council of Teachers of Mathematics;1996-ongoing;"Education (Q1); Mathematics (miscellaneous) (Q1)"
62;36483;Global Environmental Change;journal;09593780;2.303;Q1;147;41;121;2472;566;101;5.45;60.29;Netherlands;Elsevier BV;1990-ongoing;"Ecology (Q1); Geography, Planning and Development (Q1); Global and Planetary Change (Q1); Management, Monitoring, Policy and Law (Q1)"
63;17497;British Journal of Sociology;journal;00071315, 14684446;2.298;Q1;81;26;102;1289;339;96;3.35;49.58;United Kingdom;Blackwell Publishing Inc.;1965-1977, 1979-1984, 1987-ongoing;Sociology and Political Science (Q1)
64;15823;Journal of Public Administration Research and Theory;journal;14779803, 10531858;2.289;Q1;94;15;85;925;212;85;2.34;61.67;United Kingdom;Oxford University Press;1991-ongoing;"Marketing (Q1); Public Administration (Q1); Sociology and Political Science (Q1)"
65;20892;Transportation Research Part B: Methodological;journal;01912615;2.245;Q1;118;60;145;1366;392;144;2.27;22.77;United Kingdom;Elsevier Ltd.;1979-ongoing;"Civil and Structural Engineering (Q1); Management Science and Operations Research (Q1); Transportation (Q1)"
66;18927;Journal of Human Evolution;journal;00472484, 10958606;2.228;Q1;112;107;242;8043;774;237;2.84;75.17;United States;Elsevier Inc.;1972-ongoing;"Anthropology (Q1); Ecology, Evolution, Behavior and Systematics (Q1); Education (Q1)"
67;13447;Comparative Political Studies;journal;00104140;2.211;Q1;95;50;132;2648;276;131;1.92;52.96;United States;SAGE Publications;1968-ongoing;Sociology and Political Science (Q1)
68;17530;Social Forces;journal;15347605, 00377732;2.17;Q1;117;62;233;3559;482;229;1.58;57.40;United Kingdom;Oxford University Press;1974, 1977-ongoing;"Anthropology (Q1); History (Q1); Sociology and Political Science (Q1)"
69;15653;Journal of Marriage and Family;journal;17413737, 00222445;2.167;Q1;143;85;285;4052;721;274;2.08;47.67;United Kingdom;Blackwell Publishing Inc.;1973-1978, 1980-1981, 1985, 1996-ongoing;"Anthropology (Q1); Arts and Humanities (miscellaneous) (Q1); Social Sciences (miscellaneous) (Q1); Social Work (Q1)"
70;25848;International Studies Quarterly;journal;14682478, 00208833;2.163;Q1;88;39;100;2438;220;96;1.98;62.51;United Kingdom;Oxford University Press;1978, 1985, 1989-ongoing;"Political Science and International Relations (Q1); Sociology and Political Science (Q1)"
71;23675;Artificial Intelligence;journal;00043702;2.147;Q1;135;60;170;2116;747;165;4.46;35.27;Netherlands;Elsevier BV;1970-ongoing;"Artificial Intelligence (Q1); Language and Linguistics (Q1); Linguistics and Language (Q1)"
72;20333;Journal of Politics;journal;14682508, 00223816;2.145;Q1;105;79;171;3980;310;168;1.62;50.38;United Kingdom;University of Chicago Press;1968, 1977, 1980-1981, 1984-1986, 1991, 1996-ongoing;Sociology and Political Science (Q1)
73;12099;British Educational Research Journal;journal;14693518, 01411926;2.137;Q1;77;54;124;2101;299;112;2.19;38.91;United Kingdom;Wiley-Blackwell;1975-ongoing;Education (Q1)
74;27365;World Bank Economic Review;journal;1564698X, 02586770;2.127;Q1;79;12;57;379;127;57;1.9;31.58;United Kingdom;Oxford University Press;1986-ongoing;"Accounting (Q1); Development (Q1); Economics and Econometrics (Q1); Finance (Q1)"
75;14813;Journal of Travel Research;journal;00472875;2.117;Q1;114;41;144;2195;358;133;2.2;53.54;United States;SAGE Publications;1969-ongoing;"Geography, Planning and Development (Q1); Tourism, Leisure and Hospitality Management (Q1); Transportation (Q1)"
76;1000147124;European Union Politics;journal;14651165;2.088;Q1;57;25;68;965;167;68;2.24;38.60;United States;SAGE Publications;2000-ongoing;"Demography (Q1); Health (social science) (Q1); Political Science and International Relations (Q1)"
77;26124;Ethnic and Racial Studies;journal;01419870, 14664356;2.087;Q1;79;45;124;2107;293;120;2.61;46.82;United Kingdom;Routledge;1978-ongoing;"Anthropology (Q1); Cultural Studies (Q1); Sociology and Political Science (Q1)"
78;16444;Journal of Educational and Behavioral Statistics;journal;10769986;2.082;Q1;51;14;66;354;88;62;1.36;25.29;United States;SAGE Publications;1996-ongoing;"Education (Q1); Social Sciences (miscellaneous) (Q1)"
79;21100463801;Annals of the American Association of Geographers;journal;24694460, 24694452;2.046;Q1;102;42;146;3581;466;143;3.14;85.26;United Kingdom;Taylor and Francis Ltd.;2016-ongoing;"Earth-Surface Processes (Q1); Geography, Planning and Development (Q1)"
80;5200152701;Academy of Management Learning and Education;journal;1537260X;2.011;Q1;63;40;104;1534;264;78;3.38;38.35;United States;George Washington University;2005-ongoing;"Education (Q1); Organizational Behavior and Human Resource Management (Q1)"
81;16055;Reading Research Quarterly;journal;00340553;1.992;Q1;77;28;74;1167;126;72;1.47;41.68;United States;Wiley-Blackwell;1996-ongoing;"Developmental and Educational Psychology (Q1); Education (Q1)"
82;26857;International Migration Review;journal;01979183;1.975;Q1;86;38;109;1497;232;107;1.42;39.39;United States;Wiley-Blackwell;1972, 1974, 1977-ongoing;"Arts and Humanities (miscellaneous) (Q1); Demography (Q1)"
83;27162;Journal of Business and Economic Statistics;journal;07350015, 15372707;1.965;Q1;84;41;128;1295;177;108;1.31;31.59;United Kingdom;Taylor & Francis;1983-ongoing;"Economics and Econometrics (Q1); Social Sciences (miscellaneous) (Q1); Statistics and Probability (Q1); Statistics, Probability and Uncertainty (Q1)"
84;26043;Economy and Society;journal;03085147, 14695766;1.961;Q1;84;26;84;1562;242;82;2.44;60.08;United Kingdom;Routledge;1972-ongoing;"Business and International Management (Q1); Economics and Econometrics (Q1); Economics, Econometrics and Finance (miscellaneous) (Q1); History (Q1); Social Sciences (miscellaneous) (Q1)"
85;22857;Political Geography;journal;09626298;1.957;Q1;86;52;151;2646;309;110;2.58;50.88;United Kingdom;Elsevier Ltd.;1983, 1992-ongoing;"Geography, Planning and Development (Q1); History (Q1); Sociology and Political Science (Q1)"
86;15453;Journal of Cross-Cultural Psychology;journal;00220221;1.943;Q1;99;47;134;1999;317;129;1.73;42.53;United States;SAGE Publications;1970-ongoing;"Anthropology (Q1); Cultural Studies (Q1); Social Psychology (Q1)"
87;24592;European Journal of International Relations;journal;13540661;1.929;Q1;79;17;61;1484;158;59;2.39;87.29;United States;SAGE Publications;1995-ongoing;"Political Science and International Relations (Q1); Sociology and Political Science (Q1)"
88;27343;Journal of Ethnic and Migration Studies;journal;14699451, 1369183X;1.91;Q1;75;70;180;2842;310;179;1.56;40.60;United Kingdom;Carfax Publishing Ltd.;1971-ongoing;"Arts and Humanities (miscellaneous) (Q1); Demography (Q1)"
89;28092;Economic Geography;journal;00130095;1.852;Q1;74;18;51;1389;132;49;2.58;77.17;United Kingdom;Taylor & Francis;1972, 1974, 1978-1985, 1987-ongoing;"Economics and Econometrics (Q1); Geography, Planning and Development (Q1)"
90;28611;Geoforum;journal;00167185;1.846;Q1;98;104;212;6337;482;189;2.11;60.93;United Kingdom;Elsevier Ltd.;1970-ongoing;Sociology and Political Science (Q1)
91;23626;Science Education;journal;00368326, 1098237X;1.843;Q1;100;41;150;2268;299;145;1.43;55.32;United States;John Wiley & Sons Inc.;1916-1919, 1922-ongoing;"Education (Q1); History and Philosophy of Science (Q1)"
92;13274;Environment and Planning D: Society and Space;journal;02637758;1.837;Q1;93;56;154;3837;292;139;2.28;68.52;United Kingdom;SAGE Publications Inc.;1983-ongoing;"Environmental Science (miscellaneous) (Q1); Geography, Planning and Development (Q1)"
93;28964;Journal of Applied Econometrics;journal;10991255, 08837252;1.833;Q1;88;60;156;2056;234;153;1.47;34.27;United States;John Wiley & Sons Inc.;1986-ongoing;"Economics and Econometrics (Q1); Social Sciences (miscellaneous) (Q1)"
94;13268;Scientific Studies of Reading;journal;10888438;1.819;Q1;51;17;56;958;136;54;2.58;56.35;United States;Lawrence Erlbaum Associates Inc.;2004-ongoing;"Education (Q1); Psychology (miscellaneous) (Q1)"
95;19250;Work and Occupations;journal;07308884;1.81;Q1;58;13;61;754;97;61;0.91;58.00;United States;SAGE Publications;1974-ongoing;"Organizational Behavior and Human Resource Management (Q1); Sociology and Political Science (Q1)"
96;12006;Journal of Vocational Behavior;journal;10959084, 00018791;1.794;Q1;128;57;179;3206;598;175;2.93;56.25;United States;Elsevier Inc.;1971-ongoing;"Applied Psychology (Q1); Education (Q1); Life-span and Life-course Studies (Q1); Organizational Behavior and Human Resource Management (Q1)"
97;13124;Trauma, Violence and Abuse;journal;15248380, 15528324;1.789;Q1;70;28;51;1779;131;49;2.21;63.54;United States;SAGE Publications;2000-ongoing;"Applied Psychology (Q1); Health (social science) (Q1); Public Health, Environmental and Occupational Health (Q1); Social Work (Q1)"
98;26493;Academic Medicine;journal;10402446;1.787;Q1;130;257;875;4338;1789;799;2.17;16.88;United States;Lippincott Williams & Wilkins Ltd.;1989-ongoing;"Education (Q1); Medicine (miscellaneous) (Q1)"
99;30060;World Development;journal;0305750X;1.778;Q1;150;113;341;5422;984;337;2.47;47.98;United Kingdom;Elsevier Ltd.;1973-ongoing;"Development (Q1); Economics and Econometrics (Q1); Geography, Planning and Development (Q1); Sociology and Political Science (Q1)"
100;18130;Sociology;journal;00380385;1.747;Q1;96;77;193;2498;394;180;2.11;32.44;United States;SAGE Publications;1967-ongoing;Sociology and Political Science (Q1)
101;26362;Journal of Peace Research;journal;00223433;1.746;Q1;86;39;118;1831;237;117;1.36;46.95;United States;SAGE Publications;1964-ongoing;"Political Science and International Relations (Q1); Safety Research (Q1); Sociology and Political Science (Q1)"
102;18983;Social Science and Medicine;journal;02779536;1.739;Q1;213;434;1416;19327;4858;1383;3.07;44.53;United Kingdom;Elsevier Ltd.;1967-ongoing;"Health (social science) (Q1); History and Philosophy of Science (Q1); Medicine (miscellaneous) (Q1)"
