Rank;Sourceid;Title;Type;Issn;SJR;SJR Best Quartile;H index;Total Docs. (2008);Total Docs. (3years);Total Refs.;Total Cites (3years);Citable Docs. (3years);Cites / Doc. (2years);Ref. / Doc.;Country;Region;Publisher;Coverage;Categories
555;28201;Biomedical and Environmental Sciences;journal;08953988;0.293;Q3;57;80;232;1910;221;232;0.8;23.88;United Kingdom;Western Europe;Elsevier;1988-2021;"Health, Toxicology and Mutagenesis (Q3); Public Health, Environmental and Occupational Health (Q3)"
556;23359;Bioremediation Journal;journal;15476529, 10889868;0.293;Q2;36;21;51;874;34;50;0.63;41.62;United Kingdom;Western Europe;Taylor and Francis Ltd.;1997-2021;Environmental Science (miscellaneous) (Q2)
557;18418;Archives of Hydroengineering and Environmental Mechanics;journal;12313726;0.291;Q2;13;8;54;181;15;53;0.32;22.63;Poland;Eastern Europe;De Gruyter Open Ltd.;1994-2010, 2012-2020;"Water Science and Technology (Q2); Civil and Structural Engineering (Q3)"
558;19900191887;Environmental Sciences Europe;journal;21904707, 21904715;0.29;Q3;39;36;148;939;87;127;0.71;26.08;Germany;Western Europe;Springer Verlag;2011-2021;Pollution (Q3)
559;21362;Archiv fur Lebensmittelhygiene;journal;0003925X;0.289;Q3;18;35;106;942;39;102;0.34;26.91;Germany;Western Europe;Verlag M. und H. Schaper GmbH;1959-1961, 1973-1989, 1996-2019;"Food Science (Q2); Health, Toxicology and Mutagenesis (Q3); Management, Monitoring, Policy and Law (Q3); Microbiology (Q3)"
560;19203;Journal of Aquatic Plant Management (discontinued);journal;01466623;0.288;Q3;31;35;73;1346;55;72;0.55;38.46;United States;Northern America;Aquatic Plant Management Society, Inc.;1979, 1994-2017;"Aquatic Science (Q3); Management, Monitoring, Policy and Law (Q3); Plant Science (Q3)"
561;20439;Israel Journal of Entomology;journal;00751243;0.287;-;10;0;13;0;6;13;0;0;Israel;Middle East;Entomological Society of Israel;1996-1999, 2004-2005, 2019-2020;Agricultural and Biological Sciences (miscellaneous) (Q2)
562;25818;International Journal of Refugee Law;journal;14643715, 09538186;0.286;Q3;34;21;63;2365;35;61;0.56;112.62;United Kingdom;Western Europe;Oxford University Press;1989-2021;"Demography (Q2); Law (Q2); Management, Monitoring, Policy and Law (Q3)"
563;29444;Colourage;trade journal;00101826;0.283;Q2;22;167;627;707;29;607;0.05;4.23;India;Asiatic Region;Colour Publications Pvt. Ltd;1989-2020;"Business, Management and Accounting (miscellaneous) (Q2); Environmental Science (miscellaneous) (Q2); Industrial and Manufacturing Engineering (Q2)"
564;55750;Human Ecology Review;journal;10744827;0.283;Q3;43;19;53;1007;32;51;0.46;53;United States;Northern America;Society for Human Ecology;1998-2020;"Geography, Planning and Development (Q2); Management, Monitoring, Policy and Law (Q3)"
565;2200147401;Journal of ASTM International;journal;1546962X;0.283;Q3;35;220;860;4271;271;859;0.28;19.41;United States;Northern America;American Society for Testing and Materials;2005-2012;"Engineering (miscellaneous) (Q2); Materials Science (miscellaneous) (Q2); Nuclear Energy and Engineering (Q2); Environmental Engineering (Q3); Public Health, Environmental and Occupational Health (Q3)"
566;27316;Metal Finishing;journal;00260576;0.282;Q2;26;140;488;201;88;327;0.24;1.44;United States;Northern America;Elsevier USA;1969-2013;"Industrial and Manufacturing Engineering (Q2); Metals and Alloys (Q2); Polymers and Plastics (Q2); Waste Management and Disposal (Q2); Pollution (Q3)"
567;7100153101;International Zoo Yearbook;journal;00749664, 17481090;0.281;Q3;28;25;76;627;42;75;0.81;25.08;United Kingdom;Western Europe;Wiley-Blackwell Publishing Ltd;1960-1963, 1965-1982, 1984, 1986-1995, 1997-1998, 2000, 2003, 2005-2020;"Nature and Landscape Conservation (Q3); Ecology, Evolution, Behavior and Systematics (Q4)"
568;19383;Fluoride - Quarterly Reports;journal;22534083, 00154725;0.28;Q3;48;58;128;953;132;123;1.06;16.43;New Zealand;Pacific Region;International Society for Fluoride Research;1973-2021;"Agricultural and Biological Sciences (miscellaneous) (Q2); Chemistry (miscellaneous) (Q3); Dentistry (miscellaneous) (Q3); Health, Toxicology and Mutagenesis (Q3); Public Health, Environmental and Occupational Health (Q3); Toxicology (Q3); Biochemistry (Q4)"
569;110000;International Journal of Environmental Studies;journal;00207233, 10290400;0.279;Q2;35;55;197;1677;103;179;0.55;30.49;United Kingdom;Western Europe;Taylor and Francis Ltd.;1970-2021;"Geography, Planning and Development (Q2); Waste Management and Disposal (Q2); Computers in Earth Sciences (Q3); Ecology (Q3); Pollution (Q3)"
570;23996;International Journal of Environment and Pollution;journal;09574352, 17415101;0.279;Q2;47;122;282;4730;182;274;0.63;38.77;United Kingdom;Western Europe;Inderscience Enterprises Ltd.;1991-2020;"Waste Management and Disposal (Q2); Management, Monitoring, Policy and Law (Q3); Pollution (Q3)"
571;24493;Western North American Naturalist;journal;15270904;0.278;Q3;36;60;192;2174;78;185;0.36;36.23;United States;Northern America;Brigham Young University;2000-2021;"Ecology (Q3); Ecology, Evolution, Behavior and Systematics (Q4)"
572;7500153132;International Journal of River Basin Management;journal;15715124, 18142060;0.276;Q2;38;33;88;1055;39;88;0.53;31.97;United Kingdom;Western Europe;Taylor and Francis Ltd.;2003-2021;Water Science and Technology (Q2)
573;4000148503;International Journal of Environmental Science and Technology;journal;17351472;0.275;Q3;84;64;175;1966;111;175;0.62;30.72;Iran;Middle East;CEERS;2005-2021;"Agricultural and Biological Sciences (miscellaneous) (Q2); Environmental Engineering (Q3); Environmental Chemistry (Q4)"
574;50039;Review of Policy Research;journal;1541132X, 15411338;0.274;Q3;48;26;153;1365;71;139;0.51;52.5;United Kingdom;Western Europe;Wiley-Blackwell Publishing Ltd;1981-1995, 1998-2021;"Geography, Planning and Development (Q2); Management, Monitoring, Policy and Law (Q3); Public Administration (Q3)"
575;22594;Chinese Journal of Applied Ecology;journal;10019332;0.273;Q3;44;436;1454;12680;1008;1453;0.65;29.08;China;Asiatic Region;Editorial Board of Chinese Journal of Applied Ecology;1991-2021;"Ecology (Q3); Medicine (miscellaneous) (Q3); Ecology, Evolution, Behavior and Systematics (Q4)"
576;19900192156;Journal of Hazardous, Toxic, and Radioactive Waste;journal;21535493, 21535515;0.273;Q2;31;39;106;1310;52;92;0.45;33.59;United States;Northern America;American Society of Civil Engineers (ASCE);2011-2022;"Chemical Engineering (miscellaneous) (Q2); Geotechnical Engineering and Engineering Geology (Q2); Water Science and Technology (Q2); Environmental Engineering (Q3); Waste Management and Disposal (Q3); Environmental Chemistry (Q4)"
577;24737;Polish Journal of Ecology;journal;15052249;0.271;Q3;30;72;200;2686;103;196;0.49;37.31;Poland;Eastern Europe;Polish Academy of Sciences;1996, 1998-2021;"Ecology (Q3); Ecology, Evolution, Behavior and Systematics (Q4)"
578;5700162683;Globalizations;journal;1474774X, 14747731;0.27;Q3;44;51;123;1696;46;117;0.37;33.25;United Kingdom;Western Europe;Taylor and Francis Ltd.;2004-2021;"Economics, Econometrics and Finance (miscellaneous) (Q2); Geography, Planning and Development (Q2); Sociology and Political Science (Q2); Management, Monitoring, Policy and Law (Q3); Public Administration (Q3)"
579;27506;Bulletin de l'Institut Royal des Sciences Naturelles de Belqique, Sciences de la Terre;journal;03746291;0.269;Q3;30;18;40;804;22;40;0.46;44.67;Belgium;Western Europe;Institute Royal des Sciences Naturelles de Belgique;1996-2011;"Ecology (Q3); Paleontology (Q3)"
580;28216;Geocarto International;journal;17520762, 10106049;0.268;Q2;47;36;97;889;27;91;0.2;24.69;United Kingdom;Western Europe;Taylor and Francis Ltd.;1986-2021;"Geography, Planning and Development (Q2); Water Science and Technology (Q2)"
581;22018;Fresenius Environmental Bulletin (discontinued);journal;10184619;0.266;Q3;41;303;650;7961;357;649;0.51;26.27;Germany;Western Europe;Parlar Scientific Publications;1993-2021;"Pollution (Q3); Waste Management and Disposal (Q3); Environmental Chemistry (Q4)"
582;33310;Outlook on Agriculture;journal;00307270;0.266;Q3;32;38;106;920;44;93;0.36;24.21;United Kingdom;Western Europe;SAGE Publications Inc.;1973, 1976, 1979-1981, 1984-1989, 1991-2021;"Agronomy and Crop Science (Q3); Animal Science and Zoology (Q3); Ecology (Q3)"
583;29573;Limnology;journal;1439863X, 14398621;0.265;Q2;40;28;83;846;70;82;0.88;30.21;Japan;Asiatic Region;Springer Japan;2000-2021;"Water Science and Technology (Q2); Aquatic Science (Q3); Ecology (Q3)"
584;12701;Nukleonika;journal;15085791, 00295922;0.265;Q3;24;64;208;1050;79;208;0.32;16.41;Poland;Eastern Europe;Institute of Nuclear Chemistry and Technology;1968, 1970, 1973-1974, 1978, 1981, 1996-2021;"Nuclear Energy and Engineering (Q2); Safety, Risk, Reliability and Quality (Q2); Condensed Matter Physics (Q3); Instrumentation (Q3); Waste Management and Disposal (Q3); Nuclear and High Energy Physics (Q4)"
585;12888;Chinese Journal of Chemical Engineering;journal;10049541;0.263;Q3;61;160;436;3598;278;436;0.71;22.49;China;Asiatic Region;Chemical Industry Press;1993-2021;"Chemical Engineering (miscellaneous) (Q2); Chemistry (miscellaneous) (Q3); Environmental Engineering (Q3); Biochemistry (Q4)"
586;29577;Journal of Biological Systems;journal;17936470, 02183390;0.261;Q3;35;31;100;925;60;99;0.6;29.84;Singapore;Asiatic Region;World Scientific Publishing Co. Pte Ltd;1996-2021;"Agricultural and Biological Sciences (miscellaneous) (Q2); Ecology (Q3); Applied Mathematics (Q4)"
587;25223;Toxicology and Industrial Health;journal;07482337, 14770393;0.261;Q4;62;53;133;2690;109;131;0.75;50.75;United Kingdom;Western Europe;SAGE Publications Ltd;1985-2021;"Public Health, Environmental and Occupational Health (Q3); Toxicology (Q3); Health, Toxicology and Mutagenesis (Q4)"
588;5000160304;USDA Forest Service - Resource Bulletin PNW-RB;journal;07481284;0.259;Q3;6;3;10;37;2;10;0.33;12.33;United States;Northern America;USDA Forest Service;1997-1999, 2002-2012, 2014-2016, 2018-2019;"Forestry (Q2); Ecology (Q3); Plant Science (Q3)"
589;22550;Web Ecology;journal;21933081, 13991183;0.257;Q3;19;18;27;683;10;26;0.36;37.94;Germany;Western Europe;Copernicus GmbH;2000-2003, 2005-2021;"Ecology (Q3); Ecology, Evolution, Behavior and Systematics (Q4)"
590;23999;Instrumentation Science and Technology;journal;15256030, 10739149;0.256;Q2;26;50;163;875;88;162;0.54;17.5;United States;Northern America;Taylor and Francis Ltd.;1968-1972, 1974-1977, 1979-1982, 1984-1990, 1992-2021;"Chemical Engineering (miscellaneous) (Q2); Environmental Science (miscellaneous) (Q2); Instrumentation (Q3)"
591;20188;Disaster Prevention and Management;journal;09653562;0.255;Q3;57;78;276;1006;107;270;0.38;12.9;United Kingdom;Western Europe;Emerald Group Publishing Ltd.;1992-2021;"Business, Management and Accounting (miscellaneous) (Q2); Health (social science) (Q3); Management, Monitoring, Policy and Law (Q3); Public Health, Environmental and Occupational Health (Q3)"
592;56524;Ecological Restoration;journal;15434079, 15224740;0.255;Q3;31;72;131;973;49;109;0.33;13.51;United States;Northern America;University of Wisconsin Press;1999-2021;Nature and Landscape Conservation (Q3)
593;130109;Acta Ecologica Sinica;journal;10000933, 18722032;0.253;Q3;47;694;1238;21087;776;1238;0.49;30.38;China;Asiatic Region;Science Press;2005-2021;"Ecology (Q3); Ecology, Evolution, Behavior and Systematics (Q4)"
594;31877;International Agrophysics;journal;02368722;0.252;Q2;42;43;151;1028;52;151;0.34;23.91;Germany;Western Europe;Polish Academy of Sciences;1989, 1992-2021;"Agricultural and Biological Sciences (miscellaneous) (Q2); Fluid Flow and Transfer Processes (Q2); Water Science and Technology (Q2); Soil Science (Q3)"
595;24042;Mine Water and the Environment;journal;16161068, 10259112;0.252;Q2;40;24;84;568;45;75;0.43;23.67;Germany;Western Europe;Springer Verlag;1991-1995, 2001-2002, 2004-2021;"Geotechnical Engineering and Engineering Geology (Q2); Water Science and Technology (Q2)"
596;4700151615;Scandinavian Journal of Work, Environment and Health, Supplement;journal;03566528;0.251;Q4;23;54;50;1887;37;43;1.03;34.94;Finland;Western Europe;Finnish Institute of Occupational Health;2005-2011, 2016-2018;"Geography, Planning and Development (Q2); Public Health, Environmental and Occupational Health (Q3); Toxicology (Q3); Health, Toxicology and Mutagenesis (Q4)"
597;19700188237;Journal of Biological Dynamics;journal;17513766, 17513758;0.25;Q3;34;29;24;818;12;23;0.5;28.21;United Kingdom;Western Europe;Taylor and Francis Ltd.;2007-2021;"Ecology (Q3); Ecology, Evolution, Behavior and Systematics (Q4)"
598;95801;Naturschutz und Landschaftsplanung;journal;09406808;0.25;Q2;14;54;181;1343;29;155;0.2;24.87;Germany;Western Europe;Verlag Eugen Ulmer;1995-2021;"Environmental Science (miscellaneous) (Q2); Ecology (Q3)"
599;23416;Journal of International Wildlife Law and Policy;journal;15481476, 13880292;0.249;Q3;20;13;44;2041;23;42;0.53;157;United Kingdom;Western Europe;Taylor and Francis Ltd.;1998-2021;"Geography, Planning and Development (Q2); Law (Q2); Ecology (Q3); Management, Monitoring, Policy and Law (Q3)"
600;26852;US Geological Survey Profesional Paper;journal;10449612;0.249;Q2;38;55;94;2723;31;90;0.25;49.51;United States;Northern America;U.S. Geological Survey;1964, 1966, 1968-1971, 1978-2012, 2020;"Water Science and Technology (Q2); Geology (Q3)"
601;32555;Japan Agricultural Research Quarterly;journal;00213551;0.248;Q3;34;40;137;1050;92;137;0.55;26.25;Japan;Asiatic Region;Japan International Research Center for Agricultural Sciences;1973-1974, 1977-1978, 1983, 1987, 1993-2021;"Agronomy and Crop Science (Q3); Animal Science and Zoology (Q3); Biotechnology (Q3); Ecology (Q3)"
602;14692;Environmental History;journal;19308892, 10845453;0.247;Q2;38;36;151;2265;45;122;0.17;62.92;United Kingdom;Western Europe;Oxford University Press;1996-2021;"History (Q1); Environmental Science (miscellaneous) (Q2)"
603;20248;Umweltmedizin in Forschung und Praxis;journal;14308681;0.247;Q4;15;41;118;1122;42;94;0.4;27.37;Germany;Western Europe;;1998-2015;"Public Health, Environmental and Occupational Health (Q3); Health, Toxicology and Mutagenesis (Q4)"
604;19700177700;European Energy and Environmental Law Review;journal;18793886, 25890387;0.246;Q3;14;31;65;2249;28;59;0.49;72.55;Netherlands;Western Europe;Kluwer Law International;2008-2021;"Geography, Planning and Development (Q2); Law (Q2); Management, Monitoring, Policy and Law (Q3); Renewable Energy, Sustainability and the Environment (Q3)"
605;11400153306;Radioactivity in the Environment;book series;15694860;0.245;Q2;23;35;229;3073;75;224;0.5;87.8;United Kingdom;Western Europe;Elsevier Ltd.;2001-2003, 2005-2010, 2012-2013;"Earth and Planetary Sciences (miscellaneous) (Q2); Environmental Science (miscellaneous) (Q2)"
606;15900154716;Proceedings of the International Conference on Fluvial Hydraulics - River Flow 2006;conference and proceedings;-;0.243;-;13;0;247;0;91;244;0.37;0;Netherlands;Western Europe;;;Water Science and Technology
607;87661;Geotermia;journal;01865897;0.242;Q2;8;6;39;79;8;38;0.16;13.17;Mexico;Latin America;Gerencia de Proyectos Geotermoelectricos, Comision Federal de Electricidad;1996-2000, 2004-2018;"Economic Geology (Q2); Water Science and Technology (Q2)"
608;17865;Webbia;journal;00837792;0.242;Q3;21;16;45;680;26;45;0.5;42.5;Italy;Western Europe;Firenze University Press;1905, 1907, 1910, 1913-1914, 1921, 1923, 1948, 1950-2021;"Ecology (Q3); Plant Science (Q3); Ecology, Evolution, Behavior and Systematics (Q4)"
609;24739;Polish Journal of Environmental Studies;journal;12301485;0.241;Q3;59;129;353;3849;177;346;0.55;29.84;Poland;Eastern Europe;HARD;1996-2021;"Environmental Science (miscellaneous) (Q3); Environmental Chemistry (Q4)"
610;17567;Lakes and Reservoirs: Research and Management;journal;14401770, 13205331;0.24;Q2;41;32;87;1144;38;81;0.32;35.75;United Kingdom;Western Europe;Wiley-Blackwell Publishing Ltd;1995-1996, 1998-2021;Water Science and Technology (Q2)
611;25653;Northeastern Geology and Environmental Sciences;journal;01941453;0.24;Q3;12;23;76;807;14;74;0.24;35.09;United States;Northern America;Allen Press Inc.;1995-2008;"Ocean Engineering (Q2); Geology (Q3); Water Science and Technology (Q3)"
612;18587;Shuili Xuebao/Journal of Hydraulic Engineering;journal;05599350;0.237;Q3;35;229;725;3155;198;725;0.25;13.78;China;Asiatic Region;China Water Power Press;1985-1998, 2001-2021;"Energy Engineering and Power Technology (Q2); Mechanical Engineering (Q2); Water Science and Technology (Q3)"
613;17839;Conservation Science Western Australia;journal;14473682;0.236;Q3;22;14;14;2763;7;13;0.5;197.36;Australia;Pacific Region;Science Division, Department of Environment and Conservation;2002, 2004, 2006-2017;"Management, Monitoring, Policy and Law (Q3); Nature and Landscape Conservation (Q3)"
614;23275;International Journal of Sustainable Development;journal;09601406, 17415268;0.236;Q3;28;15;64;675;35;60;0.07;45;United Kingdom;Western Europe;Inderscience Enterprises Ltd.;1999-2021;"Geography, Planning and Development (Q2); Management, Monitoring, Policy and Law (Q3)"
615;9100153110;Boletin de la Asociacion de Geografos Espanoles;journal;26053322, 02129426;0.235;-;22;48;79;1368;18;77;0.23;28.5;Spain;Western Europe;Radcliffe Cardiology;2006-2021;Geography, Planning and Development (Q2)
616;14578;Ecologia Austral;journal;03275477, 1667782X;0.233;Q3;32;28;68;1373;28;66;0.38;49.04;Argentina;Latin America;Asociacion Argentina de Ecologia;1991, 1993-2021;"Ecology (Q3); Ecology, Evolution, Behavior and Systematics (Q4)"
617;16920;Gas Wasserfach Wasser Abwasser;journal;00163651;0.233;Q3;11;76;247;930;26;239;0.11;12.24;Germany;Western Europe;R. Oldenbourg;1970-2013, 2015-2018;Water Science and Technology (Q3)
618;16730;Aquatic Ecosystem Health and Management;journal;15394077, 14634988;0.231;Q3;44;49;151;1588;69;143;0.39;32.41;United States;Northern America;Michigan State University Press;1998-2021;"Ecology (Q3); Management, Monitoring, Policy and Law (Q3); Aquatic Science (Q4)"
619;21100239259;SAE Technical Papers;journal;26883627, 01487191;0.231;Q3;116;2737;9409;35712;2896;9399;0.3;13.05;United States;Northern America;SAE International;1906-2021;"Automotive Engineering (Q2); Industrial and Manufacturing Engineering (Q2); Pollution (Q3); Safety, Risk, Reliability and Quality (Q3)"
620;22766;Asia Pacific Journal of Environmental Law;journal;18758258, 13852140;0.23;Q3;8;13;22;1011;5;19;0.08;77.77;Australia;Pacific Region;Edward Elgar Publishing Ltd.;1996-2002, 2004-2011, 2013-2020;Management, Monitoring, Policy and Law (Q3)
621;13192;Radioprotection;journal;1769700X, 00338451;0.229;Q3;18;35;90;526;24;74;0.29;15.03;France;Western Europe;EDP Sciences;1977-1981, 1988-2021;"Nuclear Energy and Engineering (Q3); Public Health, Environmental and Occupational Health (Q3); Renewable Energy, Sustainability and the Environment (Q3); Safety, Risk, Reliability and Quality (Q3); Waste Management and Disposal (Q3); Health, Toxicology and Mutagenesis (Q4)"
622;21100197960;River, Coastal and Estuarine Morphodynamics: RCEM 2005 - Proceedings of the 4th IAHR Symposium on River, Coastal and Estuarine Morphodynamics;conference and proceedings;-;0.227;-;10;0;138;0;56;135;0.41;0;United States;Northern America;;;"Ecological Modeling; Environmental Chemistry"
623;14298;Harvard Environmental Law Review;journal;01478257;0.225;Q3;32;12;36;3978;27;36;0.67;331.5;United States;Northern America;Harvard University;1979-1983, 1987, 1989, 1996-2020;"Law (Q2); Environmental Science (miscellaneous) (Q3); Management, Monitoring, Policy and Law (Q3)"
624;23268;International Journal of Global Environmental Issues;journal;14666650, 17415136;0.225;Q3;23;28;61;1056;37;56;0.64;37.71;United Kingdom;Western Europe;Inderscience Enterprises Ltd.;2001-2020;"Geography, Planning and Development (Q2); Management, Monitoring, Policy and Law (Q3)"
625;23033;Proceedings of the Royal Society of Victoria;journal;00359211;0.225;Q3;21;33;57;1820;21;52;0.24;55.15;Australia;Pacific Region;Royal Society of Victoria;1980-2011, 2014-2018, 2020-2021;"Ecology (Q3); Geology (Q3)"
626;4700152709;Progress in Industrial Ecology;journal;14788764, 14768917;0.225;Q3;22;29;85;1248;31;84;0.35;43.03;United Kingdom;Western Europe;Inderscience Enterprises Ltd.;2004-2010, 2012-2020;"Development (Q3); Ecology (Q3); Economics, Econometrics and Finance (miscellaneous) (Q3); Management, Monitoring, Policy and Law (Q3); Waste Management and Disposal (Q3)"
627;5800173378;Environmental Bioindicators;journal;15555275;0.224;Q3;16;23;46;522;21;43;0.46;22.7;United Kingdom;Western Europe;Taylor and Francis Ltd.;2006-2009;"Ecology (Q3); Ecology, Evolution, Behavior and Systematics (Q4)"
628;22842;Forest Genetics;journal;1335048X;0.224;Q3;19;0;14;0;9;14;0;0;Slovakia;Eastern Europe;Arbora Publishers spol sro;1994-1995, 2000-2005;"Forestry (Q2); Ecology (Q3); Environmental Science (miscellaneous) (Q3); Plant Science (Q3); Genetics (Q4)"
629;21100232425;Transitional Waters Bulletin;journal;1825229X;0.224;Q3;18;23;34;868;15;33;0.44;37.74;Italy;Western Europe;;2007-2014;"Ecology (Q3); Nature and Landscape Conservation (Q3); Water Science and Technology (Q3)"
630;10300153374;WSEAS Transactions on Environment and Development;journal;17905079, 22243496;0.224;Q3;21;109;27;2442;32;27;1.19;22.4;Greece;Western Europe;World Scientific and Engineering Academy and Society;2007-2015, 2017-2021;"Energy (miscellaneous) (Q2); Geography, Planning and Development (Q2); Environmental Science (miscellaneous) (Q3)"
631;5000160301;Environmental Quality Management;journal;15206483, 10881913;0.223;Q3;30;40;118;550;28;115;0.23;13.75;United States;Northern America;"John Wiley &amp; Sons Inc.";1991-2021;"Management, Monitoring, Policy and Law (Q3); Pollution (Q3); Public Health, Environmental and Occupational Health (Q3); Waste Management and Disposal (Q3)"
632;22877;Journal of Sustainable Forestry;journal;1540756X, 10549811;0.221;Q3;33;32;129;1455;39;122;0.2;45.47;United Kingdom;Western Europe;Taylor and Francis Ltd.;1992-2021;"Forestry (Q2); Food Science (Q3); Geography, Planning and Development (Q3); Management, Monitoring, Policy and Law (Q3); Renewable Energy, Sustainability and the Environment (Q3)"
633;22688;Indian Journal of Environmental Protection;journal;02537141;0.22;Q3;20;140;442;2040;57;442;0.11;14.57;India;Asiatic Region;Kalpana Corporation;1981-1990, 2000-2021;Environmental Science (miscellaneous) (Q3)
634;14643;Turkish Journal of Engineering and Environmental Sciences;journal;13000160, 13036157;0.218;Q3;35;38;111;803;57;110;0.4;21.13;Turkey;Middle East;Turkiye Klinikleri Journal of Medical Sciences;1994-2014, 2016;"Fluid Flow and Transfer Processes (Q2); Ocean Engineering (Q2); Environmental Engineering (Q3); Water Science and Technology (Q3)"
635;28670;Geographica Helvetica;journal;00167312, 21948798;0.216;Q4;22;28;67;727;28;67;0.46;25.96;Germany;Western Europe;Fotorotar AG;1946-2021;"Anthropology (Q2); Earth-Surface Processes (Q3); Geography, Planning and Development (Q3); Global and Planetary Change (Q4)"
636;17895;Ecos - A Review of Conservation (discontinued);journal;01439073;0.215;Q3;9;42;163;296;20;144;0.13;7.05;United Kingdom;Western Europe;British Association of Nature Conservationists;1980-2018;"Environmental Science (miscellaneous) (Q3); Geography, Planning and Development (Q3)"
637;25241;Toxicology Mechanisms and Methods;journal;15376524, 15376516;0.215;Q4;46;95;169;3410;106;168;0.63;35.89;United Kingdom;Western Europe;Informa Healthcare;1991-2021;"Toxicology (Q3); Health, Toxicology and Mutagenesis (Q4)"
638;23945;Gefahrstoffe Reinhaltung der Luft;journal;09498036;0.212;Q3;19;88;279;1007;38;241;0.14;11.44;Germany;Western Europe;"VDI Fachmedien GmBbH &amp; Co.";1996-2021;"Management, Monitoring, Policy and Law (Q3); Pollution (Q3); Health, Toxicology and Mutagenesis (Q4)"
639;33154;Journal of Architectural and Planning Research;journal;07380895;0.212;Q3;28;22;56;776;32;55;0.61;35.27;United States;Northern America;Locke Science Publishing Company Inc.;1984-2019;"Architecture (Q1); Environmental Science (miscellaneous) (Q3); Geography, Planning and Development (Q3); Urban Studies (Q3)"
640;23285;Natures Sciences Societes;journal;12401307, 17652979;0.212;Q3;19;63;210;884;37;185;0.13;14.03;France;Western Europe;EDP Sciences;1995-2021;"Earth and Planetary Sciences (miscellaneous) (Q2); Multidisciplinary (Q2); Agricultural and Biological Sciences (miscellaneous) (Q3); Biochemistry, Genetics and Molecular Biology (miscellaneous) (Q3); Environmental Science (miscellaneous) (Q3); Social Sciences (miscellaneous) (Q3)"
641;5800179628;Australasian Journal of Environmental Management;journal;14486563, 21595356;0.211;Q3;28;31;119;1050;42;98;0.37;33.87;United Kingdom;Western Europe;Taylor and Francis Ltd.;1996-2021;"Geography, Planning and Development (Q3); Management, Monitoring, Policy and Law (Q3)"
642;130176;Environmental Practice;journal;14660474, 14660466;0.211;Q3;27;21;94;430;25;68;0.22;20.48;United Kingdom;Western Europe;Taylor and Francis Ltd.;1999-2019;"Geography, Planning and Development (Q3); Management, Monitoring, Policy and Law (Q3)"
643;130162;Management of Environmental Quality;journal;14777835;0.211;Q3;42;57;164;1220;54;161;0.25;21.4;United Kingdom;Western Europe;Emerald Group Publishing Ltd.;2003-2021;"Biochemistry, Genetics and Molecular Biology (miscellaneous) (Q3); Management, Monitoring, Policy and Law (Q3); Public Health, Environmental and Occupational Health (Q3)"
644;4800156203;Revista Brasileira de Engenharia Agricola e Ambiental;journal;14154366, 18071929;0.211;Q3;38;93;217;2024;35;217;0.16;21.76;Brazil;Latin America;Departamento de Engenharia Agricola - UFCG/Cnpq;2006-2021;"Agronomy and Crop Science (Q3); Environmental Engineering (Q3)"
645;110004;Wasserwirtschaft;journal;21928762, 00430978;0.211;Q3;10;111;250;550;26;230;0.09;4.95;Germany;Western Europe;Springer Vieweg;1970, 1973-1990, 1992, 2004-2021;Water Science and Technology (Q3)
