Rank;Sourceid;Title;Type;Issn;SJR;SJR Best Quartile;H index;Total Docs. (2013);Total Docs. (3years);Total Refs.;Total Cites (3years);Citable Docs. (3years);Cites / Doc. (2years);Ref. / Doc.;Country;Publisher;Coverage;Categories
365;21100240700;Notes on Numerical Fluid Mechanics and Multidisciplinary Design;book series;18600824, 16122909;0.271;Q3;19;134;352;1883;139;342;0.34;14.05;United States;Springer Science + Business Media;2006-ongoing;Fluid Flow and Transfer Processes (Q3)
366;89083;China Petroleum Processing and Petrochemical Technology;journal;10086234;0.27;Q3;10;56;237;974;53;173;0.4;17.39;China;Research Institute of Petroleum Processing, SINOPEC;1999-ongoing;"Energy Engineering and Power Technology (Q2); Fuel Technology (Q2); Mechanical Engineering (Q3); Process Chemistry and Technology (Q3)"
367;16050;Indian Journal of Biotechnology;journal;09725849, 09750967;0.268;Q4;32;79;209;2158;195;207;0.74;27.32;India;National Institute of Science Communication;2002-ongoing;"Applied Microbiology and Biotechnology (Q3); Biotechnology (Q3); Plant Science (Q3); Bioengineering (Q4)"
368;5000156907;Polimeros;journal;01041428;0.265;Q3;20;129;237;3458;161;211;0.62;26.81;Brazil;ABPol;2006-ongoing;"Chemical Engineering (miscellaneous) (Q3); Organic Chemistry (Q4)"
369;19700202601;International Review on Modelling and Simulations;journal;19749821;0.264;Q3;19;247;954;5501;682;949;0.73;22.27;Italy;Praise Worthy Prize;2010-ongoing;"Chemical Engineering (miscellaneous) (Q3); Electrical and Electronic Engineering (Q3); Mechanical Engineering (Q3); Modeling and Simulation (Q4)"
370;11700154725;Education for Chemical Engineers;journal;17497728;0.261;Q3;15;14;51;398;38;51;0.7;28.43;Netherlands;Elsevier BV;2006-ongoing;"Chemical Engineering (miscellaneous) (Q3); Education (Q3)"
371;21100228138;International Journal of Corrosion;journal;16879333, 16879325;0.261;Q3;13;20;84;711;68;80;0.8;35.55;Egypt;Hindawi Publishing Corporation;2010-ongoing;"Materials Science (miscellaneous) (Q3); Process Chemistry and Technology (Q3)"
372;12400154718;Shuidonglixue Yanjiu yu Jinzhan / Journal of Hydrodynamics Ser. A;journal;10004874;0.261;Q3;13;96;295;1486;98;295;0.31;15.48;China;China Ocean Press;2008-ongoing;"Computational Mechanics (Q3); Fluid Flow and Transfer Processes (Q3); Applied Mathematics (Q4)"
373;13574;Kagaku Kogaku Ronbunshu;journal;0386216X;0.26;Q3;17;86;253;1254;112;251;0.43;14.58;Japan;Society of Chemical Engineers Japan;1977, 1981-1986, 1989, 1996-ongoing;"Chemical Engineering (miscellaneous) (Q3); Chemistry (miscellaneous) (Q3)"
374;14357;Theoretical Foundations of Chemical Engineering;journal;00405795, 16083431;0.256;Q3;19;114;356;2221;158;354;0.45;19.48;Russian Federation;Maik Nauka/Interperiodica Publishing;1974-1992, 1996-ongoing;"Chemical Engineering (miscellaneous) (Q3); Chemistry (miscellaneous) (Q3)"
375;21100278103;Journal of Biomaterials and Tissue Engineering;journal;21579083, 21579091;0.255;Q4;19;69;62;3926;81;60;1.35;56.9;United States;American Scientific Publishers;2011-2017 (cancelled);"Biomedical Engineering (Q3); Biotechnology (Q3); Medicine (miscellaneous) (Q3); Bioengineering (Q4)"
376;21100241608;Journal of Nanomedicine and Nanotechnology;journal;21577439;0.252;Q4;19;43;77;1819;59;53;1.12;42.3;India;OMICS Publishing Group;2010-2014 (cancelled);"Pharmaceutical Science (Q2); Biomedical Engineering (Q3); Medicine (miscellaneous) (Q3); Bioengineering (Q4)"
377;19900195053;Frontiers of Chemical Science and Engineering;journal;20950179, 20950187;0.25;Q3;22;61;215;2023;170;206;0.89;33.16;China;Higher Education Press;2011-ongoing;Chemical Engineering (miscellaneous) (Q3)
378;18060;ZKG International;trade journal;09490205;0.249;Q3;14;58;134;328;15;134;0.13;5.66;Germany;Bauverlag BV Gmbh;1982-1986, 1988-1989, 1994-2017 (cancelled);"Industrial and Manufacturing Engineering (Q2); Building and Construction (Q3); Chemical Engineering (miscellaneous) (Q3); Materials Science (miscellaneous) (Q3)"
379;21100226436;Frontiers of Nanoscience;book series;18762778;0.242;Q4;8;7;28;606;16;0;0;86.57;United Kingdom;Elsevier Limited;2009, 2011-ongoing;"Biomedical Engineering (Q3); Materials Science (miscellaneous) (Q3); Bioengineering (Q4)"
380;19900192586;International Journal of  Bio-Science and Bio-Technology;journal;22337849;0.242;Q4;12;121;77;2184;76;76;0.91;18.05;South Korea;Science and Engineering Research Support Society;2009-2016 (cancelled);"Biomedical Engineering (Q3); Biotechnology (Q3); Artificial Intelligence (Q4); Bioengineering (Q4)"
381;19700174654;Hemijska Industrija;journal;0367598X;0.241;Q3;15;101;242;3437;155;240;0.66;34.03;Serbia;Savez Hemijskih Inzenjera;2008-ongoing;"Chemical Engineering (miscellaneous) (Q3); Chemistry (miscellaneous) (Q3)"
382;27081;Tenside, Surfactants, Detergents;journal;09323414;0.241;Q3;22;56;175;1524;115;173;0.61;27.21;Germany;Carl Hanser Verlag GmbH & Co.;1986-ongoing;"Chemical Engineering (miscellaneous) (Q3); Chemistry (miscellaneous) (Q3); Condensed Matter Physics (Q4)"
383;17675;Osterreichische Wasser- Und Abfallwirtschaft;journal;0945358X;0.24;Q3;12;38;161;525;37;140;0.28;13.82;Germany;Springer Verlag;1994-2016 (cancelled);"Energy (miscellaneous) (Q2); Fluid Flow and Transfer Processes (Q3); Water Science and Technology (Q3)"
384;19700182639;40th AIAA Fluid Dynamics Conference;conference and proceedings;00002010;0.239;-;16;0;223;0;172;222;0;0;United States;;2010;Fluid Flow and Transfer Processes
385;12100154839;Applied Bionics and Biomechanics;journal;11762322;0.238;Q4;17;17;94;490;94;92;0.86;28.82;Egypt;Hindawi Publishing Corporation;2007-ongoing;"Biomedical Engineering (Q3); Biotechnology (Q3); Medicine (miscellaneous) (Q3); Bioengineering (Q4)"
386;23201;Food Science and Technology Research;journal;13446606;0.237;Q3;36;149;307;4533;162;306;0.44;30.42;Switzerland;S. Karger AG;1999-ongoing;"Industrial and Manufacturing Engineering (Q2); Biotechnology (Q3); Chemical Engineering (miscellaneous) (Q3); Food Science (Q3); Marketing (Q3)"
387;29706;Harbin Gongcheng Daxue Xuebao/Journal of Harbin Engineering University;journal;10067043;0.237;Q3;14;263;839;3633;293;839;0.33;13.81;China;Haerbin Gongcheng Daxue/Harbin Engineering University;2004-ongoing;"Aerospace Engineering (Q3); Chemical Engineering (miscellaneous) (Q3); Control and Systems Engineering (Q3); Mechanical Engineering (Q3); Nuclear Energy and Engineering (Q3)"
388;11200153545;Computer Aided Chemical Engineering;book series;15707946;0.235;Q3;23;178;1252;1638;446;828;0.58;9.2;Netherlands;Elsevier BV;1997, 2000-ongoing;"Chemical Engineering (miscellaneous) (Q3); Computer Science Applications (Q3)"
389;28867;Journal of Applied Fire Science;journal;10444300, 15414183;0.235;Q3;12;25;73;506;17;73;0.23;20.24;United States;Baywood Publishing Co., Inc.;1993-1994, 1996-2000, 2002-2013;"Chemical Engineering (miscellaneous) (Q3); Chemistry (miscellaneous) (Q3); Safety, Risk, Reliability and Quality (Q3); Condensed Matter Physics (Q4)"
390;25193;Applied Sciences;journal;14545101;0.234;Q3;15;11;37;235;16;37;0.25;21.36;Romania;Universitatea Politehnica Bucuresti;1996, 2000-ongoing;"Engineering (miscellaneous) (Q2); Computer Science Applications (Q3); Fluid Flow and Transfer Processes (Q3); Instrumentation (Q3); Materials Science (miscellaneous) (Q3); Process Chemistry and Technology (Q3); Applied Mathematics (Q4)"
391;12100154910;Chemical Industry and Chemical Engineering Quarterly;journal;14519372;0.233;Q3;20;60;177;1845;149;176;0.94;30.75;Serbia;;2008-ongoing;Chemical Engineering (miscellaneous) (Q3)
392;96594;Huagong Xuebao/CIESC Journal;journal;04381157;0.233;Q3;23;648;1811;15028;979;1811;0.54;23.19;China;Chemical Industry and Engineering Society of China;1985-1987, 1989, 1993-ongoing;"Chemical Engineering (miscellaneous) (Q3); Chemistry (miscellaneous) (Q3)"
393;23999;Instrumentation Science and Technology;journal;10739149;0.233;Q3;22;49;119;1150;97;118;0.88;23.47;United States;Marcel Dekker Inc.;1968-1972, 1974-1977, 1979-1982, 1984-1990, 1992-ongoing;"Chemical Engineering (miscellaneous) (Q3); Environmental Science (miscellaneous) (Q3); Instrumentation (Q3)"
394;13534;Chemical and Process Engineering - Inzynieria Chemiczna i Procesowa;journal;02086425;0.231;Q3;16;41;159;918;90;154;0.57;22.39;Poland;Polish Academy of Sciences;1986-1989, 1996-ongoing;"Chemical Engineering (miscellaneous) (Q3); Chemistry (miscellaneous) (Q3)"
395;12969;Gao Xiao Hua Xue Gong Cheng Xue Bao/Journal of Chemical Engineering of Chinese Universities;journal;10039015;0.23;Q3;15;177;555;2887;217;555;0.3;16.31;China;Zhejiang Daxue;1990-1994, 2000-ongoing;Chemical Engineering (miscellaneous) (Q3)
396;27012;Progress in Colloid and Polymer Science;journal;0340255X;0.23;Q3;34;21;67;1206;51;66;0.8;57.43;Germany;Springer Verlag;1978-1979, 1983-1985, 1987-1988, 1990, 1993-1994, 1996-2011;"Colloid and Surface Chemistry (Q3); Materials Chemistry (Q3); Polymers and Plastics (Q3); Organic Chemistry (Q4); Physical and Theoretical Chemistry (Q4)"
397;19700186875;Computational Thermal Sciences;journal;19402554, 19402503;0.224;Q3;13;40;127;1071;52;124;0.43;26.78;United States;Begell House;2009-ongoing;"Energy Engineering and Power Technology (Q3); Fluid Flow and Transfer Processes (Q3); Computational Mathematics (Q4); Surfaces and Interfaces (Q4)"
398;19700182124;Health and Technology;journal;21907196, 21907188;0.222;Q4;12;29;20;1079;20;18;1.11;37.21;Germany;Springer Verlag;2011-ongoing;"Applied Microbiology and Biotechnology (Q3); Biomedical Engineering (Q3); Biotechnology (Q3); Bioengineering (Q4)"
399;19900193914;International Journal of Self-Propagating High-Temperature Synthesis;journal;10613862, 1934788X;0.222;Q3;9;44;85;641;34;84;0.4;14.57;United States;Springer Science + Business Media;2011-ongoing;"Materials Science (miscellaneous) (Q3); Process Chemistry and Technology (Q3)"
400;18800156701;NACE - International Corrosion Conference Series;book series;03614409;0.222;Q3;32;618;1610;8948;418;1601;0.28;14.48;United States;National Association of Corrosion Engineers;1983, 2006-ongoing;"Chemical Engineering (miscellaneous) (Q3); Chemistry (miscellaneous) (Q3); Materials Science (miscellaneous) (Q3)"
401;21100286919;Journal of Water Reuse and Desalination;journal;22201319;0.22;Q3;10;31;54;870;23;52;0.44;28.06;United Kingdom;IWA Publishing;2011-ongoing;"Filtration and Separation (Q3); Water Science and Technology (Q3)"
402;12100154834;Macedonian Journal of Chemistry and Chemical Engineering;journal;03500136, 18575625;0.22;Q3;13;24;63;1202;53;61;0.57;50.08;Macedonia;Macedonian Journal of Chemistry and Chemical Engineering;2008-ongoing;"Chemical Engineering (miscellaneous) (Q3); Chemistry (miscellaneous) (Q3)"
403;17900156728;Polish Journal of Chemical Technology;journal;18994741, 15098117;0.219;Q3;15;84;169;2000;98;168;0.61;23.81;Germany;De Gruyter Open;2007-ongoing;"Biotechnology (Q3); Chemical Engineering (miscellaneous) (Q3); Chemistry (miscellaneous) (Q3)"
404;19700186874;Catalysis in Industry;journal;20700555, 20700504;0.218;Q4;11;42;146;834;57;146;0.38;19.86;Russian Federation;Maik Nauka/Interperiodica Publishing;2010-ongoing;Catalysis (Q4)
405;23489;Chemical Speciation and Bioavailability;journal;09542299;0.218;Q3;25;35;91;1353;41;91;0.43;38.66;United Kingdom;Taylor & Francis;1989-ongoing;"Chemical Health and Safety (Q3); Health, Toxicology and Mutagenesis (Q4); Toxicology (Q4)"
406;16390;Chemical Engineering;trade journal;00092460;0.216;Q3;17;225;712;223;48;248;0.18;0.99;United States;Access Intelligence;1973-ongoing;"Chemical Engineering (miscellaneous) (Q3); Chemistry (miscellaneous) (Q3)"
407;26429;Polimery;journal;00322725;0.216;Q3;23;98;278;3195;160;276;0.61;32.6;Poland;Industrial Chemistry Research Institute;1969-1988, 1996-ongoing;"Chemical Engineering (miscellaneous) (Q3); Materials Chemistry (Q3); Polymers and Plastics (Q3)"
408;19700182642;5th Flow Control Conference;conference and proceedings;00002010;0.213;-;10;0;82;0;56;81;0;0;United States;;2010;Fluid Flow and Transfer Processes
409;17294;Defence Science Journal;journal;0011748X;0.212;Q3;27;93;217;1713;136;209;0.54;18.42;India;Defence Scientific Information & Documentation Centre;1970-1989, 1991-ongoing;"Chemical Engineering (miscellaneous) (Q3); Electrical and Electronic Engineering (Q3); Mechanical Engineering (Q3); Biomedical Engineering (Q4); Computer Science Applications (Q4); Physics and Astronomy (miscellaneous) (Q4)"
410;19700201518;Engineering in Agriculture, Environment and Food;journal;18818366;0.212;Q3;12;30;65;437;22;65;0.27;14.57;Japan;;2008-ongoing;"Industrial and Manufacturing Engineering (Q2); Chemical Engineering (miscellaneous) (Q3); Food Science (Q3)"
411;21100242826;Safety and Health at Work;journal;20937997, 20937911;0.212;Q4;20;30;107;1287;74;98;0.84;42.9;South Korea;Elsevier BV;2010-ongoing;"Public Health, Environmental and Occupational Health (Q3); Safety Research (Q3); Safety, Risk, Reliability and Quality (Q3); Chemical Health and Safety (Q4)"
412;19700174698;Avicenna Journal of Medical Biotechnology;journal;20084625, 20082835;0.211;Q4;16;33;81;890;67;75;0.8;26.97;Iran;Avicenna Research Institute;2010-ongoing;"Applied Microbiology and Biotechnology (Q3); Biotechnology (Q3); Bioengineering (Q4); Biomedical Engineering (Q4)"
413;19700186843;Open Chemical Engineering Journal;journal;18741231;0.211;Q3;8;4;21;74;15;20;0.38;18.5;United Arab Emirates;Bentham Science Publishers;2009-ongoing;Chemical Engineering (miscellaneous) (Q3)
414;21100258772;41st AIAA Fluid Dynamics Conference and Exhibit;conference and proceedings;00002011;0.207;-;11;0;205;0;109;204;0.53;0;United States;;2011;"Aerospace Engineering; Energy Engineering and Power Technology; Fluid Flow and Transfer Processes; Mechanical Engineering"
415;21100198208;Engineering for Rural Development;conference and proceedings;00002011, 00002013;0.207;-;10;124;225;1242;63;224;0.28;10.02;Latvia;;2011-2013;"Agricultural and Biological Sciences (miscellaneous); Automotive Engineering; Chemical Engineering (miscellaneous); Energy (miscellaneous); Food Science; Industrial and Manufacturing Engineering"
416;87828;International Journal of Heat and Technology;journal;03928764;0.207;Q3;25;40;126;803;39;126;0.4;20.08;Italy;Edizioni ETS;1983-1993, 1995-ongoing;"Fluid Flow and Transfer Processes (Q3); Mechanical Engineering (Q3); Condensed Matter Physics (Q4)"
417;120139;Proceedings - SPE International Symposium on Oilfield Chemistry;conference and proceedings;00001997, 00002003, 00002013, 00002001, 00002005, 00001995, 00002009, 00002007, 00001999, 00002011;0.207;-;29;80;83;1438;44;81;0.54;17.98;United States;;1995, 1997, 1999, 2001, 2003, 2005, 2007, 2009, 2011, 2013;"Chemical Engineering (miscellaneous); Chemistry (miscellaneous); Energy Engineering and Power Technology"
418;19400157518;Rasayan Journal of Chemistry;journal;09760083, 09741496;0.207;Q3;18;60;346;1042;155;345;0.33;17.37;India;Rasayan Journal;2009-ongoing;"Pharmacology, Toxicology and Pharmaceutics (miscellaneous) (Q2); Chemical Engineering (miscellaneous) (Q3); Chemistry (miscellaneous) (Q3); Energy (miscellaneous) (Q3); Biochemistry (Q4)"
419;21100202725;Chemistry and Chemical Technology;journal;19964196;0.206;Q3;9;76;66;1120;19;66;0.29;14.74;Ukraine;National Library of Ukraine Vernadsky;2012-ongoing;"Chemical Engineering (miscellaneous) (Q3); Chemistry (miscellaneous) (Q3)"
420;13585;Kemija u industriji/Journal of Chemists and Chemical Engineers;journal;00229830;0.206;Q3;8;51;193;977;22;130;0.12;19.16;Croatia;Hrvatsko Drustvo Kemijskih Inzenjera i Tehnologa/Croatian Society of Chemical Engineers;1993-1999, 2001-2017 (cancelled);"Chemical Engineering (miscellaneous) (Q3); Chemistry (miscellaneous) (Q3)"
421;26901;Acta Polymerica Sinica;journal;10003304;0.204;Q3;21;211;602;5775;338;602;0.64;27.37;China;Science Press;1996-ongoing;"Chemical Engineering (miscellaneous) (Q3); Chemistry (miscellaneous) (Q3); Polymers and Plastics (Q3)"
422;21457;Przemysl Chemiczny;journal;00332496;0.204;Q3;16;446;1154;8824;360;1057;0.34;19.78;Poland;Wydawnictwo SIGMA;1973, 1975-1988, 1990, 1996-ongoing;"Chemical Engineering (miscellaneous) (Q3); Chemistry (miscellaneous) (Q3)"
423;86033;IPPTA: Quarterly Journal of Indian Pulp and Paper Technical Association;journal;03795462;0.203;Q3;10;51;204;372;36;198;0.19;7.29;India;Indian Pulp and Paper Technical Association;1998-2014;"Media Technology (Q2); Chemical Engineering (miscellaneous) (Q3); Chemistry (miscellaneous) (Q3); Materials Chemistry (Q3)"
424;19700201523;European Journal of Nanomedicine;journal;16625986;0.202;Q4;13;23;23;1275;13;14;1.14;55.43;Germany;Walter de Gruyter GmbH;2009-2010, 2012-ongoing;"Medicine (miscellaneous) (Q3); Bioengineering (Q4); Biomedical Engineering (Q4); Physical and Theoretical Chemistry (Q4)"
425;19700186837;Coke and Chemistry;journal;1068364X, 19348398;0.201;Q3;10;93;276;1010;61;276;0.26;10.86;United States;Springer Science + Business Media;2009-ongoing;"Fuel Technology (Q3); Process Chemistry and Technology (Q3); Environmental Chemistry (Q4)"
426;13661;Particulate Science and Technology;journal;15480046, 02726351;0.201;Q3;30;89;128;2656;75;126;0.66;29.84;United Kingdom;Taylor & Francis;1983-ongoing;Chemical Engineering (miscellaneous) (Q3)
427;21100246522;20th AIAA Computational Fluid Dynamics Conference 2011;conference and proceedings;00002011;0.2;-;14;0;208;0;150;207;0.72;0;United States;;2011;"Aerospace Engineering; Energy Engineering and Power Technology; Fluid Flow and Transfer Processes; Mechanical Engineering"
428;93856;AIChE Ethylene Producers Conference Proceedings;conference and proceedings;00001999;0.2;-;7;77;169;287;14;169;0.09;3.73;United States;;1999-ongoing;"Chemical Engineering (miscellaneous); Chemistry (miscellaneous)"
429;21100248858;ASME 2011 Dynamic Systems and Control Conference and Bath/ASME Symposium on Fluid Power and Motion Control, DSCC 2011;conference and proceedings;00002011;0.2;-;11;0;247;0;127;245;0.52;0;United States;;2011;"Control and Systems Engineering; Fluid Flow and Transfer Processes"
430;21100198717;Open Catalysis Journal;journal;1876214X;0.2;Q4;10;5;38;196;35;38;0.86;39.2;United Arab Emirates;Bentham Science Publishers;2009-2014;"Chemistry (miscellaneous) (Q3); Catalysis (Q4)"
431;15600154713;Polymer Science - Series D;journal;19954212, 19954220;0.198;Q3;11;64;192;613;25;192;0.14;9.58;Germany;Maik Nauka Publishing / Springer SBM;2009-ongoing;"Chemical Engineering (miscellaneous) (Q3); Chemistry (miscellaneous) (Q3); Polymers and Plastics (Q3)"
432;21100201052;Chemical Engineering Research Bulletin;journal;03797678, 20729510;0.197;Q3;5;6;9;154;12;9;1.33;25.67;Bangladesh;Chemical Engineering Department, Bangladesh University of Engineering and Technology;2011, 2013, 2015;Chemical Engineering (miscellaneous) (Q3)
433;12894;Chinese Journal of Chromatography;journal;10008713;0.194;Q3;18;201;675;3802;329;672;0.59;18.92;China;Zhongguo Kexueyan Ganguang Huaxue Yanjiusuo;1997-ongoing;"Chemical Engineering (miscellaneous) (Q3); Analytical Chemistry (Q4); Biochemistry (Q4); Electrochemistry (Q4); Organic Chemistry (Q4)"
434;21100455458;Computational Methods in Applied Sciences;book series;18713033;0.194;Q3;17;106;140;2499;67;111;0.59;23.58;Netherlands;Springer Netherlands;2005, 2007-2011, 2013-ongoing;"Electrical and Electronic Engineering (Q3); Fluid Flow and Transfer Processes (Q3); Biomedical Engineering (Q4); Civil and Structural Engineering (Q4); Computational Mathematics (Q4); Computer Science Applications (Q4); Modeling and Simulation (Q4)"
435;19463;Shiyou Xuebao, Shiyou Jiagong/Acta Petrolei Sinica (Petroleum Processing Section);journal;10018719;0.193;Q3;13;139;607;2561;167;607;0.27;18.42;China;Shiyou Xuebao;1996-2014;"Chemical Engineering (miscellaneous) (Q3); Energy Engineering and Power Technology (Q3); Fuel Technology (Q3)"
436;21100819607;Egyptian Journal of Petroleum;journal;11100621, 20902468;0.192;Q3;19;52;29;1586;13;29;0.45;30.5;Egypt;Egyptian Petroleum Research Institute;2011-ongoing;"Fuel Technology (Q3); Process Chemistry and Technology (Q3); Catalysis (Q4); Geochemistry and Petrology (Q4); Organic Chemistry (Q4); Renewable Energy, Sustainability and the Environment (Q4)"
437;15489;International Journal of Nanoscience;journal;0219581X;0.191;Q4;22;47;390;1245;167;381;0.47;26.49;Singapore;World Scientific Publishing Co;2004-ongoing;"Electrical and Electronic Engineering (Q3); Materials Science (miscellaneous) (Q3); Bioengineering (Q4); Biotechnology (Q4); Computer Science Applications (Q4); Condensed Matter Physics (Q4); Nanoscience and Nanotechnology (Q4)"
438;13571;Journal of Polymer Engineering;journal;21910340, 03346447;0.191;Q3;22;90;181;2977;79;179;0.49;33.08;Germany;Walter de Gruyter GmbH;1983-1988, 1990-1991, 1994-ongoing;"Chemical Engineering (miscellaneous) (Q3); Polymers and Plastics (Q3); Materials Chemistry (Q4)"
439;19700181109;PCIC Europe 2010 Conference Record, PCIC EUROPE 2010;conference and proceedings;00002010;0.19;-;4;0;29;0;9;28;0;0;United States;;2010;"Chemical Engineering (miscellaneous); Energy Engineering and Power Technology; Geochemistry and Petrology"
440;13696;Polymer Korea;journal;0379153X;0.19;Q3;17;112;321;3014;139;321;0.43;26.91;South Korea;Polymer Society of Korea;1996-ongoing;"Chemical Engineering (miscellaneous) (Q3); Polymers and Plastics (Q3); Materials Chemistry (Q4)"
441;5300152224;Research Journal of Chemistry and Environment;journal;09720626;0.19;Q3;14;185;402;4556;190;392;0.47;24.63;India;International Congress of Chemistry and Environment;2007-ongoing;"Agricultural and Biological Sciences (miscellaneous) (Q3); Chemical Engineering (miscellaneous) (Q3); Chemistry (miscellaneous) (Q3); Earth and Planetary Sciences (miscellaneous) (Q3); Environmental Science (miscellaneous) (Q3); Biochemistry (Q4); Renewable Energy, Sustainability and the Environment (Q4)"
442;19900193838;Leather and Footwear Journal;journal;15834433;0.189;Q3;6;22;69;303;16;69;0.24;13.77;Romania;Institutional National de Cercetare-Dezvoltare Pentru Texttile Pielarie;2010-ongoing;"Chemical Engineering (miscellaneous) (Q3); Chemistry (miscellaneous) (Q3); Industrial and Manufacturing Engineering (Q3)"
443;14228;Progress in Rubber Plastics Recycling Technology;journal;14777606;0.189;Q3;11;17;41;457;19;41;0.43;26.88;United Kingdom;RAPRA Technology Ltd.;1997-1998, 2002-ongoing;"Chemical Engineering (miscellaneous) (Q3); Polymers and Plastics (Q3); Materials Chemistry (Q4); Organic Chemistry (Q4)"
444;19700186904;Recent Patents on Chemical Engineering;journal;18744788;0.189;Q3;12;20;60;1143;35;58;0.63;57.15;United Arab Emirates;Bentham Science Publishers;2009-2013;Chemical Engineering (miscellaneous) (Q3)
445;145261;Shiyou Huagong Shebei/ Petro-Chemical Equipment;journal;10007466;0.189;Q3;6;170;390;1964;54;390;0.13;11.55;China;China Petroleum & Petro-Chemical Equipment Industry Association;1998, 2001-2004, 2006-ongoing;"Chemical Engineering (miscellaneous) (Q3); Energy Engineering and Power Technology (Q3); Fuel Technology (Q3)"
446;15252;Przeglad Papierniczy;trade journal;00332291;0.188;Q3;6;102;315;677;40;315;0.16;6.64;Poland;Wydawnictwo SIGMA;1978, 1980, 1999-2017 (cancelled);"Media Technology (Q2); Chemical Engineering (miscellaneous) (Q3); Materials Science (miscellaneous) (Q3)"
447;18082;GAK Gummi Fasern Kunststoffe;trade journal;01761625;0.186;Q3;8;60;179;763;13;179;0.1;12.72;Germany;Dr. Gupta Verlag;1984-2017 (cancelled);"Chemical Engineering (miscellaneous) (Q3); Chemistry (miscellaneous) (Q3); Polymers and Plastics (Q3); Materials Chemistry (Q4)"
448;110018;Hydrocarbon Processing;trade journal;08870284;0.185;Q3;26;284;1505;302;65;615;0.11;1.06;United States;Gulf Publishing Co.;1970-1994, 1996-ongoing;"Energy Engineering and Power Technology (Q3); Fuel Technology (Q3); Process Chemistry and Technology (Q3)"
449;19900192571;2011 European Conference on Electrical and Instrumentation Applications in the Petroleum and Chemical Industry, PCIC EUROPE;conference and proceedings;00002011;0.184;-;4;0;29;0;6;28;0.21;0;United States;;2011;"Chemical Engineering (miscellaneous); Energy Engineering and Power Technology; Geochemistry and Petrology"
450;24128;Iranian Journal of Chemistry and Chemical Engineering;journal;10219986;0.184;Q3;19;54;189;1327;80;186;0.27;24.57;Iran;Iranian Research Center of Chemical Industries;1996-2013, 2015-ongoing;"Chemical Engineering (miscellaneous) (Q3); Chemistry (miscellaneous) (Q4)"
451;25880;Techniques - Sciences - Methodes;journal;02997258;0.184;Q3;8;97;274;460;21;235;0.1;4.74;France;Association generale des hygienistes et techniciens municipaux;1987-1989, 1991-ongoing;"Agricultural and Biological Sciences (miscellaneous) (Q3); Fluid Flow and Transfer Processes (Q3); Ocean Engineering (Q3); Water Science and Technology (Q3)"
452;22180;ACS Symposium Series;book series;00976156;0.182;Q3;59;577;1608;22683;643;1438;0.42;39.31;United States;American Chemical Society;1904, 1974-1989, 1996-ongoing;"Chemical Engineering (miscellaneous) (Q3); Chemistry (miscellaneous) (Q4)"
453;21100829268;Applied Sciences (Switzerland);journal;20763417;0.182;Q3;23;0;2;0;2;2;1;0;Switzerland;Multidisciplinary Digital Publishing Institute (MDPI);2011, 2015-ongoing;"Engineering (miscellaneous) (Q3); Fluid Flow and Transfer Processes (Q3); Materials Science (miscellaneous) (Q3); Process Chemistry and Technology (Q3); Computer Science Applications (Q4); Instrumentation (Q4)"
454;19700170837;Vitae;journal;01214004;0.182;Q4;11;73;88;814;38;79;0.43;11.15;Colombia;Universidad de Antioquia;2009-ongoing;"Pharmacology, Toxicology and Pharmaceutics (miscellaneous) (Q3); Applied Microbiology and Biotechnology (Q4); Bioengineering (Q4); Biotechnology (Q4); Food Science (Q4)"
455;21100247008;6th AIAA Flow Control Conference 2012;conference and proceedings;00002012;0.181;-;11;0;76;0;61;75;0.81;0;United States;;2012;"Aerospace Engineering; Control and Systems Engineering; Fluid Flow and Transfer Processes"
