Rank;Sourceid;Title;Type;Issn;SJR;SJR Best Quartile;H index;Total Docs. (2016);Total Docs. (3years);Total Refs.;Total Cites (3years);Citable Docs. (3years);Cites / Doc. (2years);Ref. / Doc.;Country;Publisher;Coverage;Categories
1224;21100329542;Vide. Tehnologija. Resursi - Environment, Technology, Resources;conference and proceedings;00002011, 00002009, 00002013, 00002005;0.126;-;7;0;213;0;24;208;0.12;0,00;Latvia;;2005, 2009, 2011, 2013;Environmental Science (miscellaneous)
1225;22766;Asia Pacific Journal of Environmental Law;journal;13852140;0.125;Q4;5;7;36;200;8;33;0.38;28,57;Australia;University of Sydney;1996-2002, 2004-ongoing;Management, Monitoring, Policy and Law (Q4)
1226;21100416079;Handbook of Environmental Chemistry;book series;1867979X;0.125;Q4;19;185;188;11039;102;50;1.52;59,67;United States;Springer Science + Business Media;1980, 1982, 1984-1986, 1988-1992, 1995, 1998, 2003-2004, 2013, 2015-ongoing;"Environmental Chemistry (Q4); Global and Planetary Change (Q4); Pollution (Q4); Waste Management and Disposal (Q4); Water Science and Technology (Q4)"
1227;21100379915;Hydrology and Water Resources Symposium 2014, HWRS 2014 - Conference Proceedings;conference and proceedings;00002014;0.125;-;4;0;135;0;16;133;0.12;0,00;Australia;;2014;"Ocean Engineering; Oceanography; Water Science and Technology"
1228;21100255516;International Journal of Interdisciplinary Environmental Studies;journal;23291621, 23291559;0.125;Q4;2;10;32;342;4;32;0.17;34,20;United States;Interdisciplinary Social Sciences;2013-ongoing;"Environmental Science (miscellaneous) (Q4); Sociology and Political Science (Q4)"
1229;29624;Revue Des Sciences De L'Eau;journal;09927158;0.125;Q4;22;19;57;1155;7;57;0.03;60,79;France;Institut National de la Research Scientifique;1988-ongoing;Water Science and Technology (Q4)
1230;21100356779;2014 2nd International Conference on Green Energy and Technology, ICGET 2014;conference and proceedings;00002014;0.124;-;3;0;29;0;9;28;0.32;0,00;United States;;2014;"Environmental Chemistry; Environmental Engineering; Management, Monitoring, Policy and Law; Renewable Energy, Sustainability and the Environment"
1231;21100775409;2014 DGON Inertial Sensors and Systems, ISS 2014 - Proceedings;conference and proceedings;00002014;0.124;-;2;0;7;0;5;7;0.71;0,00;United States;;2014;"Atmospheric Science; Modeling and Simulation; Pollution"
1232;21100256913;43rd International Conference on Environmental Systems;conference and proceedings;00002013;0.124;-;6;0;210;0;39;209;0.00;0,00;United States;;2013;Environmental Engineering
1233;17895;Ecos - A Review of Conservation;journal;01439073;0.124;Q4;8;33;80;229;4;68;0.11;6,94;United Kingdom;British Association of Nature Conservationists;1980-ongoing;"Environmental Science (miscellaneous) (Q4); Geography, Planning and Development (Q4)"
1234;21100274226;Global View of Engineering Geology and the Environment - Proceedings of the International Symposium and 9th Asian Regional Conference of IAEG;conference and proceedings;00002013;0.124;-;4;0;137;0;14;135;0.00;0,00;Netherlands;;2013;"Environmental Engineering; Geology"
1235;19700186863;Nature Environment and Pollution Technology;journal;09726268;0.124;Q4;8;219;437;4920;101;437;0.24;22,47;India;Technoscience Publications;2009-ongoing;"Environmental Science (miscellaneous) (Q4); Renewable Energy, Sustainability and the Environment (Q4)"
1236;21100780370;2014 11th International Computer Conference on Wavelet Active Media Technology and Information Processing, ICCWAMTIP 2014;conference and proceedings;00002014;0.12300000000000001;-;1;0;1;0;0;1;0.00;0,00;United States;;2014;"Building and Construction; Computer Science Applications; Health, Toxicology and Mutagenesis; Pollution"
1237;21100853547;Ecologia Balkanica;journal;13140213, 13139940;0.12300000000000001;Q4;0;0;1;0;0;1;0.00;0,00;Bulgaria;Union of Scientists in Bulgaria - Plovdiv;2015, 2017-ongoing;"Ecology (Q4); Ecology, Evolution, Behavior and Systematics (Q4); Nature and Landscape Conservation (Q4)"
1238;22606;Excellence in Ecology;journal;09322205;0.12300000000000001;Q4;9;0;1;0;1;1;0.00;0,00;Germany;Ecology Institute;1997-1998, 2000, 2003-2005, 2010-2013, 2017-ongoing;"Ecology (Q4); Ecology, Evolution, Behavior and Systematics (Q4)"
1239;15309;Imago Mundi;journal;03085694;0.12300000000000001;Q4;13;17;63;857;19;56;0.17;50,41;United Kingdom;Routledge;1935, 1937, 1939, 1947-1956, 1959-1960, 1962-1972, 1975-1997, 2001, 2005-ongoing;"Earth and Planetary Sciences (miscellaneous) (Q4); Environmental Science (miscellaneous) (Q4)"
1240;75950;International Journal of Agricultural Resources, Governance and Ecology;journal;14624605;0.12300000000000001;Q4;21;23;53;919;18;52;0.35;39,96;United Kingdom;Inderscience Enterprises;2000-ongoing;"Agronomy and Crop Science (Q4); Ecology (Q4); Management, Monitoring, Policy and Law (Q4)"
1241;8000153105;International Journal of Environment and Health;journal;17434963, 17434955;0.12300000000000001;Q4;13;6;38;323;10;36;0.38;53,83;United Kingdom;Inderscience Enterprises;2007-ongoing;"Environmental Science (miscellaneous) (Q4); Public Health, Environmental and Occupational Health (Q4)"
1242;17500155122;International Journal of Integrative Biology;journal;09738363, 09742816;0.12300000000000001;Q4;19;3;26;159;10;22;0.10;53,00;United States;Mary Ann Liebert Inc.;2008-2016 (cancelled);"Agricultural and Biological Sciences (miscellaneous) (Q4); Biochemistry, Genetics and Molecular Biology (miscellaneous) (Q4); Earth and Planetary Sciences (miscellaneous) (Q4); Environmental Science (miscellaneous) (Q4); Neuroscience (miscellaneous) (Q4)"
1243;21100777397;International Workshop on Integrated Nonlinear Microwave and Millimetre-Wave Circuits, INMMiC 2014;conference and proceedings;00002014;0.12300000000000001;-;0;0;1;0;0;1;0.00;0,00;United States;;2014;Ecological Modeling
1244;21100435520;Legal Studies on Access and Benefit-sharing;book series;2213493X;0.12300000000000001;Q4;4;0;18;0;7;1;0.00;0,00;Netherlands;Brill;2013;"Law (Q4); Management, Monitoring, Policy and Law (Q4)"
1245;21100812600;Proceedings - 12th IEEE International Conference on E-Business Engineering, ICEBE 2015;conference and proceedings;00002015;0.12300000000000001;-;1;0;1;0;0;1;0.00;0,00;United States;;2015;"Energy (miscellaneous); Engineering (miscellaneous); Environmental Science (miscellaneous)"
1246;21100780337;Proceedings of the 16th Electronics Packaging Technology Conference, EPTC 2014;conference and proceedings;00002014;0.12300000000000001;-;1;0;1;0;0;1;0.00;0,00;United States;;2014;"Environmental Engineering; Geography, Planning and Development; Nature and Landscape Conservation"
1247;21100795203;Proceedings of the 2015 18th AISEM Annual Conference, AISEM 2015;conference and proceedings;00002015;0.12300000000000001;-;1;0;1;0;1;1;1.00;0,00;United States;;2015;"Artificial Intelligence; Civil and Structural Engineering; Computer Science Applications; Environmental Engineering"
1248;21100777247;Structural Health Monitoring 2015: System Reliability for Verification and Implementation - Proceedings of the 10th International Workshop on Structural Health Monitoring, IWSHM 2015;conference and proceedings;00002015;0.12300000000000001;-;1;0;1;0;1;1;1.00;0,00;United States;;2015;"Electrical and Electronic Engineering; Environmental Engineering; Soil Science; Water Science and Technology"
1249;27465;Annales - Universitatis Mariae Curie-Sklodowska, Sectio B;journal;01371983;0.122;Q4;7;25;51;692;14;51;0.26;27,68;Poland;De Gruyter Open Ltd.;1975, 1977, 1979-1980, 1982, 1986, 1991, 1994-2000, 2002-ongoing;"Earth and Planetary Sciences (miscellaneous) (Q4); Water Science and Technology (Q4)"
1250;21100432349;Change Over Time;journal;2153053X, 21530548;0.122;Q4;5;15;57;569;14;53;0.32;37,93;United States;University of Pennsylvania Press;2011-ongoing;"Conservation (Q3); History (Q3); Urban Studies (Q3); Nature and Landscape Conservation (Q4)"
1251;23267;International Journal of Environmental Technology and Management;journal;1741511X, 14662132;0.122;Q4;19;22;105;1132;30;102;0.32;51,45;United Kingdom;Inderscience Publishers;2002-ongoing;"Environmental Engineering (Q4); Management, Monitoring, Policy and Law (Q4)"
1252;21100775037;Proceedings of ISAV 2015: 1st International Workshop on In Situ Infrastructures for Enabling Extreme-Scale Analysis and Visualization, Held in conjunction with SC 2015: The International Conference for High Performance Computing, Networking, Storage and Analysis;conference and proceedings;00002015;0.122;-;5;0;8;0;9;8;1.13;0,00;United States;;2015;Environmental Science (miscellaneous)
1253;21100229199;Transboundary Water Management in a Changing Climate - Proceedings of the AMICE Final Conference;conference and proceedings;00002013;0.122;-;2;0;24;0;3;22;0.00;0,00;Netherlands;;2013;Water Science and Technology
1254;12000154521;Developments in Earth Surface Processes;book series;09282025;0.121;Q4;21;35;86;2302;16;4;3.33;65,77;Netherlands;Elsevier BV;1996-1998, 2005-ongoing, 2011-ongoing;"Atmospheric Science (Q4); Earth-Surface Processes (Q4); Geology (Q4); Global and Planetary Change (Q4)"
1255;21100448511;Proceedings of NDM 2015: 5th International Workshop on Network-Aware Data Management - Held in conjunction with SC 2015: The International Conference for High Performance Computing, Networking, Storage and Analysis;conference and proceedings;00002015;0.121;-;3;0;7;0;5;5;1.00;0,00;United States;;2015;"Computer Science Applications; Ocean Engineering; Water Science and Technology"
1256;19400157034;West African Journal of Applied Ecology;journal;08554307;0.121;Q4;9;11;35;335;15;35;0.45;30,45;Ghana;University of Ghana;2009-ongoing;"Ecology (Q4); Ecology, Evolution, Behavior and Systematics (Q4)"
1257;21100420307;2015 IEEE 35th International Conference on Electronics and Nanotechnology, ELNANO 2015 - Conference Proceedings;conference and proceedings;00002015;0.12;-;5;0;123;0;45;122;0.37;0,00;United States;;2015;"Nuclear Energy and Engineering; Radiation; Waste Management and Disposal"
1258;21100463822;23rd Italian Symposium on Advanced Database Systems, SEBD 2015;conference and proceedings;00002015;0.12;-;2;0;45;0;8;43;0.19;0,00;Italy;;2015;"Environmental Engineering; Geochemistry and Petrology; Geotechnical Engineering and Engineering Geology; Mechanical Engineering"
1259;21100258751;International Journal of Social Sustainability in Economic, Social and Cultural Context;journal;23251115;0.12;Q4;3;20;92;838;13;92;0.11;41,90;United States;Common Ground Research Networks;2013-ongoing;"Environmental Science (miscellaneous) (Q4); Geography, Planning and Development (Q4); Sociology and Political Science (Q4)"
1260;21100398405;Proceedings of the 15th International Conference of the European Society for Precision Engineering and Nanotechnology, EUSPEN 2015;conference and proceedings;00002015;0.12;-;4;0;191;0;46;189;0.24;0,00;Germany;;2015;"Environmental Engineering; Industrial and Manufacturing Engineering; Instrumentation; Materials Science (miscellaneous); Mechanical Engineering"
1261;23033;Proceedings of the Royal Society of Victoria;journal;00359211;0.12;Q4;18;11;39;665;4;34;0.12;60,45;Australia;Royal Society of Victoria;1980-2011, 2015-ongoing;"Ecology (Q4); Geology (Q4)"
1262;21100355989;International Conference on Marine and Freshwater Environments, iMFE 2014;conference and proceedings;00002014;0.11900000000000001;-;2;0;48;0;9;47;0.19;0,00;Canada;;2014;"Ocean Engineering; Pollution; Water Science and Technology"
1263;21100207622;International Journal of Social Ecology and Sustainable Development;journal;19478410, 19478402;0.11900000000000001;Q4;7;15;75;854;15;75;0.20;56,93;United States;IGI Global Publishing;2010-ongoing;"Development (Q4); Ecology (Q4); Environmental Engineering (Q4); Management, Monitoring, Policy and Law (Q4)"
1264;21100246540;International Journal of Technology Management and Sustainable Development;journal;14742748;0.11900000000000001;Q4;4;16;46;597;11;44;0.31;37,31;United Kingdom;Intellect Publishers;2013-ongoing;"Geography, Planning and Development (Q4); Management, Monitoring, Policy and Law (Q4); Management of Technology and Innovation (Q4)"
1265;21100358101;2014 International Conference on Lightning Protection, ICLP 2014;conference and proceedings;00002014;0.11800000000000001;-;7;0;382;0;156;379;0.41;0,00;United States;;2014;Environmental Engineering
1266;21100199515;Biopesticides International;journal;0973483X;0.11800000000000001;Q4;4;21;51;678;8;51;0.17;32,29;India;Koul Research Foundation;2011-ongoing;"Agronomy and Crop Science (Q4); Management, Monitoring, Policy and Law (Q4); Plant Science (Q4)"
1267;24706;Park Science;journal;10909966, 07359462;0.11800000000000001;Q4;10;0;76;0;11;68;0.08;0,00;United States;US Department of the Interior;1996-2006, 2008-2015;"Management, Monitoring, Policy and Law (Q4); Nature and Landscape Conservation (Q4)"
1268;93698;Proceedings of the International Conference on Radioactive Waste Management and Environmental Remediation, ICEM;conference and proceedings;00001995, 00002009, 00002001, 00002011, 00002013, 00002003;0.11800000000000001;-;7;0;193;0;17;191;0.00;0,00;United States;;1995, 2001-2003, 2009-2011, 2013;"Energy Engineering and Power Technology; Safety, Risk, Reliability and Quality; Waste Management and Disposal"
1269;4700153106;Field Mycology;journal;14681641;0.11699999999999999;Q4;5;38;112;215;7;98;0.06;5,66;Netherlands;Elsevier BV;2006-ongoing;"Ecology (Q4); Plant Science (Q4)"
1270;21100378863;Indoor Air 2014 - 13th International Conference on Indoor Air Quality and Climate;conference and proceedings;00002014;0.11699999999999999;-;5;0;968;0;45;966;0.05;0,00;United States;;2014;"Building and Construction; Computer Science Applications; Health, Toxicology and Mutagenesis; Pollution"
1271;21100372696;International Low Impact Development Conference 2015 - LID: It Works in All Climates and Soils - Proceedings of the 2015 International Low Impact Development Conference;conference and proceedings;00002015;0.11699999999999999;-;3;0;46;0;5;44;0.11;0,00;United States;;2015;"Civil and Structural Engineering; Water Science and Technology"
1272;145497;Journal of Environmental Science and Engineering;journal;0367827X;0.11699999999999999;Q4;23;20;157;544;15;155;0.10;27,20;India;National Environmental Engineering Research Institute;2004-ongoing;"Environmental Science (miscellaneous) (Q4); Medicine (miscellaneous) (Q4)"
1273;21100384024;Proceedings of 2015 12th International Bhurban Conference on Applied Sciences and Technology, IBCAST 2015;conference and proceedings;00002015;0.11699999999999999;-;6;0;114;0;54;112;0.48;0,00;United States;;2015;"Computer Science (miscellaneous); Fluid Flow and Transfer Processes; Materials Science (miscellaneous); Water Science and Technology"
1274;21100406320;Proceedings of the 2014 ACM Southeast Regional Conference, ACM SE 2014;conference and proceedings;00002014;0.11699999999999999;-;4;0;66;0;15;65;0.23;0,00;United States;;2014;"Environmental Engineering; Industrial and Manufacturing Engineering; Instrumentation; Materials Science (miscellaneous); Mechanical Engineering"
1275;21100291830;Selenium in the Environment and Human Health - Proceedings of the 3rd International Conference on Selenium in the Environment and Human Health;conference and proceedings;00002014;0.11699999999999999;-;4;0;92;0;12;90;0.13;0,00;Netherlands;;2014;"Health, Toxicology and Mutagenesis; Toxicology"
1276;21100345809;2014 The 3rd International Conference on Agro-Geoinformatics, Agro-Geoinformatics 2014;conference and proceedings;00002014;0.11599999999999999;-;4;0;115;0;25;114;0.22;0,00;United States;;2014;"Agronomy and Crop Science; Civil and Structural Engineering; Geography, Planning and Development; Information Systems; Pollution"
1277;21100268070;Air and Waste Management Association - Guideline on Air Quality Models 2013: The Path Forward;conference and proceedings;00002013;0.11599999999999999;-;3;0;63;0;12;61;0.00;0,00;United States;;2013;Pollution
1278;25709;BioCycle;trade journal;02765055;0.11599999999999999;Q4;18;99;303;79;14;303;0.06;0,80;United States;J G Press, Inc.;1981-ongoing;"Soil Science (Q4); Waste Management and Disposal (Q4)"
1279;24816;Bolleti de la Societat d'Historia Natural de les Balears;journal;0212260X;0.11599999999999999;Q4;9;0;24;0;3;24;0.13;0,00;Spain;Societat d'Historia Natural de les Balears;1992-1996, 2000-2012, 2014-2015;"Ecology (Q4); Geology (Q4)"
1280;14598;Ecology, Environment and Conservation;journal;0971765X;0.11599999999999999;Q4;11;468;824;7736;58;824;0.07;16,53;India;EM International;1997-ongoing;"Ecology (Q4); Ecology, Evolution, Behavior and Systematics (Q4); Nature and Landscape Conservation (Q4)"
1281;28195;GIM International;trade journal;15669076;0.11599999999999999;Q4;10;79;164;46;14;164;0.06;0,58;Netherlands;Geomatics Information & Trading Centre BV;2001-ongoing;"Earth and Planetary Sciences (miscellaneous) (Q4); Engineering (miscellaneous) (Q4); Environmental Science (miscellaneous) (Q4)"
1282;22688;Indian Journal of Environmental Protection;journal;02537141;0.11599999999999999;Q4;17;115;253;2259;7;241;0.02;19,64;India;Scientific Publishers;1981-1990, 2000-ongoing;Environmental Science (miscellaneous) (Q4)
1283;19700188314;Pertanika Journal of Science and Technology;journal;01287680;0.11599999999999999;Q4;10;38;132;1029;31;129;0.14;27,08;Malaysia;Universiti Putra Malaysia;2010-ongoing;"Agricultural and Biological Sciences (miscellaneous) (Q4); Chemical Engineering (miscellaneous) (Q4); Computer Science (miscellaneous) (Q4); Environmental Science (miscellaneous) (Q4)"
1284;21100448230;Regions and Cohesion;journal;2152906X, 21529078;0.11599999999999999;Q4;2;18;36;627;6;32;0.19;34,83;United States;Berghahn Journals;2014-ongoing;"Geography, Planning and Development (Q4); Global and Planetary Change (Q4); Political Science and International Relations (Q4)"
1285;6500153138;Studies in the History of Gardens and Designed Landscapes;journal;14601176;0.11599999999999999;Q4;7;25;72;1002;17;72;0.29;40,08;United Kingdom;Taylor & Francis;1996-ongoing;"Visual Arts and Performing Arts (Q2); Nature and Landscape Conservation (Q4)"
1286;18216;Ultrapure Water;trade journal;07478291;0.11599999999999999;Q4;10;0;52;0;7;52;0.15;0,00;United States;Tall Oaks Publishing Inc.;1989-2015;"Fluid Flow and Transfer Processes (Q4); Water Science and Technology (Q4)"
1287;18755;Water and Energy International;journal;0972057X;0.11599999999999999;Q4;6;109;351;686;6;168;0.04;6,29;India;Scientific Publishers;1995-ongoing;"Renewable Energy, Sustainability and the Environment (Q4); Water Science and Technology (Q4)"
1288;21100450031;2015 IEEE 21st International Symposium for Design and Technology in Electronic Packaging, SIITME 2015;conference and proceedings;00002015;0.115;-;4;0;78;0;25;75;0.33;0,00;United States;;2015;"Energy Engineering and Power Technology; Environmental Engineering; Renewable Energy, Sustainability and the Environment"
1289;18418;Archives of Hydroengineering and Environmental Mechanics;journal;12313726;0.115;Q4;10;17;28;305;5;27;0.14;17,94;Poland;De Gruyter Open Ltd.;1994-2010, 2012-ongoing;"Civil and Structural Engineering (Q4); Water Science and Technology (Q4)"
1290;20000195021;Ecology and Civil Engineering;journal;18825974, 13443755;0.115;Q4;8;23;40;379;7;37;0.16;16,48;Japan;Ecology and Civil Engineering Society;2011-ongoing;"Civil and Structural Engineering (Q4); Ecology (Q4)"
1291;21100349552;Proceedings of the 37th AMOP Technical Seminar on Environmental Contamination and Response;conference and proceedings;00002014;0.115;-;4;0;66;0;22;62;0.35;0,00;Canada;;2014;"Environmental Engineering; Pollution; Waste Management and Disposal"
1292;21100421981;2015 4th IEEE International Conference on Advanced Logistics and Transport, IEEE ICALT 2015;conference and proceedings;00002015;0.114;-;5;0;60;0;17;58;0.29;0,00;United States;;2015;"Business and International Management; Management, Monitoring, Policy and Law; Management of Technology and Innovation"
1293;28756;Geographische Randschau;journal;00167460;0.114;Q4;12;0;101;0;10;101;0.00;0,00;Germany;Westermann Schulbuchverlag GmbH;1975, 1977-2014, 2018-ongoing;"Atmospheric Science (Q4); Energy (miscellaneous) (Q4); Geography, Planning and Development (Q4); Water Science and Technology (Q4)"
1294;18700156711;International Journal of Energy, Environment and Economics;journal;1054853X;0.114;Q4;5;25;77;563;4;76;0.04;22,52;United States;Nova Science Publishers Inc.;2007, 2009-ongoing;"Economics, Econometrics and Finance (miscellaneous) (Q4); Energy (miscellaneous) (Q4); Environmental Science (miscellaneous) (Q4)"
1295;21100344980;Recent Advances in Environmental Vibration - Proceedings of 6th International Symposium on Environmental Vibration, ISEV 2013;conference and proceedings;00002013;0.114;-;3;0;65;0;6;64;0.00;0,00;China;;2013;"Environmental Engineering; Management, Monitoring, Policy and Law; Mechanics of Materials; Safety, Risk, Reliability and Quality"
1296;16920;Gas Wasserfach Wasser Abwasser;journal;00163651;0.113;Q4;10;189;295;852;7;262;0.02;4,51;Germany;Walter de Gruyter GmbH;1970-ongoing;Water Science and Technology (Q4)
1297;21100332447;Hydroecologie Appliquee;journal;1958556X;0.113;Q4;6;16;8;614;2;8;0.25;38,38;France;EDP Sciences;2014-ongoing;"Aquatic Science (Q4); Ecology (Q4); Ecology, Evolution, Behavior and Systematics (Q4); Water Science and Technology (Q4)"
1298;21100446005;International Conference on Electrical, Electronics, Signals, Communication and Optimization, EESCO 2015;conference and proceedings;00002015;0.113;-;8;0;446;0;168;444;0.38;0,00;United States;;2015;"Building and Construction; Civil and Structural Engineering; Earth and Planetary Sciences (miscellaneous); Environmental Engineering; Materials Science (miscellaneous); Safety, Risk, Reliability and Quality"
1299;21100237616;Papers on Global Change IGBP;journal;1730802X, 23008121;0.113;Q4;3;15;27;174;4;26;0.14;11,60;Germany;De Gruyter Open;2012-ongoing;"Ecology (Q4); Geology (Q4); Geophysics (Q4); Global and Planetary Change (Q4)"
1300;57806;Socijalna Ekologija;journal;13300113, 18490360;0.113;Q4;7;23;19;992;2;19;0.08;43,13;Croatia;Hrvatsko sociolosko drustvo;1994-ongoing;"Geography, Planning and Development (Q4); Management, Monitoring, Policy and Law (Q4)"
1301;13162;Terra;journal;00403741;0.113;Q4;7;0;54;0;2;34;0.04;0,00;Finland;Geographical Society of Finland;1978-2015, 2017-ongoing;"Agricultural and Biological Sciences (miscellaneous) (Q4); Earth and Planetary Sciences (miscellaneous) (Q4); Geography, Planning and Development (Q4); Water Science and Technology (Q4)"
1302;21100495938;Geotechnical Engineering for Infrastructure and Development - Proceedings of the XVI European Conference on Soil Mechanics and Geotechnical Engineering, ECSMGE 2015;conference and proceedings;00002015;0.11199999999999999;-;4;0;120;0;42;117;0.36;0,00;United Kingdom;;2015;"Earth and Planetary Sciences (miscellaneous); Environmental Science (miscellaneous); Soil Science"
1303;21100346457;IEEE Proceedings of the INternational Conference On Emerging Trends in Science Engineering and Technology: Recent Advancements on Science and Engineering Innovation, INCOSET 2012;conference and proceedings;00002014;0.11199999999999999;-;6;0;94;0;38;92;0.41;0,00;United States;;2014;"Computer Science (miscellaneous); Engineering (miscellaneous); Environmental Engineering; Management of Technology and Innovation"
1304;5100152918;Jeoloji Muhendisligi Dergisi;journal;10169172;0.11199999999999999;Q4;5;12;22;399;3;21;0.00;33,25;Turkey;Jeoloji Mhendisligi;2005-ongoing;"Earth and Planetary Sciences (miscellaneous) (Q4); Environmental Science (miscellaneous) (Q4)"
1305;21100248871;Proceedings of the 36th AMOP Technical Seminar on Environmental Contamination and Response;conference and proceedings;00002013;0.11199999999999999;-;4;0;64;0;16;62;0.00;0,00;Canada;;2013;"Environmental Engineering; Pollution; Waste Management and Disposal"
1306;9500154150;Progress in Agricultural Engineering Sciences;journal;1786335X;0.11199999999999999;Q4;5;5;13;206;2;13;0.10;41,20;Hungary;Akademiai Kiado;2007-ongoing;"Industrial and Manufacturing Engineering (Q3); Environmental Engineering (Q4); Mechanical Engineering (Q4)"
1307;25880;Techniques - Sciences - Methodes;journal;02997258;0.11199999999999999;Q4;8;5;154;100;5;135;0.04;20,00;France;Association generale des hygienistes et techniciens municipaux;1987-1989, 1991-ongoing;"Agricultural and Biological Sciences (miscellaneous) (Q4); Fluid Flow and Transfer Processes (Q4); Ocean Engineering (Q4); Water Science and Technology (Q4)"
1308;21100455673;2015 IEEE 2nd VR International Workshop on Collaborative Virtual Environments, 3DCVE 2015;conference and proceedings;00002015;0.111;-;1;0;4;0;1;2;0.50;0,00;United States;;2015;"Electrical and Electronic Engineering; Environmental Science (miscellaneous); Radiation"
1309;19700177004;Advances in Environmental Biology;journal;19950756, 19981066;0.111;Q4;18;0;1818;0;362;1818;0.23;0,00;Jordan;American-Eurasian Network for Scientific Information Publications(AENSI);2009-2015;"Agricultural and Biological Sciences (miscellaneous) (Q4); Environmental Science (miscellaneous) (Q4)"
1310;19632;Asian Journal of Microbiology, Biotechnology and Environmental Sciences;journal;09723005;0.111;Q4;13;157;377;3781;32;377;0.08;24,08;India;Scientific Publishers;2001-ongoing;"Applied Microbiology and Biotechnology (Q4); Biotechnology (Q4); Environmental Science (miscellaneous) (Q4); Microbiology (Q4)"
1311;21100345620;CAS-CERN Accelerator School: Superconductivity for Accelerators - Proceedings;conference and proceedings;00002014;0.111;-;3;0;25;0;3;23;0.13;0,00;Swaziland;;2014;"Atomic and Molecular Physics, and Optics; Computer Science Applications; Condensed Matter Physics; Environmental Engineering; Fuel Technology; Geotechnical Engineering and Engineering Geology; Instrumentation"
