Rank;Sourceid;Title;Type;Issn;SJR;SJR Best Quartile;H index;Total Docs. (2016);Total Docs. (3years);Total Refs.;Total Cites (3years);Citable Docs. (3years);Cites / Doc. (2years);Ref. / Doc.;Country;Publisher;Coverage;Categories
759;21100385605;Smart and Sustainable Built Environment;journal;20466102, 20466099;0.325;Q3;10;25;49;1157;53;47;0.84;46,28;United Kingdom;Emerald Group Publishing Ltd.;2014-ongoing;"Building and Construction (Q2); Urban Studies (Q2); Civil and Structural Engineering (Q3); Human Factors and Ergonomics (Q3); Management, Monitoring, Policy and Law (Q3); Renewable Energy, Sustainability and the Environment (Q3)"
760;21100205986;International Journal of Global Warming;journal;17582091, 17582083;0.324;Q3;17;56;129;2389;149;127;0.68;42,66;Switzerland;Inderscience Publishers;2011-ongoing;"Atmospheric Science (Q3); Management, Monitoring, Policy and Law (Q3); Global and Planetary Change (Q4)"
761;24563;Water Environment Research;journal;10614303;0.324;Q2;64;173;456;8730;448;447;0.96;50,46;United States;Water Environment Federation;1992-ongoing;"Waste Management and Disposal (Q2); Pollution (Q3); Water Science and Technology (Q3); Ecological Modeling (Q4); Environmental Chemistry (Q4)"
762;21100286802;Jamba: Journal of Disaster Risk Studies;journal;19961421;0.321;Q3;8;19;43;495;27;43;0.47;26,05;South Africa;OpenJournals Publishing AOSIS (Pty) Ltd;2013-ongoing;"Management, Monitoring, Policy and Law (Q3); Safety Research (Q3)"
763;15943;Indian Journal of Fibre and Textile Research;journal;09710426;0.32;Q3;35;66;198;1293;158;198;0.60;19,59;India;Scientific Publishers;1990-ongoing;"Chemical Engineering (miscellaneous) (Q2); Materials Science (miscellaneous) (Q2); Polymers and Plastics (Q2); Environmental Science (miscellaneous) (Q3)"
764;21100220158;Remediation;journal;10515658, 15206831;0.32;Q2;23;42;116;810;76;108;0.78;19,29;United States;John Wiley & Sons Inc.;1990-1995, 2012-ongoing;"Waste Management and Disposal (Q2); Environmental Engineering (Q3); Pollution (Q3)"
765;21100371227;International Journal of Geotechnical Engineering;journal;19386362, 19397879;0.319;Q3;13;57;157;1783;77;153;0.43;31,28;United Kingdom;Maney Publishing;2007-ongoing;"Environmental Engineering (Q3); Geotechnical Engineering and Engineering Geology (Q3); Soil Science (Q3)"
766;30862;Journal of the Torrey Botanical Society;journal;10955674;0.318;Q3;42;37;105;1869;84;103;1.02;50,51;United States;Torrey Botanical Society;1996-ongoing;"Ecology (Q3); Ecology, Evolution, Behavior and Systematics (Q3); Plant Science (Q3)"
767;23489;Chemical Speciation and Bioavailability;journal;09542299;0.316;Q3;25;27;94;1057;119;92;1.48;39,15;United Kingdom;Taylor & Francis;1989-ongoing;"Chemical Health and Safety (Q3); Health, Toxicology and Mutagenesis (Q3); Toxicology (Q4)"
768;21100403434;2014 ASHRAE/IBPSA-USA Building Simulation Conference;conference and proceedings;00002014;0.315;-;6;0;64;0;42;63;0.67;0,00;United States;;2014;"Building and Construction; Civil and Structural Engineering; Energy Engineering and Power Technology; Environmental Engineering; Pollution"
769;17839;Conservation Science Western Australia;journal;14473682, 2206026X;0.315;Q3;18;9;17;2191;11;17;0.38;243,44;Australia;Department of Environment and Conservation;2002, 2004, 2006-ongoing;"Management, Monitoring, Policy and Law (Q3); Nature and Landscape Conservation (Q3)"
770;21100207601;International Journal of Climate Change Strategies and Management;journal;17568692;0.315;Q3;15;41;117;2101;91;117;0.87;51,24;United Kingdom;Emerald Group Publishing Ltd.;2011-ongoing;"Development (Q2); Geography, Planning and Development (Q3); Management, Monitoring, Policy and Law (Q3); Global and Planetary Change (Q4)"
771;19700175824;International Journal of Ecology;journal;16879708, 16879716;0.314;Q3;17;14;52;641;36;51;0.64;45,79;Egypt;Hindawi Publishing Corporation;2010-ongoing;"Ecology (Q3); Ecology, Evolution, Behavior and Systematics (Q3)"
772;18300156702;Wildlife Biology in Practice;journal;16461509, 16462742;0.314;Q3;8;10;41;410;26;39;0.58;41,00;Portugal;Portuguese Wildlife Society;2009-ongoing;"Agricultural and Biological Sciences (miscellaneous) (Q2); Ecology (Q3)"
773;21100211323;Plant Sociology;journal;22801855;0.312;Q3;23;11;47;824;40;47;0.85;74,91;Italy;Societa Italiana di Scienza della Vegetazione;2012-ongoing;"Forestry (Q2); Ecology (Q3); Ecology, Evolution, Behavior and Systematics (Q3); Plant Science (Q3)"
774;4900152411;IRRIGA;journal;14137895;0.311;Q3;13;100;234;2456;93;234;0.33;24,56;Brazil;Universidade Estadual Paulista (UNESP);2006-ongoing;Water Science and Technology (Q3)
775;21100435556;Regional Science Policy and Practice;journal;17577802;0.311;Q3;4;11;12;417;16;12;1.33;37,91;United States;John Wiley and Sons Inc.;2015-ongoing;"Development (Q3); Geography, Planning and Development (Q3); Management, Monitoring, Policy and Law (Q3)"
776;19700200833;Journal of Integrative Environmental Sciences;journal;19438168, 1943815X;0.31;Q3;14;10;57;566;39;55;0.51;56,60;United States;Taylor and Francis Ltd.;2010-ongoing;"Environmental Science (miscellaneous) (Q3); Public Health, Environmental and Occupational Health (Q3); Renewable Energy, Sustainability and the Environment (Q3)"
777;21100434052;Journal of Renewable Materials;journal;21646341, 21646325;0.31;Q3;12;43;88;1542;114;81;1.05;35,86;United States;Scrivener Publishing;2013-ongoing;"Materials Science (miscellaneous) (Q2); Environmental Science (miscellaneous) (Q3)"
778;21100466413;Life Sciences, Society and Policy;journal;21957819;0.309;Q3;10;12;44;527;63;43;1.44;43,92;Switzerland;Springer International Publishing AG;2013-ongoing;"Philosophy (Q2); Biochemistry, Genetics and Molecular Biology (miscellaneous) (Q3); Management, Monitoring, Policy and Law (Q3)"
779;95801;Naturschutz und Landschaftsplanung;journal;09406808;0.309;Q3;12;78;277;948;39;145;0.31;12,15;Germany;Verlag Eugen Ulmer GmbH;1995-ongoing;"Ecology (Q3); Environmental Science (miscellaneous) (Q3)"
780;21100239825;Zoology and Ecology;journal;21658005, 21658013;0.309;Q3;16;41;145;1625;92;144;0.52;39,63;United Kingdom;Taylor and Francis Inc.;2012-ongoing;"Animal Science and Zoology (Q3); Ecology (Q3)"
781;24581;Animal Biodiversity and Conservation;journal;1578665X;0.308;Q3;32;24;67;1159;40;67;0.61;48,29;Spain;Museu de Ciencies Naturals de Barcelona;2001-ongoing;"Animal Science and Zoology (Q3); Nature and Landscape Conservation (Q3)"
782;16777;Capitalism, Nature, Socialism;journal;10455752, 15483290;0.308;Q3;25;34;115;1200;70;101;0.68;35,29;United Kingdom;Taylor & Francis;1988-ongoing;"Political Science and International Relations (Q2); Geography, Planning and Development (Q3); Management, Monitoring, Policy and Law (Q3)"
783;30006;Global Social Policy;journal;14680181;0.306;Q3;31;31;94;976;48;76;0.65;31,48;United States;SAGE Publications;2001-ongoing;"Sociology and Political Science (Q2); Geography, Planning and Development (Q3); Management, Monitoring, Policy and Law (Q3)"
784;21100241739;Geosystem Engineering;journal;21663394, 12269328;0.305;Q3;13;42;110;985;117;109;1.09;23,45;United Kingdom;Taylor and Francis Inc.;1998-ongoing;"Environmental Engineering (Q3); Pollution (Q3); Waste Management and Disposal (Q3)"
785;21100201313;Mathematical and Computational Forestry and Natural-Resource Sciences;journal;19467664;0.305;Q3;11;11;28;197;17;28;0.88;17,91;United States;Contemporary Journal Concept Press;2009-ongoing;"Forestry (Q2); Applied Mathematics (Q3); Computer Science Applications (Q3); Environmental Engineering (Q3)"
786;24130;Natural Resource Modelling;journal;08908575;0.305;Q3;29;26;76;916;53;75;0.51;35,23;United States;Wiley-Blackwell;1990, 1992-1995, 2009-ongoing;"Environmental Science (miscellaneous) (Q3); Modeling and Simulation (Q3)"
787;19900192156;Journal of Hazardous, Toxic, and Radioactive Waste;journal;21535493, 21535515;0.304;Q3;24;48;114;2188;119;105;1.01;45,58;United States;American Society of Civil Engineers;2011-ongoing;"Chemical Engineering (miscellaneous) (Q2); Environmental Engineering (Q3); Geotechnical Engineering and Engineering Geology (Q3); Waste Management and Disposal (Q3); Water Science and Technology (Q3); Environmental Chemistry (Q4)"
788;26673;International Journal of Critical Infrastructures;journal;14753219, 17418038;0.302;Q3;22;16;64;631;64;62;0.71;39,44;United Kingdom;Inderscience Publishers;2004-ongoing;"Energy (miscellaneous) (Q2); Environmental Science (miscellaneous) (Q3); Safety, Risk, Reliability and Quality (Q3)"
789;4700152496;Landscape and Ecological Engineering;journal;18601871, 1860188X;0.301;Q3;22;26;98;1047;71;93;0.93;40,27;Germany;Springer Verlag;2006-ongoing;"Ecology (Q3); Management, Monitoring, Policy and Law (Q3); Nature and Landscape Conservation (Q3)"
790;24493;Western North American Naturalist;journal;15270904;0.301;Q3;30;48;162;2219;96;162;0.40;46,23;United States;Brigham Young University;2000-ongoing;"Ecology (Q3); Ecology, Evolution, Behavior and Systematics (Q3)"
791;12900154716;Informes de la Construccion;journal;00200883, 19883234;0.3;Q3;14;44;235;923;102;220;0.41;20,98;Spain;CSIC Consejo Superior de Investigaciones Cientificas;2008-ongoing;"Architecture (Q1); Building and Construction (Q2); Civil and Structural Engineering (Q3); Environmental Engineering (Q3)"
792;19900191954;Journal of the Indian Ocean Region;journal;1948108X, 19480881;0.299;Q3;8;19;51;518;28;44;0.72;27,26;United States;Taylor and Francis;2010-ongoing;"Management, Monitoring, Policy and Law (Q3); Oceanography (Q3); Water Science and Technology (Q3)"
793;21100232425;Transitional Waters Bulletin;journal;1825229X;0.298;Q3;14;0;31;0;27;29;0.00;0,00;Italy;ESE - Salento University Publishing;2007-2014;"Ecology (Q3); Nature and Landscape Conservation (Q3); Water Science and Technology (Q3)"
794;20926;Environmental Protection Engineering;journal;03248828;0.295;Q3;18;56;163;1200;135;162;0.55;21,43;Poland;Wydawnictwo Politechniki Wroclawskiej;1980-1981, 1983, 1996-ongoing;"Environmental Engineering (Q3); Waste Management and Disposal (Q3)"
795;20000195005;Floresta;journal;19824688, 00153826;0.293;Q3;9;45;201;1160;62;201;0.24;25,78;Brazil;Universidade Federal do Parana;2011-ongoing;"Ecology (Q3); Forestry (Q3); Nature and Landscape Conservation (Q3)"
796;17600155057;Living Reviews in Landscape Research;journal;18637329;0.293;Q3;9;0;4;0;2;4;0.50;0,00;Germany;Leibniz Centre for Agricultural Landscape Research (ZALF);2009-2014;"Ecology (Q3); Geography, Planning and Development (Q3); Management, Monitoring, Policy and Law (Q3); Nature and Landscape Conservation (Q3)"
797;11700154335;Proceedings of Institution of Civil Engineers: Waste and Resource Management;journal;17476526, 17476534;0.293;Q3;13;26;65;575;44;54;0.39;22,12;United Kingdom;ICE Publishing Ltd.;2008-ongoing;"Civil and Structural Engineering (Q3); Waste Management and Disposal (Q3)"
798;25217;Toxicological and Environmental Chemistry;journal;02772248, 10290486;0.293;Q3;33;105;414;3687;422;406;0.92;35,11;United Kingdom;Taylor & Francis;1979-2001, 2003-ongoing;"Health, Toxicology and Mutagenesis (Q3); Pollution (Q3); Environmental Chemistry (Q4)"
799;16730;Aquatic Ecosystem Health and Management;journal;15394077, 14634988;0.292;Q3;37;52;175;1611;110;159;0.81;30,98;United Kingdom;Taylor & Francis;1998-ongoing;"Aquatic Science (Q3); Ecology (Q3); Management, Monitoring, Policy and Law (Q3)"
800;12200154703;Archives of Environmental Protection;journal;03248461;0.292;Q3;16;47;131;1704;112;131;0.76;36,26;Poland;Polish Academy of Sciences;2007-ongoing;Environmental Science (miscellaneous) (Q3)
801;33154;Journal of Architectural and Planning Research;journal;07380895;0.292;Q3;22;20;54;909;23;54;0.34;45,45;United States;Locke Science Publishing Company, Inc.;1984-ongoing;"Architecture (Q1); Urban Studies (Q2); Environmental Science (miscellaneous) (Q3); Geography, Planning and Development (Q3)"
802;21100265048;Contemporary Engineering Sciences;journal;13147641, 13136569;0.29;Q4;11;109;406;1884;188;404;0.49;17,28;Bulgaria;Hikari Ltd.;2013-2016 (cancelled);"Engineering (miscellaneous) (Q2); Social Sciences (miscellaneous) (Q2); Computer Networks and Communications (Q3); Fluid Flow and Transfer Processes (Q3); Materials Science (miscellaneous) (Q3); Health, Toxicology and Mutagenesis (Q4)"
803;19200157041;Journal of Elementology;journal;16442296;0.29;Q3;19;103;227;3315;173;227;0.68;32,18;Poland;Polskie Towarzystwo Magnezologiczne;2008-ongoing;"Ecology (Q3); Pollution (Q3); Health, Toxicology and Mutagenesis (Q4); Inorganic Chemistry (Q4)"
804;21100782799;Climate of the Past Discussions;journal;18149340, 18149359;0.287;Q4;2;0;8;0;7;8;0.88;0,00;Germany;Copernicus GmbH;2014-2015;"Paleontology (Q3); Stratigraphy (Q3); Global and Planetary Change (Q4)"
805;16967;Houille Blanche;journal;00186368;0.287;Q3;14;62;183;881;89;183;0.40;14,21;France;EDP Sciences;1969-ongoing;Water Science and Technology (Q3)
806;25759;Environmental Forensics;journal;15275930, 15275922;0.285;Q3;34;34;101;1245;86;97;0.88;36,62;United Kingdom;Taylor & Francis;2000-ongoing;"Management, Monitoring, Policy and Law (Q3); Waste Management and Disposal (Q3)"
807;21100275968;Journal for European Environmental and Planning Law;journal;18760104, 16137272;0.285;Q3;6;23;52;586;22;50;0.36;25,48;Netherlands;Brill;2013-ongoing;"Law (Q2); Management, Monitoring, Policy and Law (Q3)"
808;13569;Journal of Pesticide Sciences;journal;13490923, 1348589X;0.285;Q4;34;27;105;909;84;96;0.89;33,67;Japan;Pesticide Science Society of Japan/Nippon Noyaku Gakkai;1995-ongoing;"Insect Science (Q3); Health, Toxicology and Mutagenesis (Q4)"
809;21100319031;Green Processing and Synthesis;journal;21919550, 21919542;0.284;Q4;15;68;200;1676;154;175;0.76;24,65;Germany;Walter de Gruyter GmbH;2014-ongoing;"Industrial and Manufacturing Engineering (Q2); Chemical Engineering (miscellaneous) (Q3); Fuel Technology (Q3); Renewable Energy, Sustainability and the Environment (Q3); Environmental Chemistry (Q4); Health, Toxicology and Mutagenesis (Q4)"
810;4400151712;International Journal of Fruit Science;journal;15538362;0.284;Q3;15;56;113;1694;66;110;0.45;30,25;United States;Haworth Press Inc.;2005-ongoing;"Agronomy and Crop Science (Q3); Ecology (Q3); Horticulture (Q3); Plant Science (Q3)"
811;21100327701;International Journal of GEOMATE;journal;21862990, 21862982;0.284;Q3;11;204;171;3150;108;171;0.55;15,44;Japan;GEOMATE International Society;2011-ongoing;"Building and Construction (Q3); Environmental Engineering (Q3); Geotechnical Engineering and Engineering Geology (Q3); Soil Science (Q3)"
812;21100224449;Eco.mont;journal;20731558, 2073106X;0.282;Q3;7;19;60;554;27;53;0.44;29,16;Austria;The Austrian Academy of Sciences Press;2009-ongoing;"Ecology (Q3); Management, Monitoring, Policy and Law (Q3); Nature and Landscape Conservation (Q3)"
813;21100413803;Czech Polar Reports;journal;18050689, 18050697;0.281;Q3;5;21;40;590;29;40;0.73;28,10;Czech Republic;EMUNI Press;2014-ongoing;"Agricultural and Biological Sciences (miscellaneous) (Q3); Earth and Planetary Sciences (miscellaneous) (Q3); Environmental Science (miscellaneous) (Q3)"
814;28154;Fennia;journal;00150010;0.281;Q3;18;12;39;603;34;37;0.96;50,25;Finland;Suomen Metsatieteellinen Seura;1976, 1979-2009, 2011-ongoing;"Ecology (Q3); Forestry (Q3); Geography, Planning and Development (Q3)"
815;24737;Polish Journal of Ecology;journal;24501395, 15052249;0.281;Q3;25;52;135;2517;109;135;0.76;48,40;Poland;Polish Academy of Sciences;1996, 1998-ongoing;"Ecology (Q3); Ecology, Evolution, Behavior and Systematics (Q4)"
816;19900193893;Acta Limnologica Brasiliensia;journal;01026712, 2179975X;0.28;Q3;12;29;129;1307;79;121;0.69;45,07;Brazil;Brazilian Society of Limnology;2011-ongoing;"Aquatic Science (Q3); Ecology (Q3); Water Science and Technology (Q3); Ecology, Evolution, Behavior and Systematics (Q4)"
817;87849;Journal of Environmental Engineering and Landscape Management;journal;16486897;0.28;Q3;23;28;100;1224;84;98;0.83;43,71;Lithuania;Vilnius Gediminas Technical University;2004-ongoing;"Environmental Engineering (Q3); Management, Monitoring, Policy and Law (Q3); Nature and Landscape Conservation (Q3)"
818;21100390177;Regional Studies in Marine Science;journal;23524855;0.27899999999999997;Q3;11;141;43;7945;39;42;0.93;56,35;Netherlands;Elsevier BV;2015-ongoing;"Animal Science and Zoology (Q3); Ecology (Q3); Aquatic Science (Q4); Ecology, Evolution, Behavior and Systematics (Q4)"
819;11400153336;Estonian Journal of Ecology;journal;1736602X;0.278;Q3;12;0;39;0;34;38;0.95;0,00;Estonia;Estonian Academy Publishers;2008-2014;"Ecology (Q3); Ecology, Evolution, Behavior and Systematics (Q4)"
820;16980;Hydrologie und Wasserbewirtschaftung;journal;14391783;0.278;Q3;12;24;88;755;41;83;0.52;31,46;Germany;Bundesanstalt fur Gewaesserkunde;1999-ongoing;Water Science and Technology (Q3)
821;11700154344;Developments in Environmental Science;book series;14748177;0.276;Q3;19;0;54;0;60;0;0.00;0,00;Netherlands;Elsevier BV;2002-2003, 2005, 2007-2013;"Pollution (Q3); Atmospheric Science (Q4); Environmental Chemistry (Q4); Health, Toxicology and Mutagenesis (Q4)"
822;21100852990;Cryosphere Discussions;journal;19940432, 19940440;0.275;Q3;3;2;26;161;15;26;0.58;80,50;Germany;Copernicus GmbH;2014-ongoing;"Earth-Surface Processes (Q3); Water Science and Technology (Q3)"
823;32999;Compost Science and Utilization;journal;1065657X;0.27399999999999997;Q3;46;28;67;1173;58;65;0.96;41,89;United Kingdom;Taylor & Francis;1993-ongoing;"Ecology (Q3); Soil Science (Q3); Waste Management and Disposal (Q3)"
824;5800173388;Plankton and Benthos Research;journal;18808247;0.27399999999999997;Q3;18;27;68;841;41;62;0.55;31,15;Japan;Plankton Society of Japan: Japanese Association of Benthology;2006-ongoing;"Ecology (Q3); Oceanography (Q3); Aquatic Science (Q4); Ecology, Evolution, Behavior and Systematics (Q4)"
825;17700156220;International Journal of Ecology and Development;journal;09729984, 09737308;0.273;Q3;8;36;75;784;64;75;1.10;21,78;India;CESER Publications;2009-2017 (cancelled);"Development (Q3); Ecology (Q3); Ecology, Evolution, Behavior and Systematics (Q4)"
826;23419;Journal of Marine Environmental Engineering;journal;1061026X, 10290427;0.273;Q3;14;0;2;0;2;2;1.00;0,00;United States;Old City Publishing Inc.;1996-2001, 2003-2006, 2008, 2012-ongoing, 2010-ongoing;"Environmental Engineering (Q3); Ocean Engineering (Q3); Pollution (Q3); Waste Management and Disposal (Q3)"
827;19377;Water Science and Technology: Water Supply;book series;16069749;0.273;Q3;34;182;477;4940;362;475;0.69;27,14;United Kingdom;International Water Association Publishing;2001-ongoing;Water Science and Technology (Q3)
828;21100236227;International Journal of Hydrology Science and Technology;journal;20427808, 20427816;0.272;Q3;7;22;68;665;83;68;1.80;30,23;United Kingdom;Inderscience Enterprises Ltd;2011-ongoing;"Earth and Planetary Sciences (miscellaneous) (Q3); Environmental Engineering (Q3); Waste Management and Disposal (Q3); Water Science and Technology (Q3)"
829;17567;Lakes and Reservoirs: Research and Management;journal;14401770, 13205331;0.272;Q3;34;30;87;1262;49;80;0.64;42,07;United Kingdom;Blackwell Publishing Inc.;1995-1996, 1998-ongoing;Water Science and Technology (Q3)
830;18733;ATTI Della Accademia Nazionale Dei Lincei Rendiconti Lincei Scienze Fisiche e Naturali;journal;11206349;0.27;Q3;19;102;259;4487;238;248;0.93;43,99;Italy;Accademia Nazionale dei Lincei;1990-1998, 2000-ongoing;"Agricultural and Biological Sciences (miscellaneous) (Q3); Earth and Planetary Sciences (miscellaneous) (Q3); Environmental Science (miscellaneous) (Q3)"
831;28105;Erdkunde;journal;00140015;0.27;Q3;29;21;61;1470;73;58;0.68;70,00;Germany;Ferd. Dummler;1976, 1978-ongoing;"Earth and Planetary Sciences (miscellaneous) (Q3); Ecology (Q3); Geography, Planning and Development (Q3)"
832;21100220469;Forest Science and Technology;journal;21580715, 21580103;0.27;Q3;9;29;95;880;53;93;0.56;30,34;United Kingdom;Taylor and Francis Inc.;2005-ongoing;"Forestry (Q3); Management, Monitoring, Policy and Law (Q3)"
833;21100317750;Journal of Environmental Management and Tourism;journal;20687729;0.27;Q3;8;73;46;1922;42;46;1.05;26,33;Germany;Walter de Gruyter GmbH;2013-ongoing;"Environmental Science (miscellaneous) (Q3); Neuroscience (miscellaneous) (Q4)"
834;29413;Energy Studies Review;journal;08434379;0.268;Q3;4;4;32;115;8;32;0.22;28,75;Canada;McMaster University, Institute for Energy Studies;1991-1995, 2008, 2010-ongoing;"Economics and Econometrics (Q3); Energy (miscellaneous) (Q3); Environmental Engineering (Q3)"
835;21100223585;Journal of Materials and Environmental Science;journal;20282508;0.268;Q3;29;490;900;15847;883;899;0.87;32,34;Morocco;University of Mohammed Premier Oujda;2010-2017 (cancelled);"Materials Chemistry (Q3); Pollution (Q3); Waste Management and Disposal (Q3); Environmental Chemistry (Q4)"
836;21100267005;Advances in Science and Technology of Water Resources;journal;10067647;0.267;Q3;7;100;354;1902;95;354;0.27;19,02;China;shui li shui dian ke ji jin zhan bian ji bu;2013-ongoing;Water Science and Technology (Q3)
837;17100154711;Journal of Environmental Science and Technology;journal;19947887;0.267;Q3;17;50;75;2122;57;75;0.61;42,44;Pakistan;Asian Network for Scientific Information;2009-ongoing;Environmental Science (miscellaneous) (Q3)
838;20993;Environmental Geosciences;journal;10759565, 15260984;0.266;Q3;28;8;30;347;21;26;0.83;43,38;United States;American Association of Petroleum Geologists;1995, 1998-ongoing;"Earth and Planetary Sciences (miscellaneous) (Q3); Environmental Science (miscellaneous) (Q3)"
839;130176;Environmental Practice;journal;14660466;0.265;Q3;21;42;131;848;51;100;0.37;20,19;United Kingdom;Cambridge University Press;1999-ongoing;"Geography, Planning and Development (Q3); Management, Monitoring, Policy and Law (Q3)"
840;5300152518;Ethnobotany Research and Applications;journal;15473465;0.264;Q3;21;6;96;275;58;95;0.51;45,83;United States;University of Hawaii Press;2007-ongoing;"Nature and Landscape Conservation (Q3); Plant Science (Q3)"
841;5700179464;Ethics and the Environment;journal;15355306, 10856633;0.263;Q3;6;10;33;644;28;33;0.75;64,40;United States;Indiana University Press;2013-ongoing;"Philosophy (Q2); Environmental Science (miscellaneous) (Q3)"
842;26338;Bauphysik;trade journal;14370980, 01715445;0.262;Q3;7;43;167;525;35;150;0.27;12,21;United Kingdom;John Wiley and Sons Ltd;1982, 1984, 1987, 2011-ongoing;"Architecture (Q1); Building and Construction (Q3); Environmental Engineering (Q3)"
843;29360;Energy and Environment;journal;0958305X;0.262;Q3;25;41;188;954;78;175;0.36;23,27;United States;SAGE Publications Inc.;1981, 1995-ongoing;"Energy Engineering and Power Technology (Q3); Energy (miscellaneous) (Q3); Environmental Engineering (Q3); Renewable Energy, Sustainability and the Environment (Q3)"
844;20053;International Journal of Public Sector Management;journal;09513558;0.262;Q3;48;42;119;2428;125;117;1.00;57,81;United Kingdom;Emerald Group Publishing Ltd.;1989-1991, 1993-ongoing;"Political Science and International Relations (Q2); Geography, Planning and Development (Q3); Management, Monitoring, Policy and Law (Q3); Public Administration (Q3)"
845;21100787105;Journal of Environmental Accounting and Management;journal;23256206, 23256192;0.262;Q3;8;29;79;1677;44;79;0.47;57,83;United States;L & H Scientific Publishing, LLC;2013-ongoing;"Urban Studies (Q2); Accounting (Q3); Ecology (Q3); Management, Monitoring, Policy and Law (Q3); Strategy and Management (Q3); Ecological Modeling (Q4)"
846;21100791269;Journal of Animal Behaviour and Biometeorology;journal;23181265;0.259;Q3;5;20;53;577;34;52;0.64;28,85;Brazil;Universidade Federal Rural do Semi-Arido;2013-ongoing;"Animal Science and Zoology (Q3); Ecology (Q3); Atmospheric Science (Q4)"
847;32555;Japan Agricultural Research Quarterly;journal;00213551;0.258;Q3;27;47;154;1212;109;154;0.67;25,79;Japan;Ministry of Agriculture;1973-1974, 1977-1978, 1983, 1987, 1993-ongoing;"Agronomy and Crop Science (Q3); Animal Science and Zoology (Q3); Biotechnology (Q3); Ecology (Q3)"
848;21100204915;Ochrona Srodowiska;journal;12306169;0.258;Q3;12;32;117;828;73;117;0.64;25,88;Poland;Polish Sanitary Engineers' Association;2008-ongoing;Environmental Science (miscellaneous) (Q3)
849;19400158376;CAB Reviews: Perspectives in Agriculture, Veterinary Science, Nutrition and Natural Resources;journal;17498848;0.257;Q3;24;55;154;6823;103;154;0.63;124,05;United Kingdom;CAB International;2006-ongoing;"Agricultural and Biological Sciences (miscellaneous) (Q3); Nature and Landscape Conservation (Q3); Veterinary (miscellaneous) (Q3)"
850;21100456641;HCMC 2015 - Proceedings of the 2nd Workshop on Computational Models of Social Interactions: Human-Computer-Media Communication, co-located with ACM MM 2015;conference and proceedings;00002015;0.257;-;2;0;6;0;5;4;1.25;0,00;United States;;2015;"Earth and Planetary Sciences (miscellaneous); Environmental Science (miscellaneous); Soil Science"
851;21100287109;Sustainable Environment Research;journal;24682039;0.257;Q3;17;44;142;1393;107;135;0.66;31,66;China;Chinese Institute of Environmental Engineering (CIEnvE);2013-ongoing;"Environmental Engineering (Q3); Pollution (Q3); Renewable Energy, Sustainability and the Environment (Q3); Waste Management and Disposal (Q3); Water Science and Technology (Q3)"
852;12100155621;Chinese Journal of Oceanology and Limnology;journal;02544059;0.256;Q3;24;124;447;5382;362;441;0.70;43,40;Germany;Springer Verlag;1982-1998, 2007-2017;"Water Science and Technology (Q3); Oceanography (Q4)"
853;21100286919;Journal of Water Reuse and Desalination;journal;22201319;0.256;Q3;10;56;124;1993;88;124;0.77;35,59;United Kingdom;IWA Publishing;2011-ongoing;"Water Science and Technology (Q3); Filtration and Separation (Q4)"
