Rank;Sourceid;Title;Type;Issn;SJR;SJR Best Quartile;H index;Total Docs. (2003);Total Docs. (3years);Total Refs.;Total Cites (3years);Citable Docs. (3years);Cites / Doc. (2years);Ref. / Doc.;Country;Publisher;Coverage;Categories
325;23148;IMA Journal Management Mathematics;journal;1471678X, 14716798;0.213;Q2;28;23;54;546;18;51;0.32;23.74;United Kingdom;Oxford University Press;1986, 1988-1989, 1991-1993, 1995, 2001-ongoing;"Economics, Econometrics and Finance (miscellaneous) (Q2); Management Information Systems (Q3); Modeling and Simulation (Q3); Strategy and Management (Q3); Applied Mathematics (Q4); Management Science and Operations Research (Q4)"
326;5700167235;International Journal of Consumer Studies;journal;14706423;0.211;Q3;56;84;82;1087;13;82;0.16;12.94;United Kingdom;Blackwell Science;1977-1995, 2011-ongoing;"Marketing (Q2); Economics and Econometrics (Q3); Public Health, Environmental and Occupational Health (Q3); Applied Psychology (Q4)"
327;16106;Foresight;journal;14659832, 14636689;0.208;Q2;26;53;153;719;22;153;0.15;13.57;United Kingdom;Emerald Group Publishing Ltd.;1999-ongoing;"Business and International Management (Q2); Economics, Econometrics and Finance (miscellaneous) (Q2); Management of Technology and Innovation (Q3); Management Science and Operations Research (Q4)"
328;86934;Economics of Planning;journal;00130451;0.206;Q4;16;15;40;461;11;40;0.28;30.73;Netherlands;Kluwer Academic Publishers;1961-1973, 1978-1982, 1985-1988, 1990-2005;Economics and Econometrics (Q4)
329;19980;Economic and Social Review;journal;00129984;0.205;Q4;25;15;46;478;20;46;0.21;31.87;Ireland;Economic and Social Studies;1979-ongoing;"Sociology and Political Science (Q3); Economics and Econometrics (Q4)"
330;28935;History of Political Economy;journal;15271919, 00182702;0.205;Q4;27;28;131;1402;52;131;0.49;50.07;United States;Duke University Press;1986, 1996-ongoing;"History (Q1); Economics and Econometrics (Q4)"
331;23702;Recherches economiques de Louvain;journal;07704518;0.205;Q2;8;19;32;467;5;31;0.16;24.58;Belgium;De Boeck & Larcier;1970, 1992, 1998, 2001-2014;Economics, Econometrics and Finance (miscellaneous) (Q2)
332;88147;Indian Journal of Labour Economics;journal;00195308;0.204;Q4;12;65;120;1557;18;118;0.12;23.95;Germany;Springer International Publishing AG;1996, 1998-2010, 2015-ongoing;Economics and Econometrics (Q4)
333;22707;International Review of Economics and Finance;journal;10590560;0.202;Q3;42;23;74;571;27;74;0.31;24.83;Netherlands;Elsevier BV;1992-ongoing;"Finance (Q3); Economics and Econometrics (Q4)"
334;29440;Review of Austrian Economics;journal;15737128, 08893047;0.201;Q2;29;19;45;762;19;45;0.35;40.11;Netherlands;Kluwer Academic Publishers;1987-1997, 1999-ongoing;Economics, Econometrics and Finance (miscellaneous) (Q2)
335;26941;Theory and Decision;journal;15737187, 00405833;0.199;Q2;32;34;116;623;30;116;0.28;18.32;Netherlands;Kluwer Academic Publishers;1970-ongoing;"Economics, Econometrics and Finance (miscellaneous) (Q2); Arts and Humanities (miscellaneous) (Q3); Social Sciences (miscellaneous) (Q3); Applied Psychology (Q4); Computer Science Applications (Q4); Decision Sciences (miscellaneous) (Q4); Developmental and Educational Psychology (Q4)"
336;18881;Australian Economic Review;journal;00049018, 14678462;0.198;Q4;26;32;75;706;16;75;0.29;22.06;United Kingdom;Blackwell Publishing Inc.;1968-ongoing;Economics and Econometrics (Q4)
337;4100151512;Research in Labor Economics;book series;01479121;0.197;Q4;22;17;44;470;7;40;0.12;27.65;United Kingdom;Emerald Group Publishing Ltd.;1999-2004, 2006-ongoing;"Political Science and International Relations (Q2); Industrial Relations (Q3); Economics and Econometrics (Q4)"
338;17700156007;Revue de l'OFCE;journal;12659576, 17775647;0.197;Q2;13;39;69;823;15;68;0.22;21.1;France;Presses de Sciences Po;2001-ongoing;Economics, Econometrics and Finance (miscellaneous) (Q2)
339;21781;Metroeconomica;journal;00261386, 1467999X;0.195;Q4;25;25;75;679;32;73;0.49;27.16;United States;John Wiley and Sons Inc.;1949-1986, 1988-1995, 2011-ongoing;Economics and Econometrics (Q4)
340;4000152118;Advances in Financial Economics;book series;15693732;0.194;Q3;11;9;19;278;3;19;0.16;30.89;United Kingdom;Emerald Group Publishing Ltd.;2001-2005, 2007, 2009, 2011-ongoing;"Economics, Econometrics and Finance (miscellaneous) (Q3); Finance (Q3); Accounting (Q4)"
341;130073;Journal of Consumer Policy;journal;01687034;0.194;Q4;38;0;43;0;16;43;0.35;0;Germany;Springer Nature;1977-1981, 1983-2002, 2005-ongoing;"Business, Management and Accounting (miscellaneous) (Q2); Economics and Econometrics (Q4)"
342;21100262312;Journal of Corporate Real Estate;journal;1463001X;0.194;Q3;21;16;81;112;24;81;0.28;7;United Kingdom;Emerald Group Publishing Ltd.;1998-ongoing;"Business, Management and Accounting (miscellaneous) (Q2); Finance (Q3)"
343;19900191763;New Zealand Economic Papers;journal;00779954, 19434863;0.194;Q3;11;13;52;388;3;51;0.03;29.85;United Kingdom;Routledge;1966, 1968-ongoing;Economics, Econometrics and Finance (miscellaneous) (Q3)
344;21100774787;Journal of Financial Regulation and Compliance;journal;13581988, 17400279;0.193;Q4;15;27;93;859;12;86;0.13;31.81;United Kingdom;Emerald Group Publishing Ltd.;2011-ongoing;"Strategy and Management (Q3); Finance (Q4)"
345;16230;Global Finance Journal;journal;10440283;0.191;Q4;29;17;34;565;16;34;0.38;33.24;Netherlands;Elsevier BV;1989-ongoing;"Economics and Econometrics (Q4); Finance (Q4)"
346;53958;Agrekon;journal;03031853, 20780400;0.19;Q4;21;25;134;493;13;134;0.13;19.72;United Kingdom;Taylor & Francis;1962-ongoing;"Geography, Planning and Development (Q2); Agronomy and Crop Science (Q3); Economics and Econometrics (Q4)"
347;20811;Betriebswirtschaftliche Forschung und Praxis;journal;03405370;0.19;Q4;8;40;113;1057;13;113;0.14;26.43;Germany;Verlag Neue Wirtschafts-Briete GmbH & Co.;1974-1975, 1977, 1989, 1996-2007, 2016-ongoing;"Business and International Management (Q2); Business, Management and Accounting (miscellaneous) (Q3); Economics and Econometrics (Q4)"
348;20140;Research in Human Capital and Development;book series;01943960;0.19;Q4;6;0;27;0;17;25;0.56;0;United States;Emerald Group Publishing Ltd.;1981, 1986, 1994, 1996, 1998, 2000-2001, 2004, 2008;"Political Science and International Relations (Q2); Demography (Q3); Development (Q3); Industrial Relations (Q3); Economics and Econometrics (Q4)"
349;20902;Environment, Development and Sustainability;journal;1387585X, 15732975;0.185;Q4;47;26;61;799;27;61;0.37;30.73;Netherlands;Kluwer Academic Publishers;1999-ongoing;"Geography, Planning and Development (Q3); Management, Monitoring, Policy and Law (Q3); Economics and Econometrics (Q4)"
350;23720;International Review of Applied Economics;journal;14653486, 02692171;0.183;Q4;33;24;78;824;34;78;0.37;34.33;United Kingdom;Taylor & Francis;1987-ongoing;Economics and Econometrics (Q4)
351;14727;International Paperworld IPW;trade journal;16151720;0.182;Q4;7;125;503;295;13;271;0.06;2.36;Germany;D P W Verlagsgesellschaft mbH;2003-ongoing;"Chemical Engineering (miscellaneous) (Q2); Media Technology (Q2); Chemistry (miscellaneous) (Q3); Materials Chemistry (Q3); Materials Science (miscellaneous) (Q3); Economics and Econometrics (Q4)"
352;17385;International Review of Financial Analysis;journal;10575219;0.178;Q4;43;33;77;985;22;76;0.21;29.85;Netherlands;Elsevier BV;1992-ongoing;"Economics and Econometrics (Q4); Finance (Q4)"
353;17700156442;Handbook of Game Theory with Economic Applications;book series;15740005;0.174;Q4;15;0;24;0;5;22;0.23;0;Netherlands;Elsevier BV;1992, 1994, 2002, 2015;"Applied Mathematics (Q4); Economics and Econometrics (Q4); Statistics and Probability (Q4); Statistics, Probability and Uncertainty (Q4)"
354;144968;Asia-Pacific Financial Markets;journal;13872834;0.173;Q4;19;12;56;345;12;55;0.29;28.75;Netherlands;Kluwer Academic Publishers;1996-ongoing;Finance (Q4)
355;58669;Research in Economic Anthropology;book series;01901281;0.173;Q4;15;14;13;649;2;12;0.17;46.36;United Kingdom;Emerald Group Publishing Ltd.;1983, 1987, 2002-2004, 2006-2008, 2010-ongoing;"Anthropology (Q3); Economics and Econometrics (Q4)"
356;17600155101;Economie Internationale;journal;12408093, 17775582;0.172;Q4;13;30;62;724;6;52;0.12;24.13;France;Documentation Francaise;2001-2013;"Business and International Management (Q2); Economics and Econometrics (Q4); Finance (Q4)"
357;19458;Eastern European Economics;journal;00128775;0.171;Q4;17;22;54;555;13;54;0.28;25.23;United States;M.E. Sharpe Inc.;1977, 1982, 1996-ongoing;Economics and Econometrics (Q4)
358;29884;Journal of International Accounting, Auditing and Taxation;journal;10619518;0.171;Q4;34;10;29;380;9;29;0.3;38;United Kingdom;Elsevier Ltd.;1992-ongoing;"Accounting (Q4); Finance (Q4)"
359;14089;Developing Economies;journal;00121533, 17461049;0.169;Q4;23;19;55;588;17;55;0.17;30.95;United States;Wiley-Blackwell;1962-ongoing;"Development (Q3); Economics and Econometrics (Q4)"
360;12100155919;Journal of Financial Counseling and Planning;journal;10523073;0.168;Q4;31;13;46;453;7;46;0.07;34.85;United States;Springer Publishing Company;1990-1991, 1993-ongoing;"Economics and Econometrics (Q4); Finance (Q4)"
361;29449;Revue d'Etudes Comparatives Est-Ouest;journal;03380599;0.168;Q4;8;27;94;1150;18;89;0.14;42.59;France;Editions NecPlus;1978, 1985, 1996-ongoing;"Political Science and International Relations (Q2); Finance (Q4)"
362;17700156014;Travail, Genre et Societe;journal;12946303;0.168;Q4;12;32;50;603;7;46;0.15;18.84;France;Editions La Decouverte;2001-ongoing;"Business and International Management (Q2); Gender Studies (Q2); Sociology and Political Science (Q3); Economics and Econometrics (Q4); Organizational Behavior and Human Resource Management (Q4)"
363;19600157368;Revista de Historia Economica - Journal of Iberian and Latin American Economic History;journal;02126109;0.164;Q4;17;26;70;1308;16;70;0.1;50.31;United Kingdom;Cambridge University Press;1983-ongoing;"History (Q1); Economics and Econometrics (Q4)"
364;13217;European Journal of Health Economics;journal;16187598, 14396637;0.161;Q3;45;46;84;1127;35;69;0.51;24.5;Germany;Springer Verlag;2002-ongoing;"Economics, Econometrics and Finance (miscellaneous) (Q3); Health Policy (Q3)"
365;5700163831;Revue Economique;journal;00352764, 19506694;0.16;Q3;17;68;160;1992;38;160;0.24;29.29;France;Presses de Sciences Po;2001-ongoing;Economics, Econometrics and Finance (miscellaneous) (Q3)
366;27516;Applied Health Economics and Health Policy;journal;11755652;0.158;Q4;32;29;32;289;16;30;0.53;9.97;Switzerland;Springer International Publishing AG;2002-2006, 2008-ongoing;"Health Policy (Q3); Medicine (miscellaneous) (Q3); Economics and Econometrics (Q4)"
367;19709;Education Economics;journal;09645292, 14695782;0.158;Q4;30;16;28;396;10;28;0.26;24.75;United Kingdom;Carfax Publishing Ltd.;1993-ongoing;"Education (Q3); Economics and Econometrics (Q4)"
368;21100384312;Journal des Economistes et des Etudes Humaines;journal;21945799, 21531552;0.154;Q3;9;30;144;695;19;142;0.14;23.17;Germany;Walter de Gruyter GmbH;2014-ongoing;"Economics, Econometrics and Finance (miscellaneous) (Q3); Social Sciences (miscellaneous) (Q3)"
369;24076;New England Economic Review;journal;00284726;0.154;Q4;22;3;39;40;18;39;0.32;13.33;United States;Federal Reserve Bank of Boston;1996-2004;Economics and Econometrics (Q4)
370;3300147410;Journal of Asian Pacific Communication;journal;15699838, 09576851;0.153;Q4;15;14;44;517;12;44;0.31;36.93;Netherlands;John Benjamins Publishing Company;2005-ongoing;"Business, Management and Accounting (miscellaneous) (Q3); Communication (Q3); Geography, Planning and Development (Q3); Economics and Econometrics (Q4)"
371;5200152633;Research in Law and Economics;book series;01935895;0.151;Q4;9;0;34;0;4;32;0.17;0;United Kingdom;Emerald Group Publishing Ltd.;2000, 2002, 2004, 2007, 2009, 2012, 2014-2015;"Law (Q2); Economics and Econometrics (Q4)"
372;19200156908;Annals of Economics and Finance;journal;15297373;0.15;Q4;20;10;43;234;5;43;0.22;23.4;United States;Peking University Press;2008-ongoing;"Economics and Econometrics (Q4); Finance (Q4)"
373;24982;Singapore Economic Review;journal;02175908;0.147;Q4;13;13;38;377;5;38;0.15;29;Singapore;World Scientific Publishing Co;1983-ongoing;Economics and Econometrics (Q4)
374;27142;Indian Economic and Social History Review;journal;00194646;0.145;Q4;17;14;50;1603;6;49;0.14;114.5;India;Sage Publications India Pvt Ltd.;1963-ongoing;"History (Q2); Social Sciences (miscellaneous) (Q3); Economics and Econometrics (Q4)"
375;36512;Tropical Science;journal;00413291;0.144;Q4;17;42;112;434;25;112;0.19;10.33;United Kingdom;Whurr Publishers Ltd.;1978, 1985, 1988, 1993-2007;"Agricultural and Biological Sciences (miscellaneous) (Q3); Environmental Science (miscellaneous) (Q3); Economics and Econometrics (Q4); Plant Science (Q4)"
376;18165;International Social Security Review;journal;0020871X, 1468246X;0.143;Q3;25;22;73;67;29;71;0.32;3.05;United Kingdom;Blackwell Publishing Inc.;1967-1995, 2008-ongoing;"Economics, Econometrics and Finance (miscellaneous) (Q3); Public Administration (Q3); Sociology and Political Science (Q3)"
377;33245;Crisis Intervention and Time-Limited Treatment;journal;10645136;0.142;Q3;10;2;18;0;5;18;0;0;United States;Brunner - Routledge (US);1996-2000, 2003;Economics, Econometrics and Finance (miscellaneous) (Q3)
378;15498;International Journal of Sociology and Social Policy;journal;0144333X;0.142;Q3;33;45;126;1760;24;126;0.18;39.11;United Kingdom;Emerald Group Publishing Ltd.;1981-ongoing;"Economics, Econometrics and Finance (miscellaneous) (Q3); Sociology and Political Science (Q3)"
379;24200;Review of Black Political Economy;journal;00346446;0.142;Q4;14;14;55;569;6;54;0.03;40.64;United States;Springer New York LLC;1970-ongoing;"Cultural Studies (Q1); Economics and Econometrics (Q4)"
380;6700153287;Economics Bulletin;journal;15452921;0.139;Q3;25;134;123;1578;13;123;0.11;11.78;United States;Economics Bulletin;2001-2003, 2007-ongoing;Economics, Econometrics and Finance (miscellaneous) (Q3)
381;28419;Intereconomics;journal;00205346;0.138;Q3;18;64;140;877;16;124;0.12;13.7;Germany;Springer Verlag;1966-2002, 2004-ongoing;"Business, Management and Accounting (miscellaneous) (Q3); Economics, Econometrics and Finance (miscellaneous) (Q3)"
382;145661;International Advances in Economic Research;journal;10830898;0.136;Q3;21;31;133;663;13;133;0.13;21.39;United States;Springer New York LLC;1995-ongoing;"Economics, Econometrics and Finance (miscellaneous) (Q3); Economics and Econometrics (Q4)"
383;144667;Property Management;journal;02637472;0.135;Q4;24;25;319;516;15;314;0.05;20.64;United Kingdom;Emerald Group Publishing Ltd.;1983-ongoing;"Business, Management and Accounting (miscellaneous) (Q3); Finance (Q4); Tourism, Leisure and Hospitality Management (Q4)"
384;110031;Resources Policy;journal;03014207;0.135;Q4;57;5;58;103;16;58;0.18;20.6;United Kingdom;Elsevier Ltd.;1974-ongoing;"Law (Q3); Sociology and Political Science (Q3); Economics and Econometrics (Q4); Management, Monitoring, Policy and Law (Q4)"
385;4000152110;Advances in Accounting;book series;10465715, 08826110;0.132;Q4;24;16;35;414;3;35;0.08;25.88;United Kingdom;Elsevier Ltd.;2000-2003, 2005-ongoing;"Accounting (Q4); Finance (Q4)"
386;4700152413;International Journal of Entrepreneurship and Innovation Management;journal;17415098, 1368275X;0.132;Q4;20;40;63;1176;9;63;0.14;29.4;United Kingdom;Inderscience Publishers;2006-ongoing;"Business and International Management (Q3); Management of Technology and Innovation (Q3); Economics and Econometrics (Q4); Strategy and Management (Q4)"
387;26285;Revue d'Economie du Developpement;journal;12454060;0.132;Q3;7;17;57;650;7;55;0.09;38.24;Belgium;De Boeck & Larcier;1993-ongoing;"Development (Q3); Economics, Econometrics and Finance (miscellaneous) (Q3)"
388;19700167301;Environmental Economics and Policy Studies;journal;1432847X;0.131;Q4;17;0;51;0;11;51;0.04;0;Germany;Springer Verlag;2010-ongoing;"Economics and Econometrics (Q4); Management, Monitoring, Policy and Law (Q4)"
389;12100157208;Journal of Economics and Finance;journal;10550925, 19389744;0.131;Q4;25;26;73;802;12;73;0.14;30.85;United States;Springer Verlag;1992-ongoing;"Economics and Econometrics (Q4); Finance (Q4)"
390;25524;Social Marketing Quarterly;journal;15245004;0.131;Q4;22;20;130;255;16;116;0.06;12.75;United States;SAGE Publications Inc.;1994-ongoing;"Marketing (Q3); Economics and Econometrics (Q4)"
391;5600152909;Capital and Class;journal;03098168;0.129;Q4;30;27;73;896;35;73;0.48;33.19;United States;SAGE Publications Inc.;1977-ongoing;"History (Q2); Sociology and Political Science (Q3); Economics and Econometrics (Q4)"
392;5600153391;Historical Materialism;journal;14654466;0.129;Q3;26;56;56;0;10;49;0.2;0;Netherlands;Brill;2002-ongoing;"History (Q2); Economics, Econometrics and Finance (miscellaneous) (Q3); Political Science and International Relations (Q3); Social Sciences (miscellaneous) (Q3); Sociology and Political Science (Q3)"
393;56380;IEEE/IAFE Conference on Computational Intelligence for Financial Engineering, Proceedings (CIFEr);conference and proceedings;00002009, 00002000, 00001995;0.129;-;15;59;43;1071;5;42;0;18.15;United Kingdom;;1995-2000, 2009;"Applied Mathematics; Artificial Intelligence; Computer Science Applications; Finance; Software"
394;19700175212;Revista Espanola de Financiacion y Contabilidad;journal;02102412;0.128;Q4;14;36;88;1633;7;88;0.07;45.36;United Kingdom;Taylor & Francis;1996-ongoing;"Accounting (Q4); Economics and Econometrics (Q4); Finance (Q4)"
395;21100777369;Managerial Finance;journal;03074358, 17587743;0.126;Q4;33;58;179;1750;26;179;0.14;30.17;United Kingdom;Emerald Group Publishing Ltd.;2005-ongoing;"Business, Management and Accounting (miscellaneous) (Q3); Finance (Q4); Strategy and Management (Q4)"
396;4000152102;Research in Multi-Level Issues;book series;14759144;0.126;Q3;17;22;21;942;4;21;0.19;42.82;United Kingdom;Emerald Group Publishing Ltd.;2002-2007;Economics, Econometrics and Finance (miscellaneous) (Q3)
397;29339;International Journal on Hydropower and Dams;journal;13522523;0.125;Q4;14;96;460;289;10;258;0.05;3.01;United Kingdom;Aqua Media International Ltd.;1995-2013, 2015;"Civil and Structural Engineering (Q3); Energy Engineering and Power Technology (Q3); Mechanical Engineering (Q3); Economics and Econometrics (Q4)"
398;18217;Acta Oeconomica;journal;00016373, 15882659;0.124;Q4;11;17;37;647;4;37;0.11;38.06;Hungary;Akademiai Kiado;1995-2000, 2002-ongoing;Economics and Econometrics (Q4)
399;5800191435;Economic Analysis and Policy;journal;03135926;0.124;Q4;21;21;55;488;7;55;0.1;23.24;Netherlands;Elsevier BV;2014-ongoing;Economics and Econometrics (Q4)
400;19276;Fortune;journal;00158259;0.124;Q4;14;355;503;0;39;427;0.09;0;United States;Time Inc.;1973-1974, 1976-ongoing;"Business and International Management (Q3); Business, Management and Accounting (miscellaneous) (Q3); Economics and Econometrics (Q4)"
401;14890;Mondes En Developpement;journal;03023052, 17821444;0.123;Q4;8;28;86;1030;2;80;0.04;36.79;Belgium;Institut de Sciences Mathematiques et Economiques Appliquees FRA;1977-1979, 1982-ongoing;"Development (Q4); Economics and Econometrics (Q4)"
402;19700187644;Politica Economica;journal;11209496;0.123;Q4;6;15;62;399;5;60;0.09;26.6;Italy;Societa Editrice II Mulino;2010-ongoing;"Political Science and International Relations (Q3); Economics and Econometrics (Q4)"
403;17700156406;Revue Internationale de Droit Economique;journal;10108831, 17821525;0.123;Q3;6;19;57;1842;7;38;0.18;96.95;Belgium;De Boeck & Larcier;2001-ongoing;"Business and International Management (Q3); Economics, Econometrics and Finance (miscellaneous) (Q3); Law (Q3)"
404;25587;Pacific Economic Review;journal;1361374X;0.122;Q4;29;23;84;450;19;84;0.14;19.57;United Kingdom;Blackwell Publishing Inc.;1996-ongoing;"Aerospace Engineering (Q3); Geography, Planning and Development (Q3); Development (Q4); Economics and Econometrics (Q4)"
405;26629;Annali della Fondazione Luigi Einaudi. Fondazione Luigi Einaudi;book series;05319870;0.121;Q3;2;0;1;0;0;1;0;0;Italy;Casa Editrice Leo S. Olschki;1979, 1982, 2001, 2012-2014;"History (Q2); Economics, Econometrics and Finance (miscellaneous) (Q3); Social Sciences (miscellaneous) (Q3)"
406;18500168400;Asian Affairs;journal;03068374, 14771500;0.121;Q4;5;0;1;0;0;1;0;0;United Kingdom;Routledge;1979, 1999, 2001, 2011, 2014-ongoing;"Geography, Planning and Development (Q3); Law (Q3); Political Science and International Relations (Q3); Economics and Econometrics (Q4)"
407;19300156810;Asia-Pacific Journal of Accounting and Economics;journal;16081625;0.121;Q4;10;0;1;0;0;1;0;0;United Kingdom;Taylor & Francis;2000, 2009-ongoing;"Accounting (Q4); Economics and Econometrics (Q4); Finance (Q4)"
408;20193;Business Ethics;journal;09628770;0.121;Q4;25;0;1;0;0;1;0;0;United Kingdom;Blackwell Publishing Inc.;1992-1995, 1997, 1999, 2001, 2008, 2010-ongoing;"Business and International Management (Q3); Economics and Econometrics (Q4)"
409;15900154750;South African Journal of Economic and Management Sciences;journal;10158812;0.121;Q3;11;0;1;0;0;1;0;0;South Africa;OpenJournals Publishing AOSIS (Pty) Ltd;2007-ongoing;"Business, Management and Accounting (miscellaneous) (Q3); Economics, Econometrics and Finance (miscellaneous) (Q3)"
410;14500154708;Statistical Journal of the IAOS;journal;18747655;0.121;Q4;13;25;76;152;5;72;0.07;6.08;Netherlands;IOS Press;2008-2009, 2011-ongoing;"Economics and Econometrics (Q4); Management Information Systems (Q4); Statistics, Probability and Uncertainty (Q4)"
411;145680;Business Information Review;journal;02663821;0.119;Q3;14;16;104;70;12;92;0.1;4.38;United States;SAGE Publications;1984-ongoing;"Business and International Management (Q3); Business, Management and Accounting (miscellaneous) (Q3); Economics, Econometrics and Finance (miscellaneous) (Q3)"
412;17600155224;Economie et Prevision;journal;02494744, 17775795;0.119;Q3;12;34;84;1097;9;84;0.11;32.26;France;Ministere de l'Economie, Direction de la Prevision;2001-2013, 2015-ongoing;"Business and International Management (Q3); Economics, Econometrics and Finance (miscellaneous) (Q3)"
413;22371;Hitotsubashi Journal of Economics;journal;0018280X;0.118;Q4;9;10;35;178;3;34;0.05;17.8;Japan;Sanseido Publishing Company, Ltd.;1996-ongoing;"Business, Management and Accounting (miscellaneous) (Q3); Economics and Econometrics (Q4)"
414;27859;University of Pennsylvania Journal of International Economic Law;journal;10867872;0.118;Q3;21;18;57;0;5;52;0.06;0;United States;University of Pennsylvania;1996-2013;"Economics, Econometrics and Finance (miscellaneous) (Q3); Law (Q3)"
415;4100151503;Advances in Industrial and Labor Relations;book series;07426186;0.117;Q3;8;10;20;372;3;18;0.17;37.2;United Kingdom;Emerald Group Publishing Ltd.;2001-2006, 2009-2012, 2015-ongoing;"Economics, Econometrics and Finance (miscellaneous) (Q3); Industrial Relations (Q3); Political Science and International Relations (Q3); Organizational Behavior and Human Resource Management (Q4)"
416;12300154710;Economic and Labour Relations Review;journal;10353046;0.117;Q4;15;3;24;36;8;23;0.29;12;United States;SAGE Publications;1990-ongoing;"Economics and Econometrics (Q4); Organizational Behavior and Human Resource Management (Q4)"
417;4100151536;Research in Transportation Economics;journal;07398859;0.115;Q3;33;0;7;0;1;6;0.17;0;United Kingdom;Elsevier Ltd.;1994, 1996, 1999, 2001, 2004-ongoing;"Economics, Econometrics and Finance (miscellaneous) (Q3); Transportation (Q3)"
418;4100151510;Research in Middle East Economics;book series;10945334;0.113;Q3;7;16;16;359;2;15;0.13;22.44;United Kingdom;Emerald Group Publishing Ltd.;2001, 2003, 2005;Economics, Econometrics and Finance (miscellaneous) (Q3)
419;4000152104;Research in the History of Economic Thought and Methodology;book series;07434154;0.113;Q4;6;61;113;1626;5;103;0.03;26.66;United Kingdom;Emerald Group Publishing Ltd.;2000-2003, 2005-2010, 2013-ongoing;"Arts and Humanities (miscellaneous) (Q3); History and Philosophy of Science (Q3); Economics, Econometrics and Finance (miscellaneous) (Q4)"
420;145660;Atlantic Economic Journal;journal;01974254;0.111;Q4;19;0;123;0;11;123;0.09;0;Netherlands;Springer Netherlands;1973-2002, 2005-ongoing;Economics, Econometrics and Finance (miscellaneous) (Q4)
421;55037;Asian Affairs;journal;00927678;0.11;Q4;14;19;42;234;6;40;0.13;12.32;United States;Heldref Publications;1973-ongoing;"Law (Q3); Economics and Econometrics (Q4); Geography, Planning and Development (Q4); Political Science and International Relations (Q4)"
422;19800188055;Journal of Financial Crime;journal;17587239, 13590790;0.11;Q4;18;13;99;470;2;99;0.02;36.15;United Kingdom;Emerald Group Publishing Ltd.;1993-ongoing;"Law (Q3); Economics, Econometrics and Finance (miscellaneous) (Q4)"
423;18200156703;Journal of International Trade Law and Policy;journal;14770024;0.11;Q4;7;5;2;341;0;2;0;68.2;United Kingdom;Emerald Group Publishing Ltd.;2002-ongoing;"Law (Q3); Economics, Econometrics and Finance (miscellaneous) (Q4); Industrial Relations (Q4); Political Science and International Relations (Q4)"
424;24352;Journal of Economic Studies;journal;01443585;0.109;Q4;35;26;91;663;10;91;0.05;25.5;United Kingdom;Emerald Group Publishing Ltd.;1974-ongoing;Economics, Econometrics and Finance (miscellaneous) (Q4)
425;5600153382;Journal of the Economic and Social History of the Orient;journal;00224995;0.109;Q4;24;18;50;0;9;47;0.12;0;Netherlands;Brill;1957-ongoing;"History (Q2); Economics and Econometrics (Q4); Sociology and Political Science (Q4)"
426;17018;New Perspectives on Turkey;journal;08966346, 13053299;0.107;Q4;14;0;3;0;0;3;0;0;United Kingdom;Cambridge University Press;1993, 1995, 1999-2002, 2008-ongoing;"Cultural Studies (Q2); History (Q3); Economics and Econometrics (Q4); Sociology and Political Science (Q4)"
