Rank;Sourceid;Title;Type;Issn;SJR;SJR Best Quartile;H index;Total Docs. (2020);Total Docs. (3years);Total Refs.;Total Cites (3years);Citable Docs. (3years);Cites / Doc. (2years);Ref. / Doc.;Country;Region;Publisher;Coverage;Categories
668;21100900312;Materials Engineering and Sciences Division 2018 - Core Programming Area at the 2018 AIChE Annual Meeting;conference and proceedings;-;0.117;-;1;0;17;0;1;16;0.06;0;United States;Northern America;;;"Chemical Engineering (miscellaneous); Engineering (miscellaneous); Materials Science (miscellaneous)"
669;21100856779;Proceedings of the World Congress on Mechanical, Chemical, and Material Engineering;conference and proceedings;23698136;0.117;-;5;50;321;797;42;320;0.12;15.94;Canada;Northern America;;;"Chemical Engineering (miscellaneous); Mechanical Engineering; Mechanics of Materials"
670;21100874903;12th International Conference on Fluidized Bed Technology, CFB 2017;conference and proceedings;-;0.116;-;3;0;139;0;11;137;0;0;Poland;Eastern Europe;;;"Control and Systems Engineering; Energy Engineering and Power Technology; Filtration and Separation; Fluid Flow and Transfer Processes"
671;21100931211;2019 ASABE Annual International Meeting;conference and proceedings;-;0.116;-;4;0;355;0;87;354;0.25;0;United States;Northern America;;;"Agronomy and Crop Science; Bioengineering"
672;25187;Corrosion and Protection;journal;1005748X;0.116;Q4;12;83;313;546;65;313;0.22;6.58;China;Asiatic Region;Shanghai Research Institute of Materials;2002-2021;"Chemical Engineering (miscellaneous) (Q4); Chemistry (miscellaneous) (Q4); Materials Science (miscellaneous) (Q4)"
673;33335;Huaxue Gongcheng/Chemical Engineering;journal;10059954;0.116;Q4;12;175;538;2769;76;538;0.11;15.82;China;Asiatic Region;Editorial Office of Chemical Engineering (China);1996-2021;Chemical Engineering (miscellaneous) (Q4)
674;110018;Hydrocarbon Processing;trade journal;00188190;0.116;Q4;28;106;26;247;5;25;0.8;2.33;United States;Northern America;Gulf Publishing Company;1970-1994, 1996-2018, 2020;"Energy Engineering and Power Technology (Q4); Fuel Technology (Q4); Process Chemistry and Technology (Q4)"
675;21100797224;2016 International Symposium on Micro-NanoMechatronics and Human Science, MHS 2016;conference and proceedings;-;0.115;-;5;0;96;0;24;95;0;0;United States;Northern America;;;"Artificial Intelligence; Biomedical Engineering; Biotechnology; Civil and Structural Engineering; Computer Networks and Communications; Computer Science Applications; Energy Engineering and Power Technology; Fluid Flow and Transfer Processes; Hardware and Architecture; Human-Computer Interaction; Instrumentation; Mechanical Engineering; Medicine (miscellaneous)"
676;16379;Chemical and Engineering News;trade journal;00092347, 1520605X;0.114;Q4;45;0;37;0;11;35;0;0;United States;Northern America;American Chemical Society;1942-2014, 2016-2017;Chemical Engineering (miscellaneous) (Q4)
677;51442;CONCAWE Reports;journal;01660810;0.114;Q4;5;0;41;0;5;41;0.18;0;Belgium;Western Europe;Oil Companies European Organisation for Environmental and Health Protection;1999-2019;"Energy (miscellaneous) (Q4); Environmental Science (miscellaneous) (Q4); Process Chemistry and Technology (Q4); Safety, Risk, Reliability and Quality (Q4)"
678;21100456162;ERCOFTAC Series;book series;13824309, 22151826;0.114;Q4;10;67;186;776;42;73;0.23;11.58;Netherlands;Western Europe;Springer Netherlands;2007-2008, 2010-2012, 2014-2016, 2018-2021;"Computational Mathematics (Q4); Fluid Flow and Transfer Processes (Q4)"
679;9500154122;Genetic Engineering and Biotechnology News;journal;1935472X;0.114;Q4;10;215;690;127;49;631;0.09;0.59;United States;Northern America;Mary Ann Liebert Inc.;2007-2021;"Bioengineering (Q4); Biomedical Engineering (Q4); Biotechnology (Q4); Management of Technology and Innovation (Q4)"
680;21100928240;19th International Workshop on Junction Technology, IWJT 2019;conference and proceedings;-;0.113;-;1;0;23;0;1;21;0.04;0;United States;Northern America;;;"Electrical and Electronic Engineering; Electronic, Optical and Magnetic Materials; Process Chemistry and Technology"
681;21100813707;2016 2nd International Conference of Industrial, Mechanical, Electrical, and Chemical Engineering, ICIMECE 2016;conference and proceedings;-;0.113;-;7;0;53;0;37;52;0;0;United States;Northern America;;;"Chemical Engineering (miscellaneous); Electrical and Electronic Engineering; Industrial and Manufacturing Engineering; Instrumentation; Mechanical Engineering; Media Technology; Signal Processing"
682;13026;Huadong Ligong Daxue Xuebao /Journal of East China University of Science and Technology;journal;10063080;0.113;Q4;13;103;392;2316;71;392;0.18;22.49;China;Asiatic Region;East China University of Science and Technology;1993-1995, 2001-2021;"Chemical Engineering (miscellaneous) (Q4); Engineering (miscellaneous) (Q4); Materials Chemistry (Q4)"
683;21100930145;MERCon 2019 - Proceedings, 5th International Multidisciplinary Moratuwa Engineering Research Conference;conference and proceedings;-;0.113;-;6;0;129;0;57;124;0.44;0;United States;Northern America;;;"Artificial Intelligence; Civil and Structural Engineering; Education; Electrical and Electronic Engineering; Industrial and Manufacturing Engineering; Materials Science (miscellaneous); Mechanical Engineering; Process Chemistry and Technology"
684;24817;Nachrichten aus der Chemie;journal;14399598;0.113;Q4;17;299;912;1971;35;335;0.04;6.59;Germany;Western Europe;"Walter de Gruyter GmbH &amp; Co. KG";1982-1984, 1986, 1996-2021;"Chemical Engineering (miscellaneous) (Q4); Chemistry (miscellaneous) (Q4)"
685;21100923705;2018 IEEE 8th International Conference on Underwater System Technology: Theory and Application, USYS 2018;conference and proceedings;-;0.112;-;3;0;89;0;24;88;0.27;0;United States;Northern America;;;"Automotive Engineering; Civil and Structural Engineering; Fluid Flow and Transfer Processes; Instrumentation; Ocean Engineering"
686;21100975821;4th Scientific International Conference Najaf, SICN 2019;conference and proceedings;-;0.112;-;4;0;42;0;27;41;0.64;0;United States;Northern America;;;"Computer Networks and Communications; Electrical and Electronic Engineering; Environmental Science (miscellaneous); Fluid Flow and Transfer Processes; Hardware and Architecture"
687;21100900343;Computational Molecular Science and Engineering Forum 2018 - Core Programming Area at the 2018 AIChE Annual Meeting;conference and proceedings;-;0.112;-;0;0;3;0;0;2;0;0;United States;Northern America;;;"Chemical Engineering (miscellaneous); Computer Science Applications; Engineering (miscellaneous); Modeling and Simulation"
688;21100826687;Emerging Technologies in Clean Energy 2017 - Topical Conference at the 2017 AIChE Spring Meeting and 13th Global Congress on Process Safety;conference and proceedings;-;0.112;-;1;0;3;0;0;2;0;0;United States;Northern America;;;"Chemical Engineering (miscellaneous); Engineering (miscellaneous); Renewable Energy, Sustainability and the Environment"
689;21100932427;ICSGRC 2019 - 2019 IEEE 10th Control and System Graduate Research Colloquium, Proceeding;conference and proceedings;-;0.112;-;5;0;39;0;38;38;0.97;0;United States;Northern America;;;"Artificial Intelligence; Computer Networks and Communications; Control and Optimization; Electrical and Electronic Engineering; Process Chemistry and Technology"
690;21100900342;Liaison Functions 2018 - Core Programming Area at the 2018 AIChE Annual Meeting;conference and proceedings;-;0.112;-;0;0;3;0;0;2;0;0;United States;Northern America;;;"Chemical Engineering (miscellaneous); Engineering (miscellaneous); Modeling and Simulation; Renewable Energy, Sustainability and the Environment"
691;21100928230;Management Division 2019, Held at the 2019 AIChE Spring Meeting and 15th Global Congress on Process Safety;conference and proceedings;-;0.112;-;0;0;3;0;0;2;0;0;United States;Northern America;;;"Chemical Engineering (miscellaneous); Engineering (miscellaneous); Management of Technology and Innovation; Renewable Energy, Sustainability and the Environment"
692;21100925699;34th Center for Chemical Process Safety International Conference 2019, CCPS 2019 - Topical Conference at the 2019 AIChE Spring Meeting and 15th Global Congress on Process Safety;conference and proceedings;-;0.111;-;1;0;42;0;2;41;0.05;0;United States;Northern America;;;"Process Chemistry and Technology; Safety, Risk, Reliability and Quality"
693;23390;Chemist;journal;00093025;0.111;Q4;6;0;31;0;8;27;0.35;0;United States;Northern America;American Institute of Chemists;1996-1999, 2001-2007, 2012-2018, 2021;"Chemical Engineering (miscellaneous) (Q4); Chemistry (miscellaneous) (Q4)"
694;12942;Filtration and Separation;trade journal;18737218, 00151882;0.111;Q4;31;0;28;0;3;25;0;0;Netherlands;Western Europe;Elsevier BV;1970-2019, 2021;"Environmental Science (miscellaneous) (Q4); Filtration and Separation (Q4); Industrial and Manufacturing Engineering (Q4)"
695;21100914867;Proceedings of 2019 6th International Workshop on Low Temperature Bonding for 3D Integration, LTB-3D 2019;conference and proceedings;-;0.111;-;2;0;89;0;14;87;0.16;0;United States;Northern America;;;"Electrical and Electronic Engineering; Electronic, Optical and Magnetic Materials; Process Chemistry and Technology"
696;21100321695;SpringerBriefs in Applied Sciences and Technology;book series;21915318, 2191530X;0.111;Q4;18;541;1391;14055;349;45;0.29;25.98;United States;Northern America;Springer Publishing Company;2011-2022;"Biotechnology (Q4); Chemical Engineering (miscellaneous) (Q4); Energy Engineering and Power Technology (Q4); Engineering (miscellaneous) (Q4); Materials Science (miscellaneous) (Q4); Mathematics (miscellaneous) (Q4)"
697;13638;Xiandai Huagong/Modern Chemical Industry;journal;02534320;0.111;Q4;14;662;1827;13348;194;1827;0.1;20.16;China;Asiatic Region;China National Chemical Information Center;1982, 1984-1989, 2000-2021;Chemical Engineering (miscellaneous) (Q4)
698;21100797223;2016 Dynamics of Systems, Mechanisms and Machines, Dynamics 2016;conference and proceedings;-;0.11;-;7;0;156;0;45;155;0;0;United States;Northern America;;;"Artificial Intelligence; Civil and Structural Engineering; Computer Networks and Communications; Computer Science Applications; Control and Optimization; Control and Systems Engineering; Energy Engineering and Power Technology; Fluid Flow and Transfer Processes; Hardware and Architecture; Mechanical Engineering"
699;21100962506;2019 IEEE International Conference on Engineering Veracruz, ICEV 2019;conference and proceedings;-;0.11;-;3;0;49;0;20;48;0.41;0;United States;Northern America;;;"Control and Systems Engineering; Electrical and Electronic Engineering; Energy Engineering and Power Technology; Fluid Flow and Transfer Processes; Industrial and Manufacturing Engineering; Mechanical Engineering"
700;21100901008;Proceedings - 6th International Conference on Sustainable Energy Engineering and Application, ICSEEA 2018;conference and proceedings;-;0.11;-;3;0;35;0;15;31;0.43;0;United States;Northern America;;;"Energy Engineering and Power Technology; Fluid Flow and Transfer Processes; Mechanical Engineering; Renewable Energy, Sustainability and the Environment"
701;21100873121;Current Biotechnology;journal;22115501, 2211551X;0.109;Q4;5;0;3;0;1;3;0;0;Netherlands;Western Europe;Bentham Science Publishers B.V.;2015-2017;"Applied Microbiology and Biotechnology (Q4); Bioengineering (Q4); Biotechnology (Q4)"
702;14353;Plastics Engineering;journal;00919578, 19419635;0.109;Q4;13;97;294;4;24;142;0.08;0.04;United States;Northern America;Wiley-Blackwell;1973-1991, 1993-2021;"Chemical Engineering (miscellaneous) (Q4); Materials Chemistry (Q4); Polymers and Plastics (Q4)"
703;13282;Sealing Technology;trade journal;13504789;0.109;Q4;15;8;41;78;3;41;0.07;9.75;United Kingdom;Western Europe;Elsevier BV;1994-2021;"Chemical Engineering (miscellaneous) (Q4); Mechanical Engineering (Q4)"
704;21100839216;Catalytic Science Series;book series;23994495, 17931398;0.108;Q4;1;0;45;0;1;3;0.04;0;Singapore;Asiatic Region;World Scientific Publishing Co. Pte Ltd;2017-2019, 2021;Catalysis (Q4)
705;13086;Institution of Chemical Engineers Symposium Series;conference and proceedings;03070492;0.108;-;17;63;258;761;10;255;0.03;12.08;United Kingdom;Western Europe;;;"Chemical Engineering (miscellaneous); Engineering (miscellaneous)"
706;21100877657;International Conference on Computational Methods for Thermal Problems;conference and proceedings;23055995;0.108;-;3;0;223;0;12;221;0.05;0;China;Asiatic Region;;;"Computational Mathematics; Fluid Flow and Transfer Processes; Numerical Analysis"
707;21100900340;Nanoscale Science and Engineering Forum 2018 - Core Programming Area at the 2018 AIChE Annual Meeting;conference and proceedings;-;0.108;-;0;0;4;0;0;3;0;0;United States;Northern America;;;"Chemical Engineering (miscellaneous); Engineering (miscellaneous); Environmental Engineering; Materials Chemistry"
708;21100893194;Particle Interactions 2018 - Topical at the 8th World Congress on Particle Technology;conference and proceedings;-;0.108;-;2;0;17;0;2;16;0.12;0;United States;Northern America;;;"Biotechnology; Chemical Engineering (miscellaneous); Safety, Risk, Reliability and Quality"
709;21100827173;Proceedings - 2015 IEEE IAS Joint Industrial and Commercial Power Systems / Petroleum and Chemical Industry Conference, ICPSPCIC 2015;conference and proceedings;-;0.108;-;3;0;41;0;8;39;0;0;United States;Northern America;;;"Electrical and Electronic Engineering; Energy Engineering and Power Technology; Fuel Technology; Process Chemistry and Technology"
710;21100922941;Proceedings - 2018 5th International Conference on Mathematics and Computers in Sciences and Industry, MCSI 2018;conference and proceedings;-;0.108;-;3;0;35;0;9;33;0.26;0;United States;Northern America;;;"Civil and Structural Engineering; Computational Mathematics; Computer Networks and Communications; Computer Science Applications; Electrical and Electronic Engineering; Fluid Flow and Transfer Processes; Safety, Risk, Reliability and Quality; Strategy and Management"
711;21100826686;Process Intensification 2017 - Topical Conference at the 2017 AIChE Spring Meeting and 13th Global Congress on Process Safety;conference and proceedings;-;0.108;-;0;0;4;0;0;3;0;0;United States;Northern America;;;"Environmental Chemistry; Process Chemistry and Technology"
712;21100225815;RSC Polymer Chemistry Series;book series;20440804, 20440790;0.108;Q4;10;28;127;2116;50;3;0.46;75.57;United Kingdom;Western Europe;Royal Society of Chemistry;2011-2012, 2014-2021;"Bioengineering (Q4); Biomaterials (Q4); Biotechnology (Q4); Polymers and Plastics (Q4)"
713;21100845610;2017 Fall Technical Meeting of the Western States Section of the Combustion Institute, WSSCI 2017;conference and proceedings;-;0.107;-;2;0;83;0;1;82;0;0;United States;Northern America;;;"Chemical Engineering (miscellaneous); Mechanical Engineering; Physical and Theoretical Chemistry"
714;21100821143;AATCC 2017 - 2017 AATCC International Conference Proceedings;conference and proceedings;-;0.107;-;1;0;37;0;3;36;0;0;United States;Northern America;;;"Catalysis; Process Chemistry and Technology"
715;15286;AATCC Review;trade journal;15328813, 23305525;0.107;Q4;29;8;60;84;5;60;0.03;10.5;United States;Northern America;American Association of Textile Chemists and Colorists;2001-2020;"Chemical Engineering (miscellaneous) (Q4); Chemistry (miscellaneous) (Q4); Materials Science (miscellaneous) (Q4)"
716;21100780806;Advanced Materials - TechConnect Briefs 2016;conference and proceedings;-;0.107;-;5;0;190;0;16;187;0;0;United States;Northern America;;;"Biotechnology; Fluid Flow and Transfer Processes; Fuel Technology; Surfaces, Coatings and Films"
717;21456;Chinese Journal of Biomedical Engineering;journal;02588021;0.107;Q4;13;94;297;2622;47;297;0.18;27.89;China;Asiatic Region;Chinese Academy of Medical Sciences;1984-2021;"Bioengineering (Q4); Biomedical Engineering (Q4); Medicine (miscellaneous) (Q4)"
718;21100876931;Computing and Systems Technology Division 2017 - Core Programming Area at the 2017 AIChE Annual Meeting;conference and proceedings;-;0.107;-;1;0;17;0;2;16;0;0;United States;Northern America;;;"Chemical Engineering (miscellaneous); Computer Science (miscellaneous); Control and Systems Engineering"
719;21100826262;Spring Meeting Poster Session and Networking Reception 2017 - Core Programming Area at the 2017 AIChE Spring Meeting and 13th Global Congress on Process Safety;conference and proceedings;-;0.107;-;1;0;8;0;1;7;0;0;United States;Northern America;;;"Chemical Health and Safety; Safety Research; Safety, Risk, Reliability and Quality"
720;21100942310;2018 4th IEEE International Conference on Emerging Electronics, ICEE 2018;conference and proceedings;-;0.106;-;0;0;5;0;0;4;0;0;United States;Northern America;;;"Electrical and Electronic Engineering; Electronic, Optical and Magnetic Materials; Process Chemistry and Technology"
721;21100875756;73rd Society of Tribologists and Lubrication Engineers Annual Meeting and Exhibition 2018;conference and proceedings;-;0.106;-;2;0;68;0;2;67;0.03;0;United States;Northern America;;;"Colloid and Surface Chemistry; Materials Chemistry; Process Chemistry and Technology; Surfaces and Interfaces; Surfaces, Coatings and Films"
722;21100900338;Computing and Systems Technology Division 2018 - Core Programming Area at the 2018 AIChE Annual Meeting;conference and proceedings;-;0.106;-;0;0;5;0;0;4;0;0;United States;Northern America;;;"Chemical Engineering (miscellaneous); Computer Science (miscellaneous); Control and Systems Engineering"
723;21100928094;Environmental Division 2019, Held at the 2019 AIChE Spring Meeting and 15th Global Congress on Process Safety;conference and proceedings;-;0.106;-;0;0;5;0;0;4;0;0;United States;Northern America;;;"Chemical Engineering (miscellaneous); Engineering (miscellaneous); Environmental Science (miscellaneous)"
724;21100903404;ESIT 2018 - 3rd International Conference on Engineering Science and Innovative Technology, Proceedings;conference and proceedings;-;0.106;-;3;0;36;0;10;35;0.28;0;United States;Northern America;;;"Biomaterials; Civil and Structural Engineering; Computer Networks and Communications; Electronic, Optical and Magnetic Materials; Fluid Flow and Transfer Processes; Hardware and Architecture; Mechanical Engineering; Metals and Alloys"
725;12934;Explosion;journal;0916801X;0.106;Q4;3;1;5;2;0;4;0;2;Japan;Asiatic Region;Japan Explosives Society;1996-2016, 2019-2020;Chemical Engineering (miscellaneous) (Q4)
726;16056;International Journal of Biotechnology;journal;17415020, 09636048;0.106;Q4;21;0;4;0;1;4;0;0;United Kingdom;Western Europe;Inderscience Enterprises Ltd.;1999-2017;"Bioengineering (Q4); Management of Technology and Innovation (Q4)"
727;32541;Manuals and Reports on Engineering Practice, American Society of Civil Engineers;book series;07347685;0.106;Q4;10;0;4;0;0;4;0;0;United States;Northern America;American Society of Civil Engineers (ASCE);1969-1970, 1972, 1975-1976, 1980, 1983-1987, 1990-2001, 2003-2006, 2009-2018;"Chemical Engineering (miscellaneous) (Q4); Strategy and Management (Q4); Water Science and Technology (Q4)"
728;21100468984;Medical Science Technology;journal;23290072;0.106;Q4;3;0;24;0;3;23;0.25;0;United States;Northern America;International Scientific Information, Inc.;2013, 2015-2018;"Bioengineering (Q4); Biomedical Engineering (Q4); Medicine (miscellaneous) (Q4); Psychology (miscellaneous) (Q4)"
729;21100900339;Nuclear Engineering Division 2018 - Core Programming Area at the 2018 AIChE Annual Meeting;conference and proceedings;-;0.106;-;1;0;5;0;1;4;0.2;0;United States;Northern America;;;"Chemical Engineering (miscellaneous); Engineering (miscellaneous); Management of Technology and Innovation"
730;19460;Shi You Lian Zhi Yu Hua Gong/Petroleum Processing and Petrochemicals;journal;10052399;0.106;Q4;14;221;682;2958;37;679;0.05;13.38;China;Asiatic Region;Research Institute of Petroleum Processing, SINOPEC;1996-2021;"Energy Engineering and Power Technology (Q4); Fuel Technology (Q4); Process Chemistry and Technology (Q4)"
731;144795;Speciality Petrochemicals;journal;10039384;0.106;Q4;5;98;309;1803;22;309;0.04;18.4;China;Asiatic Region;SINOPEC - China Petro-Chemical Corporation;2005-2021;"Chemical Engineering (miscellaneous) (Q4); Chemistry (miscellaneous) (Q4); Energy Engineering and Power Technology (Q4); Fuel Technology (Q4)"
732;21100826329;Computing and Systems Technology Division 2017 - Core Programming Area at the 2017 AIChE Spring Meeting and 13th Global Congress on Process Safety;conference and proceedings;-;0.105;-;0;0;6;0;0;5;0;0;United States;Northern America;;;"Chemical Engineering (miscellaneous); Computer Science (miscellaneous); Control and Systems Engineering"
733;21100900375;Education Division 2018 - Core Programming Area at the 2018 AIChE Annual Meeting;conference and proceedings;-;0.105;-;0;0;6;0;0;5;0;0;United States;Northern America;;;"Chemical Engineering (miscellaneous); Education; Engineering (miscellaneous)"
734;24081;Huaxue Fanying Gongcheng Yu Gongyi/Chemical Reaction Engineering and Technology;journal;10017631;0.105;Q4;10;72;228;1371;18;228;0.09;19.04;China;Asiatic Region;Zhejiang University Press;1985-1989, 1996-2021;"Chemical Engineering (miscellaneous) (Q4); Chemistry (miscellaneous) (Q4)"
735;14457;International Journal of the Society of Materials Engineering for Resources;journal;18846629, 13479725;0.105;Q4;11;5;46;100;5;46;0.11;20;Japan;Asiatic Region;Society of Materials Engineering for Resources of Japan;1993-2007, 2009-2014, 2016-2018, 2020;"Chemical Engineering (miscellaneous) (Q4); Materials Science (miscellaneous) (Q4); Mechanical Engineering (Q4)"
736;15191;O Papel (Brazil);trade journal;00311057;0.105;Q4;12;0;240;0;9;236;0.02;0;Brazil;Latin America;Assoc. Tecnica Brasileira de Celulose e Papel;1996-2018;"Media Technology (Q3); Chemical Engineering (miscellaneous) (Q4); Chemistry (miscellaneous) (Q4); Industrial and Manufacturing Engineering (Q4); Materials Science (miscellaneous) (Q4)"
737;21100838539;Textile Bioengineering and Informatics Symposium Proceedings 2017 - 10th Textile Bioengineering and Informatics Symposium, TBIS 2017;conference and proceedings;-;0.105;-;2;0;185;0;9;182;0;0;Hong Kong;Asiatic Region;;;"Bioengineering; Biomaterials"
738;21100892784;8th World Congress on Particle Technology 2018: Keynotes and Plenaries;conference and proceedings;-;0.104;-;0;0;7;0;0;6;0;0;United States;Northern America;;;"Biotechnology; Chemical Engineering (miscellaneous); Safety, Risk, Reliability and Quality"
739;21100892787;Combustible Dust Safety 2018 - Topical at the 8th World Congress on Particle Technology;conference and proceedings;-;0.104;-;0;0;7;0;0;6;0;0;United States;Northern America;;;"Biotechnology; Chemical Engineering (miscellaneous); Safety, Risk, Reliability and Quality"
740;14695;Converter;trade journal;00108189;0.104;Q4;1;0;6;0;0;6;0;0;United Kingdom;Western Europe;Faversham House Group Ltd;1998, 2000-2018;"Chemical Engineering (miscellaneous) (Q4); Industrial and Manufacturing Engineering (Q4); Materials Science (miscellaneous) (Q4)"
741;21100900299;Environmental Division 2018 - Core Programming Area at the 2018 AIChE Annual Meeting;conference and proceedings;-;0.104;-;2;0;27;0;4;26;0.15;0;United States;Northern America;;;"Chemical Engineering (miscellaneous); Engineering (miscellaneous); Environmental Science (miscellaneous)"
742;21100864448;Food, Pharmaceutical and Bioengineering Division 2017 - Core Programming Area at the 2017 AIChE Annual Meeting;conference and proceedings;-;0.104;-;1;0;45;0;1;43;0;0;United States;Northern America;;;"Chemical Engineering (miscellaneous); Engineering (miscellaneous); Food Science"
743;21100843120;International Conferences on Transport and Sedimentation of Solid Particles;conference and proceedings;12323071;0.104;-;3;0;95;0;14;91;0.14;0;Poland;Eastern Europe;;;"Environmental Engineering; Fluid Flow and Transfer Processes; Pollution; Waste Management and Disposal; Water Science and Technology"
744;21100903039;International Symposium on Advances in Computational Heat Transfer;conference and proceedings;25785486;0.104;-;9;0;214;0;11;213;0;0;United States;Northern America;;;"Computer Science Applications; Condensed Matter Physics; Fluid Flow and Transfer Processes; Mechanical Engineering"
745;16538;Journal of Fiber Science and Technology;journal;21897654, 00379875;0.104;Q4;20;117;369;1867;23;315;0.09;15.96;Japan;Asiatic Region;Society of Fiber Science and Technology;1946-1948, 1951, 1954-2021;"Chemical Engineering (miscellaneous) (Q4); Industrial and Manufacturing Engineering (Q4); Materials Science (miscellaneous) (Q4); Polymers and Plastics (Q4)"
746;24755;Lizi Jiaohuan Yu Xifu/Ion Exchange and Adsorption;journal;10015493;0.104;Q4;8;58;174;1287;9;174;0.05;22.19;China;Asiatic Region;;1987-1995, 1998, 2001-2020;"Chemical Engineering (miscellaneous) (Q4); Chemistry (miscellaneous) (Q4); Materials Science (miscellaneous) (Q4)"
747;21100923711;Ochrona Przed Korozja;journal;24499501, 04737733;0.104;Q4;2;67;73;723;3;51;0.04;10.79;Poland;Eastern Europe;Wydawnictwo SIGMA - N O T Sp. z o.o.;2019-2021;"Chemical Engineering (miscellaneous) (Q4); Materials Chemistry (Q4); Metals and Alloys (Q4); Surfaces, Coatings and Films (Q4)"
748;21100892785;Particle Design 2018 - Topical at the 8th World Congress on Particle Technology;conference and proceedings;-;0.104;-;0;0;7;0;0;6;0;0;United States;Northern America;;;"Biotechnology; Chemical Engineering (miscellaneous); Safety, Risk, Reliability and Quality"
749;21100958158;Proceedings of the 2019 IEEE Regional Symposium on Micro and Nanoelectronics, RSM 2019;conference and proceedings;-;0.104;-;3;0;41;0;8;40;0.2;0;United States;Northern America;;;"Electrical and Electronic Engineering; Electronic, Optical and Magnetic Materials; Process Chemistry and Technology"
