Rank;Sourceid;Title;Type;Issn;SJR;SJR Best Quartile;H index;Total Docs. (2017);Total Docs. (3years);Total Refs.;Total Cites (3years);Citable Docs. (3years);Cites / Doc. (2years);Ref. / Doc.;Country;Region;Publisher;Coverage;Categories
911;25766;Environmental and Engineering Geoscience;journal;10787275;0.238;Q3;35;18;68;723;32;68;0.32;40.17;United States;Northern America;Geological Society of America;1995-2021;"Earth and Planetary Sciences (miscellaneous) (Q3); Environmental Engineering (Q3); Geotechnical Engineering and Engineering Geology (Q3)"
912;21100814045;Journal of Human Rights and the Environment;journal;17597188, 17597196;0.238;Q3;9;14;11;523;15;9;1.36;37.36;United Kingdom;Western Europe;Edward Elgar Publishing Ltd.;2016-2021;"Law (Q3); Management, Monitoring, Policy and Law (Q3); Sociology and Political Science (Q3)"
913;19700186837;Coke and Chemistry;journal;1068364X, 19348398;0.237;Q4;14;79;267;1223;109;267;0.45;15.48;United States;Northern America;Pleiades Publishing;2009-2021;"Fuel Technology (Q3); Process Chemistry and Technology (Q3); Environmental Chemistry (Q4)"
914;19900193617;Proceedings of the National Academy of Sciences India Section B - Biological Sciences;journal;03698211, 22501746;0.237;Q3;22;161;371;6087;262;371;0.64;37.81;India;Asiatic Region;Springer India;2008-2021;"Agricultural and Biological Sciences (miscellaneous) (Q3); Environmental Science (miscellaneous) (Q3)"
915;101730;Rudarsko Geolosko Naftni Zbornik;journal;03534529, 18490409;0.237;Q3;13;27;46;628;18;44;0.36;23.26;Croatia;Eastern Europe;University of Zagreb;1994-2021;"Energy (miscellaneous) (Q3); Geotechnical Engineering and Engineering Geology (Q3); Water Science and Technology (Q3); Geology (Q4)"
916;21100797854;Advances in Natural and Technological Hazards Research;book series;22136959, 18789897;0.236;Q3;21;50;314;938;212;1;0.53;18.76;Netherlands;Western Europe;Springer International Publishing AG;2005, 2007, 2009-2011, 2013-2019;"Economic Geology (Q3); Geography, Planning and Development (Q3); Management, Monitoring, Policy and Law (Q3); Computers in Earth Sciences (Q4); Global and Planetary Change (Q4)"
917;21100239824;Journal for the Study of Religion, Nature and Culture;journal;17494915, 17494907;0.236;Q3;9;25;79;1221;43;70;0.54;48.84;United Kingdom;Western Europe;Equinox Publishing Ltd;2013-2021;"Religious Studies (Q1); Cultural Studies (Q2); Ecology (Q3); Ecology, Evolution, Behavior and Systematics (Q4)"
918;5600155441;Ambiente e Sociedade;journal;1414753X;0.235;Q3;21;57;169;2480;84;158;0.38;43.51;Brazil;Latin America;Universidade Estadual de Campinas;2006-2021;"Environmental Science (miscellaneous) (Q3); Social Sciences (miscellaneous) (Q3)"
919;22594;Chinese Journal of Applied Ecology;journal;10019332;0.235;Q3;44;482;1447;18918;1171;1447;0.79;39.25;China;Asiatic Region;Editorial Board of Chinese Journal of Applied Ecology;1991-2021;"Ecology (Q3); Medicine (miscellaneous) (Q3); Ecology, Evolution, Behavior and Systematics (Q4)"
920;21100812868;Evergreen;journal;21890420;0.235;Q3;15;24;48;519;31;43;0.66;21.63;Japan;Asiatic Region;Joint Journal of Novel Carbon Resource Sciences and Green Asia Strategy;2014-2021;"Ceramics and Composites (Q3); Management, Monitoring, Policy and Law (Q3); Surfaces, Coatings and Films (Q3); Electronic, Optical and Magnetic Materials (Q4)"
921;23285;Natures Sciences Societes;journal;12401307, 17652979;0.235;Q3;19;53;120;1251;42;97;0.35;23.6;France;Western Europe;EDP Sciences;1995-2021;"Multidisciplinary (Q2); Agricultural and Biological Sciences (miscellaneous) (Q3); Biochemistry, Genetics and Molecular Biology (miscellaneous) (Q3); Earth and Planetary Sciences (miscellaneous) (Q3); Environmental Science (miscellaneous) (Q3); Social Sciences (miscellaneous) (Q3)"
922;21100298656;RSC Green Chemistry;book series;17577047, 17577039;0.235;Q3;18;12;228;674;122;95;0.56;56.17;United Kingdom;Western Europe;Royal Society of Chemistry;2008-2021;"Management, Monitoring, Policy and Law (Q3); Pollution (Q3); Biochemistry (Q4); Environmental Chemistry (Q4)"
923;26338;Bauphysik;trade journal;14370980, 01715445;0.234;Q3;10;52;151;926;31;131;0.19;17.81;United Kingdom;Western Europe;John Wiley and Sons Ltd;1982, 1984, 1987, 2011-2021;"Architecture (Q2); Building and Construction (Q3); Environmental Engineering (Q3)"
924;15601;Gayana - Botanica;journal;00165301, 07176643;0.234;Q3;17;33;116;1284;56;113;0.43;38.91;Chile;Latin America;Universidad de Concepcion;1981-1982, 1984, 2002-2020;"Ecology (Q3); Horticulture (Q3); Plant Science (Q3)"
925;23945;Gefahrstoffe Reinhaltung der Luft;journal;09498036;0.234;Q3;19;98;258;1336;63;216;0.22;13.63;Germany;Western Europe;"VDI Fachmedien GmBbH &amp; Co.";1996-2021;"Management, Monitoring, Policy and Law (Q3); Pollution (Q3); Health, Toxicology and Mutagenesis (Q4)"
926;21100815415;Colombia Forestal;journal;01200739, 2256201X;0.233;Q3;5;15;15;596;8;15;0.53;39.73;Colombia;Latin America;Universidad Distrital Francisco Jose de Caldas;2016-2021;"Forestry (Q3); Nature and Landscape Conservation (Q3); Soil Science (Q3)"
927;15600154705;EnvironmentAsia;journal;19061714;0.233;Q3;19;33;95;1013;61;95;0.63;30.7;Thailand;Asiatic Region;Thai Society of Higher Eduation Institutes on Environment;2009-2021;"Environmental Science (miscellaneous) (Q3); Toxicology (Q4)"
928;21100788478;Frontiers of Biogeography;journal;19486596;0.233;Q3;11;15;32;507;27;20;0.84;33.8;United States;Northern America;eScholarship University of California;2016-2021;"Ecology (Q3); Ecology, Evolution, Behavior and Systematics (Q4); Global and Planetary Change (Q4)"
929;24302;Unasylva;journal;00416436;0.233;Q3;32;11;69;215;41;64;0.75;19.55;Italy;Western Europe;Food and Agriculture Organization of the United Nations;1977-1988, 1990, 1995-2018;"Ecology (Q3); Forestry (Q3); Geography, Planning and Development (Q3)"
930;14520;Vie et Milieu;journal;02408759;0.232;Q3;35;22;69;1065;40;68;0.54;48.41;France;Western Europe;Universite de Paris VI (Pierre et Marie Curie);1980-1987, 1989-2020;"Ecology (Q3); Aquatic Science (Q4)"
931;22650;Huanjing Kexue/Environmental Science;journal;02503301;0.231;Q3;38;626;1857;20575;1684;1857;0.92;32.87;China;Asiatic Region;Science Press;1986, 1988-1989, 1998-2021;Environmental Science (miscellaneous) (Q3)
932;19900193629;International Journal Bioautomation;journal;13142321, 13141902;0.231;Q4;14;30;134;871;77;134;0.63;29.03;Bulgaria;Eastern Europe;Institute of Biophysics and Biomedical Engineering at the Bulgarian Academy of Sciences;2011-2021;"Biotechnology (Q3); Food Science (Q3); Biochemistry (Q4); Ecological Modeling (Q4); Genetics (Q4)"
933;21100274232;ISH Journal of Hydraulic Engineering;journal;09715010, 21643040;0.23;Q3;19;39;104;1168;66;94;0.65;29.95;United Kingdom;Western Europe;Taylor and Francis Ltd.;1995-2021;"Civil and Structural Engineering (Q3); Fluid Flow and Transfer Processes (Q3); Water Science and Technology (Q3); Environmental Engineering (Q4)"
934;19700174747;Journal of Green Building;journal;19434618, 15526100;0.23;Q3;24;37;124;962;70;117;0.53;26;United States;Northern America;College Publishing;2006-2021;"Environmental Science (miscellaneous) (Q3); Geography, Planning and Development (Q3)"
935;27636;Cartographic Perspectives;journal;10489053;0.229;Q3;14;16;50;221;18;25;0.13;13.81;United States;Northern America;NACIS (North American Cartographic Information Society);1990-1992, 2005-2020;"Earth and Planetary Sciences (miscellaneous) (Q3); Environmental Science (miscellaneous) (Q3)"
936;21100345620;CAS-CERN Accelerator School: Superconductivity for Accelerators - Proceedings;conference and proceedings;-;0.229;-;5;0;25;0;11;23;0;0;Swaziland;Africa;;;"Atomic and Molecular Physics, and Optics; Computer Science Applications; Condensed Matter Physics; Environmental Engineering; Fuel Technology; Geotechnical Engineering and Engineering Geology; Instrumentation"
937;21100218390;Journal of Environmental Engineering (Japan);journal;1881817X, 13480685;0.229;Q4;9;109;375;847;57;375;0.16;7.77;Japan;Asiatic Region;Architectural Institute of Japan;2008-2021;Environmental Engineering (Q4)
938;21100435556;Regional Science Policy and Practice;journal;17577802;0.229;Q3;12;18;23;782;23;23;1;43.44;United States;Northern America;"John Wiley &amp; Sons Inc.";2015-2021;"Development (Q3); Geography, Planning and Development (Q3); Management, Monitoring, Policy and Law (Q3)"
939;4700152640;Austrian Journal of Forest Science;journal;03795292;0.228;Q3;14;34;35;1428;29;35;0.9;42;Austria;Western Europe;Osterreichischer Agrarverlag GmbH;2006-2021;"Ecology (Q3); Forestry (Q3); Management, Monitoring, Policy and Law (Q3); Nature and Landscape Conservation (Q3); Ecology, Evolution, Behavior and Systematics (Q4)"
940;14200154728;International Journal of Design and Nature and Ecodynamics;journal;17557445, 17557437;0.228;Q3;15;46;123;996;64;123;0.48;21.65;United Kingdom;Western Europe;International Information and Engineering Technology Association;2008-2021;"Engineering (miscellaneous) (Q2); Agricultural and Biological Sciences (miscellaneous) (Q3); Environmental Science (miscellaneous) (Q3)"
941;23368;Journal of Environmental Health;journal;00220892;0.228;Q3;36;58;292;610;149;228;0.48;10.52;United States;Northern America;National Environmental Health Association;1973-2021;"Management, Monitoring, Policy and Law (Q3); Medicine (miscellaneous) (Q3); Public Health, Environmental and Occupational Health (Q3); Health, Toxicology and Mutagenesis (Q4)"
942;21100201909;Ecological Chemistry and Engineering S;journal;18986196;0.227;Q4;24;42;140;1615;128;140;0.81;38.45;Germany;Western Europe;De Gruyter Open Ltd.;2008-2021;"Environmental Chemistry (Q4); Environmental Engineering (Q4)"
943;11700154508;Ethics in Science and Environmental Politics;journal;16118014;0.227;Q3;19;7;24;424;21;24;0.71;60.57;Germany;Western Europe;Inter-Research;2001-2021;"Philosophy (Q2); Ecology (Q3); Education (Q3); Management, Monitoring, Policy and Law (Q3); Sociology and Political Science (Q3)"
944;21100241737;International Journal of Law in the Built Environment;journal;17561469, 17561450;0.227;Q3;0;0;0;0;0;0;0;0;United Kingdom;Western Europe;Emerald Group Publishing Ltd.;2009-2017;"Urban Studies (Q2); Law (Q3); Management, Monitoring, Policy and Law (Q3)"
945;17390;Soil Mechanics and Foundation Engineering;journal;00380741, 15739279;0.227;Q3;17;69;169;1031;77;169;0.45;14.94;United States;Northern America;Springer New York;1964-2021;"Energy (miscellaneous) (Q3); Geotechnical Engineering and Engineering Geology (Q3); Ocean Engineering (Q3); Soil Science (Q3); Water Science and Technology (Q3)"
946;12453;Acta Biologica Hungarica;journal;1588256X, 02365383;0.226;Q3;0;0;0;0;0;0;0;0;Hungary;Eastern Europe;Akademiai Kiado;1983-2018;"Biochemistry, Genetics and Molecular Biology (miscellaneous) (Q3); Environmental Science (miscellaneous) (Q3); Neurology (Q4)"
947;17839;Conservation Science Western Australia;journal;14473682;0.226;Q3;22;1;17;62;6;16;0.42;62;Australia;Pacific Region;Science Division, Department of Environment and Conservation;2002, 2004, 2006-2017;"Nature and Landscape Conservation (Q3); Management, Monitoring, Policy and Law (Q4)"
948;21100852990;Cryosphere Discussions;journal;19940432, 19940440;0.226;Q3;4;0;28;0;6;28;0.22;0;Germany;Western Europe;Copernicus GmbH;2014-2016;"Earth-Surface Processes (Q3); Water Science and Technology (Q3)"
949;17700156220;International Journal of Ecology and Development (discontinued);journal;09729984, 09737308;0.226;Q3;13;52;88;1267;52;88;0.63;24.37;India;Asiatic Region;Indian Society for Development and Environment Research;2009-2017;"Development (Q3); Ecology (Q3); Ecology, Evolution, Behavior and Systematics (Q4)"
950;21100267005;Advances in Science and Technology of Water Resources;journal;10067647;0.225;Q3;11;93;335;1842;99;335;0.35;19.81;China;Asiatic Region;shui li shui dian ke ji jin zhan bian ji bu;2013-2021;Water Science and Technology (Q3)
951;13770;Memoranda - Societatis pro Fauna et Flora Fennica (discontinued);journal;03736873;0.225;Q3;12;6;45;409;15;45;0.32;68.17;Finland;Western Europe;Societas pro Fauna et Flora Fennica;1988-2018;"Ecology (Q3); Ecology, Evolution, Behavior and Systematics (Q4)"
952;21100220432;Asian Journal of Atmospheric Environment;journal;19766912, 22871160;0.224;Q3;19;30;76;1119;53;76;0.73;37.3;South Korea;Asiatic Region;Korean Society for Atmospheric Environment;2007-2021;"Environmental Science (miscellaneous) (Q3); Atmospheric Science (Q4)"
953;5300152518;Ethnobotany Research and Applications;journal;15473465;0.224;Q3;29;1;85;0;67;82;0.73;0;United States;Northern America;University of Hawaii Press;2007-2021;"Nature and Landscape Conservation (Q3); Plant Science (Q3)"
954;29490;IAHS-AISH Proceedings and Reports;conference and proceedings;01447815;0.224;-;42;0;540;0;213;520;0.42;0;United Kingdom;Western Europe;;;"Earth and Planetary Sciences (miscellaneous); Oceanography; Water Science and Technology"
955;21100246533;Journal of Ecological Engineering;journal;22998993, 2081139X;0.224;Q3;22;175;354;3872;253;354;0.7;22.13;Poland;Eastern Europe;Polskie Towarzystwo Inzynierii Ekologicznej;2013-2021;"Environmental Science (miscellaneous) (Q3); Ecology, Evolution, Behavior and Systematics (Q4)"
956;21100208039;International Journal of Urban Sustainable Development;journal;19463138, 19463146;0.223;Q4;18;23;44;1335;37;43;1;58.04;United Kingdom;Western Europe;Taylor and Francis Ltd.;2010-2021;"Urban Studies (Q2); Development (Q3); Geography, Planning and Development (Q3); Management, Monitoring, Policy and Law (Q4)"
957;19400158702;Water History;journal;18777236, 18777244;0.22;Q3;10;0;1;0;2;1;0;0;Netherlands;Western Europe;Springer Netherlands;2009-2012, 2014;"History (Q1); Geography, Planning and Development (Q3); Water Science and Technology (Q3)"
958;21100806944;Botanica Pacifica;journal;24103713, 22264701;0.218;Q3;7;16;16;575;8;16;0.5;35.94;Russian Federation;Eastern Europe;Botanical Garden-Institute;2016-2021;"Ecology (Q3); Plant Science (Q3); Ecology, Evolution, Behavior and Systematics (Q4)"
959;4700152869;Engenharia Sanitaria e Ambiental;journal;14134152;0.218;Q3;20;121;219;3763;114;217;0.37;31.1;Brazil;Latin America;ABES - Associacao Brasileira de Engenharia Sanitaria e Ambiental;2006-2021;Waste Management and Disposal (Q3)
960;19400158588;Revista Chapingo, Serie Ciencias Forestales y del Ambiente;journal;20073828, 01863231, 20074018;0.218;Q3;11;27;84;920;49;83;0.56;34.07;Mexico;Latin America;Universidad Autonoma Chapingo;2008, 2012-2021;"Ecology (Q3); Forestry (Q3)"
961;5400152617;American Journal of Environmental Sciences (discontinued);journal;1553345X;0.217;Q3;33;0;144;0;101;144;0.45;0;United States;Northern America;Science Publications;2007-2016;"Ecology (Q3); Pollution (Q3)"
962;15169;Hydrobiological Journal;journal;03758990, 00188166;0.217;Q3;12;60;178;1452;48;178;0.31;24.2;United States;Northern America;Begell House Inc.;1974-1976, 1978-1983, 1987-2021;"Ecology (Q3); Water Science and Technology (Q3); Aquatic Science (Q4)"
963;21100421904;Sustainable Human-Building Ecosystems - Selected Papers from the 1st International Symposium on Sustainable Human-Building Ecosystems;conference and proceedings;-;0.217;-;5;0;27;0;11;25;0.41;0;United States;Northern America;;;Modeling and Simulation
964;12100155635;Anuario do Instituto de Geociencias;journal;19823908, 01019759;0.216;Q3;14;96;105;3137;30;105;0.24;32.68;Brazil;Latin America;Universidade Federal do Rio de Janeiro - UFRJ;2004-2021;"Development (Q3); Economic Geology (Q3); Environmental Science (miscellaneous) (Q3); Geography, Planning and Development (Q3); Geology (Q4)"
965;15695;Ecology Law Quarterly;journal;00461121;0.215;Q3;26;49;65;3945;33;65;0.69;80.51;United States;Northern America;University of California, Berkeley Law;1973, 1978-1987, 1996, 1999-2021;"Environmental Science (miscellaneous) (Q3); Law (Q3)"
966;23996;International Journal of Environment and Pollution;journal;09574352, 17415101;0.215;Q3;47;47;133;1354;83;129;0.6;28.81;United Kingdom;Western Europe;Inderscience Enterprises Ltd.;1991-2020;"Pollution (Q3); Waste Management and Disposal (Q3); Management, Monitoring, Policy and Law (Q4)"
967;31273;Memoirs of the Queensland Museum;journal;00798835;0.215;Q3;35;9;18;209;8;16;0.57;23.22;Australia;Pacific Region;Queensland Museum;1987-2009, 2011-2021;"Ecology (Q3); Paleontology (Q3)"
968;24564;Water Quality Research Journal of Canada;journal;12013080, 24089443;0.215;Q3;0;0;0;0;0;0;0;0;Canada;Northern America;IWA Publishing;1995-2016;Water Science and Technology (Q3)
969;22550;Web Ecology;journal;21933081, 13991183;0.215;Q3;19;9;43;426;32;37;0.73;47.33;Germany;Western Europe;Copernicus GmbH;2000-2003, 2005-2021;"Ecology (Q3); Ecology, Evolution, Behavior and Systematics (Q4)"
970;19900192585;Air, Soil and Water Research;journal;11786221;0.214;Q3;14;16;35;531;31;35;0.83;33.19;United States;Northern America;SAGE Publications Inc.;2008-2021;Environmental Science (miscellaneous) (Q3)
971;21100370022;Regional Research of Russia;journal;20799713, 20799705;0.213;-;12;40;130;728;53;130;0.44;18.2;United States;Northern America;Pleiades Publishing;2011-2021;"Earth and Planetary Sciences (miscellaneous) (Q3); Geography, Planning and Development (Q3)"
972;21100463829;Chinese Journal of Population Resources and Environment;journal;23254262, 10042857;0.212;Q3;14;42;81;1070;52;81;0.64;25.48;United Kingdom;Western Europe;Taylor and Francis Ltd.;1992, 2004-2013, 2015-2019;"Demography (Q3); Environmental Science (miscellaneous) (Q3); Toxicology (Q4)"
973;14607;Ekologia Bratislava;journal;1337947X, 1335342X;0.211;Q3;22;30;101;1147;57;101;0.74;38.23;Slovakia;Eastern Europe;De Gruyter Open Ltd.;1993-1994, 1996-2021;Ecology (Q3)
974;23474;Environmental Ethics;journal;01634275;0.211;Q3;31;17;75;833;36;71;0.47;49;United States;Northern America;Environmental Philosophy Inc;1979-1981, 1984, 1988, 1990, 1996-2021;"Philosophy (Q2); Environmental Science (miscellaneous) (Q3)"
975;21100226810;Journal of Hohai University;journal;10001980;0.211;Q3;11;81;284;1693;100;284;0.34;20.9;China;Asiatic Region;Editorial Board of Journal of Hohai University;2012-2021;"Earth and Planetary Sciences (miscellaneous) (Q3); Water Science and Technology (Q3)"
976;21100812113;Journal of Rangeland Science;journal;2423642X, 20089996;0.211;Q3;7;36;35;1150;15;35;0.43;31.94;Iran;Middle East;Islamic Azad University;2016-2021;"Ecology (Q3); Nature and Landscape Conservation (Q3); Management, Monitoring, Policy and Law (Q4)"
977;21100375904;Open Engineering;journal;23915439;0.211;Q4;28;54;196;1429;152;192;0.59;26.46;Poland;Eastern Europe;De Gruyter Open Ltd.;2015-2021;"Aerospace Engineering (Q3); Civil and Structural Engineering (Q3); Electrical and Electronic Engineering (Q3); Materials Science (miscellaneous) (Q3); Mechanical Engineering (Q3); Environmental Engineering (Q4)"
978;21100413803;Czech Polar Reports;journal;18050689, 18050697;0.21;Q3;8;30;61;856;29;60;0.39;28.53;Czech Republic;Eastern Europe;EMUNI Press;2014-2021;"Agricultural and Biological Sciences (miscellaneous) (Q3); Earth and Planetary Sciences (miscellaneous) (Q3); Environmental Science (miscellaneous) (Q3)"
979;24493;Western North American Naturalist;journal;15270904;0.21;Q3;36;53;150;2329;81;150;0.53;43.94;United States;Northern America;Brigham Young University;2000-2021;"Ecology (Q3); Ecology, Evolution, Behavior and Systematics (Q4)"
980;21100421981;2015 4th IEEE International Conference on Advanced Logistics and Transport, IEEE ICALT 2015;conference and proceedings;-;0.208;-;8;0;60;0;46;58;0.77;0;United States;Northern America;;;"Business and International Management; Management, Monitoring, Policy and Law; Management of Technology and Innovation"
981;21100246540;International Journal of Technology Management and Sustainable Development;journal;14742748, 20400551;0.208;Q4;9;16;46;988;19;45;0.42;61.75;United Kingdom;Western Europe;Intellect Ltd.;2013-2020;"Geography, Planning and Development (Q3); Management, Monitoring, Policy and Law (Q4); Management of Technology and Innovation (Q4)"
982;21100456788;International Journal on Food System Dynamics;journal;18696945;0.208;Q3;19;26;70;1081;40;69;0.6;41.58;Germany;Western Europe;CENTMA Research;2010-2021;"Business and International Management (Q3); Economics, Econometrics and Finance (miscellaneous) (Q3); Environmental Science (miscellaneous) (Q3); Food Science (Q3); Geography, Planning and Development (Q3); Management Science and Operations Research (Q4); Transportation (Q4)"
983;21100415501;Journal of Marine and Island Cultures;journal;22126821;0.207;Q4;15;10;42;358;30;41;0.56;35.8;Netherlands;Western Europe;Institution for Marine and Island Cultures, Mokpo National University;2012-2019, 2021;"Cultural Studies (Q2); Anthropology (Q3); Management, Monitoring, Policy and Law (Q4); Nature and Landscape Conservation (Q4)"
984;16967;Houille Blanche;journal;00186368;0.206;Q3;17;64;198;948;57;197;0.16;14.81;France;Western Europe;EDP Sciences;1902-1914, 1917-1930, 1933-1936, 1946-1963, 1969-2020;Water Science and Technology (Q3)
985;35423;Russian Meteorology and Hydrology;journal;10683739, 19348096;0.206;Q3;19;102;321;2132;149;321;0.46;20.9;United States;Northern America;Pleiades Publishing;1993-2021;"Fluid Flow and Transfer Processes (Q3); Water Science and Technology (Q3); Atmospheric Science (Q4)"
986;23356;Journal of Environmental Engineering and Science;journal;1496256X, 14962551;0.205;Q3;42;12;25;376;10;24;0.4;31.33;United Kingdom;Western Europe;ICE Publishing;2002-2008, 2015-2021;"Environmental Science (miscellaneous) (Q3); Environmental Chemistry (Q4); Environmental Engineering (Q4)"
987;11900154394;Oriental Journal of Chemistry (discontinued);journal;0970020X, 22315039;0.205;Q4;27;396;984;10871;654;984;0.69;27.45;India;Asiatic Region;Bhopal, S.A. Iqbal;1989, 2008-2018, 2021;"Chemistry (miscellaneous) (Q3); Biochemistry (Q4); Drug Discovery (Q4); Environmental Chemistry (Q4)"
988;19400157013;Problemy Ekorozwoju;journal;18956912, 20801971;0.204;Q4;21;33;99;1178;85;94;0.9;35.7;Poland;Eastern Europe;Politechnika Lubelska;2008-2021;"Geography, Planning and Development (Q3); Management, Monitoring, Policy and Law (Q4); Renewable Energy, Sustainability and the Environment (Q4)"
989;144824;Standort;journal;01743635;0.204;-;5;32;89;483;2;74;0.02;15.09;Germany;Western Europe;Springer Verlag;2005-2021;Earth and Planetary Sciences (miscellaneous) (Q3)
990;21100773001;2016 IEEE International Workshop on Electromagnetics, iWEM 2016 - Proceeding;conference and proceedings;-;0.203;-;3;0;6;0;2;5;0.33;0;United States;Northern America;;;"Environmental Engineering; Filtration and Separation; Fluid Flow and Transfer Processes; Process Chemistry and Technology; Waste Management and Disposal"
991;22018;Fresenius Environmental Bulletin (discontinued);journal;10184619;0.203;Q3;41;391;1299;13249;564;1297;0.42;33.88;Germany;Western Europe;Parlar Scientific Publications;1993-2021;"Pollution (Q3); Waste Management and Disposal (Q3); Environmental Chemistry (Q4)"
992;21100812103;Bulletin of the Tomsk Polytechnic University, Geo Assets Engineering;journal;24131830, 25001019;0.202;Q3;13;132;324;3572;98;324;0.3;27.06;Russian Federation;Eastern Europe;Tomsk Polytechnic University;2015-2021;"Economic Geology (Q3); Geotechnical Engineering and Engineering Geology (Q3); Materials Science (miscellaneous) (Q3); Waste Management and Disposal (Q3); Fuel Technology (Q4); Management, Monitoring, Policy and Law (Q4)"
993;21100318731;Climatic Effects on Pavement and Geotechnical Infrastructure - Proceedings of the International Symposium of Climatic Effects on Pavement and Geotechnical Infrastructure 2013;conference and proceedings;-;0.202;-;3;0;9;0;6;7;0;0;United States;Northern America;;;"Building and Construction; Environmental Engineering; Geotechnical Engineering and Engineering Geology"
994;28229;Gigiena i sanitariia;journal;24120650, 00169900;0.201;Q3;15;274;610;4506;194;610;0.23;16.45;Russian Federation;Eastern Europe;F.F. Erisman Federal Research Center for Hygiene;1945-1947, 1950-2021;"Medicine (miscellaneous) (Q3); Pollution (Q3); Health, Toxicology and Mutagenesis (Q4); Public Health, Environmental and Occupational Health (Q4)"
995;145503;Agrociencia;journal;14053195, 25219766;0.2;Q3;24;63;212;2251;93;212;0.32;35.73;Mexico;Latin America;Colegio de Postgraduados;2000-2021;"Agronomy and Crop Science (Q3); Environmental Science (miscellaneous) (Q3); Animal Science and Zoology (Q4); Plant Science (Q4)"
996;21100808409;Arid Ecosystems;journal;20790961, 20790988;0.2;Q3;11;39;115;864;31;115;0.25;22.15;United States;Northern America;Pleiades Publishing;2011-2021;"Ecology (Q3); Ecology, Evolution, Behavior and Systematics (Q4); Global and Planetary Change (Q4); Soil Science (Q4)"
997;23275;International Journal of Sustainable Development;journal;09601406, 17415268;0.2;Q4;28;16;67;800;31;66;0.54;50;United Kingdom;Western Europe;Inderscience Enterprises Ltd.;1999-2021;"Geography, Planning and Development (Q3); Management, Monitoring, Policy and Law (Q4)"
998;11700154346;Developments in Aquaculture and Fisheries Science;book series;01679309;0.198;Q3;30;11;58;3757;42;0;0.72;341.55;Netherlands;Western Europe;Elsevier;1996-1997, 2001-2002, 2004, 2006-2007, 2013, 2015-2017, 2020;"Ecology (Q3); Aquatic Science (Q4); Ecology, Evolution, Behavior and Systematics (Q4)"
999;21100416079;Handbook of Environmental Chemistry;book series;1867979X;0.198;Q3;30;102;319;4379;161;146;0.5;42.93;United States;Northern America;Springer Science + Business Media;1980, 1982, 1984-1986, 1988-1992, 1995, 1998, 2003-2004, 2010, 2012-2021;"Pollution (Q3); Waste Management and Disposal (Q3); Water Science and Technology (Q3); Environmental Chemistry (Q4); Global and Planetary Change (Q4)"
