Rank;Sourceid;Title;Type;Issn;SJR;SJR Best Quartile;H index;Total Docs. (2007);Total Docs. (3years);Total Refs.;Total Cites (3years);Citable Docs. (3years);Cites / Doc. (2years);Ref. / Doc.;Country;Publisher;Coverage;Categories
1914;14803;Sexualities, Evolution and Gender;journal;14792508, 14792516;0.195;Q2;13;0;35;0;20;29;0.81;0.00;United States;Brunner - Routledge (US);2003-2005;"Gender Studies (Q2); Medicine (miscellaneous) (Q3); Psychology (miscellaneous) (Q3)"
1915;53958;Agrekon;journal;03031853, 20780400;0.194;Q3;21;29;87;728;12;87;0.19;25.10;United Kingdom;Taylor & Francis;1962-ongoing;"Agronomy and Crop Science (Q3); Geography, Planning and Development (Q3); Economics and Econometrics (Q4)"
1916;145207;Asia Europe Journal;journal;16102932;0.194;Q3;14;32;89;625;16;84;0.19;19.53;Germany;Springer Verlag;2005-ongoing;"Business, Management and Accounting (miscellaneous) (Q2); Social Sciences (miscellaneous) (Q3)"
1917;5800228211;European Physical Education Review;journal;1356336X, 17412749;0.194;Q3;39;15;41;658;26;41;0.52;43.87;United Kingdom;SAGE Publications;1995-ongoing;"Education (Q3); Orthopedics and Sports Medicine (Q3); Physical Therapy, Sports Therapy and Rehabilitation (Q3); Sports Science (Q4)"
1918;6400153173;Improving Schools;journal;13654802, 14757583;0.194;Q3;17;14;63;402;19;53;0.41;28.71;United Kingdom;SAGE Publications;1998-ongoing;Education (Q3)
1919;33328;International Journal of Special Education;journal;08273383, 19177844;0.194;Q3;20;47;92;1663;28;92;0.3;35.38;Canada;International Journal of Special Education;1995, 2001-2015;"Education (Q3); Rehabilitation (Q3)"
1920;12695;International Review of Education;journal;00208566;0.194;Q3;30;37;88;1087;26;75;0.24;29.38;Netherlands;Kluwer Academic Publishers;1955-ongoing;"Education (Q3); E-learning (Q3)"
1921;12814;Journal of Extension;journal;10775315;0.194;Q3;28;161;510;1398;81;504;0.11;8.68;United States;Extension Journal, Inc.;1976, 1996-ongoing;Education (Q3)
1922;11300153733;Management in Education;journal;08920206;0.194;Q3;13;33;114;495;9;104;0.06;15.00;United States;SAGE Publications;1987-ongoing;"Education (Q3); Strategy and Management (Q3)"
1923;21100203927;Proceedings of the Tenth Conference on Computational Natural Language Learning, CoNLL-X;conference and proceedings;00002006;0.194;-;13;0;38;0;94;37;2.54;0.00;United States;;2006;"Artificial Intelligence; Human-Computer Interaction; Linguistics and Language"
1924;27979;Round Table;journal;00358533;0.194;Q3;21;45;137;929;33;126;0.27;20.64;United Kingdom;Taylor & Francis;1910-1981, 1983-ongoing;Geography, Planning and Development (Q3)
1925;4900152805;Archaeology, Ethnology and Anthropology of Eurasia;journal;15630110;0.193;Q1;13;57;56;2443;8;55;0.15;42.86;Russian Federation;Institute of archaeology and ethnography SB RAS;2006-ongoing;"Cultural Studies (Q1); Archeology (arts and humanities) (Q2)"
1926;29540;Australian Educational Researcher;journal;03116999;0.193;Q3;25;21;51;972;22;49;0.42;46.29;Germany;Springer Verlag;2003-ongoing;Education (Q3)
1927;144818;Collection Building;journal;01604953;0.193;Q3;17;26;68;245;21;64;0.29;9.42;United Kingdom;Emerald Group Publishing Ltd.;1978-ongoing;Library and Information Sciences (Q3)
1928;144745;Educational Research and Evaluation;journal;13803611;0.193;Q3;28;33;57;1363;24;55;0.44;41.30;United Kingdom;Taylor & Francis;1995, 2005-ongoing;Education (Q3)
1929;25817;Journal of Divorce and Remarriage;journal;10502556;0.193;Q2;27;35;114;1478;47;114;0.24;42.23;United States;Haworth Press Inc.;1990-ongoing;"Demography (Q2); Law (Q2)"
1930;5700165138;Law and History Review;journal;07382480;0.193;Q2;24;17;67;2515;40;63;0.44;147.94;United Kingdom;Cambridge University Press;1983-ongoing;"History (Q2); Law (Q2)"
1931;18553;Northwestern University Law Review;journal;00293571;0.193;Q2;39;56;115;7311;35;104;0.34;130.55;United States;Northwestern University;1973, 1977, 1981, 1989-1990, 1992-ongoing;Law (Q2)
1932;5700162095;Cold War History;journal;14682745;0.192;Q2;18;26;61;862;17;61;0.21;33.15;United Kingdom;Routledge;2000-ongoing;"History (Q2); Political Science and International Relations (Q2)"
1933;25953;Dados;journal;00115258;0.192;Q3;22;24;74;856;14;74;0.14;35.67;Brazil;Instituto Universitario de Pesquisas do Rio de Janeiro;1996-ongoing;Social Sciences (miscellaneous) (Q3)
1934;22056;Focus on Exceptional Children;journal;0015511X;0.192;Q3;21;9;4;519;1;4;0.25;57.67;United States;Love Publishing Co;1996-2001, 2006-2012;"Education (Q3); Developmental and Educational Psychology (Q4)"
1935;29128;Historical Geography;journal;10916458;0.192;Q3;15;11;32;1188;11;31;0.35;108.00;United States;Geoscience Publications;1995, 1997-2003, 2005-2010;"History (Q2); Arts and Humanities (miscellaneous) (Q3); Geography, Planning and Development (Q3)"
1936;12027;Japanese Journal of Educational Psychology;journal;00215015;0.192;Q3;14;44;138;1232;20;138;0.13;28.00;Japan;Japanese Association of Education Psychology;1996-ongoing;"Education (Q3); Developmental and Educational Psychology (Q4)"
1937;14792;New Zealand Journal of Educational Studies;journal;00288276;0.192;Q3;14;13;52;409;11;52;0.16;31.46;New Zealand;Springer Singapore;1996-ongoing;Education (Q3)
1938;27207;Social Epistemology;journal;02691728, 14645297;0.192;Q3;24;29;71;1219;23;66;0.25;42.03;United Kingdom;Taylor & Francis;1987-ongoing;"Philosophy (Q2); Social Sciences (miscellaneous) (Q3)"
1939;9500154032;The Journal of legal medicine;journal;01947648, 1521057X;0.192;Q2;17;21;69;2024;26;55;0.38;96.38;United Kingdom;Taylor & Francis;1974-1975, 1979-ongoing;"Law (Q2); Medicine (miscellaneous) (Q3)"
1940;25698;World Affairs;journal;19401582, 00438200;0.192;Q3;12;28;39;473;17;39;0.48;16.89;United States;SAGE Publications Inc.;1988-1990, 1992-ongoing;Social Sciences (miscellaneous) (Q3)
1941;15285;Zeitschrift fr Padagogik;journal;00443247;0.192;Q3;19;72;195;2199;37;192;0.18;30.54;Germany;Julius Beltz GmbH & Co. KG;1996-ongoing;"Education (Q3); Pediatrics, Perinatology and Child Health (Q3)"
1942;130176;Environmental Practice;journal;14660466;0.191;Q3;21;36;98;698;21;74;0.13;19.39;United Kingdom;Cambridge University Press;1999-ongoing;"Geography, Planning and Development (Q3); Management, Monitoring, Policy and Law (Q3)"
1943;15035;Social Work with Groups;journal;01609513, 15409481;0.191;Q3;20;18;101;365;28;90;0.24;20.28;United States;Haworth Press Inc.;1978-ongoing;"Education (Q3); Social Sciences (miscellaneous) (Q3); Social Work (Q3)"
1944;27890;Studi Emigrazione;journal;00392936;0.191;Q3;10;81;148;1803;19;142;0.07;22.26;Italy;Centro Studi Emigrazione;1977-ongoing;"Arts and Humanities (miscellaneous) (Q3); Demography (Q3); Geography, Planning and Development (Q3)"
1945;21100496142;2004 5th Asian Control Conference;conference and proceedings;00002004;0.19;-;11;0;97;0;36;96;0;0.00;United States;;2004;"Language and Linguistics; Linguistics and Language"
1946;4700152647;Advances in Global Leadership;book series;15351203;0.19;Q2;14;0;19;0;3;15;0.2;0.00;United Kingdom;Emerald Group Publishing Ltd.;2001, 2003, 2006, 2009, 2011-ongoing;"Business, Management and Accounting (miscellaneous) (Q2); Political Science and International Relations (Q2)"
1947;19700186953;Enterprise Development and Microfinance;journal;17551978, 17551986;0.19;Q3;15;24;73;127;19;62;0.11;5.29;United Kingdom;Practical Action Publishing;2007-ongoing;"Development (Q3); Geography, Planning and Development (Q3)"
1948;12734;Issues in Educational Research;journal;03137155, 18376290;0.19;Q3;17;16;46;604;14;42;0.29;37.75;Australia;Western Australian Institute for Educational Research Inc.;2002-ongoing;Education (Q3)
1949;5600157642;Public Policy and Administration;journal;09520767, 17494192;0.19;Q3;31;22;88;956;26;80;0.31;43.45;United States;SAGE Publications;1986-ongoing;"Public Administration (Q3); Sociology and Political Science (Q3)"
1950;15284;Stress, Trauma and Crisis;journal;15434613, 15434591;0.19;Q3;11;0;41;0;21;40;0.58;0.00;United States;Brunner - Routledge (US);2004-2006;"Psychology (miscellaneous) (Q3); Social Sciences (miscellaneous) (Q3)"
1951;11300153728;Zeitschrift fr Evidenz, Fortbildung und Qualitat im Gesundheitswesen;journal;18659217;0.19;Q3;26;96;373;1679;108;317;0.26;17.49;Netherlands;Elsevier BV;2008-ongoing;"Education (Q3); Health Policy (Q3); Medicine (miscellaneous) (Q3)"
1952;17700154906;Archeologicke Rozhledy;journal;03231267, 25709151;0.189;Q2;12;35;123;1741;25;115;0.25;49.74;Czech Republic;Archeologicky Ustav Akademie ved Ceske Republiky;2001-ongoing;"Archeology (Q2); Archeology (arts and humanities) (Q2)"
1953;18388;Computers in Education Journal;journal;10693769;0.189;Q3;13;43;145;492;29;145;0.18;11.44;United States;American Society for Engineering Education;1994-2014, 2017-ongoing;"Computer Science (miscellaneous) (Q3); Education (Q3)"
1954;4000149407;JAC: A Journal of Composition Theory;journal;07316755;0.189;Q2;10;22;51;750;10;36;0.28;34.09;United States;Association of Teachers of Advanced Composition;2005-2008, 2010-2014;"Linguistics and Language (Q2); Education (Q3); Social Sciences (miscellaneous) (Q3)"
1955;16170;Journal of African Law;journal;00218553;0.189;Q2;15;11;34;1713;12;34;0.32;155.73;United Kingdom;Cambridge University Press;1957-2000, 2003-ongoing;Law (Q2)
1956;27661;Journal of Black Studies;journal;00219347;0.189;Q1;36;58;135;1959;40;131;0.18;33.78;United States;SAGE Publications;1970-ongoing;"Cultural Studies (Q1); Anthropology (Q3); Sociology and Political Science (Q3)"
1957;4700152757;Journal of Religion and Spirituality in Social Work;journal;15426440, 15426432;0.189;Q3;18;18;64;732;15;58;0.18;40.67;United States;Haworth Press Inc.;2004-ongoing;"Religious Studies (Q1); Public Health, Environmental and Occupational Health (Q3); Social Work (Q3)"
1958;16960;L'Annee Sociologique;journal;00662399;0.189;Q3;10;27;55;762;10;54;0.24;28.22;France;Presses Universitaires de France;1981, 1984, 1987, 2001-ongoing;Social Sciences (miscellaneous) (Q3)
1959;14730;Revista Latinoamericana de Psicologia;journal;01200534;0.189;Q3;20;37;92;1652;24;90;0.27;44.65;Colombia;Revista Latinoamericana De Psicologia;1980, 1984, 1992, 1996-ongoing;"Psychology (miscellaneous) (Q3); Social Sciences (miscellaneous) (Q3)"
1960;4700152616;Chungara;journal;07177356, 07161182;0.188;Q2;20;15;118;849;16;117;0;56.60;Chile;Universidad del Norte, Sede Arica, Depto. de Antropologia;2000-2002, 2004, 2006-ongoing;"Archeology (Q2); Anthropology (Q3)"
1961;16300154776;Comptes Rendus des Seances de la Academie des Inscriptions et Belles Lettres;journal;00650536;0.188;Q2;8;70;212;3572;9;202;0.06;51.03;France;Diffusion de Boccard;2002-2010;"Archeology (Q2); Archeology (arts and humanities) (Q2); History (Q2)"
1962;13518;Contemporary South Asia;journal;09584935, 1469364X;0.188;Q2;18;0;67;0;29;64;0.24;0.00;United Kingdom;Carfax Publishing Ltd.;1992-2006, 2008-ongoing;"Political Science and International Relations (Q2); Development (Q3); Geography, Planning and Development (Q3)"
1963;26001;Drustvena Istrazivanja;journal;13300288;0.188;Q3;14;44;160;1410;13;156;0.04;32.05;Croatia;Institut Drustvenih Znanosti lvo Pilar/Institute of Social Sciences lvo Pilar;1996-ongoing;"Social Sciences (miscellaneous) (Q3); Sociology and Political Science (Q3)"
1964;25764;Internasjonal Politikk;journal;18911757, 0020577X;0.188;Q2;6;41;80;867;6;71;0.13;21.15;Norway;Norsk Utenrikspolitisk Institutt/Norwegian Institute of International Affairs;1996-2015;"Political Science and International Relations (Q2); Sociology and Political Science (Q3)"
1965;4700152207;International Communication Gazette;journal;17480485, 17480493;0.188;Q3;30;24;32;1136;13;29;0.46;47.33;United Kingdom;SAGE Publications;1961, 1966, 1996-1999, 2003-2004, 2006-ongoing;"Communication (Q3); Sociology and Political Science (Q3)"
1966;5700167148;International Journal of Asian Studies;journal;14795914;0.188;Q3;10;3;23;95;5;23;0.11;31.67;United Kingdom;Cambridge University Press;1996, 2004-2005, 2007, 2009-ongoing;"Arts and Humanities (miscellaneous) (Q3); Social Sciences (miscellaneous) (Q3)"
1967;21100780474;Journal of Curriculum and Pedagogy;journal;15505170, 21568154;0.188;Q3;9;51;144;734;15;144;0.13;14.39;United Kingdom;Taylor and Francis Ltd.;2004-2013, 2016-ongoing;Education (Q3)
1968;29555;Journal of Housing for the Elderly;journal;02763893;0.188;Q3;21;15;65;515;14;58;0.21;34.33;United States;Haworth Press Inc.;1983-1995, 1997, 1999, 2001-ongoing;"Gerontology (Q3); Public Administration (Q3); Life-span and Life-course Studies (Q4)"
1969;130055;Public Organization Review;journal;15667170, 15737098;0.188;Q2;23;23;43;885;12;42;0.29;38.48;Netherlands;Kluwer Academic Publishers;2005-ongoing;"Business, Management and Accounting (miscellaneous) (Q2); Law (Q2)"
1970;5700153460;Publishing Research Quarterly;journal;19364792, 10538801;0.188;Q3;12;28;112;339;34;104;0.25;12.11;United States;Springer New York LLC;1991-2013;"Business and International Management (Q2); Media Technology (Q2); Communication (Q3); Management of Technology and Innovation (Q3); Marketing (Q3); Computer Science Applications (Q4)"
1971;18800156731;Revista Electronica de Investigacion y Evaluacion Educativa;journal;11344032;0.188;Q3;14;14;39;378;9;39;0.33;27.00;Spain;Universitad de Valencia;2009-ongoing;Education (Q3)
1972;5800171939;RUSI Journal;journal;17440378, 03071847;0.188;Q2;17;92;269;556;25;217;0.16;6.04;United Kingdom;Routledge;1972-ongoing;Political Science and International Relations (Q2)
1973;5700163444;Russian Review;journal;00360341;0.188;Q2;23;30;83;1735;22;77;0.3;57.83;United Kingdom;Blackwell Publishing Inc.;1973, 1978, 1981, 1983, 1985, 1987, 1996-ongoing;"Literature and Literary Theory (Q1); Cultural Studies (Q2); History (Q2); Language and Linguistics (Q2); Linguistics and Language (Q2); Sociology and Political Science (Q3)"
1974;16239;The Journal of Law and Religion;journal;07480814;0.188;Q2;13;25;47;2695;5;47;0.14;107.80;United Kingdom;Cambridge University Press;1983-1996, 1998-2010, 2012-2013, 2015-ongoing;"Religious Studies (Q1); Law (Q2)"
1975;22110;Journal for the Education of the Gifted;journal;01623532;0.187;Q3;26;25;52;698;13;42;0.3;27.92;United States;SAGE Publications Inc.;1987-ongoing;Education (Q3)
1976;15384;Journal of Applied Biobehavioral Research;journal;10712089;0.187;Q2;23;13;46;555;17;45;0.22;42.69;United States;Wiley-Blackwell;1993-1994, 1998-2001, 2003-ongoing;"Cultural Studies (Q2); Clinical Psychology (Q3); Social Sciences (miscellaneous) (Q3); Experimental and Cognitive Psychology (Q4)"
1977;145265;Middle East Quarterly;journal;10739467;0.187;Q3;14;34;91;1057;21;78;0.27;31.09;United States;Middle East Forum;2005-ongoing;"Business, Management and Accounting (miscellaneous) (Q2); Political Science and International Relations (Q3)"
1978;15159;Review of Regional Studies;journal;0048749X;0.187;Q3;18;19;57;605;14;56;0.21;31.84;United States;University of Delaware;1977-1982, 1984, 1987-2006, 2008-ongoing;"Earth-Surface Processes (Q3); Geography, Planning and Development (Q3)"
1979;24094;Acta Mathematica Academiae Paedagogicae Nyiregyhaziensis;journal;08660182;0.186;Q3;12;19;75;214;9;75;0.14;11.26;Hungary;Nyregyhazi Foiskola/College of Nyregyhaza;1998, 2000-ongoing;"Education (Q3); Mathematics (miscellaneous) (Q4)"
1980;6800153102;Canadian Journal of Speech-Language Pathology and Audiology;journal;1913200X;0.186;Q2;13;13;35;313;11;26;0.42;24.08;Canada;Canadian Association Of Speech-Language Pathologists And Audiologists;2007-ongoing;"Linguistics and Language (Q2); Speech and Hearing (Q4)"
1981;53135;Dialectical Anthropology;journal;03044092;0.186;Q3;16;9;30;541;8;30;0.27;60.11;Germany;Springer Verlag;1975, 1977-2001, 2003, 2005-ongoing;"Anthropology (Q3); Arts and Humanities (miscellaneous) (Q3); Sociology and Political Science (Q3)"
1982;5700157895;Enfance;journal;00137545;0.186;Q3;10;33;81;752;18;80;0.23;22.79;France;Presses Universitaires de France;1949-1953, 2002-2015;"Arts and Humanities (miscellaneous) (Q3); Education (Q3); Health (social science) (Q3); Pediatrics, Perinatology and Child Health (Q3); Developmental and Educational Psychology (Q4)"
1983;15802;Environmental Law and Management;journal;10676058;0.186;Q3;6;31;86;1463;7;67;0.09;47.19;United Kingdom;Lawtext Publishing Ltd.;1993-ongoing;"Geography, Planning and Development (Q3); Management, Monitoring, Policy and Law (Q3)"
1984;14912;International Journal of Transgenderism;journal;14344599;0.186;Q2;29;17;44;1009;14;39;0.36;59.35;United States;Haworth Press Inc.;1997-2002, 2005-ongoing;Gender Studies (Q2)
1985;4700152737;Journal of Applied School Psychology;journal;15377903, 15377911;0.186;Q3;20;0;63;0;10;62;0.15;0.00;United States;Haworth Press Inc.;2002-ongoing;"Education (Q3); Psychiatry and Mental Health (Q3); Applied Psychology (Q4); Developmental and Educational Psychology (Q4)"
1986;15709;Journal of Canadian studies. Revue d'etudes canadiennes;journal;00219495;0.186;Q2;14;24;79;1522;10;77;0.16;63.42;Canada;Trent University;1968, 1979, 1981-1984, 1986, 2002-ongoing;"Cultural Studies (Q2); History (Q2)"
1987;12881;Behavioral and Social Sciences Librarian;journal;01639269, 15444546;0.185;Q3;14;13;52;381;10;52;0;29.31;United States;Haworth Press Inc.;1979-2002, 2004-ongoing;"Library and Information Sciences (Q3); Social Sciences (miscellaneous) (Q3)"
1988;17032;Berliner Journal fr Soziologie;journal;08631808;0.185;Q3;13;25;84;1408;17;76;0.22;56.32;Germany;Walter de Gruyter GmbH;1992-1993, 1996-1999, 2001-ongoing;Sociology and Political Science (Q3)
1989;22828;Cultural Dynamics;journal;09213740;0.185;Q2;22;6;40;160;13;38;0.28;26.67;United States;SAGE Publications;1988-1993, 1995-ongoing;"Cultural Studies (Q2); Anthropology (Q3); Arts and Humanities (miscellaneous) (Q3)"
1990;21100200414;Legal Studies;journal;1748121X, 02613875;0.185;Q2;21;28;74;0;43;74;0.63;0.00;United States;Wiley-Blackwell;1981-1995, 2000-2001, 2011-ongoing;Law (Q2)
1991;4700152724;Metacognition and Learning;journal;15561631, 15561623;0.185;Q3;42;12;16;523;14;16;0.88;43.58;Germany;Springer Verlag;2006-ongoing;Education (Q3)
1992;27710;Teaching Philosophy;journal;21536619, 01455788;0.185;Q3;13;25;58;367;10;57;0.13;14.68;United States;Philosophy Documentation Center;1977, 1996-ongoing;"Philosophy (Q2); Education (Q3)"
1993;4000148017;Journal of bioethical inquiry.;journal;11767529;0.184;Q3;19;41;56;690;15;42;0.47;16.83;Netherlands;Springer Netherlands;2005, 2007-ongoing;"Health Policy (Q3); Health (social science) (Q3)"
1994;4700152269;Journal of Japanese Studies;journal;00956848, 15494721;0.184;Q2;16;11;19;949;16;19;0.84;86.27;United States;Society for japanese Studies;1998-2002, 2005-ongoing;"Cultural Studies (Q2); Language and Linguistics (Q2); Linguistics and Language (Q2); Anthropology (Q3); Social Psychology (Q4)"
1995;16100154756;Lexikos;journal;16844904, 22240039;0.184;Q2;12;33;74;413;18;65;0.21;12.52;South Africa;Buro van die Woordeboek van die Afrikaanse Taal;2002-ongoing;"Language and Linguistics (Q2); Linguistics and Language (Q2)"
1996;16100154719;Bulletin of the American Society of Papyrologists;journal;19386958, 00031186;0.183;Q2;8;12;33;287;6;30;0.18;23.92;United States;American Society of Papyrologists;2002-2011, 2014;"Archeology (Q2); Archeology (arts and humanities) (Q2); History (Q2)"
1997;5700178973;International Journal of Bilingualism;journal;13670069;0.183;Q2;42;16;72;781;45;69;0.56;48.81;United Kingdom;SAGE Publications Inc.;1997-ongoing;"Language and Linguistics (Q2); Linguistics and Language (Q2); Education (Q3)"
1998;29197;Journal of Elder Abuse and Neglect;journal;08946566, 15404129;0.183;Q3;34;43;47;1137;34;43;0.75;26.44;United States;The Haworth Maltreatment & Trauma Press;1989-ongoing;"Geriatrics and Gerontology (Q3); Social Sciences (miscellaneous) (Q3)"
1999;16642;Michigan Law Review;journal;00262234;0.183;Q2;46;54;106;3996;38;102;0.37;74.00;United States;Michigan Law Review Association;1974-1980, 1982-1983, 1991, 1993-ongoing;Law (Q2)
2000;18053;New York University Law Review;journal;00287881;0.183;Q2;46;41;118;5952;62;117;0.53;145.17;United States;New York University School of Law;1973-1976, 1979, 1985, 1987, 1991-1994, 1996-1999, 2001-ongoing;Law (Q2)
2001;72646;Contributions to Indian Sociology;journal;00699667;0.182;Q3;24;12;26;465;10;25;0.09;38.75;India;Sage Publications India Pvt Ltd.;1967, 1969-1980, 1982-ongoing;Sociology and Political Science (Q3)
2002;5600155082;Cultural Critique;journal;15345203, 08824371;0.182;Q2;20;26;76;853;21;60;0.38;32.81;United States;University of Minnesota;2002-ongoing;"Literature and Literary Theory (Q1); Cultural Studies (Q2); Philosophy (Q2); Anthropology (Q3); Sociology and Political Science (Q3)"
2003;23113;Differences;journal;10407391;0.182;Q2;26;20;69;801;22;64;0.13;40.05;United States;Duke University Press;1994, 1998, 2001-ongoing;"Cultural Studies (Q2); Gender Studies (Q2)"
2004;144919;Ethik in der Medizin;journal;09357335;0.182;Q3;10;36;60;508;17;54;0.31;14.11;Germany;Springer Verlag;2005-ongoing;"Philosophy (Q2); Health Policy (Q3); Health (social science) (Q3); Issues, Ethics and Legal Aspects (Q4)"
2005;13600;Georgetown Law Journal;journal;00168092;0.182;Q2;42;48;117;3285;37;116;0.28;68.44;United States;Georgetown University Law Center;1973-1974, 1976-1977, 1979, 1981, 1983-1986, 1988, 1992, 1994-ongoing;Law (Q2)
2006;23369;Journal of Environmental Law;journal;1464374X, 09528873;0.182;Q2;25;20;67;1668;19;60;0.35;83.40;United Kingdom;Oxford University Press;1989-ongoing;"Law (Q2); Management, Monitoring, Policy and Law (Q3)"
2007;15300154847;Journal of Population Research;journal;14432447;0.182;Q3;19;11;23;467;6;22;0.27;42.45;Netherlands;Springer Netherlands;2005-ongoing;Demography (Q3)
2008;50047;Journal of Southeast Asian Studies;journal;14740680, 00224634;0.182;Q3;27;22;61;1847;27;61;0.45;83.95;United Kingdom;Cambridge University Press;1970-ongoing;"History (Q2); Geography, Planning and Development (Q3); Sociology and Political Science (Q3)"
2009;17521;Law and Contemporary Problems;journal;00239186, 19452322;0.182;Q2;33;32;68;4849;29;63;0.53;151.53;United States;Duke University Press;1976, 1979, 1981-1982, 1985-1986, 1988-1989, 1991, 1993-1994, 1996, 2005-ongoing;Law (Q2)
2010;145356;Library Hi Tech News;journal;07419058;0.182;Q3;15;85;298;230;27;263;0.13;2.71;United Kingdom;Emerald Group Publishing Ltd.;1999-ongoing;"Information Systems (Q3); Library and Information Sciences (Q3)"
2011;16149;Medical Law International;journal;09685332;0.182;Q2;10;9;25;1070;6;24;0.31;118.89;United Kingdom;SAGE Publications Inc.;1993-ongoing;"Law (Q2); Medicine (miscellaneous) (Q3)"
2012;19231;Oxford Journal of Legal Studies;journal;01436503;0.182;Q2;23;32;70;3685;41;68;0.6;115.16;United Kingdom;Oxford University Press;1981-1996, 1998, 2000-2001, 2005-ongoing;Law (Q2)
2013;24798;Asian Journal of Social Science;journal;15684849, 15685314;0.181;Q3;18;25;87;955;18;80;0.13;38.20;Netherlands;Brill;2001-ongoing;Social Sciences (miscellaneous) (Q3)
2014;14089;Developing Economies;journal;00121533, 17461049;0.181;Q3;23;16;61;539;22;60;0.42;33.69;United States;Wiley-Blackwell;1962-ongoing;"Development (Q3); Economics and Econometrics (Q4)"
2015;5000155600;Health Education;journal;09654283;0.181;Q3;30;31;107;1267;36;107;0.36;40.87;United Kingdom;Emerald Group Publishing Ltd.;1992-ongoing;"Education (Q3); Public Health, Environmental and Occupational Health (Q3)"
2016;38295;Historical Archaeology;journal;04409213;0.181;Q2;20;39;93;1608;26;91;0.13;41.23;United States;Society for Historical Archaeology;1977, 1981, 1984, 1987, 1999-ongoing;"Archeology (Q2); Archeology (arts and humanities) (Q2); History (Q2)"
2017;19177;History of Political Thought;journal;0143781X;0.181;Q3;20;32;78;3986;34;78;0.23;124.56;United Kingdom;Imprint Academic;1984, 1987, 1996-ongoing;"History (Q2); Philosophy (Q2); Sociology and Political Science (Q3)"
2018;17966;International Journal of Electrical Engineering Education;journal;00207209;0.181;Q3;19;38;99;381;33;94;0.25;10.03;United Kingdom;SAGE Publications;1963, 1965, 1967, 1969-1972, 1974-ongoing;"Education (Q3); Electrical and Electronic Engineering (Q3)"
2019;4700152730;Journal of Community Practice;journal;15433706, 10705422;0.181;Q3;28;26;89;1004;41;83;0.2;38.62;United States;Haworth Press Inc.;1994-ongoing;"Development (Q3); Sociology and Political Science (Q3); Public Administration (Q4)"
2020;17700156318;Proceedings - 18th Conference on Software Engineering Education and Training, CSEE and T 2005;conference and proceedings;00002005;0.181;-;7;0;34;0;6;32;0.19;0.00;United States;;2005;"Computer Science Applications; Education"
2021;29758;Revista Mexicana de Fisica;journal;0035001X;0.181;Q3;23;151;402;2499;93;397;0.21;16.55;Mexico;Siciedad Mexicana de Fisica;1996-ongoing;"Education (Q3); Physics and Astronomy (miscellaneous) (Q4)"
2022;5700160619;Cultural Studies - Critical Methodologies;journal;15327086;0.18;Q2;27;28;101;938;23;99;0.2;33.50;United States;SAGE Publications;2001-ongoing;"Cultural Studies (Q2); Arts and Humanities (miscellaneous) (Q3)"
2023;24540;Eisenbahningenieur;trade journal;00132810;0.18;Q3;5;162;561;554;15;512;0.03;3.42;Germany;Tetzlaff Verlag GmbH & Co. KG;1973-1979, 1981, 1983-1989, 1994-2008;"Mechanical Engineering (Q3); Transportation (Q3)"
2024;17600155502;Journal of Computing in Higher Education;journal;10421726;0.18;Q3;28;13;44;361;22;38;0.5;27.77;United States;Springer New York LLC;1989, 1992-ongoing;Education (Q3)
2025;29272;Journal of Cultural Geography;journal;08873631;0.18;Q2;18;1;36;27;11;33;0.25;27.00;United Kingdom;Taylor & Francis;1980-ongoing;"Cultural Studies (Q2); Geography, Planning and Development (Q3)"
2026;15887;Journal of Urban History;journal;00961442;0.18;Q3;23;60;155;1870;30;147;0.2;31.17;United States;SAGE Publications;1974-ongoing;"History (Q2); Sociology and Political Science (Q3); Urban Studies (Q3)"
